[{"date": 20200304, "state": "AZ", "positive": 2, "probableCases": null, "negative": 27, "pending": 5, "totalTestResultsSource": "totalTestsViral", "totalTestResults": 33, "hospitalizedCurrently": null, "hospitalizedCumulative": 4, "inIcuCurrently": null, "inIcuCumulative": null, "onVentilatorCurrently": null, "onVentilatorCumulative": null, "recovered": null, "lastUpdateEt": null, "dateModified": null, "checkTimeEt": null, "death": null, "hospitalized": 4, "hospitalizedDischarged": null, "dateChecked": null, "totalTestsViral": 33, "positiveTestsViral": null, "negativeTestsViral": null, "positiveCasesViral": null, "deathConfirmed": null, "deathProbable": null, "totalTestEncountersViral": null, "totalTestsPeopleViral": 29, "totalTestsAntibody": null, "positiveTestsAntibody": null, "negativeTestsAntibody": null, "totalTestsPeopleAntibody": null, "positiveTestsPeopleAntibody": null, "negativeTestsPeopleAntibody": null, "totalTestsPeopleAntigen": null, "positiveTestsPeopleAntigen": null, "totalTestsAntigen": null, "positiveTestsAntigen": null, "fips": "04", "positiveIncrease": 0, "negativeIncrease": 0, "total": 34, "totalTestResultsIncrease": 0, "posNeg": 29, "dataQualityGrade": null, "deathIncrease": 0, "hospitalizedIncrease": 0, "hash": "5d2871fca7b14ba5155f0f8e6e3e30d58682c398", "commercialScore": 0, "negativeRegularScore": 0, "negativeScore": 0, "positiveScore": 0, "score": 0, "grade": "", "month_number_label": "2020-03", "date_label": "2020-03-04", "week_number_label": "2020W10", "week_start_label": "2020-03-02"}, {"date": 20200305, "state": "AZ", "positive": 2, "probableCases": null, "negative": 28, "pending": 6, "totalTestResultsSource": "totalTestsViral", "totalTestResults": 63, "hospitalizedCurrently": null, "hospitalizedCumulative": 5, "inIcuCurrently": null, "inIcuCumulative": null, "onVentilatorCurrently": null, "onVentilatorCumulative": null, "recovered": null, "lastUpdateEt": null, "dateModified": null, "checkTimeEt": null, "death": null, "hospitalized": 5, "hospitalizedDischarged": null, "dateChecked": null, "totalTestsViral": 63, "positiveTestsViral": null, "negativeTestsViral": null, "positiveCasesViral": null, "deathConfirmed": null, "deathProbable": null, "totalTestEncountersViral": null, "totalTestsPeopleViral": 30, "totalTestsAntibody": null, "positiveTestsAntibody": null, "negativeTestsAntibody": null, "totalTestsPeopleAntibody": null, "positiveTestsPeopleAntibody": null, "negativeTestsPeopleAntibody": null, "totalTestsPeopleAntigen": null, "positiveTestsPeopleAntigen": null, "totalTestsAntigen": null, "positiveTestsAntigen": null, "fips": "04", "positiveIncrease": 0, "negativeIncrease": 1, "total": 36, "totalTestResultsIncrease": 30, "posNeg": 30, "dataQualityGrade": null, "deathIncrease": 0, "hospitalizedIncrease": 1, "hash": "a63f3b21bf1889450fc6ecd15948e8c1d5be9f7f", "commercialScore": 0, "negativeRegularScore": 0, "negativeScore": 0, "positiveScore": 0, "score": 0, "grade": "", "month_number_label": "2020-03", "date_label": "2020-03-05", "week_number_label": "2020W10", "week_start_label": "2020-03-02"}, {"date": 20200306, "state": "AZ", "positive": 3, "probableCases": null, "negative": 33, "pending": 15, "totalTestResultsSource": "totalTestsViral", "totalTestResults": 80, "hospitalizedCurrently": null, "hospitalizedCumulative": 6, "inIcuCurrently": null, "inIcuCumulative": null, "onVentilatorCurrently": null, "onVentilatorCumulative": null, "recovered": null, "lastUpdateEt": null, "dateModified": null, "checkTimeEt": null, "death": null, "hospitalized": 6, "hospitalizedDischarged": null, "dateChecked": null, "totalTestsViral": 80, "positiveTestsViral": null, "negativeTestsViral": null, "positiveCasesViral": null, "deathConfirmed": null, "deathProbable": null, "totalTestEncountersViral": null, "totalTestsPeopleViral": 36, "totalTestsAntibody": null, "positiveTestsAntibody": null, "negativeTestsAntibody": null, "totalTestsPeopleAntibody": null, "positiveTestsPeopleAntibody": null, "negativeTestsPeopleAntibody": null, "totalTestsPeopleAntigen": null, "positiveTestsPeopleAntigen": null, "totalTestsAntigen": null, "positiveTestsAntigen": null, "fips": "04", "positiveIncrease": 1, "negativeIncrease": 5, "total": 51, "totalTestResultsIncrease": 17, "posNeg": 36, "dataQualityGrade": null, "deathIncrease": 0, "hospitalizedIncrease": 1, "hash": "c4fb2795d580903b15707cc5595214d6b6f8d008", "commercialScore": 0, "negativeRegularScore": 0, "negativeScore": 0, "positiveScore": 0, "score": 0, "grade": "", "month_number_label": "2020-03", "date_label": "2020-03-06", "week_number_label": "2020W10", "week_start_label": "2020-03-02"}, {"date": 20200307, "state": "AZ", "positive": 5, "probableCases": null, "negative": 44, "pending": 7, "totalTestResultsSource": "totalTestsViral", "totalTestResults": 117, "hospitalizedCurrently": null, "hospitalizedCumulative": 6, "inIcuCurrently": null, "inIcuCumulative": null, "onVentilatorCurrently": null, "onVentilatorCumulative": null, "recovered": null, "lastUpdateEt": null, "dateModified": null, "checkTimeEt": null, "death": null, "hospitalized": 6, "hospitalizedDischarged": null, "dateChecked": null, "totalTestsViral": 117, "positiveTestsViral": null, "negativeTestsViral": null, "positiveCasesViral": null, "deathConfirmed": null, "deathProbable": null, "totalTestEncountersViral": null, "totalTestsPeopleViral": 49, "totalTestsAntibody": null, "positiveTestsAntibody": null, "negativeTestsAntibody": null, "totalTestsPeopleAntibody": null, "positiveTestsPeopleAntibody": null, "negativeTestsPeopleAntibody": null, "totalTestsPeopleAntigen": null, "positiveTestsPeopleAntigen": null, "totalTestsAntigen": null, "positiveTestsAntigen": null, "fips": "04", "positiveIncrease": 2, "negativeIncrease": 11, "total": 56, "totalTestResultsIncrease": 37, "posNeg": 49, "dataQualityGrade": null, "deathIncrease": 0, "hospitalizedIncrease": 0, "hash": "5c7967711919c03c1fed57fd8f9b0d975553e5c9", "commercialScore": 0, "negativeRegularScore": 0, "negativeScore": 0, "positiveScore": 0, "score": 0, "grade": "", "month_number_label": "2020-03", "date_label": "2020-03-07", "week_number_label": "2020W10", "week_start_label": "2020-03-02"}, {"date": 20200308, "state": "AZ", "positive": 5, "probableCases": null, "negative": 44, "pending": 7, "totalTestResultsSource": "totalTestsViral", "totalTestResults": 130, "hospitalizedCurrently": null, "hospitalizedCumulative": 6, "inIcuCurrently": null, "inIcuCumulative": null, "onVentilatorCurrently": null, "onVentilatorCumulative": null, "recovered": null, "lastUpdateEt": null, "dateModified": null, "checkTimeEt": null, "death": null, "hospitalized": 6, "hospitalizedDischarged": null, "dateChecked": null, "totalTestsViral": 130, "positiveTestsViral": null, "negativeTestsViral": null, "positiveCasesViral": null, "deathConfirmed": null, "deathProbable": null, "totalTestEncountersViral": null, "totalTestsPeopleViral": 49, "totalTestsAntibody": null, "positiveTestsAntibody": null, "negativeTestsAntibody": null, "totalTestsPeopleAntibody": null, "positiveTestsPeopleAntibody": null, "negativeTestsPeopleAntibody": null, "totalTestsPeopleAntigen": null, "positiveTestsPeopleAntigen": null, "totalTestsAntigen": null, "positiveTestsAntigen": null, "fips": "04", "positiveIncrease": 0, "negativeIncrease": 0, "total": 56, "totalTestResultsIncrease": 13, "posNeg": 49, "dataQualityGrade": null, "deathIncrease": 0, "hospitalizedIncrease": 0, "hash": "92c2f0fcdce8e6fdb434a13a9029b935023a2afb", "commercialScore": 0, "negativeRegularScore": 0, "negativeScore": 0, "positiveScore": 0, "score": 0, "grade": "", "month_number_label": "2020-03", "date_label": "2020-03-08", "week_number_label": "2020W10", "week_start_label": "2020-03-02"}, {"date": 20200309, "state": "AZ", "positive": 5, "probableCases": null, "negative": 44, "pending": 7, "totalTestResultsSource": "totalTestsViral", "totalTestResults": 147, "hospitalizedCurrently": null, "hospitalizedCumulative": 8, "inIcuCurrently": null, "inIcuCumulative": null, "onVentilatorCurrently": null, "onVentilatorCumulative": null, "recovered": null, "lastUpdateEt": null, "dateModified": null, "checkTimeEt": null, "death": null, "hospitalized": 8, "hospitalizedDischarged": null, "dateChecked": null, "totalTestsViral": 147, "positiveTestsViral": null, "negativeTestsViral": null, "positiveCasesViral": null, "deathConfirmed": null, "deathProbable": null, "totalTestEncountersViral": null, "totalTestsPeopleViral": 49, "totalTestsAntibody": null, "positiveTestsAntibody": null, "negativeTestsAntibody": null, "totalTestsPeopleAntibody": null, "positiveTestsPeopleAntibody": null, "negativeTestsPeopleAntibody": null, "totalTestsPeopleAntigen": null, "positiveTestsPeopleAntigen": null, "totalTestsAntigen": null, "positiveTestsAntigen": null, "fips": "04", "positiveIncrease": 0, "negativeIncrease": 0, "total": 56, "totalTestResultsIncrease": 17, "posNeg": 49, "dataQualityGrade": null, "deathIncrease": 0, "hospitalizedIncrease": 2, "hash": "d0441a6e55eeec6bde70713b5d0d8e4af9c9358d", "commercialScore": 0, "negativeRegularScore": 0, "negativeScore": 0, "positiveScore": 0, "score": 0, "grade": "", "month_number_label": "2020-03", "date_label": "2020-03-09", "week_number_label": "2020W11", "week_start_label": "2020-03-09"}, {"date": 20200310, "state": "AZ", "positive": 6, "probableCases": null, "negative": 51, "pending": 27, "totalTestResultsSource": "totalTestsViral", "totalTestResults": 222, "hospitalizedCurrently": null, "hospitalizedCumulative": 8, "inIcuCurrently": null, "inIcuCumulative": null, "onVentilatorCurrently": null, "onVentilatorCumulative": null, "recovered": null, "lastUpdateEt": null, "dateModified": null, "checkTimeEt": null, "death": null, "hospitalized": 8, "hospitalizedDischarged": null, "dateChecked": null, "totalTestsViral": 222, "positiveTestsViral": null, "negativeTestsViral": null, "positiveCasesViral": null, "deathConfirmed": null, "deathProbable": null, "totalTestEncountersViral": null, "totalTestsPeopleViral": 57, "totalTestsAntibody": null, "positiveTestsAntibody": null, "negativeTestsAntibody": null, "totalTestsPeopleAntibody": null, "positiveTestsPeopleAntibody": null, "negativeTestsPeopleAntibody": null, "totalTestsPeopleAntigen": null, "positiveTestsPeopleAntigen": null, "totalTestsAntigen": null, "positiveTestsAntigen": null, "fips": "04", "positiveIncrease": 1, "negativeIncrease": 7, "total": 84, "totalTestResultsIncrease": 75, "posNeg": 57, "dataQualityGrade": null, "deathIncrease": 0, "hospitalizedIncrease": 0, "hash": "b5703d1c86f2c1c0e7f59e88dce4dd0d055e5985", "commercialScore": 0, "negativeRegularScore": 0, "negativeScore": 0, "positiveScore": 0, "score": 0, "grade": "", "month_number_label": "2020-03", "date_label": "2020-03-10", "week_number_label": "2020W11", "week_start_label": "2020-03-09"}, {"date": 20200311, "state": "AZ", "positive": 9, "probableCases": null, "negative": 59, "pending": 32, "totalTestResultsSource": "totalTestsViral", "totalTestResults": 285, "hospitalizedCurrently": null, "hospitalizedCumulative": 11, "inIcuCurrently": null, "inIcuCumulative": null, "onVentilatorCurrently": null, "onVentilatorCumulative": null, "recovered": null, "lastUpdateEt": null, "dateModified": null, "checkTimeEt": null, "death": null, "hospitalized": 11, "hospitalizedDischarged": null, "dateChecked": null, "totalTestsViral": 285, "positiveTestsViral": null, "negativeTestsViral": null, "positiveCasesViral": null, "deathConfirmed": null, "deathProbable": null, "totalTestEncountersViral": null, "totalTestsPeopleViral": 68, "totalTestsAntibody": null, "positiveTestsAntibody": null, "negativeTestsAntibody": null, "totalTestsPeopleAntibody": null, "positiveTestsPeopleAntibody": null, "negativeTestsPeopleAntibody": null, "totalTestsPeopleAntigen": null, "positiveTestsPeopleAntigen": null, "totalTestsAntigen": null, "positiveTestsAntigen": null, "fips": "04", "positiveIncrease": 3, "negativeIncrease": 8, "total": 100, "totalTestResultsIncrease": 63, "posNeg": 68, "dataQualityGrade": null, "deathIncrease": 0, "hospitalizedIncrease": 3, "hash": "02a2071583b97ddbd8efb3be1d2d0810c5748533", "commercialScore": 0, "negativeRegularScore": 0, "negativeScore": 0, "positiveScore": 0, "score": 0, "grade": "", "month_number_label": "2020-03", "date_label": "2020-03-11", "week_number_label": "2020W11", "week_start_label": "2020-03-09"}, {"date": 20200312, "state": "AZ", "positive": 9, "probableCases": null, "negative": 82, "pending": 24, "totalTestResultsSource": "totalTestsViral", "totalTestResults": 422, "hospitalizedCurrently": null, "hospitalizedCumulative": 16, "inIcuCurrently": null, "inIcuCumulative": null, "onVentilatorCurrently": null, "onVentilatorCumulative": null, "recovered": null, "lastUpdateEt": "3/12/2020 12:00", "dateModified": "2020-03-12T12:00:00Z", "checkTimeEt": "03/12 08:00", "death": null, "hospitalized": 16, "hospitalizedDischarged": null, "dateChecked": "2020-03-12T12:00:00Z", "totalTestsViral": 422, "positiveTestsViral": null, "negativeTestsViral": null, "positiveCasesViral": null, "deathConfirmed": null, "deathProbable": null, "totalTestEncountersViral": null, "totalTestsPeopleViral": 91, "totalTestsAntibody": null, "positiveTestsAntibody": null, "negativeTestsAntibody": null, "totalTestsPeopleAntibody": null, "positiveTestsPeopleAntibody": null, "negativeTestsPeopleAntibody": null, "totalTestsPeopleAntigen": null, "positiveTestsPeopleAntigen": null, "totalTestsAntigen": null, "positiveTestsAntigen": null, "fips": "04", "positiveIncrease": 0, "negativeIncrease": 23, "total": 115, "totalTestResultsIncrease": 137, "posNeg": 91, "dataQualityGrade": null, "deathIncrease": 0, "hospitalizedIncrease": 5, "hash": "5c162d28a95aa1cdc745900e8366e9658d87b966", "commercialScore": 0, "negativeRegularScore": 0, "negativeScore": 0, "positiveScore": 0, "score": 0, "grade": "", "month_number_label": "2020-03", "date_label": "2020-03-12", "week_number_label": "2020W11", "week_start_label": "2020-03-09"}, {"date": 20200313, "state": "AZ", "positive": 9, "probableCases": null, "negative": 94, "pending": 40, "totalTestResultsSource": "totalTestsViral", "totalTestResults": 813, "hospitalizedCurrently": null, "hospitalizedCumulative": 22, "inIcuCurrently": null, "inIcuCumulative": null, "onVentilatorCurrently": null, "onVentilatorCumulative": null, "recovered": null, "lastUpdateEt": "3/13/2020 12:01", "dateModified": "2020-03-13T12:01:00Z", "checkTimeEt": "03/13 08:01", "death": 0, "hospitalized": 22, "hospitalizedDischarged": null, "dateChecked": "2020-03-13T12:01:00Z", "totalTestsViral": 813, "positiveTestsViral": null, "negativeTestsViral": null, "positiveCasesViral": null, "deathConfirmed": null, "deathProbable": null, "totalTestEncountersViral": null, "totalTestsPeopleViral": 103, "totalTestsAntibody": null, "positiveTestsAntibody": null, "negativeTestsAntibody": null, "totalTestsPeopleAntibody": null, "positiveTestsPeopleAntibody": null, "negativeTestsPeopleAntibody": null, "totalTestsPeopleAntigen": null, "positiveTestsPeopleAntigen": null, "totalTestsAntigen": null, "positiveTestsAntigen": null, "fips": "04", "positiveIncrease": 0, "negativeIncrease": 12, "total": 143, "totalTestResultsIncrease": 391, "posNeg": 103, "dataQualityGrade": null, "deathIncrease": 0, "hospitalizedIncrease": 6, "hash": "ad53d91245596b4cff9aab2b7e5a16bf2e4390bf", "commercialScore": 0, "negativeRegularScore": 0, "negativeScore": 0, "positiveScore": 0, "score": 0, "grade": "", "month_number_label": "2020-03", "date_label": "2020-03-13", "week_number_label": "2020W11", "week_start_label": "2020-03-09"}, {"date": 20200314, "state": "AZ", "positive": 12, "probableCases": null, "negative": 121, "pending": 50, "totalTestResultsSource": "totalTestsViral", "totalTestResults": 1291, "hospitalizedCurrently": null, "hospitalizedCumulative": 26, "inIcuCurrently": null, "inIcuCumulative": null, "onVentilatorCurrently": null, "onVentilatorCumulative": null, "recovered": null, "lastUpdateEt": "3/14/2020 12:01", "dateModified": "2020-03-14T12:01:00Z", "checkTimeEt": "03/14 08:01", "death": 0, "hospitalized": 26, "hospitalizedDischarged": null, "dateChecked": "2020-03-14T12:01:00Z", "totalTestsViral": 1291, "positiveTestsViral": null, "negativeTestsViral": null, "positiveCasesViral": null, "deathConfirmed": null, "deathProbable": null, "totalTestEncountersViral": null, "totalTestsPeopleViral": 133, "totalTestsAntibody": null, "positiveTestsAntibody": null, "negativeTestsAntibody": null, "totalTestsPeopleAntibody": null, "positiveTestsPeopleAntibody": null, "negativeTestsPeopleAntibody": null, "totalTestsPeopleAntigen": null, "positiveTestsPeopleAntigen": null, "totalTestsAntigen": null, "positiveTestsAntigen": null, "fips": "04", "positiveIncrease": 3, "negativeIncrease": 27, "total": 183, "totalTestResultsIncrease": 478, "posNeg": 133, "dataQualityGrade": null, "deathIncrease": 0, "hospitalizedIncrease": 4, "hash": "4007fa3edfaa5f41fa3d2c7bee5f04c892971a7c", "commercialScore": 0, "negativeRegularScore": 0, "negativeScore": 0, "positiveScore": 0, "score": 0, "grade": "", "month_number_label": "2020-03", "date_label": "2020-03-14", "week_number_label": "2020W11", "week_start_label": "2020-03-09"}, {"date": 20200315, "state": "AZ", "positive": 12, "probableCases": null, "negative": 121, "pending": 50, "totalTestResultsSource": "totalTestsViral", "totalTestResults": 1552, "hospitalizedCurrently": null, "hospitalizedCumulative": 36, "inIcuCurrently": null, "inIcuCumulative": null, "onVentilatorCurrently": null, "onVentilatorCumulative": null, "recovered": null, "lastUpdateEt": "3/15/2020 12:01", "dateModified": "2020-03-15T12:01:00Z", "checkTimeEt": "03/15 08:01", "death": 0, "hospitalized": 36, "hospitalizedDischarged": null, "dateChecked": "2020-03-15T12:01:00Z", "totalTestsViral": 1552, "positiveTestsViral": null, "negativeTestsViral": null, "positiveCasesViral": null, "deathConfirmed": null, "deathProbable": null, "totalTestEncountersViral": null, "totalTestsPeopleViral": 133, "totalTestsAntibody": null, "positiveTestsAntibody": null, "negativeTestsAntibody": null, "totalTestsPeopleAntibody": null, "positiveTestsPeopleAntibody": null, "negativeTestsPeopleAntibody": null, "totalTestsPeopleAntigen": null, "positiveTestsPeopleAntigen": null, "totalTestsAntigen": null, "positiveTestsAntigen": null, "fips": "04", "positiveIncrease": 0, "negativeIncrease": 0, "total": 183, "totalTestResultsIncrease": 261, "posNeg": 133, "dataQualityGrade": null, "deathIncrease": 0, "hospitalizedIncrease": 10, "hash": "c814102f8b91d670f5253e165c734fc23a957acc", "commercialScore": 0, "negativeRegularScore": 0, "negativeScore": 0, "positiveScore": 0, "score": 0, "grade": "", "month_number_label": "2020-03", "date_label": "2020-03-15", "week_number_label": "2020W11", "week_start_label": "2020-03-09"}, {"date": 20200316, "state": "AZ", "positive": 18, "probableCases": null, "negative": 125, "pending": 63, "totalTestResultsSource": "totalTestsViral", "totalTestResults": 1855, "hospitalizedCurrently": null, "hospitalizedCumulative": 42, "inIcuCurrently": null, "inIcuCumulative": null, "onVentilatorCurrently": null, "onVentilatorCumulative": null, "recovered": null, "lastUpdateEt": "3/16/2020 16:16", "dateModified": "2020-03-16T16:16:00Z", "checkTimeEt": "03/16 12:16", "death": 0, "hospitalized": 42, "hospitalizedDischarged": null, "dateChecked": "2020-03-16T16:16:00Z", "totalTestsViral": 1855, "positiveTestsViral": null, "negativeTestsViral": null, "positiveCasesViral": null, "deathConfirmed": null, "deathProbable": null, "totalTestEncountersViral": null, "totalTestsPeopleViral": 143, "totalTestsAntibody": null, "positiveTestsAntibody": null, "negativeTestsAntibody": null, "totalTestsPeopleAntibody": null, "positiveTestsPeopleAntibody": null, "negativeTestsPeopleAntibody": null, "totalTestsPeopleAntigen": null, "positiveTestsPeopleAntigen": null, "totalTestsAntigen": null, "positiveTestsAntigen": null, "fips": "04", "positiveIncrease": 6, "negativeIncrease": 4, "total": 206, "totalTestResultsIncrease": 303, "posNeg": 143, "dataQualityGrade": null, "deathIncrease": 0, "hospitalizedIncrease": 6, "hash": "64db50c52baeb18bc2f2cc26a873a9d82f5dc6fc", "commercialScore": 0, "negativeRegularScore": 0, "negativeScore": 0, "positiveScore": 0, "score": 0, "grade": "", "month_number_label": "2020-03", "date_label": "2020-03-16", "week_number_label": "2020W12", "week_start_label": "2020-03-16"}, {"date": 20200317, "state": "AZ", "positive": 20, "probableCases": null, "negative": 142, "pending": 66, "totalTestResultsSource": "totalTestsViral", "totalTestResults": 2898, "hospitalizedCurrently": null, "hospitalizedCumulative": 55, "inIcuCurrently": null, "inIcuCumulative": null, "onVentilatorCurrently": null, "onVentilatorCumulative": null, "recovered": null, "lastUpdateEt": "3/17/2020 00:00", "dateModified": "2020-03-17T00:00:00Z", "checkTimeEt": "03/16 20:00", "death": 0, "hospitalized": 55, "hospitalizedDischarged": null, "dateChecked": "2020-03-17T00:00:00Z", "totalTestsViral": 2898, "positiveTestsViral": null, "negativeTestsViral": null, "positiveCasesViral": null, "deathConfirmed": null, "deathProbable": null, "totalTestEncountersViral": null, "totalTestsPeopleViral": 162, "totalTestsAntibody": null, "positiveTestsAntibody": null, "negativeTestsAntibody": null, "totalTestsPeopleAntibody": null, "positiveTestsPeopleAntibody": null, "negativeTestsPeopleAntibody": null, "totalTestsPeopleAntigen": null, "positiveTestsPeopleAntigen": null, "totalTestsAntigen": null, "positiveTestsAntigen": null, "fips": "04", "positiveIncrease": 2, "negativeIncrease": 17, "total": 228, "totalTestResultsIncrease": 1043, "posNeg": 162, "dataQualityGrade": null, "deathIncrease": 0, "hospitalizedIncrease": 13, "hash": "7c075fdbe19423bcba6bc4991d607cce3d86038a", "commercialScore": 0, "negativeRegularScore": 0, "negativeScore": 0, "positiveScore": 0, "score": 0, "grade": "", "month_number_label": "2020-03", "date_label": "2020-03-17", "week_number_label": "2020W12", "week_start_label": "2020-03-16"}, {"date": 20200318, "state": "AZ", "positive": 28, "probableCases": null, "negative": 148, "pending": 102, "totalTestResultsSource": "totalTestsViral", "totalTestResults": 4294, "hospitalizedCurrently": null, "hospitalizedCumulative": 67, "inIcuCurrently": null, "inIcuCumulative": null, "onVentilatorCurrently": null, "onVentilatorCumulative": null, "recovered": null, "lastUpdateEt": "3/18/2020 00:00", "dateModified": "2020-03-18T00:00:00Z", "checkTimeEt": "03/17 20:00", "death": 0, "hospitalized": 67, "hospitalizedDischarged": null, "dateChecked": "2020-03-18T00:00:00Z", "totalTestsViral": 4294, "positiveTestsViral": null, "negativeTestsViral": null, "positiveCasesViral": null, "deathConfirmed": null, "deathProbable": null, "totalTestEncountersViral": null, "totalTestsPeopleViral": 176, "totalTestsAntibody": null, "positiveTestsAntibody": null, "negativeTestsAntibody": null, "totalTestsPeopleAntibody": null, "positiveTestsPeopleAntibody": null, "negativeTestsPeopleAntibody": null, "totalTestsPeopleAntigen": null, "positiveTestsPeopleAntigen": null, "totalTestsAntigen": null, "positiveTestsAntigen": null, "fips": "04", "positiveIncrease": 8, "negativeIncrease": 6, "total": 278, "totalTestResultsIncrease": 1396, "posNeg": 176, "dataQualityGrade": null, "deathIncrease": 0, "hospitalizedIncrease": 12, "hash": "64e78278f9c7d9b8d561cf37854d14236d4a0de7", "commercialScore": 0, "negativeRegularScore": 0, "negativeScore": 0, "positiveScore": 0, "score": 0, "grade": "", "month_number_label": "2020-03", "date_label": "2020-03-18", "week_number_label": "2020W12", "week_start_label": "2020-03-16"}, {"date": 20200319, "state": "AZ", "positive": 44, "probableCases": null, "negative": 175, "pending": 130, "totalTestResultsSource": "totalTestsViral", "totalTestResults": 5743, "hospitalizedCurrently": null, "hospitalizedCumulative": 85, "inIcuCurrently": null, "inIcuCumulative": null, "onVentilatorCurrently": null, "onVentilatorCumulative": null, "recovered": null, "lastUpdateEt": "3/19/2020 00:00", "dateModified": "2020-03-19T00:00:00Z", "checkTimeEt": "03/18 20:00", "death": 0, "hospitalized": 85, "hospitalizedDischarged": null, "dateChecked": "2020-03-19T00:00:00Z", "totalTestsViral": 5743, "positiveTestsViral": null, "negativeTestsViral": null, "positiveCasesViral": null, "deathConfirmed": null, "deathProbable": null, "totalTestEncountersViral": null, "totalTestsPeopleViral": 219, "totalTestsAntibody": null, "positiveTestsAntibody": null, "negativeTestsAntibody": null, "totalTestsPeopleAntibody": null, "positiveTestsPeopleAntibody": null, "negativeTestsPeopleAntibody": null, "totalTestsPeopleAntigen": null, "positiveTestsPeopleAntigen": null, "totalTestsAntigen": null, "positiveTestsAntigen": null, "fips": "04", "positiveIncrease": 16, "negativeIncrease": 27, "total": 349, "totalTestResultsIncrease": 1449, "posNeg": 219, "dataQualityGrade": null, "deathIncrease": 0, "hospitalizedIncrease": 18, "hash": "0a5a14b6f0442f563344e7a2f56c03ad21b783cf", "commercialScore": 0, "negativeRegularScore": 0, "negativeScore": 0, "positiveScore": 0, "score": 0, "grade": "", "month_number_label": "2020-03", "date_label": "2020-03-19", "week_number_label": "2020W12", "week_start_label": "2020-03-16"}, {"date": 20200320, "state": "AZ", "positive": 65, "probableCases": null, "negative": 211, "pending": 101, "totalTestResultsSource": "totalTestsViral", "totalTestResults": 7395, "hospitalizedCurrently": null, "hospitalizedCumulative": 108, "inIcuCurrently": null, "inIcuCumulative": null, "onVentilatorCurrently": null, "onVentilatorCumulative": null, "recovered": null, "lastUpdateEt": "3/20/2020 00:00", "dateModified": "2020-03-20T00:00:00Z", "checkTimeEt": "03/19 20:00", "death": 0, "hospitalized": 108, "hospitalizedDischarged": null, "dateChecked": "2020-03-20T00:00:00Z", "totalTestsViral": 7395, "positiveTestsViral": null, "negativeTestsViral": null, "positiveCasesViral": null, "deathConfirmed": null, "deathProbable": null, "totalTestEncountersViral": null, "totalTestsPeopleViral": 276, "totalTestsAntibody": null, "positiveTestsAntibody": null, "negativeTestsAntibody": null, "totalTestsPeopleAntibody": null, "positiveTestsPeopleAntibody": null, "negativeTestsPeopleAntibody": null, "totalTestsPeopleAntigen": null, "positiveTestsPeopleAntigen": null, "totalTestsAntigen": null, "positiveTestsAntigen": null, "fips": "04", "positiveIncrease": 21, "negativeIncrease": 36, "total": 377, "totalTestResultsIncrease": 1652, "posNeg": 276, "dataQualityGrade": null, "deathIncrease": 0, "hospitalizedIncrease": 23, "hash": "a8b8426d9954694caa3ba74cd0ae82667911df6c", "commercialScore": 0, "negativeRegularScore": 0, "negativeScore": 0, "positiveScore": 0, "score": 0, "grade": "", "month_number_label": "2020-03", "date_label": "2020-03-20", "week_number_label": "2020W12", "week_start_label": "2020-03-16"}, {"date": 20200321, "state": "AZ", "positive": 104, "probableCases": null, "negative": 240, "pending": 122, "totalTestResultsSource": "totalTestsViral", "totalTestResults": 9314, "hospitalizedCurrently": null, "hospitalizedCumulative": 128, "inIcuCurrently": null, "inIcuCumulative": null, "onVentilatorCurrently": null, "onVentilatorCumulative": null, "recovered": null, "lastUpdateEt": "3/21/2020 00:00", "dateModified": "2020-03-21T00:00:00Z", "checkTimeEt": "03/20 20:00", "death": 1, "hospitalized": 128, "hospitalizedDischarged": null, "dateChecked": "2020-03-21T00:00:00Z", "totalTestsViral": 9314, "positiveTestsViral": null, "negativeTestsViral": null, "positiveCasesViral": null, "deathConfirmed": null, "deathProbable": null, "totalTestEncountersViral": null, "totalTestsPeopleViral": 344, "totalTestsAntibody": null, "positiveTestsAntibody": null, "negativeTestsAntibody": null, "totalTestsPeopleAntibody": null, "positiveTestsPeopleAntibody": null, "negativeTestsPeopleAntibody": null, "totalTestsPeopleAntigen": null, "positiveTestsPeopleAntigen": null, "totalTestsAntigen": null, "positiveTestsAntigen": null, "fips": "04", "positiveIncrease": 39, "negativeIncrease": 29, "total": 466, "totalTestResultsIncrease": 1919, "posNeg": 344, "dataQualityGrade": null, "deathIncrease": 1, "hospitalizedIncrease": 20, "hash": "2df80a8d91cfb9c4c00b8e84da59b6bd7055fb1a", "commercialScore": 0, "negativeRegularScore": 0, "negativeScore": 0, "positiveScore": 0, "score": 0, "grade": "", "month_number_label": "2020-03", "date_label": "2020-03-21", "week_number_label": "2020W12", "week_start_label": "2020-03-16"}, {"date": 20200322, "state": "AZ", "positive": 152, "probableCases": null, "negative": 282, "pending": 87, "totalTestResultsSource": "totalTestsViral", "totalTestResults": 10120, "hospitalizedCurrently": null, "hospitalizedCumulative": 145, "inIcuCurrently": null, "inIcuCumulative": null, "onVentilatorCurrently": null, "onVentilatorCumulative": null, "recovered": null, "lastUpdateEt": "3/22/2020 00:00", "dateModified": "2020-03-22T00:00:00Z", "checkTimeEt": "03/21 20:00", "death": 2, "hospitalized": 145, "hospitalizedDischarged": null, "dateChecked": "2020-03-22T00:00:00Z", "totalTestsViral": 10120, "positiveTestsViral": null, "negativeTestsViral": null, "positiveCasesViral": null, "deathConfirmed": null, "deathProbable": null, "totalTestEncountersViral": null, "totalTestsPeopleViral": 434, "totalTestsAntibody": null, "positiveTestsAntibody": null, "negativeTestsAntibody": null, "totalTestsPeopleAntibody": null, "positiveTestsPeopleAntibody": null, "negativeTestsPeopleAntibody": null, "totalTestsPeopleAntigen": null, "positiveTestsPeopleAntigen": null, "totalTestsAntigen": null, "positiveTestsAntigen": null, "fips": "04", "positiveIncrease": 48, "negativeIncrease": 42, "total": 521, "totalTestResultsIncrease": 806, "posNeg": 434, "dataQualityGrade": null, "deathIncrease": 1, "hospitalizedIncrease": 17, "hash": "0239c2a5cf38052e90847613fcb5bf457a7bf9f9", "commercialScore": 0, "negativeRegularScore": 0, "negativeScore": 0, "positiveScore": 0, "score": 0, "grade": "", "month_number_label": "2020-03", "date_label": "2020-03-22", "week_number_label": "2020W12", "week_start_label": "2020-03-16"}, {"date": 20200323, "state": "AZ", "positive": 265, "probableCases": null, "negative": 309, "pending": 6, "totalTestResultsSource": "totalTestsViral", "totalTestResults": 10844, "hospitalizedCurrently": null, "hospitalizedCumulative": 189, "inIcuCurrently": null, "inIcuCumulative": null, "onVentilatorCurrently": null, "onVentilatorCumulative": null, "recovered": null, "lastUpdateEt": "3/23/2020 00:00", "dateModified": "2020-03-23T00:00:00Z", "checkTimeEt": "03/22 20:00", "death": 2, "hospitalized": 189, "hospitalizedDischarged": null, "dateChecked": "2020-03-23T00:00:00Z", "totalTestsViral": 10844, "positiveTestsViral": null, "negativeTestsViral": null, "positiveCasesViral": null, "deathConfirmed": null, "deathProbable": null, "totalTestEncountersViral": null, "totalTestsPeopleViral": 574, "totalTestsAntibody": null, "positiveTestsAntibody": null, "negativeTestsAntibody": null, "totalTestsPeopleAntibody": null, "positiveTestsPeopleAntibody": null, "negativeTestsPeopleAntibody": null, "totalTestsPeopleAntigen": null, "positiveTestsPeopleAntigen": null, "totalTestsAntigen": null, "positiveTestsAntigen": null, "fips": "04", "positiveIncrease": 113, "negativeIncrease": 27, "total": 580, "totalTestResultsIncrease": 724, "posNeg": 574, "dataQualityGrade": null, "deathIncrease": 0, "hospitalizedIncrease": 44, "hash": "e3c9f92248baf786041e79bfd2cd2978e1e34b59", "commercialScore": 0, "negativeRegularScore": 0, "negativeScore": 0, "positiveScore": 0, "score": 0, "grade": "", "month_number_label": "2020-03", "date_label": "2020-03-23", "week_number_label": "2020W13", "week_start_label": "2020-03-23"}, {"date": 20200324, "state": "AZ", "positive": 357, "probableCases": null, "negative": 313, "pending": 22, "totalTestResultsSource": "totalTestsViral", "totalTestResults": 13392, "hospitalizedCurrently": null, "hospitalizedCumulative": 219, "inIcuCurrently": null, "inIcuCumulative": null, "onVentilatorCurrently": null, "onVentilatorCumulative": null, "recovered": null, "lastUpdateEt": "3/24/2020 00:00", "dateModified": "2020-03-24T00:00:00Z", "checkTimeEt": "03/23 20:00", "death": 5, "hospitalized": 219, "hospitalizedDischarged": null, "dateChecked": "2020-03-24T00:00:00Z", "totalTestsViral": 13392, "positiveTestsViral": null, "negativeTestsViral": null, "positiveCasesViral": null, "deathConfirmed": null, "deathProbable": null, "totalTestEncountersViral": null, "totalTestsPeopleViral": 670, "totalTestsAntibody": null, "positiveTestsAntibody": null, "negativeTestsAntibody": null, "totalTestsPeopleAntibody": null, "positiveTestsPeopleAntibody": null, "negativeTestsPeopleAntibody": null, "totalTestsPeopleAntigen": null, "positiveTestsPeopleAntigen": null, "totalTestsAntigen": null, "positiveTestsAntigen": null, "fips": "04", "positiveIncrease": 92, "negativeIncrease": 4, "total": 692, "totalTestResultsIncrease": 2548, "posNeg": 670, "dataQualityGrade": null, "deathIncrease": 3, "hospitalizedIncrease": 30, "hash": "0650a2fdfa277acaea1937437ecdb4a05f888543", "commercialScore": 0, "negativeRegularScore": 0, "negativeScore": 0, "positiveScore": 0, "score": 0, "grade": "", "month_number_label": "2020-03", "date_label": "2020-03-24", "week_number_label": "2020W13", "week_start_label": "2020-03-23"}, {"date": 20200325, "state": "AZ", "positive": 450, "probableCases": null, "negative": 323, "pending": 53, "totalTestResultsSource": "totalTestsViral", "totalTestResults": 15978, "hospitalizedCurrently": null, "hospitalizedCumulative": 264, "inIcuCurrently": null, "inIcuCumulative": null, "onVentilatorCurrently": null, "onVentilatorCumulative": null, "recovered": null, "lastUpdateEt": "3/24/2020 00:00", "dateModified": "2020-03-24T00:00:00Z", "checkTimeEt": "03/23 20:00", "death": 6, "hospitalized": 264, "hospitalizedDischarged": null, "dateChecked": "2020-03-24T00:00:00Z", "totalTestsViral": 15978, "positiveTestsViral": null, "negativeTestsViral": null, "positiveCasesViral": null, "deathConfirmed": null, "deathProbable": null, "totalTestEncountersViral": null, "totalTestsPeopleViral": 773, "totalTestsAntibody": null, "positiveTestsAntibody": null, "negativeTestsAntibody": null, "totalTestsPeopleAntibody": null, "positiveTestsPeopleAntibody": null, "negativeTestsPeopleAntibody": null, "totalTestsPeopleAntigen": null, "positiveTestsPeopleAntigen": null, "totalTestsAntigen": null, "positiveTestsAntigen": null, "fips": "04", "positiveIncrease": 93, "negativeIncrease": 10, "total": 826, "totalTestResultsIncrease": 2586, "posNeg": 773, "dataQualityGrade": null, "deathIncrease": 1, "hospitalizedIncrease": 45, "hash": "1ba85b0f4c92bf5d2da9434132dc186cbe786fed", "commercialScore": 0, "negativeRegularScore": 0, "negativeScore": 0, "positiveScore": 0, "score": 0, "grade": "", "month_number_label": "2020-03", "date_label": "2020-03-25", "week_number_label": "2020W13", "week_start_label": "2020-03-23"}, {"date": 20200326, "state": "AZ", "positive": 577, "probableCases": null, "negative": 347, "pending": 33, "totalTestResultsSource": "totalTestsViral", "totalTestResults": 18707, "hospitalizedCurrently": null, "hospitalizedCumulative": 303, "inIcuCurrently": null, "inIcuCumulative": null, "onVentilatorCurrently": null, "onVentilatorCumulative": null, "recovered": null, "lastUpdateEt": "3/26/2020 00:00", "dateModified": "2020-03-26T00:00:00Z", "checkTimeEt": "03/25 20:00", "death": 8, "hospitalized": 303, "hospitalizedDischarged": null, "dateChecked": "2020-03-26T00:00:00Z", "totalTestsViral": 18707, "positiveTestsViral": null, "negativeTestsViral": null, "positiveCasesViral": null, "deathConfirmed": null, "deathProbable": null, "totalTestEncountersViral": null, "totalTestsPeopleViral": 924, "totalTestsAntibody": null, "positiveTestsAntibody": null, "negativeTestsAntibody": null, "totalTestsPeopleAntibody": null, "positiveTestsPeopleAntibody": null, "negativeTestsPeopleAntibody": null, "totalTestsPeopleAntigen": null, "positiveTestsPeopleAntigen": null, "totalTestsAntigen": null, "positiveTestsAntigen": null, "fips": "04", "positiveIncrease": 127, "negativeIncrease": 24, "total": 957, "totalTestResultsIncrease": 2729, "posNeg": 924, "dataQualityGrade": null, "deathIncrease": 2, "hospitalizedIncrease": 39, "hash": "19b67f583443bf82c08a2b9ac188e91956402d85", "commercialScore": 0, "negativeRegularScore": 0, "negativeScore": 0, "positiveScore": 0, "score": 0, "grade": "", "month_number_label": "2020-03", "date_label": "2020-03-26", "week_number_label": "2020W13", "week_start_label": "2020-03-23"}, {"date": 20200327, "state": "AZ", "positive": 736, "probableCases": null, "negative": 7455, "pending": 30, "totalTestResultsSource": "totalTestsViral", "totalTestResults": 21133, "hospitalizedCurrently": null, "hospitalizedCumulative": 343, "inIcuCurrently": null, "inIcuCumulative": null, "onVentilatorCurrently": null, "onVentilatorCumulative": null, "recovered": null, "lastUpdateEt": "3/27/2020 00:00", "dateModified": "2020-03-27T00:00:00Z", "checkTimeEt": "03/26 20:00", "death": 13, "hospitalized": 343, "hospitalizedDischarged": null, "dateChecked": "2020-03-27T00:00:00Z", "totalTestsViral": 21133, "positiveTestsViral": null, "negativeTestsViral": null, "positiveCasesViral": null, "deathConfirmed": null, "deathProbable": null, "totalTestEncountersViral": null, "totalTestsPeopleViral": 8191, "totalTestsAntibody": null, "positiveTestsAntibody": null, "negativeTestsAntibody": null, "totalTestsPeopleAntibody": null, "positiveTestsPeopleAntibody": null, "negativeTestsPeopleAntibody": null, "totalTestsPeopleAntigen": null, "positiveTestsPeopleAntigen": null, "totalTestsAntigen": null, "positiveTestsAntigen": null, "fips": "04", "positiveIncrease": 159, "negativeIncrease": 7108, "total": 8221, "totalTestResultsIncrease": 2426, "posNeg": 8191, "dataQualityGrade": null, "deathIncrease": 5, "hospitalizedIncrease": 40, "hash": "eb56534312533541bb117984f2945bbe8da55a70", "commercialScore": 0, "negativeRegularScore": 0, "negativeScore": 0, "positiveScore": 0, "score": 0, "grade": "", "month_number_label": "2020-03", "date_label": "2020-03-27", "week_number_label": "2020W13", "week_start_label": "2020-03-23"}, {"date": 20200328, "state": "AZ", "positive": 873, "probableCases": null, "negative": 7455, "pending": 21, "totalTestResultsSource": "totalTestsViral", "totalTestResults": 23540, "hospitalizedCurrently": null, "hospitalizedCumulative": 386, "inIcuCurrently": null, "inIcuCumulative": null, "onVentilatorCurrently": null, "onVentilatorCumulative": null, "recovered": null, "lastUpdateEt": "3/28/2020 00:00", "dateModified": "2020-03-28T00:00:00Z", "checkTimeEt": "03/27 20:00", "death": 15, "hospitalized": 386, "hospitalizedDischarged": null, "dateChecked": "2020-03-28T00:00:00Z", "totalTestsViral": 23540, "positiveTestsViral": null, "negativeTestsViral": null, "positiveCasesViral": null, "deathConfirmed": null, "deathProbable": null, "totalTestEncountersViral": null, "totalTestsPeopleViral": 8328, "totalTestsAntibody": null, "positiveTestsAntibody": null, "negativeTestsAntibody": null, "totalTestsPeopleAntibody": null, "positiveTestsPeopleAntibody": null, "negativeTestsPeopleAntibody": null, "totalTestsPeopleAntigen": null, "positiveTestsPeopleAntigen": null, "totalTestsAntigen": null, "positiveTestsAntigen": null, "fips": "04", "positiveIncrease": 137, "negativeIncrease": 0, "total": 8349, "totalTestResultsIncrease": 2407, "posNeg": 8328, "dataQualityGrade": null, "deathIncrease": 2, "hospitalizedIncrease": 43, "hash": "39d1dc2bd0ab44a2307387b54ebc9a40d60eb5d6", "commercialScore": 0, "negativeRegularScore": 0, "negativeScore": 0, "positiveScore": 0, "score": 0, "grade": "", "month_number_label": "2020-03", "date_label": "2020-03-28", "week_number_label": "2020W13", "week_start_label": "2020-03-23"}, {"date": 20200329, "state": "AZ", "positive": 919, "probableCases": null, "negative": 12953, "pending": null, "totalTestResultsSource": "totalTestsViral", "totalTestResults": 24777, "hospitalizedCurrently": null, "hospitalizedCumulative": 427, "inIcuCurrently": null, "inIcuCumulative": null, "onVentilatorCurrently": null, "onVentilatorCumulative": null, "recovered": null, "lastUpdateEt": "3/29/2020 00:00", "dateModified": "2020-03-29T00:00:00Z", "checkTimeEt": "03/28 20:00", "death": 17, "hospitalized": 427, "hospitalizedDischarged": null, "dateChecked": "2020-03-29T00:00:00Z", "totalTestsViral": 24777, "positiveTestsViral": null, "negativeTestsViral": null, "positiveCasesViral": null, "deathConfirmed": null, "deathProbable": null, "totalTestEncountersViral": null, "totalTestsPeopleViral": 13872, "totalTestsAntibody": null, "positiveTestsAntibody": null, "negativeTestsAntibody": null, "totalTestsPeopleAntibody": null, "positiveTestsPeopleAntibody": null, "negativeTestsPeopleAntibody": null, "totalTestsPeopleAntigen": null, "positiveTestsPeopleAntigen": null, "totalTestsAntigen": null, "positiveTestsAntigen": null, "fips": "04", "positiveIncrease": 46, "negativeIncrease": 5498, "total": 13872, "totalTestResultsIncrease": 1237, "posNeg": 13872, "dataQualityGrade": null, "deathIncrease": 2, "hospitalizedIncrease": 41, "hash": "2969e10f8b0f32bde783304027a29f1ab336f561", "commercialScore": 0, "negativeRegularScore": 0, "negativeScore": 0, "positiveScore": 0, "score": 0, "grade": "", "month_number_label": "2020-03", "date_label": "2020-03-29", "week_number_label": "2020W13", "week_start_label": "2020-03-23"}, {"date": 20200330, "state": "AZ", "positive": 1157, "probableCases": null, "negative": 15602, "pending": null, "totalTestResultsSource": "totalTestsViral", "totalTestResults": 25558, "hospitalizedCurrently": null, "hospitalizedCumulative": 478, "inIcuCurrently": null, "inIcuCumulative": null, "onVentilatorCurrently": null, "onVentilatorCumulative": null, "recovered": null, "lastUpdateEt": "3/30/2020 00:00", "dateModified": "2020-03-30T00:00:00Z", "checkTimeEt": "03/29 20:00", "death": 20, "hospitalized": 478, "hospitalizedDischarged": null, "dateChecked": "2020-03-30T00:00:00Z", "totalTestsViral": 25558, "positiveTestsViral": null, "negativeTestsViral": null, "positiveCasesViral": null, "deathConfirmed": null, "deathProbable": null, "totalTestEncountersViral": null, "totalTestsPeopleViral": 16759, "totalTestsAntibody": null, "positiveTestsAntibody": null, "negativeTestsAntibody": null, "totalTestsPeopleAntibody": null, "positiveTestsPeopleAntibody": null, "negativeTestsPeopleAntibody": null, "totalTestsPeopleAntigen": null, "positiveTestsPeopleAntigen": null, "totalTestsAntigen": null, "positiveTestsAntigen": null, "fips": "04", "positiveIncrease": 238, "negativeIncrease": 2649, "total": 16759, "totalTestResultsIncrease": 781, "posNeg": 16759, "dataQualityGrade": null, "deathIncrease": 3, "hospitalizedIncrease": 51, "hash": "4e6de1731019ed62378c929028fce3ceecfa8dfb", "commercialScore": 0, "negativeRegularScore": 0, "negativeScore": 0, "positiveScore": 0, "score": 0, "grade": "", "month_number_label": "2020-03", "date_label": "2020-03-30", "week_number_label": "2020W14", "week_start_label": "2020-03-30"}, {"date": 20200331, "state": "AZ", "positive": 1289, "probableCases": null, "negative": 18082, "pending": null, "totalTestResultsSource": "totalTestsViral", "totalTestResults": 27999, "hospitalizedCurrently": null, "hospitalizedCumulative": 534, "inIcuCurrently": null, "inIcuCumulative": null, "onVentilatorCurrently": null, "onVentilatorCumulative": null, "recovered": null, "lastUpdateEt": "3/31/2020 00:00", "dateModified": "2020-03-31T00:00:00Z", "checkTimeEt": "03/30 20:00", "death": 24, "hospitalized": 534, "hospitalizedDischarged": null, "dateChecked": "2020-03-31T00:00:00Z", "totalTestsViral": 27999, "positiveTestsViral": null, "negativeTestsViral": null, "positiveCasesViral": null, "deathConfirmed": null, "deathProbable": null, "totalTestEncountersViral": null, "totalTestsPeopleViral": 19371, "totalTestsAntibody": null, "positiveTestsAntibody": null, "negativeTestsAntibody": null, "totalTestsPeopleAntibody": null, "positiveTestsPeopleAntibody": null, "negativeTestsPeopleAntibody": null, "totalTestsPeopleAntigen": null, "positiveTestsPeopleAntigen": null, "totalTestsAntigen": null, "positiveTestsAntigen": null, "fips": "04", "positiveIncrease": 132, "negativeIncrease": 2480, "total": 19371, "totalTestResultsIncrease": 2441, "posNeg": 19371, "dataQualityGrade": null, "deathIncrease": 4, "hospitalizedIncrease": 56, "hash": "22b522a9b940c27c7ebe9801d8c1180e38787469", "commercialScore": 0, "negativeRegularScore": 0, "negativeScore": 0, "positiveScore": 0, "score": 0, "grade": "", "month_number_label": "2020-03", "date_label": "2020-03-31", "week_number_label": "2020W14", "week_start_label": "2020-03-30"}, {"date": 20200401, "state": "AZ", "positive": 1413, "probableCases": null, "negative": 19645, "pending": null, "totalTestResultsSource": "totalTestsViral", "totalTestResults": 30273, "hospitalizedCurrently": null, "hospitalizedCumulative": 582, "inIcuCurrently": null, "inIcuCumulative": null, "onVentilatorCurrently": null, "onVentilatorCumulative": null, "recovered": null, "lastUpdateEt": "4/1/2020 00:00", "dateModified": "2020-04-01T00:00:00Z", "checkTimeEt": "03/31 20:00", "death": 29, "hospitalized": 582, "hospitalizedDischarged": null, "dateChecked": "2020-04-01T00:00:00Z", "totalTestsViral": 30273, "positiveTestsViral": null, "negativeTestsViral": null, "positiveCasesViral": null, "deathConfirmed": null, "deathProbable": null, "totalTestEncountersViral": null, "totalTestsPeopleViral": 21058, "totalTestsAntibody": null, "positiveTestsAntibody": null, "negativeTestsAntibody": null, "totalTestsPeopleAntibody": null, "positiveTestsPeopleAntibody": null, "negativeTestsPeopleAntibody": null, "totalTestsPeopleAntigen": null, "positiveTestsPeopleAntigen": null, "totalTestsAntigen": null, "positiveTestsAntigen": null, "fips": "04", "positiveIncrease": 124, "negativeIncrease": 1563, "total": 21058, "totalTestResultsIncrease": 2274, "posNeg": 21058, "dataQualityGrade": null, "deathIncrease": 5, "hospitalizedIncrease": 48, "hash": "361e950f874c5d2f053f5a6d4a3858071cf44d40", "commercialScore": 0, "negativeRegularScore": 0, "negativeScore": 0, "positiveScore": 0, "score": 0, "grade": "", "month_number_label": "2020-04", "date_label": "2020-04-01", "week_number_label": "2020W14", "week_start_label": "2020-03-30"}, {"date": 20200402, "state": "AZ", "positive": 1598, "probableCases": null, "negative": 21111, "pending": null, "totalTestResultsSource": "totalTestsViral", "totalTestResults": 32656, "hospitalizedCurrently": null, "hospitalizedCumulative": 616, "inIcuCurrently": null, "inIcuCumulative": null, "onVentilatorCurrently": null, "onVentilatorCumulative": null, "recovered": null, "lastUpdateEt": "4/2/2020 00:00", "dateModified": "2020-04-02T00:00:00Z", "checkTimeEt": "04/01 20:00", "death": 32, "hospitalized": 616, "hospitalizedDischarged": null, "dateChecked": "2020-04-02T00:00:00Z", "totalTestsViral": 32656, "positiveTestsViral": null, "negativeTestsViral": null, "positiveCasesViral": null, "deathConfirmed": null, "deathProbable": null, "totalTestEncountersViral": null, "totalTestsPeopleViral": 22709, "totalTestsAntibody": null, "positiveTestsAntibody": null, "negativeTestsAntibody": null, "totalTestsPeopleAntibody": null, "positiveTestsPeopleAntibody": null, "negativeTestsPeopleAntibody": null, "totalTestsPeopleAntigen": null, "positiveTestsPeopleAntigen": null, "totalTestsAntigen": null, "positiveTestsAntigen": null, "fips": "04", "positiveIncrease": 185, "negativeIncrease": 1466, "total": 22709, "totalTestResultsIncrease": 2383, "posNeg": 22709, "dataQualityGrade": null, "deathIncrease": 3, "hospitalizedIncrease": 34, "hash": "fc8d9faf7ea889791acac6c1d19bd971e00c80b3", "commercialScore": 0, "negativeRegularScore": 0, "negativeScore": 0, "positiveScore": 0, "score": 0, "grade": "", "month_number_label": "2020-04", "date_label": "2020-04-02", "week_number_label": "2020W14", "week_start_label": "2020-03-30"}, {"date": 20200403, "state": "AZ", "positive": 1769, "probableCases": null, "negative": 22904, "pending": null, "totalTestResultsSource": "totalTestsViral", "totalTestResults": 35068, "hospitalizedCurrently": null, "hospitalizedCumulative": 667, "inIcuCurrently": null, "inIcuCumulative": null, "onVentilatorCurrently": null, "onVentilatorCumulative": null, "recovered": null, "lastUpdateEt": "4/3/2020 00:00", "dateModified": "2020-04-03T00:00:00Z", "checkTimeEt": "04/02 20:00", "death": 41, "hospitalized": 667, "hospitalizedDischarged": null, "dateChecked": "2020-04-03T00:00:00Z", "totalTestsViral": 35068, "positiveTestsViral": null, "negativeTestsViral": null, "positiveCasesViral": null, "deathConfirmed": null, "deathProbable": null, "totalTestEncountersViral": null, "totalTestsPeopleViral": 24673, "totalTestsAntibody": null, "positiveTestsAntibody": null, "negativeTestsAntibody": null, "totalTestsPeopleAntibody": null, "positiveTestsPeopleAntibody": null, "negativeTestsPeopleAntibody": null, "totalTestsPeopleAntigen": null, "positiveTestsPeopleAntigen": null, "totalTestsAntigen": null, "positiveTestsAntigen": null, "fips": "04", "positiveIncrease": 171, "negativeIncrease": 1793, "total": 24673, "totalTestResultsIncrease": 2412, "posNeg": 24673, "dataQualityGrade": null, "deathIncrease": 9, "hospitalizedIncrease": 51, "hash": "3f204af4704f5943cf4f41ba15890c8d3f860232", "commercialScore": 0, "negativeRegularScore": 0, "negativeScore": 0, "positiveScore": 0, "score": 0, "grade": "", "month_number_label": "2020-04", "date_label": "2020-04-03", "week_number_label": "2020W14", "week_start_label": "2020-03-30"}, {"date": 20200404, "state": "AZ", "positive": 2019, "probableCases": null, "negative": 25141, "pending": null, "totalTestResultsSource": "totalTestsViral", "totalTestResults": 37309, "hospitalizedCurrently": null, "hospitalizedCumulative": 711, "inIcuCurrently": null, "inIcuCumulative": null, "onVentilatorCurrently": null, "onVentilatorCumulative": null, "recovered": null, "lastUpdateEt": "4/4/2020 00:00", "dateModified": "2020-04-04T00:00:00Z", "checkTimeEt": "04/03 20:00", "death": 52, "hospitalized": 711, "hospitalizedDischarged": null, "dateChecked": "2020-04-04T00:00:00Z", "totalTestsViral": 37309, "positiveTestsViral": null, "negativeTestsViral": null, "positiveCasesViral": null, "deathConfirmed": null, "deathProbable": null, "totalTestEncountersViral": null, "totalTestsPeopleViral": 27160, "totalTestsAntibody": null, "positiveTestsAntibody": null, "negativeTestsAntibody": null, "totalTestsPeopleAntibody": null, "positiveTestsPeopleAntibody": null, "negativeTestsPeopleAntibody": null, "totalTestsPeopleAntigen": null, "positiveTestsPeopleAntigen": null, "totalTestsAntigen": null, "positiveTestsAntigen": null, "fips": "04", "positiveIncrease": 250, "negativeIncrease": 2237, "total": 27160, "totalTestResultsIncrease": 2241, "posNeg": 27160, "dataQualityGrade": null, "deathIncrease": 11, "hospitalizedIncrease": 44, "hash": "5ee7a41e1549cede42d367688077c424636cf3c5", "commercialScore": 0, "negativeRegularScore": 0, "negativeScore": 0, "positiveScore": 0, "score": 0, "grade": "", "month_number_label": "2020-04", "date_label": "2020-04-04", "week_number_label": "2020W14", "week_start_label": "2020-03-30"}, {"date": 20200405, "state": "AZ", "positive": 2269, "probableCases": null, "negative": 25141, "pending": null, "totalTestResultsSource": "totalTestsViral", "totalTestResults": 38447, "hospitalizedCurrently": null, "hospitalizedCumulative": 760, "inIcuCurrently": null, "inIcuCumulative": null, "onVentilatorCurrently": null, "onVentilatorCumulative": null, "recovered": null, "lastUpdateEt": "4/5/2020 00:00", "dateModified": "2020-04-05T00:00:00Z", "checkTimeEt": "04/04 20:00", "death": 64, "hospitalized": 760, "hospitalizedDischarged": null, "dateChecked": "2020-04-05T00:00:00Z", "totalTestsViral": 38447, "positiveTestsViral": null, "negativeTestsViral": null, "positiveCasesViral": null, "deathConfirmed": null, "deathProbable": null, "totalTestEncountersViral": null, "totalTestsPeopleViral": 27410, "totalTestsAntibody": null, "positiveTestsAntibody": null, "negativeTestsAntibody": null, "totalTestsPeopleAntibody": null, "positiveTestsPeopleAntibody": null, "negativeTestsPeopleAntibody": null, "totalTestsPeopleAntigen": null, "positiveTestsPeopleAntigen": null, "totalTestsAntigen": null, "positiveTestsAntigen": null, "fips": "04", "positiveIncrease": 250, "negativeIncrease": 0, "total": 27410, "totalTestResultsIncrease": 1138, "posNeg": 27410, "dataQualityGrade": null, "deathIncrease": 12, "hospitalizedIncrease": 49, "hash": "38eb71ac1cad69503ea8fdef83f711bec5eca018", "commercialScore": 0, "negativeRegularScore": 0, "negativeScore": 0, "positiveScore": 0, "score": 0, "grade": "", "month_number_label": "2020-04", "date_label": "2020-04-05", "week_number_label": "2020W14", "week_start_label": "2020-03-30"}, {"date": 20200406, "state": "AZ", "positive": 2456, "probableCases": null, "negative": 30078, "pending": null, "totalTestResultsSource": "totalTestsViral", "totalTestResults": 39395, "hospitalizedCurrently": null, "hospitalizedCumulative": 819, "inIcuCurrently": null, "inIcuCumulative": null, "onVentilatorCurrently": null, "onVentilatorCumulative": null, "recovered": null, "lastUpdateEt": "4/6/2020 00:00", "dateModified": "2020-04-06T00:00:00Z", "checkTimeEt": "04/05 20:00", "death": 65, "hospitalized": 819, "hospitalizedDischarged": null, "dateChecked": "2020-04-06T00:00:00Z", "totalTestsViral": 39395, "positiveTestsViral": null, "negativeTestsViral": null, "positiveCasesViral": null, "deathConfirmed": null, "deathProbable": null, "totalTestEncountersViral": null, "totalTestsPeopleViral": 32534, "totalTestsAntibody": null, "positiveTestsAntibody": null, "negativeTestsAntibody": null, "totalTestsPeopleAntibody": null, "positiveTestsPeopleAntibody": null, "negativeTestsPeopleAntibody": null, "totalTestsPeopleAntigen": null, "positiveTestsPeopleAntigen": null, "totalTestsAntigen": null, "positiveTestsAntigen": null, "fips": "04", "positiveIncrease": 187, "negativeIncrease": 4937, "total": 32534, "totalTestResultsIncrease": 948, "posNeg": 32534, "dataQualityGrade": null, "deathIncrease": 1, "hospitalizedIncrease": 59, "hash": "d7658828118e4f353651647c382e256e97154edd", "commercialScore": 0, "negativeRegularScore": 0, "negativeScore": 0, "positiveScore": 0, "score": 0, "grade": "", "month_number_label": "2020-04", "date_label": "2020-04-06", "week_number_label": "2020W15", "week_start_label": "2020-04-06"}, {"date": 20200407, "state": "AZ", "positive": 2575, "probableCases": null, "negative": 30800, "pending": null, "totalTestResultsSource": "totalTestsViral", "totalTestResults": 43059, "hospitalizedCurrently": null, "hospitalizedCumulative": 853, "inIcuCurrently": null, "inIcuCumulative": null, "onVentilatorCurrently": null, "onVentilatorCumulative": null, "recovered": null, "lastUpdateEt": "4/7/2020 00:00", "dateModified": "2020-04-07T00:00:00Z", "checkTimeEt": "04/06 20:00", "death": 73, "hospitalized": 853, "hospitalizedDischarged": null, "dateChecked": "2020-04-07T00:00:00Z", "totalTestsViral": 43059, "positiveTestsViral": null, "negativeTestsViral": null, "positiveCasesViral": null, "deathConfirmed": null, "deathProbable": null, "totalTestEncountersViral": null, "totalTestsPeopleViral": 33375, "totalTestsAntibody": null, "positiveTestsAntibody": null, "negativeTestsAntibody": null, "totalTestsPeopleAntibody": null, "positiveTestsPeopleAntibody": null, "negativeTestsPeopleAntibody": null, "totalTestsPeopleAntigen": null, "positiveTestsPeopleAntigen": null, "totalTestsAntigen": null, "positiveTestsAntigen": null, "fips": "04", "positiveIncrease": 119, "negativeIncrease": 722, "total": 33375, "totalTestResultsIncrease": 3664, "posNeg": 33375, "dataQualityGrade": null, "deathIncrease": 8, "hospitalizedIncrease": 34, "hash": "0d6e2c73f3f9cbbd3926ad27abfcc41c9a77f9e9", "commercialScore": 0, "negativeRegularScore": 0, "negativeScore": 0, "positiveScore": 0, "score": 0, "grade": "", "month_number_label": "2020-04", "date_label": "2020-04-07", "week_number_label": "2020W15", "week_start_label": "2020-04-06"}, {"date": 20200408, "state": "AZ", "positive": 2726, "probableCases": null, "negative": 31838, "pending": null, "totalTestResultsSource": "totalTestsViral", "totalTestResults": 45479, "hospitalizedCurrently": null, "hospitalizedCumulative": 906, "inIcuCurrently": null, "inIcuCumulative": null, "onVentilatorCurrently": null, "onVentilatorCumulative": null, "recovered": null, "lastUpdateEt": "4/8/2020 00:00", "dateModified": "2020-04-08T00:00:00Z", "checkTimeEt": "04/07 20:00", "death": 80, "hospitalized": 906, "hospitalizedDischarged": null, "dateChecked": "2020-04-08T00:00:00Z", "totalTestsViral": 45479, "positiveTestsViral": null, "negativeTestsViral": null, "positiveCasesViral": null, "deathConfirmed": null, "deathProbable": null, "totalTestEncountersViral": null, "totalTestsPeopleViral": 34564, "totalTestsAntibody": null, "positiveTestsAntibody": null, "negativeTestsAntibody": null, "totalTestsPeopleAntibody": null, "positiveTestsPeopleAntibody": null, "negativeTestsPeopleAntibody": null, "totalTestsPeopleAntigen": null, "positiveTestsPeopleAntigen": null, "totalTestsAntigen": null, "positiveTestsAntigen": null, "fips": "04", "positiveIncrease": 151, "negativeIncrease": 1038, "total": 34564, "totalTestResultsIncrease": 2420, "posNeg": 34564, "dataQualityGrade": null, "deathIncrease": 7, "hospitalizedIncrease": 53, "hash": "4a59a01f5c16f31f938ae5f9bf749244475150e3", "commercialScore": 0, "negativeRegularScore": 0, "negativeScore": 0, "positiveScore": 0, "score": 0, "grade": "", "month_number_label": "2020-04", "date_label": "2020-04-08", "week_number_label": "2020W15", "week_start_label": "2020-04-06"}, {"date": 20200409, "state": "AZ", "positive": 3018, "probableCases": null, "negative": 34160, "pending": null, "totalTestResultsSource": "totalTestsViral", "totalTestResults": 47368, "hospitalizedCurrently": null, "hospitalizedCumulative": 950, "inIcuCurrently": null, "inIcuCumulative": null, "onVentilatorCurrently": null, "onVentilatorCumulative": null, "recovered": null, "lastUpdateEt": "4/9/2020 00:00", "dateModified": "2020-04-09T00:00:00Z", "checkTimeEt": "04/08 20:00", "death": 89, "hospitalized": 950, "hospitalizedDischarged": null, "dateChecked": "2020-04-09T00:00:00Z", "totalTestsViral": 47368, "positiveTestsViral": null, "negativeTestsViral": null, "positiveCasesViral": null, "deathConfirmed": null, "deathProbable": null, "totalTestEncountersViral": null, "totalTestsPeopleViral": 37178, "totalTestsAntibody": null, "positiveTestsAntibody": null, "negativeTestsAntibody": null, "totalTestsPeopleAntibody": null, "positiveTestsPeopleAntibody": null, "negativeTestsPeopleAntibody": null, "totalTestsPeopleAntigen": null, "positiveTestsPeopleAntigen": null, "totalTestsAntigen": null, "positiveTestsAntigen": null, "fips": "04", "positiveIncrease": 292, "negativeIncrease": 2322, "total": 37178, "totalTestResultsIncrease": 1889, "posNeg": 37178, "dataQualityGrade": null, "deathIncrease": 9, "hospitalizedIncrease": 44, "hash": "b393991de02ed37dda335409900b4fef9d01274c", "commercialScore": 0, "negativeRegularScore": 0, "negativeScore": 0, "positiveScore": 0, "score": 0, "grade": "", "month_number_label": "2020-04", "date_label": "2020-04-09", "week_number_label": "2020W15", "week_start_label": "2020-04-06"}, {"date": 20200410, "state": "AZ", "positive": 3112, "probableCases": null, "negative": 34622, "pending": null, "totalTestResultsSource": "totalTestsViral", "totalTestResults": 49474, "hospitalizedCurrently": null, "hospitalizedCumulative": 995, "inIcuCurrently": null, "inIcuCumulative": null, "onVentilatorCurrently": null, "onVentilatorCumulative": null, "recovered": null, "lastUpdateEt": "4/10/2020 00:00", "dateModified": "2020-04-10T00:00:00Z", "checkTimeEt": "04/09 20:00", "death": 97, "hospitalized": 995, "hospitalizedDischarged": null, "dateChecked": "2020-04-10T00:00:00Z", "totalTestsViral": 49474, "positiveTestsViral": null, "negativeTestsViral": null, "positiveCasesViral": null, "deathConfirmed": null, "deathProbable": null, "totalTestEncountersViral": null, "totalTestsPeopleViral": 37734, "totalTestsAntibody": null, "positiveTestsAntibody": null, "negativeTestsAntibody": null, "totalTestsPeopleAntibody": null, "positiveTestsPeopleAntibody": null, "negativeTestsPeopleAntibody": null, "totalTestsPeopleAntigen": null, "positiveTestsPeopleAntigen": null, "totalTestsAntigen": null, "positiveTestsAntigen": null, "fips": "04", "positiveIncrease": 94, "negativeIncrease": 462, "total": 37734, "totalTestResultsIncrease": 2106, "posNeg": 37734, "dataQualityGrade": null, "deathIncrease": 8, "hospitalizedIncrease": 45, "hash": "e45e8397d7a8fed6cf9e4519b95d8097b5413e7a", "commercialScore": 0, "negativeRegularScore": 0, "negativeScore": 0, "positiveScore": 0, "score": 0, "grade": "", "month_number_label": "2020-04", "date_label": "2020-04-10", "week_number_label": "2020W15", "week_start_label": "2020-04-06"}, {"date": 20200411, "state": "AZ", "positive": 3393, "probableCases": null, "negative": 37137, "pending": null, "totalTestResultsSource": "totalTestsViral", "totalTestResults": 51435, "hospitalizedCurrently": null, "hospitalizedCumulative": 1037, "inIcuCurrently": null, "inIcuCumulative": null, "onVentilatorCurrently": null, "onVentilatorCumulative": null, "recovered": null, "lastUpdateEt": "4/11/2020 00:00", "dateModified": "2020-04-11T00:00:00Z", "checkTimeEt": "04/10 20:00", "death": 108, "hospitalized": 1037, "hospitalizedDischarged": null, "dateChecked": "2020-04-11T00:00:00Z", "totalTestsViral": 51435, "positiveTestsViral": null, "negativeTestsViral": null, "positiveCasesViral": null, "deathConfirmed": null, "deathProbable": null, "totalTestEncountersViral": null, "totalTestsPeopleViral": 40530, "totalTestsAntibody": null, "positiveTestsAntibody": null, "negativeTestsAntibody": null, "totalTestsPeopleAntibody": null, "positiveTestsPeopleAntibody": null, "negativeTestsPeopleAntibody": null, "totalTestsPeopleAntigen": null, "positiveTestsPeopleAntigen": null, "totalTestsAntigen": null, "positiveTestsAntigen": null, "fips": "04", "positiveIncrease": 281, "negativeIncrease": 2515, "total": 40530, "totalTestResultsIncrease": 1961, "posNeg": 40530, "dataQualityGrade": null, "deathIncrease": 11, "hospitalizedIncrease": 42, "hash": "40177c8be77e751a512a1134add7f026c75e7195", "commercialScore": 0, "negativeRegularScore": 0, "negativeScore": 0, "positiveScore": 0, "score": 0, "grade": "", "month_number_label": "2020-04", "date_label": "2020-04-11", "week_number_label": "2020W15", "week_start_label": "2020-04-06"}, {"date": 20200412, "state": "AZ", "positive": 3539, "probableCases": null, "negative": 38570, "pending": null, "totalTestResultsSource": "totalTestsViral", "totalTestResults": 52289, "hospitalizedCurrently": null, "hospitalizedCumulative": 1074, "inIcuCurrently": null, "inIcuCumulative": null, "onVentilatorCurrently": null, "onVentilatorCumulative": null, "recovered": null, "lastUpdateEt": "4/12/2020 00:00", "dateModified": "2020-04-12T00:00:00Z", "checkTimeEt": "04/11 20:00", "death": 115, "hospitalized": 1074, "hospitalizedDischarged": null, "dateChecked": "2020-04-12T00:00:00Z", "totalTestsViral": 52289, "positiveTestsViral": null, "negativeTestsViral": null, "positiveCasesViral": null, "deathConfirmed": null, "deathProbable": null, "totalTestEncountersViral": null, "totalTestsPeopleViral": 42109, "totalTestsAntibody": null, "positiveTestsAntibody": null, "negativeTestsAntibody": null, "totalTestsPeopleAntibody": null, "positiveTestsPeopleAntibody": null, "negativeTestsPeopleAntibody": null, "totalTestsPeopleAntigen": null, "positiveTestsPeopleAntigen": null, "totalTestsAntigen": null, "positiveTestsAntigen": null, "fips": "04", "positiveIncrease": 146, "negativeIncrease": 1433, "total": 42109, "totalTestResultsIncrease": 854, "posNeg": 42109, "dataQualityGrade": null, "deathIncrease": 7, "hospitalizedIncrease": 37, "hash": "27164bab017671cb10f1e015a7934217dcd48b05", "commercialScore": 0, "negativeRegularScore": 0, "negativeScore": 0, "positiveScore": 0, "score": 0, "grade": "", "month_number_label": "2020-04", "date_label": "2020-04-12", "week_number_label": "2020W15", "week_start_label": "2020-04-06"}, {"date": 20200413, "state": "AZ", "positive": 3702, "probableCases": null, "negative": 39645, "pending": null, "totalTestResultsSource": "totalTestsViral", "totalTestResults": 53187, "hospitalizedCurrently": 525, "hospitalizedCumulative": 1122, "inIcuCurrently": 286, "inIcuCumulative": null, "onVentilatorCurrently": 195, "onVentilatorCumulative": null, "recovered": null, "lastUpdateEt": "4/13/2020 00:00", "dateModified": "2020-04-13T00:00:00Z", "checkTimeEt": "04/12 20:00", "death": 122, "hospitalized": 1122, "hospitalizedDischarged": null, "dateChecked": "2020-04-13T00:00:00Z", "totalTestsViral": 53187, "positiveTestsViral": null, "negativeTestsViral": null, "positiveCasesViral": null, "deathConfirmed": null, "deathProbable": null, "totalTestEncountersViral": null, "totalTestsPeopleViral": 43347, "totalTestsAntibody": null, "positiveTestsAntibody": null, "negativeTestsAntibody": null, "totalTestsPeopleAntibody": null, "positiveTestsPeopleAntibody": null, "negativeTestsPeopleAntibody": null, "totalTestsPeopleAntigen": null, "positiveTestsPeopleAntigen": null, "totalTestsAntigen": null, "positiveTestsAntigen": null, "fips": "04", "positiveIncrease": 163, "negativeIncrease": 1075, "total": 43347, "totalTestResultsIncrease": 898, "posNeg": 43347, "dataQualityGrade": null, "deathIncrease": 7, "hospitalizedIncrease": 48, "hash": "fb7a2748a183c482d699577a7c3e085af7272515", "commercialScore": 0, "negativeRegularScore": 0, "negativeScore": 0, "positiveScore": 0, "score": 0, "grade": "", "month_number_label": "2020-04", "date_label": "2020-04-13", "week_number_label": "2020W16", "week_start_label": "2020-04-13"}, {"date": 20200414, "state": "AZ", "positive": 3806, "probableCases": null, "negative": 40290, "pending": null, "totalTestResultsSource": "totalTestsViral", "totalTestResults": 55491, "hospitalizedCurrently": 580, "hospitalizedCumulative": 1171, "inIcuCurrently": 286, "inIcuCumulative": null, "onVentilatorCurrently": 216, "onVentilatorCumulative": null, "recovered": null, "lastUpdateEt": "4/14/2020 00:00", "dateModified": "2020-04-14T00:00:00Z", "checkTimeEt": "04/13 20:00", "death": 131, "hospitalized": 1171, "hospitalizedDischarged": 249, "dateChecked": "2020-04-14T00:00:00Z", "totalTestsViral": 55491, "positiveTestsViral": null, "negativeTestsViral": null, "positiveCasesViral": null, "deathConfirmed": null, "deathProbable": null, "totalTestEncountersViral": null, "totalTestsPeopleViral": 44096, "totalTestsAntibody": null, "positiveTestsAntibody": null, "negativeTestsAntibody": null, "totalTestsPeopleAntibody": null, "positiveTestsPeopleAntibody": null, "negativeTestsPeopleAntibody": null, "totalTestsPeopleAntigen": null, "positiveTestsPeopleAntigen": null, "totalTestsAntigen": null, "positiveTestsAntigen": null, "fips": "04", "positiveIncrease": 104, "negativeIncrease": 645, "total": 44096, "totalTestResultsIncrease": 2304, "posNeg": 44096, "dataQualityGrade": null, "deathIncrease": 9, "hospitalizedIncrease": 49, "hash": "2ccfb715f5df12046f705ef2c4f1032a6e485162", "commercialScore": 0, "negativeRegularScore": 0, "negativeScore": 0, "positiveScore": 0, "score": 0, "grade": "", "month_number_label": "2020-04", "date_label": "2020-04-14", "week_number_label": "2020W16", "week_start_label": "2020-04-13"}, {"date": 20200415, "state": "AZ", "positive": 3962, "probableCases": null, "negative": 41348, "pending": null, "totalTestResultsSource": "totalTestsViral", "totalTestResults": 57662, "hospitalizedCurrently": 590, "hospitalizedCumulative": 1213, "inIcuCurrently": 286, "inIcuCumulative": null, "onVentilatorCurrently": 202, "onVentilatorCumulative": null, "recovered": null, "lastUpdateEt": "4/15/2020 00:00", "dateModified": "2020-04-15T00:00:00Z", "checkTimeEt": "04/14 20:00", "death": 142, "hospitalized": 1213, "hospitalizedDischarged": 385, "dateChecked": "2020-04-15T00:00:00Z", "totalTestsViral": 57662, "positiveTestsViral": null, "negativeTestsViral": null, "positiveCasesViral": null, "deathConfirmed": null, "deathProbable": null, "totalTestEncountersViral": null, "totalTestsPeopleViral": 45310, "totalTestsAntibody": null, "positiveTestsAntibody": null, "negativeTestsAntibody": null, "totalTestsPeopleAntibody": null, "positiveTestsPeopleAntibody": null, "negativeTestsPeopleAntibody": null, "totalTestsPeopleAntigen": null, "positiveTestsPeopleAntigen": null, "totalTestsAntigen": null, "positiveTestsAntigen": null, "fips": "04", "positiveIncrease": 156, "negativeIncrease": 1058, "total": 45310, "totalTestResultsIncrease": 2171, "posNeg": 45310, "dataQualityGrade": null, "deathIncrease": 11, "hospitalizedIncrease": 42, "hash": "0ac853da18efbf512d2ef943cc54185c4fbfbf3e", "commercialScore": 0, "negativeRegularScore": 0, "negativeScore": 0, "positiveScore": 0, "score": 0, "grade": "", "month_number_label": "2020-04", "date_label": "2020-04-15", "week_number_label": "2020W16", "week_start_label": "2020-04-13"}, {"date": 20200416, "state": "AZ", "positive": 4234, "probableCases": null, "negative": 43164, "pending": null, "totalTestResultsSource": "totalTestsViral", "totalTestResults": 59878, "hospitalizedCurrently": 578, "hospitalizedCumulative": 1258, "inIcuCurrently": 278, "inIcuCumulative": null, "onVentilatorCurrently": 188, "onVentilatorCumulative": null, "recovered": null, "lastUpdateEt": "4/16/2020 00:00", "dateModified": "2020-04-16T00:00:00Z", "checkTimeEt": "04/15 20:00", "death": 150, "hospitalized": 1258, "hospitalizedDischarged": 460, "dateChecked": "2020-04-16T00:00:00Z", "totalTestsViral": 59878, "positiveTestsViral": null, "negativeTestsViral": null, "positiveCasesViral": null, "deathConfirmed": null, "deathProbable": null, "totalTestEncountersViral": null, "totalTestsPeopleViral": 47398, "totalTestsAntibody": null, "positiveTestsAntibody": null, "negativeTestsAntibody": null, "totalTestsPeopleAntibody": null, "positiveTestsPeopleAntibody": null, "negativeTestsPeopleAntibody": null, "totalTestsPeopleAntigen": null, "positiveTestsPeopleAntigen": null, "totalTestsAntigen": null, "positiveTestsAntigen": null, "fips": "04", "positiveIncrease": 272, "negativeIncrease": 1816, "total": 47398, "totalTestResultsIncrease": 2216, "posNeg": 47398, "dataQualityGrade": null, "deathIncrease": 8, "hospitalizedIncrease": 45, "hash": "d66be4aea07c72bb033029f407b6ed63b7ff7934", "commercialScore": 0, "negativeRegularScore": 0, "negativeScore": 0, "positiveScore": 0, "score": 0, "grade": "", "month_number_label": "2020-04", "date_label": "2020-04-16", "week_number_label": "2020W16", "week_start_label": "2020-04-13"}, {"date": 20200417, "state": "AZ", "positive": 4507, "probableCases": null, "negative": 44723, "pending": null, "totalTestResultsSource": "totalTestsViral", "totalTestResults": 62213, "hospitalizedCurrently": 566, "hospitalizedCumulative": 1289, "inIcuCurrently": 285, "inIcuCumulative": null, "onVentilatorCurrently": 178, "onVentilatorCumulative": null, "recovered": null, "lastUpdateEt": "4/17/2020 00:00", "dateModified": "2020-04-17T00:00:00Z", "checkTimeEt": "04/16 20:00", "death": 169, "hospitalized": 1289, "hospitalizedDischarged": 539, "dateChecked": "2020-04-17T00:00:00Z", "totalTestsViral": 62213, "positiveTestsViral": null, "negativeTestsViral": null, "positiveCasesViral": null, "deathConfirmed": null, "deathProbable": null, "totalTestEncountersViral": null, "totalTestsPeopleViral": 49230, "totalTestsAntibody": null, "positiveTestsAntibody": null, "negativeTestsAntibody": null, "totalTestsPeopleAntibody": null, "positiveTestsPeopleAntibody": null, "negativeTestsPeopleAntibody": null, "totalTestsPeopleAntigen": null, "positiveTestsPeopleAntigen": null, "totalTestsAntigen": null, "positiveTestsAntigen": null, "fips": "04", "positiveIncrease": 273, "negativeIncrease": 1559, "total": 49230, "totalTestResultsIncrease": 2335, "posNeg": 49230, "dataQualityGrade": null, "deathIncrease": 19, "hospitalizedIncrease": 31, "hash": "d17aae447a37bc009676ca84ffb3ad47d71f88a8", "commercialScore": 0, "negativeRegularScore": 0, "negativeScore": 0, "positiveScore": 0, "score": 0, "grade": "", "month_number_label": "2020-04", "date_label": "2020-04-17", "week_number_label": "2020W16", "week_start_label": "2020-04-13"}, {"date": 20200418, "state": "AZ", "positive": 4719, "probableCases": null, "negative": 46326, "pending": null, "totalTestResultsSource": "totalTestsViral", "totalTestResults": 64671, "hospitalizedCurrently": 566, "hospitalizedCumulative": 1341, "inIcuCurrently": 285, "inIcuCumulative": null, "onVentilatorCurrently": 178, "onVentilatorCumulative": null, "recovered": null, "lastUpdateEt": "4/18/2020 00:00", "dateModified": "2020-04-18T00:00:00Z", "checkTimeEt": "04/17 20:00", "death": 177, "hospitalized": 1341, "hospitalizedDischarged": 539, "dateChecked": "2020-04-18T00:00:00Z", "totalTestsViral": 64671, "positiveTestsViral": null, "negativeTestsViral": null, "positiveCasesViral": null, "deathConfirmed": null, "deathProbable": null, "totalTestEncountersViral": null, "totalTestsPeopleViral": 51045, "totalTestsAntibody": null, "positiveTestsAntibody": null, "negativeTestsAntibody": null, "totalTestsPeopleAntibody": null, "positiveTestsPeopleAntibody": null, "negativeTestsPeopleAntibody": null, "totalTestsPeopleAntigen": null, "positiveTestsPeopleAntigen": null, "totalTestsAntigen": null, "positiveTestsAntigen": null, "fips": "04", "positiveIncrease": 212, "negativeIncrease": 1603, "total": 51045, "totalTestResultsIncrease": 2458, "posNeg": 51045, "dataQualityGrade": null, "deathIncrease": 8, "hospitalizedIncrease": 52, "hash": "11cce155dc02e8ab851d684222d0e27051ae4b94", "commercialScore": 0, "negativeRegularScore": 0, "negativeScore": 0, "positiveScore": 0, "score": 0, "grade": "", "month_number_label": "2020-04", "date_label": "2020-04-18", "week_number_label": "2020W16", "week_start_label": "2020-04-13"}, {"date": 20200419, "state": "AZ", "positive": 4929, "probableCases": null, "negative": 48061, "pending": null, "totalTestResultsSource": "totalTestsViral", "totalTestResults": 65652, "hospitalizedCurrently": 631, "hospitalizedCumulative": 1387, "inIcuCurrently": 283, "inIcuCumulative": null, "onVentilatorCurrently": 187, "onVentilatorCumulative": null, "recovered": null, "lastUpdateEt": "4/19/2020 00:00", "dateModified": "2020-04-19T00:00:00Z", "checkTimeEt": "04/18 20:00", "death": 184, "hospitalized": 1387, "hospitalizedDischarged": 994, "dateChecked": "2020-04-19T00:00:00Z", "totalTestsViral": 65652, "positiveTestsViral": null, "negativeTestsViral": null, "positiveCasesViral": null, "deathConfirmed": null, "deathProbable": null, "totalTestEncountersViral": null, "totalTestsPeopleViral": 52990, "totalTestsAntibody": null, "positiveTestsAntibody": null, "negativeTestsAntibody": null, "totalTestsPeopleAntibody": null, "positiveTestsPeopleAntibody": null, "negativeTestsPeopleAntibody": null, "totalTestsPeopleAntigen": null, "positiveTestsPeopleAntigen": null, "totalTestsAntigen": null, "positiveTestsAntigen": null, "fips": "04", "positiveIncrease": 210, "negativeIncrease": 1735, "total": 52990, "totalTestResultsIncrease": 981, "posNeg": 52990, "dataQualityGrade": null, "deathIncrease": 7, "hospitalizedIncrease": 46, "hash": "0672159148df7c454da62d395fdfc9c944a922de", "commercialScore": 0, "negativeRegularScore": 0, "negativeScore": 0, "positiveScore": 0, "score": 0, "grade": "", "month_number_label": "2020-04", "date_label": "2020-04-19", "week_number_label": "2020W16", "week_start_label": "2020-04-13"}, {"date": 20200420, "state": "AZ", "positive": 5064, "probableCases": null, "negative": 49436, "pending": null, "totalTestResultsSource": "totalTestsViral", "totalTestResults": 66619, "hospitalizedCurrently": 637, "hospitalizedCumulative": 1454, "inIcuCurrently": 285, "inIcuCumulative": null, "onVentilatorCurrently": 181, "onVentilatorCumulative": null, "recovered": null, "lastUpdateEt": "4/20/2020 00:00", "dateModified": "2020-04-20T00:00:00Z", "checkTimeEt": "04/19 20:00", "death": 187, "hospitalized": 1454, "hospitalizedDischarged": 1155, "dateChecked": "2020-04-20T00:00:00Z", "totalTestsViral": 66619, "positiveTestsViral": null, "negativeTestsViral": null, "positiveCasesViral": null, "deathConfirmed": null, "deathProbable": null, "totalTestEncountersViral": null, "totalTestsPeopleViral": 54500, "totalTestsAntibody": null, "positiveTestsAntibody": null, "negativeTestsAntibody": null, "totalTestsPeopleAntibody": null, "positiveTestsPeopleAntibody": null, "negativeTestsPeopleAntibody": null, "totalTestsPeopleAntigen": null, "positiveTestsPeopleAntigen": null, "totalTestsAntigen": null, "positiveTestsAntigen": null, "fips": "04", "positiveIncrease": 135, "negativeIncrease": 1375, "total": 54500, "totalTestResultsIncrease": 967, "posNeg": 54500, "dataQualityGrade": null, "deathIncrease": 3, "hospitalizedIncrease": 67, "hash": "8c555b85c65943161c9fe0a044c50c9a5b53ae63", "commercialScore": 0, "negativeRegularScore": 0, "negativeScore": 0, "positiveScore": 0, "score": 0, "grade": "", "month_number_label": "2020-04", "date_label": "2020-04-20", "week_number_label": "2020W17", "week_start_label": "2020-04-20"}, {"date": 20200421, "state": "AZ", "positive": 5251, "probableCases": null, "negative": 49901, "pending": null, "totalTestResultsSource": "totalTestsViral", "totalTestResults": 69364, "hospitalizedCurrently": 637, "hospitalizedCumulative": 1484, "inIcuCurrently": 285, "inIcuCumulative": null, "onVentilatorCurrently": 181, "onVentilatorCumulative": null, "recovered": null, "lastUpdateEt": "4/21/2020 00:00", "dateModified": "2020-04-21T00:00:00Z", "checkTimeEt": "04/20 20:00", "death": 208, "hospitalized": 1484, "hospitalizedDischarged": 1155, "dateChecked": "2020-04-21T00:00:00Z", "totalTestsViral": 69364, "positiveTestsViral": null, "negativeTestsViral": null, "positiveCasesViral": null, "deathConfirmed": null, "deathProbable": null, "totalTestEncountersViral": null, "totalTestsPeopleViral": 55152, "totalTestsAntibody": null, "positiveTestsAntibody": null, "negativeTestsAntibody": null, "totalTestsPeopleAntibody": null, "positiveTestsPeopleAntibody": null, "negativeTestsPeopleAntibody": null, "totalTestsPeopleAntigen": null, "positiveTestsPeopleAntigen": null, "totalTestsAntigen": null, "positiveTestsAntigen": null, "fips": "04", "positiveIncrease": 187, "negativeIncrease": 465, "total": 55152, "totalTestResultsIncrease": 2745, "posNeg": 55152, "dataQualityGrade": null, "deathIncrease": 21, "hospitalizedIncrease": 30, "hash": "3c8bd9f8c09e4d93b55bd83227c14cd50813c313", "commercialScore": 0, "negativeRegularScore": 0, "negativeScore": 0, "positiveScore": 0, "score": 0, "grade": "", "month_number_label": "2020-04", "date_label": "2020-04-21", "week_number_label": "2020W17", "week_start_label": "2020-04-20"}, {"date": 20200422, "state": "AZ", "positive": 5459, "probableCases": null, "negative": 51142, "pending": null, "totalTestResultsSource": "totalTestsViral", "totalTestResults": 71814, "hospitalizedCurrently": 664, "hospitalizedCumulative": 1528, "inIcuCurrently": 300, "inIcuCumulative": null, "onVentilatorCurrently": 195, "onVentilatorCumulative": null, "recovered": null, "lastUpdateEt": "4/22/2020 00:00", "dateModified": "2020-04-22T00:00:00Z", "checkTimeEt": "04/21 20:00", "death": 229, "hospitalized": 1528, "hospitalizedDischarged": 1265, "dateChecked": "2020-04-22T00:00:00Z", "totalTestsViral": 71814, "positiveTestsViral": null, "negativeTestsViral": null, "positiveCasesViral": null, "deathConfirmed": null, "deathProbable": null, "totalTestEncountersViral": null, "totalTestsPeopleViral": 56601, "totalTestsAntibody": null, "positiveTestsAntibody": null, "negativeTestsAntibody": null, "totalTestsPeopleAntibody": null, "positiveTestsPeopleAntibody": null, "negativeTestsPeopleAntibody": null, "totalTestsPeopleAntigen": null, "positiveTestsPeopleAntigen": null, "totalTestsAntigen": null, "positiveTestsAntigen": null, "fips": "04", "positiveIncrease": 208, "negativeIncrease": 1241, "total": 56601, "totalTestResultsIncrease": 2450, "posNeg": 56601, "dataQualityGrade": null, "deathIncrease": 21, "hospitalizedIncrease": 44, "hash": "d823a34a541363b2414c011646014e250e873a0e", "commercialScore": 0, "negativeRegularScore": 0, "negativeScore": 0, "positiveScore": 0, "score": 0, "grade": "", "month_number_label": "2020-04", "date_label": "2020-04-22", "week_number_label": "2020W17", "week_start_label": "2020-04-20"}, {"date": 20200423, "state": "AZ", "positive": 5769, "probableCases": null, "negative": 52928, "pending": null, "totalTestResultsSource": "totalTestsViral", "totalTestResults": 74324, "hospitalizedCurrently": 699, "hospitalizedCumulative": 1572, "inIcuCurrently": 305, "inIcuCumulative": null, "onVentilatorCurrently": 201, "onVentilatorCumulative": null, "recovered": null, "lastUpdateEt": "4/23/2020 00:00", "dateModified": "2020-04-23T00:00:00Z", "checkTimeEt": "04/22 20:00", "death": 249, "hospitalized": 1572, "hospitalizedDischarged": 1282, "dateChecked": "2020-04-23T00:00:00Z", "totalTestsViral": 74324, "positiveTestsViral": null, "negativeTestsViral": null, "positiveCasesViral": null, "deathConfirmed": null, "deathProbable": null, "totalTestEncountersViral": null, "totalTestsPeopleViral": 58697, "totalTestsAntibody": null, "positiveTestsAntibody": null, "negativeTestsAntibody": null, "totalTestsPeopleAntibody": null, "positiveTestsPeopleAntibody": null, "negativeTestsPeopleAntibody": null, "totalTestsPeopleAntigen": null, "positiveTestsPeopleAntigen": null, "totalTestsAntigen": null, "positiveTestsAntigen": null, "fips": "04", "positiveIncrease": 310, "negativeIncrease": 1786, "total": 58697, "totalTestResultsIncrease": 2510, "posNeg": 58697, "dataQualityGrade": null, "deathIncrease": 20, "hospitalizedIncrease": 44, "hash": "8153880078b1331ad0946b397440249b814a8ec2", "commercialScore": 0, "negativeRegularScore": 0, "negativeScore": 0, "positiveScore": 0, "score": 0, "grade": "", "month_number_label": "2020-04", "date_label": "2020-04-23", "week_number_label": "2020W17", "week_start_label": "2020-04-20"}, {"date": 20200424, "state": "AZ", "positive": 6045, "probableCases": null, "negative": 54669, "pending": null, "totalTestResultsSource": "totalTestsViral", "totalTestResults": 76906, "hospitalizedCurrently": 639, "hospitalizedCumulative": 1626, "inIcuCurrently": 332, "inIcuCumulative": null, "onVentilatorCurrently": 186, "onVentilatorCumulative": null, "recovered": null, "lastUpdateEt": "4/24/2020 00:00", "dateModified": "2020-04-24T00:00:00Z", "checkTimeEt": "04/23 20:00", "death": 266, "hospitalized": 1626, "hospitalizedDischarged": 1313, "dateChecked": "2020-04-24T00:00:00Z", "totalTestsViral": 76906, "positiveTestsViral": null, "negativeTestsViral": null, "positiveCasesViral": null, "deathConfirmed": null, "deathProbable": null, "totalTestEncountersViral": null, "totalTestsPeopleViral": 60714, "totalTestsAntibody": null, "positiveTestsAntibody": null, "negativeTestsAntibody": null, "totalTestsPeopleAntibody": null, "positiveTestsPeopleAntibody": null, "negativeTestsPeopleAntibody": null, "totalTestsPeopleAntigen": null, "positiveTestsPeopleAntigen": null, "totalTestsAntigen": null, "positiveTestsAntigen": null, "fips": "04", "positiveIncrease": 276, "negativeIncrease": 1741, "total": 60714, "totalTestResultsIncrease": 2582, "posNeg": 60714, "dataQualityGrade": null, "deathIncrease": 17, "hospitalizedIncrease": 54, "hash": "622ee170407cbd7b3c8d28306ff3c64b4f95fa76", "commercialScore": 0, "negativeRegularScore": 0, "negativeScore": 0, "positiveScore": 0, "score": 0, "grade": "", "month_number_label": "2020-04", "date_label": "2020-04-24", "week_number_label": "2020W17", "week_start_label": "2020-04-20"}, {"date": 20200425, "state": "AZ", "positive": 6280, "probableCases": null, "negative": 56228, "pending": null, "totalTestResultsSource": "totalTestsViral", "totalTestResults": 79897, "hospitalizedCurrently": 697, "hospitalizedCumulative": 1672, "inIcuCurrently": 313, "inIcuCumulative": null, "onVentilatorCurrently": 191, "onVentilatorCumulative": null, "recovered": null, "lastUpdateEt": "4/25/2020 00:00", "dateModified": "2020-04-25T00:00:00Z", "checkTimeEt": "04/24 20:00", "death": 266, "hospitalized": 1672, "hospitalizedDischarged": 1345, "dateChecked": "2020-04-25T00:00:00Z", "totalTestsViral": 79897, "positiveTestsViral": null, "negativeTestsViral": null, "positiveCasesViral": null, "deathConfirmed": null, "deathProbable": null, "totalTestEncountersViral": null, "totalTestsPeopleViral": 62508, "totalTestsAntibody": null, "positiveTestsAntibody": null, "negativeTestsAntibody": null, "totalTestsPeopleAntibody": null, "positiveTestsPeopleAntibody": null, "negativeTestsPeopleAntibody": null, "totalTestsPeopleAntigen": null, "positiveTestsPeopleAntigen": null, "totalTestsAntigen": null, "positiveTestsAntigen": null, "fips": "04", "positiveIncrease": 235, "negativeIncrease": 1559, "total": 62508, "totalTestResultsIncrease": 2991, "posNeg": 62508, "dataQualityGrade": null, "deathIncrease": 0, "hospitalizedIncrease": 46, "hash": "5ba1092ef1b60c7d16a6b55b9aa7800b588b208c", "commercialScore": 0, "negativeRegularScore": 0, "negativeScore": 0, "positiveScore": 0, "score": 0, "grade": "", "month_number_label": "2020-04", "date_label": "2020-04-25", "week_number_label": "2020W17", "week_start_label": "2020-04-20"}, {"date": 20200426, "state": "AZ", "positive": 6526, "probableCases": null, "negative": 58285, "pending": null, "totalTestResultsSource": "totalTestsViral", "totalTestResults": 81060, "hospitalizedCurrently": 671, "hospitalizedCumulative": 1716, "inIcuCurrently": 308, "inIcuCumulative": null, "onVentilatorCurrently": 200, "onVentilatorCumulative": null, "recovered": null, "lastUpdateEt": "4/26/2020 00:00", "dateModified": "2020-04-26T00:00:00Z", "checkTimeEt": "04/25 20:00", "death": 275, "hospitalized": 1716, "hospitalizedDischarged": 1383, "dateChecked": "2020-04-26T00:00:00Z", "totalTestsViral": 81060, "positiveTestsViral": null, "negativeTestsViral": null, "positiveCasesViral": null, "deathConfirmed": null, "deathProbable": null, "totalTestEncountersViral": null, "totalTestsPeopleViral": 64811, "totalTestsAntibody": null, "positiveTestsAntibody": null, "negativeTestsAntibody": null, "totalTestsPeopleAntibody": null, "positiveTestsPeopleAntibody": null, "negativeTestsPeopleAntibody": null, "totalTestsPeopleAntigen": null, "positiveTestsPeopleAntigen": null, "totalTestsAntigen": null, "positiveTestsAntigen": null, "fips": "04", "positiveIncrease": 246, "negativeIncrease": 2057, "total": 64811, "totalTestResultsIncrease": 1163, "posNeg": 64811, "dataQualityGrade": null, "deathIncrease": 9, "hospitalizedIncrease": 44, "hash": "39386572523d356645d0efb3c649824eb97c3ca4", "commercialScore": 0, "negativeRegularScore": 0, "negativeScore": 0, "positiveScore": 0, "score": 0, "grade": "", "month_number_label": "2020-04", "date_label": "2020-04-26", "week_number_label": "2020W17", "week_start_label": "2020-04-20"}, {"date": 20200427, "state": "AZ", "positive": 6716, "probableCases": null, "negative": 59827, "pending": null, "totalTestResultsSource": "totalTestsViral", "totalTestResults": 81952, "hospitalizedCurrently": 647, "hospitalizedCumulative": 1772, "inIcuCurrently": 328, "inIcuCumulative": null, "onVentilatorCurrently": 200, "onVentilatorCumulative": null, "recovered": null, "lastUpdateEt": "4/27/2020 00:00", "dateModified": "2020-04-27T00:00:00Z", "checkTimeEt": "04/26 20:00", "death": 275, "hospitalized": 1772, "hospitalizedDischarged": 1418, "dateChecked": "2020-04-27T00:00:00Z", "totalTestsViral": 81952, "positiveTestsViral": null, "negativeTestsViral": null, "positiveCasesViral": null, "deathConfirmed": null, "deathProbable": null, "totalTestEncountersViral": null, "totalTestsPeopleViral": 66543, "totalTestsAntibody": null, "positiveTestsAntibody": null, "negativeTestsAntibody": null, "totalTestsPeopleAntibody": null, "positiveTestsPeopleAntibody": null, "negativeTestsPeopleAntibody": null, "totalTestsPeopleAntigen": null, "positiveTestsPeopleAntigen": null, "totalTestsAntigen": null, "positiveTestsAntigen": null, "fips": "04", "positiveIncrease": 190, "negativeIncrease": 1542, "total": 66543, "totalTestResultsIncrease": 892, "posNeg": 66543, "dataQualityGrade": null, "deathIncrease": 0, "hospitalizedIncrease": 56, "hash": "50e6a872778e260addb6e095eb14e188134fd4f1", "commercialScore": 0, "negativeRegularScore": 0, "negativeScore": 0, "positiveScore": 0, "score": 0, "grade": "", "month_number_label": "2020-04", "date_label": "2020-04-27", "week_number_label": "2020W18", "week_start_label": "2020-04-27"}, {"date": 20200428, "state": "AZ", "positive": 6948, "probableCases": null, "negative": 60490, "pending": null, "totalTestResultsSource": "totalTestsViral", "totalTestResults": 85487, "hospitalizedCurrently": 737, "hospitalizedCumulative": 1824, "inIcuCurrently": 303, "inIcuCumulative": null, "onVentilatorCurrently": 193, "onVentilatorCumulative": null, "recovered": null, "lastUpdateEt": "4/27/2020 00:00", "dateModified": "2020-04-27T00:00:00Z", "checkTimeEt": "04/26 20:00", "death": 293, "hospitalized": 1824, "hospitalizedDischarged": 1450, "dateChecked": "2020-04-27T00:00:00Z", "totalTestsViral": 85487, "positiveTestsViral": null, "negativeTestsViral": null, "positiveCasesViral": null, "deathConfirmed": null, "deathProbable": null, "totalTestEncountersViral": null, "totalTestsPeopleViral": 67438, "totalTestsAntibody": null, "positiveTestsAntibody": null, "negativeTestsAntibody": null, "totalTestsPeopleAntibody": null, "positiveTestsPeopleAntibody": null, "negativeTestsPeopleAntibody": null, "totalTestsPeopleAntigen": null, "positiveTestsPeopleAntigen": null, "totalTestsAntigen": null, "positiveTestsAntigen": null, "fips": "04", "positiveIncrease": 232, "negativeIncrease": 663, "total": 67438, "totalTestResultsIncrease": 3535, "posNeg": 67438, "dataQualityGrade": null, "deathIncrease": 18, "hospitalizedIncrease": 52, "hash": "24fe2d0ff9614cb2fbce00085a339d32cc407b8b", "commercialScore": 0, "negativeRegularScore": 0, "negativeScore": 0, "positiveScore": 0, "score": 0, "grade": "", "month_number_label": "2020-04", "date_label": "2020-04-28", "week_number_label": "2020W18", "week_start_label": "2020-04-27"}, {"date": 20200429, "state": "AZ", "positive": 7202, "probableCases": null, "negative": 61611, "pending": null, "totalTestResultsSource": "totalTestsViral", "totalTestResults": 89547, "hospitalizedCurrently": 756, "hospitalizedCumulative": 1884, "inIcuCurrently": 312, "inIcuCumulative": null, "onVentilatorCurrently": 191, "onVentilatorCumulative": null, "recovered": null, "lastUpdateEt": "4/29/2020 00:00", "dateModified": "2020-04-29T00:00:00Z", "checkTimeEt": "04/28 20:00", "death": 304, "hospitalized": 1884, "hospitalizedDischarged": 1475, "dateChecked": "2020-04-29T00:00:00Z", "totalTestsViral": 89547, "positiveTestsViral": null, "negativeTestsViral": null, "positiveCasesViral": null, "deathConfirmed": null, "deathProbable": null, "totalTestEncountersViral": null, "totalTestsPeopleViral": 68813, "totalTestsAntibody": null, "positiveTestsAntibody": null, "negativeTestsAntibody": null, "totalTestsPeopleAntibody": null, "positiveTestsPeopleAntibody": null, "negativeTestsPeopleAntibody": null, "totalTestsPeopleAntigen": null, "positiveTestsPeopleAntigen": null, "totalTestsAntigen": null, "positiveTestsAntigen": null, "fips": "04", "positiveIncrease": 254, "negativeIncrease": 1121, "total": 68813, "totalTestResultsIncrease": 4060, "posNeg": 68813, "dataQualityGrade": null, "deathIncrease": 11, "hospitalizedIncrease": 60, "hash": "14c4613827b284105d8b28b2beb6cf0cd720addd", "commercialScore": 0, "negativeRegularScore": 0, "negativeScore": 0, "positiveScore": 0, "score": 0, "grade": "", "month_number_label": "2020-04", "date_label": "2020-04-29", "week_number_label": "2020W18", "week_start_label": "2020-04-27"}, {"date": 20200430, "state": "AZ", "positive": 7648, "probableCases": null, "negative": 64138, "pending": null, "totalTestResultsSource": "totalTestsViral", "totalTestResults": 93389, "hospitalizedCurrently": 755, "hospitalizedCumulative": 1937, "inIcuCurrently": 311, "inIcuCumulative": null, "onVentilatorCurrently": 194, "onVentilatorCumulative": null, "recovered": null, "lastUpdateEt": "4/30/2020 00:00", "dateModified": "2020-04-30T00:00:00Z", "checkTimeEt": "04/29 20:00", "death": 320, "hospitalized": 1937, "hospitalizedDischarged": 1499, "dateChecked": "2020-04-30T00:00:00Z", "totalTestsViral": 93389, "positiveTestsViral": null, "negativeTestsViral": null, "positiveCasesViral": null, "deathConfirmed": null, "deathProbable": null, "totalTestEncountersViral": null, "totalTestsPeopleViral": 71786, "totalTestsAntibody": null, "positiveTestsAntibody": null, "negativeTestsAntibody": null, "totalTestsPeopleAntibody": null, "positiveTestsPeopleAntibody": null, "negativeTestsPeopleAntibody": null, "totalTestsPeopleAntigen": null, "positiveTestsPeopleAntigen": null, "totalTestsAntigen": null, "positiveTestsAntigen": null, "fips": "04", "positiveIncrease": 446, "negativeIncrease": 2527, "total": 71786, "totalTestResultsIncrease": 3842, "posNeg": 71786, "dataQualityGrade": null, "deathIncrease": 16, "hospitalizedIncrease": 53, "hash": "2075904ca588564f25157a6ccb10f2308bc399c1", "commercialScore": 0, "negativeRegularScore": 0, "negativeScore": 0, "positiveScore": 0, "score": 0, "grade": "", "month_number_label": "2020-04", "date_label": "2020-04-30", "week_number_label": "2020W18", "week_start_label": "2020-04-27"}, {"date": 20200501, "state": "AZ", "positive": 7962, "probableCases": null, "negative": 66917, "pending": null, "totalTestResultsSource": "totalTestsViral", "totalTestResults": 97494, "hospitalizedCurrently": 709, "hospitalizedCumulative": 1986, "inIcuCurrently": 311, "inIcuCumulative": null, "onVentilatorCurrently": 187, "onVentilatorCumulative": null, "recovered": null, "lastUpdateEt": "5/1/2020 00:00", "dateModified": "2020-05-01T00:00:00Z", "checkTimeEt": "04/30 20:00", "death": 330, "hospitalized": 1986, "hospitalizedDischarged": 1528, "dateChecked": "2020-05-01T00:00:00Z", "totalTestsViral": 97494, "positiveTestsViral": null, "negativeTestsViral": null, "positiveCasesViral": null, "deathConfirmed": null, "deathProbable": null, "totalTestEncountersViral": null, "totalTestsPeopleViral": 74879, "totalTestsAntibody": null, "positiveTestsAntibody": null, "negativeTestsAntibody": null, "totalTestsPeopleAntibody": null, "positiveTestsPeopleAntibody": null, "negativeTestsPeopleAntibody": null, "totalTestsPeopleAntigen": null, "positiveTestsPeopleAntigen": null, "totalTestsAntigen": null, "positiveTestsAntigen": null, "fips": "04", "positiveIncrease": 314, "negativeIncrease": 2779, "total": 74879, "totalTestResultsIncrease": 4105, "posNeg": 74879, "dataQualityGrade": null, "deathIncrease": 10, "hospitalizedIncrease": 49, "hash": "3f99a6207ec01c3c4c18023706b36c301afb041e", "commercialScore": 0, "negativeRegularScore": 0, "negativeScore": 0, "positiveScore": 0, "score": 0, "grade": "", "month_number_label": "2020-05", "date_label": "2020-05-01", "week_number_label": "2020W18", "week_start_label": "2020-04-27"}, {"date": 20200502, "state": "AZ", "positive": 8364, "probableCases": null, "negative": 69633, "pending": null, "totalTestResultsSource": "totalTestsViral", "totalTestResults": 102618, "hospitalizedCurrently": 718, "hospitalizedCumulative": 2033, "inIcuCurrently": 291, "inIcuCumulative": null, "onVentilatorCurrently": 198, "onVentilatorCumulative": null, "recovered": null, "lastUpdateEt": "5/2/2020 00:00", "dateModified": "2020-05-02T00:00:00Z", "checkTimeEt": "05/01 20:00", "death": 348, "hospitalized": 2033, "hospitalizedDischarged": 1565, "dateChecked": "2020-05-02T00:00:00Z", "totalTestsViral": 102618, "positiveTestsViral": null, "negativeTestsViral": null, "positiveCasesViral": null, "deathConfirmed": null, "deathProbable": null, "totalTestEncountersViral": null, "totalTestsPeopleViral": 77997, "totalTestsAntibody": null, "positiveTestsAntibody": null, "negativeTestsAntibody": null, "totalTestsPeopleAntibody": null, "positiveTestsPeopleAntibody": null, "negativeTestsPeopleAntibody": null, "totalTestsPeopleAntigen": null, "positiveTestsPeopleAntigen": null, "totalTestsAntigen": null, "positiveTestsAntigen": null, "fips": "04", "positiveIncrease": 402, "negativeIncrease": 2716, "total": 77997, "totalTestResultsIncrease": 5124, "posNeg": 77997, "dataQualityGrade": null, "deathIncrease": 18, "hospitalizedIncrease": 47, "hash": "a282887e529678c89919ae67fda11bc3fe05bcb6", "commercialScore": 0, "negativeRegularScore": 0, "negativeScore": 0, "positiveScore": 0, "score": 0, "grade": "", "month_number_label": "2020-05", "date_label": "2020-05-02", "week_number_label": "2020W18", "week_start_label": "2020-04-27"}, {"date": 20200503, "state": "AZ", "positive": 8640, "probableCases": null, "negative": 72479, "pending": null, "totalTestResultsSource": "totalTestsViral", "totalTestResults": 109167, "hospitalizedCurrently": 732, "hospitalizedCumulative": 2089, "inIcuCurrently": 282, "inIcuCumulative": null, "onVentilatorCurrently": 192, "onVentilatorCumulative": null, "recovered": null, "lastUpdateEt": "5/3/2020 00:00", "dateModified": "2020-05-03T00:00:00Z", "checkTimeEt": "05/02 20:00", "death": 362, "hospitalized": 2089, "hospitalizedDischarged": 1597, "dateChecked": "2020-05-03T00:00:00Z", "totalTestsViral": 109167, "positiveTestsViral": null, "negativeTestsViral": null, "positiveCasesViral": null, "deathConfirmed": null, "deathProbable": null, "totalTestEncountersViral": null, "totalTestsPeopleViral": 81119, "totalTestsAntibody": null, "positiveTestsAntibody": null, "negativeTestsAntibody": null, "totalTestsPeopleAntibody": null, "positiveTestsPeopleAntibody": null, "negativeTestsPeopleAntibody": null, "totalTestsPeopleAntigen": null, "positiveTestsPeopleAntigen": null, "totalTestsAntigen": null, "positiveTestsAntigen": null, "fips": "04", "positiveIncrease": 276, "negativeIncrease": 2846, "total": 81119, "totalTestResultsIncrease": 6549, "posNeg": 81119, "dataQualityGrade": null, "deathIncrease": 14, "hospitalizedIncrease": 56, "hash": "5ca451fc371eff9b45d0aae43db21113aa41c401", "commercialScore": 0, "negativeRegularScore": 0, "negativeScore": 0, "positiveScore": 0, "score": 0, "grade": "", "month_number_label": "2020-05", "date_label": "2020-05-03", "week_number_label": "2020W18", "week_start_label": "2020-04-27"}, {"date": 20200504, "state": "AZ", "positive": 8919, "probableCases": null, "negative": 76334, "pending": null, "totalTestResultsSource": "totalTestsViral", "totalTestResults": 110799, "hospitalizedCurrently": 703, "hospitalizedCumulative": 2135, "inIcuCurrently": 288, "inIcuCumulative": null, "onVentilatorCurrently": 200, "onVentilatorCumulative": null, "recovered": null, "lastUpdateEt": "5/4/2020 00:00", "dateModified": "2020-05-04T00:00:00Z", "checkTimeEt": "05/03 20:00", "death": 362, "hospitalized": 2135, "hospitalizedDischarged": 1632, "dateChecked": "2020-05-04T00:00:00Z", "totalTestsViral": 110799, "positiveTestsViral": null, "negativeTestsViral": null, "positiveCasesViral": null, "deathConfirmed": null, "deathProbable": null, "totalTestEncountersViral": null, "totalTestsPeopleViral": 85253, "totalTestsAntibody": null, "positiveTestsAntibody": null, "negativeTestsAntibody": null, "totalTestsPeopleAntibody": null, "positiveTestsPeopleAntibody": null, "negativeTestsPeopleAntibody": null, "totalTestsPeopleAntigen": null, "positiveTestsPeopleAntigen": null, "totalTestsAntigen": null, "positiveTestsAntigen": null, "fips": "04", "positiveIncrease": 279, "negativeIncrease": 3855, "total": 85253, "totalTestResultsIncrease": 1632, "posNeg": 85253, "dataQualityGrade": null, "deathIncrease": 0, "hospitalizedIncrease": 46, "hash": "8ed81c71b9cf9359bb8bc2ccf3e77b991960a2b3", "commercialScore": 0, "negativeRegul