[{"date": 20200305, "state": "NM", "positive": 0, "probableCases": null, "negative": 16, "pending": 0, "totalTestResultsSource": "posNeg", "totalTestResults": 16, "hospitalizedCurrently": null, "hospitalizedCumulative": null, "inIcuCurrently": null, "inIcuCumulative": null, "onVentilatorCurrently": null, "onVentilatorCumulative": null, "recovered": null, "dataQualityGrade": null, "lastUpdateEt": null, "dateModified": null, "checkTimeEt": null, "death": null, "hospitalized": null, "dateChecked": null, "totalTestsViral": null, "positiveTestsViral": null, "negativeTestsViral": null, "positiveCasesViral": null, "deathConfirmed": null, "deathProbable": null, "totalTestEncountersViral": null, "totalTestsPeopleViral": null, "totalTestsAntibody": null, "positiveTestsAntibody": null, "negativeTestsAntibody": null, "totalTestsPeopleAntibody": null, "positiveTestsPeopleAntibody": null, "negativeTestsPeopleAntibody": null, "totalTestsPeopleAntigen": null, "positiveTestsPeopleAntigen": null, "totalTestsAntigen": null, "positiveTestsAntigen": null, "fips": "35", "positiveIncrease": 0, "negativeIncrease": 0, "total": 16, "totalTestResultsIncrease": 0, "posNeg": 16, "deathIncrease": 0, "hospitalizedIncrease": 0, "hash": "9dcba0fda0d229c811eb2ebd4bcc173a53140bc8", "commercialScore": 0, "negativeRegularScore": 0, "negativeScore": 0, "positiveScore": 0, "score": 0, "grade": "", "month_number_label": "2020-03", "date_label": "2020-03-05", "week_number_label": "2020W10", "week_start_label": "2020-03-02"}, {"date": 20200306, "state": "NM", "positive": 0, "probableCases": null, "negative": 48, "pending": 0, "totalTestResultsSource": "posNeg", "totalTestResults": 48, "hospitalizedCurrently": null, "hospitalizedCumulative": null, "inIcuCurrently": null, "inIcuCumulative": null, "onVentilatorCurrently": null, "onVentilatorCumulative": null, "recovered": null, "dataQualityGrade": null, "lastUpdateEt": null, "dateModified": null, "checkTimeEt": null, "death": null, "hospitalized": null, "dateChecked": null, "totalTestsViral": null, "positiveTestsViral": null, "negativeTestsViral": null, "positiveCasesViral": null, "deathConfirmed": null, "deathProbable": null, "totalTestEncountersViral": null, "totalTestsPeopleViral": null, "totalTestsAntibody": null, "positiveTestsAntibody": null, "negativeTestsAntibody": null, "totalTestsPeopleAntibody": null, "positiveTestsPeopleAntibody": null, "negativeTestsPeopleAntibody": null, "totalTestsPeopleAntigen": null, "positiveTestsPeopleAntigen": null, "totalTestsAntigen": null, "positiveTestsAntigen": null, "fips": "35", "positiveIncrease": 0, "negativeIncrease": 32, "total": 48, "totalTestResultsIncrease": 32, "posNeg": 48, "deathIncrease": 0, "hospitalizedIncrease": 0, "hash": "0f9c3808c8ecd7e5b73fdb7cb314ecdf2dfa4465", "commercialScore": 0, "negativeRegularScore": 0, "negativeScore": 0, "positiveScore": 0, "score": 0, "grade": "", "month_number_label": "2020-03", "date_label": "2020-03-06", "week_number_label": "2020W10", "week_start_label": "2020-03-02"}, {"date": 20200307, "state": "NM", "positive": 0, "probableCases": null, "negative": 48, "pending": 0, "totalTestResultsSource": "posNeg", "totalTestResults": 48, "hospitalizedCurrently": null, "hospitalizedCumulative": null, "inIcuCurrently": null, "inIcuCumulative": null, "onVentilatorCurrently": null, "onVentilatorCumulative": null, "recovered": null, "dataQualityGrade": null, "lastUpdateEt": null, "dateModified": null, "checkTimeEt": null, "death": null, "hospitalized": null, "dateChecked": null, "totalTestsViral": null, "positiveTestsViral": null, "negativeTestsViral": null, "positiveCasesViral": null, "deathConfirmed": null, "deathProbable": null, "totalTestEncountersViral": null, "totalTestsPeopleViral": null, "totalTestsAntibody": null, "positiveTestsAntibody": null, "negativeTestsAntibody": null, "totalTestsPeopleAntibody": null, "positiveTestsPeopleAntibody": null, "negativeTestsPeopleAntibody": null, "totalTestsPeopleAntigen": null, "positiveTestsPeopleAntigen": null, "totalTestsAntigen": null, "positiveTestsAntigen": null, "fips": "35", "positiveIncrease": 0, "negativeIncrease": 0, "total": 48, "totalTestResultsIncrease": 0, "posNeg": 48, "deathIncrease": 0, "hospitalizedIncrease": 0, "hash": "0e40f2b9aec58e4dd21f674fa261a9127331a273", "commercialScore": 0, "negativeRegularScore": 0, "negativeScore": 0, "positiveScore": 0, "score": 0, "grade": "", "month_number_label": "2020-03", "date_label": "2020-03-07", "week_number_label": "2020W10", "week_start_label": "2020-03-02"}, {"date": 20200308, "state": "NM", "positive": 0, "probableCases": null, "negative": 57, "pending": 0, "totalTestResultsSource": "posNeg", "totalTestResults": 57, "hospitalizedCurrently": null, "hospitalizedCumulative": null, "inIcuCurrently": null, "inIcuCumulative": null, "onVentilatorCurrently": null, "onVentilatorCumulative": null, "recovered": null, "dataQualityGrade": null, "lastUpdateEt": null, "dateModified": null, "checkTimeEt": null, "death": null, "hospitalized": null, "dateChecked": null, "totalTestsViral": null, "positiveTestsViral": null, "negativeTestsViral": null, "positiveCasesViral": null, "deathConfirmed": null, "deathProbable": null, "totalTestEncountersViral": null, "totalTestsPeopleViral": null, "totalTestsAntibody": null, "positiveTestsAntibody": null, "negativeTestsAntibody": null, "totalTestsPeopleAntibody": null, "positiveTestsPeopleAntibody": null, "negativeTestsPeopleAntibody": null, "totalTestsPeopleAntigen": null, "positiveTestsPeopleAntigen": null, "totalTestsAntigen": null, "positiveTestsAntigen": null, "fips": "35", "positiveIncrease": 0, "negativeIncrease": 9, "total": 57, "totalTestResultsIncrease": 9, "posNeg": 57, "deathIncrease": 0, "hospitalizedIncrease": 0, "hash": "00ac8fd7d1960f73276c4e55bc71ae24538eb4b6", "commercialScore": 0, "negativeRegularScore": 0, "negativeScore": 0, "positiveScore": 0, "score": 0, "grade": "", "month_number_label": "2020-03", "date_label": "2020-03-08", "week_number_label": "2020W10", "week_start_label": "2020-03-02"}, {"date": 20200309, "state": "NM", "positive": 0, "probableCases": null, "negative": 69, "pending": null, "totalTestResultsSource": "posNeg", "totalTestResults": 69, "hospitalizedCurrently": null, "hospitalizedCumulative": null, "inIcuCurrently": null, "inIcuCumulative": null, "onVentilatorCurrently": null, "onVentilatorCumulative": null, "recovered": null, "dataQualityGrade": null, "lastUpdateEt": null, "dateModified": null, "checkTimeEt": null, "death": null, "hospitalized": null, "dateChecked": null, "totalTestsViral": null, "positiveTestsViral": null, "negativeTestsViral": null, "positiveCasesViral": null, "deathConfirmed": null, "deathProbable": null, "totalTestEncountersViral": null, "totalTestsPeopleViral": null, "totalTestsAntibody": null, "positiveTestsAntibody": null, "negativeTestsAntibody": null, "totalTestsPeopleAntibody": null, "positiveTestsPeopleAntibody": null, "negativeTestsPeopleAntibody": null, "totalTestsPeopleAntigen": null, "positiveTestsPeopleAntigen": null, "totalTestsAntigen": null, "positiveTestsAntigen": null, "fips": "35", "positiveIncrease": 0, "negativeIncrease": 12, "total": 69, "totalTestResultsIncrease": 12, "posNeg": 69, "deathIncrease": 0, "hospitalizedIncrease": 0, "hash": "3fcae336fec16c7aacd7c75335cdc11b23749d25", "commercialScore": 0, "negativeRegularScore": 0, "negativeScore": 0, "positiveScore": 0, "score": 0, "grade": "", "month_number_label": "2020-03", "date_label": "2020-03-09", "week_number_label": "2020W11", "week_start_label": "2020-03-09"}, {"date": 20200310, "state": "NM", "positive": 3, "probableCases": null, "negative": 87, "pending": null, "totalTestResultsSource": "posNeg", "totalTestResults": 90, "hospitalizedCurrently": null, "hospitalizedCumulative": null, "inIcuCurrently": null, "inIcuCumulative": null, "onVentilatorCurrently": null, "onVentilatorCumulative": null, "recovered": null, "dataQualityGrade": null, "lastUpdateEt": null, "dateModified": null, "checkTimeEt": null, "death": null, "hospitalized": null, "dateChecked": null, "totalTestsViral": null, "positiveTestsViral": null, "negativeTestsViral": null, "positiveCasesViral": null, "deathConfirmed": null, "deathProbable": null, "totalTestEncountersViral": null, "totalTestsPeopleViral": null, "totalTestsAntibody": null, "positiveTestsAntibody": null, "negativeTestsAntibody": null, "totalTestsPeopleAntibody": null, "positiveTestsPeopleAntibody": null, "negativeTestsPeopleAntibody": null, "totalTestsPeopleAntigen": null, "positiveTestsPeopleAntigen": null, "totalTestsAntigen": null, "positiveTestsAntigen": null, "fips": "35", "positiveIncrease": 3, "negativeIncrease": 18, "total": 90, "totalTestResultsIncrease": 21, "posNeg": 90, "deathIncrease": 0, "hospitalizedIncrease": 0, "hash": "0ad2ebe51aef89fa4fc87298bc4819823cbfc594", "commercialScore": 0, "negativeRegularScore": 0, "negativeScore": 0, "positiveScore": 0, "score": 0, "grade": "", "month_number_label": "2020-03", "date_label": "2020-03-10", "week_number_label": "2020W11", "week_start_label": "2020-03-09"}, {"date": 20200311, "state": "NM", "positive": 5, "probableCases": null, "negative": 155, "pending": null, "totalTestResultsSource": "posNeg", "totalTestResults": 160, "hospitalizedCurrently": null, "hospitalizedCumulative": null, "inIcuCurrently": null, "inIcuCumulative": null, "onVentilatorCurrently": null, "onVentilatorCumulative": null, "recovered": null, "dataQualityGrade": null, "lastUpdateEt": "3/12/2020 00:00", "dateModified": "2020-03-12T00:00:00Z", "checkTimeEt": "03/11 20:00", "death": null, "hospitalized": null, "dateChecked": "2020-03-12T00:00:00Z", "totalTestsViral": null, "positiveTestsViral": null, "negativeTestsViral": null, "positiveCasesViral": null, "deathConfirmed": null, "deathProbable": null, "totalTestEncountersViral": null, "totalTestsPeopleViral": null, "totalTestsAntibody": null, "positiveTestsAntibody": null, "negativeTestsAntibody": null, "totalTestsPeopleAntibody": null, "positiveTestsPeopleAntibody": null, "negativeTestsPeopleAntibody": null, "totalTestsPeopleAntigen": null, "positiveTestsPeopleAntigen": null, "totalTestsAntigen": null, "positiveTestsAntigen": null, "fips": "35", "positiveIncrease": 2, "negativeIncrease": 68, "total": 160, "totalTestResultsIncrease": 70, "posNeg": 160, "deathIncrease": 0, "hospitalizedIncrease": 0, "hash": "32ed76c4c7e62f0b777c509dc076f8951e1b3c41", "commercialScore": 0, "negativeRegularScore": 0, "negativeScore": 0, "positiveScore": 0, "score": 0, "grade": "", "month_number_label": "2020-03", "date_label": "2020-03-11", "week_number_label": "2020W11", "week_start_label": "2020-03-09"}, {"date": 20200312, "state": "NM", "positive": 10, "probableCases": null, "negative": 190, "pending": null, "totalTestResultsSource": "posNeg", "totalTestResults": 200, "hospitalizedCurrently": null, "hospitalizedCumulative": null, "inIcuCurrently": null, "inIcuCumulative": null, "onVentilatorCurrently": null, "onVentilatorCumulative": null, "recovered": null, "dataQualityGrade": null, "lastUpdateEt": "3/12/2020 00:00", "dateModified": "2020-03-12T00:00:00Z", "checkTimeEt": "03/11 20:00", "death": null, "hospitalized": null, "dateChecked": "2020-03-12T00:00:00Z", "totalTestsViral": null, "positiveTestsViral": null, "negativeTestsViral": null, "positiveCasesViral": null, "deathConfirmed": null, "deathProbable": null, "totalTestEncountersViral": null, "totalTestsPeopleViral": null, "totalTestsAntibody": null, "positiveTestsAntibody": null, "negativeTestsAntibody": null, "totalTestsPeopleAntibody": null, "positiveTestsPeopleAntibody": null, "negativeTestsPeopleAntibody": null, "totalTestsPeopleAntigen": null, "positiveTestsPeopleAntigen": null, "totalTestsAntigen": null, "positiveTestsAntigen": null, "fips": "35", "positiveIncrease": 5, "negativeIncrease": 35, "total": 200, "totalTestResultsIncrease": 40, "posNeg": 200, "deathIncrease": 0, "hospitalizedIncrease": 0, "hash": "3e1ebc61a8cd8fde48562c9e5495a73907936de1", "commercialScore": 0, "negativeRegularScore": 0, "negativeScore": 0, "positiveScore": 0, "score": 0, "grade": "", "month_number_label": "2020-03", "date_label": "2020-03-12", "week_number_label": "2020W11", "week_start_label": "2020-03-09"}, {"date": 20200313, "state": "NM", "positive": 10, "probableCases": null, "negative": 237, "pending": null, "totalTestResultsSource": "posNeg", "totalTestResults": 247, "hospitalizedCurrently": null, "hospitalizedCumulative": null, "inIcuCurrently": null, "inIcuCumulative": null, "onVentilatorCurrently": null, "onVentilatorCumulative": null, "recovered": null, "dataQualityGrade": null, "lastUpdateEt": "3/13/2020 00:00", "dateModified": "2020-03-13T00:00:00Z", "checkTimeEt": "03/12 20:00", "death": null, "hospitalized": null, "dateChecked": "2020-03-13T00:00:00Z", "totalTestsViral": null, "positiveTestsViral": null, "negativeTestsViral": null, "positiveCasesViral": null, "deathConfirmed": null, "deathProbable": null, "totalTestEncountersViral": null, "totalTestsPeopleViral": null, "totalTestsAntibody": null, "positiveTestsAntibody": null, "negativeTestsAntibody": null, "totalTestsPeopleAntibody": null, "positiveTestsPeopleAntibody": null, "negativeTestsPeopleAntibody": null, "totalTestsPeopleAntigen": null, "positiveTestsPeopleAntigen": null, "totalTestsAntigen": null, "positiveTestsAntigen": null, "fips": "35", "positiveIncrease": 0, "negativeIncrease": 47, "total": 247, "totalTestResultsIncrease": 47, "posNeg": 247, "deathIncrease": 0, "hospitalizedIncrease": 0, "hash": "0973a2229b53ec0880bf98cc6228664d0c14819a", "commercialScore": 0, "negativeRegularScore": 0, "negativeScore": 0, "positiveScore": 0, "score": 0, "grade": "", "month_number_label": "2020-03", "date_label": "2020-03-13", "week_number_label": "2020W11", "week_start_label": "2020-03-09"}, {"date": 20200314, "state": "NM", "positive": 13, "probableCases": null, "negative": 482, "pending": null, "totalTestResultsSource": "posNeg", "totalTestResults": 495, "hospitalizedCurrently": null, "hospitalizedCumulative": null, "inIcuCurrently": null, "inIcuCumulative": null, "onVentilatorCurrently": null, "onVentilatorCumulative": null, "recovered": null, "dataQualityGrade": null, "lastUpdateEt": "3/13/2020 13:00", "dateModified": "2020-03-13T13:00:00Z", "checkTimeEt": "03/13 09:00", "death": null, "hospitalized": null, "dateChecked": "2020-03-13T13:00:00Z", "totalTestsViral": null, "positiveTestsViral": null, "negativeTestsViral": null, "positiveCasesViral": null, "deathConfirmed": null, "deathProbable": null, "totalTestEncountersViral": null, "totalTestsPeopleViral": null, "totalTestsAntibody": null, "positiveTestsAntibody": null, "negativeTestsAntibody": null, "totalTestsPeopleAntibody": null, "positiveTestsPeopleAntibody": null, "negativeTestsPeopleAntibody": null, "totalTestsPeopleAntigen": null, "positiveTestsPeopleAntigen": null, "totalTestsAntigen": null, "positiveTestsAntigen": null, "fips": "35", "positiveIncrease": 3, "negativeIncrease": 245, "total": 495, "totalTestResultsIncrease": 248, "posNeg": 495, "deathIncrease": 0, "hospitalizedIncrease": 0, "hash": "89d37a0d3597f9532fd571304bc994c691fdf470", "commercialScore": 0, "negativeRegularScore": 0, "negativeScore": 0, "positiveScore": 0, "score": 0, "grade": "", "month_number_label": "2020-03", "date_label": "2020-03-14", "week_number_label": "2020W11", "week_start_label": "2020-03-09"}, {"date": 20200315, "state": "NM", "positive": 17, "probableCases": null, "negative": 566, "pending": null, "totalTestResultsSource": "posNeg", "totalTestResults": 583, "hospitalizedCurrently": null, "hospitalizedCumulative": null, "inIcuCurrently": null, "inIcuCumulative": null, "onVentilatorCurrently": null, "onVentilatorCumulative": null, "recovered": null, "dataQualityGrade": null, "lastUpdateEt": "3/16/2020 15:11", "dateModified": "2020-03-16T15:11:00Z", "checkTimeEt": "03/16 11:11", "death": null, "hospitalized": null, "dateChecked": "2020-03-16T15:11:00Z", "totalTestsViral": null, "positiveTestsViral": null, "negativeTestsViral": null, "positiveCasesViral": null, "deathConfirmed": null, "deathProbable": null, "totalTestEncountersViral": null, "totalTestsPeopleViral": null, "totalTestsAntibody": null, "positiveTestsAntibody": null, "negativeTestsAntibody": null, "totalTestsPeopleAntibody": null, "positiveTestsPeopleAntibody": null, "negativeTestsPeopleAntibody": null, "totalTestsPeopleAntigen": null, "positiveTestsPeopleAntigen": null, "totalTestsAntigen": null, "positiveTestsAntigen": null, "fips": "35", "positiveIncrease": 4, "negativeIncrease": 84, "total": 583, "totalTestResultsIncrease": 88, "posNeg": 583, "deathIncrease": 0, "hospitalizedIncrease": 0, "hash": "14c95e0c693028b81a5665450294df8892ebf3e4", "commercialScore": 0, "negativeRegularScore": 0, "negativeScore": 0, "positiveScore": 0, "score": 0, "grade": "", "month_number_label": "2020-03", "date_label": "2020-03-15", "week_number_label": "2020W11", "week_start_label": "2020-03-09"}, {"date": 20200316, "state": "NM", "positive": 23, "probableCases": null, "negative": 1249, "pending": null, "totalTestResultsSource": "posNeg", "totalTestResults": 1272, "hospitalizedCurrently": null, "hospitalizedCumulative": null, "inIcuCurrently": null, "inIcuCumulative": null, "onVentilatorCurrently": null, "onVentilatorCumulative": null, "recovered": null, "dataQualityGrade": null, "lastUpdateEt": "3/17/2020 00:00", "dateModified": "2020-03-17T00:00:00Z", "checkTimeEt": "03/16 20:00", "death": null, "hospitalized": null, "dateChecked": "2020-03-17T00:00:00Z", "totalTestsViral": null, "positiveTestsViral": null, "negativeTestsViral": null, "positiveCasesViral": null, "deathConfirmed": null, "deathProbable": null, "totalTestEncountersViral": null, "totalTestsPeopleViral": null, "totalTestsAntibody": null, "positiveTestsAntibody": null, "negativeTestsAntibody": null, "totalTestsPeopleAntibody": null, "positiveTestsPeopleAntibody": null, "negativeTestsPeopleAntibody": null, "totalTestsPeopleAntigen": null, "positiveTestsPeopleAntigen": null, "totalTestsAntigen": null, "positiveTestsAntigen": null, "fips": "35", "positiveIncrease": 6, "negativeIncrease": 683, "total": 1272, "totalTestResultsIncrease": 689, "posNeg": 1272, "deathIncrease": 0, "hospitalizedIncrease": 0, "hash": "5f71d346de6428ce59c489f06b6ba2f961c62caf", "commercialScore": 0, "negativeRegularScore": 0, "negativeScore": 0, "positiveScore": 0, "score": 0, "grade": "", "month_number_label": "2020-03", "date_label": "2020-03-16", "week_number_label": "2020W12", "week_start_label": "2020-03-16"}, {"date": 20200317, "state": "NM", "positive": 28, "probableCases": null, "negative": 2326, "pending": null, "totalTestResultsSource": "posNeg", "totalTestResults": 2354, "hospitalizedCurrently": null, "hospitalizedCumulative": null, "inIcuCurrently": null, "inIcuCumulative": null, "onVentilatorCurrently": null, "onVentilatorCumulative": null, "recovered": null, "dataQualityGrade": null, "lastUpdateEt": "3/18/2020 00:00", "dateModified": "2020-03-18T00:00:00Z", "checkTimeEt": "03/17 20:00", "death": null, "hospitalized": null, "dateChecked": "2020-03-18T00:00:00Z", "totalTestsViral": null, "positiveTestsViral": null, "negativeTestsViral": null, "positiveCasesViral": null, "deathConfirmed": null, "deathProbable": null, "totalTestEncountersViral": null, "totalTestsPeopleViral": null, "totalTestsAntibody": null, "positiveTestsAntibody": null, "negativeTestsAntibody": null, "totalTestsPeopleAntibody": null, "positiveTestsPeopleAntibody": null, "negativeTestsPeopleAntibody": null, "totalTestsPeopleAntigen": null, "positiveTestsPeopleAntigen": null, "totalTestsAntigen": null, "positiveTestsAntigen": null, "fips": "35", "positiveIncrease": 5, "negativeIncrease": 1077, "total": 2354, "totalTestResultsIncrease": 1082, "posNeg": 2354, "deathIncrease": 0, "hospitalizedIncrease": 0, "hash": "90d0770fab0637e803d29ff01b579d96ee8628c9", "commercialScore": 0, "negativeRegularScore": 0, "negativeScore": 0, "positiveScore": 0, "score": 0, "grade": "", "month_number_label": "2020-03", "date_label": "2020-03-17", "week_number_label": "2020W12", "week_start_label": "2020-03-16"}, {"date": 20200318, "state": "NM", "positive": 35, "probableCases": null, "negative": 2762, "pending": null, "totalTestResultsSource": "posNeg", "totalTestResults": 2797, "hospitalizedCurrently": null, "hospitalizedCumulative": null, "inIcuCurrently": null, "inIcuCumulative": null, "onVentilatorCurrently": null, "onVentilatorCumulative": null, "recovered": null, "dataQualityGrade": null, "lastUpdateEt": "3/19/2020 00:00", "dateModified": "2020-03-19T00:00:00Z", "checkTimeEt": "03/18 20:00", "death": null, "hospitalized": null, "dateChecked": "2020-03-19T00:00:00Z", "totalTestsViral": null, "positiveTestsViral": null, "negativeTestsViral": null, "positiveCasesViral": null, "deathConfirmed": null, "deathProbable": null, "totalTestEncountersViral": null, "totalTestsPeopleViral": null, "totalTestsAntibody": null, "positiveTestsAntibody": null, "negativeTestsAntibody": null, "totalTestsPeopleAntibody": null, "positiveTestsPeopleAntibody": null, "negativeTestsPeopleAntibody": null, "totalTestsPeopleAntigen": null, "positiveTestsPeopleAntigen": null, "totalTestsAntigen": null, "positiveTestsAntigen": null, "fips": "35", "positiveIncrease": 7, "negativeIncrease": 436, "total": 2797, "totalTestResultsIncrease": 443, "posNeg": 2797, "deathIncrease": 0, "hospitalizedIncrease": 0, "hash": "786851254680b36181f462c86f87c5aaaca03698", "commercialScore": 0, "negativeRegularScore": 0, "negativeScore": 0, "positiveScore": 0, "score": 0, "grade": "", "month_number_label": "2020-03", "date_label": "2020-03-18", "week_number_label": "2020W12", "week_start_label": "2020-03-16"}, {"date": 20200319, "state": "NM", "positive": 43, "probableCases": null, "negative": 3771, "pending": null, "totalTestResultsSource": "posNeg", "totalTestResults": 3814, "hospitalizedCurrently": null, "hospitalizedCumulative": null, "inIcuCurrently": null, "inIcuCumulative": null, "onVentilatorCurrently": null, "onVentilatorCumulative": null, "recovered": null, "dataQualityGrade": null, "lastUpdateEt": "3/20/2020 00:00", "dateModified": "2020-03-20T00:00:00Z", "checkTimeEt": "03/19 20:00", "death": null, "hospitalized": null, "dateChecked": "2020-03-20T00:00:00Z", "totalTestsViral": null, "positiveTestsViral": null, "negativeTestsViral": null, "positiveCasesViral": null, "deathConfirmed": null, "deathProbable": null, "totalTestEncountersViral": null, "totalTestsPeopleViral": null, "totalTestsAntibody": null, "positiveTestsAntibody": null, "negativeTestsAntibody": null, "totalTestsPeopleAntibody": null, "positiveTestsPeopleAntibody": null, "negativeTestsPeopleAntibody": null, "totalTestsPeopleAntigen": null, "positiveTestsPeopleAntigen": null, "totalTestsAntigen": null, "positiveTestsAntigen": null, "fips": "35", "positiveIncrease": 8, "negativeIncrease": 1009, "total": 3814, "totalTestResultsIncrease": 1017, "posNeg": 3814, "deathIncrease": 0, "hospitalizedIncrease": 0, "hash": "cd8a6cbfa22a098915fa7ac927f9f8354c679e51", "commercialScore": 0, "negativeRegularScore": 0, "negativeScore": 0, "positiveScore": 0, "score": 0, "grade": "", "month_number_label": "2020-03", "date_label": "2020-03-19", "week_number_label": "2020W12", "week_start_label": "2020-03-16"}, {"date": 20200320, "state": "NM", "positive": 57, "probableCases": null, "negative": 3771, "pending": null, "totalTestResultsSource": "posNeg", "totalTestResults": 3828, "hospitalizedCurrently": null, "hospitalizedCumulative": null, "inIcuCurrently": null, "inIcuCumulative": null, "onVentilatorCurrently": null, "onVentilatorCumulative": null, "recovered": null, "dataQualityGrade": null, "lastUpdateEt": "3/21/2020 00:00", "dateModified": "2020-03-21T00:00:00Z", "checkTimeEt": "03/20 20:00", "death": null, "hospitalized": null, "dateChecked": "2020-03-21T00:00:00Z", "totalTestsViral": null, "positiveTestsViral": null, "negativeTestsViral": null, "positiveCasesViral": null, "deathConfirmed": null, "deathProbable": null, "totalTestEncountersViral": null, "totalTestsPeopleViral": null, "totalTestsAntibody": null, "positiveTestsAntibody": null, "negativeTestsAntibody": null, "totalTestsPeopleAntibody": null, "positiveTestsPeopleAntibody": null, "negativeTestsPeopleAntibody": null, "totalTestsPeopleAntigen": null, "positiveTestsPeopleAntigen": null, "totalTestsAntigen": null, "positiveTestsAntigen": null, "fips": "35", "positiveIncrease": 14, "negativeIncrease": 0, "total": 3828, "totalTestResultsIncrease": 14, "posNeg": 3828, "deathIncrease": 0, "hospitalizedIncrease": 0, "hash": "e2eb9cb2b493f006227ad7a8e8b0c679a1311ec4", "commercialScore": 0, "negativeRegularScore": 0, "negativeScore": 0, "positiveScore": 0, "score": 0, "grade": "", "month_number_label": "2020-03", "date_label": "2020-03-20", "week_number_label": "2020W12", "week_start_label": "2020-03-16"}, {"date": 20200321, "state": "NM", "positive": 57, "probableCases": null, "negative": 4722, "pending": null, "totalTestResultsSource": "posNeg", "totalTestResults": 4779, "hospitalizedCurrently": null, "hospitalizedCumulative": null, "inIcuCurrently": null, "inIcuCumulative": null, "onVentilatorCurrently": null, "onVentilatorCumulative": null, "recovered": null, "dataQualityGrade": null, "lastUpdateEt": "3/21/2020 00:00", "dateModified": "2020-03-21T00:00:00Z", "checkTimeEt": "03/20 20:00", "death": null, "hospitalized": null, "dateChecked": "2020-03-21T00:00:00Z", "totalTestsViral": null, "positiveTestsViral": null, "negativeTestsViral": null, "positiveCasesViral": null, "deathConfirmed": null, "deathProbable": null, "totalTestEncountersViral": null, "totalTestsPeopleViral": null, "totalTestsAntibody": null, "positiveTestsAntibody": null, "negativeTestsAntibody": null, "totalTestsPeopleAntibody": null, "positiveTestsPeopleAntibody": null, "negativeTestsPeopleAntibody": null, "totalTestsPeopleAntigen": null, "positiveTestsPeopleAntigen": null, "totalTestsAntigen": null, "positiveTestsAntigen": null, "fips": "35", "positiveIncrease": 0, "negativeIncrease": 951, "total": 4779, "totalTestResultsIncrease": 951, "posNeg": 4779, "deathIncrease": 0, "hospitalizedIncrease": 0, "hash": "14aff14824befb1e0c4617f0af94104ea7ddcc43", "commercialScore": 0, "negativeRegularScore": 0, "negativeScore": 0, "positiveScore": 0, "score": 0, "grade": "", "month_number_label": "2020-03", "date_label": "2020-03-21", "week_number_label": "2020W12", "week_start_label": "2020-03-16"}, {"date": 20200322, "state": "NM", "positive": 65, "probableCases": null, "negative": 5321, "pending": null, "totalTestResultsSource": "posNeg", "totalTestResults": 5386, "hospitalizedCurrently": null, "hospitalizedCumulative": null, "inIcuCurrently": null, "inIcuCumulative": null, "onVentilatorCurrently": null, "onVentilatorCumulative": null, "recovered": null, "dataQualityGrade": "A", "lastUpdateEt": "3/22/2020 00:00", "dateModified": "2020-03-22T00:00:00Z", "checkTimeEt": "03/21 20:00", "death": null, "hospitalized": null, "dateChecked": "2020-03-22T00:00:00Z", "totalTestsViral": null, "positiveTestsViral": null, "negativeTestsViral": null, "positiveCasesViral": null, "deathConfirmed": null, "deathProbable": null, "totalTestEncountersViral": null, "totalTestsPeopleViral": null, "totalTestsAntibody": null, "positiveTestsAntibody": null, "negativeTestsAntibody": null, "totalTestsPeopleAntibody": null, "positiveTestsPeopleAntibody": null, "negativeTestsPeopleAntibody": null, "totalTestsPeopleAntigen": null, "positiveTestsPeopleAntigen": null, "totalTestsAntigen": null, "positiveTestsAntigen": null, "fips": "35", "positiveIncrease": 8, "negativeIncrease": 599, "total": 5386, "totalTestResultsIncrease": 607, "posNeg": 5386, "deathIncrease": 0, "hospitalizedIncrease": 0, "hash": "92279ec7c6f4c6a4dcf3da59858b856c6516821c", "commercialScore": 0, "negativeRegularScore": 0, "negativeScore": 0, "positiveScore": 0, "score": 0, "grade": "", "month_number_label": "2020-03", "date_label": "2020-03-22", "week_number_label": "2020W12", "week_start_label": "2020-03-16"}, {"date": 20200323, "state": "NM", "positive": 83, "probableCases": null, "negative": 5890, "pending": null, "totalTestResultsSource": "posNeg", "totalTestResults": 5973, "hospitalizedCurrently": null, "hospitalizedCumulative": null, "inIcuCurrently": null, "inIcuCumulative": null, "onVentilatorCurrently": null, "onVentilatorCumulative": null, "recovered": null, "dataQualityGrade": "A", "lastUpdateEt": "3/23/2020 00:00", "dateModified": "2020-03-23T00:00:00Z", "checkTimeEt": "03/22 20:00", "death": null, "hospitalized": null, "dateChecked": "2020-03-23T00:00:00Z", "totalTestsViral": null, "positiveTestsViral": null, "negativeTestsViral": null, "positiveCasesViral": null, "deathConfirmed": null, "deathProbable": null, "totalTestEncountersViral": null, "totalTestsPeopleViral": null, "totalTestsAntibody": null, "positiveTestsAntibody": null, "negativeTestsAntibody": null, "totalTestsPeopleAntibody": null, "positiveTestsPeopleAntibody": null, "negativeTestsPeopleAntibody": null, "totalTestsPeopleAntigen": null, "positiveTestsPeopleAntigen": null, "totalTestsAntigen": null, "positiveTestsAntigen": null, "fips": "35", "positiveIncrease": 18, "negativeIncrease": 569, "total": 5973, "totalTestResultsIncrease": 587, "posNeg": 5973, "deathIncrease": 0, "hospitalizedIncrease": 0, "hash": "9797a21cf38d536c7be40757a4b1ac4ba9cf1133", "commercialScore": 0, "negativeRegularScore": 0, "negativeScore": 0, "positiveScore": 0, "score": 0, "grade": "", "month_number_label": "2020-03", "date_label": "2020-03-23", "week_number_label": "2020W13", "week_start_label": "2020-03-23"}, {"date": 20200324, "state": "NM", "positive": 100, "probableCases": null, "negative": 6742, "pending": null, "totalTestResultsSource": "posNeg", "totalTestResults": 6842, "hospitalizedCurrently": null, "hospitalizedCumulative": null, "inIcuCurrently": null, "inIcuCumulative": null, "onVentilatorCurrently": null, "onVentilatorCumulative": null, "recovered": null, "dataQualityGrade": "A", "lastUpdateEt": "3/24/2020 00:00", "dateModified": "2020-03-24T00:00:00Z", "checkTimeEt": "03/23 20:00", "death": 1, "hospitalized": null, "dateChecked": "2020-03-24T00:00:00Z", "totalTestsViral": null, "positiveTestsViral": null, "negativeTestsViral": null, "positiveCasesViral": null, "deathConfirmed": null, "deathProbable": null, "totalTestEncountersViral": null, "totalTestsPeopleViral": null, "totalTestsAntibody": null, "positiveTestsAntibody": null, "negativeTestsAntibody": null, "totalTestsPeopleAntibody": null, "positiveTestsPeopleAntibody": null, "negativeTestsPeopleAntibody": null, "totalTestsPeopleAntigen": null, "positiveTestsPeopleAntigen": null, "totalTestsAntigen": null, "positiveTestsAntigen": null, "fips": "35", "positiveIncrease": 17, "negativeIncrease": 852, "total": 6842, "totalTestResultsIncrease": 869, "posNeg": 6842, "deathIncrease": 1, "hospitalizedIncrease": 0, "hash": "31127cf7e297a131a534015e549255584524eb8e", "commercialScore": 0, "negativeRegularScore": 0, "negativeScore": 0, "positiveScore": 0, "score": 0, "grade": "", "month_number_label": "2020-03", "date_label": "2020-03-24", "week_number_label": "2020W13", "week_start_label": "2020-03-23"}, {"date": 20200325, "state": "NM", "positive": 112, "probableCases": null, "negative": 7681, "pending": null, "totalTestResultsSource": "posNeg", "totalTestResults": 7793, "hospitalizedCurrently": null, "hospitalizedCumulative": null, "inIcuCurrently": null, "inIcuCumulative": null, "onVentilatorCurrently": null, "onVentilatorCumulative": null, "recovered": null, "dataQualityGrade": "A", "lastUpdateEt": "3/25/2020 00:00", "dateModified": "2020-03-25T00:00:00Z", "checkTimeEt": "03/24 20:00", "death": 1, "hospitalized": null, "dateChecked": "2020-03-25T00:00:00Z", "totalTestsViral": null, "positiveTestsViral": null, "negativeTestsViral": null, "positiveCasesViral": null, "deathConfirmed": null, "deathProbable": null, "totalTestEncountersViral": null, "totalTestsPeopleViral": null, "totalTestsAntibody": null, "positiveTestsAntibody": null, "negativeTestsAntibody": null, "totalTestsPeopleAntibody": null, "positiveTestsPeopleAntibody": null, "negativeTestsPeopleAntibody": null, "totalTestsPeopleAntigen": null, "positiveTestsPeopleAntigen": null, "totalTestsAntigen": null, "positiveTestsAntigen": null, "fips": "35", "positiveIncrease": 12, "negativeIncrease": 939, "total": 7793, "totalTestResultsIncrease": 951, "posNeg": 7793, "deathIncrease": 0, "hospitalizedIncrease": 0, "hash": "3f2edba50463b7e03d7dcb25879f48e5c154a61f", "commercialScore": 0, "negativeRegularScore": 0, "negativeScore": 0, "positiveScore": 0, "score": 0, "grade": "", "month_number_label": "2020-03", "date_label": "2020-03-25", "week_number_label": "2020W13", "week_start_label": "2020-03-23"}, {"date": 20200326, "state": "NM", "positive": 136, "probableCases": null, "negative": 8377, "pending": null, "totalTestResultsSource": "posNeg", "totalTestResults": 8513, "hospitalizedCurrently": null, "hospitalizedCumulative": null, "inIcuCurrently": null, "inIcuCumulative": null, "onVentilatorCurrently": null, "onVentilatorCumulative": null, "recovered": null, "dataQualityGrade": "A", "lastUpdateEt": "3/26/2020 00:00", "dateModified": "2020-03-26T00:00:00Z", "checkTimeEt": "03/25 20:00", "death": 1, "hospitalized": null, "dateChecked": "2020-03-26T00:00:00Z", "totalTestsViral": null, "positiveTestsViral": null, "negativeTestsViral": null, "positiveCasesViral": null, "deathConfirmed": null, "deathProbable": null, "totalTestEncountersViral": null, "totalTestsPeopleViral": null, "totalTestsAntibody": null, "positiveTestsAntibody": null, "negativeTestsAntibody": null, "totalTestsPeopleAntibody": null, "positiveTestsPeopleAntibody": null, "negativeTestsPeopleAntibody": null, "totalTestsPeopleAntigen": null, "positiveTestsPeopleAntigen": null, "totalTestsAntigen": null, "positiveTestsAntigen": null, "fips": "35", "positiveIncrease": 24, "negativeIncrease": 696, "total": 8513, "totalTestResultsIncrease": 720, "posNeg": 8513, "deathIncrease": 0, "hospitalizedIncrease": 0, "hash": "e3e9d813100a6f896b9ca85f77567d53cbe10f3e", "commercialScore": 0, "negativeRegularScore": 0, "negativeScore": 0, "positiveScore": 0, "score": 0, "grade": "", "month_number_label": "2020-03", "date_label": "2020-03-26", "week_number_label": "2020W13", "week_start_label": "2020-03-23"}, {"date": 20200327, "state": "NM", "positive": 191, "probableCases": null, "negative": 9196, "pending": null, "totalTestResultsSource": "posNeg", "totalTestResults": 9387, "hospitalizedCurrently": 17, "hospitalizedCumulative": null, "inIcuCurrently": null, "inIcuCumulative": null, "onVentilatorCurrently": null, "onVentilatorCumulative": null, "recovered": null, "dataQualityGrade": "A", "lastUpdateEt": "3/27/2020 00:00", "dateModified": "2020-03-27T00:00:00Z", "checkTimeEt": "03/26 20:00", "death": 1, "hospitalized": null, "dateChecked": "2020-03-27T00:00:00Z", "totalTestsViral": null, "positiveTestsViral": null, "negativeTestsViral": null, "positiveCasesViral": null, "deathConfirmed": null, "deathProbable": null, "totalTestEncountersViral": null, "totalTestsPeopleViral": null, "totalTestsAntibody": null, "positiveTestsAntibody": null, "negativeTestsAntibody": null, "totalTestsPeopleAntibody": null, "positiveTestsPeopleAntibody": null, "negativeTestsPeopleAntibody": null, "totalTestsPeopleAntigen": null, "positiveTestsPeopleAntigen": null, "totalTestsAntigen": null, "positiveTestsAntigen": null, "fips": "35", "positiveIncrease": 55, "negativeIncrease": 819, "total": 9387, "totalTestResultsIncrease": 874, "posNeg": 9387, "deathIncrease": 0, "hospitalizedIncrease": 0, "hash": "e29f7e559bc6675411e5ebd3e42ceedd743bb0f7", "commercialScore": 0, "negativeRegularScore": 0, "negativeScore": 0, "positiveScore": 0, "score": 0, "grade": "", "month_number_label": "2020-03", "date_label": "2020-03-27", "week_number_label": "2020W13", "week_start_label": "2020-03-23"}, {"date": 20200328, "state": "NM", "positive": 237, "probableCases": null, "negative": 10769, "pending": null, "totalTestResultsSource": "posNeg", "totalTestResults": 11006, "hospitalizedCurrently": 19, "hospitalizedCumulative": null, "inIcuCurrently": null, "inIcuCumulative": null, "onVentilatorCurrently": null, "onVentilatorCumulative": null, "recovered": 2, "dataQualityGrade": "A", "lastUpdateEt": "3/29/2020 00:00", "dateModified": "2020-03-29T00:00:00Z", "checkTimeEt": "03/28 20:00", "death": 2, "hospitalized": null, "dateChecked": "2020-03-29T00:00:00Z", "totalTestsViral": null, "positiveTestsViral": null, "negativeTestsViral": null, "positiveCasesViral": null, "deathConfirmed": null, "deathProbable": null, "totalTestEncountersViral": null, "totalTestsPeopleViral": null, "totalTestsAntibody": null, "positiveTestsAntibody": null, "negativeTestsAntibody": null, "totalTestsPeopleAntibody": null, "positiveTestsPeopleAntibody": null, "negativeTestsPeopleAntibody": null, "totalTestsPeopleAntigen": null, "positiveTestsPeopleAntigen": null, "totalTestsAntigen": null, "positiveTestsAntigen": null, "fips": "35", "positiveIncrease": 46, "negativeIncrease": 1573, "total": 11006, "totalTestResultsIncrease": 1619, "posNeg": 11006, "deathIncrease": 1, "hospitalizedIncrease": 0, "hash": "085aa3adbf9a4fac4837ebfd82abc8cbd8cf604f", "commercialScore": 0, "negativeRegularScore": 0, "negativeScore": 0, "positiveScore": 0, "score": 0, "grade": "", "month_number_label": "2020-03", "date_label": "2020-03-28", "week_number_label": "2020W13", "week_start_label": "2020-03-23"}, {"date": 20200329, "state": "NM", "positive": 237, "probableCases": null, "negative": 10942, "pending": null, "totalTestResultsSource": "posNeg", "totalTestResults": 11179, "hospitalizedCurrently": 22, "hospitalizedCumulative": null, "inIcuCurrently": null, "inIcuCumulative": null, "onVentilatorCurrently": null, "onVentilatorCumulative": null, "recovered": 26, "dataQualityGrade": "A", "lastUpdateEt": "3/29/2020 00:00", "dateModified": "2020-03-29T00:00:00Z", "checkTimeEt": "03/28 20:00", "death": 2, "hospitalized": null, "dateChecked": "2020-03-29T00:00:00Z", "totalTestsViral": null, "positiveTestsViral": null, "negativeTestsViral": null, "positiveCasesViral": null, "deathConfirmed": null, "deathProbable": null, "totalTestEncountersViral": null, "totalTestsPeopleViral": null, "totalTestsAntibody": null, "positiveTestsAntibody": null, "negativeTestsAntibody": null, "totalTestsPeopleAntibody": null, "positiveTestsPeopleAntibody": null, "negativeTestsPeopleAntibody": null, "totalTestsPeopleAntigen": null, "positiveTestsPeopleAntigen": null, "totalTestsAntigen": null, "positiveTestsAntigen": null, "fips": "35", "positiveIncrease": 0, "negativeIncrease": 173, "total": 11179, "totalTestResultsIncrease": 173, "posNeg": 11179, "deathIncrease": 0, "hospitalizedIncrease": 0, "hash": "4b1c38964355f48f3fc8eb58ebdb7e71826919e7", "commercialScore": 0, "negativeRegularScore": 0, "negativeScore": 0, "positiveScore": 0, "score": 0, "grade": "", "month_number_label": "2020-03", "date_label": "2020-03-29", "week_number_label": "2020W13", "week_start_label": "2020-03-23"}, {"date": 20200330, "state": "NM", "positive": 281, "probableCases": null, "negative": 12246, "pending": null, "totalTestResultsSource": "posNeg", "totalTestResults": 12527, "hospitalizedCurrently": 22, "hospitalizedCumulative": null, "inIcuCurrently": null, "inIcuCumulative": null, "onVentilatorCurrently": null, "onVentilatorCumulative": null, "recovered": 26, "dataQualityGrade": "A", "lastUpdateEt": "3/31/2020 00:00", "dateModified": "2020-03-31T00:00:00Z", "checkTimeEt": "03/30 20:00", "death": 4, "hospitalized": null, "dateChecked": "2020-03-31T00:00:00Z", "totalTestsViral": null, "positiveTestsViral": null, "negativeTestsViral": null, "positiveCasesViral": null, "deathConfirmed": null, "deathProbable": null, "totalTestEncountersViral": null, "totalTestsPeopleViral": null, "totalTestsAntibody": null, "positiveTestsAntibody": null, "negativeTestsAntibody": null, "totalTestsPeopleAntibody": null, "positiveTestsPeopleAntibody": null, "negativeTestsPeopleAntibody": null, "totalTestsPeopleAntigen": null, "positiveTestsPeopleAntigen": null, "totalTestsAntigen": null, "positiveTestsAntigen": null, "fips": "35", "positiveIncrease": 44, "negativeIncrease": 1304, "total": 12527, "totalTestResultsIncrease": 1348, "posNeg": 12527, "deathIncrease": 2, "hospitalizedIncrease": 0, "hash": "ce732a384a818204aa654c0592bd8cc6f2c07b56", "commercialScore": 0, "negativeRegularScore": 0, "negativeScore": 0, "positiveScore": 0, "score": 0, "grade": "", "month_number_label": "2020-03", "date_label": "2020-03-30", "week_number_label": "2020W14", "week_start_label": "2020-03-30"}, {"date": 20200331, "state": "NM", "positive": 315, "probableCases": null, "negative": 12925, "pending": null, "totalTestResultsSource": "posNeg", "totalTestResults": 13240, "hospitalizedCurrently": 24, "hospitalizedCumulative": null, "inIcuCurrently": null, "inIcuCumulative": null, "onVentilatorCurrently": null, "onVentilatorCumulative": null, "recovered": 26, "dataQualityGrade": "A", "lastUpdateEt": "3/31/2020 22:22", "dateModified": "2020-03-31T22:22:00Z", "checkTimeEt": "03/31 18:22", "death": 5, "hospitalized": null, "dateChecked": "2020-03-31T22:22:00Z", "totalTestsViral": null, "positiveTestsViral": null, "negativeTestsViral": null, "positiveCasesViral": null, "deathConfirmed": null, "deathProbable": null, "totalTestEncountersViral": null, "totalTestsPeopleViral": null, "totalTestsAntibody": null, "positiveTestsAntibody": null, "negativeTestsAntibody": null, "totalTestsPeopleAntibody": null, "positiveTestsPeopleAntibody": null, "negativeTestsPeopleAntibody": null, "totalTestsPeopleAntigen": null, "positiveTestsPeopleAntigen": null, "totalTestsAntigen": null, "positiveTestsAntigen": null, "fips": "35", "positiveIncrease": 34, "negativeIncrease": 679, "total": 13240, "totalTestResultsIncrease": 713, "posNeg": 13240, "deathIncrease": 1, "hospitalizedIncrease": 0, "hash": "1f0d30882ecc20f43c63652c04b269258fdddfe1", "commercialScore": 0, "negativeRegularScore": 0, "negativeScore": 0, "positiveScore": 0, "score": 0, "grade": "", "month_number_label": "2020-03", "date_label": "2020-03-31", "week_number_label": "2020W14", "week_start_label": "2020-03-30"}, {"date": 20200401, "state": "NM", "positive": 363, "probableCases": null, "negative": 13648, "pending": null, "totalTestResultsSource": "posNeg", "totalTestResults": 14011, "hospitalizedCurrently": 31, "hospitalizedCumulative": null, "inIcuCurrently": null, "inIcuCumulative": null, "onVentilatorCurrently": null, "onVentilatorCumulative": null, "recovered": 26, "dataQualityGrade": "A", "lastUpdateEt": "4/1/2020 00:00", "dateModified": "2020-04-01T00:00:00Z", "checkTimeEt": "03/31 20:00", "death": 6, "hospitalized": null, "dateChecked": "2020-04-01T00:00:00Z", "totalTestsViral": null, "positiveTestsViral": null, "negativeTestsViral": null, "positiveCasesViral": null, "deathConfirmed": null, "deathProbable": null, "totalTestEncountersViral": null, "totalTestsPeopleViral": null, "totalTestsAntibody": null, "positiveTestsAntibody": null, "negativeTestsAntibody": null, "totalTestsPeopleAntibody": null, "positiveTestsPeopleAntibody": null, "negativeTestsPeopleAntibody": null, "totalTestsPeopleAntigen": null, "positiveTestsPeopleAntigen": null, "totalTestsAntigen": null, "positiveTestsAntigen": null, "fips": "35", "positiveIncrease": 48, "negativeIncrease": 723, "total": 14011, "totalTestResultsIncrease": 771, "posNeg": 14011, "deathIncrease": 1, "hospitalizedIncrease": 0, "hash": "3966a967bfabcf9089f51ab1ad8be08856b9638b", "commercialScore": 0, "negativeRegularScore": 0, "negativeScore": 0, "positiveScore": 0, "score": 0, "grade": "", "month_number_label": "2020-04", "date_label": "2020-04-01", "week_number_label": "2020W14", "week_start_label": "2020-03-30"}, {"date": 20200402, "state": "NM", "positive": 403, "probableCases": null, "negative": 14375, "pending": null, "totalTestResultsSource": "posNeg", "totalTestResults": 14778, "hospitalizedCurrently": 31, "hospitalizedCumulative": null, "inIcuCurrently": null, "inIcuCumulative": null, "onVentilatorCurrently": null, "onVentilatorCumulative": null, "recovered": 26, "dataQualityGrade": "A", "lastUpdateEt": "4/2/2020 00:00", "dateModified": "2020-04-02T00:00:00Z", "checkTimeEt": "04/01 20:00", "death": 7, "hospitalized": null, "dateChecked": "2020-04-02T00:00:00Z", "totalTestsViral": null, "positiveTestsViral": null, "negativeTestsViral": null, "positiveCasesViral": null, "deathConfirmed": null, "deathProbable": null, "totalTestEncountersViral": null, "totalTestsPeopleViral": null, "totalTestsAntibody": null, "positiveTestsAntibody": null, "negativeTestsAntibody": null, "totalTestsPeopleAntibody": null, "positiveTestsPeopleAntibody": null, "negativeTestsPeopleAntibody": null, "totalTestsPeopleAntigen": null, "positiveTestsPeopleAntigen": null, "totalTestsAntigen": null, "positiveTestsAntigen": null, "fips": "35", "positiveIncrease": 40, "negativeIncrease": 727, "total": 14778, "totalTestResultsIncrease": 767, "posNeg": 14778, "deathIncrease": 1, "hospitalizedIncrease": 0, "hash": "c6017b39c336f6cb1df57af6cc7ad495d7d7bd87", "commercialScore": 0, "negativeRegularScore": 0, "negativeScore": 0, "positiveScore": 0, "score": 0, "grade": "", "month_number_label": "2020-04", "date_label": "2020-04-02", "week_number_label": "2020W14", "week_start_label": "2020-03-30"}, {"date": 20200403, "state": "NM", "positive": 495, "probableCases": null, "negative": 15137, "pending": null, "totalTestResultsSource": "posNeg", "totalTestResults": 15632, "hospitalizedCurrently": 41, "hospitalizedCumulative": null, "inIcuCurrently": null, "inIcuCumulative": null, "onVentilatorCurrently": 18, "onVentilatorCumulative": null, "recovered": 26, "dataQualityGrade": "A", "lastUpdateEt": "4/3/2020 00:00", "dateModified": "2020-04-03T00:00:00Z", "checkTimeEt": "04/02 20:00", "death": 10, "hospitalized": null, "dateChecked": "2020-04-03T00:00:00Z", "totalTestsViral": null, "positiveTestsViral": null, "negativeTestsViral": null, "positiveCasesViral": null, "deathConfirmed": null, "deathProbable": null, "totalTestEncountersViral": null, "totalTestsPeopleViral": null, "totalTestsAntibody": null, "positiveTestsAntibody": null, "negativeTestsAntibody": null, "totalTestsPeopleAntibody": null, "positiveTestsPeopleAntibody": null, "negativeTestsPeopleAntibody": null, "totalTestsPeopleAntigen": null, "positiveTestsPeopleAntigen": null, "totalTestsAntigen": null, "positiveTestsAntigen": null, "fips": "35", "positiveIncrease": 92, "negativeIncrease": 762, "total": 15632, "totalTestResultsIncrease": 854, "posNeg": 15632, "deathIncrease": 3, "hospitalizedIncrease": 0, "hash": "5a7c4056ecb58b03893f85ae630755f0137d1456", "commercialScore": 0, "negativeRegularScore": 0, "negativeScore": 0, "positiveScore": 0, "score": 0, "grade": "", "month_number_label": "2020-04", "date_label": "2020-04-03", "week_number_label": "2020W14", "week_start_label": "2020-03-30"}, {"date": 20200404, "state": "NM", "positive": 543, "probableCases": null, "negative": 16285, "pending": null, "totalTestResultsSource": "posNeg", "totalTestResults": 16828, "hospitalizedCurrently": 37, "hospitalizedCumulative": null, "inIcuCurrently": null, "inIcuCumulative": null, "onVentilatorCurrently": 18, "onVentilatorCumulative": null, "recovered": 54, "dataQualityGrade": "A", "lastUpdateEt": "4/4/2020 00:00", "dateModified": "2020-04-04T00:00:00Z", "checkTimeEt": "04/03 20:00", "death": 11, "hospitalized": null, "dateChecked": "2020-04-04T00:00:00Z", "totalTestsViral": null, "positiveTestsViral": null, "negativeTestsViral": null, "positiveCasesViral": null, "deathConfirmed": null, "deathProbable": null, "totalTestEncountersViral": null, "totalTestsPeopleViral": null, "totalTestsAntibody": null, "positiveTestsAntibody": null, "negativeTestsAntibody": null, "totalTestsPeopleAntibody": null, "positiveTestsPeopleAntibody": null, "negativeTestsPeopleAntibody": null, "totalTestsPeopleAntigen": null, "positiveTestsPeopleAntigen": null, "totalTestsAntigen": null, "positiveTestsAntigen": null, "fips": "35", "positiveIncrease": 48, "negativeIncrease": 1148, "total": 16828, "totalTestResultsIncrease": 1196, "posNeg": 16828, "deathIncrease": 1, "hospitalizedIncrease": 0, "hash": "b1630c7ecd04a7f4d77c6279c423cf09567ec551", "commercialScore": 0, "negativeRegularScore": 0, "negativeScore": 0, "positiveScore": 0, "score": 0, "grade": "", "month_number_label": "2020-04", "date_label": "2020-04-04", "week_number_label": "2020W14", "week_start_label": "2020-03-30"}, {"date": 20200405, "state": "NM", "positive": 624, "probableCases": null, "negative": 18512, "pending": null, "totalTestResultsSource": "posNeg", "totalTestResults": 19136, "hospitalizedCurrently": 45, "hospitalizedCumulative": null, "inIcuCurrently": null, "inIcuCumulative": null, "onVentilatorCurrently": 18, "onVentilatorCumulative": null, "recovered": 130, "dataQualityGrade": "A", "lastUpdateEt": "4/6/2020 00:00", "dateModified": "2020-04-06T00:00:00Z", "checkTimeEt": "04/05 20:00", "death": 12, "hospitalized": null, "dateChecked": "2020-04-06T00:00:00Z", "totalTestsViral": null, "positiveTestsViral": null, "negativeTestsViral": null, "positiveCasesViral": null, "deathConfirmed": null, "deathProbable": null, "totalTestEncountersViral": null, "totalTestsPeopleViral": null, "totalTestsAntibody": null, "positiveTestsAntibody": null, "negativeTestsAntibody": null, "totalTestsPeopleAntibody": null, "positiveTestsPeopleAntibody": null, "negativeTestsPeopleAntibody": null, "totalTestsPeopleAntigen": null, "positiveTestsPeopleAntigen": null, "totalTestsAntigen": null, "positiveTestsAntigen": null, "fips": "35", "positiveIncrease": 81, "negativeIncrease": 2227, "total": 19136, "totalTestResultsIncrease": 2308, "posNeg": 19136, "deathIncrease": 1, "hospitalizedIncrease": 0, "hash": "e019e8d400112b26323e209ab7f43dd757a6d5c5", "commercialScore": 0, "negativeRegularScore": 0, "negativeScore": 0, "positiveScore": 0, "score": 0, "grade": "", "month_number_label": "2020-04", "date_label": "2020-04-05", "week_number_label": "2020W14", "week_start_label": "2020-03-30"}, {"date": 20200406, "state": "NM", "positive": 686, "probableCases": null, "negative": 21139, "pending": null, "totalTestResultsSource": "posNeg", "totalTestResults": 21825, "hospitalizedCurrently": 48, "hospitalizedCumulative": null, "inIcuCurrently": null, "inIcuCumulative": null, "onVentilatorCurrently": 18, "onVentilatorCumulative": null, "recovered": 133, "dataQualityGrade": "A", "lastUpdateEt": "4/6/2020 00:00", "dateModified": "2020-04-06T00:00:00Z", "checkTimeEt": "04/05 20:00", "death": 12, "hospitalized": null, "dateChecked": "2020-04-06T00:00:00Z", "totalTestsViral": null, "positiveTestsViral": null, "negativeTestsViral": null, "positiveCasesViral": null, "deathConfirmed": null, "deathProbable": null, "totalTestEncountersViral": null, "totalTestsPeopleViral": null, "totalTestsAntibody": null, "positiveTestsAntibody": null, "negativeTestsAntibody": null, "totalTestsPeopleAntibody": null, "positiveTestsPeopleAntibody": null, "negativeTestsPeopleAntibody": null, "totalTestsPeopleAntigen": null, "positiveTestsPeopleAntigen": null, "totalTestsAntigen": null, "positiveTestsAntigen": null, "fips": "35", "positiveIncrease": 62, "negativeIncrease": 2627, "total": 21825, "totalTestResultsIncrease": 2689, "posNeg": 21825, "deathIncrease": 0, "hospitalizedIncrease": 0, "hash": "1839900423080db3876f667fb48eebb28f981f42", "commercialScore": 0, "negativeRegularScore": 0, "negativeScore": 0, "positiveScore": 0, "score": 0, "grade": "", "month_number_label": "2020-04", "date_label": "2020-04-06", "week_number_label": "2020W15", "week_start_label": "2020-04-06"}, {"date": 20200407, "state": "NM", "positive": 794, "probableCases": null, "negative": 21451, "pending": null, "totalTestResultsSource": "posNeg", "totalTestResults": 22245, "hospitalizedCurrently": 51, "hospitalizedCumulative": null, "inIcuCurrently": null, "inIcuCumulative": null, "onVentilatorCurrently": 18, "onVentilatorCumulative": null, "recovered": 171, "dataQualityGrade": "A", "lastUpdateEt": "4/7/2020 00:00", "dateModified": "2020-04-07T00:00:00Z", "checkTimeEt": "04/06 20:00", "death": 13, "hospitalized": null, "dateChecked": "2020-04-07T00:00:00Z", "totalTestsViral": null, "positiveTestsViral": null, "negativeTestsViral": null, "positiveCasesViral": null, "deathConfirmed": null, "deathProbable": null, "totalTestEncountersViral": null, "totalTestsPeopleViral": null, "totalTestsAntibody": null, "positiveTestsAntibody": null, "negativeTestsAntibody": null, "totalTestsPeopleAntibody": null, "positiveTestsPeopleAntibody": null, "negativeTestsPeopleAntibody": null, "totalTestsPeopleAntigen": null, "positiveTestsPeopleAntigen": null, "totalTestsAntigen": null, "positiveTestsAntigen": null, "fips": "35", "positiveIncrease": 108, "negativeIncrease": 312, "total": 22245, "totalTestResultsIncrease": 420, "posNeg": 22245, "deathIncrease": 1, "hospitalizedIncrease": 0, "hash": "a647da712aac210a187123a1067a9f93b0da12b9", "commercialScore": 0, "negativeRegularScore": 0, "negativeScore": 0, "positiveScore": 0, "score": 0, "grade": "", "month_number_label": "2020-04", "date_label": "2020-04-07", "week_number_label": "2020W15", "week_start_label": "2020-04-06"}, {"date": 20200408, "state": "NM", "positive": 865, "probableCases": null, "negative": 22942, "pending": null, "totalTestResultsSource": "posNeg", "totalTestResults": 23807, "hospitalizedCurrently": 59, "hospitalizedCumulative": null, "inIcuCurrently": null, "inIcuCumulative": null, "onVentilatorCurrently": 18, "onVentilatorCumulative": null, "recovered": 201, "dataQualityGrade": "A", "lastUpdateEt": "4/8/2020 00:00", "dateModified": "2020-04-08T00:00:00Z", "checkTimeEt": "04/07 20:00", "death": 16, "hospitalized": null, "dateChecked": "2020-04-08T00:00:00Z", "totalTestsViral": null, "positiveTestsViral": null, "negativeTestsViral": null, "positiveCasesViral": null, "deathConfirmed": null, "deathProbable": null, "totalTestEncountersViral": null, "totalTestsPeopleViral": null, "totalTestsAntibody": null, "positiveTestsAntibody": null, "negativeTestsAntibody": null, "totalTestsPeopleAntibody": null, "positiveTestsPeopleAntibody": null, "negativeTestsPeopleAntibody": null, "totalTestsPeopleAntigen": null, "positiveTestsPeopleAntigen": null, "totalTestsAntigen": null, "positiveTestsAntigen": null, "fips": "35", "positiveIncrease": 71, "negativeIncrease": 1491, "total": 23807, "totalTestResultsIncrease": 1562, "posNeg": 23807, "deathIncrease": 3, "hospitalizedIncrease": 0, "hash": "00882fb830b4401a21e5518db0ec4d218b92ca5a", "commercialScore": 0, "negativeRegularScore": 0, "negativeScore": 0, "positiveScore": 0, "score": 0, "grade": "", "month_number_label": "2020-04", "date_label": "2020-04-08", "week_number_label": "2020W15", "week_start_label": "2020-04-06"}, {"date": 20200409, "state": "NM", "positive": 1091, "probableCases": null, "negative": 26007, "pending": null, "totalTestResultsSource": "posNeg", "totalTestResults": 27098, "hospitalizedCurrently": 73, "hospitalizedCumulative": null, "inIcuCurrently": null, "inIcuCumulative": null, "onVentilatorCurrently": 18, "onVentilatorCumulative": null, "recovered": 217, "dataQualityGrade": "A", "lastUpdateEt": "4/10/2020 00:00", "dateModified": "2020-04-10T00:00:00Z", "checkTimeEt": "04/09 20:00", "death": 19, "hospitalized": null, "dateChecked": "2020-04-10T00:00:00Z", "totalTestsViral": null, "positiveTestsViral": null, "negativeTestsViral": null, "positiveCasesViral": null, "deathConfirmed": null, "deathProbable": null, "totalTestEncountersViral": null, "totalTestsPeopleViral": null, "totalTestsAntibody": null, "positiveTestsAntibody": null, "negativeTestsAntibody": null, "totalTestsPeopleAntibody": null, "positiveTestsPeopleAntibody": null, "negativeTestsPeopleAntibody": null, "totalTestsPeopleAntigen": null, "positiveTestsPeopleAntigen": null, "totalTestsAntigen": null, "positiveTestsAntigen": null, "fips": "35", "positiveIncrease": 226, "negativeIncrease": 3065, "total": 27098, "totalTestResultsIncrease": 3291, "posNeg": 27098, "deathIncrease": 3, "hospitalizedIncrease": 0, "hash": "50e1270e78396992035012399d416a5edc140442", "commercialScore": 0, "negativeRegularScore": 0, "negativeScore": 0, "positiveScore": 0, "score": 0, "grade": "", "month_number_label": "2020-04", "date_label": "2020-04-09", "week_number_label": "2020W15", "week_start_label": "2020-04-06"}, {"date": 20200410, "state": "NM", "positive": 1091, "probableCases": null, "negative": 26007, "pending": null, "totalTestResultsSource": "posNeg", "totalTestResults": 27098, "hospitalizedCurrently": 75, "hospitalizedCumulative": null, "inIcuCurrently": null, "inIcuCumulative": null, "onVentilatorCurrently": 18, "onVentilatorCumulative": null, "recovered": 235, "dataQualityGrade": "A", "lastUpdateEt": "4/10/2020 00:00", "dateModified": "2020-04-10T00:00:00Z", "checkTimeEt": "04/09 20:00", "death": 19, "hospitalized": null, "dateChecked": "2020-04-10T00:00:00Z", "totalTestsViral": null, "positiveTestsViral": null, "negativeTestsViral": null, "positiveCasesViral": null, "deathConfirmed": null, "deathProbable": null, "totalTestEncountersViral": null, "totalTestsPeopleViral": null, "totalTestsAntibody": null, "positiveTestsAntibody": null, "negativeTestsAntibody": null, "totalTestsPeopleAntibody": null, "positiveTestsPeopleAntibody": null, "negativeTestsPeopleAntibody": null, "totalTestsPeopleAntigen": null, "positiveTestsPeopleAntigen": null, "totalTestsAntigen": null, "positiveTestsAntigen": null, "fips": "35", "positiveIncrease": 0, "negativeIncrease": 0, "total": 27098, "totalTestResultsIncrease": 0, "posNeg": 27098, "deathIncrease": 0, "hospitalizedIncrease": 0, "hash": "b2a4e5366b14cfebed9d8e78843e0f51430e2f44", "commercialScore": 0, "negativeRegularScore": 0, "negativeScore": 0, "positiveScore": 0, "score": 0, "grade": "", "month_number_label": "2020-04", "date_label": "2020-04-10", "week_number_label": "2020W15", "week_start_label": "2020-04-06"}, {"date": 20200411, "state": "NM", "positive": 1174, "probableCases": null, "negative": 27518, "pending": null, "totalTestResultsSource": "posNeg", "totalTestResults": 28692, "hospitalizedCurrently": 78, "hospitalizedCumulative": null, "inIcuCurrently": null, "inIcuCumulative": null, "onVentilatorCurrently": 18, "onVentilatorCumulative": null, "recovered": 235, "dataQualityGrade": "A", "lastUpdateEt": "4/11/2020 00:00", "dateModified": "2020-04-11T00:00:00Z", "checkTimeEt": "04/10 20:00", "death": 20, "hospitalized": null, "dateChecked": "2020-04-11T00:00:00Z", "totalTestsViral": null, "positiveTestsViral": null, "negativeTestsViral": null, "positiveCasesViral": null, "deathConfirmed": null, "deathProbable": null, "totalTestEncountersViral": null, "totalTestsPeopleViral": null, "totalTestsAntibody": null, "positiveTestsAntibody": null, "negativeTestsAntibody": null, "totalTestsPeopleAntibody": null, "positiveTestsPeopleAntibody": null, "negativeTestsPeopleAntibody": null, "totalTestsPeopleAntigen": null, "positiveTestsPeopleAntigen": null, "totalTestsAntigen": null, "positiveTestsAntigen": null, "fips": "35", "positiveIncrease": 83, "negativeIncrease": 1511, "total": 28692, "totalTestResultsIncrease": 1594, "posNeg": 28692, "deathIncrease": 1, "hospitalizedIncrease": 0, "hash": "05251f0138fd207723aaa25b4aa2f7cf7b4170d7", "commercialScore": 0, "negativeRegularScore": 0, "negativeScore": 0, "positiveScore": 0, "score": 0, "grade": "", "month_number_label": "2020-04", "date_label": "2020-04-11", "week_number_label": "2020W15", "week_start_label": "2020-04-06"}, {"date": 20200412, "state": "NM", "positive": 1245, "probableCases": null, "negative": 29270, "pending": null, "totalTestResultsSource": "posNeg", "totalTestResults": 30515, "hospitalizedCurrently": 80, "hospitalizedCumulative": null, "inIcuCurrently": null, "inIcuCumulative": null, "onVentilatorCurrently": null, "onVentilatorCumulative": null, "recovered": 235, "dataQualityGrade": "A", "lastUpdateEt": "4/13/2020 00:00", "dateModified": "2020-04-13T00:00:00Z", "checkTimeEt": "04/12 20:00", "death": 26, "hospitalized": null, "dateChecked": "2020-04-13T00:00:00Z", "totalTestsViral": null, "positiveTestsViral": null, "negativeTestsViral": null, "positiveCasesViral": null, "deathConfirmed": null, "deathProbable": null, "totalTestEncountersViral": null, "totalTestsPeopleViral": null, "totalTestsAntibody": null, "positiveTestsAntibody": null, "negativeTestsAntibody": null, "totalTestsPeopleAntibody": null, "positiveTestsPeopleAntibody": null, "negativeTestsPeopleAntibody": null, "totalTestsPeopleAntigen": null, "positiveTestsPeopleAntigen": null, "totalTestsAntigen": null, "positiveTestsAntigen": null, "fips": "35", "positiveIncrease": 71, "negativeIncrease": 1752, "total": 30515, "totalTestResultsIncrease": 1823, "posNeg": 30515, "deathIncrease": 6, "hospitalizedIncrease": 0, "hash": "833580f3bad5c824f8082722495405a1ba09f193", "commercialScore": 0, "negativeRegularScore": 0, "negativeScore": 0, "positiveScore": 0, "score": 0, "grade": "", "month_number_label": "2020-04", "date_label": "2020-04-12", "week_number_label": "2020W15", "week_start_label": "2020-04-06"}, {"date": 20200413, "state": "NM", "positive": 1345, "probableCases": null, "negative": 30625, "pending": null, "totalTestResultsSource": "posNeg", "totalTestResults": 31970, "hospitalizedCurrently": 87, "hospitalizedCumulative": 181, "inIcuCurrently": null, "inIcuCumulative": null, "onVentilatorCurrently": null, "onVentilatorCumulative": null, "recovered": 304, "dataQualityGrade": "A", "lastUpdateEt": "4/14/2020 20:56", "dateModified": "2020-04-14T20:56:00Z", "checkTimeEt": "04/14 16:56", "death": 31, "hospitalized": 181, "dateChecked": "2020-04-14T20:56:00Z", "totalTestsViral": null, "positiveTestsViral": null, "negativeTestsViral": null, "positiveCasesViral": null, "deathConfirmed": null, "deathProbable": null, "totalTestEncountersViral": null, "totalTestsPeopleViral": null, "totalTestsAntibody": null, "positiveTestsAntibody": null, "negativeTestsAntibody": null, "totalTestsPeopleAntibody": null, "positiveTestsPeopleAntibody": null, "negativeTestsPeopleAntibody": null, "totalTestsPeopleAntigen": null, "positiveTestsPeopleAntigen": null, "totalTestsAntigen": null, "positiveTestsAntigen": null, "fips": "35", "positiveIncrease": 100, "negativeIncrease": 1355, "total": 31970, "totalTestResultsIncrease": 1455, "posNeg": 31970, "deathIncrease": 5, "hospitalizedIncrease": 181, "hash": "4d502dd8f2e0c5fac35bec346e7621cef5f68555", "commercialScore": 0, "negativeRegularScore": 0, "negativeScore": 0, "positiveScore": 0, "score": 0, "grade": "", "month_number_label": "2020-04", "date_label": "2020-04-13", "week_number_label": "2020W16", "week_start_label": "2020-04-13"}, {"date": 20200414, "state": "NM", "positive": 1407, "probableCases": null, "negative": 31443, "pending": null, "totalTestResultsSource": "posNeg", "totalTestResults": 32850, "hospitalizedCurrently": 87, "hospitalizedCumulative": 181, "inIcuCurrently": null, "inIcuCumulative": null, "onVentilatorCurrently": null, "onVentilatorCumulative": null, "recovered": 340, "dataQualityGrade": "A", "lastUpdateEt": "4/14/2020 18:56", "dateModified": "2020-04-14T18:56:00Z", "checkTimeEt": "04/14 14:56", "death": 36, "hospitalized": 181, "dateChecked": "2020-04-14T18:56:00Z", "totalTestsViral": null, "positiveTestsViral": null, "negativeTestsViral": null, "positiveCasesViral": null, "deathConfirmed": null, "deathProbable": null, "totalTestEncountersViral": null, "totalTestsPeopleViral": null, "totalTestsAntibody": null, "positiveTestsAntibody": null, "negativeTestsAntibody": null, "totalTestsPeopleAntibody": null, "positiveTestsPeopleAntibody": null, "negativeTestsPeopleAntibody": null, "totalTestsPeopleAntigen": null, "positiveTestsPeopleAntigen": null, "totalTestsAntigen": null, "positiveTestsAntigen": null, "fips": "35", "positiveIncrease": 62, "negativeIncrease": 818, "total": 32850, "totalTestResultsIncrease": 880, "posNeg": 32850, "deathIncrease": 5, "hospitalizedIncrease": 0, "hash": "5db8f5cba9b9973fbfbcbeccf18868ecabbd5070", "commercialScore": 0, "negativeRegularScore": 0, "negativeScore": 0, "positiveScore": 0, "score": 0, "grade": "", "month_number_label": "2020-04", "date_label": "2020-04-14", "week_number_label": "2020W16", "week_start_label": "2020-04-13"}, {"date": 20200415, "state": "NM", "positive": 1484, "probableCases": null, "negative": 31910, "pending": null, "totalTestResultsSource": "posNeg", "totalTestResults": 33394, "hospitalizedCurrently": 90, "hospitalizedCumulative": 215, "inIcuCurrently": null, "inIcuCumulative": null, "onVentilatorCurrently": null, "onVentilatorCumulative": null, "recovered": 353, "dataQualityGrade": "A", "lastUpdateEt": "4/16/2020 19:09", "dateModified": "2020-04-16T19:09:00Z", "checkTimeEt": "04/16 15:09", "death": 36, "hospitalized": 215, "dateChecked": "2020-04-16T19:09:00Z", "totalTestsViral": null, "positiveTestsViral": null, "negativeTestsViral": null, "positiveCasesViral": null, "deathConfirmed": null, "deathProbable": null, "totalTestEncountersViral": null, "totalTestsPeopleViral": null, "totalTestsAntibody": null, "positiveTestsAntibody": null, "negativeTestsAntibody": null, "totalTestsPeopleAntibody": null, "positiveTestsPeopleAntibody": null, "negativeTestsPeopleAntibody": null, "totalTestsPeopleAntigen": null, "positiveTestsPeopleAntigen": null, "totalTestsAntigen": null, "positiveTestsAntigen": null, "fips": "35", "positiveIncrease": 77, "negativeIncrease": 467, "total": 33394, "totalTestResultsIncrease": 544, "posNeg": 33394, "deathIncrease": 0, "hospitalizedIncrease": 34, "hash": "c25fdf5bff0c673a8e4eca66c55d90a022c3287d", "commercialScore": 0, "negativeRegularScore": 0, "negativeScore": 0, "positiveScore": 0, "score": 0, "grade": "", "month_number_label": "2020-04", "date_label": "2020-04-15", "week_number_label": "2020W16", "week_start_label": "2020-04-13"}, {"date": 20200416, "state": "NM", "positive": 1597, "probableCases": null, "negative": 32891, "pending": null, "totalTestResultsSource": "posNeg", "totalTestResults": 34488, "hospitalizedCurrently": 90, "hospitalizedCumulative": 230, "inIcuCurrently": null, "inIcuCumulative": null, "onVentilatorCurrently": null, "onVentilatorCumulative": null, "recovered": 353, "dataQualityGrade": "A", "lastUpdateEt": "4/17/2020 20:53", "dateModified": "2020-04-17T20:53:00Z", "checkTimeEt": "04/17 16:53", "death": 44, "hospitalized": 230, "dateChecked": "2020-04-17T20:53:00Z", "totalTestsViral": null, "positiveTestsViral": null, "negativeTestsViral": null, "positiveCasesViral": null, "deathConfirmed": null, "deathProbable": null, "totalTestEncountersViral": null, "totalTestsPeopleViral": null, "totalTestsAntibody": null, "positiveTestsAntibody": null, "negativeTestsAntibody": null, "totalTestsPeopleAntibody": null, "positiveTestsPeopleAntibody": null, "negativeTestsPeopleAntibody": null, "totalTestsPeopleAntigen": null, "positiveTestsPeopleAntigen": null, "totalTestsAntigen": null, "positiveTestsAntigen": null, "fips": "35", "positiveIncrease": 113, "negativeIncrease": 981, "total": 34488, "totalTestResultsIncrease": 1094, "posNeg": 34488, "deathIncrease": 8, "hospitalizedIncrease": 15, "hash": "01e9ceaf7a9e4c45c6229ebd307d1ed75ebfa656", "commercialScore": 0, "negativeRegularScore": 0, "negativeScore": 0, "positiveScore": 0, "score": 0, "grade": "", "month_number_label": "2020-04", "date_label": "2020-04-16", "week_number_label": "2020W16", "week_start_label": "2020-04-13"}, {"date": 20200417, "state": "NM", "positive": 1711, "probableCases": null, "negative": 33902, "pending": null, "totalTestResultsSource": "posNeg", "totalTestResults": 35613, "hospitalizedCurrently": 96, "hospitalizedCumulative": 242, "inIcuCurrently": null, "inIcuCumulative": null, "onVentilatorCurrently": null, "onVentilatorCumulative": null, "recovered": 382, "dataQualityGrade": "A", "lastUpdateEt": "4/17/2020 21:53", "dateModified": "2020-04-17T21:53:00Z", "checkTimeEt": "04/17 17:53", "death": 51, "hospitalized": 242, "dateChecked": "2020-04-17T21:53:00Z", "totalTestsViral": null, "positiveTestsViral": null, "negativeTestsViral": null, "positiveCasesViral": null, "deathConfirmed": null, "deathProbable": null, "totalTestEncountersViral": null, "totalTestsPeopleViral": null, "totalTestsAntibody": null, "positiveTestsAntibody": null, "negativeTestsAntibody": null, "totalTestsPeopleAntibody": null, "positiveTestsPeopleAntibody": null, "negativeTestsPeopleAntibody": null, "totalTestsPeopleAntigen": null, "positiveTestsPeopleAntigen": null, "totalTestsAntigen": null, "positiveTestsAntigen": null, "fips": "35", "positiveIncrease": 114, "negativeIncrease": 1011, "total": 35613, "totalTestResultsIncrease": 1125, "posNeg": 35613, "deathIncrease": 7, "hospitalizedIncrease": 12, "hash": "caff823bac6e0590d1f4883192b7e7e8d5af91c4", "commercialScore": 0, "negativeRegularScore": 0, "negativeScore": 0, "positiveScore": 0, "score": 0, "grade": "", "month_number_label": "2020-04", "date_label": "2020-04-17", "week_number_label": "2020W16", "week_start_label": "2020-04-13"}, {"date": 20200418, "state": "NM", "positive": 1798, "probableCases": null, "negative": 34834, "pending": null, "totalTestResultsSource": "posNeg", "totalTestResults": 36632, "hospitalizedCurrently": 92, "hospitalizedCumulative": 258, "inIcuCurrently": null, "inIcuCumulative": null, "onVentilatorCurrently": null, "onVentilatorCumulative": null, "recovered": 465, "dataQualityGrade": "A", "lastUpdateEt": "4/19/2020 19:46", "dateModified": "2020-04-19T19:46:00Z", "checkTimeEt": "04/19 15:46", "death": 53, "hospitalized": 258, "dateChecked": "2020-04-19T19:46:00Z", "totalTestsViral": null, "positiveTestsViral": null, "negativeTestsViral": null, "positiveCasesViral": null, "deathConfirmed": null, "deathProbable": null, "totalTestEncountersViral": null, "totalTestsPeopleViral": null, "totalTestsAntibody": null, "positiveTestsAntibody": null, "negativeTestsAntibody": null, "totalTestsPeopleAntibody": null, "positiveTestsPeopleAntibody": null, "negativeTestsPeopleAntibody": null, "totalTestsPeopleAntigen": null, "positiveTestsPeopleAntigen": null, "totalTestsAntigen": null, "positiveTestsAntigen": null, "fips": "35", "positiveIncrease": 87, "negativeIncrease": 932, "total": 36632, "totalTestResultsIncrease": 1019, "posNeg": 36632, "deathIncrease": 2, "hospitalizedIncrease": 16, "hash": "4f6797965b9a1e44e1a6b977cc6a1a4527ed54c2", "commercialScore": 0, "negativeRegularScore": 0, "negativeScore": 0, "positiveScore": 0, "score": 0, "grade": "", "month_number_label": "2020-04", "date_label": "2020-04-18", "week_number_label": "2020W16", "week_start_label": "2020-04-13"}, {"date": 20200419, "state": "NM", "positive": 1845, "probableCases": null, "negative": 35197, "pending": null, "totalTestResultsSource": "posNeg", "totalTestResults": 37042, "hospitalizedCurrently": 103, "hospitalizedCumulative": 274, "inIcuCurrently": null, "inIcuCumulative": null, "onVentilatorCurrently": null, "onVentilatorCumulative": null, "recovered": 487, "dataQualityGrade": "A", "lastUpdateEt": "4/19/2020 18:46", "dateModified": "2020-04-19T18:46:00Z", "checkTimeEt": "04/19 14:46", "death": 55, "hospitalized": 274, "dateChecked": "2020-04-19T18:46:00Z", "totalTestsViral": null, "positiveTestsViral": null, "negativeTestsViral": null, "positiveCasesViral": null, "deathConfirmed": null, "deathProbable": null, "totalTestEncountersViral": null, "totalTestsPeopleViral": null, "totalTestsAntibody": null, "positiveTestsAntibody": null, "negativeTestsAntibody": null, "totalTestsPeopleAntibody": null, "positiveTestsPeopleAntibody": null, "negativeTestsPeopleAntibody": null, "totalTestsPeopleAntigen": null, "positiveTestsPeopleAntigen": null, "totalTestsAntigen": null, "positiveTestsAntigen": null, "fips": "35", "positiveIncrease": 47, "negativeIncrease": 363, "total": 37042, "totalTestResultsIncrease": 410, "posNeg": 37042, "deathIncrease": 2, "hospitalizedIncrease": 16, "hash": "3b8564012f3f43bca362c17d3c8b7cdbd1055615", "commercialScore": 0, "negativeRegularScore": 0, "negativeScore": 0, "positiveScore": 0, "score": 0, "grade": "", "month_number_label": "2020-04", "date_label": "2020-04-19", "week_number_label": "2020W16", "week_start_label": "2020-04-13"}, {"date": 20200420, "state": "NM", "positive": 1971, "probableCases": null, "negative": 36784, "pending": null, "totalTestResultsSource": "posNeg", "totalTestResults": 38755, "hospitalizedCurrently": 116, "hospitalizedCumulative": 291, "inIcuCurrently": null, "inIcuCumulative": null, "onVentilatorCurrently": null, "onVentilatorCumulative": null, "recovered": 501, "dataQualityGrade": "A", "lastUpdateEt": "4/21/2020 10:22", "dateModified": "2020-04-21T10:22:00Z", "checkTimeEt": "04/21 06:22", "death": 58, "hospitalized": 291, "dateChecked": "2020-04-21T10:22:00Z", "totalTestsViral": null, "positiveTestsViral": null, "negativeTestsViral": null, "positiveCasesViral": null, "deathConfirmed": null, "deathProbable": null, "totalTestEncountersViral": null, "totalTestsPeopleViral": null, "totalTestsAntibody": null, "positiveTestsAntibody": null, "negativeTestsAntibody": null, "totalTestsPeopleAntibody": null, "positiveTestsPeopleAntibody": null, "negativeTestsPeopleAntibody": null, "totalTestsPeopleAntigen": null, "positiveTestsPeopleAntigen": null, "totalTestsAntigen": null, "positiveTestsAntigen": null, "fips": "35", "positiveIncrease": 126, "negativeIncrease": 1587, "total": 38755, "totalTestResultsIncrease": 1713, "posNeg": 38755, "deathIncrease": 3, "hospitalizedIncrease": 17, "hash": "4fec01f29a379d80d5fd99585b45cfadef1a6594", "commercialScore": 0, "negativeRegularScore": 0, "negativeScore": 0, "positiveScore": 0, "score": 0, "grade": "", "month_number_label": "2020-04", "date_label": "2020-04-20", "week_number_label": "2020W17", "week_start_label": "2020-04-20"}, {"date": 20200421, "state": "NM", "positive": 2072, "probableCases": null, "negative": 38805, "pending": null, "totalTestResultsSource": "posNeg", "totalTestResults": 40877, "hospitalizedCurrently": 119, "hospitalizedCumulative": 306, "inIcuCurrently": null, "inIcuCumulative": null, "onVentilatorCurrently": null, "onVentilatorCumulative": null, "recovered": 529, "dataQualityGrade": "A", "lastUpdateEt": "4/22/2020 19:11", "dateModified": "2020-04-22T19:11:00Z", "checkTimeEt": "04/22 15:11", "death": 65, "hospitalized": 306, "dateChecked": "2020-04-22T19:11:00Z", "totalTestsViral": null, "positiveTestsViral": null, "negativeTestsViral": null, "positiveCasesViral": null, "deathConfirmed": null, "deathProbable": null, "totalTestEncountersViral": null, "totalTestsPeopleViral": null, "totalTestsAntibody": null, "positiveTestsAntibody": null, "negativeTestsAntibody": null, "totalTestsPeopleAntibody": null, "positiveTestsPeopleAntibody": null, "negativeTestsPeopleAntibody": null, "totalTestsPeopleAntigen": null, "positiveTestsPeopleAntigen": null, "totalTestsAntigen": null, "positiveTestsAntigen": null, "fips": "35", "positiveIncrease": 101, "negativeIncrease": 2021, "total": 40877, "totalTestResultsIncrease": 2122, "posNeg": 40877, "deathIncrease": 7, "hospitalizedIncrease": 15, "hash": "3c0bfcf17aa90214dce18c01709900f798f16dc2", "commercialScore": 0, "negativeRegularScore": 0, "negativeScore": 0, "positiveScore": 0, "score": 0, "grade": "", "month_number_label": "2020-04", "date_label": "2020-04-21", "week_number_label": "2020W17", "week_start_label": "2020-04-20"}, {"date": 20200422, "state": "NM", "positive": 2210, "probableCases": null, "negative": 39022, "pending": null, "totalTestResultsSource": "posNeg", "totalTestResults": 41232, "hospitalizedCurrently": 121, "hospitalizedCumulative": 331, "inIcuCurrently": null, "inIcuCumulative": null, "onVentilatorCurrently": null, "onVentilatorCumulative": null, "recovered": 547, "dataQualityGrade": "A", "lastUpdateEt": "4/23/2020 09:11", "dateModified": "2020-04-23T09:11:00Z", "checkTimeEt": "04/23 05:11", "death": 71, "hospitalized": 331, "dateChecked": "2020-04-23T09:11:00Z", "totalTestsViral": null, "positiveTestsViral": null, "negativeTestsViral": null, "positiveCasesViral": null, "deathConfirmed": null, "deathProbable": null, "totalTestEncountersViral": null, "totalTestsPeopleViral": null, "totalTestsAntibody": null, "positiveTestsAntibody": null, "negativeTestsAntibody": null, "totalTestsPeopleAntibody": null, "positiveTestsPeopleAntibody": null, "negativeTestsPeopleAntibody": null, "totalTestsPeopleAntigen": null, "positiveTestsPeopleAntigen": null, "totalTestsAntigen": null, "positiveTestsAntigen": null, "fips": "35", "positiveIncrease": 138, "negativeIncrease": 217, "total": 41232, "totalTestResultsIncrease": 355, "posNeg": 41232, "deathIncrease": 6, "hospitalizedIncrease": 25, "hash": "e2f47dbf847a6561916cdbda8eed0a1d9317a599", "commercialScore": 0, "negativeRegularScore": 0, "negativeScore": 0, "positiveScore": 0, "score": 0, "grade": "", "month_number_label": "2020-04", "date_label": "2020-04-22", "week_number_label": "2020W17", "week_start_label": "2020-04-20"}, {"date": 20200423, "state": "NM", "positive": 2379, "probableCases": null, "negative": 44184, "pending": null, "totalTestResultsSource": "posNeg", "totalTestResults": 46563, "hospitalizedCurrently": 123, "hospitalizedCumulative": 367, "inIcuCurrently": null, "inIcuCumulative": null, "onVentilatorCurrently": null, "onVentilatorCumulative": null, "recovered": 573, "dataQualityGrade": "A", "lastUpdateEt": "4/24/2020 20:17", "dateModified": "2020-04-24T20:17:00Z", "checkTimeEt": "04/24 16:17", "death": 78, "hospitalized": 367, "dateChecked": "2020-04-24T20:17:00Z", "totalTestsViral": null, "positiveTestsViral": null, "negativeTestsViral": null, "positiveCasesViral": null, "deathConfirmed": null, "deathProbable": null, "totalTestEncountersViral": null, "totalTestsPeopleViral": null, "totalTestsAntibody": null, "positiveTestsAntibody": null, "negativeTestsAntibody": null, "totalTestsPeopleAntibody": null, "positiveTestsPeopleAntibody": null, "negativeTestsPeopleAntibody": null, "totalTestsPeopleAntigen": null, "positiveTestsPeopleAntigen": null, "totalTestsAntigen": null, "positiveTestsAntigen": null, "fips": "35", "positiveIncrease": 169, "negativeIncrease": 5162, "total": 46563, "totalTestResultsIncrease": 5331, "posNeg": 46563, "deathIncrease": 7, "hospitalizedIncrease": 36, "hash": "6ab47d8cd2cecce093ee07683be524f452c46ac9", "commercialScore": 0, "negativeRegularScore": 0, "negativeScore": 0, "positiveScore": 0, "score": 0, "grade": "", "month_number_label": "2020-04", "date_label": "2020-04-23", "week_number_label": "2020W17", "week_start_label": "2020-04-20"}, {"date": 20200424, "state": "NM", "positive": 2521, "probableCases": null, "negative": 48989, "pending": null, "totalTestResultsSource": "posNeg", "totalTestResults": 51510, "hospitalizedCurrently": 152, "hospitalizedCumulative": 412, "inIcuCurrently": null, "inIcuCumulative": null, "onVentilatorCurrently": null, "onVentilatorCumulative": null, "recovered": 614, "dataQualityGrade": "C", "lastUpdateEt": "4/25/2020 13:59", "dateModified": "2020-04-25T13:59:00Z", "checkTimeEt": "04/25 09:59", "death": 84, "hospitalized": 412, "dateChecked": "2020-04-25T13:59:00Z", "totalTestsViral": null, "positiveTestsViral": null, "negativeTestsViral": null, "positiveCasesViral": null, "deathConfirmed": null, "deathProbable": null, "totalTestEncountersViral": null, "totalTestsPeopleViral": null, "totalTestsAntibody": null, "positiveTestsAntibody": null, "negativeTestsAntibody": null, "totalTestsPeopleAntibody": null, "positiveTestsPeopleAntibody": null, "negativeTestsPeopleAntibody": null, "totalTestsPeopleAntigen": null, "positiveTestsPeopleAntigen": null, "totalTestsAntigen": null, "positiveTestsAntigen": null, "fips": "35", "positiveIncrease": 142, "negativeIncrease": 4805, "total": 51510, "totalTestResultsIncrease": 4947, "posNeg": 51510, "deathIncrease": 6, "hospitalizedIncrease": 45, "hash": "fe636b519a82f364f443750e4897d06fd3ccaec0", "commercialScore": 0, "negativeRegularScore": 0, "negativeScore": 0, "positiveScore": 0, "score": 0, "grade": "", "month_number_label": "2020-04", "date_label": "2020-04-24", "week_number_label": "2020W17", "week_start_label": "2020-04-20"}, {"date": 20200425, "state": "NM", "positive": 2660, "probableCases": null, "negative": 51075, "pending": null, "totalTestResultsSource": "posNeg", "totalTestResults": 53735, "hospitalizedCurrently": 152, "hospitalizedCumulative": 412, "inIcuCurrently": null, "inIcuCumulative": null, "onVentilatorCurrently": null, "onVentilatorCumulative": null, "recovered": 614, "dataQualityGrade": "C", "lastUpdateEt": "4/25/2020 20:24", "dateModified": "2020-04-25T20:24:00Z", "checkTimeEt": "04/25 16:24", "death": 93, "hospitalized": 412, "dateChecked": "2020-04-25T20:24:00Z", "totalTestsViral": null, "positiveTestsViral": null, "negativeTestsViral": null, "positiveCasesViral": null, "deathConfirmed": null, "deathProbable": null, "totalTestEncountersViral": null, "totalTestsPeopleViral": null, "totalTestsAntibody": null, "positiveTestsAntibody": null, "negativeTestsAntibody": null, "totalTestsPeopleAntibody": null, "positiveTestsPeopleAntibody": null, "negativeTestsPeopleAntibody": null, "totalTestsPeopleAntigen": null, "positiveTestsPeopleAntigen": null, "totalTestsAntigen": null, "positiveTestsAntigen": null, "fips": "35", "positiveIncrease": 139, "negativeIncrease": 2086, "total": 53735, "totalTestResultsIncrease": 2225, "posNeg": 53735, "deathIncrease": 9, "hospitalizedIncrease": 0, "hash": "1644d0c7a15fdd5d6d5d073bd725d5eef46b28e4", "commercialScore": 0, "negativeRegularScore": 0, "negativeScore": 0, "positiveScore": 0, "score": 0, "grade": "", "month_number_label": "2020-04", "date_label": "2020-04-25", "week_number_label": "2020W17", "week_start_label": "2020-04-20"}, {"date": 20200426, "state": "NM", "positive": 2726, "probableCases": null, "negative": 53889, "pending": null, "totalTestResultsSource": "posNeg", "totalTestResults": 56615, "hospitalizedCurrently": 148, "hospitalizedCumulative": 412, "inIcuCurrently": null, "inIcuCumulative": null, "onVentilatorCurrently": null, "onVentilatorCumulative": null, "recovered": 650, "dataQualityGrade": "C", "lastUpdateEt": "4/26/2020 18:01", "dateModified": "2020-04-26T18:01:00Z", "checkTimeEt": "04/26 14:01", "death": 99, "hospitalized": 412, "dateChecked": "2020-04-26T18:01:00Z", "totalTestsViral": null, "positiveTestsViral": null, "negativeTestsViral": null, "positiveCasesViral": null, "deathConfirmed": null, "deathProbable": null, "totalTestEncountersViral": null, "totalTestsPeopleViral": null, "totalTestsAntibody": null, "positiveTestsAntibody": null, "negativeTestsAntibody": null, "totalTestsPeopleAntibody": null, "positiveTestsPeopleAntibody": null, "negativeTestsPeopleAntibody": null, "totalTestsPeopleAntigen": null, "positiveTestsPeopleAntigen": null, "totalTestsAntigen": null, "positiveTestsAntigen": null, "fips": "35", "positiveIncrease": 66, "negativeIncrease": 2814, "total": 56615, "totalTestResultsIncrease": 2880, "posNeg": 56615, "deathIncrease": 6, "hospitalizedIncrease": 0, "hash": "305a0a7c28ee8228fdf3c6ffa7ae8c8396acd973", "commercialScore": 0, "negativeRegularScore": 0, "negativeScore": 0, "positiveScore": 0, "score": 0, "grade": "", "month_number_label": "2020-04", "date_label": "2020-04-26", "week_number_label": "2020W17", "week_start_label": "2020-04-20"}, {"date": 20200427, "state": "NM", "positive": 2823, "probableCases": null, "negative": 55980, "pending": null, "totalTestResultsSource": "posNeg", "totalTestResults": 58803, "hospitalizedCurrently": 155, "hospitalizedCumulative": 481, "inIcuCurrently": null, "inIcuCumulative": null, "onVentilatorCurrently": null, "onVentilatorCumulative": null, "recovered": 666, "dataQualityGrade": "C", "lastUpdateEt": "4/27/2020 18:04", "dateModified": "2020-04-27T18:04:00Z", "checkTimeEt": "04/27 14:04", "death": 104, "hospitalized": 481, "dateChecked": "2020-04-27T18:04:00Z", "totalTestsViral": null, "positiveTestsViral": null, "negativeTestsViral": null, "positiveCasesViral": null, "deathConfirmed": null, "deathProbable": null, "totalTestEncountersViral": null, "totalTestsPeopleViral": null, "totalTestsAntibody": null, "positiveTestsAntibody": null, "negativeTestsAntibody": null, "totalTestsPeopleAntibody": null, "positiveTestsPeopleAntibody": null, "negativeTestsPeopleAntibody": null, "totalTestsPeopleAntigen": null, "positiveTestsPeopleAntigen": null, "totalTestsAntigen": null, "positiveTestsAntigen": null, "fips": "35", "positiveIncrease": 97, "negativeIncrease": 2091, "total": 58803, "totalTestResultsIncrease": 2188, "posNeg": 58803, "deathIncrease": 5, "hospitalizedIncrease": 69, "hash": "62c17d8600c8e5239c1b57d8a560957157bc60ef", "commercialScore": 0, "negativeRegularScore": 0, "negativeScore": 0, "positiveScore": 0, "score": 0, "grade": "", "month_number_label": "2020-04", "date_label": "2020-04-27", "week_number_label": "2020W18", "week_start_label": "2020-04-27"}, {"date": 20200428, "state": "NM", "positive": 2974, "probableCases": null, "negative": 58771, "pending": null, "totalTestResultsSource": "posNeg", "totalTestResults": 61745, "hospitalizedCurrently": 157, "hospitalizedCumulative": 509, "inIcuCurrently": null, "inIcuCumulative": null, "onVentilatorCurrently": null, "onVentilatorCumulative": null, "recovered": 705, "dataQualityGrade": "C", "lastUpdateEt": "4/28/2020 18:00", "dateModified": "2020-04-28T18:00:00Z", "checkTimeEt": "04/28 14:00", "death": 110, "hospitalized": 509, "dateChecked": "2020-04-28T18:00:00Z", "totalTestsViral": null, "positiveTestsViral": null, "negativeTestsViral": null, "positiveCasesViral": 2974, "deathConfirmed": null, "deathProbable": null, "totalTestEncountersViral": null, "totalTestsPeopleViral": null, "totalTestsAntibody": null, "positiveTestsAntibody": null, "negativeTestsAntibody": null, "totalTestsPeopleAntibody": null, "positiveTestsPeopleAntibody": null, "negativeTestsPeopleAntibody": null, "totalTestsPeopleAntigen": null, "positiveTestsPeopleAntigen": null, "totalTestsAntigen": null, "positiveTestsAntigen": null, "fips": "35", "positiveIncrease": 151, "negativeIncrease": 2791, "total": 61745, "totalTestResultsIncrease": 2942, "posNeg": 61745, "deathIncrease": 6, "hospitalizedIncrease": 28, "hash": "9af848ad842bd5e82662be2a12f1a238dd9b3eb3", "commercialScore": 0, "negativeRegularScore": 0, "negativeScore": 0, "positiveScore": 0, "score": 0, "grade": "", "month_number_label": "2020-04", "date_label": "2020-04-28", "week_number_label": "2020W18", "week_start_label": "2020-04-27"}, {"date": 20200429, "state": "NM", "positive": 3213, "probableCases": null, "negative": 61872, "pending": null, "totalTestResultsSource": "posNeg", "totalTestResults": 65085, "hospitalizedCurrently": 163, "hospitalizedCumulative": 536, "inIcuCurrently": null, "inIcuCumulative": null, "onVentilatorCurrently": null, "onVentilatorCumulative": null, "recovered": 734, "dataQualityGrade": "C", "lastUpdateEt": "4/29/2020 20:02", "dateModified": "2020-04-29T20:02:00Z", "checkTimeEt": "04/29 16:02", "death": 112, "hospitalized": 536, "dateChecked": "2020-04-29T20:02:00Z", "totalTestsViral": null, "positiveTestsViral": null, "negativeTestsViral": null, "positiveCasesViral": 3213, "deathConfirmed": null, "deathProbable": null, "totalTestEncountersViral": null, "totalTestsPeopleViral": null, "totalTestsAntibody": null, "positiveTestsAntibody": null, "negativeTestsAntibody": null, "totalTestsPeopleAntibody": null, "positiveTestsPeopleAntibody": null, "negativeTestsPeopleAntibody": null, "totalTestsPeopleAntigen": null, "positiveTestsPeopleAntigen": null, "totalTestsAntigen": null, "positiveTestsAntigen": null, "fips": "35", "positiveIncrease": 239, "negativeIncrease": 3101, "total": 65085, "totalTestResultsIncrease": 3340, "posNeg": 65085, "deathIncrease": 2, "hospitalizedIncrease": 27, "hash": "1453e3d06cdbd545d31d7c4503b9828b3705c56c", "commercialScore": 0, "negativeRegularScore": 0, "negativeScore": 0, "positiveScore": 0, "score": 0, "grade": "", "month_number_label": "2020-04", "date_label": "2020-04-29", "week_number_label": "2020W18", "week_start_label": "2020-04-27"}, {"date": 20200430, "state": "NM", "positive": 3411, "probableCases": null, "negative": 64458, "pending": null, "totalTestResultsSource": "posNeg", "totalTestResults": 67869, "hospitalizedCurrently": 172, "hospitalizedCumulative": 536, "inIcuCurrently": null, "inIcuCumulative": null, "onVentilatorCurrently": null, "onVentilatorCumulative": null, "recovered": 760, "dataQualityGrade": "C", "lastUpdateEt": "5/1/2020 10:55", "dateModified": "2020-05-01T10:55:00Z", "checkTimeEt": "05/01 06:55", "death": 123, "hospitalized": 536, "dateChecked": "2020-05-01T10:55:00Z", "totalTestsViral": null, "positiveTestsViral": null, "negativeTestsViral": null, "positiveCasesViral": 3411, "deathConfirmed": null, "deathProbable": null, "totalTestEncountersViral": null, "totalTestsPeopleViral": null, "totalTestsAntibody": null, "positiveTestsAntibody": null, "negativeTestsAntibody": null, "totalTestsPeopleAntibody": null, "positiveTestsPeopleAntibody": null, "negativeTestsPeopleAntibody": null, "totalTestsPeopleAntigen": null, "positiveTestsPeopleAntigen": null, "totalTestsAntigen": null, "positiveTestsAntigen": null, "fips": "35", "positiveIncrease": 198, "negativeIncrease": 2586, "total": 67869, "totalTestResultsIncrease": 2784, "posNeg": 67869, "deathIncrease": 11, "hospitalizedIncrease": 0, "hash": "dcab4be1fcefea022d681f52dc10a0ec4d8cd406", "commercialScore": 0, "negativeRegularScore": 0, "negativeScore": 0, "positiveScore": 0, "score": 0, "grade": "", "month_number_label": "2020-04", "date_label": "2020-04-30", "week_number_label": "2020W18", "week_start_label": "2020-04-27"}, {"date": 20200501, "state": "NM", "positive": 3513, "probableCases": null, "negative": 67605, "pending": null, "totalTestResultsSource": "posNeg", "totalTestResults": 71118, "hospitalizedCurrently": 159, "hospitalizedCumulative": 587, "inIcuCurrently": null, "inIcuCumulative": null, "onVentilatorCurrently": null, "onVentilatorCumulative": null, "recovered": 785, "dataQualityGrade": "C", "lastUpdateEt": "5/1/2020 20:02", "dateModified": "2020-05-01T20:02:00Z", "checkTimeEt": "05/01 16:02", "death": 131, "hospitalized": 587, "dateChecked": "2020-05-01T20:02:00Z", "totalTestsViral": null, "positiveTestsViral": null, "negativeTestsViral": null, "positiveCasesViral": 3513, "deathConfirmed": null, "deathProbable": null, "totalTestEncountersViral": null, "totalTestsPeopleViral": null, "totalTestsAntibody": null, "positiveTestsAntibody": null, "negativeTestsAntibody": null, "totalTestsPeopleAntibody": null, "positiveTestsPeopleAntibody": null, "negativeTestsPeopleAntibody": null, "totalTestsPeopleAntigen": null, "positiveTestsPeopleAntigen": null, "totalTestsAntigen": null, "positiveTestsAntigen": null, "fips": "35", "positiveIncrease": 102, "negativeIncrease": 3147, "total": 71118, "totalTestResultsIncrease": 3249, "posNeg": 71118, "deathIncrease": 8, "hospitalizedIncrease": 51, "hash": "455d0527987a8fa4a0df42096caddb31575a2c0b", "commercialScore": 0, "negativeRegularScore": 0, "negativeScore": 0, "positiveScore": 0, "score": 0, "grade": "", "month_number_label": "2020-05", "date_label": "2020-05-01", "week_number_label": "2020W18", "week_start_label": "2020-04-27"}, {"date": 20200502, "state": "NM", "positive": 3732, "probableCases": null, "negative": 71212, "pending": null, "totalTestResultsSource": "posNeg", "totalTestResults": 74944, "hospitalizedCurrently": 168, "hospitalizedCumulative": 587, "inIcuCurrently": null, "inIcuCumulative": null, "onVentilatorCurrently": null, "onVentilatorCumulative": null, "recovered": 812, "dataQualityGrade": "C", "lastUpdateEt": "5/2/2020 18:00", "dateModified": "2020-05-02T18:00:00Z", "checkTimeEt": "05/02 14:00", "death": 139, "hospitalized": 587, "dateChecked": "2020-05-02T18:00:00Z", "totalTestsViral": null, "positiveTestsViral": null, "negativeTestsViral": null, "positiveCasesViral": 3732, "deathConfirmed": null, "deathProbable": null, "totalTestEncountersViral": null, "totalTestsPeopleViral": null, "totalTestsAntibody": null, "positiveTestsAntibody": null, "negativeTestsAntibody": null, "totalTestsPeopleAntibody": null, "positiveTestsPeopleAntibody": null, "negativeTestsPeopleAntibody": null, "totalTestsPeopleAntigen": null, "positiveTestsPeopleAntigen": null, "totalTestsAntigen": null, "positiveTestsAntigen": null, "fips": "35", "positiveIncrease": 219, "negativeIncrease": 3607, "total": 74944, "totalTestResultsIncrease": 3826, "posNeg": 74944, "deathIncrease": 8, "hospitalizedIncrease": 0, "hash": "15178e197c028d5c72edeaccd673704cff896a45", "commercialScore": 0, "negativeRegularScore": 0, "negativeScore": 0, "positiveScore": 0, "score": 0, "grade": "", "month_number_label": "2020-05", "date_label": "2020-05-02", "week_number_label": "2020W18", "week_start_label": "2020-04-27"}, {"date": 20200503, "state": "NM", "positive": 3850, "probableCases": null, "negative": 74127, "pending": null, "totalTestResultsSource": "posNeg", "totalTestResults": 77977, "hospitalizedCurrently": 164, "hospitalizedCumulative": 587, "inIcuCurrently": null, "inIcuCumulative": null, "onVentilatorCurrently": null, "onVentilatorCumulative": null, "recovered": 832, "dataQualityGrade": "C", "lastUpdateEt": "5/3/2020 17:58", "dateModified": "2020-05-03T17:58:00Z", "checkTimeEt": "05/03 13:58", "death": 151, "hospitalized": 587, "dateChecked": "2020-05-03T17:58:00Z", "totalTestsViral": null, "positiveTestsViral": null, "negativeTestsViral": null, "positiveCasesViral": 3850, "deathConfirmed": null, "deathProbable": null, "totalTestEncountersViral": null, "totalTestsPeopleViral": null, "totalTestsAntibody": null, "positiveTestsAntibody": null, "negativeTestsAntibody": null, "totalTestsPeopleAntibody": null, "positiveTestsPeopleAntibody": null, "negativeTestsPeopleAntibody": null, "totalTestsPeopleAntigen": null, "positiveTestsPeopleAntigen": null, "totalTestsAntigen": null, "positiveTestsAntigen": null, "fips": "35", "positiveIncrease": 118, "negativeIncrease": 2915, "total": 77977, "totalTestResultsIncrease": 3033, "posNeg": 77977, "deathIncrease": 12, "hospitalizedIncrease": 0, "hash": "f7ea4a633e4b4b3caf92b91520e5798e6c026e47", "commercialScore": 0, "negativeRegularScore": 0, "negativeScore": 0, "positiveScore": 0, "score": 0, "grade": "", "month_number_label": "2020-05", "date_label": "2020-05-03", "week_number_label": "2020W18", "week_start_label": "2020-04-27"}, {"date": 20200504, "state": "NM", "positive": 4031, "probableCases": null, "negative": 77689, "pending": null, "totalTestResultsSource": "posNeg", "totalTestResults": 81720, "hospitalizedCurrently": 181, "hospitalizedCumulative": 667, "inIcuCurrently": null, "inIcuCumulative": null, "onVentilatorCurrently": null, "onVentilatorCumulative": null, "recovered": 842, "dataQualityGrade": "C", "lastUpdateEt": "5/4/2020 17:53", "dateModified": "2020-05-04T17:53:00Z", "checkTimeEt": "05/04 13:53", "death": 156, "hospitalized": 667, "dateChecked": "2020-05-04T17:53:00Z", "totalTestsViral": null, "positiveTestsViral": null, "negativeTestsViral": null, "positiveCasesViral": 4031, "deathConfirmed": null, "deathProbable": null, "totalTestEncountersViral": null, "totalTestsPeopleViral": null, "totalTestsAntibody": null, "positiveTestsAntibody": null, "negativeTestsAntibody": null, "totalTestsPeopleAntibody": null, "positiveTestsPeopleAntibody": null, "negativeTestsPeopleAntibody": null, "totalTestsPeopleAntigen": null, "positiveTestsPeopleAntigen": null, "totalTestsAntigen": null, "positiveTestsAntigen": null, "fips": "35", "positiveIncrease": 181, "negativeIncrease": 3562, "total": 81720, "totalTestResultsIncrease": 3743, "posNeg": 81720, "deathIncrease": 5, "hospitalizedIncrease": 80, "hash": "226edddac2b406961ea37dd6e9e108811e2f124c", "commercialScore": 0, "negativeRegularScore": 0, "negativeScore": 0, "positiveScore": 0, "score": 0, "grade": "", "month_number_label": "2020-05", "date_label": "2020-05-04", "week_number_label": "2020W19", "week_start_label": "2020-05-04"}, {"date": 20200505, "state": "NM", "positive": 4138, "probableCases": null, "negative": 79113, "pending": null, "totalTestResultsSource": "posNeg", "totalTestResults": 83251, "hospitalizedCurrently": 178, "hospitalizedCumulative": 687, "inIcuCurrently": null, "inIcuCumulative": null, "onVentilatorCurrently": null, "onVentilatorCumulative": null, "recovered": 964, "dataQualityGrade": "C", "lastUpdateEt": "5/5/2020 17:30", "dateModified": "2020-05-05T17:30:00Z", "checkTimeEt": "05/05 13:30", "death": 162, "hospitalized": 687, "dateChecked": "2020-05-05T17:30:00Z", "totalTestsViral": null, "positiveTestsViral": null, "negativeTestsViral": null, "positiveCasesViral": 4138, "deathConfirmed": null, "deathProbable": null, "totalTestEncountersViral": null, "totalTestsPeopleViral": null, "totalTestsAntibody": null, "positiveTestsAntibody": null, "negativeTestsAntibody": null, "totalTestsPeopleAntibody": null, "positiveTestsPeopleAntibody": null, "negativeTestsPeopleAntibody": null, "totalTestsPeopleAntigen": null, "positiveTestsPeopleAntigen": null, "totalTestsAntigen": null, "positiveTestsAntigen": null, "fips": "35", "positiveIncrease": 107, "negativeIncrease": 1424, "total": 83251, "totalTestResultsIncrease": 1531, "posNeg": 83251, "deathIncrease": 6, "hospitalizedIncrease": 20, "hash": "fa2d4c4a38bcabc68fce741b23aec9371e775015", "commercialScore": 0, "negativeRegularScore": 0, "negativeScore": 0, "positiveScore": 0, "score": 0, "grade": "", "month_number_label": "2020-05", "date_label": "2020-05-05", "week_number_label": "2020W19", "week_start_label": "2020-05-04"}, {"date": 20200506, "state": "NM", "positive": 4291, "probableCases": null, "negative": 81393, "pending": null, "totalTestResultsSource": "posNeg", "totalTestResults": 85684, "hospitalizedCurrently": 193, "hospitalizedCumulative": 687, "inIcuCurrently": null, "inIcuCumulative": null, "onVentilatorCurrently": null, "onVentilatorCumulative": null, "recovered": 1073, "dataQualityGrade": "C", "lastUpdateEt": "5/6/2020 06:01", "dateModified": "2020-05-06T06:01:00Z", "checkTimeEt": "05/06 02:01", "death": 169, "hospitalized": 687, "dateChecked": "2020-05-06T06:01:00Z", "totalTestsViral": null, "positiveTestsViral": null, "negativeTestsViral": null, "positiveCasesViral": 4291, "deathConfirmed": null, "deathProbable": null, "totalTestEncountersViral": null, "totalTestsPeopleViral": null, "totalTestsAntibody": null, "positiveTestsAntibody": null, "negativeTestsAntibody": null, "totalTestsPeopleAntibody": null, "positiveTestsPeopleAntibody": null, "negativeTestsPeopleAntibody": null, "totalTestsPeopleAntigen": null, "positiveTestsPeopleAntigen": null, "totalTestsAntigen": null, "positiveTestsAntigen": null, "fips": "35", "positiveIncrease": 153, "negativeIncrease": 2280, "total": 85684, "totalTestResultsIncrease": 2433, "posNeg": 85684, "deathIncrease": 7, "hospitalizedIncrease": 0, "hash": "d90a5f876205117811a2e9229f603e4ecee474d0", "commercialScore": 0, "negativeRegularScore": 0, "negativeScore": 0, "positiveScore": 0, "score": 0, "grade": "", "month_number_label": "2020-05", "date_label": "2020-05-06", "week_number_label": "2020W19", "week_start_label": "2020-05-04"}, {"date": 20200507, "state": "NM", "positive": 4493, "probableCases": null, "negative": 84539, "pending": null, "totalTestResultsSource": "posNeg", "totalTestResults": 89032, "hospitalizedCurrently": 197, "hospitalizedCumulative": 760, "inIcuCurrently": null, "inIcuCumulative": null, "onVentilatorCurrently": null, "onVentilatorCumulative": null, "recovered": 1125, "dataQualityGrade": "C", "lastUpdateEt": "5/7/2020 06:09", "dateModified": "2020-05-07T06:09:00Z", "checkTimeEt": "05/07 02:09", "death": 172, "hospitalized": 760, "dateChecked": "2020-05-07T06:09:00Z", "totalTestsViral": null, "positiveTestsViral": null, "negativeTestsViral": null, "positiveCasesViral": 4493, "deathConfi