[{"date": 20200307, "state": "ND", "positive": null, "probableCases": null, "negative": 0, "pending": null, "totalTestResultsSource": "totalTestEncountersViral", "totalTestResults": null, "hospitalizedCurrently": null, "hospitalizedCumulative": null, "inIcuCurrently": null, "inIcuCumulative": null, "onVentilatorCurrently": null, "onVentilatorCumulative": null, "recovered": null, "dataQualityGrade": null, "lastUpdateEt": null, "dateModified": null, "checkTimeEt": null, "death": null, "hospitalized": null, "dateChecked": null, "totalTestsViral": null, "positiveTestsViral": null, "negativeTestsViral": null, "positiveCasesViral": null, "deathConfirmed": null, "deathProbable": null, "totalTestEncountersViral": null, "totalTestsPeopleViral": null, "totalTestsAntibody": null, "positiveTestsAntibody": null, "negativeTestsAntibody": null, "totalTestsPeopleAntibody": null, "positiveTestsPeopleAntibody": null, "negativeTestsPeopleAntibody": null, "totalTestsPeopleAntigen": null, "positiveTestsPeopleAntigen": null, "totalTestsAntigen": null, "positiveTestsAntigen": null, "fips": "38", "positiveIncrease": 0, "negativeIncrease": 0, "total": 0, "totalTestResultsIncrease": 0, "posNeg": 0, "deathIncrease": 0, "hospitalizedIncrease": 0, "hash": "7c9e8e9e075c9e5805d10e4db0c1f2baad888c29", "commercialScore": 0, "negativeRegularScore": 0, "negativeScore": 0, "positiveScore": 0, "score": 0, "grade": "", "month_number_label": "2020-03", "date_label": "2020-03-07", "week_number_label": "2020W10", "week_start_label": "2020-03-02"}, {"date": 20200308, "state": "ND", "positive": null, "probableCases": null, "negative": 0, "pending": null, "totalTestResultsSource": "totalTestEncountersViral", "totalTestResults": null, "hospitalizedCurrently": null, "hospitalizedCumulative": null, "inIcuCurrently": null, "inIcuCumulative": null, "onVentilatorCurrently": null, "onVentilatorCumulative": null, "recovered": null, "dataQualityGrade": null, "lastUpdateEt": null, "dateModified": null, "checkTimeEt": null, "death": null, "hospitalized": null, "dateChecked": null, "totalTestsViral": null, "positiveTestsViral": null, "negativeTestsViral": null, "positiveCasesViral": null, "deathConfirmed": null, "deathProbable": null, "totalTestEncountersViral": null, "totalTestsPeopleViral": null, "totalTestsAntibody": null, "positiveTestsAntibody": null, "negativeTestsAntibody": null, "totalTestsPeopleAntibody": null, "positiveTestsPeopleAntibody": null, "negativeTestsPeopleAntibody": null, "totalTestsPeopleAntigen": null, "positiveTestsPeopleAntigen": null, "totalTestsAntigen": null, "positiveTestsAntigen": null, "fips": "38", "positiveIncrease": 0, "negativeIncrease": 0, "total": 0, "totalTestResultsIncrease": 0, "posNeg": 0, "deathIncrease": 0, "hospitalizedIncrease": 0, "hash": "4dacfc03135ea179789d010f84c7267dee01116f", "commercialScore": 0, "negativeRegularScore": 0, "negativeScore": 0, "positiveScore": 0, "score": 0, "grade": "", "month_number_label": "2020-03", "date_label": "2020-03-08", "week_number_label": "2020W10", "week_start_label": "2020-03-02"}, {"date": 20200309, "state": "ND", "positive": null, "probableCases": null, "negative": 0, "pending": null, "totalTestResultsSource": "totalTestEncountersViral", "totalTestResults": null, "hospitalizedCurrently": null, "hospitalizedCumulative": null, "inIcuCurrently": null, "inIcuCumulative": null, "onVentilatorCurrently": null, "onVentilatorCumulative": null, "recovered": null, "dataQualityGrade": null, "lastUpdateEt": null, "dateModified": null, "checkTimeEt": null, "death": null, "hospitalized": null, "dateChecked": null, "totalTestsViral": null, "positiveTestsViral": null, "negativeTestsViral": null, "positiveCasesViral": null, "deathConfirmed": null, "deathProbable": null, "totalTestEncountersViral": null, "totalTestsPeopleViral": null, "totalTestsAntibody": null, "positiveTestsAntibody": null, "negativeTestsAntibody": null, "totalTestsPeopleAntibody": null, "positiveTestsPeopleAntibody": null, "negativeTestsPeopleAntibody": null, "totalTestsPeopleAntigen": null, "positiveTestsPeopleAntigen": null, "totalTestsAntigen": null, "positiveTestsAntigen": null, "fips": "38", "positiveIncrease": 0, "negativeIncrease": 0, "total": 0, "totalTestResultsIncrease": 0, "posNeg": 0, "deathIncrease": 0, "hospitalizedIncrease": 0, "hash": "ed7bb3ac9e5d077931e00ebaffd5bb0549e02c48", "commercialScore": 0, "negativeRegularScore": 0, "negativeScore": 0, "positiveScore": 0, "score": 0, "grade": "", "month_number_label": "2020-03", "date_label": "2020-03-09", "week_number_label": "2020W11", "week_start_label": "2020-03-09"}, {"date": 20200310, "state": "ND", "positive": 0, "probableCases": null, "negative": 6, "pending": 2, "totalTestResultsSource": "totalTestEncountersViral", "totalTestResults": 7, "hospitalizedCurrently": null, "hospitalizedCumulative": null, "inIcuCurrently": null, "inIcuCumulative": null, "onVentilatorCurrently": null, "onVentilatorCumulative": null, "recovered": null, "dataQualityGrade": null, "lastUpdateEt": null, "dateModified": null, "checkTimeEt": null, "death": null, "hospitalized": null, "dateChecked": null, "totalTestsViral": 12, "positiveTestsViral": null, "negativeTestsViral": null, "positiveCasesViral": null, "deathConfirmed": null, "deathProbable": null, "totalTestEncountersViral": 7, "totalTestsPeopleViral": 7, "totalTestsAntibody": null, "positiveTestsAntibody": null, "negativeTestsAntibody": null, "totalTestsPeopleAntibody": null, "positiveTestsPeopleAntibody": null, "negativeTestsPeopleAntibody": null, "totalTestsPeopleAntigen": null, "positiveTestsPeopleAntigen": null, "totalTestsAntigen": null, "positiveTestsAntigen": null, "fips": "38", "positiveIncrease": 0, "negativeIncrease": 6, "total": 8, "totalTestResultsIncrease": 7, "posNeg": 6, "deathIncrease": 0, "hospitalizedIncrease": 0, "hash": "5bb2971949bc7ebb81839f0424bff56d7e56f7e5", "commercialScore": 0, "negativeRegularScore": 0, "negativeScore": 0, "positiveScore": 0, "score": 0, "grade": "", "month_number_label": "2020-03", "date_label": "2020-03-10", "week_number_label": "2020W11", "week_start_label": "2020-03-09"}, {"date": 20200311, "state": "ND", "positive": 0, "probableCases": null, "negative": 7, "pending": 6, "totalTestResultsSource": "totalTestEncountersViral", "totalTestResults": 9, "hospitalizedCurrently": null, "hospitalizedCumulative": null, "inIcuCurrently": null, "inIcuCumulative": null, "onVentilatorCurrently": null, "onVentilatorCumulative": null, "recovered": null, "dataQualityGrade": null, "lastUpdateEt": null, "dateModified": null, "checkTimeEt": null, "death": null, "hospitalized": null, "dateChecked": null, "totalTestsViral": 14, "positiveTestsViral": null, "negativeTestsViral": null, "positiveCasesViral": 0, "deathConfirmed": null, "deathProbable": null, "totalTestEncountersViral": 9, "totalTestsPeopleViral": 8, "totalTestsAntibody": null, "positiveTestsAntibody": null, "negativeTestsAntibody": null, "totalTestsPeopleAntibody": null, "positiveTestsPeopleAntibody": null, "negativeTestsPeopleAntibody": null, "totalTestsPeopleAntigen": null, "positiveTestsPeopleAntigen": null, "totalTestsAntigen": null, "positiveTestsAntigen": null, "fips": "38", "positiveIncrease": 0, "negativeIncrease": 1, "total": 13, "totalTestResultsIncrease": 2, "posNeg": 7, "deathIncrease": 0, "hospitalizedIncrease": 0, "hash": "1621a06df4943113f359b3db98d07ab094563180", "commercialScore": 0, "negativeRegularScore": 0, "negativeScore": 0, "positiveScore": 0, "score": 0, "grade": "", "month_number_label": "2020-03", "date_label": "2020-03-11", "week_number_label": "2020W11", "week_start_label": "2020-03-09"}, {"date": 20200312, "state": "ND", "positive": 1, "probableCases": null, "negative": 12, "pending": 14, "totalTestResultsSource": "totalTestEncountersViral", "totalTestResults": 17, "hospitalizedCurrently": null, "hospitalizedCumulative": null, "inIcuCurrently": null, "inIcuCumulative": null, "onVentilatorCurrently": null, "onVentilatorCumulative": null, "recovered": null, "dataQualityGrade": null, "lastUpdateEt": "3/11/2020 00:00", "dateModified": "2020-03-11T00:00:00Z", "checkTimeEt": "03/10 20:00", "death": null, "hospitalized": null, "dateChecked": "2020-03-11T00:00:00Z", "totalTestsViral": 26, "positiveTestsViral": null, "negativeTestsViral": null, "positiveCasesViral": 1, "deathConfirmed": null, "deathProbable": null, "totalTestEncountersViral": 17, "totalTestsPeopleViral": 16, "totalTestsAntibody": null, "positiveTestsAntibody": null, "negativeTestsAntibody": null, "totalTestsPeopleAntibody": null, "positiveTestsPeopleAntibody": null, "negativeTestsPeopleAntibody": null, "totalTestsPeopleAntigen": null, "positiveTestsPeopleAntigen": null, "totalTestsAntigen": null, "positiveTestsAntigen": null, "fips": "38", "positiveIncrease": 1, "negativeIncrease": 5, "total": 27, "totalTestResultsIncrease": 8, "posNeg": 13, "deathIncrease": 0, "hospitalizedIncrease": 0, "hash": "5d1d3439f4e02d36b8a180b4948cf1a50ea7b313", "commercialScore": 0, "negativeRegularScore": 0, "negativeScore": 0, "positiveScore": 0, "score": 0, "grade": "", "month_number_label": "2020-03", "date_label": "2020-03-12", "week_number_label": "2020W11", "week_start_label": "2020-03-09"}, {"date": 20200313, "state": "ND", "positive": 1, "probableCases": null, "negative": 39, "pending": 12, "totalTestResultsSource": "totalTestEncountersViral", "totalTestResults": 29, "hospitalizedCurrently": null, "hospitalizedCumulative": null, "inIcuCurrently": null, "inIcuCumulative": null, "onVentilatorCurrently": null, "onVentilatorCumulative": null, "recovered": null, "dataQualityGrade": null, "lastUpdateEt": "3/13/2020 13:00", "dateModified": "2020-03-13T13:00:00Z", "checkTimeEt": "03/13 09:00", "death": 0, "hospitalized": null, "dateChecked": "2020-03-13T13:00:00Z", "totalTestsViral": 40, "positiveTestsViral": null, "negativeTestsViral": null, "positiveCasesViral": 1, "deathConfirmed": null, "deathProbable": null, "totalTestEncountersViral": 29, "totalTestsPeopleViral": 28, "totalTestsAntibody": null, "positiveTestsAntibody": null, "negativeTestsAntibody": null, "totalTestsPeopleAntibody": null, "positiveTestsPeopleAntibody": null, "negativeTestsPeopleAntibody": null, "totalTestsPeopleAntigen": null, "positiveTestsPeopleAntigen": null, "totalTestsAntigen": null, "positiveTestsAntigen": null, "fips": "38", "positiveIncrease": 0, "negativeIncrease": 27, "total": 52, "totalTestResultsIncrease": 12, "posNeg": 40, "deathIncrease": 0, "hospitalizedIncrease": 0, "hash": "2512b6bd396cf2f511ced9520a368f772f3b77e4", "commercialScore": 0, "negativeRegularScore": 0, "negativeScore": 0, "positiveScore": 0, "score": 0, "grade": "", "month_number_label": "2020-03", "date_label": "2020-03-13", "week_number_label": "2020W11", "week_start_label": "2020-03-09"}, {"date": 20200314, "state": "ND", "positive": 1, "probableCases": null, "negative": 54, "pending": 14, "totalTestResultsSource": "totalTestEncountersViral", "totalTestResults": 50, "hospitalizedCurrently": null, "hospitalizedCumulative": null, "inIcuCurrently": null, "inIcuCumulative": null, "onVentilatorCurrently": null, "onVentilatorCumulative": null, "recovered": null, "dataQualityGrade": null, "lastUpdateEt": "3/13/2020 13:00", "dateModified": "2020-03-13T13:00:00Z", "checkTimeEt": "03/13 09:00", "death": 0, "hospitalized": null, "dateChecked": "2020-03-13T13:00:00Z", "totalTestsViral": 63, "positiveTestsViral": null, "negativeTestsViral": null, "positiveCasesViral": 1, "deathConfirmed": null, "deathProbable": null, "totalTestEncountersViral": 50, "totalTestsPeopleViral": 49, "totalTestsAntibody": null, "positiveTestsAntibody": null, "negativeTestsAntibody": null, "totalTestsPeopleAntibody": null, "positiveTestsPeopleAntibody": null, "negativeTestsPeopleAntibody": null, "totalTestsPeopleAntigen": null, "positiveTestsPeopleAntigen": null, "totalTestsAntigen": null, "positiveTestsAntigen": null, "fips": "38", "positiveIncrease": 0, "negativeIncrease": 15, "total": 69, "totalTestResultsIncrease": 21, "posNeg": 55, "deathIncrease": 0, "hospitalizedIncrease": 0, "hash": "762ee238c1cead1a5b6bee7f1e4c134db5531117", "commercialScore": 0, "negativeRegularScore": 0, "negativeScore": 0, "positiveScore": 0, "score": 0, "grade": "", "month_number_label": "2020-03", "date_label": "2020-03-14", "week_number_label": "2020W11", "week_start_label": "2020-03-09"}, {"date": 20200315, "state": "ND", "positive": 1, "probableCases": null, "negative": 95, "pending": 4, "totalTestResultsSource": "totalTestEncountersViral", "totalTestResults": 74, "hospitalizedCurrently": null, "hospitalizedCumulative": null, "inIcuCurrently": null, "inIcuCumulative": null, "onVentilatorCurrently": null, "onVentilatorCumulative": null, "recovered": null, "dataQualityGrade": null, "lastUpdateEt": "3/15/2020 12:00", "dateModified": "2020-03-15T12:00:00Z", "checkTimeEt": "03/15 08:00", "death": 0, "hospitalized": null, "dateChecked": "2020-03-15T12:00:00Z", "totalTestsViral": 87, "positiveTestsViral": null, "negativeTestsViral": null, "positiveCasesViral": 1, "deathConfirmed": null, "deathProbable": null, "totalTestEncountersViral": 74, "totalTestsPeopleViral": 73, "totalTestsAntibody": null, "positiveTestsAntibody": null, "negativeTestsAntibody": null, "totalTestsPeopleAntibody": null, "positiveTestsPeopleAntibody": null, "negativeTestsPeopleAntibody": null, "totalTestsPeopleAntigen": null, "positiveTestsPeopleAntigen": null, "totalTestsAntigen": null, "positiveTestsAntigen": null, "fips": "38", "positiveIncrease": 0, "negativeIncrease": 41, "total": 100, "totalTestResultsIncrease": 24, "posNeg": 96, "deathIncrease": 0, "hospitalizedIncrease": 0, "hash": "2f2dbbe66f03139e0769f0adc6d09f0da9fa6360", "commercialScore": 0, "negativeRegularScore": 0, "negativeScore": 0, "positiveScore": 0, "score": 0, "grade": "", "month_number_label": "2020-03", "date_label": "2020-03-15", "week_number_label": "2020W11", "week_start_label": "2020-03-09"}, {"date": 20200316, "state": "ND", "positive": 1, "probableCases": null, "negative": 123, "pending": 0, "totalTestResultsSource": "totalTestEncountersViral", "totalTestResults": 96, "hospitalizedCurrently": null, "hospitalizedCumulative": null, "inIcuCurrently": null, "inIcuCumulative": null, "onVentilatorCurrently": null, "onVentilatorCumulative": null, "recovered": null, "dataQualityGrade": null, "lastUpdateEt": "3/16/2020 15:45", "dateModified": "2020-03-16T15:45:00Z", "checkTimeEt": "03/16 11:45", "death": 0, "hospitalized": null, "dateChecked": "2020-03-16T15:45:00Z", "totalTestsViral": 109, "positiveTestsViral": null, "negativeTestsViral": null, "positiveCasesViral": 1, "deathConfirmed": null, "deathProbable": null, "totalTestEncountersViral": 96, "totalTestsPeopleViral": 93, "totalTestsAntibody": null, "positiveTestsAntibody": null, "negativeTestsAntibody": null, "totalTestsPeopleAntibody": null, "positiveTestsPeopleAntibody": null, "negativeTestsPeopleAntibody": null, "totalTestsPeopleAntigen": null, "positiveTestsPeopleAntigen": null, "totalTestsAntigen": null, "positiveTestsAntigen": null, "fips": "38", "positiveIncrease": 0, "negativeIncrease": 28, "total": 124, "totalTestResultsIncrease": 22, "posNeg": 124, "deathIncrease": 0, "hospitalizedIncrease": 0, "hash": "94f5a96bad1e434dd672a0602f1b7cb91458cce6", "commercialScore": 0, "negativeRegularScore": 0, "negativeScore": 0, "positiveScore": 0, "score": 0, "grade": "", "month_number_label": "2020-03", "date_label": "2020-03-16", "week_number_label": "2020W12", "week_start_label": "2020-03-16"}, {"date": 20200317, "state": "ND", "positive": 1, "probableCases": null, "negative": 220, "pending": 0, "totalTestResultsSource": "totalTestEncountersViral", "totalTestResults": 130, "hospitalizedCurrently": null, "hospitalizedCumulative": null, "inIcuCurrently": null, "inIcuCumulative": null, "onVentilatorCurrently": null, "onVentilatorCumulative": null, "recovered": null, "dataQualityGrade": null, "lastUpdateEt": "3/17/2020 00:00", "dateModified": "2020-03-17T00:00:00Z", "checkTimeEt": "03/16 20:00", "death": 0, "hospitalized": null, "dateChecked": "2020-03-17T00:00:00Z", "totalTestsViral": 143, "positiveTestsViral": null, "negativeTestsViral": null, "positiveCasesViral": 1, "deathConfirmed": null, "deathProbable": null, "totalTestEncountersViral": 130, "totalTestsPeopleViral": 127, "totalTestsAntibody": null, "positiveTestsAntibody": null, "negativeTestsAntibody": null, "totalTestsPeopleAntibody": null, "positiveTestsPeopleAntibody": null, "negativeTestsPeopleAntibody": null, "totalTestsPeopleAntigen": null, "positiveTestsPeopleAntigen": null, "totalTestsAntigen": null, "positiveTestsAntigen": null, "fips": "38", "positiveIncrease": 0, "negativeIncrease": 97, "total": 221, "totalTestResultsIncrease": 34, "posNeg": 221, "deathIncrease": 0, "hospitalizedIncrease": 0, "hash": "fbf3bb9d14a64b09ee916e8a3d1c3474a34f58aa", "commercialScore": 0, "negativeRegularScore": 0, "negativeScore": 0, "positiveScore": 0, "score": 0, "grade": "", "month_number_label": "2020-03", "date_label": "2020-03-17", "week_number_label": "2020W12", "week_start_label": "2020-03-16"}, {"date": 20200318, "state": "ND", "positive": 6, "probableCases": null, "negative": 268, "pending": null, "totalTestResultsSource": "totalTestEncountersViral", "totalTestResults": 246, "hospitalizedCurrently": null, "hospitalizedCumulative": null, "inIcuCurrently": null, "inIcuCumulative": null, "onVentilatorCurrently": null, "onVentilatorCumulative": null, "recovered": null, "dataQualityGrade": null, "lastUpdateEt": "3/18/2020 00:00", "dateModified": "2020-03-18T00:00:00Z", "checkTimeEt": "03/17 20:00", "death": 0, "hospitalized": null, "dateChecked": "2020-03-18T00:00:00Z", "totalTestsViral": 259, "positiveTestsViral": null, "negativeTestsViral": null, "positiveCasesViral": 6, "deathConfirmed": null, "deathProbable": null, "totalTestEncountersViral": 246, "totalTestsPeopleViral": 239, "totalTestsAntibody": null, "positiveTestsAntibody": null, "negativeTestsAntibody": null, "totalTestsPeopleAntibody": null, "positiveTestsPeopleAntibody": null, "negativeTestsPeopleAntibody": null, "totalTestsPeopleAntigen": null, "positiveTestsPeopleAntigen": null, "totalTestsAntigen": null, "positiveTestsAntigen": null, "fips": "38", "positiveIncrease": 5, "negativeIncrease": 48, "total": 274, "totalTestResultsIncrease": 116, "posNeg": 274, "deathIncrease": 0, "hospitalizedIncrease": 0, "hash": "4eddd24ad7fb3c3b949eb7cc25a41bbad74ddcc8", "commercialScore": 0, "negativeRegularScore": 0, "negativeScore": 0, "positiveScore": 0, "score": 0, "grade": "", "month_number_label": "2020-03", "date_label": "2020-03-18", "week_number_label": "2020W12", "week_start_label": "2020-03-16"}, {"date": 20200319, "state": "ND", "positive": 15, "probableCases": null, "negative": 493, "pending": null, "totalTestResultsSource": "totalTestEncountersViral", "totalTestResults": 471, "hospitalizedCurrently": null, "hospitalizedCumulative": null, "inIcuCurrently": null, "inIcuCumulative": null, "onVentilatorCurrently": null, "onVentilatorCumulative": null, "recovered": null, "dataQualityGrade": null, "lastUpdateEt": "3/19/2020 00:00", "dateModified": "2020-03-19T00:00:00Z", "checkTimeEt": "03/18 20:00", "death": 0, "hospitalized": null, "dateChecked": "2020-03-19T00:00:00Z", "totalTestsViral": 487, "positiveTestsViral": null, "negativeTestsViral": null, "positiveCasesViral": 15, "deathConfirmed": null, "deathProbable": null, "totalTestEncountersViral": 471, "totalTestsPeopleViral": 460, "totalTestsAntibody": null, "positiveTestsAntibody": null, "negativeTestsAntibody": null, "totalTestsPeopleAntibody": null, "positiveTestsPeopleAntibody": null, "negativeTestsPeopleAntibody": null, "totalTestsPeopleAntigen": null, "positiveTestsPeopleAntigen": null, "totalTestsAntigen": null, "positiveTestsAntigen": null, "fips": "38", "positiveIncrease": 9, "negativeIncrease": 225, "total": 508, "totalTestResultsIncrease": 225, "posNeg": 508, "deathIncrease": 0, "hospitalizedIncrease": 0, "hash": "67f3093f945bdd72d353d3a725fe5129f9b0234e", "commercialScore": 0, "negativeRegularScore": 0, "negativeScore": 0, "positiveScore": 0, "score": 0, "grade": "", "month_number_label": "2020-03", "date_label": "2020-03-19", "week_number_label": "2020W12", "week_start_label": "2020-03-16"}, {"date": 20200320, "state": "ND", "positive": 20, "probableCases": null, "negative": 800, "pending": null, "totalTestResultsSource": "totalTestEncountersViral", "totalTestResults": 764, "hospitalizedCurrently": null, "hospitalizedCumulative": null, "inIcuCurrently": null, "inIcuCumulative": null, "onVentilatorCurrently": null, "onVentilatorCumulative": null, "recovered": null, "dataQualityGrade": null, "lastUpdateEt": "3/20/2020 00:00", "dateModified": "2020-03-20T00:00:00Z", "checkTimeEt": "03/19 20:00", "death": 0, "hospitalized": null, "dateChecked": "2020-03-20T00:00:00Z", "totalTestsViral": 778, "positiveTestsViral": null, "negativeTestsViral": null, "positiveCasesViral": 20, "deathConfirmed": null, "deathProbable": null, "totalTestEncountersViral": 764, "totalTestsPeopleViral": 748, "totalTestsAntibody": null, "positiveTestsAntibody": null, "negativeTestsAntibody": null, "totalTestsPeopleAntibody": null, "positiveTestsPeopleAntibody": null, "negativeTestsPeopleAntibody": null, "totalTestsPeopleAntigen": null, "positiveTestsPeopleAntigen": null, "totalTestsAntigen": null, "positiveTestsAntigen": null, "fips": "38", "positiveIncrease": 5, "negativeIncrease": 307, "total": 820, "totalTestResultsIncrease": 293, "posNeg": 820, "deathIncrease": 0, "hospitalizedIncrease": 0, "hash": "7e11743fa50e4443a0cfbbe6445062f31a75b54d", "commercialScore": 0, "negativeRegularScore": 0, "negativeScore": 0, "positiveScore": 0, "score": 0, "grade": "", "month_number_label": "2020-03", "date_label": "2020-03-20", "week_number_label": "2020W12", "week_start_label": "2020-03-16"}, {"date": 20200321, "state": "ND", "positive": 28, "probableCases": null, "negative": 1141, "pending": null, "totalTestResultsSource": "totalTestEncountersViral", "totalTestResults": 1096, "hospitalizedCurrently": null, "hospitalizedCumulative": 3, "inIcuCurrently": null, "inIcuCumulative": null, "onVentilatorCurrently": null, "onVentilatorCumulative": null, "recovered": null, "dataQualityGrade": null, "lastUpdateEt": "3/21/2020 11:56", "dateModified": "2020-03-21T11:56:00Z", "checkTimeEt": "03/21 07:56", "death": 0, "hospitalized": 3, "dateChecked": "2020-03-21T11:56:00Z", "totalTestsViral": 1113, "positiveTestsViral": null, "negativeTestsViral": null, "positiveCasesViral": 28, "deathConfirmed": null, "deathProbable": null, "totalTestEncountersViral": 1096, "totalTestsPeopleViral": 1075, "totalTestsAntibody": null, "positiveTestsAntibody": null, "negativeTestsAntibody": null, "totalTestsPeopleAntibody": null, "positiveTestsPeopleAntibody": null, "negativeTestsPeopleAntibody": null, "totalTestsPeopleAntigen": null, "positiveTestsPeopleAntigen": null, "totalTestsAntigen": null, "positiveTestsAntigen": null, "fips": "38", "positiveIncrease": 8, "negativeIncrease": 341, "total": 1169, "totalTestResultsIncrease": 332, "posNeg": 1169, "deathIncrease": 0, "hospitalizedIncrease": 3, "hash": "7930cf7d0de4f9683d30bf9a71271c93efaf86fb", "commercialScore": 0, "negativeRegularScore": 0, "negativeScore": 0, "positiveScore": 0, "score": 0, "grade": "", "month_number_label": "2020-03", "date_label": "2020-03-21", "week_number_label": "2020W12", "week_start_label": "2020-03-16"}, {"date": 20200322, "state": "ND", "positive": 28, "probableCases": null, "negative": 1260, "pending": null, "totalTestResultsSource": "totalTestEncountersViral", "totalTestResults": 1246, "hospitalizedCurrently": null, "hospitalizedCumulative": 3, "inIcuCurrently": null, "inIcuCumulative": null, "onVentilatorCurrently": null, "onVentilatorCumulative": null, "recovered": null, "dataQualityGrade": null, "lastUpdateEt": "3/22/2020 11:39", "dateModified": "2020-03-22T11:39:00Z", "checkTimeEt": "03/22 07:39", "death": 0, "hospitalized": 3, "dateChecked": "2020-03-22T11:39:00Z", "totalTestsViral": 1263, "positiveTestsViral": null, "negativeTestsViral": null, "positiveCasesViral": 28, "deathConfirmed": null, "deathProbable": null, "totalTestEncountersViral": 1246, "totalTestsPeopleViral": 1221, "totalTestsAntibody": null, "positiveTestsAntibody": null, "negativeTestsAntibody": null, "totalTestsPeopleAntibody": null, "positiveTestsPeopleAntibody": null, "negativeTestsPeopleAntibody": null, "totalTestsPeopleAntigen": null, "positiveTestsPeopleAntigen": null, "totalTestsAntigen": null, "positiveTestsAntigen": null, "fips": "38", "positiveIncrease": 0, "negativeIncrease": 119, "total": 1288, "totalTestResultsIncrease": 150, "posNeg": 1288, "deathIncrease": 0, "hospitalizedIncrease": 0, "hash": "fe75d9f7b7d22758138f2c769afb4cfff60d6755", "commercialScore": 0, "negativeRegularScore": 0, "negativeScore": 0, "positiveScore": 0, "score": 0, "grade": "", "month_number_label": "2020-03", "date_label": "2020-03-22", "week_number_label": "2020W12", "week_start_label": "2020-03-16"}, {"date": 20200323, "state": "ND", "positive": 30, "probableCases": null, "negative": 1353, "pending": null, "totalTestResultsSource": "totalTestEncountersViral", "totalTestResults": 1344, "hospitalizedCurrently": null, "hospitalizedCumulative": 4, "inIcuCurrently": null, "inIcuCumulative": null, "onVentilatorCurrently": null, "onVentilatorCumulative": null, "recovered": null, "dataQualityGrade": "B", "lastUpdateEt": "3/23/2020 12:11", "dateModified": "2020-03-23T12:11:00Z", "checkTimeEt": "03/23 08:11", "death": 0, "hospitalized": 4, "dateChecked": "2020-03-23T12:11:00Z", "totalTestsViral": 1361, "positiveTestsViral": null, "negativeTestsViral": null, "positiveCasesViral": 30, "deathConfirmed": null, "deathProbable": null, "totalTestEncountersViral": 1344, "totalTestsPeopleViral": 1317, "totalTestsAntibody": null, "positiveTestsAntibody": null, "negativeTestsAntibody": null, "totalTestsPeopleAntibody": null, "positiveTestsPeopleAntibody": null, "negativeTestsPeopleAntibody": null, "totalTestsPeopleAntigen": null, "positiveTestsPeopleAntigen": null, "totalTestsAntigen": null, "positiveTestsAntigen": null, "fips": "38", "positiveIncrease": 2, "negativeIncrease": 93, "total": 1383, "totalTestResultsIncrease": 98, "posNeg": 1383, "deathIncrease": 0, "hospitalizedIncrease": 1, "hash": "c47a93460bb148fabca359cba0631a3e27093791", "commercialScore": 0, "negativeRegularScore": 0, "negativeScore": 0, "positiveScore": 0, "score": 0, "grade": "", "month_number_label": "2020-03", "date_label": "2020-03-23", "week_number_label": "2020W13", "week_start_label": "2020-03-23"}, {"date": 20200324, "state": "ND", "positive": 33, "probableCases": null, "negative": 1454, "pending": null, "totalTestResultsSource": "totalTestEncountersViral", "totalTestResults": 1456, "hospitalizedCurrently": null, "hospitalizedCumulative": 5, "inIcuCurrently": null, "inIcuCumulative": null, "onVentilatorCurrently": null, "onVentilatorCumulative": null, "recovered": null, "dataQualityGrade": "B", "lastUpdateEt": "3/24/2020 11:17", "dateModified": "2020-03-24T11:17:00Z", "checkTimeEt": "03/24 07:17", "death": 0, "hospitalized": 5, "dateChecked": "2020-03-24T11:17:00Z", "totalTestsViral": 1474, "positiveTestsViral": null, "negativeTestsViral": null, "positiveCasesViral": 33, "deathConfirmed": null, "deathProbable": null, "totalTestEncountersViral": 1456, "totalTestsPeopleViral": 1422, "totalTestsAntibody": null, "positiveTestsAntibody": null, "negativeTestsAntibody": null, "totalTestsPeopleAntibody": null, "positiveTestsPeopleAntibody": null, "negativeTestsPeopleAntibody": null, "totalTestsPeopleAntigen": null, "positiveTestsPeopleAntigen": null, "totalTestsAntigen": null, "positiveTestsAntigen": null, "fips": "38", "positiveIncrease": 3, "negativeIncrease": 101, "total": 1487, "totalTestResultsIncrease": 112, "posNeg": 1487, "deathIncrease": 0, "hospitalizedIncrease": 1, "hash": "1d7df11b8a71c900e9761f1d5f67d8ef2d3b72c9", "commercialScore": 0, "negativeRegularScore": 0, "negativeScore": 0, "positiveScore": 0, "score": 0, "grade": "", "month_number_label": "2020-03", "date_label": "2020-03-24", "week_number_label": "2020W13", "week_start_label": "2020-03-23"}, {"date": 20200325, "state": "ND", "positive": 39, "probableCases": null, "negative": 1734, "pending": null, "totalTestResultsSource": "totalTestEncountersViral", "totalTestResults": 1743, "hospitalizedCurrently": null, "hospitalizedCumulative": 8, "inIcuCurrently": null, "inIcuCumulative": null, "onVentilatorCurrently": null, "onVentilatorCumulative": null, "recovered": null, "dataQualityGrade": "B", "lastUpdateEt": "3/25/2020 11:47", "dateModified": "2020-03-25T11:47:00Z", "checkTimeEt": "03/25 07:47", "death": 0, "hospitalized": 8, "dateChecked": "2020-03-25T11:47:00Z", "totalTestsViral": 1760, "positiveTestsViral": null, "negativeTestsViral": null, "positiveCasesViral": 39, "deathConfirmed": null, "deathProbable": null, "totalTestEncountersViral": 1743, "totalTestsPeopleViral": 1701, "totalTestsAntibody": null, "positiveTestsAntibody": null, "negativeTestsAntibody": null, "totalTestsPeopleAntibody": null, "positiveTestsPeopleAntibody": null, "negativeTestsPeopleAntibody": null, "totalTestsPeopleAntigen": null, "positiveTestsPeopleAntigen": null, "totalTestsAntigen": null, "positiveTestsAntigen": null, "fips": "38", "positiveIncrease": 6, "negativeIncrease": 280, "total": 1773, "totalTestResultsIncrease": 287, "posNeg": 1773, "deathIncrease": 0, "hospitalizedIncrease": 3, "hash": "6c0b50b39d383c0a51e44d6a8ef3a28cdc14b678", "commercialScore": 0, "negativeRegularScore": 0, "negativeScore": 0, "positiveScore": 0, "score": 0, "grade": "", "month_number_label": "2020-03", "date_label": "2020-03-25", "week_number_label": "2020W13", "week_start_label": "2020-03-23"}, {"date": 20200326, "state": "ND", "positive": 52, "probableCases": null, "negative": 2039, "pending": null, "totalTestResultsSource": "totalTestEncountersViral", "totalTestResults": 2087, "hospitalizedCurrently": null, "hospitalizedCumulative": 10, "inIcuCurrently": null, "inIcuCumulative": null, "onVentilatorCurrently": null, "onVentilatorCumulative": null, "recovered": null, "dataQualityGrade": "B", "lastUpdateEt": "3/26/2020 11:37", "dateModified": "2020-03-26T11:37:00Z", "checkTimeEt": "03/26 07:37", "death": 0, "hospitalized": 10, "dateChecked": "2020-03-26T11:37:00Z", "totalTestsViral": 2105, "positiveTestsViral": null, "negativeTestsViral": null, "positiveCasesViral": 52, "deathConfirmed": null, "deathProbable": null, "totalTestEncountersViral": 2087, "totalTestsPeopleViral": 2036, "totalTestsAntibody": null, "positiveTestsAntibody": null, "negativeTestsAntibody": null, "totalTestsPeopleAntibody": null, "positiveTestsPeopleAntibody": null, "negativeTestsPeopleAntibody": null, "totalTestsPeopleAntigen": null, "positiveTestsPeopleAntigen": null, "totalTestsAntigen": null, "positiveTestsAntigen": null, "fips": "38", "positiveIncrease": 13, "negativeIncrease": 305, "total": 2091, "totalTestResultsIncrease": 344, "posNeg": 2091, "deathIncrease": 0, "hospitalizedIncrease": 2, "hash": "5dc4f4dadcfec3f86ce333119ac92b47b19ca656", "commercialScore": 0, "negativeRegularScore": 0, "negativeScore": 0, "positiveScore": 0, "score": 0, "grade": "", "month_number_label": "2020-03", "date_label": "2020-03-26", "week_number_label": "2020W13", "week_start_label": "2020-03-23"}, {"date": 20200327, "state": "ND", "positive": 61, "probableCases": null, "negative": 2427, "pending": null, "totalTestResultsSource": "totalTestEncountersViral", "totalTestResults": 2549, "hospitalizedCurrently": null, "hospitalizedCumulative": 13, "inIcuCurrently": null, "inIcuCumulative": null, "onVentilatorCurrently": null, "onVentilatorCumulative": null, "recovered": 15, "dataQualityGrade": "B", "lastUpdateEt": "3/27/2020 11:31", "dateModified": "2020-03-27T11:31:00Z", "checkTimeEt": "03/27 07:31", "death": 0, "hospitalized": 13, "dateChecked": "2020-03-27T11:31:00Z", "totalTestsViral": 2568, "positiveTestsViral": null, "negativeTestsViral": null, "positiveCasesViral": 61, "deathConfirmed": null, "deathProbable": null, "totalTestEncountersViral": 2549, "totalTestsPeopleViral": 2482, "totalTestsAntibody": null, "positiveTestsAntibody": null, "negativeTestsAntibody": null, "totalTestsPeopleAntibody": null, "positiveTestsPeopleAntibody": null, "negativeTestsPeopleAntibody": null, "totalTestsPeopleAntigen": null, "positiveTestsPeopleAntigen": null, "totalTestsAntigen": null, "positiveTestsAntigen": null, "fips": "38", "positiveIncrease": 9, "negativeIncrease": 388, "total": 2488, "totalTestResultsIncrease": 462, "posNeg": 2488, "deathIncrease": 0, "hospitalizedIncrease": 3, "hash": "de1d132a9e5940694fec94ad2b92c5ccef616759", "commercialScore": 0, "negativeRegularScore": 0, "negativeScore": 0, "positiveScore": 0, "score": 0, "grade": "", "month_number_label": "2020-03", "date_label": "2020-03-27", "week_number_label": "2020W13", "week_start_label": "2020-03-23"}, {"date": 20200328, "state": "ND", "positive": 80, "probableCases": null, "negative": 2809, "pending": null, "totalTestResultsSource": "totalTestEncountersViral", "totalTestResults": 3052, "hospitalizedCurrently": null, "hospitalizedCumulative": 16, "inIcuCurrently": null, "inIcuCumulative": null, "onVentilatorCurrently": null, "onVentilatorCumulative": null, "recovered": 16, "dataQualityGrade": "B", "lastUpdateEt": "3/28/2020 12:00", "dateModified": "2020-03-28T12:00:00Z", "checkTimeEt": "03/28 08:00", "death": 1, "hospitalized": 16, "dateChecked": "2020-03-28T12:00:00Z", "totalTestsViral": 3072, "positiveTestsViral": null, "negativeTestsViral": null, "positiveCasesViral": 80, "deathConfirmed": null, "deathProbable": null, "totalTestEncountersViral": 3052, "totalTestsPeopleViral": 2957, "totalTestsAntibody": null, "positiveTestsAntibody": null, "negativeTestsAntibody": null, "totalTestsPeopleAntibody": null, "positiveTestsPeopleAntibody": null, "negativeTestsPeopleAntibody": null, "totalTestsPeopleAntigen": null, "positiveTestsPeopleAntigen": null, "totalTestsAntigen": null, "positiveTestsAntigen": null, "fips": "38", "positiveIncrease": 19, "negativeIncrease": 382, "total": 2889, "totalTestResultsIncrease": 503, "posNeg": 2889, "deathIncrease": 1, "hospitalizedIncrease": 3, "hash": "e602f23f1ba5285debb8b5800ca4bbadc934d9be", "commercialScore": 0, "negativeRegularScore": 0, "negativeScore": 0, "positiveScore": 0, "score": 0, "grade": "", "month_number_label": "2020-03", "date_label": "2020-03-28", "week_number_label": "2020W13", "week_start_label": "2020-03-23"}, {"date": 20200329, "state": "ND", "positive": 97, "probableCases": null, "negative": 3355, "pending": null, "totalTestResultsSource": "totalTestEncountersViral", "totalTestResults": 3574, "hospitalizedCurrently": null, "hospitalizedCumulative": 17, "inIcuCurrently": null, "inIcuCumulative": null, "onVentilatorCurrently": null, "onVentilatorCumulative": null, "recovered": 18, "dataQualityGrade": "B", "lastUpdateEt": "3/29/2020 12:00", "dateModified": "2020-03-29T12:00:00Z", "checkTimeEt": "03/29 08:00", "death": 1, "hospitalized": 17, "dateChecked": "2020-03-29T12:00:00Z", "totalTestsViral": 3597, "positiveTestsViral": null, "negativeTestsViral": null, "positiveCasesViral": 97, "deathConfirmed": null, "deathProbable": null, "totalTestEncountersViral": 3574, "totalTestsPeopleViral": 3459, "totalTestsAntibody": null, "positiveTestsAntibody": null, "negativeTestsAntibody": null, "totalTestsPeopleAntibody": null, "positiveTestsPeopleAntibody": null, "negativeTestsPeopleAntibody": null, "totalTestsPeopleAntigen": null, "positiveTestsPeopleAntigen": null, "totalTestsAntigen": null, "positiveTestsAntigen": null, "fips": "38", "positiveIncrease": 17, "negativeIncrease": 546, "total": 3452, "totalTestResultsIncrease": 522, "posNeg": 3452, "deathIncrease": 0, "hospitalizedIncrease": 1, "hash": "2878b74db65e7184826bd0b9c5532330ab089037", "commercialScore": 0, "negativeRegularScore": 0, "negativeScore": 0, "positiveScore": 0, "score": 0, "grade": "", "month_number_label": "2020-03", "date_label": "2020-03-29", "week_number_label": "2020W13", "week_start_label": "2020-03-23"}, {"date": 20200330, "state": "ND", "positive": 107, "probableCases": null, "negative": 3728, "pending": null, "totalTestResultsSource": "totalTestEncountersViral", "totalTestResults": 3868, "hospitalizedCurrently": null, "hospitalizedCumulative": 19, "inIcuCurrently": null, "inIcuCumulative": null, "onVentilatorCurrently": null, "onVentilatorCumulative": null, "recovered": 19, "dataQualityGrade": "B", "lastUpdateEt": "3/30/2020 12:00", "dateModified": "2020-03-30T12:00:00Z", "checkTimeEt": "03/30 08:00", "death": 2, "hospitalized": 19, "dateChecked": "2020-03-30T12:00:00Z", "totalTestsViral": 3892, "positiveTestsViral": null, "negativeTestsViral": null, "positiveCasesViral": 107, "deathConfirmed": null, "deathProbable": null, "totalTestEncountersViral": 3868, "totalTestsPeopleViral": 3743, "totalTestsAntibody": null, "positiveTestsAntibody": null, "negativeTestsAntibody": null, "totalTestsPeopleAntibody": null, "positiveTestsPeopleAntibody": null, "negativeTestsPeopleAntibody": null, "totalTestsPeopleAntigen": null, "positiveTestsPeopleAntigen": null, "totalTestsAntigen": null, "positiveTestsAntigen": null, "fips": "38", "positiveIncrease": 10, "negativeIncrease": 373, "total": 3835, "totalTestResultsIncrease": 294, "posNeg": 3835, "deathIncrease": 1, "hospitalizedIncrease": 2, "hash": "023e48cfa96f0237df7783d61f9f1f8ce9775fac", "commercialScore": 0, "negativeRegularScore": 0, "negativeScore": 0, "positiveScore": 0, "score": 0, "grade": "", "month_number_label": "2020-03", "date_label": "2020-03-30", "week_number_label": "2020W14", "week_start_label": "2020-03-30"}, {"date": 20200331, "state": "ND", "positive": 117, "probableCases": null, "negative": 4131, "pending": null, "totalTestResultsSource": "totalTestEncountersViral", "totalTestResults": 4075, "hospitalizedCurrently": null, "hospitalizedCumulative": 21, "inIcuCurrently": null, "inIcuCumulative": null, "onVentilatorCurrently": null, "onVentilatorCumulative": null, "recovered": 30, "dataQualityGrade": "B", "lastUpdateEt": "3/31/2020 18:00", "dateModified": "2020-03-31T18:00:00Z", "checkTimeEt": "03/31 14:00", "death": 3, "hospitalized": 21, "dateChecked": "2020-03-31T18:00:00Z", "totalTestsViral": 4098, "positiveTestsViral": null, "negativeTestsViral": null, "positiveCasesViral": 117, "deathConfirmed": null, "deathProbable": null, "totalTestEncountersViral": 4075, "totalTestsPeopleViral": 3942, "totalTestsAntibody": null, "positiveTestsAntibody": null, "negativeTestsAntibody": null, "totalTestsPeopleAntibody": null, "positiveTestsPeopleAntibody": null, "negativeTestsPeopleAntibody": null, "totalTestsPeopleAntigen": null, "positiveTestsPeopleAntigen": null, "totalTestsAntigen": null, "positiveTestsAntigen": null, "fips": "38", "positiveIncrease": 10, "negativeIncrease": 403, "total": 4248, "totalTestResultsIncrease": 207, "posNeg": 4248, "deathIncrease": 1, "hospitalizedIncrease": 2, "hash": "c2fe42f07e836495ca4d7ef4d39f566f070a3289", "commercialScore": 0, "negativeRegularScore": 0, "negativeScore": 0, "positiveScore": 0, "score": 0, "grade": "", "month_number_label": "2020-03", "date_label": "2020-03-31", "week_number_label": "2020W14", "week_start_label": "2020-03-30"}, {"date": 20200401, "state": "ND", "positive": 139, "probableCases": null, "negative": 4351, "pending": null, "totalTestResultsSource": "totalTestEncountersViral", "totalTestResults": 4640, "hospitalizedCurrently": null, "hospitalizedCumulative": 23, "inIcuCurrently": null, "inIcuCumulative": null, "onVentilatorCurrently": null, "onVentilatorCumulative": null, "recovered": 34, "dataQualityGrade": "B", "lastUpdateEt": "4/1/2020 12:00", "dateModified": "2020-04-01T12:00:00Z", "checkTimeEt": "04/01 08:00", "death": 3, "hospitalized": 23, "dateChecked": "2020-04-01T12:00:00Z", "totalTestsViral": 4666, "positiveTestsViral": null, "negativeTestsViral": null, "positiveCasesViral": 139, "deathConfirmed": null, "deathProbable": null, "totalTestEncountersViral": 4640, "totalTestsPeopleViral": 4478, "totalTestsAntibody": null, "positiveTestsAntibody": null, "negativeTestsAntibody": null, "totalTestsPeopleAntibody": null, "positiveTestsPeopleAntibody": null, "negativeTestsPeopleAntibody": null, "totalTestsPeopleAntigen": null, "positiveTestsPeopleAntigen": null, "totalTestsAntigen": null, "positiveTestsAntigen": null, "fips": "38", "positiveIncrease": 22, "negativeIncrease": 220, "total": 4490, "totalTestResultsIncrease": 565, "posNeg": 4490, "deathIncrease": 0, "hospitalizedIncrease": 2, "hash": "09e0585b87b7864aa4261b5aac0e55836ddda767", "commercialScore": 0, "negativeRegularScore": 0, "negativeScore": 0, "positiveScore": 0, "score": 0, "grade": "", "month_number_label": "2020-04", "date_label": "2020-04-01", "week_number_label": "2020W14", "week_start_label": "2020-03-30"}, {"date": 20200402, "state": "ND", "positive": 159, "probableCases": null, "negative": 4821, "pending": null, "totalTestResultsSource": "totalTestEncountersViral", "totalTestResults": 5289, "hospitalizedCurrently": null, "hospitalizedCumulative": 28, "inIcuCurrently": null, "inIcuCumulative": null, "onVentilatorCurrently": null, "onVentilatorCumulative": null, "recovered": 43, "dataQualityGrade": "B", "lastUpdateEt": "4/2/2020 12:56", "dateModified": "2020-04-02T12:56:00Z", "checkTimeEt": "04/02 08:56", "death": 3, "hospitalized": 28, "dateChecked": "2020-04-02T12:56:00Z", "totalTestsViral": 5321, "positiveTestsViral": null, "negativeTestsViral": null, "positiveCasesViral": 159, "deathConfirmed": null, "deathProbable": null, "totalTestEncountersViral": 5289, "totalTestsPeopleViral": 5090, "totalTestsAntibody": null, "positiveTestsAntibody": null, "negativeTestsAntibody": null, "totalTestsPeopleAntibody": null, "positiveTestsPeopleAntibody": null, "negativeTestsPeopleAntibody": null, "totalTestsPeopleAntigen": null, "positiveTestsPeopleAntigen": null, "totalTestsAntigen": null, "positiveTestsAntigen": null, "fips": "38", "positiveIncrease": 20, "negativeIncrease": 470, "total": 4980, "totalTestResultsIncrease": 649, "posNeg": 4980, "deathIncrease": 0, "hospitalizedIncrease": 5, "hash": "f45aad9e8a2b904c03e83cfc186ae3abbc51147e", "commercialScore": 0, "negativeRegularScore": 0, "negativeScore": 0, "positiveScore": 0, "score": 0, "grade": "", "month_number_label": "2020-04", "date_label": "2020-04-02", "week_number_label": "2020W14", "week_start_label": "2020-03-30"}, {"date": 20200403, "state": "ND", "positive": 173, "probableCases": null, "negative": 5625, "pending": null, "totalTestResultsSource": "totalTestEncountersViral", "totalTestResults": 5824, "hospitalizedCurrently": null, "hospitalizedCumulative": 29, "inIcuCurrently": null, "inIcuCumulative": null, "onVentilatorCurrently": null, "onVentilatorCumulative": null, "recovered": 55, "dataQualityGrade": "B", "lastUpdateEt": "4/3/2020 13:50", "dateModified": "2020-04-03T13:50:00Z", "checkTimeEt": "04/03 09:50", "death": 3, "hospitalized": 29, "dateChecked": "2020-04-03T13:50:00Z", "totalTestsViral": 5857, "positiveTestsViral": null, "negativeTestsViral": null, "positiveCasesViral": 173, "deathConfirmed": null, "deathProbable": null, "totalTestEncountersViral": 5824, "totalTestsPeopleViral": 5598, "totalTestsAntibody": null, "positiveTestsAntibody": null, "negativeTestsAntibody": null, "totalTestsPeopleAntibody": null, "positiveTestsPeopleAntibody": null, "negativeTestsPeopleAntibody": null, "totalTestsPeopleAntigen": null, "positiveTestsPeopleAntigen": null, "totalTestsAntigen": null, "positiveTestsAntigen": null, "fips": "38", "positiveIncrease": 14, "negativeIncrease": 804, "total": 5798, "totalTestResultsIncrease": 535, "posNeg": 5798, "deathIncrease": 0, "hospitalizedIncrease": 1, "hash": "5946f644af123e2dc24059e009e5b07d275ac3f7", "commercialScore": 0, "negativeRegularScore": 0, "negativeScore": 0, "positiveScore": 0, "score": 0, "grade": "", "month_number_label": "2020-04", "date_label": "2020-04-03", "week_number_label": "2020W14", "week_start_label": "2020-03-30"}, {"date": 20200404, "state": "ND", "positive": 186, "probableCases": null, "negative": 6021, "pending": null, "totalTestResultsSource": "totalTestEncountersViral", "totalTestResults": 6320, "hospitalizedCurrently": null, "hospitalizedCumulative": 30, "inIcuCurrently": null, "inIcuCumulative": null, "onVentilatorCurrently": null, "onVentilatorCumulative": null, "recovered": 63, "dataQualityGrade": "B", "lastUpdateEt": "4/4/2020 13:00", "dateModified": "2020-04-04T13:00:00Z", "checkTimeEt": "04/04 09:00", "death": 3, "hospitalized": 30, "dateChecked": "2020-04-04T13:00:00Z", "totalTestsViral": 6361, "positiveTestsViral": null, "negativeTestsViral": null, "positiveCasesViral": 186, "deathConfirmed": null, "deathProbable": null, "totalTestEncountersViral": 6320, "totalTestsPeopleViral": 6064, "totalTestsAntibody": null, "positiveTestsAntibody": null, "negativeTestsAntibody": null, "totalTestsPeopleAntibody": null, "positiveTestsPeopleAntibody": null, "negativeTestsPeopleAntibody": null, "totalTestsPeopleAntigen": null, "positiveTestsPeopleAntigen": null, "totalTestsAntigen": null, "positiveTestsAntigen": null, "fips": "38", "positiveIncrease": 13, "negativeIncrease": 396, "total": 6207, "totalTestResultsIncrease": 496, "posNeg": 6207, "deathIncrease": 0, "hospitalizedIncrease": 1, "hash": "dd1654d2f8d96bb664e542b6d32a559180095729", "commercialScore": 0, "negativeRegularScore": 0, "negativeScore": 0, "positiveScore": 0, "score": 0, "grade": "", "month_number_label": "2020-04", "date_label": "2020-04-04", "week_number_label": "2020W14", "week_start_label": "2020-03-30"}, {"date": 20200405, "state": "ND", "positive": 207, "probableCases": null, "negative": 6580, "pending": null, "totalTestResultsSource": "totalTestEncountersViral", "totalTestResults": 6760, "hospitalizedCurrently": 20, "hospitalizedCumulative": 31, "inIcuCurrently": null, "inIcuCumulative": null, "onVentilatorCurrently": null, "onVentilatorCumulative": null, "recovered": 63, "dataQualityGrade": "B", "lastUpdateEt": "4/5/2020 12:51", "dateModified": "2020-04-05T12:51:00Z", "checkTimeEt": "04/05 08:51", "death": 3, "hospitalized": 31, "dateChecked": "2020-04-05T12:51:00Z", "totalTestsViral": 6807, "positiveTestsViral": null, "negativeTestsViral": null, "positiveCasesViral": 207, "deathConfirmed": null, "deathProbable": null, "totalTestEncountersViral": 6760, "totalTestsPeopleViral": 6476, "totalTestsAntibody": null, "positiveTestsAntibody": null, "negativeTestsAntibody": null, "totalTestsPeopleAntibody": null, "positiveTestsPeopleAntibody": null, "negativeTestsPeopleAntibody": null, "totalTestsPeopleAntigen": null, "positiveTestsPeopleAntigen": null, "totalTestsAntigen": null, "positiveTestsAntigen": null, "fips": "38", "positiveIncrease": 21, "negativeIncrease": 559, "total": 6787, "totalTestResultsIncrease": 440, "posNeg": 6787, "deathIncrease": 0, "hospitalizedIncrease": 1, "hash": "1faad4cbef45f338bffa25d2436dbe38942740df", "commercialScore": 0, "negativeRegularScore": 0, "negativeScore": 0, "positiveScore": 0, "score": 0, "grade": "", "month_number_label": "2020-04", "date_label": "2020-04-05", "week_number_label": "2020W14", "week_start_label": "2020-03-30"}, {"date": 20200406, "state": "ND", "positive": 225, "probableCases": null, "negative": 6988, "pending": null, "totalTestResultsSource": "totalTestEncountersViral", "totalTestResults": 7117, "hospitalizedCurrently": 19, "hospitalizedCumulative": 32, "inIcuCurrently": null, "inIcuCumulative": null, "onVentilatorCurrently": null, "onVentilatorCumulative": null, "recovered": 74, "dataQualityGrade": "B", "lastUpdateEt": "4/6/2020 13:05", "dateModified": "2020-04-06T13:05:00Z", "checkTimeEt": "04/06 09:05", "death": 3, "hospitalized": 32, "dateChecked": "2020-04-06T13:05:00Z", "totalTestsViral": 7169, "positiveTestsViral": null, "negativeTestsViral": null, "positiveCasesViral": 225, "deathConfirmed": null, "deathProbable": null, "totalTestEncountersViral": 7117, "totalTestsPeopleViral": 6815, "totalTestsAntibody": null, "positiveTestsAntibody": null, "negativeTestsAntibody": null, "totalTestsPeopleAntibody": null, "positiveTestsPeopleAntibody": null, "negativeTestsPeopleAntibody": null, "totalTestsPeopleAntigen": null, "positiveTestsPeopleAntigen": null, "totalTestsAntigen": null, "positiveTestsAntigen": null, "fips": "38", "positiveIncrease": 18, "negativeIncrease": 408, "total": 7213, "totalTestResultsIncrease": 357, "posNeg": 7213, "deathIncrease": 0, "hospitalizedIncrease": 1, "hash": "92b1d422f0a955498dabe679a89b987ac75808f6", "commercialScore": 0, "negativeRegularScore": 0, "negativeScore": 0, "positiveScore": 0, "score": 0, "grade": "", "month_number_label": "2020-04", "date_label": "2020-04-06", "week_number_label": "2020W15", "week_start_label": "2020-04-06"}, {"date": 20200407, "state": "ND", "positive": 237, "probableCases": null, "negative": 7466, "pending": null, "totalTestResultsSource": "totalTestEncountersViral", "totalTestResults": 7554, "hospitalizedCurrently": 18, "hospitalizedCumulative": 33, "inIcuCurrently": null, "inIcuCumulative": null, "onVentilatorCurrently": null, "onVentilatorCumulative": null, "recovered": 82, "dataQualityGrade": "B", "lastUpdateEt": "4/7/2020 13:00", "dateModified": "2020-04-07T13:00:00Z", "checkTimeEt": "04/07 09:00", "death": 4, "hospitalized": 33, "dateChecked": "2020-04-07T13:00:00Z", "totalTestsViral": 7612, "positiveTestsViral": null, "negativeTestsViral": null, "positiveCasesViral": 237, "deathConfirmed": null, "deathProbable": null, "totalTestEncountersViral": 7554, "totalTestsPeopleViral": 7231, "totalTestsAntibody": null, "positiveTestsAntibody": null, "negativeTestsAntibody": null, "totalTestsPeopleAntibody": null, "positiveTestsPeopleAntibody": null, "negativeTestsPeopleAntibody": null, "totalTestsPeopleAntigen": null, "positiveTestsPeopleAntigen": null, "totalTestsAntigen": null, "positiveTestsAntigen": null, "fips": "38", "positiveIncrease": 12, "negativeIncrease": 478, "total": 7703, "totalTestResultsIncrease": 437, "posNeg": 7703, "deathIncrease": 1, "hospitalizedIncrease": 1, "hash": "440c0798853e4eaa1284c62ab6826995050f8239", "commercialScore": 0, "negativeRegularScore": 0, "negativeScore": 0, "positiveScore": 0, "score": 0, "grade": "", "month_number_label": "2020-04", "date_label": "2020-04-07", "week_number_label": "2020W15", "week_start_label": "2020-04-06"}, {"date": 20200408, "state": "ND", "positive": 251, "probableCases": null, "negative": 8301, "pending": null, "totalTestResultsSource": "totalTestEncountersViral", "totalTestResults": 8431, "hospitalizedCurrently": 16, "hospitalizedCumulative": 34, "inIcuCurrently": null, "inIcuCumulative": null, "onVentilatorCurrently": null, "onVentilatorCumulative": null, "recovered": 98, "dataQualityGrade": "B", "lastUpdateEt": "4/8/2020 13:54", "dateModified": "2020-04-08T13:54:00Z", "checkTimeEt": "04/08 09:54", "death": 4, "hospitalized": 34, "dateChecked": "2020-04-08T13:54:00Z", "totalTestsViral": 8496, "positiveTestsViral": null, "negativeTestsViral": null, "positiveCasesViral": 251, "deathConfirmed": null, "deathProbable": null, "totalTestEncountersViral": 8431, "totalTestsPeopleViral": 8059, "totalTestsAntibody": null, "positiveTestsAntibody": null, "negativeTestsAntibody": null, "totalTestsPeopleAntibody": null, "positiveTestsPeopleAntibody": null, "negativeTestsPeopleAntibody": null, "totalTestsPeopleAntigen": null, "positiveTestsPeopleAntigen": null, "totalTestsAntigen": null, "positiveTestsAntigen": null, "fips": "38", "positiveIncrease": 14, "negativeIncrease": 835, "total": 8552, "totalTestResultsIncrease": 877, "posNeg": 8552, "deathIncrease": 0, "hospitalizedIncrease": 1, "hash": "1db28df6919c272320781813f11e6fb4c71f6e04", "commercialScore": 0, "negativeRegularScore": 0, "negativeScore": 0, "positiveScore": 0, "score": 0, "grade": "", "month_number_label": "2020-04", "date_label": "2020-04-08", "week_number_label": "2020W15", "week_start_label": "2020-04-06"}, {"date": 20200409, "state": "ND", "positive": 269, "probableCases": null, "negative": 8721, "pending": null, "totalTestResultsSource": "totalTestEncountersViral", "totalTestResults": 8974, "hospitalizedCurrently": 14, "hospitalizedCumulative": 34, "inIcuCurrently": null, "inIcuCumulative": null, "onVentilatorCurrently": null, "onVentilatorCumulative": null, "recovered": 101, "dataQualityGrade": "B", "lastUpdateEt": "4/9/2020 13:00", "dateModified": "2020-04-09T13:00:00Z", "checkTimeEt": "04/09 09:00", "death": 5, "hospitalized": 34, "dateChecked": "2020-04-09T13:00:00Z", "totalTestsViral": 9046, "positiveTestsViral": null, "negativeTestsViral": null, "positiveCasesViral": 269, "deathConfirmed": null, "deathProbable": null, "totalTestEncountersViral": 8974, "totalTestsPeopleViral": 8557, "totalTestsAntibody": null, "positiveTestsAntibody": null, "negativeTestsAntibody": null, "totalTestsPeopleAntibody": null, "positiveTestsPeopleAntibody": null, "negativeTestsPeopleAntibody": null, "totalTestsPeopleAntigen": null, "positiveTestsPeopleAntigen": null, "totalTestsAntigen": null, "positiveTestsAntigen": null, "fips": "38", "positiveIncrease": 18, "negativeIncrease": 420, "total": 8990, "totalTestResultsIncrease": 543, "posNeg": 8990, "deathIncrease": 1, "hospitalizedIncrease": 0, "hash": "6351d12a1da6d50679bfbcf9d3beed3f069a0353", "commercialScore": 0, "negativeRegularScore": 0, "negativeScore": 0, "positiveScore": 0, "score": 0, "grade": "", "month_number_label": "2020-04", "date_label": "2020-04-09", "week_number_label": "2020W15", "week_start_label": "2020-04-06"}, {"date": 20200410, "state": "ND", "positive": 278, "probableCases": null, "negative": 9330, "pending": null, "totalTestResultsSource": "totalTestEncountersViral", "totalTestResults": 9401, "hospitalizedCurrently": 13, "hospitalizedCumulative": 36, "inIcuCurrently": null, "inIcuCumulative": null, "onVentilatorCurrently": null, "onVentilatorCumulative": null, "recovered": 105, "dataQualityGrade": "B", "lastUpdateEt": "4/10/2020 13:00", "dateModified": "2020-04-10T13:00:00Z", "checkTimeEt": "04/10 09:00", "death": 6, "hospitalized": 36, "dateChecked": "2020-04-10T13:00:00Z", "totalTestsViral": 9478, "positiveTestsViral": null, "negativeTestsViral": null, "positiveCasesViral": 278, "deathConfirmed": null, "deathProbable": null, "totalTestEncountersViral": 9401, "totalTestsPeopleViral": 8956, "totalTestsAntibody": null, "positiveTestsAntibody": null, "negativeTestsAntibody": null, "totalTestsPeopleAntibody": null, "positiveTestsPeopleAntibody": null, "negativeTestsPeopleAntibody": null, "totalTestsPeopleAntigen": null, "positiveTestsPeopleAntigen": null, "totalTestsAntigen": null, "positiveTestsAntigen": null, "fips": "38", "positiveIncrease": 9, "negativeIncrease": 609, "total": 9608, "totalTestResultsIncrease": 427, "posNeg": 9608, "deathIncrease": 1, "hospitalizedIncrease": 2, "hash": "ef566fea81d18bcbe65a802ee644109a06997b82", "commercialScore": 0, "negativeRegularScore": 0, "negativeScore": 0, "positiveScore": 0, "score": 0, "grade": "", "month_number_label": "2020-04", "date_label": "2020-04-10", "week_number_label": "2020W15", "week_start_label": "2020-04-06"}, {"date": 20200411, "state": "ND", "positive": 293, "probableCases": null, "negative": 9787, "pending": null, "totalTestResultsSource": "totalTestEncountersViral", "totalTestResults": 10011, "hospitalizedCurrently": 10, "hospitalizedCumulative": 36, "inIcuCurrently": null, "inIcuCumulative": null, "onVentilatorCurrently": null, "onVentilatorCumulative": null, "recovered": 119, "dataQualityGrade": "B", "lastUpdateEt": "4/11/2020 13:00", "dateModified": "2020-04-11T13:00:00Z", "checkTimeEt": "04/11 09:00", "death": 7, "hospitalized": 36, "dateChecked": "2020-04-11T13:00:00Z", "totalTestsViral": 10094, "positiveTestsViral": null, "negativeTestsViral": null, "positiveCasesViral": 293, "deathConfirmed": null, "deathProbable": null, "totalTestEncountersViral": 10011, "totalTestsPeopleViral": 9517, "totalTestsAntibody": null, "positiveTestsAntibody": null, "negativeTestsAntibody": null, "totalTestsPeopleAntibody": null, "positiveTestsPeopleAntibody": null, "negativeTestsPeopleAntibody": null, "totalTestsPeopleAntigen": null, "positiveTestsPeopleAntigen": null, "totalTestsAntigen": null, "positiveTestsAntigen": null, "fips": "38", "positiveIncrease": 15, "negativeIncrease": 457, "total": 10080, "totalTestResultsIncrease": 610, "posNeg": 10080, "deathIncrease": 1, "hospitalizedIncrease": 0, "hash": "a1dbf8c4fde1ae6c6db40090b7b4ba3e31fbd643", "commercialScore": 0, "negativeRegularScore": 0, "negativeScore": 0, "positiveScore": 0, "score": 0, "grade": "", "month_number_label": "2020-04", "date_label": "2020-04-11", "week_number_label": "2020W15", "week_start_label": "2020-04-06"}, {"date": 20200412, "state": "ND", "positive": 308, "probableCases": null, "negative": 10042, "pending": null, "totalTestResultsSource": "totalTestEncountersViral", "totalTestResults": 10407, "hospitalizedCurrently": 12, "hospitalizedCumulative": 39, "inIcuCurrently": null, "inIcuCumulative": null, "onVentilatorCurrently": null, "onVentilatorCumulative": null, "recovered": 121, "dataQualityGrade": "B", "lastUpdateEt": "4/12/2020 12:58", "dateModified": "2020-04-12T12:58:00Z", "checkTimeEt": "04/12 08:58", "death": 8, "hospitalized": 39, "dateChecked": "2020-04-12T12:58:00Z", "totalTestsViral": 10495, "positiveTestsViral": null, "negativeTestsViral": null, "positiveCasesViral": 308, "deathConfirmed": null, "deathProbable": null, "totalTestEncountersViral": 10407, "totalTestsPeopleViral": 9884, "totalTestsAntibody": null, "positiveTestsAntibody": null, "negativeTestsAntibody": null, "totalTestsPeopleAntibody": null, "positiveTestsPeopleAntibody": null, "negativeTestsPeopleAntibody": null, "totalTestsPeopleAntigen": null, "positiveTestsPeopleAntigen": null, "totalTestsAntigen": null, "positiveTestsAntigen": null, "fips": "38", "positiveIncrease": 15, "negativeIncrease": 255, "total": 10350, "totalTestResultsIncrease": 396, "posNeg": 10350, "deathIncrease": 1, "hospitalizedIncrease": 3, "hash": "930288f7cbeb8f7c728c2c40aa0e5ac6349f37fa", "commercialScore": 0, "negativeRegularScore": 0, "negativeScore": 0, "positiveScore": 0, "score": 0, "grade": "", "month_number_label": "2020-04", "date_label": "2020-04-12", "week_number_label": "2020W15", "week_start_label": "2020-04-06"}, {"date": 20200413, "state": "ND", "positive": 331, "probableCases": null, "negative": 10450, "pending": null, "totalTestResultsSource": "totalTestEncountersViral", "totalTestResults": 10864, "hospitalizedCurrently": 13, "hospitalizedCumulative": 40, "inIcuCurrently": null, "inIcuCumulative": null, "onVentilatorCurrently": null, "onVentilatorCumulative": null, "recovered": 127, "dataQualityGrade": "B", "lastUpdateEt": "4/13/2020 13:00", "dateModified": "2020-04-13T13:00:00Z", "checkTimeEt": "04/13 09:00", "death": 8, "hospitalized": 40, "dateChecked": "2020-04-13T13:00:00Z", "totalTestsViral": 10960, "positiveTestsViral": null, "negativeTestsViral": null, "positiveCasesViral": 331, "deathConfirmed": null, "deathProbable": null, "totalTestEncountersViral": 10864, "totalTestsPeopleViral": 10307, "totalTestsAntibody": null, "positiveTestsAntibody": null, "negativeTestsAntibody": null, "totalTestsPeopleAntibody": null, "positiveTestsPeopleAntibody": null, "negativeTestsPeopleAntibody": null, "totalTestsPeopleAntigen": null, "positiveTestsPeopleAntigen": null, "totalTestsAntigen": null, "positiveTestsAntigen": null, "fips": "38", "positiveIncrease": 23, "negativeIncrease": 408, "total": 10781, "totalTestResultsIncrease": 457, "posNeg": 10781, "deathIncrease": 0, "hospitalizedIncrease": 1, "hash": "bab73cfa96f1bb2df0453b93c3052f08ec63a417", "commercialScore": 0, "negativeRegularScore": 0, "negativeScore": 0, "positiveScore": 0, "score": 0, "grade": "", "month_number_label": "2020-04", "date_label": "2020-04-13", "week_number_label": "2020W16", "week_start_label": "2020-04-13"}, {"date": 20200414, "state": "ND", "positive": 341, "probableCases": null, "negative": 10575, "pending": null, "totalTestResultsSource": "totalTestEncountersViral", "totalTestResults": 11070, "hospitalizedCurrently": 13, "hospitalizedCumulative": 42, "inIcuCurrently": null, "inIcuCumulative": null, "onVentilatorCurrently": null, "onVentilatorCumulative": null, "recovered": 138, "dataQualityGrade": "B", "lastUpdateEt": "4/14/2020 13:00", "dateModified": "2020-04-14T13:00:00Z", "checkTimeEt": "04/14 09:00", "death": 9, "hospitalized": 42, "dateChecked": "2020-04-14T13:00:00Z", "totalTestsViral": 11169, "positiveTestsViral": null, "negativeTestsViral": null, "positiveCasesViral": 341, "deathConfirmed": null, "deathProbable": null, "totalTestEncountersViral": 11070, "totalTestsPeopleViral": 10492, "totalTestsAntibody": null, "positiveTestsAntibody": null, "negativeTestsAntibody": null, "totalTestsPeopleAntibody": null, "positiveTestsPeopleAntibody": null, "negativeTestsPeopleAntibody": null, "totalTestsPeopleAntigen": null, "positiveTestsPeopleAntigen": null, "totalTestsAntigen": null, "positiveTestsAntigen": null, "fips": "38", "positiveIncrease": 10, "negativeIncrease": 125, "total": 10916, "totalTestResultsIncrease": 206, "posNeg": 10916, "deathIncrease": 1, "hospitalizedIncrease": 2, "hash": "140a53cf19e5f7430d84b326d01047a56f78736a", "commercialScore": 0, "negativeRegularScore": 0, "negativeScore": 0, "positiveScore": 0, "score": 0, "grade": "", "month_number_label": "2020-04", "date_label": "2020-04-14", "week_number_label": "2020W16", "week_start_label": "2020-04-13"}, {"date": 20200415, "state": "ND", "positive": 364, "probableCases": null, "negative": 10952, "pending": null, "totalTestResultsSource": "totalTestEncountersViral", "totalTestResults": 11410, "hospitalizedCurrently": 13, "hospitalizedCumulative": 44, "inIcuCurrently": null, "inIcuCumulative": null, "onVentilatorCurrently": null, "onVentilatorCumulative": null, "recovered": 142, "dataQualityGrade": "B", "lastUpdateEt": "4/15/2020 13:00", "dateModified": "2020-04-15T13:00:00Z", "checkTimeEt": "04/15 09:00", "death": 9, "hospitalized": 44, "dateChecked": "2020-04-15T13:00:00Z", "totalTestsViral": 11519, "positiveTestsViral": null, "negativeTestsViral": null, "positiveCasesViral": 364, "deathConfirmed": null, "deathProbable": null, "totalTestEncountersViral": 11410, "totalTestsPeopleViral": 10772, "totalTestsAntibody": null, "positiveTestsAntibody": null, "negativeTestsAntibody": null, "totalTestsPeopleAntibody": null, "positiveTestsPeopleAntibody": null, "negativeTestsPeopleAntibody": null, "totalTestsPeopleAntigen": null, "positiveTestsPeopleAntigen": null, "totalTestsAntigen": null, "positiveTestsAntigen": null, "fips": "38", "positiveIncrease": 23, "negativeIncrease": 377, "total": 11316, "totalTestResultsIncrease": 340, "posNeg": 11316, "deathIncrease": 0, "hospitalizedIncrease": 2, "hash": "f94028e2cef73843b1d56917856fe21539744791", "commercialScore": 0, "negativeRegularScore": 0, "negativeScore": 0, "positiveScore": 0, "score": 0, "grade": "", "month_number_label": "2020-04", "date_label": "2020-04-15", "week_number_label": "2020W16", "week_start_label": "2020-04-13"}, {"date": 20200416, "state": "ND", "positive": 392, "probableCases": null, "negative": 11311, "pending": null, "totalTestResultsSource": "totalTestEncountersViral", "totalTestResults": 11810, "hospitalizedCurrently": 14, "hospitalizedCumulative": 45, "inIcuCurrently": null, "inIcuCumulative": null, "onVentilatorCurrently": null, "onVentilatorCumulative": null, "recovered": 163, "dataQualityGrade": "B", "lastUpdateEt": "4/16/2020 13:00", "dateModified": "2020-04-16T13:00:00Z", "checkTimeEt": "04/16 09:00", "death": 9, "hospitalized": 45, "dateChecked": "2020-04-16T13:00:00Z", "totalTestsViral": 11932, "positiveTestsViral": null, "negativeTestsViral": null, "positiveCasesViral": 392, "deathConfirmed": null, "deathProbable": null, "totalTestEncountersViral": 11810, "totalTestsPeopleViral": 11114, "totalTestsAntibody": null, "positiveTestsAntibody": null, "negativeTestsAntibody": null, "totalTestsPeopleAntibody": null, "positiveTestsPeopleAntibody": null, "negativeTestsPeopleAntibody": null, "totalTestsPeopleAntigen": null, "positiveTestsPeopleAntigen": null, "totalTestsAntigen": null, "positiveTestsAntigen": null, "fips": "38", "positiveIncrease": 28, "negativeIncrease": 359, "total": 11703, "totalTestResultsIncrease": 400, "posNeg": 11703, "deathIncrease": 0, "hospitalizedIncrease": 1, "hash": "743386850e3b57153e7d73598860ce656fee9d75", "commercialScore": 0, "negativeRegularScore": 0, "negativeScore": 0, "positiveScore": 0, "score": 0, "grade": "", "month_number_label": "2020-04", "date_label": "2020-04-16", "week_number_label": "2020W16", "week_start_label": "2020-04-13"}, {"date": 20200417, "state": "ND", "positive": 438, "probableCases": null, "negative": 11903, "pending": null, "totalTestResultsSource": "totalTestEncountersViral", "totalTestResults": 12629, "hospitalizedCurrently": 16, "hospitalizedCumulative": 47, "inIcuCurrently": null, "inIcuCumulative": null, "onVentilatorCurrently": null, "onVentilatorCumulative": null, "recovered": 172, "dataQualityGrade": "B", "lastUpdateEt": "4/17/2020 13:00", "dateModified": "2020-04-17T13:00:00Z", "checkTimeEt": "04/17 09:00", "death": 9, "hospitalized": 47, "dateChecked": "2020-04-17T13:00:00Z", "totalTestsViral": 12790, "positiveTestsViral": null, "negativeTestsViral": null, "positiveCasesViral": 438, "deathConfirmed": null, "deathProbable": null, "totalTestEncountersViral": 12629, "totalTestsPeopleViral": 11825, "totalTestsAntibody": null, "positiveTestsAntibody": null, "negativeTestsAntibody": null, "totalTestsPeopleAntibody": null, "positiveTestsPeopleAntibody": null, "negativeTestsPeopleAntibody": null, "totalTestsPeopleAntigen": null, "positiveTestsPeopleAntigen": null, "totalTestsAntigen": null, "positiveTestsAntigen": null, "fips": "38", "positiveIncrease": 46, "negativeIncrease": 592, "total": 12341, "totalTestResultsIncrease": 819, "posNeg": 12341, "deathIncrease": 0, "hospitalizedIncrease": 2, "hash": "82d87d04b2a63958c9d2789ac0bebb7046d6852f", "commercialScore": 0, "negativeRegularScore": 0, "negativeScore": 0, "positiveScore": 0, "score": 0, "grade": "", "month_number_label": "2020-04", "date_label": "2020-04-17", "week_number_label": "2020W16", "week_start_label": "2020-04-13"}, {"date": 20200418, "state": "ND", "positive": 528, "probableCases": null, "negative": 12435, "pending": null, "totalTestResultsSource": "totalTestEncountersViral", "totalTestResults": 13325, "hospitalizedCurrently": 13, "hospitalizedCumulative": 47, "inIcuCurrently": null, "inIcuCumulative": null, "onVentilatorCurrently": null, "onVentilatorCumulative": null, "recovered": 183, "dataQualityGrade": "B", "lastUpdateEt": "4/18/2020 13:08", "dateModified": "2020-04-18T13:08:00Z", "checkTimeEt": "04/18 09:08", "death": 9, "hospitalized": 47, "dateChecked": "2020-04-18T13:08:00Z", "totalTestsViral": 13503, "positiveTestsViral": null, "negativeTestsViral": null, "positiveCasesViral": 528, "deathConfirmed": null, "deathProbable": null, "totalTestEncountersViral": 13325, "totalTestsPeopleViral": 12459, "totalTestsAntibody": null, "positiveTestsAntibody": null, "negativeTestsAntibody": null, "totalTestsPeopleAntibody": null, "positiveTestsPeopleAntibody": null, "negativeTestsPeopleAntibody": null, "totalTestsPeopleAntigen": null, "positiveTestsPeopleAntigen": null, "totalTestsAntigen": null, "positiveTestsAntigen": null, "fips": "38", "positiveIncrease": 90, "negativeIncrease": 532, "total": 12963, "totalTestResultsIncrease": 696, "posNeg": 12963, "deathIncrease": 0, "hospitalizedIncrease": 0, "hash": "99688f03fcc89c2672093b5869a9487d9fa2c91b", "commercialScore": 0, "negativeRegularScore": 0, "negativeScore": 0, "positiveScore": 0, "score": 0, "grade": "", "month_number_label": "2020-04", "date_label": "2020-04-18", "week_number_label": "2020W16", "week_start_label": "2020-04-13"}, {"date": 20200419, "state": "ND", "positive": 584, "probableCases": null, "negative": 13045, "pending": null, "totalTestResultsSource": "totalTestEncountersViral", "totalTestResults": 14257, "hospitalizedCurrently": 15, "hospitalizedCumulative": 51, "inIcuCurrently": null, "inIcuCumulative": null, "onVentilatorCurrently": null, "onVentilatorCumulative": null, "recovered": 189, "dataQualityGrade": "B", "lastUpdateEt": "4/19/2020 13:00", "dateModified": "2020-04-19T13:00:00Z", "checkTimeEt": "04/19 09:00", "death": 10, "hospitalized": 51, "dateChecked": "2020-04-19T13:00:00Z", "totalTestsViral": 14458, "positiveTestsViral": null, "negativeTestsViral": null, "positiveCasesViral": 584, "deathConfirmed": null, "deathProbable": null, "totalTestEncountersViral": 14257, "totalTestsPeopleViral": 13277, "totalTestsAntibody": null, "positiveTestsAntibody": null, "negativeTestsAntibody": null, "totalTestsPeopleAntibody": null, "positiveTestsPeopleAntibody": null, "negativeTestsPeopleAntibody": null, "totalTestsPeopleAntigen": null, "positiveTestsPeopleAntigen": null, "totalTestsAntigen": null, "positiveTestsAntigen": null, "fips": "38", "positiveIncrease": 56, "negativeIncrease": 610, "total": 13629, "totalTestResultsIncrease": 932, "posNeg": 13629, "deathIncrease": 1, "hospitalizedIncrease": 4, "hash": "617db3bb8646c385e1021828ff119ac47d3b0b9c", "commercialScore": 0, "negativeRegularScore": 0, "negativeScore": 0, "positiveScore": 0, "score": 0, "grade": "", "month_number_label": "2020-04", "date_label": "2020-04-19", "week_number_label": "2020W16", "week_start_label": "2020-04-13"}, {"date": 20200420, "state": "ND", "positive": 626, "probableCases": null, "negative": 14120, "pending": null, "totalTestResultsSource": "totalTestEncountersViral", "totalTestResults": 15150, "hospitalizedCurrently": 17, "hospitalizedCumulative": 53, "inIcuCurrently": null, "inIcuCumulative": null, "onVentilatorCurrently": null, "onVentilatorCumulative": null, "recovered": 189, "dataQualityGrade": "B", "lastUpdateEt": "4/20/2020 13:00", "dateModified": "2020-04-20T13:00:00Z", "checkTimeEt": "04/20 09:00", "death": 13, "hospitalized": 53, "dateChecked": "2020-04-20T13:00:00Z", "totalTestsViral": 15370, "positiveTestsViral": null, "negativeTestsViral": null, "positiveCasesViral": 626, "deathConfirmed": null, "deathProbable": null, "totalTestEncountersViral": 15150, "totalTestsPeopleViral": 14028, "totalTestsAntibody": null, "positiveTestsAntibody": null, "negativeTestsAntibody": null, "totalTestsPeopleAntibody": null, "positiveTestsPeopleAntibody": null, "negativeTestsPeopleAntibody": null, "totalTestsPeopleAntigen": null, "positiveTestsPeopleAntigen": null, "totalTestsAntigen": null, "positiveTestsAntigen": null, "fips": "38", "positiveIncrease": 42, "negativeIncrease": 1075, "total": 14746, "totalTestResultsIncrease": 893, "posNeg": 14746, "deathIncrease": 3, "hospitalizedIncrease": 2, "hash": "5449c70194715642b17983adec146af1ed22f41f", "commercialScore": 0, "negativeRegularScore": 0, "negativeScore": 0, "positiveScore": 0, "score": 0, "grade": "", "month_number_label": "2020-04", "date_label": "2020-04-20", "week_number_label": "2020W17", "week_start_label": "2020-04-20"}, {"date": 20200421, "state": "ND", "positive": 644, "probableCases": null, "negative": 14343, "pending": null, "totalTestResultsSource": "totalTestEncountersViral", "totalTestResults": 15419, "hospitalizedCurrently": 17, "hospitalizedCumulative": 54, "inIcuCurrently": null, "inIcuCumulative": null, "onVentilatorCurrently": null, "onVentilatorCumulative": null, "recovered": 214, "dataQualityGrade": "B", "lastUpdateEt": "4/20/2020 13:17", "dateModified": "2020-04-20T13:17:00Z", "checkTimeEt": "04/20 09:17", "death": 13, "hospitalized": 54, "dateChecked": "2020-04-20T13:17:00Z", "totalTestsViral": 15642, "positiveTestsViral": null, "negativeTestsViral": null, "positiveCasesViral": 644, "deathConfirmed": null, "deathProbable": null, "totalTestEncountersViral": 15419, "totalTestsPeopleViral": 14230, "totalTestsAntibody": null, "positiveTestsAntibody": null, "negativeTestsAntibody": null, "totalTestsPeopleAntibody": null, "positiveTestsPeopleAntibody": null, "negativeTestsPeopleAntibody": null, "totalTestsPeopleAntigen": null, "positiveTestsPeopleAntigen": null, "totalTestsAntigen": null, "positiveTestsAntigen": null, "fips": "38", "positiveIncrease": 18, "negativeIncrease": 223, "total": 14987, "totalTestResultsIncrease": 269, "posNeg": 14987, "deathIncrease": 0, "hospitalizedIncrease": 1, "hash": "e5f1dda0a5001dc783cbd4d2f1d94e305b3decc8", "commercialScore": 0, "negativeRegularScore": 0, "negativeScore": 0, "positiveScore": 0, "score": 0, "grade": "", "month_number_label": "2020-04", "date_label": "2020-04-21", "week_number_label": "2020W17", "week_start_label": "2020-04-20"}, {"date": 20200422, "state": "ND", "positive": 677, "probableCases": null, "negative": 14910, "pending": null, "totalTestResultsSource": "totalTestEncountersViral", "totalTestResults": 16096, "hospitalizedCurrently": 23, "hospitalizedCumulative": 62, "inIcuCurrently": null, "inIcuCumulative": null, "onVentilatorCurrently": null, "onVentilatorCumulative": null, "recovered": 229, "dataQualityGrade": "B", "lastUpdateEt": "4/22/2020 13:10", "dateModified": "2020-04-22T13:10:00Z", "checkTimeEt": "04/22 09:10", "death": 14, "hospitalized": 62, "dateChecked": "2020-04-22T13:10:00Z", "totalTestsViral": 16348, "positiveTestsViral": null, "negativeTestsViral": null, "positiveCasesViral": 677, "deathConfirmed": null, "deathProbable": null, "totalTestEncountersViral": 16096, "totalTestsPeopleViral": 14811, "totalTestsAntibody": null, "positiveTestsAntibody": null, "negativeTestsAntibody": null, "totalTestsPeopleAntibody": null, "positiveTestsPeopleAntibody": null, "negativeTestsPeopleAntibody": null, "totalTestsPeopleAntigen": null, "positiveTestsPeopleAntigen": null, "totalTestsAntigen": null, "positiveTestsAntigen": null, "fips": "38", "positiveIncrease": 33, "negativeIncrease": 567, "total": 15587, "totalTestResultsIncrease": 677, "posNeg": 15587, "deathIncrease": 1, "hospitalizedIncrease": 8, "hash": "7bd0873569994a462e2261c5468d1cda7a30a955", "commercialScore": 0, "negativeRegularScore": 0, "negativeScore": 0, "positiveScore": 0, "score": 0, "grade": "", "month_number_label": "2020-04", "date_label": "2020-04-22", "week_number_label": "2020W17", "week_start_label": "2020-04-20"}, {"date": 20200423, "state": "ND", "positive": 709, "probableCases": null, "negative": 15621, "pending": null, "totalTestResultsSource": "totalTestEncountersViral", "totalTestResults": 16916, "hospitalizedCurrently": 18, "hospitalizedCumulative": 65, "inIcuCurrently": null, "inIcuCumulative": null, "onVentilatorCurrently": null, "onVentilatorCumulative": null, "recovered": 269, "dataQualityGrade": "B", "lastUpdateEt": "4/23/2020 13:02", "dateModified": "2020-04-23T13:02:00Z", "checkTimeEt": "04/23 09:02", "death": 15, "hospitalized": 65, "dateChecked": "2020-04-23T13:02:00Z", "totalTestsViral": 17177, "positiveTestsViral": null, "negativeTestsViral": null, "positiveCasesViral": 709, "deathConfirmed": null, "deathProbable": null, "totalTestEncountersViral": 16916, "totalTestsPeopleViral": 15558, "totalTestsAntibody": null, "positiveTestsAntibody": null, "negativeTestsAntibody": null, "totalTestsPeopleAntibody": null, "positiveTestsPeopleAntibody": null, "negativeTestsPeopleAntibody": null, "totalTestsPeopleAntigen": null, "positiveTestsPeopleAntigen": null, "totalTestsAntigen": null, "positiveTestsAntigen": null, "fips": "38", "positiveIncrease": 32, "negativeIncrease": 711, "total": 16330, "totalTestResultsIncrease": 820, "posNeg": 16330, "deathIncrease": 1, "hospitalizedIncrease": 3, "hash": "24a3cdbde41d3f63a04094ad09450d94c0724926", "commercialScore": 0, "negativeRegularScore": 0, "negativeScore": 0, "positiveScore": 0, "score": 0, "grade": "", "month_number_label": "2020-04", "date_label": "2020-04-23", "week_number_label": "2020W17", "week_start_label": "2020-04-20"}, {"date": 20200424, "state": "ND", "positive": 747, "probableCases": null, "negative": 16701, "pending": null, "totalTestResultsSource": "totalTestEncountersViral", "totalTestResults": 18251, "hospitalizedCurrently": 17, "hospitalizedCumulative": 67, "inIcuCurrently": null, "inIcuCumulative": null, "onVentilatorCurrently": null, "onVentilatorCumulative": null, "recovered": 285, "dataQualityGrade": "B", "lastUpdateEt": "4/24/2020 13:00", "dateModified": "2020-04-24T13:00:00Z", "checkTimeEt": "04/24 09:00", "death": 15, "hospitalized": 67, "dateChecked": "2020-04-24T13:00:00Z", "totalTestsViral": 18545, "positiveTestsViral": null, "negativeTestsViral": null, "positiveCasesViral": 747, "deathConfirmed": null, "deathProbable": null, "totalTestEncountersViral": 18251, "totalTestsPeopleViral": 16679, "totalTestsAntibody": null, "positiveTestsAntibody": null, "negativeTestsAntibody": null, "totalTestsPeopleAntibody": null, "positiveTestsPeopleAntibody": null, "negativeTestsPeopleAntibody": null, "totalTestsPeopleAntigen": null, "positiveTestsPeopleAntigen": null, "totalTestsAntigen": null, "positiveTestsAntigen": null, "fips": "38", "positiveIncrease": 38, "negativeIncrease": 1080, "total": 17448, "totalTestResultsIncrease": 1335, "posNeg": 17448, "deathIncrease": 0, "hospitalizedIncrease": 2, "hash": "377b026ccb15c42caa43fda0d6261405c44aaa02", "commercialScore": 0, "negativeRegularScore": 0, "negativeScore": 0, "positiveScore": 0, "score": 0, "grade": "", "month_number_label": "2020-04", "date_label": "2020-04-24", "week_number_label": "2020W17", "week_start_label": "2020-04-20"}, {"date": 20200425, "state": "ND", "positive": 803, "probableCases": null, "negative": 18547, "pending": null, "totalTestResultsSource": "totalTestEncountersViral", "totalTestResults": 20293, "hospitalizedCurrently": 17, "hospitalizedCumulative": 70, "inIcuCurrently": null, "inIcuCumulative": null, "onVentilatorCurrently": null, "onVentilatorCumulative": null, "recovered": 310, "dataQualityGrade": "C", "lastUpdateEt": "4/25/2020 13:00", "dateModified": "2020-04-25T13:00:00Z", "checkTimeEt": "04/25 09:00", "death": 16, "hospitalized": 70, "dateChecked": "2020-04-25T13:00:00Z", "totalTestsViral": 20602, "positiveTestsViral": null, "negativeTestsViral": null, "positiveCasesViral": 803, "deathConfirmed": null, "deathProbable": null, "totalTestEncountersViral": 20293, "totalTestsPeopleViral": 18483, "totalTestsAntibody": null, "positiveTestsAntibody": null, "negativeTestsAntibody": null, "totalTestsPeopleAntibody": null, "positiveTestsPeopleAntibody": null, "negativeTestsPeopleAntibody": null, "totalTestsPeopleAntigen": null, "positiveTestsPeopleAntigen": null, "totalTestsAntigen": null, "positiveTestsAntigen": null, "fips": "38", "positiveIncrease": 56, "negativeIncrease": 1846, "total": 19350, "totalTestResultsIncrease": 2042, "posNeg": 19350, "deathIncrease": 1, "hospitalizedIncrease": 3, "hash": "39a5e3680273e6a8246a5890404613e947a80798", "commercialScore": 0, "negativeRegularScore": 0, "negativeScore": 0, "positiveScore": 0, "score": 0, "grade": "", "month_number_label": "2020-04", "date_label": "2020-04-25", "week_number_label": "2020W17", "week_start_label": "2020-04-20"}, {"date": 20200426, "state": "ND", "positive": 867, "probableCases": null, "negative": 19850, "pending": null, "totalTestResultsSource": "totalTestEncountersViral", "totalTestResults": 21481, "hospitalizedCurrently": 18, "hospitalizedCumulative": 71, "inIcuCurrently": null, "inIcuCumulative": null, "onVentilatorCurrently": null, "onVentilatorCumulative": null, "recovered": 326, "dataQualityGrade": "C", "lastUpdateEt": "4/26/2020 13:00", "dateModified": "2020-04-26T13:00:00Z", "checkTimeEt": "04/26 09:00", "death": 17, "hospitalized": 71, "dateChecked": "2020-04-26T13:00:00Z", "totalTestsViral": 21797, "positiveTestsViral": null, "negativeTestsViral": null, "positiveCasesViral": 867, "deathConfirmed": null, "deathProbable": null, "totalTestEncountersViral": 21481, "totalTestsPeopleViral": 19628, "totalTestsAntibody": null, "positiveTestsAntibody": null, "negativeTestsAntibody": null, "totalTestsPeopleAntibody": null, "positiveTestsPeopleAntibody": null, "negativeTestsPeopleAntibody": null, "totalTestsPeopleAntigen": null, "positiveTestsPeopleAntigen": null, "totalTestsAntigen": null, "positiveTestsAntigen": null, "fips": "38", "positiveIncrease": 64, "negativeIncrease": 1303, "total": 20717, "totalTestResultsIncrease": 1188, "posNeg": 20717, "deathIncrease": 1, "hospitalizedIncrease": 1, "hash": "0acba92d9016242bc8c9b50cf443112cc535091b", "commercialScore": 0, "negativeRegularScore": 0, "negativeScore": 0, "positiveScore": 0, "score": 0, "grade": "", "month_number_label": "2020-04", "date_label": "2020-04-26", "week_number_label": "2020W17", "week_start_label": "2020-04-20"}, {"date": 20200427, "state": "ND", "positive": 942, "probableCases": null, "negative": 21492, "pending": null, "totalTestResultsSource": "totalTestEncountersViral", "totalTestResults": 23475, "hospitalizedCurrently": 23, "hospitalizedCumulative": 77, "inIcuCurrently": null, "inIcuCumulative": null, "onVentilatorCurrently": null, "onVentilatorCumulative": null, "recovered": 350, "dataQualityGrade": "C", "lastUpdateEt": "4/27/2020 13:00", "dateModified": "2020-04-27T13:00:00Z", "checkTimeEt": "04/27 09:00", "death": 19, "hospitalized": 77, "dateChecked": "2020-04-27T13:00:00Z", "totalTestsViral": 23831, "positiveTestsViral": null, "negativeTestsViral": null, "positiveCasesViral": 942, "deathConfirmed": null, "deathProbable": null, "totalTestEncountersViral": 23475, "totalTestsPeopleViral": 21497, "totalTestsAntibody": null, "positiveTestsAntibody": null, "negativeTestsAntibody": null, "totalTestsPeopleAntibody": null, "positiveTestsPeopleAntibody": null, "negativeTestsPeopleAntibody": null, "totalTestsPeopleAntigen": null, "positiveTestsPeopleAntigen": null, "totalTestsAntigen": null, "positiveTestsAntigen": null, "fips": "38", "positiveIncrease": 75, "negativeIncrease": 1642, "total": 22434, "totalTestResultsIncrease": 1994, "posNeg": 22434, "deathIncrease": 2, "hospitalizedIncrease": 6, "hash": "f4d26d64f056ccc9e02eabf35c957a8783567ac8", "commercialScore": 0, "negativeRegularScore": 0, "negativeScore": 0, "positiveScore": 0, "score": 0, "grade": "", "month_number_label": "2020-04", "date_label": "2020-04-27", "week_number_label": "2020W18", "week_start_label": "2020-04-27"}, {"date": 20200428, "state": "ND", "positive": 991, "probableCases": null, "negative": 22732, "pending": null, "totalTestResultsSource": "totalTestEncountersViral", "totalTestResults": 24929, "hospitalizedCurrently": 25, "hospitalizedCumulative": 79, "inIcuCurrently": null, "inIcuCumulative": null, "onVentilatorCurrently": null, "onVentilatorCumulative": null, "recovered": 409, "dataQualityGrade": "C", "lastUpdateEt": "4/28/2020 13:00", "dateModified": "2020-04-28T13:00:00Z", "checkTimeEt": "04/28 09:00", "death": 19, "hospitalized": 79, "dateChecked": "2020-04-28T13:00:00Z", "totalTestsViral": 25316, "positiveTestsViral": null, "negativeTestsViral": null, "positiveCasesViral": 991, "deathConfirmed": null, "deathProbable": null, "totalTestEncountersViral": 24929, "totalTestsPeopleViral": 22768, "totalTestsAntibody": null, "positiveTestsAntibody": null, "negativeTestsAntibody": null, "totalTestsPeopleAntibody": null, "positiveTestsPeopleAntibody": null, "negativeTestsPeopleAntibody": null, "totalTestsPeopleAntigen": null, "positiveTestsPeopleAntigen": null, "totalTestsAntigen": null, "positiveTestsAntigen": null, "fips": "38", "positiveIncrease": 49, "negativeIncrease": 1240, "total": 23723, "totalTestResultsIncrease": 1454, "posNeg": 23723, "deathIncrease": 0, "hospitalizedIncrease": 2, "hash": "0203f5ee3b2440f33975641ea668886a0142ad3d", "commercialScore": 0, "negativeRegularScore": 0, "negativeScore": 0, "positiveScore": 0, "score": 0, "grade": "", "month_number_label": "2020-04", "date_label": "2020-04-28", "week_number_label": "2020W18", "week_start_label": "2020-04-27"}, {"date": 20200429, "state": "ND", "positive": 1033, "probableCases": null, "negative": 24503, "pending": null, "totalTestResultsSource": "totalTestEncountersViral", "totalTestResults": 26973, "hospitalizedCurrently": 28, "hospitalizedCumulative": 82, "inIcuCurrently": null, "inIcuCumulative": null, "onVentilatorCurrently": null, "onVentilatorCumulative": null, "recovered": 437, "dataQualityGrade": "C", "lastUpdateEt": "4/29/2020 13:00", "dateModified": "2020-04-29T13:00:00Z", "checkTimeEt": "04/29 09:00", "death": 19, "hospitalized": 82, "dateChecked": "2020-04-29T13:00:00Z", "totalTestsViral": 27388, "positiveTestsViral": null, "negativeTestsViral": null, "positiveCasesViral": 1033, "deathConfirmed": null, "deathProbable": null, "totalTestEncountersViral": 26973, "totalTestsPeopleViral": 24522, "totalTestsAntibody": null, "positiveTestsAntibody": null, "negativeTestsAntibody": null, "totalTestsPeopleAntibody": null, "positiveTestsPeopleAntibody": null, "negativeTestsPeopleAntibody": null, "totalTestsPeopleAntigen": null, "positiveTestsPeopleAntigen": null, "totalTestsAntigen": null, "positiveTestsAntigen": null, "fips": "38", "positiveIncrease": 42, "negativeIncrease": 1771, "total": 25536, "totalTestResultsIncrease": 2044, "posNeg": 25536, "deathIncrease": 0, "hospitalizedIncrease": 3, "hash": "161cd8bb8b5d7f649649bc143484877565e38f34", "commercialScore": 0, "negativeRegularScore": 0, "negativeScore": 0, "positiveScore": 0, "score": 0, "grade": "", "month_number_label": "2020-04", "date_label": "2020-04-29", "week_number_label": "2020W18", "week_start_label": "2020-04-27"}, {"date": 20200430, "state": "ND", "positive": 1067, "probableCases": null, "negative": 26393, "pending": null, "totalTestResultsSource": "totalTestEncountersViral", "totalTestResults": 29003, "hospitalizedCurrently": 30, "hospitalizedCumulative": 85, "inIcuCurrently": null, "inIcuCumulative": null, "onVentilatorCurrently": null, "onVentilatorCumulative": null, "recovered": 458, "dataQualityGrade": "C", "lastUpdateEt": "4/30/2020 13:00", "dateModified": "2020-04-30T13:00:00Z", "checkTimeEt": "04/30 09:00", "death": 19, "hospitalized": 85, "dateChecked": "2020-04-30T13:00:00Z", "totalTestsViral": 29439, "positiveTestsViral": null, "negativeTestsViral": null, "positiveCasesViral": 1067, "deathConfirmed": null, "deathProbable": null, "totalTestEncountersViral": 29003, "totalTestsPeopleViral": 26353, "totalTestsAntibody": null, "positiveTestsAntibody": null, "negativeTestsAntibody": null, "totalTestsPeopleAntibody": null, "positiveTestsPeopleAntibody": null, "negativeTestsPeopleAntibody": null, "totalTestsPeopleAntigen": null, "positiveTestsPeopleAntigen": null, "totalTestsAntigen": null, "positiveTestsAntigen": null, "fips": "38", "positiveIncrease": 34, "negativeIncrease": 1890, "total": 27460, "totalTestResultsIncrease": 2030, "posNeg": 27460, "deathIncrease": 0, "hospitalizedIncrease": 3, "hash": "6dcb2b581c4458373e1ac649f8473b7890744c27", "commercialScore": 0, "negativeRegularScore": 0, "negativeScore": 0, "positiveScore": 0, "score": 0, "grade": "", "month_number_label": "2020-04", "date_label": "2020-04-30", "week_number_label": "2020W18", "week_start_label": "2020-04-27"}, {"date": 20200501, "state": "ND", "positive": 1107, "probableCases": null, "negative": 28418, "pending": null, "totalTestResultsSource": "totalTestEncountersViral", "totalTestResults": 31092, "hospitalizedCurrently": 27, "hospitalizedCumulative": 86, "inIcuCurrently": null, "inIcuCumulative": null, "onVentilatorCurrently": null, "onVentilatorCumulative": null, "recovered": 482, "dataQualityGrade": "C", "lastUpdateEt": "5/1/2020 13:00", "dateModified": "2020-05-01T13:00:00Z", "checkTimeEt": "05/01 09:00", "death": 23, "hospitalized": 86, "dateChecked": "2020-05-01T13:00:00Z", "totalTestsViral": 31566, "positiveTestsViral": null, "negativeTestsViral": null, "positiveCasesViral": 1107, "deathConfirmed": null, "deathProbable": null, "totalTestEncountersViral": 31092, "totalTestsPeopleViral": 28341, "totalTestsAntibody": null, "positiveTestsAntibody": null, "negativeTestsAntibody": null, "totalTestsPeopleAntibody": null, "positiveTestsPeopleAntibody": null, "negativeTestsPeopleAntibody": null, "totalTestsPeopleAntigen": null, "positiveTestsPeopleAntigen": null, "totalTestsAntigen": null, "positiveTestsAntigen": null, "fips": "38", "positiveIncrease": 40, "negativeIncrease": 2025, "total": 29525, "totalTestResultsIncrease": 2089, "posNeg": 29525, "deathIncrease": 4, "hospitalizedIncrease": 1, "hash": "c43f07aeca5572312a26a9d54fa366bb1f762c23", "commercialScore": 0, "negativeRegularScore": 0, "negativeScore": 0, "positiveScore": 0, "score": 0, "grade": "", "month_number_label": "2020-05", "date_label": "2020-05-01", "week_number_label": "2020W18", "week_start_label": "2020-04-27"}, {"date": 20200502, "state": "ND", "positive": 1153, "probableCases": null, "negative": 30394, "pending": null, "totalTestResultsSource": "totalTestEncountersViral", "totalTestResults": 33206, "hospitalizedCurrently": 32, "hospitalizedCumulative": 90, "inIcuCurrently": null, "inIcuCumulative": null, "onVentilatorCurrently": null, "onVentilatorCumulative": null, "recovered": 510, "dataQualityGrade": "C", "lastUpdateEt": "5/2/2020 13:00", "dateModified": "2020-05-02T13:00:00Z", "checkTimeEt": "05/02 09:00", "death": 24, "hospitalized": 90, "dateChecked": "2020-05-02T13:00:00Z", "totalTestsViral": 33722, "positiveTestsViral": null, "negativeTestsViral": null, "positiveCasesViral": 1153, "deathConfirmed": null, "deathProbable": null, "totalTestEncountersViral": 33206, "totalTestsPeopleViral": 30332, "totalTestsAntibody": null, "positiveTestsAntibody": null, "negativeTestsAntibody": null, "totalTestsPeopleAntibody": null, "positiveTestsPeopleAntibody": null, "negativeTestsPeopleAntibody": null, "totalTestsPeopleAntigen": null, "positiveTestsPeopleAntigen": null, "totalTestsAntigen": null, "positiveTestsAntigen": null, "fips": "38", "positiveIncrease": 46, "negativeIncrease": 1976, "total": 31547, "totalTestResultsIncrease": 2114, "posNeg": 31547, "deathIncrease": 1, "hospitalizedIncrease": 4, "hash": "6bd7d497dd42193a5b2f4dc72cf4a6ab3a699f7a", "commercialScore": 0, "negativeRegularScore": 0, "negativeScore": 0, "positiveScore": 0, "score": 0, "grade": "", "month_number_label": "2020-05", "date_label": "2020-05-02", "week_number_label": "2020W18", "week_start_label": "2020-04-27"}, {"date": 20200503, "state": "ND", "positive": 1191, "probableCases": null, "negative": 32162, "pending": null, "totalTestResultsSource": "totalTestEncountersViral", "totalTestResults": 35095, "hospitalizedCurrently": 31, "hospitalizedCumulative": 90, "inIcuCurrently": null, "inIcuCumulative": null, "onVentilatorCurrently": null, "onVentilatorCumulative": null, "recovered": 517, "dataQualityGrade": "C", "lastUpdateEt": "5/3/2020 13:00", "dateModified": "2020-05-03T13:00:00Z", "checkTimeEt": "05/03 09:00", "death": 25, "hospitalized": 90, "dateChecked": "2020-05-03T13:00:00Z", "totalTestsViral": 35636, "positiveTestsViral": null, "negativeTestsViral": null, "positiveCasesViral": 1191, "deathConfirmed": 25, "deathProbable": null, "totalTestEncountersViral": 35095, "totalTestsPeopleViral": 32083, "totalTestsAntibody": null, "positiveTestsAntibody": null, "negativeTestsAntibody": null, "totalTestsPeopleAntibody": null, "positiveTestsPeopleAntibody": null, "negativeTestsPeopleAntibody": null, "totalTestsPeopleAntigen": null, "positiveTestsPeopleAntigen": null, "totalTestsAntigen": null, "positiveTestsAntigen": null, "fips": "38", "positiveIncrease": 38, "negativeIncrease": 1768, "total": 33353, "totalTestResultsIncrease": 1889, "posNeg": 33353, "deathIncrease": 1, "hospitalizedIncrease": 0, "hash": "bba81b20b083193971f42116360668f1d1aa3c7f", "commercialScore": 0, "negativeRegularScore": 0, "negativeScore": 0, "positiveScore": 0, "score": 0, "grade": "", "month_number_label": "2020-05", "date_label": "2020-05-03", "week_number_label": "2020W18", "week_start_label": "2020-04-27"}, {"date": 20200504, "state": "ND", "positive": 1225, "probableCases": null, "negative": 33529, "pending": null, "totalTestResultsSource": "totalTestEncountersViral", "totalTestResults": 36556, "hospitalizedCurrently": 31, "hospitalizedCumulative": 94, "inIcuCurrently": null, "inIcuCumulative": null, "onVentilatorCurrently": null, "onVentilatorCumulative": null, "recovered": 540, "dataQualityGrade": "C", "lastUpdateEt": "5/4/2020 13:00", "dateModified": "2020-05-04T13:00:00Z", "checkTimeEt": "05/04 09:00", "death": 25, "hospitalized": 94, "dateChecked": "2020-05-04T13:00:00Z", "totalTestsViral": 37122, "positiveTestsViral": null, "negativeTestsViral": null, "positiveCasesViral": 1225, "deathConfirmed": 25, "deathProbable": null, "totalTestEncountersViral": 36556, "totalTestsPeopleViral": 33441, "totalTestsAntibody": null, "positiveTestsAntibody": null, "negativeTestsAntibody": null, "totalTestsPeopleAntibody": null, "positiveTestsPeopleAntibody": null, "negativeTestsPeopleAntibody": null, "totalTestsPeopleAntigen": null, "positiveTestsPeopleAntigen": null, "totalTestsAntigen": null, "positiveTestsAntigen": null, "fips": "38", "positiveIncrease": 34, "negativeIncrease": 1367, "total": 34754, "totalTestResultsIncrease": 1461, "posNeg": 34754, "deathIncrease": 0, "hospitalizedIncrease": 4, "hash": "485ad0c30f6ebcabf108b8ece3e5e21faf1e50d0", "commercialScore": 0, "negativeRegularScore": 0, "negativeScore": 0, "positiveScore": 0, "score": 0, "grade": "", "month_number_label": "2020-05", "date_label": "2020-05-04", "week_number_label": "2020W19", "week_start_label": "2020-05-04"}, {"date": 20200505, "state": "ND", "positive": 1266, "probableCases": null, "negative": 35155, "pending": null, "totalTestResultsSource": "totalTestEncountersViral", "totalTestResults": 38434, "hospitalizedCurrently": 31, "hospitalizedCumulative": 95, "inIcuCurrently": null, "inIcuCumulative": null, "onVentilatorCurrently": null, "onVentilatorCumulative": null, "recovered": 559, "dataQualityGrade": "C", "lastUpdateEt": "5/5/2020 13:00", "dateModified": "2020-05-05T13:00:00Z", "checkTimeEt": "05/05 09:00", "death": 25, "hospitalized": 95, "dateChecked": "2020-05-05T13:00:00Z", "totalTestsViral": 39019, "positiveTestsViral": null, "negativeTestsViral": null, "positiveCasesViral": 1266, "deathConfirmed": 25, "deathProbable": null, "totalTestEncountersViral": 38434, "totalTestsPeopleViral": 35051, "totalTestsAntibody": null, "positiveTestsAntibody": null, "negativeTestsAntibody": null, "totalTestsPeopleAntibody": null, "positiveTestsPeopleAntibody": null, "negativeTestsPeopleAntibody": null, "totalTestsPeopleAntigen": null, "positiveTestsPeopleAntigen": null, "totalTestsAntigen": null, "positiveTestsAntigen": null, "fips": "38", "positiveIncrease": 41, "negativeIncrease": 1626, "total": 36421, "totalTestResultsIncrease": 1878, "posNeg": 36421, "deathIncrease": 0, "hospitalizedIncrease": 1, "hash": "31924721cd5d8a7adeb1f2817f5e4f95e36a5c71", "commercialScore": 0, "negativeRegularScore": 0, "negativeScore": 0, "positiveScore": 0, "score": 0, "grade": "", "month_number_label": "2020-05", "date_label": "2020-05-05", "week_number_label": "2020W19", "week_start_label": "2020-05-04"}, {"date": 20200506, "state": "ND", "positive": 1322, "probableCases": null, "negative": 37309, "pending": null, "totalTestResultsSource": "totalTestEncountersViral", "totalTestResults": 40988, "hospitalizedCurrently": 32, "hospitalizedCumulative": 97, "inIcuCurrently": null, "inIcuCumulative": null, "onVentilatorCurrently": null, "onVentilatorCumulative": null, "recovered": 582, "dataQualityGrade": "C", "lastUpdateEt": "5/6/2020 13:00", "dateModified": "2020-05-06T13:00:00Z", "checkTimeEt": "05/06 09:00", "death": 31, "hospitalized": 97, "dateChecked": "2020-05-06T13:00:00Z", "totalTestsViral": 41601, "positiveTestsViral": null, "negativeTestsViral": null, "positiveCasesViral": 1322, "deathConfirmed": 31, "deathProbable": null, "totalTestEncountersViral": 40988, "totalTestsPeopleViral": 37173, "totalTestsAntibody": null, "positiveTestsAntibody": null, "negativeTestsAntibody": null, "totalTestsPeopleAntibody": null, "positiveTestsPeopleAntibody": null, "negativeTestsPeopleAntibody": null, "totalTestsPeopleAntigen": null, "positiveTestsPeopleAntigen": null, "totalTestsAntigen": null, "positiveTestsAntigen": null, "fips": "38", "positiveIncrease": 56, "negativeIncrease": 2154, "total": 38631, "totalTestResultsIncrease": 2554, "posNeg": 38631, "deathIncrease": 6, "hospitalizedIncrease": 2, "hash": "127d38a6a70fdb06ab732dc2baacdcf5a7c44273", "commercialScore": 0, "negativeRegularScore": 0, "negativeScore": 0, "positiveScore": 0, "score": 0, "grade": "", "month_number_label": "2020-05", "date_label": "2020-05-06", "week_number_label": "2020W19", "week_start_label": "2020-05-04"}, {"date": 20200507, "state": "ND", "positive": 1371, "probableCases": null, "negative": 39496, "pending": null, "totalTestResultsSource": "totalTestEncountersViral", "totalTestResults": 43506, "hospitalizedCurrently": 35, "hospitalizedCumulative": 102, "inIcuCurrently": null, "inIcuCumulative": null, "onVentilatorCurrently": null, "onVentilatorCumulative": null, "recovered": 601, "dataQualityGrade": "C", "lastUpdateEt": "5/7/2020 13:00", "dateModified": "2020-05-07T13:00:00Z", "checkTimeEt": "05/07 09:00", "death": 31, "hospitalized": 102, "dateChecked": "2020-05-07T13:00:00Z", "totalTestsViral": 44167, "positiveTestsViral": null, "negativeTestsViral": null, "positiveCasesViral": 1371, "deathConfirmed": 31, "deathProbable": null, "totalTestEncountersViral": 43506, "totalTestsPeopleViral": 39374, "totalTestsAntibody": null, "positiveTestsAntibody": null, "negativeTestsAntibody": null, "totalTestsPeopleAntibody": null, "positiveTestsPeopleAntibody": null, "negativeTestsPeopleAntibody": null, "totalTestsPeopleAntigen": null, "positiveTestsPeopleAntigen": null, "totalTestsAntigen": null, "positiveTestsAntigen": null, "fips": "38", "positiveIncrease": 49, "negativeIncrease": 2187, "total": 40867, "totalTestResultsIncrease": 2518, "posNeg": 40867, "deathIncrease": 0, "hospitalizedIncrease": 5, "hash": "be6b1d118ee5a1d0c6167410d41911c01fc53b21", "commercialScore": 0, "negativeRegularScore": 0, "negativeScore": 0, "positiveScore": 0, "score": 0, "grade": "", "month_number_label": "2020-05", "date_label": "2020-05-07", "week_number_label": "2020W19", "week_start_label": "2020-05-04"}, {"date": 20200508, "state": "ND", "positive": 1424, "probableCases": null, "negative": 41076, "pending": null, "totalTestResultsSource": "totalTestEncountersViral", "totalTestResults": 45424, "hospitalizedCurrently": 33, "hospitalizedCumulative": 104, "inIcuCurrently": null, "inIcuCumulative": null, "onVentilatorCurrently": null, "onVentilatorCumulative": null, "recovered": 714, "dataQualityGrade": "C", "lastUpdateEt": "5/8/2020 13:00", "dateModified": "2020-05-08T13:00:00Z", "checkTimeEt": "05/08 09:00", "death": 33, "hospitalized": 104, "dateChecked": "2020-05-08T13:00:00Z", "totalTestsViral": 46137, "positiveTestsViral": null, "negativeTestsViral": null, "positiveCasesViral": 1424, "deathConfirmed": 33, "deathProbable": null, "totalTestEncountersViral": 45424, "totalTestsPeopleViral": 41013, "totalTestsAntibody": null, "positiveTestsAntibody": null, "negativeTestsAntibody": null, "totalTestsPeopleAntibody": null, "positiveTestsPeopleAntibody": null, "negativeTestsPeopleAntibody": null, "totalTestsPeopleAntigen": null, "positiveTestsPeopleAntigen": null, "totalTestsAntigen": null, "positiveTestsAntigen": null, "fips": "38", "positiveIncrease": 53, "negativeIncrease": 1580, "total": 42500, "totalTestResultsIncrease": 1918, "posNeg": 42500, "deathIncrease": 2, "hospitalizedIncrease": 2, "hash": "2148654b87e11a18313dd7421dd97f3bca27f839", "commercialScore": 0, "negativeRegularScore": 0, "negativeScore": 0, "positiveScore": 0, "score": 0, "grade": "", "month_number_label": "2020-05", "date_label": "2020-05-08", "week_number_label": "2020