[{"date": 20200304, "state": "GA", "positive": 2, "probableCases": null, "negative": null, "pending": null, "totalTestResultsSource": "totalTestsViral", "totalTestResults": 0, "hospitalizedCurrently": null, "hospitalizedCumulative": null, "inIcuCurrently": null, "inIcuCumulative": null, "onVentilatorCurrently": null, "onVentilatorCumulative": null, "recovered": null, "dataQualityGrade": null, "lastUpdateEt": null, "dateModified": null, "checkTimeEt": null, "death": null, "hospitalized": null, "dateChecked": null, "totalTestsViral": 0, "positiveTestsViral": 0, "negativeTestsViral": null, "positiveCasesViral": null, "deathConfirmed": null, "deathProbable": null, "totalTestEncountersViral": null, "totalTestsPeopleViral": null, "totalTestsAntibody": null, "positiveTestsAntibody": null, "negativeTestsAntibody": null, "totalTestsPeopleAntibody": null, "positiveTestsPeopleAntibody": null, "negativeTestsPeopleAntibody": null, "totalTestsPeopleAntigen": null, "positiveTestsPeopleAntigen": null, "totalTestsAntigen": null, "positiveTestsAntigen": null, "fips": "13", "positiveIncrease": 0, "negativeIncrease": 0, "total": 2, "totalTestResultsIncrease": 0, "posNeg": 2, "deathIncrease": 0, "hospitalizedIncrease": 0, "hash": "e7c94fed3ddfaf6f8cf6ff72d38f2cee08fbbd32", "commercialScore": 0, "negativeRegularScore": 0, "negativeScore": 0, "positiveScore": 0, "score": 0, "grade": "", "month_number_label": "2020-03", "date_label": "2020-03-04", "week_number_label": "2020W10", "week_start_label": "2020-03-02"}, {"date": 20200305, "state": "GA", "positive": 2, "probableCases": null, "negative": null, "pending": null, "totalTestResultsSource": "totalTestsViral", "totalTestResults": 0, "hospitalizedCurrently": null, "hospitalizedCumulative": null, "inIcuCurrently": null, "inIcuCumulative": null, "onVentilatorCurrently": null, "onVentilatorCumulative": null, "recovered": null, "dataQualityGrade": null, "lastUpdateEt": null, "dateModified": null, "checkTimeEt": null, "death": null, "hospitalized": null, "dateChecked": null, "totalTestsViral": 0, "positiveTestsViral": 0, "negativeTestsViral": null, "positiveCasesViral": null, "deathConfirmed": null, "deathProbable": null, "totalTestEncountersViral": null, "totalTestsPeopleViral": null, "totalTestsAntibody": null, "positiveTestsAntibody": null, "negativeTestsAntibody": null, "totalTestsPeopleAntibody": null, "positiveTestsPeopleAntibody": null, "negativeTestsPeopleAntibody": null, "totalTestsPeopleAntigen": null, "positiveTestsPeopleAntigen": null, "totalTestsAntigen": null, "positiveTestsAntigen": null, "fips": "13", "positiveIncrease": 0, "negativeIncrease": 0, "total": 2, "totalTestResultsIncrease": 0, "posNeg": 2, "deathIncrease": 0, "hospitalizedIncrease": 0, "hash": "6741baa4346dba22666759d943ed6da989b2a6b9", "commercialScore": 0, "negativeRegularScore": 0, "negativeScore": 0, "positiveScore": 0, "score": 0, "grade": "", "month_number_label": "2020-03", "date_label": "2020-03-05", "week_number_label": "2020W10", "week_start_label": "2020-03-02"}, {"date": 20200306, "state": "GA", "positive": 2, "probableCases": null, "negative": null, "pending": null, "totalTestResultsSource": "totalTestsViral", "totalTestResults": 0, "hospitalizedCurrently": null, "hospitalizedCumulative": null, "inIcuCurrently": null, "inIcuCumulative": null, "onVentilatorCurrently": null, "onVentilatorCumulative": null, "recovered": null, "dataQualityGrade": null, "lastUpdateEt": null, "dateModified": null, "checkTimeEt": null, "death": null, "hospitalized": null, "dateChecked": null, "totalTestsViral": 0, "positiveTestsViral": 0, "negativeTestsViral": null, "positiveCasesViral": null, "deathConfirmed": null, "deathProbable": null, "totalTestEncountersViral": null, "totalTestsPeopleViral": null, "totalTestsAntibody": null, "positiveTestsAntibody": null, "negativeTestsAntibody": null, "totalTestsPeopleAntibody": null, "positiveTestsPeopleAntibody": null, "negativeTestsPeopleAntibody": null, "totalTestsPeopleAntigen": null, "positiveTestsPeopleAntigen": null, "totalTestsAntigen": null, "positiveTestsAntigen": null, "fips": "13", "positiveIncrease": 0, "negativeIncrease": 0, "total": 2, "totalTestResultsIncrease": 0, "posNeg": 2, "deathIncrease": 0, "hospitalizedIncrease": 0, "hash": "bbbd2825bbcf3fd2306901a519935aedc3e92688", "commercialScore": 0, "negativeRegularScore": 0, "negativeScore": 0, "positiveScore": 0, "score": 0, "grade": "", "month_number_label": "2020-03", "date_label": "2020-03-06", "week_number_label": "2020W10", "week_start_label": "2020-03-02"}, {"date": 20200307, "state": "GA", "positive": 6, "probableCases": null, "negative": null, "pending": null, "totalTestResultsSource": "totalTestsViral", "totalTestResults": 0, "hospitalizedCurrently": null, "hospitalizedCumulative": null, "inIcuCurrently": null, "inIcuCumulative": null, "onVentilatorCurrently": null, "onVentilatorCumulative": null, "recovered": null, "dataQualityGrade": null, "lastUpdateEt": null, "dateModified": null, "checkTimeEt": null, "death": null, "hospitalized": null, "dateChecked": null, "totalTestsViral": 0, "positiveTestsViral": 0, "negativeTestsViral": null, "positiveCasesViral": null, "deathConfirmed": null, "deathProbable": null, "totalTestEncountersViral": null, "totalTestsPeopleViral": null, "totalTestsAntibody": null, "positiveTestsAntibody": null, "negativeTestsAntibody": null, "totalTestsPeopleAntibody": null, "positiveTestsPeopleAntibody": null, "negativeTestsPeopleAntibody": null, "totalTestsPeopleAntigen": null, "positiveTestsPeopleAntigen": null, "totalTestsAntigen": null, "positiveTestsAntigen": null, "fips": "13", "positiveIncrease": 4, "negativeIncrease": 0, "total": 6, "totalTestResultsIncrease": 0, "posNeg": 6, "deathIncrease": 0, "hospitalizedIncrease": 0, "hash": "43d76ba1d6c4538ec5a21cc94ad6ab01c17ac479", "commercialScore": 0, "negativeRegularScore": 0, "negativeScore": 0, "positiveScore": 0, "score": 0, "grade": "", "month_number_label": "2020-03", "date_label": "2020-03-07", "week_number_label": "2020W10", "week_start_label": "2020-03-02"}, {"date": 20200308, "state": "GA", "positive": 7, "probableCases": null, "negative": null, "pending": null, "totalTestResultsSource": "totalTestsViral", "totalTestResults": 0, "hospitalizedCurrently": null, "hospitalizedCumulative": null, "inIcuCurrently": null, "inIcuCumulative": null, "onVentilatorCurrently": null, "onVentilatorCumulative": null, "recovered": null, "dataQualityGrade": null, "lastUpdateEt": null, "dateModified": null, "checkTimeEt": null, "death": null, "hospitalized": null, "dateChecked": null, "totalTestsViral": 0, "positiveTestsViral": 0, "negativeTestsViral": null, "positiveCasesViral": null, "deathConfirmed": null, "deathProbable": null, "totalTestEncountersViral": null, "totalTestsPeopleViral": null, "totalTestsAntibody": null, "positiveTestsAntibody": null, "negativeTestsAntibody": null, "totalTestsPeopleAntibody": null, "positiveTestsPeopleAntibody": null, "negativeTestsPeopleAntibody": null, "totalTestsPeopleAntigen": null, "positiveTestsPeopleAntigen": null, "totalTestsAntigen": null, "positiveTestsAntigen": null, "fips": "13", "positiveIncrease": 1, "negativeIncrease": 0, "total": 7, "totalTestResultsIncrease": 0, "posNeg": 7, "deathIncrease": 0, "hospitalizedIncrease": 0, "hash": "4f243613e31e9366ae8021b0e3784c7a9315694a", "commercialScore": 0, "negativeRegularScore": 0, "negativeScore": 0, "positiveScore": 0, "score": 0, "grade": "", "month_number_label": "2020-03", "date_label": "2020-03-08", "week_number_label": "2020W10", "week_start_label": "2020-03-02"}, {"date": 20200309, "state": "GA", "positive": 12, "probableCases": null, "negative": null, "pending": null, "totalTestResultsSource": "totalTestsViral", "totalTestResults": 6, "hospitalizedCurrently": null, "hospitalizedCumulative": null, "inIcuCurrently": null, "inIcuCumulative": null, "onVentilatorCurrently": null, "onVentilatorCumulative": null, "recovered": null, "dataQualityGrade": null, "lastUpdateEt": null, "dateModified": null, "checkTimeEt": null, "death": null, "hospitalized": null, "dateChecked": null, "totalTestsViral": 6, "positiveTestsViral": 1, "negativeTestsViral": null, "positiveCasesViral": null, "deathConfirmed": null, "deathProbable": null, "totalTestEncountersViral": null, "totalTestsPeopleViral": null, "totalTestsAntibody": null, "positiveTestsAntibody": null, "negativeTestsAntibody": null, "totalTestsPeopleAntibody": null, "positiveTestsPeopleAntibody": null, "negativeTestsPeopleAntibody": null, "totalTestsPeopleAntigen": null, "positiveTestsPeopleAntigen": null, "totalTestsAntigen": null, "positiveTestsAntigen": null, "fips": "13", "positiveIncrease": 5, "negativeIncrease": 0, "total": 12, "totalTestResultsIncrease": 6, "posNeg": 12, "deathIncrease": 0, "hospitalizedIncrease": 0, "hash": "432e55d787cc43e0f72c17f5952a78db4eb8cb45", "commercialScore": 0, "negativeRegularScore": 0, "negativeScore": 0, "positiveScore": 0, "score": 0, "grade": "", "month_number_label": "2020-03", "date_label": "2020-03-09", "week_number_label": "2020W11", "week_start_label": "2020-03-09"}, {"date": 20200310, "state": "GA", "positive": 17, "probableCases": null, "negative": null, "pending": null, "totalTestResultsSource": "totalTestsViral", "totalTestResults": 29, "hospitalizedCurrently": null, "hospitalizedCumulative": null, "inIcuCurrently": null, "inIcuCumulative": null, "onVentilatorCurrently": null, "onVentilatorCumulative": null, "recovered": null, "dataQualityGrade": null, "lastUpdateEt": null, "dateModified": null, "checkTimeEt": null, "death": null, "hospitalized": null, "dateChecked": null, "totalTestsViral": 29, "positiveTestsViral": 2, "negativeTestsViral": null, "positiveCasesViral": null, "deathConfirmed": null, "deathProbable": null, "totalTestEncountersViral": null, "totalTestsPeopleViral": null, "totalTestsAntibody": null, "positiveTestsAntibody": null, "negativeTestsAntibody": null, "totalTestsPeopleAntibody": null, "positiveTestsPeopleAntibody": null, "negativeTestsPeopleAntibody": null, "totalTestsPeopleAntigen": null, "positiveTestsPeopleAntigen": null, "totalTestsAntigen": null, "positiveTestsAntigen": null, "fips": "13", "positiveIncrease": 5, "negativeIncrease": 0, "total": 17, "totalTestResultsIncrease": 23, "posNeg": 17, "deathIncrease": 0, "hospitalizedIncrease": 0, "hash": "37ee3800349b21e1f61af3b25f9512a666f69539", "commercialScore": 0, "negativeRegularScore": 0, "negativeScore": 0, "positiveScore": 0, "score": 0, "grade": "", "month_number_label": "2020-03", "date_label": "2020-03-10", "week_number_label": "2020W11", "week_start_label": "2020-03-09"}, {"date": 20200311, "state": "GA", "positive": 22, "probableCases": null, "negative": null, "pending": null, "totalTestResultsSource": "totalTestsViral", "totalTestResults": 44, "hospitalizedCurrently": null, "hospitalizedCumulative": null, "inIcuCurrently": null, "inIcuCumulative": null, "onVentilatorCurrently": null, "onVentilatorCumulative": null, "recovered": null, "dataQualityGrade": null, "lastUpdateEt": null, "dateModified": null, "checkTimeEt": null, "death": null, "hospitalized": null, "dateChecked": null, "totalTestsViral": 44, "positiveTestsViral": 4, "negativeTestsViral": null, "positiveCasesViral": null, "deathConfirmed": null, "deathProbable": null, "totalTestEncountersViral": null, "totalTestsPeopleViral": null, "totalTestsAntibody": null, "positiveTestsAntibody": null, "negativeTestsAntibody": null, "totalTestsPeopleAntibody": null, "positiveTestsPeopleAntibody": null, "negativeTestsPeopleAntibody": null, "totalTestsPeopleAntigen": null, "positiveTestsPeopleAntigen": null, "totalTestsAntigen": null, "positiveTestsAntigen": null, "fips": "13", "positiveIncrease": 5, "negativeIncrease": 0, "total": 22, "totalTestResultsIncrease": 15, "posNeg": 22, "deathIncrease": 0, "hospitalizedIncrease": 0, "hash": "ae58d72c099251cdf8ae954c4ec046036c719743", "commercialScore": 0, "negativeRegularScore": 0, "negativeScore": 0, "positiveScore": 0, "score": 0, "grade": "", "month_number_label": "2020-03", "date_label": "2020-03-11", "week_number_label": "2020W11", "week_start_label": "2020-03-09"}, {"date": 20200312, "state": "GA", "positive": 31, "probableCases": null, "negative": null, "pending": null, "totalTestResultsSource": "totalTestsViral", "totalTestResults": 81, "hospitalizedCurrently": null, "hospitalizedCumulative": null, "inIcuCurrently": null, "inIcuCumulative": null, "onVentilatorCurrently": null, "onVentilatorCumulative": null, "recovered": null, "dataQualityGrade": null, "lastUpdateEt": "3/11/2020 20:00", "dateModified": "2020-03-11T20:00:00Z", "checkTimeEt": "03/11 16:00", "death": null, "hospitalized": null, "dateChecked": "2020-03-11T20:00:00Z", "totalTestsViral": 81, "positiveTestsViral": 7, "negativeTestsViral": null, "positiveCasesViral": null, "deathConfirmed": null, "deathProbable": null, "totalTestEncountersViral": null, "totalTestsPeopleViral": null, "totalTestsAntibody": null, "positiveTestsAntibody": null, "negativeTestsAntibody": null, "totalTestsPeopleAntibody": null, "positiveTestsPeopleAntibody": null, "negativeTestsPeopleAntibody": null, "totalTestsPeopleAntigen": null, "positiveTestsPeopleAntigen": null, "totalTestsAntigen": null, "positiveTestsAntigen": null, "fips": "13", "positiveIncrease": 9, "negativeIncrease": 0, "total": 31, "totalTestResultsIncrease": 37, "posNeg": 31, "deathIncrease": 0, "hospitalizedIncrease": 0, "hash": "cc1fab4269dba9a6a45c85a05d6d058aab343b9c", "commercialScore": 0, "negativeRegularScore": 0, "negativeScore": 0, "positiveScore": 0, "score": 0, "grade": "", "month_number_label": "2020-03", "date_label": "2020-03-12", "week_number_label": "2020W11", "week_start_label": "2020-03-09"}, {"date": 20200313, "state": "GA", "positive": 42, "probableCases": null, "negative": null, "pending": null, "totalTestResultsSource": "totalTestsViral", "totalTestResults": 336, "hospitalizedCurrently": null, "hospitalizedCumulative": null, "inIcuCurrently": null, "inIcuCumulative": null, "onVentilatorCurrently": null, "onVentilatorCumulative": null, "recovered": null, "dataQualityGrade": null, "lastUpdateEt": "3/13/2020 00:00", "dateModified": "2020-03-13T00:00:00Z", "checkTimeEt": "03/12 20:00", "death": 1, "hospitalized": null, "dateChecked": "2020-03-13T00:00:00Z", "totalTestsViral": 336, "positiveTestsViral": 32, "negativeTestsViral": null, "positiveCasesViral": null, "deathConfirmed": null, "deathProbable": null, "totalTestEncountersViral": null, "totalTestsPeopleViral": null, "totalTestsAntibody": null, "positiveTestsAntibody": null, "negativeTestsAntibody": null, "totalTestsPeopleAntibody": null, "positiveTestsPeopleAntibody": null, "negativeTestsPeopleAntibody": null, "totalTestsPeopleAntigen": null, "positiveTestsPeopleAntigen": null, "totalTestsAntigen": null, "positiveTestsAntigen": null, "fips": "13", "positiveIncrease": 11, "negativeIncrease": 0, "total": 42, "totalTestResultsIncrease": 255, "posNeg": 42, "deathIncrease": 1, "hospitalizedIncrease": 0, "hash": "9e57f5139a2bc935506c089872edfd109be8fafe", "commercialScore": 0, "negativeRegularScore": 0, "negativeScore": 0, "positiveScore": 0, "score": 0, "grade": "", "month_number_label": "2020-03", "date_label": "2020-03-13", "week_number_label": "2020W11", "week_start_label": "2020-03-09"}, {"date": 20200314, "state": "GA", "positive": 66, "probableCases": null, "negative": null, "pending": null, "totalTestResultsSource": "totalTestsViral", "totalTestResults": 466, "hospitalizedCurrently": null, "hospitalizedCumulative": null, "inIcuCurrently": null, "inIcuCumulative": null, "onVentilatorCurrently": null, "onVentilatorCumulative": null, "recovered": null, "dataQualityGrade": null, "lastUpdateEt": "3/14/2020 12:00", "dateModified": "2020-03-14T12:00:00Z", "checkTimeEt": "03/14 08:00", "death": 1, "hospitalized": null, "dateChecked": "2020-03-14T12:00:00Z", "totalTestsViral": 466, "positiveTestsViral": 41, "negativeTestsViral": null, "positiveCasesViral": null, "deathConfirmed": null, "deathProbable": null, "totalTestEncountersViral": null, "totalTestsPeopleViral": null, "totalTestsAntibody": null, "positiveTestsAntibody": null, "negativeTestsAntibody": null, "totalTestsPeopleAntibody": null, "positiveTestsPeopleAntibody": null, "negativeTestsPeopleAntibody": null, "totalTestsPeopleAntigen": null, "positiveTestsPeopleAntigen": null, "totalTestsAntigen": null, "positiveTestsAntigen": null, "fips": "13", "positiveIncrease": 24, "negativeIncrease": 0, "total": 66, "totalTestResultsIncrease": 130, "posNeg": 66, "deathIncrease": 0, "hospitalizedIncrease": 0, "hash": "d79e4444dde0547ca3f53335fe632c0c1a6a7f03", "commercialScore": 0, "negativeRegularScore": 0, "negativeScore": 0, "positiveScore": 0, "score": 0, "grade": "", "month_number_label": "2020-03", "date_label": "2020-03-14", "week_number_label": "2020W11", "week_start_label": "2020-03-09"}, {"date": 20200315, "state": "GA", "positive": 99, "probableCases": null, "negative": null, "pending": null, "totalTestResultsSource": "totalTestsViral", "totalTestResults": 707, "hospitalizedCurrently": null, "hospitalizedCumulative": null, "inIcuCurrently": null, "inIcuCumulative": null, "onVentilatorCurrently": null, "onVentilatorCumulative": null, "recovered": null, "dataQualityGrade": null, "lastUpdateEt": "3/15/2020 11:43", "dateModified": "2020-03-15T11:43:00Z", "checkTimeEt": "03/15 07:43", "death": 1, "hospitalized": null, "dateChecked": "2020-03-15T11:43:00Z", "totalTestsViral": 707, "positiveTestsViral": 68, "negativeTestsViral": null, "positiveCasesViral": null, "deathConfirmed": null, "deathProbable": null, "totalTestEncountersViral": null, "totalTestsPeopleViral": null, "totalTestsAntibody": null, "positiveTestsAntibody": null, "negativeTestsAntibody": null, "totalTestsPeopleAntibody": null, "positiveTestsPeopleAntibody": null, "negativeTestsPeopleAntibody": null, "totalTestsPeopleAntigen": null, "positiveTestsPeopleAntigen": null, "totalTestsAntigen": null, "positiveTestsAntigen": null, "fips": "13", "positiveIncrease": 33, "negativeIncrease": 0, "total": 99, "totalTestResultsIncrease": 241, "posNeg": 99, "deathIncrease": 0, "hospitalizedIncrease": 0, "hash": "ecc25f869de7b34bcddfb2610482ce387bf693f6", "commercialScore": 0, "negativeRegularScore": 0, "negativeScore": 0, "positiveScore": 0, "score": 0, "grade": "", "month_number_label": "2020-03", "date_label": "2020-03-15", "week_number_label": "2020W11", "week_start_label": "2020-03-09"}, {"date": 20200316, "state": "GA", "positive": 121, "probableCases": null, "negative": null, "pending": null, "totalTestResultsSource": "totalTestsViral", "totalTestResults": 959, "hospitalizedCurrently": null, "hospitalizedCumulative": null, "inIcuCurrently": null, "inIcuCumulative": null, "onVentilatorCurrently": null, "onVentilatorCumulative": null, "recovered": null, "dataQualityGrade": null, "lastUpdateEt": "3/16/2020 15:19", "dateModified": "2020-03-16T15:19:00Z", "checkTimeEt": "03/16 11:19", "death": 1, "hospitalized": null, "dateChecked": "2020-03-16T15:19:00Z", "totalTestsViral": 959, "positiveTestsViral": 100, "negativeTestsViral": null, "positiveCasesViral": null, "deathConfirmed": null, "deathProbable": null, "totalTestEncountersViral": null, "totalTestsPeopleViral": null, "totalTestsAntibody": null, "positiveTestsAntibody": null, "negativeTestsAntibody": null, "totalTestsPeopleAntibody": null, "positiveTestsPeopleAntibody": null, "negativeTestsPeopleAntibody": null, "totalTestsPeopleAntigen": null, "positiveTestsPeopleAntigen": null, "totalTestsAntigen": null, "positiveTestsAntigen": null, "fips": "13", "positiveIncrease": 22, "negativeIncrease": 0, "total": 121, "totalTestResultsIncrease": 252, "posNeg": 121, "deathIncrease": 0, "hospitalizedIncrease": 0, "hash": "c7d9384e628e4dfca2d1b2442fe8e1b02ccc3ccc", "commercialScore": 0, "negativeRegularScore": 0, "negativeScore": 0, "positiveScore": 0, "score": 0, "grade": "", "month_number_label": "2020-03", "date_label": "2020-03-16", "week_number_label": "2020W12", "week_start_label": "2020-03-16"}, {"date": 20200317, "state": "GA", "positive": 146, "probableCases": null, "negative": null, "pending": null, "totalTestResultsSource": "totalTestsViral", "totalTestResults": 1500, "hospitalizedCurrently": null, "hospitalizedCumulative": null, "inIcuCurrently": null, "inIcuCumulative": null, "onVentilatorCurrently": null, "onVentilatorCumulative": null, "recovered": null, "dataQualityGrade": null, "lastUpdateEt": "3/17/2020 12:00", "dateModified": "2020-03-17T12:00:00Z", "checkTimeEt": "03/17 08:00", "death": 1, "hospitalized": null, "dateChecked": "2020-03-17T12:00:00Z", "totalTestsViral": 1500, "positiveTestsViral": 185, "negativeTestsViral": null, "positiveCasesViral": null, "deathConfirmed": null, "deathProbable": null, "totalTestEncountersViral": null, "totalTestsPeopleViral": null, "totalTestsAntibody": null, "positiveTestsAntibody": null, "negativeTestsAntibody": null, "totalTestsPeopleAntibody": null, "positiveTestsPeopleAntibody": null, "negativeTestsPeopleAntibody": null, "totalTestsPeopleAntigen": null, "positiveTestsPeopleAntigen": null, "totalTestsAntigen": null, "positiveTestsAntigen": null, "fips": "13", "positiveIncrease": 25, "negativeIncrease": 0, "total": 146, "totalTestResultsIncrease": 541, "posNeg": 146, "deathIncrease": 0, "hospitalizedIncrease": 0, "hash": "ff555f11887778085b4d19c14789bfb1ecf40d64", "commercialScore": 0, "negativeRegularScore": 0, "negativeScore": 0, "positiveScore": 0, "score": 0, "grade": "", "month_number_label": "2020-03", "date_label": "2020-03-17", "week_number_label": "2020W12", "week_start_label": "2020-03-16"}, {"date": 20200318, "state": "GA", "positive": 197, "probableCases": null, "negative": 1311, "pending": null, "totalTestResultsSource": "totalTestsViral", "totalTestResults": 1866, "hospitalizedCurrently": null, "hospitalizedCumulative": null, "inIcuCurrently": null, "inIcuCumulative": null, "onVentilatorCurrently": null, "onVentilatorCumulative": null, "recovered": null, "dataQualityGrade": null, "lastUpdateEt": "3/18/2020 12:00", "dateModified": "2020-03-18T12:00:00Z", "checkTimeEt": "03/18 08:00", "death": 1, "hospitalized": null, "dateChecked": "2020-03-18T12:00:00Z", "totalTestsViral": 1866, "positiveTestsViral": 246, "negativeTestsViral": null, "positiveCasesViral": null, "deathConfirmed": null, "deathProbable": null, "totalTestEncountersViral": null, "totalTestsPeopleViral": null, "totalTestsAntibody": null, "positiveTestsAntibody": null, "negativeTestsAntibody": null, "totalTestsPeopleAntibody": null, "positiveTestsPeopleAntibody": null, "negativeTestsPeopleAntibody": null, "totalTestsPeopleAntigen": null, "positiveTestsPeopleAntigen": null, "totalTestsAntigen": null, "positiveTestsAntigen": null, "fips": "13", "positiveIncrease": 51, "negativeIncrease": 1311, "total": 1508, "totalTestResultsIncrease": 366, "posNeg": 1508, "deathIncrease": 0, "hospitalizedIncrease": 0, "hash": "bbd7eb07cfcb0f67ee375d0bde47b637459269ce", "commercialScore": 0, "negativeRegularScore": 0, "negativeScore": 0, "positiveScore": 0, "score": 0, "grade": "", "month_number_label": "2020-03", "date_label": "2020-03-18", "week_number_label": "2020W12", "week_start_label": "2020-03-16"}, {"date": 20200319, "state": "GA", "positive": 287, "probableCases": null, "negative": 1544, "pending": null, "totalTestResultsSource": "totalTestsViral", "totalTestResults": 2468, "hospitalizedCurrently": null, "hospitalizedCumulative": null, "inIcuCurrently": null, "inIcuCumulative": null, "onVentilatorCurrently": null, "onVentilatorCumulative": null, "recovered": null, "dataQualityGrade": null, "lastUpdateEt": "3/19/2020 12:00", "dateModified": "2020-03-19T12:00:00Z", "checkTimeEt": "03/19 08:00", "death": 10, "hospitalized": null, "dateChecked": "2020-03-19T12:00:00Z", "totalTestsViral": 2468, "positiveTestsViral": 352, "negativeTestsViral": null, "positiveCasesViral": null, "deathConfirmed": null, "deathProbable": null, "totalTestEncountersViral": null, "totalTestsPeopleViral": null, "totalTestsAntibody": null, "positiveTestsAntibody": null, "negativeTestsAntibody": null, "totalTestsPeopleAntibody": null, "positiveTestsPeopleAntibody": null, "negativeTestsPeopleAntibody": null, "totalTestsPeopleAntigen": null, "positiveTestsPeopleAntigen": null, "totalTestsAntigen": null, "positiveTestsAntigen": null, "fips": "13", "positiveIncrease": 90, "negativeIncrease": 233, "total": 1831, "totalTestResultsIncrease": 602, "posNeg": 1831, "deathIncrease": 9, "hospitalizedIncrease": 0, "hash": "58a6348dd03e6314cf9afc146e6c352866acda7f", "commercialScore": 0, "negativeRegularScore": 0, "negativeScore": 0, "positiveScore": 0, "score": 0, "grade": "", "month_number_label": "2020-03", "date_label": "2020-03-19", "week_number_label": "2020W12", "week_start_label": "2020-03-16"}, {"date": 20200320, "state": "GA", "positive": 420, "probableCases": null, "negative": 1966, "pending": null, "totalTestResultsSource": "totalTestsViral", "totalTestResults": 3115, "hospitalizedCurrently": null, "hospitalizedCumulative": null, "inIcuCurrently": null, "inIcuCumulative": null, "onVentilatorCurrently": null, "onVentilatorCumulative": null, "recovered": null, "dataQualityGrade": null, "lastUpdateEt": "3/20/2020 12:00", "dateModified": "2020-03-20T12:00:00Z", "checkTimeEt": "03/20 08:00", "death": 13, "hospitalized": null, "dateChecked": "2020-03-20T12:00:00Z", "totalTestsViral": 3115, "positiveTestsViral": 460, "negativeTestsViral": null, "positiveCasesViral": null, "deathConfirmed": null, "deathProbable": null, "totalTestEncountersViral": null, "totalTestsPeopleViral": null, "totalTestsAntibody": null, "positiveTestsAntibody": null, "negativeTestsAntibody": null, "totalTestsPeopleAntibody": null, "positiveTestsPeopleAntibody": null, "negativeTestsPeopleAntibody": null, "totalTestsPeopleAntigen": null, "positiveTestsPeopleAntigen": null, "totalTestsAntigen": null, "positiveTestsAntigen": null, "fips": "13", "positiveIncrease": 133, "negativeIncrease": 422, "total": 2386, "totalTestResultsIncrease": 647, "posNeg": 2386, "deathIncrease": 3, "hospitalizedIncrease": 0, "hash": "402309890a2626d07d19ea3c1b36303af7688619", "commercialScore": 0, "negativeRegularScore": 0, "negativeScore": 0, "positiveScore": 0, "score": 0, "grade": "", "month_number_label": "2020-03", "date_label": "2020-03-20", "week_number_label": "2020W12", "week_start_label": "2020-03-16"}, {"date": 20200321, "state": "GA", "positive": 507, "probableCases": null, "negative": 2557, "pending": null, "totalTestResultsSource": "totalTestsViral", "totalTestResults": 3981, "hospitalizedCurrently": null, "hospitalizedCumulative": null, "inIcuCurrently": null, "inIcuCumulative": null, "onVentilatorCurrently": null, "onVentilatorCumulative": null, "recovered": null, "dataQualityGrade": null, "lastUpdateEt": "3/21/2020 12:00", "dateModified": "2020-03-21T12:00:00Z", "checkTimeEt": "03/21 08:00", "death": 14, "hospitalized": null, "dateChecked": "2020-03-21T12:00:00Z", "totalTestsViral": 3981, "positiveTestsViral": 582, "negativeTestsViral": null, "positiveCasesViral": null, "deathConfirmed": null, "deathProbable": null, "totalTestEncountersViral": null, "totalTestsPeopleViral": null, "totalTestsAntibody": null, "positiveTestsAntibody": null, "negativeTestsAntibody": null, "totalTestsPeopleAntibody": null, "positiveTestsPeopleAntibody": null, "negativeTestsPeopleAntibody": null, "totalTestsPeopleAntigen": null, "positiveTestsPeopleAntigen": null, "totalTestsAntigen": null, "positiveTestsAntigen": null, "fips": "13", "positiveIncrease": 87, "negativeIncrease": 591, "total": 3064, "totalTestResultsIncrease": 866, "posNeg": 3064, "deathIncrease": 1, "hospitalizedIncrease": 0, "hash": "2c16553cfed991ca1e46de59aa95983cb785fac6", "commercialScore": 0, "negativeRegularScore": 0, "negativeScore": 0, "positiveScore": 0, "score": 0, "grade": "", "month_number_label": "2020-03", "date_label": "2020-03-21", "week_number_label": "2020W12", "week_start_label": "2020-03-16"}, {"date": 20200322, "state": "GA", "positive": 600, "probableCases": null, "negative": 3420, "pending": null, "totalTestResultsSource": "totalTestsViral", "totalTestResults": 4762, "hospitalizedCurrently": null, "hospitalizedCumulative": null, "inIcuCurrently": null, "inIcuCumulative": null, "onVentilatorCurrently": null, "onVentilatorCumulative": null, "recovered": null, "dataQualityGrade": null, "lastUpdateEt": "3/22/2020 12:00", "dateModified": "2020-03-22T12:00:00Z", "checkTimeEt": "03/22 08:00", "death": 23, "hospitalized": null, "dateChecked": "2020-03-22T12:00:00Z", "totalTestsViral": 4762, "positiveTestsViral": 698, "negativeTestsViral": null, "positiveCasesViral": null, "deathConfirmed": null, "deathProbable": null, "totalTestEncountersViral": null, "totalTestsPeopleViral": null, "totalTestsAntibody": null, "positiveTestsAntibody": null, "negativeTestsAntibody": null, "totalTestsPeopleAntibody": null, "positiveTestsPeopleAntibody": null, "negativeTestsPeopleAntibody": null, "totalTestsPeopleAntigen": null, "positiveTestsPeopleAntigen": null, "totalTestsAntigen": null, "positiveTestsAntigen": null, "fips": "13", "positiveIncrease": 93, "negativeIncrease": 863, "total": 4020, "totalTestResultsIncrease": 781, "posNeg": 4020, "deathIncrease": 9, "hospitalizedIncrease": 0, "hash": "64ddc056f77408e15f3e609e510d729e3790156d", "commercialScore": 0, "negativeRegularScore": 0, "negativeScore": 0, "positiveScore": 0, "score": 0, "grade": "", "month_number_label": "2020-03", "date_label": "2020-03-22", "week_number_label": "2020W12", "week_start_label": "2020-03-16"}, {"date": 20200323, "state": "GA", "positive": 772, "probableCases": null, "negative": 4297, "pending": null, "totalTestResultsSource": "totalTestsViral", "totalTestResults": 5959, "hospitalizedCurrently": null, "hospitalizedCumulative": null, "inIcuCurrently": null, "inIcuCumulative": null, "onVentilatorCurrently": null, "onVentilatorCumulative": null, "recovered": null, "dataQualityGrade": "A", "lastUpdateEt": "3/23/2020 12:00", "dateModified": "2020-03-23T12:00:00Z", "checkTimeEt": "03/23 08:00", "death": 25, "hospitalized": null, "dateChecked": "2020-03-23T12:00:00Z", "totalTestsViral": 5959, "positiveTestsViral": 905, "negativeTestsViral": null, "positiveCasesViral": null, "deathConfirmed": null, "deathProbable": null, "totalTestEncountersViral": null, "totalTestsPeopleViral": null, "totalTestsAntibody": null, "positiveTestsAntibody": null, "negativeTestsAntibody": null, "totalTestsPeopleAntibody": null, "positiveTestsPeopleAntibody": null, "negativeTestsPeopleAntibody": null, "totalTestsPeopleAntigen": null, "positiveTestsPeopleAntigen": null, "totalTestsAntigen": null, "positiveTestsAntigen": null, "fips": "13", "positiveIncrease": 172, "negativeIncrease": 877, "total": 5069, "totalTestResultsIncrease": 1197, "posNeg": 5069, "deathIncrease": 2, "hospitalizedIncrease": 0, "hash": "f5fe2f309b55c3f3eb3f9d3838c8688379a8133b", "commercialScore": 0, "negativeRegularScore": 0, "negativeScore": 0, "positiveScore": 0, "score": 0, "grade": "", "month_number_label": "2020-03", "date_label": "2020-03-23", "week_number_label": "2020W13", "week_start_label": "2020-03-23"}, {"date": 20200324, "state": "GA", "positive": 1026, "probableCases": null, "negative": 4458, "pending": null, "totalTestResultsSource": "totalTestsViral", "totalTestResults": 6806, "hospitalizedCurrently": null, "hospitalizedCumulative": null, "inIcuCurrently": null, "inIcuCumulative": null, "onVentilatorCurrently": null, "onVentilatorCumulative": null, "recovered": null, "dataQualityGrade": "A", "lastUpdateEt": "3/24/2020 12:00", "dateModified": "2020-03-24T12:00:00Z", "checkTimeEt": "03/24 08:00", "death": 32, "hospitalized": null, "dateChecked": "2020-03-24T12:00:00Z", "totalTestsViral": 6806, "positiveTestsViral": 1092, "negativeTestsViral": null, "positiveCasesViral": null, "deathConfirmed": null, "deathProbable": null, "totalTestEncountersViral": null, "totalTestsPeopleViral": null, "totalTestsAntibody": null, "positiveTestsAntibody": null, "negativeTestsAntibody": null, "totalTestsPeopleAntibody": null, "positiveTestsPeopleAntibody": null, "negativeTestsPeopleAntibody": null, "totalTestsPeopleAntigen": null, "positiveTestsPeopleAntigen": null, "totalTestsAntigen": null, "positiveTestsAntigen": null, "fips": "13", "positiveIncrease": 254, "negativeIncrease": 161, "total": 5484, "totalTestResultsIncrease": 847, "posNeg": 5484, "deathIncrease": 7, "hospitalizedIncrease": 0, "hash": "f1d4995d04ec50e8385d7b83496a0044cb30cedb", "commercialScore": 0, "negativeRegularScore": 0, "negativeScore": 0, "positiveScore": 0, "score": 0, "grade": "", "month_number_label": "2020-03", "date_label": "2020-03-24", "week_number_label": "2020W13", "week_start_label": "2020-03-23"}, {"date": 20200325, "state": "GA", "positive": 1247, "probableCases": null, "negative": 4932, "pending": null, "totalTestResultsSource": "totalTestsViral", "totalTestResults": 9307, "hospitalizedCurrently": null, "hospitalizedCumulative": 394, "inIcuCurrently": null, "inIcuCumulative": null, "onVentilatorCurrently": null, "onVentilatorCumulative": null, "recovered": null, "dataQualityGrade": "A", "lastUpdateEt": "3/25/2020 12:00", "dateModified": "2020-03-25T12:00:00Z", "checkTimeEt": "03/25 08:00", "death": 40, "hospitalized": 394, "dateChecked": "2020-03-25T12:00:00Z", "totalTestsViral": 9307, "positiveTestsViral": 1495, "negativeTestsViral": null, "positiveCasesViral": null, "deathConfirmed": null, "deathProbable": null, "totalTestEncountersViral": null, "totalTestsPeopleViral": null, "totalTestsAntibody": null, "positiveTestsAntibody": null, "negativeTestsAntibody": null, "totalTestsPeopleAntibody": null, "positiveTestsPeopleAntibody": null, "negativeTestsPeopleAntibody": null, "totalTestsPeopleAntigen": null, "positiveTestsPeopleAntigen": null, "totalTestsAntigen": null, "positiveTestsAntigen": null, "fips": "13", "positiveIncrease": 221, "negativeIncrease": 474, "total": 6179, "totalTestResultsIncrease": 2501, "posNeg": 6179, "deathIncrease": 8, "hospitalizedIncrease": 394, "hash": "ae386d65789e652aa29334032adacc11c59dd0e4", "commercialScore": 0, "negativeRegularScore": 0, "negativeScore": 0, "positiveScore": 0, "score": 0, "grade": "", "month_number_label": "2020-03", "date_label": "2020-03-25", "week_number_label": "2020W13", "week_start_label": "2020-03-23"}, {"date": 20200326, "state": "GA", "positive": 1525, "probableCases": null, "negative": 7401, "pending": null, "totalTestResultsSource": "totalTestsViral", "totalTestResults": 9962, "hospitalizedCurrently": null, "hospitalizedCumulative": 473, "inIcuCurrently": null, "inIcuCumulative": null, "onVentilatorCurrently": null, "onVentilatorCumulative": null, "recovered": null, "dataQualityGrade": "A", "lastUpdateEt": "3/26/2020 12:00", "dateModified": "2020-03-26T12:00:00Z", "checkTimeEt": "03/26 08:00", "death": 48, "hospitalized": 473, "dateChecked": "2020-03-26T12:00:00Z", "totalTestsViral": 9962, "positiveTestsViral": 1557, "negativeTestsViral": null, "positiveCasesViral": null, "deathConfirmed": null, "deathProbable": null, "totalTestEncountersViral": null, "totalTestsPeopleViral": null, "totalTestsAntibody": null, "positiveTestsAntibody": null, "negativeTestsAntibody": null, "totalTestsPeopleAntibody": null, "positiveTestsPeopleAntibody": null, "negativeTestsPeopleAntibody": null, "totalTestsPeopleAntigen": null, "positiveTestsPeopleAntigen": null, "totalTestsAntigen": null, "positiveTestsAntigen": null, "fips": "13", "positiveIncrease": 278, "negativeIncrease": 2469, "total": 8926, "totalTestResultsIncrease": 655, "posNeg": 8926, "deathIncrease": 8, "hospitalizedIncrease": 79, "hash": "801a127b88752b0ef648bef2571a075789a2e96a", "commercialScore": 0, "negativeRegularScore": 0, "negativeScore": 0, "positiveScore": 0, "score": 0, "grade": "", "month_number_label": "2020-03", "date_label": "2020-03-26", "week_number_label": "2020W13", "week_start_label": "2020-03-23"}, {"date": 20200327, "state": "GA", "positive": 2001, "probableCases": null, "negative": 7864, "pending": null, "totalTestResultsSource": "totalTestsViral", "totalTestResults": 11021, "hospitalizedCurrently": null, "hospitalizedCumulative": 566, "inIcuCurrently": null, "inIcuCumulative": null, "onVentilatorCurrently": null, "onVentilatorCumulative": null, "recovered": null, "dataQualityGrade": "A", "lastUpdateEt": "3/27/2020 12:00", "dateModified": "2020-03-27T12:00:00Z", "checkTimeEt": "03/27 08:00", "death": 64, "hospitalized": 566, "dateChecked": "2020-03-27T12:00:00Z", "totalTestsViral": 11021, "positiveTestsViral": 1789, "negativeTestsViral": null, "positiveCasesViral": null, "deathConfirmed": null, "deathProbable": null, "totalTestEncountersViral": null, "totalTestsPeopleViral": null, "totalTestsAntibody": null, "positiveTestsAntibody": null, "negativeTestsAntibody": null, "totalTestsPeopleAntibody": null, "positiveTestsPeopleAntibody": null, "negativeTestsPeopleAntibody": null, "totalTestsPeopleAntigen": null, "positiveTestsPeopleAntigen": null, "totalTestsAntigen": null, "positiveTestsAntigen": null, "fips": "13", "positiveIncrease": 476, "negativeIncrease": 463, "total": 9865, "totalTestResultsIncrease": 1059, "posNeg": 9865, "deathIncrease": 16, "hospitalizedIncrease": 93, "hash": "b88acec0ad4e597524bc46cbfce6dcd2796f366f", "commercialScore": 0, "negativeRegularScore": 0, "negativeScore": 0, "positiveScore": 0, "score": 0, "grade": "", "month_number_label": "2020-03", "date_label": "2020-03-27", "week_number_label": "2020W13", "week_start_label": "2020-03-23"}, {"date": 20200328, "state": "GA", "positive": 2366, "probableCases": null, "negative": 8685, "pending": null, "totalTestResultsSource": "totalTestsViral", "totalTestResults": 14080, "hospitalizedCurrently": null, "hospitalizedCumulative": 617, "inIcuCurrently": null, "inIcuCumulative": null, "onVentilatorCurrently": null, "onVentilatorCumulative": null, "recovered": null, "dataQualityGrade": "A", "lastUpdateEt": "3/28/2020 11:27", "dateModified": "2020-03-28T11:27:00Z", "checkTimeEt": "03/28 07:27", "death": 69, "hospitalized": 617, "dateChecked": "2020-03-28T11:27:00Z", "totalTestsViral": 14080, "positiveTestsViral": 2383, "negativeTestsViral": null, "positiveCasesViral": null, "deathConfirmed": null, "deathProbable": null, "totalTestEncountersViral": null, "totalTestsPeopleViral": null, "totalTestsAntibody": null, "positiveTestsAntibody": null, "negativeTestsAntibody": null, "totalTestsPeopleAntibody": null, "positiveTestsPeopleAntibody": null, "negativeTestsPeopleAntibody": null, "totalTestsPeopleAntigen": null, "positiveTestsPeopleAntigen": null, "totalTestsAntigen": null, "positiveTestsAntigen": null, "fips": "13", "positiveIncrease": 365, "negativeIncrease": 821, "total": 11051, "totalTestResultsIncrease": 3059, "posNeg": 11051, "deathIncrease": 5, "hospitalizedIncrease": 51, "hash": "fc5106b9a71ffa04a95a1f0425161f7a08f875cb", "commercialScore": 0, "negativeRegularScore": 0, "negativeScore": 0, "positiveScore": 0, "score": 0, "grade": "", "month_number_label": "2020-03", "date_label": "2020-03-28", "week_number_label": "2020W13", "week_start_label": "2020-03-23"}, {"date": 20200329, "state": "GA", "positive": 2651, "probableCases": null, "negative": 9913, "pending": null, "totalTestResultsSource": "totalTestsViral", "totalTestResults": 14629, "hospitalizedCurrently": null, "hospitalizedCumulative": 666, "inIcuCurrently": null, "inIcuCumulative": null, "onVentilatorCurrently": null, "onVentilatorCumulative": null, "recovered": null, "dataQualityGrade": "A", "lastUpdateEt": "3/28/2020 18:27", "dateModified": "2020-03-28T18:27:00Z", "checkTimeEt": "03/28 14:27", "death": 80, "hospitalized": 666, "dateChecked": "2020-03-28T18:27:00Z", "totalTestsViral": 14629, "positiveTestsViral": 2508, "negativeTestsViral": null, "positiveCasesViral": null, "deathConfirmed": null, "deathProbable": null, "totalTestEncountersViral": null, "totalTestsPeopleViral": null, "totalTestsAntibody": null, "positiveTestsAntibody": null, "negativeTestsAntibody": null, "totalTestsPeopleAntibody": null, "positiveTestsPeopleAntibody": null, "negativeTestsPeopleAntibody": null, "totalTestsPeopleAntigen": null, "positiveTestsPeopleAntigen": null, "totalTestsAntigen": null, "positiveTestsAntigen": null, "fips": "13", "positiveIncrease": 285, "negativeIncrease": 1228, "total": 12564, "totalTestResultsIncrease": 549, "posNeg": 12564, "deathIncrease": 11, "hospitalizedIncrease": 49, "hash": "05403a1f0875ee428c2c1f1677be8df911dae300", "commercialScore": 0, "negativeRegularScore": 0, "negativeScore": 0, "positiveScore": 0, "score": 0, "grade": "", "month_number_label": "2020-03", "date_label": "2020-03-29", "week_number_label": "2020W13", "week_start_label": "2020-03-23"}, {"date": 20200330, "state": "GA", "positive": 2809, "probableCases": null, "negative": 9915, "pending": null, "totalTestResultsSource": "totalTestsViral", "totalTestResults": 16225, "hospitalizedCurrently": null, "hospitalizedCumulative": 707, "inIcuCurrently": null, "inIcuCumulative": null, "onVentilatorCurrently": null, "onVentilatorCumulative": null, "recovered": null, "dataQualityGrade": "A", "lastUpdateEt": "3/30/2020 11:28", "dateModified": "2020-03-30T11:28:00Z", "checkTimeEt": "03/30 07:28", "death": 87, "hospitalized": 707, "dateChecked": "2020-03-30T11:28:00Z", "totalTestsViral": 16225, "positiveTestsViral": 2920, "negativeTestsViral": null, "positiveCasesViral": null, "deathConfirmed": null, "deathProbable": null, "totalTestEncountersViral": null, "totalTestsPeopleViral": null, "totalTestsAntibody": null, "positiveTestsAntibody": null, "negativeTestsAntibody": null, "totalTestsPeopleAntibody": null, "positiveTestsPeopleAntibody": null, "negativeTestsPeopleAntibody": null, "totalTestsPeopleAntigen": null, "positiveTestsPeopleAntigen": null, "totalTestsAntigen": null, "positiveTestsAntigen": null, "fips": "13", "positiveIncrease": 158, "negativeIncrease": 2, "total": 12724, "totalTestResultsIncrease": 1596, "posNeg": 12724, "deathIncrease": 7, "hospitalizedIncrease": 41, "hash": "ddd622b643f06de26f26a9e83ea9c9110de8c409", "commercialScore": 0, "negativeRegularScore": 0, "negativeScore": 0, "positiveScore": 0, "score": 0, "grade": "", "month_number_label": "2020-03", "date_label": "2020-03-30", "week_number_label": "2020W14", "week_start_label": "2020-03-30"}, {"date": 20200331, "state": "GA", "positive": 3929, "probableCases": null, "negative": 12252, "pending": null, "totalTestResultsSource": "totalTestsViral", "totalTestResults": 19910, "hospitalizedCurrently": null, "hospitalizedCumulative": 833, "inIcuCurrently": null, "inIcuCumulative": null, "onVentilatorCurrently": null, "onVentilatorCumulative": null, "recovered": null, "dataQualityGrade": "A", "lastUpdateEt": "3/31/2020 12:57", "dateModified": "2020-03-31T12:57:00Z", "checkTimeEt": "03/31 08:57", "death": 111, "hospitalized": 833, "dateChecked": "2020-03-31T12:57:00Z", "totalTestsViral": 19910, "positiveTestsViral": 3653, "negativeTestsViral": null, "positiveCasesViral": null, "deathConfirmed": null, "deathProbable": null, "totalTestEncountersViral": null, "totalTestsPeopleViral": null, "totalTestsAntibody": null, "positiveTestsAntibody": null, "negativeTestsAntibody": null, "totalTestsPeopleAntibody": null, "positiveTestsPeopleAntibody": null, "negativeTestsPeopleAntibody": null, "totalTestsPeopleAntigen": null, "positiveTestsPeopleAntigen": null, "totalTestsAntigen": null, "positiveTestsAntigen": null, "fips": "13", "positiveIncrease": 1120, "negativeIncrease": 2337, "total": 16181, "totalTestResultsIncrease": 3685, "posNeg": 16181, "deathIncrease": 24, "hospitalizedIncrease": 126, "hash": "fd9ab1f0424343dbd91508879847c9a4a6d0e56f", "commercialScore": 0, "negativeRegularScore": 0, "negativeScore": 0, "positiveScore": 0, "score": 0, "grade": "", "month_number_label": "2020-03", "date_label": "2020-03-31", "week_number_label": "2020W14", "week_start_label": "2020-03-30"}, {"date": 20200401, "state": "GA", "positive": 4638, "probableCases": null, "negative": 15688, "pending": null, "totalTestResultsSource": "totalTestsViral", "totalTestResults": 20338, "hospitalizedCurrently": null, "hospitalizedCumulative": 952, "inIcuCurrently": null, "inIcuCumulative": null, "onVentilatorCurrently": null, "onVentilatorCumulative": null, "recovered": null, "dataQualityGrade": "A", "lastUpdateEt": "4/1/2020 11:28", "dateModified": "2020-04-01T11:28:00Z", "checkTimeEt": "04/01 07:28", "death": 139, "hospitalized": 952, "dateChecked": "2020-04-01T11:28:00Z", "totalTestsViral": 20338, "positiveTestsViral": 3713, "negativeTestsViral": null, "positiveCasesViral": null, "deathConfirmed": null, "deathProbable": null, "totalTestEncountersViral": null, "totalTestsPeopleViral": null, "totalTestsAntibody": null, "positiveTestsAntibody": null, "negativeTestsAntibody": null, "totalTestsPeopleAntibody": null, "positiveTestsPeopleAntibody": null, "negativeTestsPeopleAntibody": null, "totalTestsPeopleAntigen": null, "positiveTestsPeopleAntigen": null, "totalTestsAntigen": null, "positiveTestsAntigen": null, "fips": "13", "positiveIncrease": 709, "negativeIncrease": 3436, "total": 20326, "totalTestResultsIncrease": 428, "posNeg": 20326, "deathIncrease": 28, "hospitalizedIncrease": 119, "hash": "08182b0836dae973ae4d4f5460ae650a45a5c6a0", "commercialScore": 0, "negativeRegularScore": 0, "negativeScore": 0, "positiveScore": 0, "score": 0, "grade": "", "month_number_label": "2020-04", "date_label": "2020-04-01", "week_number_label": "2020W14", "week_start_label": "2020-03-30"}, {"date": 20200402, "state": "GA", "positive": 5348, "probableCases": null, "negative": 17609, "pending": null, "totalTestResultsSource": "totalTestsViral", "totalTestResults": 22970, "hospitalizedCurrently": null, "hospitalizedCumulative": 1056, "inIcuCurrently": null, "inIcuCumulative": null, "onVentilatorCurrently": null, "onVentilatorCumulative": null, "recovered": null, "dataQualityGrade": "A", "lastUpdateEt": "4/2/2020 11:28", "dateModified": "2020-04-02T11:28:00Z", "checkTimeEt": "04/02 07:28", "death": 163, "hospitalized": 1056, "dateChecked": "2020-04-02T11:28:00Z", "totalTestsViral": 22970, "positiveTestsViral": 4560, "negativeTestsViral": null, "positiveCasesViral": null, "deathConfirmed": null, "deathProbable": null, "totalTestEncountersViral": null, "totalTestsPeopleViral": null, "totalTestsAntibody": null, "positiveTestsAntibody": null, "negativeTestsAntibody": null, "totalTestsPeopleAntibody": null, "positiveTestsPeopleAntibody": null, "negativeTestsPeopleAntibody": null, "totalTestsPeopleAntigen": null, "positiveTestsPeopleAntigen": null, "totalTestsAntigen": null, "positiveTestsAntigen": null, "fips": "13", "positiveIncrease": 710, "negativeIncrease": 1921, "total": 22957, "totalTestResultsIncrease": 2632, "posNeg": 22957, "deathIncrease": 24, "hospitalizedIncrease": 104, "hash": "07d18226cafcbf66c8b30c1ade1fe60fa4619f8b", "commercialScore": 0, "negativeRegularScore": 0, "negativeScore": 0, "positiveScore": 0, "score": 0, "grade": "", "month_number_label": "2020-04", "date_label": "2020-04-02", "week_number_label": "2020W14", "week_start_label": "2020-03-30"}, {"date": 20200403, "state": "GA", "positive": 5831, "probableCases": null, "negative": 19434, "pending": null, "totalTestResultsSource": "totalTestsViral", "totalTestResults": 25286, "hospitalizedCurrently": null, "hospitalizedCumulative": 1158, "inIcuCurrently": null, "inIcuCumulative": null, "onVentilatorCurrently": null, "onVentilatorCumulative": null, "recovered": null, "dataQualityGrade": "A", "lastUpdateEt": "4/3/2020 11:28", "dateModified": "2020-04-03T11:28:00Z", "checkTimeEt": "04/03 07:28", "death": 184, "hospitalized": 1158, "dateChecked": "2020-04-03T11:28:00Z", "totalTestsViral": 25286, "positiveTestsViral": 5010, "negativeTestsViral": null, "positiveCasesViral": null, "deathConfirmed": null, "deathProbable": null, "totalTestEncountersViral": null, "totalTestsPeopleViral": null, "totalTestsAntibody": null, "positiveTestsAntibody": null, "negativeTestsAntibody": null, "totalTestsPeopleAntibody": null, "positiveTestsPeopleAntibody": null, "negativeTestsPeopleAntibody": null, "totalTestsPeopleAntigen": null, "positiveTestsPeopleAntigen": null, "totalTestsAntigen": null, "positiveTestsAntigen": null, "fips": "13", "positiveIncrease": 483, "negativeIncrease": 1825, "total": 25265, "totalTestResultsIncrease": 2316, "posNeg": 25265, "deathIncrease": 21, "hospitalizedIncrease": 102, "hash": "ef3bc563da754e58a1f5fe752807c7a24e10e4b9", "commercialScore": 0, "negativeRegularScore": 0, "negativeScore": 0, "positiveScore": 0, "score": 0, "grade": "", "month_number_label": "2020-04", "date_label": "2020-04-03", "week_number_label": "2020W14", "week_start_label": "2020-03-30"}, {"date": 20200404, "state": "GA", "positive": 6160, "probableCases": null, "negative": 20134, "pending": null, "totalTestResultsSource": "totalTestsViral", "totalTestResults": 26337, "hospitalizedCurrently": null, "hospitalizedCumulative": 1239, "inIcuCurrently": null, "inIcuCumulative": null, "onVentilatorCurrently": null, "onVentilatorCumulative": null, "recovered": null, "dataQualityGrade": "A", "lastUpdateEt": "4/4/2020 11:27", "dateModified": "2020-04-04T11:27:00Z", "checkTimeEt": "04/04 07:27", "death": 201, "hospitalized": 1239, "dateChecked": "2020-04-04T11:27:00Z", "totalTestsViral": 26337, "positiveTestsViral": 5292, "negativeTestsViral": null, "positiveCasesViral": null, "deathConfirmed": null, "deathProbable": null, "totalTestEncountersViral": null, "totalTestsPeopleViral": null, "totalTestsAntibody": null, "positiveTestsAntibody": null, "negativeTestsAntibody": null, "totalTestsPeopleAntibody": null, "positiveTestsPeopleAntibody": null, "negativeTestsPeopleAntibody": null, "totalTestsPeopleAntigen": null, "positiveTestsPeopleAntigen": null, "totalTestsAntigen": null, "positiveTestsAntigen": null, "fips": "13", "positiveIncrease": 329, "negativeIncrease": 700, "total": 26294, "totalTestResultsIncrease": 1051, "posNeg": 26294, "deathIncrease": 17, "hospitalizedIncrease": 81, "hash": "ed1ed60cc48810d104d56a32ca282cc044a200d7", "commercialScore": 0, "negativeRegularScore": 0, "negativeScore": 0, "positiveScore": 0, "score": 0, "grade": "", "month_number_label": "2020-04", "date_label": "2020-04-04", "week_number_label": "2020W14", "week_start_label": "2020-03-30"}, {"date": 20200405, "state": "GA", "positive": 6647, "probableCases": null, "negative": 21185, "pending": null, "totalTestResultsSource": "totalTestsViral", "totalTestResults": 27941, "hospitalizedCurrently": null, "hospitalizedCumulative": 1283, "inIcuCurrently": null, "inIcuCumulative": null, "onVentilatorCurrently": null, "onVentilatorCumulative": null, "recovered": null, "dataQualityGrade": "A", "lastUpdateEt": "4/5/2020 11:27", "dateModified": "2020-04-05T11:27:00Z", "checkTimeEt": "04/05 07:27", "death": 211, "hospitalized": 1283, "dateChecked": "2020-04-05T11:27:00Z", "totalTestsViral": 27941, "positiveTestsViral": 5573, "negativeTestsViral": null, "positiveCasesViral": null, "deathConfirmed": null, "deathProbable": null, "totalTestEncountersViral": null, "totalTestsPeopleViral": null, "totalTestsAntibody": null, "positiveTestsAntibody": null, "negativeTestsAntibody": null, "totalTestsPeopleAntibody": null, "positiveTestsPeopleAntibody": null, "negativeTestsPeopleAntibody": null, "totalTestsPeopleAntigen": null, "positiveTestsPeopleAntigen": null, "totalTestsAntigen": null, "positiveTestsAntigen": null, "fips": "13", "positiveIncrease": 487, "negativeIncrease": 1051, "total": 27832, "totalTestResultsIncrease": 1604, "posNeg": 27832, "deathIncrease": 10, "hospitalizedIncrease": 44, "hash": "6cc3b5a3e0f5efed787c31dc54cb5f213171c1b3", "commercialScore": 0, "negativeRegularScore": 0, "negativeScore": 0, "positiveScore": 0, "score": 0, "grade": "", "month_number_label": "2020-04", "date_label": "2020-04-05", "week_number_label": "2020W14", "week_start_label": "2020-03-30"}, {"date": 20200406, "state": "GA", "positive": 7314, "probableCases": null, "negative": 23960, "pending": null, "totalTestResultsSource": "totalTestsViral", "totalTestResults": 31350, "hospitalizedCurrently": null, "hospitalizedCumulative": 1332, "inIcuCurrently": null, "inIcuCumulative": null, "onVentilatorCurrently": null, "onVentilatorCumulative": null, "recovered": null, "dataQualityGrade": "A", "lastUpdateEt": "4/6/2020 11:28", "dateModified": "2020-04-06T11:28:00Z", "checkTimeEt": "04/06 07:28", "death": 229, "hospitalized": 1332, "dateChecked": "2020-04-06T11:28:00Z", "totalTestsViral": 31350, "positiveTestsViral": 6154, "negativeTestsViral": null, "positiveCasesViral": null, "deathConfirmed": null, "deathProbable": null, "totalTestEncountersViral": null, "totalTestsPeopleViral": null, "totalTestsAntibody": null, "positiveTestsAntibody": null, "negativeTestsAntibody": null, "totalTestsPeopleAntibody": null, "positiveTestsPeopleAntibody": null, "negativeTestsPeopleAntibody": null, "totalTestsPeopleAntigen": null, "positiveTestsPeopleAntigen": null, "totalTestsAntigen": null, "positiveTestsAntigen": null, "fips": "13", "positiveIncrease": 667, "negativeIncrease": 2775, "total": 31274, "totalTestResultsIncrease": 3409, "posNeg": 31274, "deathIncrease": 18, "hospitalizedIncrease": 49, "hash": "4126972abaa04cb52835632fbff0cd151eba0f7c", "commercialScore": 0, "negativeRegularScore": 0, "negativeScore": 0, "positiveScore": 0, "score": 0, "grade": "", "month_number_label": "2020-04", "date_label": "2020-04-06", "week_number_label": "2020W15", "week_start_label": "2020-04-06"}, {"date": 20200407, "state": "GA", "positive": 8818, "probableCases": null, "negative": 24895, "pending": null, "totalTestResultsSource": "totalTestsViral", "totalTestResults": 37997, "hospitalizedCurrently": null, "hospitalizedCumulative": 1774, "inIcuCurrently": null, "inIcuCumulative": null, "onVentilatorCurrently": null, "onVentilatorCumulative": null, "recovered": null, "dataQualityGrade": "A", "lastUpdateEt": "4/7/2020 11:28", "dateModified": "2020-04-07T11:28:00Z", "checkTimeEt": "04/07 07:28", "death": 329, "hospitalized": 1774, "dateChecked": "2020-04-07T11:28:00Z", "totalTestsViral": 37997, "positiveTestsViral": 7817, "negativeTestsViral": null, "positiveCasesViral": null, "deathConfirmed": null, "deathProbable": null, "totalTestEncountersViral": null, "totalTestsPeopleViral": null, "totalTestsAntibody": null, "positiveTestsAntibody": null, "negativeTestsAntibody": null, "totalTestsPeopleAntibody": null, "positiveTestsPeopleAntibody": null, "negativeTestsPeopleAntibody": null, "totalTestsPeopleAntigen": null, "positiveTestsPeopleAntigen": null, "totalTestsAntigen": null, "positiveTestsAntigen": null, "fips": "13", "positiveIncrease": 1504, "negativeIncrease": 935, "total": 33713, "totalTestResultsIncrease": 6647, "posNeg": 33713, "deathIncrease": 100, "hospitalizedIncrease": 442, "hash": "8736fc747926a7a2878c98b9cc5f1614824d46a9", "commercialScore": 0, "negativeRegularScore": 0, "negativeScore": 0, "positiveScore": 0, "score": 0, "grade": "", "month_number_label": "2020-04", "date_label": "2020-04-07", "week_number_label": "2020W15", "week_start_label": "2020-04-06"}, {"date": 20200408, "state": "GA", "positive": 9901, "probableCases": null, "negative": 28886, "pending": null, "totalTestResultsSource": "totalTestsViral", "totalTestResults": 40999, "hospitalizedCurrently": null, "hospitalizedCumulative": 1993, "inIcuCurrently": null, "inIcuCumulative": null, "onVentilatorCurrently": null, "onVentilatorCumulative": null, "recovered": null, "dataQualityGrade": "A", "lastUpdateEt": "4/8/2020 12:29", "dateModified": "2020-04-08T12:29:00Z", "checkTimeEt": "04/08 08:29", "death": 362, "hospitalized": 1993, "dateChecked": "2020-04-08T12:29:00Z", "totalTestsViral": 40999, "positiveTestsViral": 8525, "negativeTestsViral": null, "positiveCasesViral": null, "deathConfirmed": null, "deathProbable": null, "totalTestEncountersViral": null, "totalTestsPeopleViral": null, "totalTestsAntibody": null, "positiveTestsAntibody": null, "negativeTestsAntibody": null, "totalTestsPeopleAntibody": null, "positiveTestsPeopleAntibody": null, "negativeTestsPeopleAntibody": null, "totalTestsPeopleAntigen": null, "positiveTestsPeopleAntigen": null, "totalTestsAntigen": null, "positiveTestsAntigen": null, "fips": "13", "positiveIncrease": 1083, "negativeIncrease": 3991, "total": 38787, "totalTestResultsIncrease": 3002, "posNeg": 38787, "deathIncrease": 33, "hospitalizedIncrease": 219, "hash": "ac830226f193b058573d0f8a0f3a8dbe4d786514", "commercialScore": 0, "negativeRegularScore": 0, "negativeScore": 0, "positiveScore": 0, "score": 0, "grade": "", "month_number_label": "2020-04", "date_label": "2020-04-08", "week_number_label": "2020W15", "week_start_label": "2020-04-06"}, {"date": 20200409, "state": "GA", "positive": 10566, "probableCases": null, "negative": 30519, "pending": null, "totalTestResultsSource": "totalTestsViral", "totalTestResults": 44828, "hospitalizedCurrently": null, "hospitalizedCumulative": 2159, "inIcuCurrently": null, "inIcuCumulative": null, "onVentilatorCurrently": null, "onVentilatorCumulative": null, "recovered": null, "dataQualityGrade": "A", "lastUpdateEt": "4/9/2020 11:54", "dateModified": "2020-04-09T11:54:00Z", "checkTimeEt": "04/09 07:54", "death": 379, "hospitalized": 2159, "dateChecked": "2020-04-09T11:54:00Z", "totalTestsViral": 44828, "positiveTestsViral": 9153, "negativeTestsViral": null, "positiveCasesViral": null, "deathConfirmed": null, "deathProbable": null, "totalTestEncountersViral": null, "totalTestsPeopleViral": null, "totalTestsAntibody": null, "positiveTestsAntibody": null, "negativeTestsAntibody": null, "totalTestsPeopleAntibody": null, "positiveTestsPeopleAntibody": null, "negativeTestsPeopleAntibody": null, "totalTestsPeopleAntigen": null, "positiveTestsPeopleAntigen": null, "totalTestsAntigen": null, "positiveTestsAntigen": null, "fips": "13", "positiveIncrease": 665, "negativeIncrease": 1633, "total": 41085, "totalTestResultsIncrease": 3829, "posNeg": 41085, "deathIncrease": 17, "hospitalizedIncrease": 166, "hash": "3895327120a13ff85e9d7a0915ee7a8bb691b219", "commercialScore": 0, "negativeRegularScore": 0, "negativeScore": 0, "positiveScore": 0, "score": 0, "grade": "", "month_number_label": "2020-04", "date_label": "2020-04-09", "week_number_label": "2020W15", "week_start_label": "2020-04-06"}, {"date": 20200410, "state": "GA", "positive": 11483, "probableCases": null, "negative": 34664, "pending": null, "totalTestResultsSource": "totalTestsViral", "totalTestResults": 46188, "hospitalizedCurrently": null, "hospitalizedCumulative": 2351, "inIcuCurrently": null, "inIcuCumulative": null, "onVentilatorCurrently": null, "onVentilatorCumulative": null, "recovered": null, "dataQualityGrade": "A", "lastUpdateEt": "4/10/2020 11:28", "dateModified": "2020-04-10T11:28:00Z", "checkTimeEt": "04/10 07:28", "death": 416, "hospitalized": 2351, "dateChecked": "2020-04-10T11:28:00Z", "totalTestsViral": 46188, "positiveTestsViral": 9391, "negativeTestsViral": null, "positiveCasesViral": null, "deathConfirmed": null, "deathProbable": null, "totalTestEncountersViral": null, "totalTestsPeopleViral": null, "totalTestsAntibody": null, "positiveTestsAntibody": null, "negativeTestsAntibody": null, "totalTestsPeopleAntibody": null, "positiveTestsPeopleAntibody": null, "negativeTestsPeopleAntibody": null, "totalTestsPeopleAntigen": null, "positiveTestsPeopleAntigen": null, "totalTestsAntigen": null, "positiveTestsAntigen": null, "fips": "13", "positiveIncrease": 917, "negativeIncrease": 4145, "total": 46147, "totalTestResultsIncrease": 1360, "posNeg": 46147, "deathIncrease": 37, "hospitalizedIncrease": 192, "hash": "62f5f1f049a2e8a573e2766a6d8776cea5ad1d75", "commercialScore": 0, "negativeRegularScore": 0, "negativeScore": 0, "positiveScore": 0, "score": 0, "grade": "", "month_number_label": "2020-04", "date_label": "2020-04-10", "week_number_label": "2020W15", "week_start_label": "2020-04-06"}, {"date": 20200411, "state": "GA", "positive": 12159, "probableCases": null, "negative": 39556, "pending": null, "totalTestResultsSource": "totalTestsViral", "totalTestResults": 51769, "hospitalizedCurrently": null, "hospitalizedCumulative": 2479, "inIcuCurrently": null, "inIcuCumulative": null, "onVentilatorCurrently": null, "onVentilatorCumulative": null, "recovered": null, "dataQualityGrade": "A", "lastUpdateEt": "4/11/2020 11:28", "dateModified": "2020-04-11T11:28:00Z", "checkTimeEt": "04/11 07:28", "death": 428, "hospitalized": 2479, "dateChecked": "2020-04-11T11:28:00Z", "totalTestsViral": 51769, "positiveTestsViral": 9912, "negativeTestsViral": null, "positiveCasesViral": null, "deathConfirmed": null, "deathProbable": null, "totalTestEncountersViral": null, "totalTestsPeopleViral": null, "totalTestsAntibody": null, "positiveTestsAntibody": null, "negativeTestsAntibody": null, "totalTestsPeopleAntibody": null, "positiveTestsPeopleAntibody": null, "negativeTestsPeopleAntibody": null, "totalTestsPeopleAntigen": null, "positiveTestsPeopleAntigen": null, "totalTestsAntigen": null, "positiveTestsAntigen": null, "fips": "13", "positiveIncrease": 676, "negativeIncrease": 4892, "total": 51715, "totalTestResultsIncrease": 5581, "posNeg": 51715, "deathIncrease": 12, "hospitalizedIncrease": 128, "hash": "24ab71f34a24fb90a82e04efb83c5c66092117cd", "commercialScore": 0, "negativeRegularScore": 0, "negativeScore": 0, "positiveScore": 0, "score": 0, "grade": "", "month_number_label": "2020-04", "date_label": "2020-04-11", "week_number_label": "2020W15", "week_start_label": "2020-04-06"}, {"date": 20200412, "state": "GA", "positive": 12452, "probableCases": null, "negative": 42001, "pending": null, "totalTestResultsSource": "totalTestsViral", "totalTestResults": 56613, "hospitalizedCurrently": null, "hospitalizedCumulative": 2505, "inIcuCurrently": null, "inIcuCumulative": null, "onVentilatorCurrently": null, "onVentilatorCumulative": null, "recovered": null, "dataQualityGrade": "A", "lastUpdateEt": "4/12/2020 11:27", "dateModified": "2020-04-12T11:27:00Z", "checkTimeEt": "04/12 07:27", "death": 433, "hospitalized": 2505, "dateChecked": "2020-04-12T11:27:00Z", "totalTestsViral": 56613, "positiveTestsViral": 10610, "negativeTestsViral": null, "positiveCasesViral": null, "deathConfirmed": null, "deathProbable": null, "totalTestEncountersViral": null, "totalTestsPeopleViral": null, "totalTestsAntibody": null, "positiveTestsAntibody": null, "negativeTestsAntibody": null, "totalTestsPeopleAntibody": null, "positiveTestsPeopleAntibody": null, "negativeTestsPeopleAntibody": null, "totalTestsPeopleAntigen": null, "positiveTestsPeopleAntigen": null, "totalTestsAntigen": null, "positiveTestsAntigen": null, "fips": "13", "positiveIncrease": 293, "negativeIncrease": 2445, "total": 54453, "totalTestResultsIncrease": 4844, "posNeg": 54453, "deathIncrease": 5, "hospitalizedIncrease": 26, "hash": "eee8df84dde0821a6730a699f2a2fd9cefa2c75e", "commercialScore": 0, "negativeRegularScore": 0, "negativeScore": 0, "positiveScore": 0, "score": 0, "grade": "", "month_number_label": "2020-04", "date_label": "2020-04-12", "week_number_label": "2020W15", "week_start_label": "2020-04-06"}, {"date": 20200413, "state": "GA", "positive": 13315, "probableCases": null, "negative": 43706, "pending": null, "totalTestResultsSource": "totalTestsViral", "totalTestResults": 57089, "hospitalizedCurrently": null, "hospitalizedCumulative": 2589, "inIcuCurrently": null, "inIcuCumulative": null, "onVentilatorCurrently": null, "onVentilatorCumulative": null, "recovered": null, "dataQualityGrade": "A", "lastUpdateEt": "4/13/2020 18:27", "dateModified": "2020-04-13T18:27:00Z", "checkTimeEt": "04/13 14:27", "death": 464, "hospitalized": 2589, "dateChecked": "2020-04-13T18:27:00Z", "totalTestsViral": 57089, "positiveTestsViral": 10659, "negativeTestsViral": null, "positiveCasesViral": null, "deathConfirmed": null, "deathProbable": null, "totalTestEncountersViral": null, "totalTestsPeopleViral": null, "totalTestsAntibody": null, "positiveTestsAntibody": null, "negativeTestsAntibody": null, "totalTestsPeopleAntibody": null, "positiveTestsPeopleAntibody": null, "negativeTestsPeopleAntibody": null, "totalTestsPeopleAntigen": null, "positiveTestsPeopleAntigen": null, "totalTestsAntigen": null, "positiveTestsAntigen": null, "fips": "13", "positiveIncrease": 863, "negativeIncrease": 1705, "total": 57021, "totalTestResultsIncrease": 476, "posNeg": 57021, "deathIncrease": 31, "hospitalizedIncrease": 84, "hash": "db8a9d2c7dfc1bd23a9b97eac8e6773b1565eb64", "commercialScore": 0, "negativeRegularScore": 0, "negativeScore": 0, "positiveScore": 0, "score": 0, "grade": "", "month_number_label": "2020-04", "date_label": "2020-04-13", "week_number_label": "2020W16", "week_start_label": "2020-04-13"}, {"date": 20200414, "state": "GA", "positive": 14223, "probableCases": null, "negative": 47572, "pending": null, "totalTestResultsSource": "totalTestsViral", "totalTestResults": 61808, "hospitalizedCurrently": null, "hospitalizedCumulative": 2769, "inIcuCurrently": null, "inIcuCumulative": null, "onVentilatorCurrently": null, "onVentilatorCumulative": null, "recovered": null, "dataQualityGrade": "A", "lastUpdateEt": "4/14/2020 18:28", "dateModified": "2020-04-14T18:28:00Z", "checkTimeEt": "04/14 14:28", "death": 501, "hospitalized": 2769, "dateChecked": "2020-04-14T18:28:00Z", "totalTestsViral": 61808, "positiveTestsViral": 11524, "negativeTestsViral": null, "positiveCasesViral": null, "deathConfirmed": null, "deathProbable": null, "totalTestEncountersViral": null, "totalTestsPeopleViral": null, "totalTestsAntibody": null, "positiveTestsAntibody": null, "negativeTestsAntibody": null, "totalTestsPeopleAntibody": null, "positiveTestsPeopleAntibody": null, "negativeTestsPeopleAntibody": null, "totalTestsPeopleAntigen": null, "positiveTestsPeopleAntigen": null, "totalTestsAntigen": null, "positiveTestsAntigen": null, "fips": "13", "positiveIncrease": 908, "negativeIncrease": 3866, "total": 61795, "totalTestResultsIncrease": 4719, "posNeg": 61795, "deathIncrease": 37, "hospitalizedIncrease": 180, "hash": "c93ab3d8bbd25e3c5454d0aecceb00fe6a9b785b", "commercialScore": 0, "negativeRegularScore": 0, "negativeScore": 0, "positiveScore": 0, "score": 0, "grade": "", "month_number_label": "2020-04", "date_label": "2020-04-14", "week_number_label": "2020W16", "week_start_label": "2020-04-13"}, {"date": 20200415, "state": "GA", "positive": 14987, "probableCases": null, "negative": 49103, "pending": null, "totalTestResultsSource": "totalTestsViral", "totalTestResults": 65232, "hospitalizedCurrently": null, "hospitalizedCumulative": 2922, "inIcuCurrently": null, "inIcuCumulative": null, "onVentilatorCurrently": null, "onVentilatorCumulative": null, "recovered": null, "dataQualityGrade": "A", "lastUpdateEt": "4/15/2020 11:28", "dateModified": "2020-04-15T11:28:00Z", "checkTimeEt": "04/15 07:28", "death": 552, "hospitalized": 2922, "dateChecked": "2020-04-15T11:28:00Z", "totalTestsViral": 65232, "positiveTestsViral": 12071, "negativeTestsViral": null, "positiveCasesViral": null, "deathConfirmed": null, "deathProbable": null, "totalTestEncountersViral": null, "totalTestsPeopleViral": null, "totalTestsAntibody": null, "positiveTestsAntibody": null, "negativeTestsAntibody": null, "totalTestsPeopleAntibody": null, "positiveTestsPeopleAntibody": null, "negativeTestsPeopleAntibody": null, "totalTestsPeopleAntigen": null, "positiveTestsPeopleAntigen": null, "totalTestsAntigen": null, "positiveTestsAntigen": null, "fips": "13", "positiveIncrease": 764, "negativeIncrease": 1531, "total": 64090, "totalTestResultsIncrease": 3424, "posNeg": 64090, "deathIncrease": 51, "hospitalizedIncrease": 153, "hash": "e3d641fb417bbd3e7cd195e3177784180c532e8f", "commercialScore": 0, "negativeRegularScore": 0, "negativeScore": 0, "positiveScore": 0, "score": 0, "grade": "", "month_number_label": "2020-04", "date_label": "2020-04-15", "week_number_label": "2020W16", "week_start_label": "2020-04-13"}, {"date": 20200416, "state": "GA", "positive": 15669, "probableCases": null, "negative": 52270, "pending": null, "totalTestResultsSource": "totalTestsViral", "totalTestResults": 69766, "hospitalizedCurrently": null, "hospitalizedCumulative": 3108, "inIcuCurrently": null, "inIcuCumulative": null, "onVentilatorCurrently": null, "onVentilatorCumulative": null, "recovered": null, "dataQualityGrade": "A", "lastUpdateEt": "4/16/2020 18:28", "dateModified": "2020-04-16T18:28:00Z", "checkTimeEt": "04/16 14:28", "death": 587, "hospitalized": 3108, "dateChecked": "2020-04-16T18:28:00Z", "totalTestsViral": 69766, "positiveTestsViral": 12763, "negativeTestsViral": null, "positiveCasesViral": null, "deathConfirmed": null, "deathProbable": null, "totalTestEncountersViral": null, "totalTestsPeopleViral": null, "totalTestsAntibody": null, "positiveTestsAntibody": null, "negativeTestsAntibody": null, "totalTestsPeopleAntibody": null, "positiveTestsPeopleAntibody": null, "negativeTestsPeopleAntibody": null, "totalTestsPeopleAntigen": null, "positiveTestsPeopleAntigen": null, "totalTestsAntigen": null, "positiveTestsAntigen": null, "fips": "13", "positiveIncrease": 682, "negativeIncrease": 3167, "total": 67939, "totalTestResultsIncrease": 4534, "posNeg": 67939, "deathIncrease": 35, "hospitalizedIncrease": 186, "hash": "e6f6cf579782a3845cafcdaf45f2c6a020119857", "commercialScore": 0, "negativeRegularScore": 0, "negativeScore": 0, "positiveScore": 0, "score": 0, "grade": "", "month_number_label": "2020-04", "date_label": "2020-04-16", "week_number_label": "2020W16", "week_start_label": "2020-04-13"}, {"date": 20200417, "state": "GA", "positive": 17194, "probableCases": null, "negative": 54490, "pending": null, "totalTestResultsSource": "totalTestsViral", "totalTestResults": 71686, "hospitalizedCurrently": null, "hospitalizedCumulative": 3324, "inIcuCurrently": null, "inIcuCumulative": null, "onVentilatorCurrently": null, "onVentilatorCumulative": null, "recovered": null, "dataQualityGrade": "A", "lastUpdateEt": "4/17/2020 18:28", "dateModified": "2020-04-17T18:28:00Z", "checkTimeEt": "04/17 14:28", "death": 650, "hospitalized": 3324, "dateChecked": "2020-04-17T18:28:00Z", "totalTestsViral": 71686, "positiveTestsViral": 13002, "negativeTestsViral": null, "positiveCasesViral": null, "deathConfirmed": null, "deathProbable": null, "totalTestEncountersViral": null, "totalTestsPeopleViral": null, "totalTestsAntibody": null, "positiveTestsAntibody": null, "negativeTestsAntibody": null, "totalTestsPeopleAntibody": null, "positiveTestsPeopleAntibody": null, "negativeTestsPeopleAntibody": null, "totalTestsPeopleAntigen": null, "positiveTestsPeopleAntigen": null, "totalTestsAntigen": null, "positiveTestsAntigen": null, "fips": "13", "positiveIncrease": 1525, "negativeIncrease": 2220, "total": 71684, "totalTestResultsIncrease": 1920, "posNeg": 71684, "deathIncrease": 63, "hospitalizedIncrease": 216, "hash": "83266bf2c5defe0d31fcbd84b8786b78889e2a48", "commercialScore": 0, "negativeRegularScore": 0, "negativeScore": 0, "positiveScore": 0, "score": 0, "grade": "", "month_number_label": "2020-04", "date_label": "2020-04-17", "week_number_label": "2020W16", "week_start_label": "2020-04-13"}, {"date": 20200418, "state": "GA", "positive": 17669, "probableCases": null, "negative": 56539, "pending": null, "totalTestResultsSource": "totalTestsViral", "totalTestResults": 79350, "hospitalizedCurrently": null, "hospitalizedCumulative": 3420, "inIcuCurrently": null, "inIcuCumulative": null, "onVentilatorCurrently": null, "onVentilatorCumulative": null, "recovered": null, "dataQualityGrade": "A", "lastUpdateEt": "4/18/2020 11:28", "dateModified": "2020-04-18T11:28:00Z", "checkTimeEt": "04/18 07:28", "death": 673, "hospitalized": 3420, "dateChecked": "2020-04-18T11:28:00Z", "totalTestsViral": 79350, "positiveTestsViral": 14183, "negativeTestsViral": null, "positiveCasesViral": null, "deathConfirmed": null, "deathProbable": null, "totalTestEncountersViral": null, "totalTestsPeopleViral": null, "totalTestsAntibody": null, "positiveTestsAntibody": null, "negativeTestsAntibody": null, "totalTestsPeopleAntibody": null, "positiveTestsPeopleAntibody": null, "negativeTestsPeopleAntibody": null, "totalTestsPeopleAntigen": null, "positiveTestsPeopleAntigen": null, "totalTestsAntigen": null, "positiveTestsAntigen": null, "fips": "13", "positiveIncrease": 475, "negativeIncrease": 2049, "total": 74208, "totalTestResultsIncrease": 7664, "posNeg": 74208, "deathIncrease": 23, "hospitalizedIncrease": 96, "hash": "069ff0683eb9b5697c74329e6a076c5b467af97c", "commercialScore": 0, "negativeRegularScore": 0, "negativeScore": 0, "positiveScore": 0, "score": 0, "grade": "", "month_number_label": "2020-04", "date_label": "2020-04-18", "week_number_label": "2020W16", "week_start_label": "2020-04-13"}, {"date": 20200419, "state": "GA", "positive": 18301, "probableCases": null, "negative": 61632, "pending": null, "totalTestResultsSource": "totalTestsViral", "totalTestResults": 83327, "hospitalizedCurrently": null, "hospitalizedCumulative": 3464, "inIcuCurrently": null, "inIcuCumulative": null, "onVentilatorCurrently": null, "onVentilatorCumulative": null, "recovered": null, "dataQualityGrade": "A", "lastUpdateEt": "4/19/2020 21:34", "dateModified": "2020-04-19T21:34:00Z", "checkTimeEt": "04/19 17:34", "death": 687, "hospitalized": 3464, "dateChecked": "2020-04-19T21:34:00Z", "totalTestsViral": 83327, "positiveTestsViral": 14613, "negativeTestsViral": null, "positiveCasesViral": null, "deathConfirmed": null, "deathProbable": null, "totalTestEncountersViral": null, "totalTestsPeopleViral": null, "totalTestsAntibody": null, "positiveTestsAntibody": null, "negativeTestsAntibody": null, "totalTestsPeopleAntibody": null, "positiveTestsPeopleAntibody": null, "negativeTestsPeopleAntibody": null, "totalTestsPeopleAntigen": null, "positiveTestsPeopleAntigen": null, "totalTestsAntigen": null, "positiveTestsAntigen": null, "fips": "13", "positiveIncrease": 632, "negativeIncrease": 5093, "total": 79933, "totalTestResultsIncrease": 3977, "posNeg": 79933, "deathIncrease": 14, "hospitalizedIncrease": 44, "hash": "7269626a99047dff99ee85ec4f88ac95e25bed4d", "commercialScore": 0, "negativeRegularScore": 0, "negativeScore": 0, "positiveScore": 0, "score": 0, "grade": "", "month_number_label": "2020-04", "date_label": "2020-04-19", "week_number_label": "2020W16", "week_start_label": "2020-04-13"}, {"date": 20200420, "state": "GA", "positive": 18947, "probableCases": null, "negative": 65381, "pending": null, "totalTestResultsSource": "totalTestsViral", "totalTestResults": 87423, "hospitalizedCurrently": null, "hospitalizedCumulative": 3550, "inIcuCurrently": null, "inIcuCumulative": null, "onVentilatorCurrently": null, "onVentilatorCumulative": null, "recovered": null, "dataQualityGrade": "A", "lastUpdateEt": "4/20/2020 11:27", "dateModified": "2020-04-20T11:27:00Z", "checkTimeEt": "04/20 07:27", "death": 733, "hospitalized": 3550, "dateChecked": "2020-04-20T11:27:00Z", "totalTestsViral": 87423, "positiveTestsViral": 15109, "negativeTestsViral": null, "positiveCasesViral": null, "deathConfirmed": null, "deathProbable": null, "totalTestEncountersViral": null, "totalTestsPeopleViral": null, "totalTestsAntibody": null, "positiveTestsAntibody": null, "negativeTestsAntibody": null, "totalTestsPeopleAntibody": null, "positiveTestsPeopleAntibody": null, "negativeTestsPeopleAntibody": null, "totalTestsPeopleAntigen": null, "positiveTestsPeopleAntigen": null, "totalTestsAntigen": null, "positiveTestsAntigen": null, "fips": "13", "positiveIncrease": 646, "negativeIncrease": 3749, "total": 84328, "totalTestResultsIncrease": 4096, "posNeg": 84328, "deathIncrease": 46, "hospitalizedIncrease": 86, "hash": "e62999d9f2a0a0f396639c2ec7b54a996065b0ca", "commercialScore": 0, "negativeRegularScore": 0, "negativeScore": 0, "positiveScore": 0, "score": 0, "grade": "", "month_number_label": "2020-04", "date_label": "2020-04-20", "week_number_label": "2020W17", "week_start_label": "2020-04-20"}, {"date": 20200421, "state": "GA", "positive": 19881, "probableCases": null, "negative": 68259, "pending": null, "totalTestResultsSource": "totalTestsViral", "totalTestResults": 92422, "hospitalizedCurrently": null, "hospitalizedCumulative": 3779, "inIcuCurrently": null, "inIcuCumulative": null, "onVentilatorCurrently": null, "onVentilatorCumulative": null, "recovered": null, "dataQualityGrade": "A", "lastUpdateEt": "4/21/2020 18:28", "dateModified": "2020-04-21T18:28:00Z", "checkTimeEt": "04/21 14:28", "death": 799, "hospitalized": 3779, "dateChecked": "2020-04-21T18:28:00Z", "totalTestsViral": 92422, "positiveTestsViral": 15635, "negativeTestsViral": null, "positiveCasesViral": null, "deathConfirmed": null, "deathProbable": null, "totalTestEncountersViral": null, "totalTestsPeopleViral": null, "totalTestsAntibody": null, "positiveTestsAntibody": null, "negativeTestsAntibody": null, "totalTestsPeopleAntibody": null, "positiveTestsPeopleAntibody": null, "negativeTestsPeopleAntibody": null, "totalTestsPeopleAntigen": null, "positiveTestsPeopleAntigen": null, "totalTestsAntigen": null, "positiveTestsAntigen": null, "fips": "13", "positiveIncrease": 934, "negativeIncrease": 2878, "total": 88140, "totalTestResultsIncrease": 4999, "posNeg": 88140, "deathIncrease": 66, "hospitalizedIncrease": 229, "hash": "bf4d1562afcaa9f79b96a235a51ec2c2a8636f3b", "commercialScore": 0, "negativeRegularScore": 0, "negativeScore": 0, "positiveScore": 0, "score": 0, "grade": "", "month_number_label": "2020-04", "date_label": "2020-04-21", "week_number_label": "2020W17", "week_start_label": "2020-04-20"}, {"date": 20200422, "state": "GA", "positive": 20740, "probableCases": null, "negative": 73332, "pending": null, "totalTestResultsSource": "totalTestsViral", "totalTestResults": 94071, "hospitalizedCurrently": null, "hospitalizedCumulative": 3959, "inIcuCurrently": null, "inIcuCumulative": null, "onVentilatorCurrently": null, "onVentilatorCumulative": null, "recovered": null, "dataQualityGrade": "A", "lastUpdateEt": "4/22/2020 18:28", "dateModified": "2020-04-22T18:28:00Z", "checkTimeEt": "04/22 14:28", "death": 836, "hospitalized": 3959, "dateChecked": "2020-04-22T18:28:00Z", "totalTestsViral": 94071, "positiveTestsViral": 15804, "negativeTestsViral": null, "positiveCasesViral": null, "deathConfirmed": null, "deathProbable": null, "totalTestEncountersViral": null, "totalTestsPeopleViral": null, "totalTestsAntibody": null, "positiveTestsAntibody": null, "negativeTestsAntibody": null, "totalTestsPeopleAntibody": null, "positiveTestsPeopleAntibody": null, "negativeTestsPeopleAntibody": null, "totalTestsPeopleAntigen": null, "positiveTestsPeopleAntigen": null, "totalTestsAntigen": null, "positiveTestsAntigen": null, "fips": "13", "positiveIncrease": 859, "negativeIncrease": 5073, "total": 94072, "totalTestResultsIncrease": 1649, "posNeg": 94072, "deathIncrease": 37, "hospitalizedIncrease": 180, "hash": "f00a54ef7d54c683d4f8fb2bd8ad617d7545b25a", "commercialScore": 0, "negativeRegularScore": 0, "negativeScore": 0, "positiveScore": 0, "score": 0, "grade": "", "month_number_label": "2020-04", "date_label": "2020-04-22", "week_number_label": "2020W17", "week_start_label": "2020-04-20"}, {"date": 20200423, "state": "GA", "positive": 21512, "probableCases": null, "negative": 79550, "pending": null, "totalTestResultsSource": "totalTestsViral", "totalTestResults": 100979, "hospitalizedCurrently": null, "hospitalizedCumulative": 4069, "inIcuCurrently": null, "inIcuCumulative": null, "onVentilatorCurrently": null, "onVentilatorCumulative": null, "recovered": null, "dataQualityGrade": "A", "lastUpdateEt": "4/23/2020 18:28", "dateModified": "2020-04-23T18:28:00Z", "checkTimeEt": "04/23 14:28", "death": 872, "hospitalized": 4069, "dateChecked": "2020-04-23T18:28:00Z", "totalTestsViral": 100979, "positiveTestsViral": 16471, "negativeTestsViral": null, "positiveCasesViral": null, "deathConfirmed": null, "deathProbable": null, "totalTestEncountersViral": null, "totalTestsPeopleViral": null, "totalTestsAntibody": null, "positiveTestsAntibody": null, "negativeTestsAntibody": null, "totalTestsPeopleAntibody": null, "positiveTestsPeopleAntibody": null, "negativeTestsPeopleAntibody": null, "totalTestsPeopleAntigen": null, "positiveTestsPeopleAntigen": null, "totalTestsAntigen": null, "positiveTestsAntigen": null, "fips": "13", "positiveIncrease": 772, "negativeIncrease": 6218, "total": 101062, "totalTestResultsIncrease": 6908, "posNeg": 101062, "deathIncrease": 36, "hospitalizedIncrease": 110, "hash": "bf15b04dc9a0067a6c65fad1f0e9b7a84dec9fbd", "commercialScore": 0, "negativeRegularScore": 0, "negativeScore": 0, "positiveScore": 0, "score": 0, "grade": "", "month_number_label": "2020-04", "date_label": "2020-04-23", "week_number_label": "2020W17", "week_start_label": "2020-04-20"}, {"date": 20200424, "state": "GA", "positive": 22147, "probableCases": null, "negative": 85029, "pending": null, "totalTestResultsSource": "totalTestsViral", "totalTestResults": 107085, "hospitalizedCurrently": null, "hospitalizedCumulative": 4221, "inIcuCurrently": null, "inIcuCumulative": null, "onVentilatorCurrently": null, "onVentilatorCumulative": null, "recovered": null, "dataQualityGrade": "A", "lastUpdateEt": "4/24/2020 18:28", "dateModified": "2020-04-24T18:28:00Z", "checkTimeEt": "04/24 14:28", "death": 892, "hospitalized": 4221, "dateChecked": "2020-04-24T18:28:00Z", "totalTestsViral": 107085, "positiveTestsViral": 17164, "negativeTestsViral": null, "positiveCasesViral": null, "deathConfirmed": null, "deathProbable": null, "totalTestEncountersViral": null, "totalTestsPeopleViral": null, "totalTestsAntibody": null, "positiveTestsAntibody": null, "negativeTestsAntibody": null, "totalTestsPeopleAntibody": null, "positiveTestsPeopleAntibody": null, "negativeTestsPeopleAntibody": null, "totalTestsPeopleAntigen": null, "positiveTestsPeopleAntigen": null, "totalTestsAntigen": null, "positiveTestsAntigen": null, "fips": "13", "positiveIncrease": 635, "negativeIncrease": 5479, "total": 107176, "totalTestResultsIncrease": 6106, "posNeg": 107176, "deathIncrease": 20, "hospitalizedIncrease": 152, "hash": "21dc5e84d653e23092a422672f62af430cc5e117", "commercialScore": 0, "negativeRegularScore": 0, "negativeScore": 0, "positiveScore": 0, "score": 0, "grade": "", "month_number_label": "2020-04", "date_label": "2020-04-24", "week_number_label": "2020W17", "week_start_label": "2020-04-20"}, {"date": 20200425, "state": "GA", "positive": 22695, "probableCases": null, "negative": 96319, "pending": null, "totalTestResultsSource": "totalTestsViral", "totalTestResults": 121027, "hospitalizedCurrently": null, "hospitalizedCumulative": 4326, "inIcuCurrently": null, "inIcuCumulative": null, "onVentilatorCurrently": null, "onVentilatorCumulative": null, "recovered": null, "dataQualityGrade": "B", "lastUpdateEt": "4/25/2020 11:28", "dateModified": "2020-04-25T11:28:00Z", "checkTimeEt": "04/25 07:28", "death": 904, "hospitalized": 4326, "dateChecked": "2020-04-25T11:28:00Z", "totalTestsViral": 121027, "positiveTestsViral": 18792, "negativeTestsViral": null, "positiveCasesViral": null, "deathConfirmed": null, "deathProbable": null, "totalTestEncountersViral": null, "totalTestsPeopleViral": null, "totalTestsAntibody": null, "positiveTestsAntibody": null, "negativeTestsAntibody": null, "totalTestsPeopleAntibody": null, "positiveTestsPeopleAntibody": null, "negativeTestsPeopleAntibody": null, "totalTestsPeopleAntigen": null, "positiveTestsPeopleAntigen": null, "totalTestsAntigen": null, "positiveTestsAntigen": null, "fips": "13", "positiveIncrease": 548, "negativeIncrease": 11290, "total": 119014, "totalTestResultsIncrease": 13942, "posNeg": 119014, "deathIncrease": 12, "hospitalizedIncrease": 105, "hash": "33e54b558aa34c6ffeeb8fddd078d4362d0a5961", "commercialScore": 0, "negativeRegularScore": 0, "negativeScore": 0, "positiveScore": 0, "score": 0, "grade": "", "month_number_label": "2020-04", "date_label": "2020-04-25", "week_number_label": "2020W17", "week_start_label": "2020-04-20"}, {"date": 20200426, "state": "GA", "positive": 23401, "probableCases": null, "negative": 99822, "pending": null, "totalTestResultsSource": "totalTestsViral", "totalTestResults": 124429, "hospitalizedCurrently": null, "hospitalizedCumulative": 4359, "inIcuCurrently": null, "inIcuCumulative": null, "onVentilatorCurrently": null, "onVentilatorCumulative": null, "recovered": null, "dataQualityGrade": "B", "lastUpdateEt": "4/26/2020 11:28", "dateModified": "2020-04-26T11:28:00Z", "checkTimeEt": "04/26 07:28", "death": 912, "hospitalized": 4359, "dateChecked": "2020-04-26T11:28:00Z", "totalTestsViral": 124429, "positiveTestsViral": 19108, "negativeTestsViral": null, "positiveCasesViral": null, "deathConfirmed": null, "deathProbable": null, "totalTestEncountersViral": null, "totalTestsPeopleViral": null, "totalTestsAntibody": null, "positiveTestsAntibody": null, "negativeTestsAntibody": null, "totalTestsPeopleAntibody": null, "positiveTestsPeopleAntibody": null, "negativeTestsPeopleAntibody": null, "totalTestsPeopleAntigen": null, "positiveTestsPeopleAntigen": null, "totalTestsAntigen": null, "positiveTestsAntigen": null, "fips": "13", "positiveIncrease": 706, "negativeIncrease": 3503, "total": 123223, "totalTestResultsIncrease": 3402, "posNeg": 123223, "deathIncrease": 8, "hospitalizedIncrease": 33, "hash": "a6e949325dbdcfbb1d7f563fd293462242a6a148", "commercialScore": 0, "negativeRegularScore": 0, "negativeScore": 0, "positiveScore": 0, "score": 0, "grade": "", "month_number_label": "2020-04", "date_label": "2020-04-26", "week_number_label": "2020W17", "week_start_label": "2020-04-20"}, {"date": 20200427, "state": "GA", "positive": 23913, "probableCases": null, "negative": 103256, "pending": null, "totalTestResultsSource": "totalTestsViral", "totalTestResults": 136179, "hospitalizedCurrently": null, "hospitalizedCumulative": 4681, "inIcuCurrently": null, "inIcuCumulative": 1057, "onVentilatorCurrently": null, "onVentilatorCumulative": null, "recovered": null, "dataQualityGrade": "B", "lastUpdateEt": "4/27/2020 11:27", "dateModified": "2020-04-27T11:27:00Z", "checkTimeEt": "04/27 07:27", "death": 971, "hospitalized": 4681, "dateChecked": "2020-04-27T11:27:00Z", "totalTestsViral": 136179, "positiveTestsViral": 20557, "negativeTestsViral": null, "positiveCasesViral": null, "deathConfirmed": null, "deathProbable": null, "totalTestEncountersViral": null, "totalTestsPeopleViral": null, "totalTestsAntibody": null, "positiveTestsAntibody": null, "negativeTestsAntibody": null, "totalTestsPeopleAntibody": null, "positiveTestsPeopleAntibody": null, "negativeTestsPeopleAntibody": null, "totalTestsPeopleAntigen": null, "positiveTestsPeopleAntigen": null, "totalTestsAntigen": null, "positiveTestsAntigen": null, "fips": "13", "positiveIncrease": 512, "negativeIncrease": 3434, "total": 127169, "totalTestResultsIncrease": 11750, "posNeg": 127169, "deathIncrease": 59, "hospitalizedIncrease": 322, "hash": "d1d0cf6f65bc2843ba55e6116c6368111f29278f", "commercialScore": 0, "negativeRegularScore": 0, "negativeScore": 0, "positiveScore": 0, "score": 0, "grade": "", "month_number_label": "2020-04", "date_label": "2020-04-27", "week_number_label": "2020W18", "week_start_label": "2020-04-27"}, {"date": 20200428, "state": "GA", "positive": 24615, "probableCases": null, "negative": 115405, "pending": null, "totalTestResultsSource": "totalTestsViral", "totalTestResults": 139914, "hospitalizedCurrently": null, "hospitalizedCumulative": 4814, "inIcuCurrently": null, "inIcuCumulative": 1087, "onVentilatorCurrently": null, "onVentilatorCumulative": null, "recovered": null, "dataQualityGrade": "B", "lastUpdateEt": "4/28/2020 13:25", "dateModified": "2020-04-28T13:25:00Z", "checkTimeEt": "04/28 09:25", "death": 1026, "hospitalized": 4814, "dateChecked": "2020-04-28T13:25:00Z", "totalTestsViral": 139914, "positiveTestsViral": 20950, "negativeTestsViral": null, "positiveCasesViral": null, "deathConfirmed": null, "deathProbable": null, "totalTestEncountersViral": null, "totalTestsPeopleViral": null, "totalTestsAntibody": null, "positiveTestsAntibody": null, "negativeTestsAntibody": null, "totalTestsPeopleAntibody": null, "positiveTestsPeopleAntibody": null, "negativeTestsPeopleAntibody": null, "totalTestsPeopleAntigen": null, "positiveTestsPeopleAntigen": null, "totalTestsAntigen": null, "positiveTestsAntigen": null, "fips": "13", "positiveIncrease": 702, "negativeIncrease": 12149, "total": 140020, "totalTestResultsIncrease": 3735, "posNeg": 140020, "deathIncrease": 55, "hospitalizedIncrease": 133, "hash": "b49a977083ec7ed074ed956c22d6aff94c479f65", "commercialScore": 0, "negativeRegularScore": 0, "negativeScore": 0, "positiveScore": 0, "score": 0, "grade": "", "month_number_label": "2020-04", "date_label": "2020-04-28", "week_number_label": "2020W18", "week_start_label": "2020-04-27"}, {"date": 20200429, "state": "GA", "positive": 25623, "probableCases": null, "negative": 118155, "pending": null, "totalTestResultsSource": "totalTestsViral", "totalTestResults": 145225, "hospitalizedCurrently": null, "hospitalizedCumulative": 5056, "inIcuCurrently": null, "inIcuCumulative": 1148, "onVentilatorCurrently": null, "onVentilatorCumulative": null, "recovered": null, "dataQualityGrade": "A", "lastUpdateEt": "4/29/2020 14:25", "dateModified": "2020-04-29T14:25:00Z", "checkTimeEt": "04/29 10:25", "death": 1093, "hospitalized": 5056, "dateChecked": "2020-04-29T14:25:00Z", "totalTestsViral": 145225, "positiveTestsViral": 21502, "negativeTestsViral": null, "positiveCasesViral": 25411, "deathConfirmed": null, "deathProbable": null, "totalTestEncountersViral": null, "totalTestsPeopleViral": null, "totalTestsAntibody": null, "positiveTestsAntibody": null, "negativeTestsAntibody": null, "totalTestsPeopleAntibody": null, "positiveTestsPeopleAntibody": null, "negativeTestsPeopleAntibody": null, "totalTestsPeopleAntigen": null, "positiveTestsPeopleAntigen": null, "totalTestsAntigen": null, "positiveTestsAntigen": null, "fips": "13", "positiveIncrease": 1008, "negativeIncrease": 2750, "total": 143778, "totalTestResultsIncrease": 5311, "posNeg": 143778, "deathIncrease": 67, "hospitalizedIncrease": 242, "hash": "b6e2fef009e554821af338f50cb0f5cb8ea6cf6d", "commercialScore": 0, "negativeRegularScore": 0, "negativeScore": 0, "positiveScore": 0, "score": 0, "grade": "", "month_number_label": "2020-04", "date_label": "2020-04-29", "week_number_label": "2020W18", "week_start_label": "2020-04-27"}, {"date": 20200430, "state": "GA", "positive": 26155, "probableCases": null, "negative": 122889, "pending": null, "totalTestResultsSource": "totalTestsViral", "totalTestResults": 161181, "hospitalizedCurrently": null, "hospitalizedCumulative": 5156, "inIcuCurrently": null, "inIcuCumulative": 1171, "onVentilatorCurrently": null, "onVentilatorCumulative": null, "recovered": null, "dataQualityGrade": "A", "lastUpdateEt": "4/30/2020 14:25", "dateModified": "2020-04-30T14:25:00Z", "checkTimeEt": "04/30 10:25", "death": 1120, "hospitalized": 5156, "dateChecked": "2020-04-30T14:25:00Z", "totalTestsViral": 161181, "positiveTestsViral": 23045, "negativeTestsViral": null, "positiveCasesViral": 26155, "deathConfirmed": null, "deathProbable": null, "totalTestEncountersViral": null, "totalTestsPeopleViral": null, "totalTestsAntibody": null, "positiveTestsAntibody": null, "negativeTestsAntibody": null, "totalTestsPeopleAntibody": null, "positiveTestsPeopleAntibody": null, "negativeTestsPeopleAntibody": null, "totalTestsPeopleAntigen": null, "positiveTestsPeopleAntigen": null, "totalTestsAntigen": null, "positiveTestsAntigen": null, "fips": "13", "positiveIncrease": 532, "negativeIncrease": 4734, "total": 149044, "totalTestResultsIncrease": 15956, "posNeg": 149044, "deathIncrease": 27, "hospitalizedIncrease": 100, "hash": "dbed916060ea5677900bfb4446c2c259b72c3de9", "commercialScore": 0, "negativeRegularScore": 0, "negativeScore": 0, "positiveScore": 0, "score": 0, "grade": "", "month_number_label": "2020-04", "date_label": "2020-04-30", "week_number_label": "2020W18", "week_start_label": "2020-04-27"}, {"date": 20200501, "state": "GA", "positive": 27270, "probableCases": null, "negative": 141097, "pending": null, "totalTestResultsSource": "totalTestsViral", "totalTestResults": 166062, "hospitalizedCurrently": 1500, "hospitalizedCumulative": 5269, "inIcuCurrently": null, "inIcuCumulative": 1215, "onVentilatorCurrently": null, "onVentilatorCumulative": null, "recovered": null, "dataQualityGrade": "A", "lastUpdateEt": "5/1/2020 14:25", "dateModified": "2020-05-01T14:25:00Z", "checkTimeEt": "05/01 10:25", "death": 1154, "hospitalized": 5269, "dateChecked": "2020-05-01T14:25:00Z", "totalTestsViral": 166062, "positiveTestsViral": 23434, "negativeTestsViral": null, "positiveCasesViral": 27270, "deathConfirmed": null, "deathProbable": null, "totalTestEncountersViral": null, "totalTestsPeopleViral": null, "totalTestsAntibody": null, "positiveTestsAntibody": null, "negativeTestsAntibody": null, "totalTestsPeopleAntibody": null, "positiveTestsPeopleAntibody": null, "negativeTestsPeopleAntibody": null, "totalTestsPeopleAntigen": null, "positiveTestsPeopleAntigen": null, "totalTestsAntigen": null, "positiveTestsAntigen": null, "fips": "13", "positiveIncrease": 1115, "negativeIncrease": 18208, "total": 168367, "totalTestResultsIncrease": 4881, "posNeg": 168367, "deathIncrease": 34, "hospitalizedIncrease": 113, "hash": "bc18bf67da9b9a90883611b34110e9ef48dd4099", "commercialScore": 0, "negativeRegularScore": 0, "negativeScore": 0, "positiveScore": 0, "score": 0, "grade": "", "month_number_label": "2020-05", "date_label": "2020-05-01", "week_number_label": "2020W18", "week_start_label": "2020-04-27"}, {"date": 20200502, "state": "GA", "positive": 28306, "probableCases": null, "negative": 146494, "pending": null, "totalTestResultsSource": "totalTestsViral", "totalTestResults": 172523, "hospitalizedCurrently": 1440, "hospitalizedCumulative": 5387, "inIcuCurrently": null, "inIcuCumulative": 1247, "onVentilatorCurrently": null, "onVentilatorCumulative": null, "recovered": null, "dataQualityGrade": "A", "lastUpdateEt": "5/2/2020 14:25", "dateModified": "2020-05-02T14:25:00Z", "checkTimeEt": "05/02 10:25", "death": 1174, "hospitalized": 5387, "dateChecked": "2020-05-02T14:25:00Z", "totalTestsViral": 172523, "positiveTestsViral": 23961, "negativeTestsViral": null, "positiveCasesViral": 28306, "deathConfirmed": null, "deathProbable": null, "totalTestEncountersViral": null, "totalTestsPeopleViral": null, "totalTestsAntibody": null, "positiveTestsAntibody": null, "negativeTestsAntibody": null, "totalTestsPeopleAntibody": null, "positiveTestsPeopleAntibody": null, "negativeTestsPeopleAntibody": null, "totalTestsPeopleAntigen": null, "positiveTestsPeopleAntigen": null, "totalTestsAntigen": null, "positiveTestsAntigen": null, "fips": "13", "positiveIncrease": 1036, "negativeIncrease": 5397, "total": 174800, "totalTestResultsIncrease": 6461, "posNeg": 174800, "deathIncrease": 20, "hospitalizedIncrease": 118, "hash": "2eb0633f0fbd0c2a512d5c3808bb26131919d320", "commercialScore": 0, "negativeRegularScore": 0, "negativeScore": 0, "positiveScore": 0, "score": 0, "grade": "", "month_number_label": "2020-05", "date_label": "2020-05-02", "week_number_label": "2020W18", "week_start_label": "2020-04-27"}, {"date": 20200503, "state": "GA", "positive": 28602, "probableCases": null, "negative": 146494, "pending": null, "totalTestResultsSource": "totalTestsViral", "totalTestResults": 172968, "hospitalizedCurrently": 1410, "hospitalizedCumulative": 5393, "inIcuCurrently": null, "inIcuCumulative": 1249, "onVentilatorCurrently": null, "onVentilatorCumulative": null, "recovered": null, "dataQualityGrade": "A", "lastUpdateEt": "5/3/2020 10:25", "dateModified": "2020-05-03T10:25:00Z", "checkTimeEt": "05/03 06:25", "death": 1177, "hospitalized": 5393, "dateChecked": "2020-05-03T10:25:00Z", "totalTestsViral": 172968, "positiveTestsViral": 23985, "negativeTestsViral": null, "positiveCasesViral": 28602, "deathConfirmed": null, "deathProbable": null, "totalTestEncountersViral": null, "totalTestsPeopleViral": null, "totalTestsAntibody": null, "positiveTestsAntibody": null, "negativeTestsAntibody": null, "totalTestsPeopleAntibody": null, "positiveTestsPeopleAntibody": null, "negativeTestsPeopleAntibody": null, "totalTestsPeopleAntigen": null, "positiveTestsPeopleAntigen": null, "totalTestsAntigen": null, "positiveTestsAntigen": null, "fips": "13", "positiveIncrease": 296, "negativeIncrease": 0, "total": 175096, "totalTestResultsIncrease": 445, "posNeg": 175096, "deathIncrease": 3, "hospitalizedIncrease": 6, "hash": "5540dcaff4d9b95e404b1e558ede35006b3b6405", "commercialScore": 0, "negativeRegularScore": 0, "negativeScore": 0, "positiveScore": 0, "score": 0, "grade": "", "month_number_label": "2020-05", "date_label": "2020-05-03", "week_number_label": "2020W18", "week_start_label": "2020-04-27"}, {"date": 20200504, "state": "GA", "positive": 29368, "probableCases": null, "negative": 153957, "pending": null, "totalTestResultsSource": "totalTestsViral", "totalTestResults": 185541, "hospitalizedCurrently": 1377, "hospitalizedCumulative": 5526, "inIcuCurrently": null, "inIcuCumulative": 1284, "onVentilatorCurrently": null, "onVentilatorCumulative": null, "recovered": null, "dataQualityGrade": "A", "lastUpdateEt": "5/4/2020 15:25", "dateModified": "2020-05-04T15:25:00Z", "checkTimeEt": "05/04 11:25", "death": 1222, "hospitalized": 5526, "dateChecked": "2020-05-04T15:25:00Z", "totalTestsViral": 185541, "positiveTestsViral": 24899, "negativeTestsViral": null, "positiveCasesViral": 29368, "deathConfirmed": null, "deathProbable": null, "totalTestEncountersViral": null, "totalTestsPeopleViral": null, "totalTestsAntibody": null, "positiveTestsAntibody": null, "negativeTestsAntibody": null, "totalTestsPeopleAntibody": null, "positiveTestsPeopleAntibody": null, "negativeTestsPeopleAntibody": null, "totalTestsPeopleAntigen": null, "positiveTestsPeopleAntigen": null, "totalTestsAntigen": null, "positiveTestsAntigen": null, "fips": "13", "positiveIncrease": 766, "negativeIncrease": 7463, "total": 183325, "totalTestResultsIncrease": 12573, "posNeg": 183325, "deathIncrease": 45, "hospitalizedIncrease": 133, "hash": "93612f2ff7aca2ccbb87b138a714123c29d902d0", "commercialScore": 0, "negativeRegularScore": 0, "negativeScore": 0, "positiveScore": 0, "score": 0, "grade": "", "month_number_label": "2020-05", "date_label": "2020-05-04", "week_number_label": "2020W19", "week_start_label": "2020-05-04"}, {"date": 20200505, "state": "GA", "positive": 29711, "probableCases": null, "negative": 171172, "pending": null, "totalTestResultsSource": "totalTestsViral", "totalTestResults": 190322, "hospitalizedCurrently": 1343, "hospitalizedCumulative": 5634, "inIcuCurrently": null, "inIcuCumulative": 1318, "onVentilatorCurrently": null, "onVentilatorCumulative": null, "recovered": null, "dataQualityGrade": "A", "lastUpdateEt": "5/5/2020 16:25", "dateModified": "2020-05-05T16:25:00Z", "checkTimeEt": "05/05 12:25", "death": 1288, "hospitalized": 5634, "dateChecked": "2020-05-05T16:25:00Z", "totalTestsViral": 190322, "positiveTestsViral": 25197, "negativeTestsViral": null, "positiveCasesViral": 29711, "deathConfirmed": null, "deathProbable": null, "totalTestEncountersViral": null, "totalTestsPeopleViral": null, "totalTestsAntibody": null, "positiveTestsAntibody": null, "negativeTestsAntibody": null, "totalTestsPeopleAntibody": null, "positiveTestsPeopleAntibody": null, "negativeTestsPeopleAntibody": null, "totalTestsPeopleAntigen": null, "positiveTestsPeopleAntigen": null, "totalTestsAntigen": null, "positiveTestsAntigen": null, "fips": "13", "positiveIncrease": 343, "negativeIncrease": 17215, "total": 200883, "totalTestResultsIncrease": 4781, "posNeg": 200883, "deathIncrease": 66, "hospitalizedIncrease": 108, "hash": "f85a5db2241e3f489aba54f50a8eaa5b3ec8272b", "commercialScore": 0, "negativeRegularScore": 0, "negativeScore":