[{"date": 20200303, "state": "VT", "positive": null, "probableCases": null, "negative": null, "pending": null, "totalTestResultsSource": "totalTestsViral", "totalTestResults": 0, "hospitalizedCurrently": null, "hospitalizedCumulative": null, "inIcuCurrently": null, "inIcuCumulative": null, "onVentilatorCurrently": null, "onVentilatorCumulative": null, "recovered": null, "dataQualityGrade": null, "lastUpdateEt": null, "dateModified": null, "checkTimeEt": null, "death": null, "hospitalized": null, "dateChecked": null, "totalTestsViral": 0, "positiveTestsViral": null, "negativeTestsViral": null, "positiveCasesViral": null, "deathConfirmed": null, "deathProbable": null, "totalTestEncountersViral": null, "totalTestsPeopleViral": null, "totalTestsAntibody": null, "positiveTestsAntibody": null, "negativeTestsAntibody": null, "totalTestsPeopleAntibody": null, "positiveTestsPeopleAntibody": null, "negativeTestsPeopleAntibody": null, "totalTestsPeopleAntigen": null, "positiveTestsPeopleAntigen": null, "totalTestsAntigen": null, "positiveTestsAntigen": null, "fips": "50", "positiveIncrease": 0, "negativeIncrease": 0, "total": 0, "totalTestResultsIncrease": 0, "posNeg": 0, "deathIncrease": 0, "hospitalizedIncrease": 0, "hash": "9cd138baa99bcdf4f99edcc8e21fa83b70b42faf", "commercialScore": 0, "negativeRegularScore": 0, "negativeScore": 0, "positiveScore": 0, "score": 0, "grade": "", "month_number_label": "2020-03", "date_label": "2020-03-03", "week_number_label": "2020W10", "week_start_label": "2020-03-02"}, {"date": 20200304, "state": "VT", "positive": null, "probableCases": null, "negative": null, "pending": null, "totalTestResultsSource": "totalTestsViral", "totalTestResults": 3, "hospitalizedCurrently": null, "hospitalizedCumulative": null, "inIcuCurrently": null, "inIcuCumulative": null, "onVentilatorCurrently": null, "onVentilatorCumulative": null, "recovered": null, "dataQualityGrade": null, "lastUpdateEt": null, "dateModified": null, "checkTimeEt": null, "death": null, "hospitalized": null, "dateChecked": null, "totalTestsViral": 3, "positiveTestsViral": null, "negativeTestsViral": null, "positiveCasesViral": null, "deathConfirmed": null, "deathProbable": null, "totalTestEncountersViral": null, "totalTestsPeopleViral": null, "totalTestsAntibody": null, "positiveTestsAntibody": null, "negativeTestsAntibody": null, "totalTestsPeopleAntibody": null, "positiveTestsPeopleAntibody": null, "negativeTestsPeopleAntibody": null, "totalTestsPeopleAntigen": null, "positiveTestsPeopleAntigen": null, "totalTestsAntigen": null, "positiveTestsAntigen": null, "fips": "50", "positiveIncrease": 0, "negativeIncrease": 0, "total": 0, "totalTestResultsIncrease": 3, "posNeg": 0, "deathIncrease": 0, "hospitalizedIncrease": 0, "hash": "dd437406d85765dfab8480e897b493cc58993d9b", "commercialScore": 0, "negativeRegularScore": 0, "negativeScore": 0, "positiveScore": 0, "score": 0, "grade": "", "month_number_label": "2020-03", "date_label": "2020-03-04", "week_number_label": "2020W10", "week_start_label": "2020-03-02"}, {"date": 20200305, "state": "VT", "positive": null, "probableCases": null, "negative": null, "pending": null, "totalTestResultsSource": "totalTestsViral", "totalTestResults": 6, "hospitalizedCurrently": null, "hospitalizedCumulative": null, "inIcuCurrently": null, "inIcuCumulative": null, "onVentilatorCurrently": null, "onVentilatorCumulative": null, "recovered": null, "dataQualityGrade": null, "lastUpdateEt": null, "dateModified": null, "checkTimeEt": null, "death": null, "hospitalized": null, "dateChecked": null, "totalTestsViral": 6, "positiveTestsViral": null, "negativeTestsViral": null, "positiveCasesViral": null, "deathConfirmed": null, "deathProbable": null, "totalTestEncountersViral": null, "totalTestsPeopleViral": null, "totalTestsAntibody": null, "positiveTestsAntibody": null, "negativeTestsAntibody": null, "totalTestsPeopleAntibody": null, "positiveTestsPeopleAntibody": null, "negativeTestsPeopleAntibody": null, "totalTestsPeopleAntigen": null, "positiveTestsPeopleAntigen": null, "totalTestsAntigen": null, "positiveTestsAntigen": null, "fips": "50", "positiveIncrease": 0, "negativeIncrease": 0, "total": 0, "totalTestResultsIncrease": 3, "posNeg": 0, "deathIncrease": 0, "hospitalizedIncrease": 0, "hash": "8b6d25fb2bf76200fe506cf11cd964199322842c", "commercialScore": 0, "negativeRegularScore": 0, "negativeScore": 0, "positiveScore": 0, "score": 0, "grade": "", "month_number_label": "2020-03", "date_label": "2020-03-05", "week_number_label": "2020W10", "week_start_label": "2020-03-02"}, {"date": 20200306, "state": "VT", "positive": null, "probableCases": null, "negative": null, "pending": null, "totalTestResultsSource": "totalTestsViral", "totalTestResults": 10, "hospitalizedCurrently": null, "hospitalizedCumulative": null, "inIcuCurrently": null, "inIcuCumulative": null, "onVentilatorCurrently": null, "onVentilatorCumulative": null, "recovered": null, "dataQualityGrade": null, "lastUpdateEt": "3/6/2020 00:00", "dateModified": "2020-03-06T00:00:00Z", "checkTimeEt": "03/05 19:00", "death": null, "hospitalized": null, "dateChecked": "2020-03-06T00:00:00Z", "totalTestsViral": 10, "positiveTestsViral": null, "negativeTestsViral": null, "positiveCasesViral": null, "deathConfirmed": null, "deathProbable": null, "totalTestEncountersViral": null, "totalTestsPeopleViral": null, "totalTestsAntibody": null, "positiveTestsAntibody": null, "negativeTestsAntibody": null, "totalTestsPeopleAntibody": null, "positiveTestsPeopleAntibody": null, "negativeTestsPeopleAntibody": null, "totalTestsPeopleAntigen": null, "positiveTestsPeopleAntigen": null, "totalTestsAntigen": null, "positiveTestsAntigen": null, "fips": "50", "positiveIncrease": 0, "negativeIncrease": 0, "total": 0, "totalTestResultsIncrease": 4, "posNeg": 0, "deathIncrease": 0, "hospitalizedIncrease": 0, "hash": "d2999160daae16a6ac7588bf281133d6b92d5107", "commercialScore": 0, "negativeRegularScore": 0, "negativeScore": 0, "positiveScore": 0, "score": 0, "grade": "", "month_number_label": "2020-03", "date_label": "2020-03-06", "week_number_label": "2020W10", "week_start_label": "2020-03-02"}, {"date": 20200307, "state": "VT", "positive": null, "probableCases": null, "negative": null, "pending": null, "totalTestResultsSource": "totalTestsViral", "totalTestResults": 17, "hospitalizedCurrently": null, "hospitalizedCumulative": null, "inIcuCurrently": null, "inIcuCumulative": null, "onVentilatorCurrently": null, "onVentilatorCumulative": null, "recovered": null, "dataQualityGrade": null, "lastUpdateEt": "3/7/2020 00:00", "dateModified": "2020-03-07T00:00:00Z", "checkTimeEt": "03/06 19:00", "death": null, "hospitalized": null, "dateChecked": "2020-03-07T00:00:00Z", "totalTestsViral": 17, "positiveTestsViral": null, "negativeTestsViral": null, "positiveCasesViral": null, "deathConfirmed": null, "deathProbable": null, "totalTestEncountersViral": null, "totalTestsPeopleViral": null, "totalTestsAntibody": null, "positiveTestsAntibody": null, "negativeTestsAntibody": null, "totalTestsPeopleAntibody": null, "positiveTestsPeopleAntibody": null, "negativeTestsPeopleAntibody": null, "totalTestsPeopleAntigen": null, "positiveTestsPeopleAntigen": null, "totalTestsAntigen": null, "positiveTestsAntigen": null, "fips": "50", "positiveIncrease": 0, "negativeIncrease": 0, "total": 0, "totalTestResultsIncrease": 7, "posNeg": 0, "deathIncrease": 0, "hospitalizedIncrease": 0, "hash": "c5d2d627096de4ab8f012ac535ea497f02d621a7", "commercialScore": 0, "negativeRegularScore": 0, "negativeScore": 0, "positiveScore": 0, "score": 0, "grade": "", "month_number_label": "2020-03", "date_label": "2020-03-07", "week_number_label": "2020W10", "week_start_label": "2020-03-02"}, {"date": 20200308, "state": "VT", "positive": 1, "probableCases": 0, "negative": 23, "pending": null, "totalTestResultsSource": "totalTestsViral", "totalTestResults": 26, "hospitalizedCurrently": null, "hospitalizedCumulative": null, "inIcuCurrently": null, "inIcuCumulative": null, "onVentilatorCurrently": null, "onVentilatorCumulative": null, "recovered": null, "dataQualityGrade": null, "lastUpdateEt": "3/8/2020 00:00", "dateModified": "2020-03-08T00:00:00Z", "checkTimeEt": "03/07 19:00", "death": null, "hospitalized": null, "dateChecked": "2020-03-08T00:00:00Z", "totalTestsViral": 26, "positiveTestsViral": null, "negativeTestsViral": null, "positiveCasesViral": 1, "deathConfirmed": null, "deathProbable": null, "totalTestEncountersViral": null, "totalTestsPeopleViral": 24, "totalTestsAntibody": null, "positiveTestsAntibody": null, "negativeTestsAntibody": null, "totalTestsPeopleAntibody": null, "positiveTestsPeopleAntibody": null, "negativeTestsPeopleAntibody": null, "totalTestsPeopleAntigen": null, "positiveTestsPeopleAntigen": null, "totalTestsAntigen": null, "positiveTestsAntigen": null, "fips": "50", "positiveIncrease": 1, "negativeIncrease": 23, "total": 24, "totalTestResultsIncrease": 9, "posNeg": 24, "deathIncrease": 0, "hospitalizedIncrease": 0, "hash": "7b01197b983d6befdf7080c7ccc1ef9a553c0d3b", "commercialScore": 0, "negativeRegularScore": 0, "negativeScore": 0, "positiveScore": 0, "score": 0, "grade": "", "month_number_label": "2020-03", "date_label": "2020-03-08", "week_number_label": "2020W10", "week_start_label": "2020-03-02"}, {"date": 20200309, "state": "VT", "positive": 1, "probableCases": 0, "negative": 28, "pending": null, "totalTestResultsSource": "totalTestsViral", "totalTestResults": 31, "hospitalizedCurrently": null, "hospitalizedCumulative": null, "inIcuCurrently": null, "inIcuCumulative": null, "onVentilatorCurrently": null, "onVentilatorCumulative": null, "recovered": null, "dataQualityGrade": null, "lastUpdateEt": "3/9/2020 00:00", "dateModified": "2020-03-09T00:00:00Z", "checkTimeEt": "03/08 20:00", "death": null, "hospitalized": null, "dateChecked": "2020-03-09T00:00:00Z", "totalTestsViral": 31, "positiveTestsViral": null, "negativeTestsViral": null, "positiveCasesViral": 1, "deathConfirmed": null, "deathProbable": null, "totalTestEncountersViral": null, "totalTestsPeopleViral": 29, "totalTestsAntibody": null, "positiveTestsAntibody": null, "negativeTestsAntibody": null, "totalTestsPeopleAntibody": null, "positiveTestsPeopleAntibody": null, "negativeTestsPeopleAntibody": null, "totalTestsPeopleAntigen": null, "positiveTestsPeopleAntigen": null, "totalTestsAntigen": null, "positiveTestsAntigen": null, "fips": "50", "positiveIncrease": 0, "negativeIncrease": 5, "total": 29, "totalTestResultsIncrease": 5, "posNeg": 29, "deathIncrease": 0, "hospitalizedIncrease": 0, "hash": "16c7eef53b3e92cea491ba04833af1df5779e900", "commercialScore": 0, "negativeRegularScore": 0, "negativeScore": 0, "positiveScore": 0, "score": 0, "grade": "", "month_number_label": "2020-03", "date_label": "2020-03-09", "week_number_label": "2020W11", "week_start_label": "2020-03-09"}, {"date": 20200310, "state": "VT", "positive": 1, "probableCases": 0, "negative": 34, "pending": null, "totalTestResultsSource": "totalTestsViral", "totalTestResults": 38, "hospitalizedCurrently": null, "hospitalizedCumulative": null, "inIcuCurrently": null, "inIcuCumulative": null, "onVentilatorCurrently": null, "onVentilatorCumulative": null, "recovered": null, "dataQualityGrade": null, "lastUpdateEt": "3/10/2020 00:00", "dateModified": "2020-03-10T00:00:00Z", "checkTimeEt": "03/09 20:00", "death": null, "hospitalized": null, "dateChecked": "2020-03-10T00:00:00Z", "totalTestsViral": 38, "positiveTestsViral": null, "negativeTestsViral": null, "positiveCasesViral": 1, "deathConfirmed": null, "deathProbable": null, "totalTestEncountersViral": null, "totalTestsPeopleViral": 35, "totalTestsAntibody": null, "positiveTestsAntibody": null, "negativeTestsAntibody": null, "totalTestsPeopleAntibody": null, "positiveTestsPeopleAntibody": null, "negativeTestsPeopleAntibody": null, "totalTestsPeopleAntigen": null, "positiveTestsPeopleAntigen": null, "totalTestsAntigen": null, "positiveTestsAntigen": null, "fips": "50", "positiveIncrease": 0, "negativeIncrease": 6, "total": 35, "totalTestResultsIncrease": 7, "posNeg": 35, "deathIncrease": 0, "hospitalizedIncrease": 0, "hash": "041ded92358b56bd067673166ea5c6916f24cc74", "commercialScore": 0, "negativeRegularScore": 0, "negativeScore": 0, "positiveScore": 0, "score": 0, "grade": "", "month_number_label": "2020-03", "date_label": "2020-03-10", "week_number_label": "2020W11", "week_start_label": "2020-03-09"}, {"date": 20200311, "state": "VT", "positive": 1, "probableCases": 0, "negative": 57, "pending": null, "totalTestResultsSource": "totalTestsViral", "totalTestResults": 66, "hospitalizedCurrently": null, "hospitalizedCumulative": null, "inIcuCurrently": null, "inIcuCumulative": null, "onVentilatorCurrently": null, "onVentilatorCumulative": null, "recovered": null, "dataQualityGrade": null, "lastUpdateEt": "3/11/2020 00:00", "dateModified": "2020-03-11T00:00:00Z", "checkTimeEt": "03/10 20:00", "death": null, "hospitalized": null, "dateChecked": "2020-03-11T00:00:00Z", "totalTestsViral": 66, "positiveTestsViral": null, "negativeTestsViral": null, "positiveCasesViral": 1, "deathConfirmed": null, "deathProbable": null, "totalTestEncountersViral": null, "totalTestsPeopleViral": 58, "totalTestsAntibody": null, "positiveTestsAntibody": null, "negativeTestsAntibody": null, "totalTestsPeopleAntibody": null, "positiveTestsPeopleAntibody": null, "negativeTestsPeopleAntibody": null, "totalTestsPeopleAntigen": null, "positiveTestsPeopleAntigen": null, "totalTestsAntigen": null, "positiveTestsAntigen": null, "fips": "50", "positiveIncrease": 0, "negativeIncrease": 23, "total": 58, "totalTestResultsIncrease": 28, "posNeg": 58, "deathIncrease": 0, "hospitalizedIncrease": 0, "hash": "4214e8463a97e20ab7fe22de5af9c95715caaefb", "commercialScore": 0, "negativeRegularScore": 0, "negativeScore": 0, "positiveScore": 0, "score": 0, "grade": "", "month_number_label": "2020-03", "date_label": "2020-03-11", "week_number_label": "2020W11", "week_start_label": "2020-03-09"}, {"date": 20200312, "state": "VT", "positive": 2, "probableCases": 0, "negative": 88, "pending": null, "totalTestResultsSource": "totalTestsViral", "totalTestResults": 99, "hospitalizedCurrently": null, "hospitalizedCumulative": null, "inIcuCurrently": null, "inIcuCumulative": null, "onVentilatorCurrently": null, "onVentilatorCumulative": null, "recovered": null, "dataQualityGrade": null, "lastUpdateEt": "3/12/2020 00:00", "dateModified": "2020-03-12T00:00:00Z", "checkTimeEt": "03/11 20:00", "death": null, "hospitalized": null, "dateChecked": "2020-03-12T00:00:00Z", "totalTestsViral": 99, "positiveTestsViral": null, "negativeTestsViral": null, "positiveCasesViral": 2, "deathConfirmed": null, "deathProbable": null, "totalTestEncountersViral": null, "totalTestsPeopleViral": 90, "totalTestsAntibody": null, "positiveTestsAntibody": null, "negativeTestsAntibody": null, "totalTestsPeopleAntibody": null, "positiveTestsPeopleAntibody": null, "negativeTestsPeopleAntibody": null, "totalTestsPeopleAntigen": null, "positiveTestsPeopleAntigen": null, "totalTestsAntigen": null, "positiveTestsAntigen": null, "fips": "50", "positiveIncrease": 1, "negativeIncrease": 31, "total": 90, "totalTestResultsIncrease": 33, "posNeg": 90, "deathIncrease": 0, "hospitalizedIncrease": 0, "hash": "6e9411a8c4f0ad5df99ea7cb3b4745fd5c2a2757", "commercialScore": 0, "negativeRegularScore": 0, "negativeScore": 0, "positiveScore": 0, "score": 0, "grade": "", "month_number_label": "2020-03", "date_label": "2020-03-12", "week_number_label": "2020W11", "week_start_label": "2020-03-09"}, {"date": 20200313, "state": "VT", "positive": 2, "probableCases": 0, "negative": 132, "pending": null, "totalTestResultsSource": "totalTestsViral", "totalTestResults": 149, "hospitalizedCurrently": null, "hospitalizedCumulative": null, "inIcuCurrently": null, "inIcuCumulative": null, "onVentilatorCurrently": null, "onVentilatorCumulative": null, "recovered": null, "dataQualityGrade": null, "lastUpdateEt": "3/13/2020 00:00", "dateModified": "2020-03-13T00:00:00Z", "checkTimeEt": "03/12 20:00", "death": null, "hospitalized": null, "dateChecked": "2020-03-13T00:00:00Z", "totalTestsViral": 149, "positiveTestsViral": null, "negativeTestsViral": null, "positiveCasesViral": 2, "deathConfirmed": null, "deathProbable": null, "totalTestEncountersViral": null, "totalTestsPeopleViral": 134, "totalTestsAntibody": null, "positiveTestsAntibody": null, "negativeTestsAntibody": null, "totalTestsPeopleAntibody": null, "positiveTestsPeopleAntibody": null, "negativeTestsPeopleAntibody": null, "totalTestsPeopleAntigen": null, "positiveTestsPeopleAntigen": null, "totalTestsAntigen": null, "positiveTestsAntigen": null, "fips": "50", "positiveIncrease": 0, "negativeIncrease": 44, "total": 134, "totalTestResultsIncrease": 50, "posNeg": 134, "deathIncrease": 0, "hospitalizedIncrease": 0, "hash": "c9dd59b16ac0f1ade60e2f46ca9c1d17e8455710", "commercialScore": 0, "negativeRegularScore": 0, "negativeScore": 0, "positiveScore": 0, "score": 0, "grade": "", "month_number_label": "2020-03", "date_label": "2020-03-13", "week_number_label": "2020W11", "week_start_label": "2020-03-09"}, {"date": 20200314, "state": "VT", "positive": 5, "probableCases": 0, "negative": 218, "pending": null, "totalTestResultsSource": "totalTestsViral", "totalTestResults": 238, "hospitalizedCurrently": null, "hospitalizedCumulative": null, "inIcuCurrently": null, "inIcuCumulative": null, "onVentilatorCurrently": null, "onVentilatorCumulative": null, "recovered": null, "dataQualityGrade": null, "lastUpdateEt": "3/14/2020 00:00", "dateModified": "2020-03-14T00:00:00Z", "checkTimeEt": "03/13 20:00", "death": null, "hospitalized": null, "dateChecked": "2020-03-14T00:00:00Z", "totalTestsViral": 238, "positiveTestsViral": null, "negativeTestsViral": null, "positiveCasesViral": 5, "deathConfirmed": null, "deathProbable": null, "totalTestEncountersViral": null, "totalTestsPeopleViral": 223, "totalTestsAntibody": null, "positiveTestsAntibody": null, "negativeTestsAntibody": null, "totalTestsPeopleAntibody": null, "positiveTestsPeopleAntibody": null, "negativeTestsPeopleAntibody": null, "totalTestsPeopleAntigen": null, "positiveTestsPeopleAntigen": null, "totalTestsAntigen": null, "positiveTestsAntigen": null, "fips": "50", "positiveIncrease": 3, "negativeIncrease": 86, "total": 223, "totalTestResultsIncrease": 89, "posNeg": 223, "deathIncrease": 0, "hospitalizedIncrease": 0, "hash": "bb46550ec64efb348514f6a9926c282713c16ad7", "commercialScore": 0, "negativeRegularScore": 0, "negativeScore": 0, "positiveScore": 0, "score": 0, "grade": "", "month_number_label": "2020-03", "date_label": "2020-03-14", "week_number_label": "2020W11", "week_start_label": "2020-03-09"}, {"date": 20200315, "state": "VT", "positive": 8, "probableCases": 0, "negative": 320, "pending": null, "totalTestResultsSource": "totalTestsViral", "totalTestResults": 370, "hospitalizedCurrently": null, "hospitalizedCumulative": null, "inIcuCurrently": null, "inIcuCumulative": null, "onVentilatorCurrently": null, "onVentilatorCumulative": null, "recovered": null, "dataQualityGrade": null, "lastUpdateEt": "3/15/2020 00:00", "dateModified": "2020-03-15T00:00:00Z", "checkTimeEt": "03/14 20:00", "death": null, "hospitalized": null, "dateChecked": "2020-03-15T00:00:00Z", "totalTestsViral": 370, "positiveTestsViral": null, "negativeTestsViral": null, "positiveCasesViral": 8, "deathConfirmed": null, "deathProbable": null, "totalTestEncountersViral": null, "totalTestsPeopleViral": 328, "totalTestsAntibody": null, "positiveTestsAntibody": null, "negativeTestsAntibody": null, "totalTestsPeopleAntibody": null, "positiveTestsPeopleAntibody": null, "negativeTestsPeopleAntibody": null, "totalTestsPeopleAntigen": null, "positiveTestsPeopleAntigen": null, "totalTestsAntigen": null, "positiveTestsAntigen": null, "fips": "50", "positiveIncrease": 3, "negativeIncrease": 102, "total": 328, "totalTestResultsIncrease": 132, "posNeg": 328, "deathIncrease": 0, "hospitalizedIncrease": 0, "hash": "2139437f97edcb107ea688cd843c1bed985d4d4e", "commercialScore": 0, "negativeRegularScore": 0, "negativeScore": 0, "positiveScore": 0, "score": 0, "grade": "", "month_number_label": "2020-03", "date_label": "2020-03-15", "week_number_label": "2020W11", "week_start_label": "2020-03-09"}, {"date": 20200316, "state": "VT", "positive": 12, "probableCases": 0, "negative": 392, "pending": null, "totalTestResultsSource": "totalTestsViral", "totalTestResults": 428, "hospitalizedCurrently": null, "hospitalizedCumulative": null, "inIcuCurrently": null, "inIcuCumulative": null, "onVentilatorCurrently": null, "onVentilatorCumulative": null, "recovered": null, "dataQualityGrade": null, "lastUpdateEt": "3/16/2020 00:00", "dateModified": "2020-03-16T00:00:00Z", "checkTimeEt": "03/15 20:00", "death": null, "hospitalized": null, "dateChecked": "2020-03-16T00:00:00Z", "totalTestsViral": 428, "positiveTestsViral": null, "negativeTestsViral": null, "positiveCasesViral": 12, "deathConfirmed": null, "deathProbable": null, "totalTestEncountersViral": null, "totalTestsPeopleViral": 404, "totalTestsAntibody": null, "positiveTestsAntibody": null, "negativeTestsAntibody": null, "totalTestsPeopleAntibody": null, "positiveTestsPeopleAntibody": null, "negativeTestsPeopleAntibody": null, "totalTestsPeopleAntigen": null, "positiveTestsPeopleAntigen": null, "totalTestsAntigen": null, "positiveTestsAntigen": null, "fips": "50", "positiveIncrease": 4, "negativeIncrease": 72, "total": 404, "totalTestResultsIncrease": 58, "posNeg": 404, "deathIncrease": 0, "hospitalizedIncrease": 0, "hash": "5960aef150718bd46c608f5aff66c2a250132bf4", "commercialScore": 0, "negativeRegularScore": 0, "negativeScore": 0, "positiveScore": 0, "score": 0, "grade": "", "month_number_label": "2020-03", "date_label": "2020-03-16", "week_number_label": "2020W12", "week_start_label": "2020-03-16"}, {"date": 20200317, "state": "VT", "positive": 17, "probableCases": 0, "negative": 473, "pending": null, "totalTestResultsSource": "totalTestsViral", "totalTestResults": 549, "hospitalizedCurrently": null, "hospitalizedCumulative": null, "inIcuCurrently": null, "inIcuCumulative": null, "onVentilatorCurrently": null, "onVentilatorCumulative": null, "recovered": null, "dataQualityGrade": null, "lastUpdateEt": "3/17/2020 00:00", "dateModified": "2020-03-17T00:00:00Z", "checkTimeEt": "03/16 20:00", "death": null, "hospitalized": null, "dateChecked": "2020-03-17T00:00:00Z", "totalTestsViral": 549, "positiveTestsViral": null, "negativeTestsViral": null, "positiveCasesViral": 17, "deathConfirmed": null, "deathProbable": null, "totalTestEncountersViral": null, "totalTestsPeopleViral": 490, "totalTestsAntibody": null, "positiveTestsAntibody": null, "negativeTestsAntibody": null, "totalTestsPeopleAntibody": null, "positiveTestsPeopleAntibody": null, "negativeTestsPeopleAntibody": null, "totalTestsPeopleAntigen": null, "positiveTestsPeopleAntigen": null, "totalTestsAntigen": null, "positiveTestsAntigen": null, "fips": "50", "positiveIncrease": 5, "negativeIncrease": 81, "total": 490, "totalTestResultsIncrease": 121, "posNeg": 490, "deathIncrease": 0, "hospitalizedIncrease": 0, "hash": "e0dc45f091675eab1f157b4e9cd717ea650d1397", "commercialScore": 0, "negativeRegularScore": 0, "negativeScore": 0, "positiveScore": 0, "score": 0, "grade": "", "month_number_label": "2020-03", "date_label": "2020-03-17", "week_number_label": "2020W12", "week_start_label": "2020-03-16"}, {"date": 20200318, "state": "VT", "positive": 19, "probableCases": 0, "negative": 565, "pending": null, "totalTestResultsSource": "totalTestsViral", "totalTestResults": 811, "hospitalizedCurrently": null, "hospitalizedCumulative": null, "inIcuCurrently": null, "inIcuCumulative": null, "onVentilatorCurrently": null, "onVentilatorCumulative": null, "recovered": null, "dataQualityGrade": null, "lastUpdateEt": "3/18/2020 00:00", "dateModified": "2020-03-18T00:00:00Z", "checkTimeEt": "03/17 20:00", "death": null, "hospitalized": null, "dateChecked": "2020-03-18T00:00:00Z", "totalTestsViral": 811, "positiveTestsViral": null, "negativeTestsViral": null, "positiveCasesViral": 19, "deathConfirmed": null, "deathProbable": null, "totalTestEncountersViral": null, "totalTestsPeopleViral": 584, "totalTestsAntibody": null, "positiveTestsAntibody": null, "negativeTestsAntibody": null, "totalTestsPeopleAntibody": null, "positiveTestsPeopleAntibody": null, "negativeTestsPeopleAntibody": null, "totalTestsPeopleAntigen": null, "positiveTestsPeopleAntigen": null, "totalTestsAntigen": null, "positiveTestsAntigen": null, "fips": "50", "positiveIncrease": 2, "negativeIncrease": 92, "total": 584, "totalTestResultsIncrease": 262, "posNeg": 584, "deathIncrease": 0, "hospitalizedIncrease": 0, "hash": "8094387b16b98c4185a8a7ea7c23fa2778215d2f", "commercialScore": 0, "negativeRegularScore": 0, "negativeScore": 0, "positiveScore": 0, "score": 0, "grade": "", "month_number_label": "2020-03", "date_label": "2020-03-18", "week_number_label": "2020W12", "week_start_label": "2020-03-16"}, {"date": 20200319, "state": "VT", "positive": 21, "probableCases": 0, "negative": 619, "pending": null, "totalTestResultsSource": "totalTestsViral", "totalTestResults": 1135, "hospitalizedCurrently": null, "hospitalizedCumulative": null, "inIcuCurrently": null, "inIcuCumulative": null, "onVentilatorCurrently": null, "onVentilatorCumulative": null, "recovered": null, "dataQualityGrade": null, "lastUpdateEt": "3/19/2020 00:00", "dateModified": "2020-03-19T00:00:00Z", "checkTimeEt": "03/18 20:00", "death": null, "hospitalized": null, "dateChecked": "2020-03-19T00:00:00Z", "totalTestsViral": 1135, "positiveTestsViral": null, "negativeTestsViral": null, "positiveCasesViral": 21, "deathConfirmed": null, "deathProbable": null, "totalTestEncountersViral": null, "totalTestsPeopleViral": 640, "totalTestsAntibody": null, "positiveTestsAntibody": null, "negativeTestsAntibody": null, "totalTestsPeopleAntibody": null, "positiveTestsPeopleAntibody": null, "negativeTestsPeopleAntibody": null, "totalTestsPeopleAntigen": null, "positiveTestsPeopleAntigen": null, "totalTestsAntigen": null, "positiveTestsAntigen": null, "fips": "50", "positiveIncrease": 2, "negativeIncrease": 54, "total": 640, "totalTestResultsIncrease": 324, "posNeg": 640, "deathIncrease": 0, "hospitalizedIncrease": 0, "hash": "67b82fee31496266a5ac4a878ca77713a5ad7157", "commercialScore": 0, "negativeRegularScore": 0, "negativeScore": 0, "positiveScore": 0, "score": 0, "grade": "", "month_number_label": "2020-03", "date_label": "2020-03-19", "week_number_label": "2020W12", "week_start_label": "2020-03-16"}, {"date": 20200320, "state": "VT", "positive": 28, "probableCases": 0, "negative": 742, "pending": null, "totalTestResultsSource": "totalTestsViral", "totalTestResults": 1422, "hospitalizedCurrently": null, "hospitalizedCumulative": null, "inIcuCurrently": null, "inIcuCumulative": null, "onVentilatorCurrently": null, "onVentilatorCumulative": null, "recovered": null, "dataQualityGrade": null, "lastUpdateEt": "3/20/2020 00:00", "dateModified": "2020-03-20T00:00:00Z", "checkTimeEt": "03/19 20:00", "death": 2, "hospitalized": null, "dateChecked": "2020-03-20T00:00:00Z", "totalTestsViral": 1422, "positiveTestsViral": null, "negativeTestsViral": null, "positiveCasesViral": 28, "deathConfirmed": null, "deathProbable": null, "totalTestEncountersViral": null, "totalTestsPeopleViral": 770, "totalTestsAntibody": null, "positiveTestsAntibody": null, "negativeTestsAntibody": null, "totalTestsPeopleAntibody": null, "positiveTestsPeopleAntibody": null, "negativeTestsPeopleAntibody": null, "totalTestsPeopleAntigen": null, "positiveTestsPeopleAntigen": null, "totalTestsAntigen": null, "positiveTestsAntigen": null, "fips": "50", "positiveIncrease": 7, "negativeIncrease": 123, "total": 770, "totalTestResultsIncrease": 287, "posNeg": 770, "deathIncrease": 2, "hospitalizedIncrease": 0, "hash": "13e68673fc681892dcd14121bbffc7c3f48f8242", "commercialScore": 0, "negativeRegularScore": 0, "negativeScore": 0, "positiveScore": 0, "score": 0, "grade": "", "month_number_label": "2020-03", "date_label": "2020-03-20", "week_number_label": "2020W12", "week_start_label": "2020-03-16"}, {"date": 20200321, "state": "VT", "positive": 44, "probableCases": 0, "negative": 943, "pending": null, "totalTestResultsSource": "totalTestsViral", "totalTestResults": 1457, "hospitalizedCurrently": null, "hospitalizedCumulative": null, "inIcuCurrently": null, "inIcuCumulative": null, "onVentilatorCurrently": null, "onVentilatorCumulative": null, "recovered": null, "dataQualityGrade": null, "lastUpdateEt": "3/21/2020 00:00", "dateModified": "2020-03-21T00:00:00Z", "checkTimeEt": "03/20 20:00", "death": 2, "hospitalized": null, "dateChecked": "2020-03-21T00:00:00Z", "totalTestsViral": 1457, "positiveTestsViral": null, "negativeTestsViral": null, "positiveCasesViral": 44, "deathConfirmed": null, "deathProbable": null, "totalTestEncountersViral": null, "totalTestsPeopleViral": 987, "totalTestsAntibody": null, "positiveTestsAntibody": null, "negativeTestsAntibody": null, "totalTestsPeopleAntibody": null, "positiveTestsPeopleAntibody": null, "negativeTestsPeopleAntibody": null, "totalTestsPeopleAntigen": null, "positiveTestsPeopleAntigen": null, "totalTestsAntigen": null, "positiveTestsAntigen": null, "fips": "50", "positiveIncrease": 16, "negativeIncrease": 201, "total": 987, "totalTestResultsIncrease": 35, "posNeg": 987, "deathIncrease": 0, "hospitalizedIncrease": 0, "hash": "7c494658bbb6b955fa51b9b891bab569db8675c6", "commercialScore": 0, "negativeRegularScore": 0, "negativeScore": 0, "positiveScore": 0, "score": 0, "grade": "", "month_number_label": "2020-03", "date_label": "2020-03-21", "week_number_label": "2020W12", "week_start_label": "2020-03-16"}, {"date": 20200322, "state": "VT", "positive": 52, "probableCases": 0, "negative": 1088, "pending": null, "totalTestResultsSource": "totalTestsViral", "totalTestResults": 1547, "hospitalizedCurrently": null, "hospitalizedCumulative": null, "inIcuCurrently": null, "inIcuCumulative": null, "onVentilatorCurrently": null, "onVentilatorCumulative": null, "recovered": null, "dataQualityGrade": null, "lastUpdateEt": "3/22/2020 00:00", "dateModified": "2020-03-22T00:00:00Z", "checkTimeEt": "03/21 20:00", "death": 2, "hospitalized": null, "dateChecked": "2020-03-22T00:00:00Z", "totalTestsViral": 1547, "positiveTestsViral": null, "negativeTestsViral": null, "positiveCasesViral": 52, "deathConfirmed": null, "deathProbable": null, "totalTestEncountersViral": null, "totalTestsPeopleViral": 1140, "totalTestsAntibody": null, "positiveTestsAntibody": null, "negativeTestsAntibody": null, "totalTestsPeopleAntibody": null, "positiveTestsPeopleAntibody": null, "negativeTestsPeopleAntibody": null, "totalTestsPeopleAntigen": null, "positiveTestsPeopleAntigen": null, "totalTestsAntigen": null, "positiveTestsAntigen": null, "fips": "50", "positiveIncrease": 8, "negativeIncrease": 145, "total": 1140, "totalTestResultsIncrease": 90, "posNeg": 1140, "deathIncrease": 0, "hospitalizedIncrease": 0, "hash": "5307b1a6d4c6aa9437fc5580331f549f089876a7", "commercialScore": 0, "negativeRegularScore": 0, "negativeScore": 0, "positiveScore": 0, "score": 0, "grade": "", "month_number_label": "2020-03", "date_label": "2020-03-22", "week_number_label": "2020W12", "week_start_label": "2020-03-16"}, {"date": 20200323, "state": "VT", "positive": 76, "probableCases": 0, "negative": 1282, "pending": null, "totalTestResultsSource": "totalTestsViral", "totalTestResults": 1724, "hospitalizedCurrently": null, "hospitalizedCumulative": null, "inIcuCurrently": null, "inIcuCumulative": null, "onVentilatorCurrently": null, "onVentilatorCumulative": null, "recovered": null, "dataQualityGrade": "A", "lastUpdateEt": "3/23/2020 00:00", "dateModified": "2020-03-23T00:00:00Z", "checkTimeEt": "03/22 20:00", "death": 5, "hospitalized": null, "dateChecked": "2020-03-23T00:00:00Z", "totalTestsViral": 1724, "positiveTestsViral": null, "negativeTestsViral": null, "positiveCasesViral": 76, "deathConfirmed": null, "deathProbable": null, "totalTestEncountersViral": null, "totalTestsPeopleViral": 1358, "totalTestsAntibody": null, "positiveTestsAntibody": null, "negativeTestsAntibody": null, "totalTestsPeopleAntibody": null, "positiveTestsPeopleAntibody": null, "negativeTestsPeopleAntibody": null, "totalTestsPeopleAntigen": null, "positiveTestsPeopleAntigen": null, "totalTestsAntigen": null, "positiveTestsAntigen": null, "fips": "50", "positiveIncrease": 24, "negativeIncrease": 194, "total": 1358, "totalTestResultsIncrease": 177, "posNeg": 1358, "deathIncrease": 3, "hospitalizedIncrease": 0, "hash": "5da98d0f46a63daf19db7dd904b089bac759cf5c", "commercialScore": 0, "negativeRegularScore": 0, "negativeScore": 0, "positiveScore": 0, "score": 0, "grade": "", "month_number_label": "2020-03", "date_label": "2020-03-23", "week_number_label": "2020W13", "week_start_label": "2020-03-23"}, {"date": 20200324, "state": "VT", "positive": 97, "probableCases": 0, "negative": 1405, "pending": null, "totalTestResultsSource": "totalTestsViral", "totalTestResults": 1878, "hospitalizedCurrently": null, "hospitalizedCumulative": null, "inIcuCurrently": null, "inIcuCumulative": null, "onVentilatorCurrently": null, "onVentilatorCumulative": null, "recovered": null, "dataQualityGrade": "A", "lastUpdateEt": "3/24/2020 00:00", "dateModified": "2020-03-24T00:00:00Z", "checkTimeEt": "03/23 20:00", "death": 7, "hospitalized": null, "dateChecked": "2020-03-24T00:00:00Z", "totalTestsViral": 1878, "positiveTestsViral": null, "negativeTestsViral": null, "positiveCasesViral": 97, "deathConfirmed": null, "deathProbable": null, "totalTestEncountersViral": null, "totalTestsPeopleViral": 1502, "totalTestsAntibody": null, "positiveTestsAntibody": null, "negativeTestsAntibody": null, "totalTestsPeopleAntibody": null, "positiveTestsPeopleAntibody": null, "negativeTestsPeopleAntibody": null, "totalTestsPeopleAntigen": null, "positiveTestsPeopleAntigen": null, "totalTestsAntigen": null, "positiveTestsAntigen": null, "fips": "50", "positiveIncrease": 21, "negativeIncrease": 123, "total": 1502, "totalTestResultsIncrease": 154, "posNeg": 1502, "deathIncrease": 2, "hospitalizedIncrease": 0, "hash": "dbdf7259d15d4dfcbdf1f029fcd82b4bd0e4accb", "commercialScore": 0, "negativeRegularScore": 0, "negativeScore": 0, "positiveScore": 0, "score": 0, "grade": "", "month_number_label": "2020-03", "date_label": "2020-03-24", "week_number_label": "2020W13", "week_start_label": "2020-03-23"}, {"date": 20200325, "state": "VT", "positive": 125, "probableCases": 0, "negative": 1631, "pending": null, "totalTestResultsSource": "totalTestsViral", "totalTestResults": 2144, "hospitalizedCurrently": null, "hospitalizedCumulative": null, "inIcuCurrently": null, "inIcuCumulative": null, "onVentilatorCurrently": null, "onVentilatorCumulative": null, "recovered": null, "dataQualityGrade": "A", "lastUpdateEt": "3/25/2020 00:00", "dateModified": "2020-03-25T00:00:00Z", "checkTimeEt": "03/24 20:00", "death": 8, "hospitalized": null, "dateChecked": "2020-03-25T00:00:00Z", "totalTestsViral": 2144, "positiveTestsViral": null, "negativeTestsViral": null, "positiveCasesViral": 125, "deathConfirmed": null, "deathProbable": null, "totalTestEncountersViral": null, "totalTestsPeopleViral": 1756, "totalTestsAntibody": null, "positiveTestsAntibody": null, "negativeTestsAntibody": null, "totalTestsPeopleAntibody": null, "positiveTestsPeopleAntibody": null, "negativeTestsPeopleAntibody": null, "totalTestsPeopleAntigen": null, "positiveTestsPeopleAntigen": null, "totalTestsAntigen": null, "positiveTestsAntigen": null, "fips": "50", "positiveIncrease": 28, "negativeIncrease": 226, "total": 1756, "totalTestResultsIncrease": 266, "posNeg": 1756, "deathIncrease": 1, "hospitalizedIncrease": 0, "hash": "82c48d21a2be8ff52c6bd5dec21c786111c09338", "commercialScore": 0, "negativeRegularScore": 0, "negativeScore": 0, "positiveScore": 0, "score": 0, "grade": "", "month_number_label": "2020-03", "date_label": "2020-03-25", "week_number_label": "2020W13", "week_start_label": "2020-03-23"}, {"date": 20200326, "state": "VT", "positive": 160, "probableCases": 0, "negative": 2616, "pending": null, "totalTestResultsSource": "totalTestsViral", "totalTestResults": 3051, "hospitalizedCurrently": null, "hospitalizedCumulative": null, "inIcuCurrently": null, "inIcuCumulative": null, "onVentilatorCurrently": null, "onVentilatorCumulative": null, "recovered": null, "dataQualityGrade": "A", "lastUpdateEt": "3/26/2020 00:00", "dateModified": "2020-03-26T00:00:00Z", "checkTimeEt": "03/25 20:00", "death": 9, "hospitalized": null, "dateChecked": "2020-03-26T00:00:00Z", "totalTestsViral": 3051, "positiveTestsViral": null, "negativeTestsViral": null, "positiveCasesViral": 160, "deathConfirmed": null, "deathProbable": null, "totalTestEncountersViral": null, "totalTestsPeopleViral": 2776, "totalTestsAntibody": null, "positiveTestsAntibody": null, "negativeTestsAntibody": null, "totalTestsPeopleAntibody": null, "positiveTestsPeopleAntibody": null, "negativeTestsPeopleAntibody": null, "totalTestsPeopleAntigen": null, "positiveTestsPeopleAntigen": null, "totalTestsAntigen": null, "positiveTestsAntigen": null, "fips": "50", "positiveIncrease": 35, "negativeIncrease": 985, "total": 2776, "totalTestResultsIncrease": 907, "posNeg": 2776, "deathIncrease": 1, "hospitalizedIncrease": 0, "hash": "77479e4c20fa89f9dcf2c056738e4c145a56a65c", "commercialScore": 0, "negativeRegularScore": 0, "negativeScore": 0, "positiveScore": 0, "score": 0, "grade": "", "month_number_label": "2020-03", "date_label": "2020-03-26", "week_number_label": "2020W13", "week_start_label": "2020-03-23"}, {"date": 20200327, "state": "VT", "positive": 185, "probableCases": 0, "negative": 2786, "pending": null, "totalTestResultsSource": "totalTestsViral", "totalTestResults": 3248, "hospitalizedCurrently": null, "hospitalizedCumulative": 18, "inIcuCurrently": null, "inIcuCumulative": null, "onVentilatorCurrently": null, "onVentilatorCumulative": null, "recovered": null, "dataQualityGrade": "A", "lastUpdateEt": "3/27/2020 00:00", "dateModified": "2020-03-27T00:00:00Z", "checkTimeEt": "03/26 20:00", "death": 10, "hospitalized": 18, "dateChecked": "2020-03-27T00:00:00Z", "totalTestsViral": 3248, "positiveTestsViral": null, "negativeTestsViral": null, "positiveCasesViral": 185, "deathConfirmed": null, "deathProbable": null, "totalTestEncountersViral": null, "totalTestsPeopleViral": 2971, "totalTestsAntibody": null, "positiveTestsAntibody": null, "negativeTestsAntibody": null, "totalTestsPeopleAntibody": null, "positiveTestsPeopleAntibody": null, "negativeTestsPeopleAntibody": null, "totalTestsPeopleAntigen": null, "positiveTestsPeopleAntigen": null, "totalTestsAntigen": null, "positiveTestsAntigen": null, "fips": "50", "positiveIncrease": 25, "negativeIncrease": 170, "total": 2971, "totalTestResultsIncrease": 197, "posNeg": 2971, "deathIncrease": 1, "hospitalizedIncrease": 18, "hash": "13a33f0bbc1ee0a69cda635bd12a735f56870493", "commercialScore": 0, "negativeRegularScore": 0, "negativeScore": 0, "positiveScore": 0, "score": 0, "grade": "", "month_number_label": "2020-03", "date_label": "2020-03-27", "week_number_label": "2020W13", "week_start_label": "2020-03-23"}, {"date": 20200328, "state": "VT", "positive": 213, "probableCases": 0, "negative": 3106, "pending": null, "totalTestResultsSource": "totalTestsViral", "totalTestResults": 3608, "hospitalizedCurrently": null, "hospitalizedCumulative": 18, "inIcuCurrently": null, "inIcuCumulative": null, "onVentilatorCurrently": null, "onVentilatorCumulative": null, "recovered": null, "dataQualityGrade": "A", "lastUpdateEt": "3/28/2020 00:00", "dateModified": "2020-03-28T00:00:00Z", "checkTimeEt": "03/27 20:00", "death": 12, "hospitalized": 18, "dateChecked": "2020-03-28T00:00:00Z", "totalTestsViral": 3608, "positiveTestsViral": null, "negativeTestsViral": null, "positiveCasesViral": 213, "deathConfirmed": null, "deathProbable": null, "totalTestEncountersViral": null, "totalTestsPeopleViral": 3319, "totalTestsAntibody": null, "positiveTestsAntibody": null, "negativeTestsAntibody": null, "totalTestsPeopleAntibody": null, "positiveTestsPeopleAntibody": null, "negativeTestsPeopleAntibody": null, "totalTestsPeopleAntigen": null, "positiveTestsPeopleAntigen": null, "totalTestsAntigen": null, "positiveTestsAntigen": null, "fips": "50", "positiveIncrease": 28, "negativeIncrease": 320, "total": 3319, "totalTestResultsIncrease": 360, "posNeg": 3319, "deathIncrease": 2, "hospitalizedIncrease": 0, "hash": "2705a2ce2eb5dc4d91c6314f4e1b9b3dfeb02094", "commercialScore": 0, "negativeRegularScore": 0, "negativeScore": 0, "positiveScore": 0, "score": 0, "grade": "", "month_number_label": "2020-03", "date_label": "2020-03-28", "week_number_label": "2020W13", "week_start_label": "2020-03-23"}, {"date": 20200329, "state": "VT", "positive": 234, "probableCases": 0, "negative": 3374, "pending": null, "totalTestResultsSource": "totalTestsViral", "totalTestResults": 3917, "hospitalizedCurrently": null, "hospitalizedCumulative": 18, "inIcuCurrently": null, "inIcuCumulative": null, "onVentilatorCurrently": null, "onVentilatorCumulative": null, "recovered": null, "dataQualityGrade": "A", "lastUpdateEt": "3/29/2020 00:00", "dateModified": "2020-03-29T00:00:00Z", "checkTimeEt": "03/28 20:00", "death": 12, "hospitalized": 18, "dateChecked": "2020-03-29T00:00:00Z", "totalTestsViral": 3917, "positiveTestsViral": null, "negativeTestsViral": null, "positiveCasesViral": 234, "deathConfirmed": null, "deathProbable": null, "totalTestEncountersViral": null, "totalTestsPeopleViral": 3608, "totalTestsAntibody": null, "positiveTestsAntibody": null, "negativeTestsAntibody": null, "totalTestsPeopleAntibody": null, "positiveTestsPeopleAntibody": null, "negativeTestsPeopleAntibody": null, "totalTestsPeopleAntigen": null, "positiveTestsPeopleAntigen": null, "totalTestsAntigen": null, "positiveTestsAntigen": null, "fips": "50", "positiveIncrease": 21, "negativeIncrease": 268, "total": 3608, "totalTestResultsIncrease": 309, "posNeg": 3608, "deathIncrease": 0, "hospitalizedIncrease": 0, "hash": "62b9600c5cf562fb34d78373815f1c1c91c4bc28", "commercialScore": 0, "negativeRegularScore": 0, "negativeScore": 0, "positiveScore": 0, "score": 0, "grade": "", "month_number_label": "2020-03", "date_label": "2020-03-29", "week_number_label": "2020W13", "week_start_label": "2020-03-23"}, {"date": 20200330, "state": "VT", "positive": 256, "probableCases": 0, "negative": 3546, "pending": null, "totalTestResultsSource": "totalTestsViral", "totalTestResults": 4102, "hospitalizedCurrently": null, "hospitalizedCumulative": 18, "inIcuCurrently": null, "inIcuCumulative": null, "onVentilatorCurrently": null, "onVentilatorCumulative": null, "recovered": null, "dataQualityGrade": "A", "lastUpdateEt": "3/30/2020 00:00", "dateModified": "2020-03-30T00:00:00Z", "checkTimeEt": "03/29 20:00", "death": 12, "hospitalized": 18, "dateChecked": "2020-03-30T00:00:00Z", "totalTestsViral": 4102, "positiveTestsViral": null, "negativeTestsViral": null, "positiveCasesViral": 256, "deathConfirmed": null, "deathProbable": null, "totalTestEncountersViral": null, "totalTestsPeopleViral": 3802, "totalTestsAntibody": null, "positiveTestsAntibody": null, "negativeTestsAntibody": null, "totalTestsPeopleAntibody": null, "positiveTestsPeopleAntibody": null, "negativeTestsPeopleAntibody": null, "totalTestsPeopleAntigen": null, "positiveTestsPeopleAntigen": null, "totalTestsAntigen": null, "positiveTestsAntigen": null, "fips": "50", "positiveIncrease": 22, "negativeIncrease": 172, "total": 3802, "totalTestResultsIncrease": 185, "posNeg": 3802, "deathIncrease": 0, "hospitalizedIncrease": 0, "hash": "2f29f1d5480812b60b3ed088e880e4bd44972353", "commercialScore": 0, "negativeRegularScore": 0, "negativeScore": 0, "positiveScore": 0, "score": 0, "grade": "", "month_number_label": "2020-03", "date_label": "2020-03-30", "week_number_label": "2020W14", "week_start_label": "2020-03-30"}, {"date": 20200331, "state": "VT", "positive": 293, "probableCases": 0, "negative": 3839, "pending": null, "totalTestResultsSource": "totalTestsViral", "totalTestResults": 4447, "hospitalizedCurrently": 21, "hospitalizedCumulative": 36, "inIcuCurrently": null, "inIcuCumulative": null, "onVentilatorCurrently": null, "onVentilatorCumulative": null, "recovered": 15, "dataQualityGrade": "A", "lastUpdateEt": "3/31/2020 00:00", "dateModified": "2020-03-31T00:00:00Z", "checkTimeEt": "03/30 20:00", "death": 13, "hospitalized": 36, "dateChecked": "2020-03-31T00:00:00Z", "totalTestsViral": 4447, "positiveTestsViral": null, "negativeTestsViral": null, "positiveCasesViral": 293, "deathConfirmed": null, "deathProbable": null, "totalTestEncountersViral": null, "totalTestsPeopleViral": 4132, "totalTestsAntibody": null, "positiveTestsAntibody": null, "negativeTestsAntibody": null, "totalTestsPeopleAntibody": null, "positiveTestsPeopleAntibody": null, "negativeTestsPeopleAntibody": null, "totalTestsPeopleAntigen": null, "positiveTestsPeopleAntigen": null, "totalTestsAntigen": null, "positiveTestsAntigen": null, "fips": "50", "positiveIncrease": 37, "negativeIncrease": 293, "total": 4132, "totalTestResultsIncrease": 345, "posNeg": 4132, "deathIncrease": 1, "hospitalizedIncrease": 18, "hash": "f62f0f67981dabae51594e9eb033704791076faf", "commercialScore": 0, "negativeRegularScore": 0, "negativeScore": 0, "positiveScore": 0, "score": 0, "grade": "", "month_number_label": "2020-03", "date_label": "2020-03-31", "week_number_label": "2020W14", "week_start_label": "2020-03-30"}, {"date": 20200401, "state": "VT", "positive": 320, "probableCases": 0, "negative": 4019, "pending": null, "totalTestResultsSource": "totalTestsViral", "totalTestResults": 4662, "hospitalizedCurrently": 30, "hospitalizedCumulative": 45, "inIcuCurrently": null, "inIcuCumulative": null, "onVentilatorCurrently": null, "onVentilatorCumulative": null, "recovered": 15, "dataQualityGrade": "A", "lastUpdateEt": "4/1/2020 00:00", "dateModified": "2020-04-01T00:00:00Z", "checkTimeEt": "03/31 20:00", "death": 16, "hospitalized": 45, "dateChecked": "2020-04-01T00:00:00Z", "totalTestsViral": 4662, "positiveTestsViral": null, "negativeTestsViral": null, "positiveCasesViral": 320, "deathConfirmed": null, "deathProbable": null, "totalTestEncountersViral": null, "totalTestsPeopleViral": 4339, "totalTestsAntibody": null, "positiveTestsAntibody": null, "negativeTestsAntibody": null, "totalTestsPeopleAntibody": null, "positiveTestsPeopleAntibody": null, "negativeTestsPeopleAntibody": null, "totalTestsPeopleAntigen": null, "positiveTestsPeopleAntigen": null, "totalTestsAntigen": null, "positiveTestsAntigen": null, "fips": "50", "positiveIncrease": 27, "negativeIncrease": 180, "total": 4339, "totalTestResultsIncrease": 215, "posNeg": 4339, "deathIncrease": 3, "hospitalizedIncrease": 9, "hash": "2d305b5ded89c7ad2f4cd5f2e2d7f88abdf98ed3", "commercialScore": 0, "negativeRegularScore": 0, "negativeScore": 0, "positiveScore": 0, "score": 0, "grade": "", "month_number_label": "2020-04", "date_label": "2020-04-01", "week_number_label": "2020W14", "week_start_label": "2020-03-30"}, {"date": 20200402, "state": "VT", "positive": 359, "probableCases": 0, "negative": 4185, "pending": null, "totalTestResultsSource": "totalTestsViral", "totalTestResults": 4871, "hospitalizedCurrently": 29, "hospitalizedCumulative": 45, "inIcuCurrently": null, "inIcuCumulative": null, "onVentilatorCurrently": null, "onVentilatorCumulative": null, "recovered": 15, "dataQualityGrade": "A", "lastUpdateEt": "4/2/2020 00:00", "dateModified": "2020-04-02T00:00:00Z", "checkTimeEt": "04/01 20:00", "death": 17, "hospitalized": 45, "dateChecked": "2020-04-02T00:00:00Z", "totalTestsViral": 4871, "positiveTestsViral": null, "negativeTestsViral": null, "positiveCasesViral": 359, "deathConfirmed": null, "deathProbable": null, "totalTestEncountersViral": null, "totalTestsPeopleViral": 4544, "totalTestsAntibody": null, "positiveTestsAntibody": null, "negativeTestsAntibody": null, "totalTestsPeopleAntibody": null, "positiveTestsPeopleAntibody": null, "negativeTestsPeopleAntibody": null, "totalTestsPeopleAntigen": null, "positiveTestsPeopleAntigen": null, "totalTestsAntigen": null, "positiveTestsAntigen": null, "fips": "50", "positiveIncrease": 39, "negativeIncrease": 166, "total": 4544, "totalTestResultsIncrease": 209, "posNeg": 4544, "deathIncrease": 1, "hospitalizedIncrease": 0, "hash": "b57e1842c6a9f86d4890a6586cdb083b341c28e7", "commercialScore": 0, "negativeRegularScore": 0, "negativeScore": 0, "positiveScore": 0, "score": 0, "grade": "", "month_number_label": "2020-04", "date_label": "2020-04-02", "week_number_label": "2020W14", "week_start_label": "2020-03-30"}, {"date": 20200403, "state": "VT", "positive": 390, "probableCases": 0, "negative": 4658, "pending": null, "totalTestResultsSource": "totalTestsViral", "totalTestResults": 5380, "hospitalizedCurrently": 29, "hospitalizedCumulative": 45, "inIcuCurrently": null, "inIcuCumulative": null, "onVentilatorCurrently": null, "onVentilatorCumulative": null, "recovered": 15, "dataQualityGrade": "A", "lastUpdateEt": "4/3/2020 00:00", "dateModified": "2020-04-03T00:00:00Z", "checkTimeEt": "04/02 20:00", "death": 17, "hospitalized": 45, "dateChecked": "2020-04-03T00:00:00Z", "totalTestsViral": 5380, "positiveTestsViral": null, "negativeTestsViral": null, "positiveCasesViral": 390, "deathConfirmed": null, "deathProbable": null, "totalTestEncountersViral": null, "totalTestsPeopleViral": 5048, "totalTestsAntibody": null, "positiveTestsAntibody": null, "negativeTestsAntibody": null, "totalTestsPeopleAntibody": null, "positiveTestsPeopleAntibody": null, "negativeTestsPeopleAntibody": null, "totalTestsPeopleAntigen": null, "positiveTestsPeopleAntigen": null, "totalTestsAntigen": null, "positiveTestsAntigen": null, "fips": "50", "positiveIncrease": 31, "negativeIncrease": 473, "total": 5048, "totalTestResultsIncrease": 509, "posNeg": 5048, "deathIncrease": 0, "hospitalizedIncrease": 0, "hash": "55af7106e7869c264330535d42673e9e63640fc6", "commercialScore": 0, "negativeRegularScore": 0, "negativeScore": 0, "positiveScore": 0, "score": 0, "grade": "", "month_number_label": "2020-04", "date_label": "2020-04-03", "week_number_label": "2020W14", "week_start_label": "2020-03-30"}, {"date": 20200404, "state": "VT", "positive": 460, "probableCases": 0, "negative": 5090, "pending": null, "totalTestResultsSource": "totalTestsViral", "totalTestResults": 5891, "hospitalizedCurrently": 29, "hospitalizedCumulative": 45, "inIcuCurrently": null, "inIcuCumulative": null, "onVentilatorCurrently": null, "onVentilatorCumulative": null, "recovered": 15, "dataQualityGrade": "A", "lastUpdateEt": "4/4/2020 00:00", "dateModified": "2020-04-04T00:00:00Z", "checkTimeEt": "04/03 20:00", "death": 20, "hospitalized": 45, "dateChecked": "2020-04-04T00:00:00Z", "totalTestsViral": 5891, "positiveTestsViral": null, "negativeTestsViral": null, "positiveCasesViral": 460, "deathConfirmed": null, "deathProbable": null, "totalTestEncountersViral": null, "totalTestsPeopleViral": 5550, "totalTestsAntibody": null, "positiveTestsAntibody": null, "negativeTestsAntibody": null, "totalTestsPeopleAntibody": null, "positiveTestsPeopleAntibody": null, "negativeTestsPeopleAntibody": null, "totalTestsPeopleAntigen": null, "positiveTestsPeopleAntigen": null, "totalTestsAntigen": null, "positiveTestsAntigen": null, "fips": "50", "positiveIncrease": 70, "negativeIncrease": 432, "total": 5550, "totalTestResultsIncrease": 511, "posNeg": 5550, "deathIncrease": 3, "hospitalizedIncrease": 0, "hash": "4fc68cbf17953073ffa971227cc1503c78b60705", "commercialScore": 0, "negativeRegularScore": 0, "negativeScore": 0, "positiveScore": 0, "score": 0, "grade": "", "month_number_label": "2020-04", "date_label": "2020-04-04", "week_number_label": "2020W14", "week_start_label": "2020-03-30"}, {"date": 20200405, "state": "VT", "positive": 512, "probableCases": 0, "negative": 5660, "pending": null, "totalTestResultsSource": "totalTestsViral", "totalTestResults": 6493, "hospitalizedCurrently": 29, "hospitalizedCumulative": 45, "inIcuCurrently": null, "inIcuCumulative": null, "onVentilatorCurrently": null, "onVentilatorCumulative": null, "recovered": 15, "dataQualityGrade": "A", "lastUpdateEt": "4/5/2020 00:00", "dateModified": "2020-04-05T00:00:00Z", "checkTimeEt": "04/04 20:00", "death": 22, "hospitalized": 45, "dateChecked": "2020-04-05T00:00:00Z", "totalTestsViral": 6493, "positiveTestsViral": null, "negativeTestsViral": null, "positiveCasesViral": 512, "deathConfirmed": null, "deathProbable": null, "totalTestEncountersViral": null, "totalTestsPeopleViral": 6172, "totalTestsAntibody": null, "positiveTestsAntibody": null, "negativeTestsAntibody": null, "totalTestsPeopleAntibody": null, "positiveTestsPeopleAntibody": null, "negativeTestsPeopleAntibody": null, "totalTestsPeopleAntigen": null, "positiveTestsPeopleAntigen": null, "totalTestsAntigen": null, "positiveTestsAntigen": null, "fips": "50", "positiveIncrease": 52, "negativeIncrease": 570, "total": 6172, "totalTestResultsIncrease": 602, "posNeg": 6172, "deathIncrease": 2, "hospitalizedIncrease": 0, "hash": "9c2284da266c2ec7522c089515228bb8bf20252e", "commercialScore": 0, "negativeRegularScore": 0, "negativeScore": 0, "positiveScore": 0, "score": 0, "grade": "", "month_number_label": "2020-04", "date_label": "2020-04-05", "week_number_label": "2020W14", "week_start_label": "2020-03-30"}, {"date": 20200406, "state": "VT", "positive": 543, "probableCases": 0, "negative": 5984, "pending": null, "totalTestResultsSource": "totalTestsViral", "totalTestResults": 6882, "hospitalizedCurrently": 28, "hospitalizedCumulative": 45, "inIcuCurrently": null, "inIcuCumulative": null, "onVentilatorCurrently": null, "onVentilatorCumulative": null, "recovered": 15, "dataQualityGrade": "A", "lastUpdateEt": "4/6/2020 00:00", "dateModified": "2020-04-06T00:00:00Z", "checkTimeEt": "04/05 20:00", "death": 23, "hospitalized": 45, "dateChecked": "2020-04-06T00:00:00Z", "totalTestsViral": 6882, "positiveTestsViral": null, "negativeTestsViral": null, "positiveCasesViral": 543, "deathConfirmed": null, "deathProbable": null, "totalTestEncountersViral": null, "totalTestsPeopleViral": 6527, "totalTestsAntibody": null, "positiveTestsAntibody": null, "negativeTestsAntibody": null, "totalTestsPeopleAntibody": null, "positiveTestsPeopleAntibody": null, "negativeTestsPeopleAntibody": null, "totalTestsPeopleAntigen": null, "positiveTestsPeopleAntigen": null, "totalTestsAntigen": null, "positiveTestsAntigen": null, "fips": "50", "positiveIncrease": 31, "negativeIncrease": 324, "total": 6527, "totalTestResultsIncrease": 389, "posNeg": 6527, "deathIncrease": 1, "hospitalizedIncrease": 0, "hash": "ef09c3abcda134ff786bce227a4ddcf22d854afc", "commercialScore": 0, "negativeRegularScore": 0, "negativeScore": 0, "positiveScore": 0, "score": 0, "grade": "", "month_number_label": "2020-04", "date_label": "2020-04-06", "week_number_label": "2020W15", "week_start_label": "2020-04-06"}, {"date": 20200407, "state": "VT", "positive": 575, "probableCases": 0, "negative": 6453, "pending": null, "totalTestResultsSource": "totalTestsViral", "totalTestResults": 7394, "hospitalizedCurrently": 29, "hospitalizedCumulative": 45, "inIcuCurrently": null, "inIcuCumulative": null, "onVentilatorCurrently": null, "onVentilatorCumulative": null, "recovered": 15, "dataQualityGrade": "A", "lastUpdateEt": "4/7/2020 00:00", "dateModified": "2020-04-07T00:00:00Z", "checkTimeEt": "04/06 20:00", "death": 23, "hospitalized": 45, "dateChecked": "2020-04-07T00:00:00Z", "totalTestsViral": 7394, "positiveTestsViral": null, "negativeTestsViral": null, "positiveCasesViral": 575, "deathConfirmed": null, "deathProbable": null, "totalTestEncountersViral": null, "totalTestsPeopleViral": 7028, "totalTestsAntibody": null, "positiveTestsAntibody": null, "negativeTestsAntibody": null, "totalTestsPeopleAntibody": null, "positiveTestsPeopleAntibody": null, "negativeTestsPeopleAntibody": null, "totalTestsPeopleAntigen": null, "positiveTestsPeopleAntigen": null, "totalTestsAntigen": null, "positiveTestsAntigen": null, "fips": "50", "positiveIncrease": 32, "negativeIncrease": 469, "total": 7028, "totalTestResultsIncrease": 512, "posNeg": 7028, "deathIncrease": 0, "hospitalizedIncrease": 0, "hash": "4f0bf01d46dd4a9e528ee48286c99ba08c8634c3", "commercialScore": 0, "negativeRegularScore": 0, "negativeScore": 0, "positiveScore": 0, "score": 0, "grade": "", "month_number_label": "2020-04", "date_label": "2020-04-07", "week_number_label": "2020W15", "week_start_label": "2020-04-06"}, {"date": 20200408, "state": "VT", "positive": 608, "probableCases": 0, "negative": 6777, "pending": null, "totalTestResultsSource": "totalTestsViral", "totalTestResults": 7787, "hospitalizedCurrently": 35, "hospitalizedCumulative": 50, "inIcuCurrently": null, "inIcuCumulative": null, "onVentilatorCurrently": null, "onVentilatorCumulative": null, "recovered": 15, "dataQualityGrade": "A", "lastUpdateEt": "4/8/2020 00:00", "dateModified": "2020-04-08T00:00:00Z", "checkTimeEt": "04/07 20:00", "death": 23, "hospitalized": 50, "dateChecked": "2020-04-08T00:00:00Z", "totalTestsViral": 7787, "positiveTestsViral": null, "negativeTestsViral": null, "positiveCasesViral": 608, "deathConfirmed": null, "deathProbable": null, "totalTestEncountersViral": null, "totalTestsPeopleViral": 7385, "totalTestsAntibody": null, "positiveTestsAntibody": null, "negativeTestsAntibody": null, "totalTestsPeopleAntibody": null, "positiveTestsPeopleAntibody": null, "negativeTestsPeopleAntibody": null, "totalTestsPeopleAntigen": null, "positiveTestsPeopleAntigen": null, "totalTestsAntigen": null, "positiveTestsAntigen": null, "fips": "50", "positiveIncrease": 33, "negativeIncrease": 324, "total": 7385, "totalTestResultsIncrease": 393, "posNeg": 7385, "deathIncrease": 0, "hospitalizedIncrease": 5, "hash": "bca527a9bad07d6ad4d6e9f368b832ee55c225c3", "commercialScore": 0, "negativeRegularScore": 0, "negativeScore": 0, "positiveScore": 0, "score": 0, "grade": "", "month_number_label": "2020-04", "date_label": "2020-04-08", "week_number_label": "2020W15", "week_start_label": "2020-04-06"}, {"date": 20200409, "state": "VT", "positive": 631, "probableCases": 0, "negative": 6975, "pending": null, "totalTestResultsSource": "totalTestsViral", "totalTestResults": 8164, "hospitalizedCurrently": 33, "hospitalizedCumulative": null, "inIcuCurrently": null, "inIcuCumulative": null, "onVentilatorCurrently": null, "onVentilatorCumulative": null, "recovered": 15, "dataQualityGrade": "A", "lastUpdateEt": "4/9/2020 00:00", "dateModified": "2020-04-09T00:00:00Z", "checkTimeEt": "04/08 20:00", "death": 23, "hospitalized": null, "dateChecked": "2020-04-09T00:00:00Z", "totalTestsViral": 8164, "positiveTestsViral": null, "negativeTestsViral": null, "positiveCasesViral": 631, "deathConfirmed": null, "deathProbable": null, "totalTestEncountersViral": null, "totalTestsPeopleViral": 7606, "totalTestsAntibody": null, "positiveTestsAntibody": null, "negativeTestsAntibody": null, "totalTestsPeopleAntibody": null, "positiveTestsPeopleAntibody": null, "negativeTestsPeopleAntibody": null, "totalTestsPeopleAntigen": null, "positiveTestsPeopleAntigen": null, "totalTestsAntigen": null, "positiveTestsAntigen": null, "fips": "50", "positiveIncrease": 23, "negativeIncrease": 198, "total": 7606, "totalTestResultsIncrease": 377, "posNeg": 7606, "deathIncrease": 0, "hospitalizedIncrease": -50, "hash": "ee25186e68186d85c65fdf6b5b499fd34ace8409", "commercialScore": 0, "negativeRegularScore": 0, "negativeScore": 0, "positiveScore": 0, "score": 0, "grade": "", "month_number_label": "2020-04", "date_label": "2020-04-09", "week_number_label": "2020W15", "week_start_label": "2020-04-06"}, {"date": 20200410, "state": "VT", "positive": 680, "probableCases": 0, "negative": 7249, "pending": null, "totalTestResultsSource": "totalTestsViral", "totalTestResults": 8472, "hospitalizedCurrently": 32, "hospitalizedCumulative": null, "inIcuCurrently": null, "inIcuCumulative": null, "onVentilatorCurrently": null, "onVentilatorCumulative": null, "recovered": 15, "dataQualityGrade": "A", "lastUpdateEt": "4/10/2020 00:00", "dateModified": "2020-04-10T00:00:00Z", "checkTimeEt": "04/09 20:00", "death": 24, "hospitalized": null, "dateChecked": "2020-04-10T00:00:00Z", "totalTestsViral": 8472, "positiveTestsViral": null, "negativeTestsViral": null, "positiveCasesViral": 680, "deathConfirmed": null, "deathProbable": null, "totalTestEncountersViral": null, "totalTestsPeopleViral": 7929, "totalTestsAntibody": null, "positiveTestsAntibody": null, "negativeTestsAntibody": null, "totalTestsPeopleAntibody": null, "positiveTestsPeopleAntibody": null, "negativeTestsPeopleAntibody": null, "totalTestsPeopleAntigen": null, "positiveTestsPeopleAntigen": null, "totalTestsAntigen": null, "positiveTestsAntigen": null, "fips": "50", "positiveIncrease": 49, "negativeIncrease": 274, "total": 7929, "totalTestResultsIncrease": 308, "posNeg": 7929, "deathIncrease": 1, "hospitalizedIncrease": 0, "hash": "5bece2b80509e858b22756ae89c44cba3e308c84", "commercialScore": 0, "negativeRegularScore": 0, "negativeScore": 0, "positiveScore": 0, "score": 0, "grade": "", "month_number_label": "2020-04", "date_label": "2020-04-10", "week_number_label": "2020W15", "week_start_label": "2020-04-06"}, {"date": 20200411, "state": "VT", "positive": 713, "probableCases": 0, "negative": 7774, "pending": null, "totalTestResultsSource": "totalTestsViral", "totalTestResults": 9061, "hospitalizedCurrently": 77, "hospitalizedCumulative": null, "inIcuCurrently": null, "inIcuCumulative": null, "onVentilatorCurrently": null, "onVentilatorCumulative": null, "recovered": 15, "dataQualityGrade": "A", "lastUpdateEt": "4/11/2020 00:00", "dateModified": "2020-04-11T00:00:00Z", "checkTimeEt": "04/10 20:00", "death": 25, "hospitalized": null, "dateChecked": "2020-04-11T00:00:00Z", "totalTestsViral": 9061, "positiveTestsViral": null, "negativeTestsViral": null, "positiveCasesViral": 713, "deathConfirmed": null, "deathProbable": null, "totalTestEncountersViral": null, "totalTestsPeopleViral": 8487, "totalTestsAntibody": null, "positiveTestsAntibody": null, "negativeTestsAntibody": null, "totalTestsPeopleAntibody": null, "positiveTestsPeopleAntibody": null, "negativeTestsPeopleAntibody": null, "totalTestsPeopleAntigen": null, "positiveTestsPeopleAntigen": null, "totalTestsAntigen": null, "positiveTestsAntigen": null, "fips": "50", "positiveIncrease": 33, "negativeIncrease": 525, "total": 8487, "totalTestResultsIncrease": 589, "posNeg": 8487, "deathIncrease": 1, "hospitalizedIncrease": 0, "hash": "d3d9a230a78d2777f0ad2c410b928dc701a6829d", "commercialScore": 0, "negativeRegularScore": 0, "negativeScore": 0, "positiveScore": 0, "score": 0, "grade": "", "month_number_label": "2020-04", "date_label": "2020-04-11", "week_number_label": "2020W15", "week_start_label": "2020-04-06"}, {"date": 20200412, "state": "VT", "positive": 733, "probableCases": 0, "negative": 8316, "pending": null, "totalTestResultsSource": "totalTestsViral", "totalTestResults": 9609, "hospitalizedCurrently": 34, "hospitalizedCumulative": null, "inIcuCurrently": null, "inIcuCumulative": null, "onVentilatorCurrently": null, "onVentilatorCumulative": null, "recovered": 15, "dataQualityGrade": "A", "lastUpdateEt": "4/12/2020 00:00", "dateModified": "2020-04-12T00:00:00Z", "checkTimeEt": "04/11 20:00", "death": 27, "hospitalized": null, "dateChecked": "2020-04-12T00:00:00Z", "totalTestsViral": 9609, "positiveTestsViral": null, "negativeTestsViral": null, "positiveCasesViral": 733, "deathConfirmed": null, "deathProbable": null, "totalTestEncountersViral": null, "totalTestsPeopleViral": 9049, "totalTestsAntibody": null, "positiveTestsAntibody": null, "negativeTestsAntibody": null, "totalTestsPeopleAntibody": null, "positiveTestsPeopleAntibody": null, "negativeTestsPeopleAntibody": null, "totalTestsPeopleAntigen": null, "positiveTestsPeopleAntigen": null, "totalTestsAntigen": null, "positiveTestsAntigen": null, "fips": "50", "positiveIncrease": 20, "negativeIncrease": 542, "total": 9049, "totalTestResultsIncrease": 548, "posNeg": 9049, "deathIncrease": 2, "hospitalizedIncrease": 0, "hash": "6dab4c9b1538eba9e47a8bb0b4f9fada73e1fd55", "commercialScore": 0, "negativeRegularScore": 0, "negativeScore": 0, "positiveScore": 0, "score": 0, "grade": "", "month_number_label": "2020-04", "date_label": "2020-04-12", "week_number_label": "2020W15", "week_start_label": "2020-04-06"}, {"date": 20200413, "state": "VT", "positive": 754, "probableCases": 0, "negative": 8806, "pending": null, "totalTestResultsSource": "totalTestsViral", "totalTestResults": 10115, "hospitalizedCurrently": 33, "hospitalizedCumulative": null, "inIcuCurrently": null, "inIcuCumulative": null, "onVentilatorCurrently": null, "onVentilatorCumulative": null, "recovered": 15, "dataQualityGrade": "A", "lastUpdateEt": "4/13/2020 00:00", "dateModified": "2020-04-13T00:00:00Z", "checkTimeEt": "04/12 20:00", "death": 28, "hospitalized": null, "dateChecked": "2020-04-13T00:00:00Z", "totalTestsViral": 10115, "positiveTestsViral": null, "negativeTestsViral": null, "positiveCasesViral": 754, "deathConfirmed": null, "deathProbable": null, "totalTestEncountersViral": null, "totalTestsPeopleViral": 9560, "totalTestsAntibody": null, "positiveTestsAntibody": null, "negativeTestsAntibody": null, "totalTestsPeopleAntibody": null, "positiveTestsPeopleAntibody": null, "negativeTestsPeopleAntibody": null, "totalTestsPeopleAntigen": null, "positiveTestsPeopleAntigen": null, "totalTestsAntigen": null, "positiveTestsAntigen": null, "fips": "50", "positiveIncrease": 21, "negativeIncrease": 490, "total": 9560, "totalTestResultsIncrease": 506, "posNeg": 9560, "deathIncrease": 1, "hospitalizedIncrease": 0, "hash": "b2fc35ab35db33b18fd17ad0a877878a8c52eb3a", "commercialScore": 0, "negativeRegularScore": 0, "negativeScore": 0, "positiveScore": 0, "score": 0, "grade": "", "month_number_label": "2020-04", "date_label": "2020-04-13", "week_number_label": "2020W16", "week_start_label": "2020-04-13"}, {"date": 20200414, "state": "VT", "positive": 761, "probableCases": 0, "negative": 8975, "pending": null, "totalTestResultsSource": "totalTestsViral", "totalTestResults": 10342, "hospitalizedCurrently": 64, "hospitalizedCumulative": null, "inIcuCurrently": null, "inIcuCumulative": null, "onVentilatorCurrently": null, "onVentilatorCumulative": null, "recovered": 15, "dataQualityGrade": "A", "lastUpdateEt": "4/14/2020 00:00", "dateModified": "2020-04-14T00:00:00Z", "checkTimeEt": "04/13 20:00", "death": 29, "hospitalized": null, "dateChecked": "2020-04-14T00:00:00Z", "totalTestsViral": 10342, "positiveTestsViral": null, "negativeTestsViral": null, "positiveCasesViral": 761, "deathConfirmed": null, "deathProbable": null, "totalTestEncountersViral": null, "totalTestsPeopleViral": 9736, "totalTestsAntibody": null, "positiveTestsAntibody": null, "negativeTestsAntibody": null, "totalTestsPeopleAntibody": null, "positiveTestsPeopleAntibody": null, "negativeTestsPeopleAntibody": null, "totalTestsPeopleAntigen": null, "positiveTestsPeopleAntigen": null, "totalTestsAntigen": null, "positiveTestsAntigen": null, "fips": "50", "positiveIncrease": 7, "negativeIncrease": 169, "total": 9736, "totalTestResultsIncrease": 227, "posNeg": 9736, "deathIncrease": 1, "hospitalizedIncrease": 0, "hash": "c5a74d9d153c9bd0d86e058133ac6583dda0210f", "commercialScore": 0, "negativeRegularScore": 0, "negativeScore": 0, "positiveScore": 0, "score": 0, "grade": "", "month_number_label": "2020-04", "date_label": "2020-04-14", "week_number_label": "2020W16", "week_start_label": "2020-04-13"}, {"date": 20200415, "state": "VT", "positive": 770, "probableCases": 0, "negative": 9326, "pending": null, "totalTestResultsSource": "totalTestsViral", "totalTestResults": 10768, "hospitalizedCurrently": 63, "hospitalizedCumulative": null, "inIcuCurrently": null, "inIcuCumulative": null, "onVentilatorCurrently": null, "onVentilatorCumulative": null, "recovered": 15, "dataQualityGrade": "A", "lastUpdateEt": "4/15/2020 00:00", "dateModified": "2020-04-15T00:00:00Z", "checkTimeEt": "04/14 20:00", "death": 30, "hospitalized": null, "dateChecked": "2020-04-15T00:00:00Z", "totalTestsViral": 10768, "positiveTestsViral": null, "negativeTestsViral": null, "positiveCasesViral": 770, "deathConfirmed": null, "deathProbable": null, "totalTestEncountersViral": null, "totalTestsPeopleViral": 10096, "totalTestsAntibody": null, "positiveTestsAntibody": null, "negativeTestsAntibody": null, "totalTestsPeopleAntibody": null, "positiveTestsPeopleAntibody": null, "negativeTestsPeopleAntibody": null, "totalTestsPeopleAntigen": null, "positiveTestsPeopleAntigen": null, "totalTestsAntigen": null, "positiveTestsAntigen": null, "fips": "50", "positiveIncrease": 9, "negativeIncrease": 351, "total": 10096, "totalTestResultsIncrease": 426, "posNeg": 10096, "deathIncrease": 1, "hospitalizedIncrease": 0, "hash": "fc9f9dee6af2a4bae6fcd07eeaf2c2f3ca9264e6", "commercialScore": 0, "negativeRegularScore": 0, "negativeScore": 0, "positiveScore": 0, "score": 0, "grade": "", "month_number_label": "2020-04", "date_label": "2020-04-15", "week_number_label": "2020W16", "week_start_label": "2020-04-13"}, {"date": 20200416, "state": "VT", "positive": 779, "probableCases": 0, "negative": 9583, "pending": null, "totalTestResultsSource": "totalTestsViral", "totalTestResults": 11133, "hospitalizedCurrently": 58, "hospitalizedCumulative": null, "inIcuCurrently": null, "inIcuCumulative": null, "onVentilatorCurrently": null, "onVentilatorCumulative": null, "recovered": 15, "dataQualityGrade": "A", "lastUpdateEt": "4/16/2020 00:00", "dateModified": "2020-04-16T00:00:00Z", "checkTimeEt": "04/15 20:00", "death": 35, "hospitalized": null, "dateChecked": "2020-04-16T00:00:00Z", "totalTestsViral": 11133, "positiveTestsViral": null, "negativeTestsViral": null, "positiveCasesViral": 779, "deathConfirmed": null, "deathProbable": null, "totalTestEncountersViral": null, "totalTestsPeopleViral": 10362, "totalTestsAntibody": null, "positiveTestsAntibody": null, "negativeTestsAntibody": null, "totalTestsPeopleAntibody": null, "positiveTestsPeopleAntibody": null, "negativeTestsPeopleAntibody": null, "totalTestsPeopleAntigen": null, "positiveTestsPeopleAntigen": null, "totalTestsAntigen": null, "positiveTestsAntigen": null, "fips": "50", "positiveIncrease": 9, "negativeIncrease": 257, "total": 10362, "totalTestResultsIncrease": 365, "posNeg": 10362, "deathIncrease": 5, "hospitalizedIncrease": 0, "hash": "4d50dab00a138d2ae10232a8b6027125f8912260", "commercialScore": 0, "negativeRegularScore": 0, "negativeScore": 0, "positiveScore": 0, "score": 0, "grade": "", "month_number_label": "2020-04", "date_label": "2020-04-16", "week_number_label": "2020W16", "week_start_label": "2020-04-13"}, {"date": 20200417, "state": "VT", "positive": 792, "probableCases": 0, "negative": 10054, "pending": null, "totalTestResultsSource": "totalTestsViral", "totalTestResults": 11684, "hospitalizedCurrently": 32, "hospitalizedCumulative": null, "inIcuCurrently": null, "inIcuCumulative": null, "onVentilatorCurrently": null, "onVentilatorCumulative": null, "recovered": 15, "dataQualityGrade": "A", "lastUpdateEt": "4/17/2020 00:00", "dateModified": "2020-04-17T00:00:00Z", "checkTimeEt": "04/16 20:00", "death": 35, "hospitalized": null, "dateChecked": "2020-04-17T00:00:00Z", "totalTestsViral": 11684, "positiveTestsViral": null, "negativeTestsViral": null, "positiveCasesViral": 792, "deathConfirmed": null, "deathProbable": null, "totalTestEncountersViral": null, "totalTestsPeopleViral": 10846, "totalTestsAntibody": null, "positiveTestsAntibody": null, "negativeTestsAntibody": null, "totalTestsPeopleAntibody": null, "positiveTestsPeopleAntibody": null, "negativeTestsPeopleAntibody": null, "totalTestsPeopleAntigen": null, "positiveTestsPeopleAntigen": null, "totalTestsAntigen": null, "positiveTestsAntigen": null, "fips": "50", "positiveIncrease": 13, "negativeIncrease": 471, "total": 10846, "totalTestResultsIncrease": 551, "posNeg": 10846, "deathIncrease": 0, "hospitalizedIncrease": 0, "hash": "db5423b019d9f4c8ef6e1cb0f036ec4ea59859b7", "commercialScore": 0, "negativeRegularScore": 0, "negativeScore": 0, "positiveScore": 0, "score": 0, "grade": "", "month_number_label": "2020-04", "date_label": "2020-04-17", "week_number_label": "2020W16", "week_start_label": "2020-04-13"}, {"date": 20200418, "state": "VT", "positive": 802, "probableCases": 0, "negative": 10346, "pending": null, "totalTestResultsSource": "totalTestsViral", "totalTestResults": 12186, "hospitalizedCurrently": 56, "hospitalizedCumulative": null, "inIcuCurrently": null, "inIcuCumulative": null, "onVentilatorCurrently": null, "onVentilatorCumulative": null, "recovered": 15, "dataQualityGrade": "A", "lastUpdateEt": "4/18/2020 00:00", "dateModified": "2020-04-18T00:00:00Z", "checkTimeEt": "04/17 20:00", "death": 38, "hospitalized": null, "dateChecked": "2020-04-18T00:00:00Z", "totalTestsViral": 12186, "positiveTestsViral": null, "negativeTestsViral": null, "positiveCasesViral": 802, "deathConfirmed": null, "deathProbable": null, "totalTestEncountersViral": null, "totalTestsPeopleViral": 11148, "totalTestsAntibody": null, "positiveTestsAntibody": null, "negativeTestsAntibody": null, "totalTestsPeopleAntibody": null, "positiveTestsPeopleAntibody": null, "negativeTestsPeopleAntibody": null, "totalTestsPeopleAntigen": null, "positiveTestsPeopleAntigen": null, "totalTestsAntigen": null, "positiveTestsAntigen": null, "fips": "50", "positiveIncrease": 10, "negativeIncrease": 292, "total": 11148, "totalTestResultsIncrease": 502, "posNeg": 11148, "deathIncrease": 3, "hospitalizedIncrease": 0, "hash": "02b593d2fcb5006d4e7c7bbf455ce3e7a30afcfc", "commercialScore": 0, "negativeRegularScore": 0, "negativeScore": 0, "positiveScore": 0, "score": 0, "grade": "", "month_number_label": "2020-04", "date_label": "2020-04-18", "week_number_label": "2020W16", "week_start_label": "2020-04-13"}, {"date": 20200419, "state": "VT", "positive": 813, "probableCases": 0, "negative": 10514, "pending": null, "totalTestResultsSource": "totalTestsViral", "totalTestResults": 12481, "hospitalizedCurrently": 53, "hospitalizedCumulative": null, "inIcuCurrently": null, "inIcuCumulative": null, "onVentilatorCurrently": null, "onVentilatorCumulative": null, "recovered": 15, "dataQualityGrade": "A", "lastUpdateEt": "4/19/2020 00:00", "dateModified": "2020-04-19T00:00:00Z", "checkTimeEt": "04/18 20:00", "death": 38, "hospitalized": null, "dateChecked": "2020-04-19T00:00:00Z", "totalTestsViral": 12481, "positiveTestsViral": null, "negativeTestsViral": null, "positiveCasesViral": 813, "deathConfirmed": null, "deathProbable": null, "totalTestEncountersViral": null, "totalTestsPeopleViral": 11327, "totalTestsAntibody": null, "positiveTestsAntibody": null, "negativeTestsAntibody": null, "totalTestsPeopleAntibody": null, "positiveTestsPeopleAntibody": null, "negativeTestsPeopleAntibody": null, "totalTestsPeopleAntigen": null, "positiveTestsPeopleAntigen": null, "totalTestsAntigen": null, "positiveTestsAntigen": null, "fips": "50", "positiveIncrease": 11, "negativeIncrease": 168, "total": 11327, "totalTestResultsIncrease": 295, "posNeg": 11327, "deathIncrease": 0, "hospitalizedIncrease": 0, "hash": "c864b3a36a2f3ea34074c1f9f8b586d4b91ef874", "commercialScore": 0, "negativeRegularScore": 0, "negativeScore": 0, "positiveScore": 0, "score": 0, "grade": "", "month_number_label": "2020-04", "date_label": "2020-04-19", "week_number_label": "2020W16", "week_start_label": "2020-04-13"}, {"date": 20200420, "state": "VT", "positive": 817, "probableCases": 0, "negative": 10695, "pending": null, "totalTestResultsSource": "totalTestsViral", "totalTestResults": 12788, "hospitalizedCurrently": 49, "hospitalizedCumulative": null, "inIcuCurrently": null, "inIcuCumulative": null, "onVentilatorCurrently": null, "onVentilatorCumulative": null, "recovered": 15, "dataQualityGrade": "A", "lastUpdateEt": "4/20/2020 00:00", "dateModified": "2020-04-20T00:00:00Z", "checkTimeEt": "04/19 20:00", "death": 38, "hospitalized": null, "dateChecked": "2020-04-20T00:00:00Z", "totalTestsViral": 12788, "positiveTestsViral": null, "negativeTestsViral": null, "positiveCasesViral": 817, "deathConfirmed": null, "deathProbable": null, "totalTestEncountersViral": null, "totalTestsPeopleViral": 11512, "totalTestsAntibody": null, "positiveTestsAntibody": null, "negativeTestsAntibody": null, "totalTestsPeopleAntibody": null, "positiveTestsPeopleAntibody": null, "negativeTestsPeopleAntibody": null, "totalTestsPeopleAntigen": null, "positiveTestsPeopleAntigen": null, "totalTestsAntigen": null, "positiveTestsAntigen": null, "fips": "50", "positiveIncrease": 4, "negativeIncrease": 181, "total": 11512, "totalTestResultsIncrease": 307, "posNeg": 11512, "deathIncrease": 0, "hospitalizedIncrease": 0, "hash": "445e00e7582cfad348d7fd0f2be849b06757d3f2", "commercialScore": 0, "negativeRegularScore": 0, "negativeScore": 0, "positiveScore": 0, "score": 0, "grade": "", "month_number_label": "2020-04", "date_label": "2020-04-20", "week_number_label": "2020W17", "week_start_label": "2020-04-20"}, {"date": 20200421, "state": "VT", "positive": 820, "probableCases": 0, "negative": 10739, "pending": null, "totalTestResultsSource": "totalTestsViral", "totalTestResults": 12947, "hospitalizedCurrently": 41, "hospitalizedCumulative": null, "inIcuCurrently": null, "inIcuCumulative": null, "onVentilatorCurrently": null, "onVentilatorCumulative": null, "recovered": null, "dataQualityGrade": "A", "lastUpdateEt": "4/21/2020 00:00", "dateModified": "2020-04-21T00:00:00Z", "checkTimeEt": "04/20 20:00", "death": 40, "hospitalized": null, "dateChecked": "2020-04-21T00:00:00Z", "totalTestsViral": 12947, "positiveTestsViral": null, "negativeTestsViral": null, "positiveCasesViral": 820, "deathConfirmed": null, "deathProbable": null, "totalTestEncountersViral": null, "totalTestsPeopleViral": 11559, "totalTestsAntibody": null, "positiveTestsAntibody": null, "negativeTestsAntibody": null, "totalTestsPeopleAntibody": null, "positiveTestsPeopleAntibody": null, "negativeTestsPeopleAntibody": null, "totalTestsPeopleAntigen": null, "positiveTestsPeopleAntigen": null, "totalTestsAntigen": null, "positiveTestsAntigen": null, "fips": "50", "positiveIncrease": 3, "negativeIncrease": 44, "total": 11559, "totalTestResultsIncrease": 159, "posNeg": 11559, "deathIncrease": 2, "hospitalizedIncrease": 0, "hash": "b43e48c9d3a77c9d992c24047cca7029c12df6dc", "commercialScore": 0, "negativeRegularScore": 0, "negativeScore": 0, "positiveScore": 0, "score": 0, "grade": "", "month_number_label": "2020-04", "date_label": "2020-04-21", "week_number_label": "2020W17", "week_start_label": "2020-04-20"}, {"date": 20200422, "state": "VT", "positive": 828, "probableCases": 0, "negative": 10946, "pending": null, "totalTestResultsSource": "totalTestsViral", "totalTestResults": 13326, "hospitalizedCurrently": 37, "hospitalizedCumulative": null, "inIcuCurrently": null, "inIcuCumulative": null, "onVentilatorCurrently": null, "onVentilatorCumulative": null, "recovered": null, "dataQualityGrade": "A", "lastUpdateEt": "4/22/2020 00:00", "dateModified": "2020-04-22T00:00:00Z", "checkTimeEt": "04/21 20:00", "death": 40, "hospitalized": null, "dateChecked": "2020-04-22T00:00:00Z", "totalTestsViral": 13326, "positiveTestsViral": null, "negativeTestsViral": null, "positiveCasesViral": 828, "deathConfirmed": null, "deathProbable": null, "totalTestEncountersViral": null, "totalTestsPeopleViral": 11774, "totalTestsAntibody": null, "positiveTestsAntibody": null, "negativeTestsAntibody": null, "totalTestsPeopleAntibody": null, "positiveTestsPeopleAntibody": null, "negativeTestsPeopleAntibody": null, "totalTestsPeopleAntigen": null, "positiveTestsPeopleAntigen": null, "totalTestsAntigen": null, "positiveTestsAntigen": null, "fips": "50", "positiveIncrease": 8, "negativeIncrease": 207, "total": 11774, "totalTestResultsIncrease": 379, "posNeg": 11774, "deathIncrease": 0, "hospitalizedIncrease": 0, "hash": "b29629ea3d3dd3e03f57994d532aefc068170bb0", "commercialScore": 0, "negativeRegularScore": 0, "negativeScore": 0, "positiveScore": 0, "score": 0, "grade": "", "month_number_label": "2020-04", "date_label": "2020-04-22", "week_number_label": "2020W17", "week_start_label": "2020-04-20"}, {"date": 20200423, "state": "VT", "positive": 831, "probableCases": 0, "negative": 11231, "pending": null, "totalTestResultsSource": "totalTestsViral", "totalTestResults": 13929, "hospitalizedCurrently": 44, "hospitalizedCumulative": null, "inIcuCurrently": null, "inIcuCumulative": null, "onVentilatorCurrently": null, "onVentilatorCumulative": null, "recovered": null, "dataQualityGrade": "A", "lastUpdateEt": "4/23/2020 00:00", "dateModified": "2020-04-23T00:00:00Z", "checkTimeEt": "04/22 20:00", "death": 43, "hospitalized": null, "dateChecked": "2020-04-23T00:00:00Z", "totalTestsViral": 13929, "positiveTestsViral": null, "negativeTestsViral": null, "positiveCasesViral": 831, "deathConfirmed": null, "deathProbable": null, "totalTestEncountersViral": null, "totalTestsPeopleViral": 12062, "totalTestsAntibody": null, "positiveTestsAntibody": null, "negativeTestsAntibody": null, "totalTestsPeopleAntibody": null, "positiveTestsPeopleAntibody": null, "negativeTestsPeopleAntibody": null, "totalTestsPeopleAntigen": null, "positiveTestsPeopleAntigen": null, "totalTestsAntigen": null, "positiveTestsAntigen": null, "fips": "50", "positiveIncrease": 3, "negativeIncrease": 285, "total": 12062, "totalTestResultsIncrease": 603, "posNeg": 12062, "deathIncrease": 3, "hospitalizedIncrease": 0, "hash": "70ecd78355086bb2f68a6958960b3b54cd51e3f1", "commercialScore": 0, "negativeRegularScore": 0, "negativeScore": 0, "positiveScore": 0, "score": 0, "grade": "", "month_number_label": "2020-04", "date_label": "2020-04-23", "week_number_label": "2020W17", "week_start_label": "2020-04-20"}, {"date": 20200424, "state": "VT", "positive": 834, "probableCases": 0, "negative": 11515, "pending": null, "totalTestResultsSource": "totalTestsViral", "totalTestResults": 14408, "hospitalizedCurrently": 32, "hospitalizedCumulative": null, "inIcuCurrently": null, "inIcuCumulative": null, "onVentilatorCurrently": null, "onVentilatorCumulative": null, "recovered": null, "dataQualityGrade": "A", "lastUpdateEt": "4/24/2020 00:00", "dateModified": "2020-04-24T00:00:00Z", "checkTimeEt": "04/23 20:00", "death": 44, "hospitalized": null, "dateChecked": "2020-04-24T00:00:00Z", "totalTestsViral": 14408, "positiveTestsViral": null, "negativeTestsViral": null, "positiveCasesViral": 834, "deathConfirmed": null, "deathProbable": null, "totalTestEncountersViral": null, "totalTestsPeopleViral": 12349, "totalTestsAntibody": null, "positiveTestsAntibody": null, "negativeTestsAntibody": null, "totalTestsPeopleAntibody": null, "positiveTestsPeopleAntibody": null, "negativeTestsPeopleAntibody": null, "totalTestsPeopleAntigen": null, "positiveTestsPeopleAntigen": null, "totalTestsAntigen": null, "positiveTestsAntigen": null, "fips": "50", "positiveIncrease": 3, "negativeIncrease": 284, "total": 12349, "totalTestResultsIncrease": 479, "posNeg": 12349, "deathIncrease": 1, "hospitalizedIncrease": 0, "hash": "f2ecdb7a177b0632f46753d6cef33ccd6a3dd578", "commercialScore": 0, "negativeRegularScore": 0, "negativeScore": 0, "positiveScore": 0, "score": 0, "grade": "", "month_number_label": "2020-04", "date_label": "2020-04-24", "week_number_label": "2020W17", "week_start_label": "2020-04-20"}, {"date": 20200425, "state": "VT", "positive": 843, "probableCases": 0, "negative": 11814, "pending": null, "totalTestResultsSource": "totalTestsViral", "totalTestResults": 15166, "hospitalizedCurrently": 37, "hospitalizedCumulative": null, "inIcuCurrently": null, "inIcuCumulative": null, "onVentilatorCurrently": null, "onVentilatorCumulative": null, "recovered": null, "dataQualityGrade": "C", "lastUpdateEt": "4/25/2020 00:00", "dateModified": "2020-04-25T00:00:00Z", "checkTimeEt": "04/24 20:00", "death": 46, "hospitalized": null, "dateChecked": "2020-04-25T00:00:00Z", "totalTestsViral": 15166, "positiveTestsViral": null, "negativeTestsViral": null, "positiveCasesViral": 843, "deathConfirmed": null, "deathProbable": null, "totalTestEncountersViral": null, "totalTestsPeopleViral": 12657, "totalTestsAntibody": null, "positiveTestsAntibody": null, "negativeTestsAntibody": null, "totalTestsPeopleAntibody": null, "positiveTestsPeopleAntibody": null, "negativeTestsPeopleAntibody": null, "totalTestsPeopleAntigen": null, "positiveTestsPeopleAntigen": null, "totalTestsAntigen": null, "positiveTestsAntigen": null, "fips": "50", "positiveIncrease": 9, "negativeIncrease": 299, "total": 12657, "totalTestResultsIncrease": 758, "posNeg": 12657, "deathIncrease": 2, "hospitalizedIncrease": 0, "hash": "ab39c5f641063c0bbcc5116c8802b8f123e44014", "commercialScore": 0, "negativeRegularScore": 0, "negativeScore": 0, "positiveScore": 0, "score": 0, "grade": "", "month_number_label": "2020-04", "date_label": "2020-04-25", "week_number_label": "2020W17", "week_start_label": "2020-04-20"}, {"date": 20200426, "state": "VT", "positive": 852, "probableCases": 0, "negative": 11925, "pending": null, "totalTestResultsSource": "totalTestsViral", "totalTestResults": 15566, "hospitalizedCurrently": 34, "hospitalizedCumulative": null, "inIcuCurrently": null, "inIcuCumulative": null, "onVentilatorCurrently": null, "onVentilatorCumulative": null, "recovered": null, "dataQualityGrade": "C", "lastUpdateEt": "4/26/2020 00:00", "dateModified": "2020-04-26T00:00:00Z", "checkTimeEt": "04/25 20:00", "death": 46, "hospitalized": null, "dateChecked": "2020-04-26T00:00:00Z", "totalTestsViral": 15566, "positiveTestsViral": null, "negativeTestsViral": null, "positiveCasesViral": 852, "deathConfirmed": null, "deathProbable": null, "totalTestEncountersViral": null, "totalTestsPeopleViral": 12777, "totalTestsAntibody": null, "positiveTestsAntibody": null, "negativeTestsAntibody": null, "totalTestsPeopleAntibody": null, "positiveTestsPeopleAntibody": null, "negativeTestsPeopleAntibody": null, "totalTestsPeopleAntigen": null, "positiveTestsPeopleAntigen": null, "totalTestsAntigen": null, "positiveTestsAntigen": null, "fips": "50", "positiveIncrease": 9, "negativeIncrease": 111, "total": 12777, "totalTestResultsIncrease": 400, "posNeg": 12777, "deathIncrease": 0, "hospitalizedIncrease": 0, "hash": "69be9c5935859537716c7a92cb14d94b93350cb2", "commercialScore": 0, "negativeRegularScore": 0, "negativeScore": 0, "positiveScore": 0, "score": 0, "grade": "", "month_number_label": "2020-04", "date_label": "2020-04-26", "week_number_label": "2020W17", "week_start_label": "2020-04-20"}, {"date": 20200427, "state": "VT", "positive": 855, "probableCases": 0, "negative": 12146, "pending": null, "totalTestResultsSource": "totalTestsViral", "totalTestResults": 16137, "hospitalizedCurrently": 33, "hospitalizedCumulative": null, "inIcuCurrently": null, "inIcuCumulative": null, "onVentilatorCurrently": null, "onVentilatorCumulative": null, "recovered": null, "dataQualityGrade": "C", "lastUpdateEt": "4/27/2020 00:00", "dateModified": "2020-04-27T00:00:00Z", "checkTimeEt": "04/26 20:00", "death": 47, "hospitalized": null, "dateChecked": "2020-04-27T00:00:00Z", "totalTestsViral": 16137, "positiveTestsViral": null, "negativeTestsViral": null, "positiveCasesViral": 855, "deathConfirmed": null, "deathProbable": null, "totalTestEncountersViral": null, "totalTestsPeopleViral": 13001, "totalTestsAntibody": null, "positiveTestsAntibody": null, "negativeTestsAntibody": null, "totalTestsPeopleAntibody": null, "positiveTestsPeopleAntibody": null, "negativeTestsPeopleAntibody": null, "totalTestsPeopleAntigen": null, "positiveTestsPeopleAntigen": null, "totalTestsAntigen": null, "positiveTestsAntigen": null, "fips": "50", "positiveIncrease": 3, "negativeIncrease": 221, "total": 13001, "totalTestResultsIncrease": 571, "posNeg": 13001, "deathIncrease": 1, "hospitalizedIncrease": 0, "hash": "106ea8d42f3b634c24c9add7730ebe07cfc57e59", "commercialScore": 0, "negativeRegularScore": 0, "negativeScore": 0, "positiveScore": 0, "score": 0, "grade": "", "month_number_label": "2020-04", "date_label": "2020-04-27", "week_number_label": "2020W18", "week_start_label": "2020-04-27"}, {"date": 20200428, "state": "VT", "positive": 862, "probableCases": 0, "negative": 12261, "pending": null, "totalTestResultsSource": "totalTestsViral", "totalTestResults": 16430, "hospitalizedCurrently": 29, "hospitalizedCumulative": null, "inIcuCurrently": null, "inIcuCumulative": null, "onVentilatorCurrently": null, "onVentilatorCumulative": null, "recovered": null, "dataQualityGrade": "C", "lastUpdateEt": "4/28/2020 00:00", "dateModified": "2020-04-28T00:00:00Z", "checkTimeEt": "04/27 20:00", "death": 47, "hospitalized": null, "dateChecked": "2020-04-28T00:00:00Z", "totalTestsViral": 16430, "positiveTestsViral": null, "negativeTestsViral": null, "positiveCasesViral": 862, "deathConfirmed": null, "deathProbable": null, "totalTestEncountersViral": null, "totalTestsPeopleViral": 13123, "totalTestsAntibody": null, "positiveTestsAntibody": null, "negativeTestsAntibody": null, "totalTestsPeopleAntibody": null, "positiveTestsPeopleAntibody": null, "negativeTestsPeopleAntibody": null, "totalTestsPeopleAntigen": null, "positiveTestsPeopleAntigen": null, "totalTestsAntigen": null, "positiveTestsAntigen": null, "fips": "50", "positiveIncrease": 7, "negativeIncrease": 115, "total": 13123, "totalTestResultsIncrease": 293, "posNeg": 13123, "deathIncrease": 0, "hospitalizedIncrease": 0, "hash": "2d68c8fe786e6e44cd3ca8b18d3c2a014bd180be", "commercialScore": 0, "negativeRegularScore": 0, "negativeScore": 0, "positiveScore": 0, "score": 0, "grade": "", "month_number_label": "2020-04", "date_label": "2020-04-28", "week_number_label": "2020W18", "week_start_label": "2020-04-27"}, {"date": 20200429, "state": "VT", "positive": 862, "probableCases": 0, "negative": 12375, "pending": null, "totalTestResultsSource": "totalTestsViral", "totalTestResults": 16595, "hospitalizedCurrently": 26, "hospitalizedCumulative": null, "inIcuCurrently": null, "inIcuCumulative": null, "onVentilatorCurrently": null, "onVentilatorCumulative": null, "recovered": null, "dataQualityGrade": "C", "lastUpdateEt": "4/29/2020 00:00", "dateModified": "2020-04-29T00:00:00Z", "checkTimeEt": "04/28 20:00", "death": 47, "hospitalized": null, "dateChecked": "2020-04-29T00:00:00Z", "totalTestsViral": 16595, "positiveTestsViral": null, "negativeTestsViral": null, "positiveCasesViral": 862, "deathConfirmed": null, "deathProbable": null, "totalTestEncountersViral": null, "totalTestsPeopleViral": 13237, "totalTestsAntibody": null, "positiveTestsAntibody": null, "negativeTestsAntibody": null, "totalTestsPeopleAntibody": null, "positiveTestsPeopleAntibody": null, "negativeTestsPeopleAntibody": null, "totalTestsPeopleAntigen": null, "positiveTestsPeopleAntigen": null, "totalTestsAntigen": null, "positiveTestsAntigen": null, "fips": "50", "positiveIncrease": 0, "negativeIncrease": 114, "total": 13237, "totalTestResultsIncrease": 165, "posNeg": 13237, "deathIncrease": 0, "hospitalizedIncrease": 0, "hash": "653374965a3c9f32d6449ecf959b5e28e4719ac2", "commercialScore": 0, "negativeRegularScore": 0, "negativeScore": 0, "positiveScore": 0, "score": 0, "grade": "", "month_number_label": "2020-04", "date_label": "2020-04-29", "week_number_label": "2020W18", "week_start_label": "2020-04-27"}, {"date": 20200430, "state": "VT", "positive": 866, "probableCases": 0, "negative": 12569, "pending": null, "totalTestResultsSource": "totalTestsViral", "totalTestResults": 16851, "hospitalizedCurrently": 23, "hospitalizedCumulative": null, "inIcuCurrently": null, "inIcuCumulative": null, "onVentilatorCurrently": null, "onVentilatorCumulative": null, "recovered": null, "dataQualityGrade": "C", "lastUpdateEt": "4/30/2020 00:00", "dateModified": "2020-04-30T00:00:00Z", "checkTimeEt": "04/29 20:00", "death": 49, "hospitalized": null, "dateChecked": "2020-04-30T00:00:00Z", "totalTestsViral": 16851, "positiveTestsViral": null, "negativeTestsViral": null, "positiveCasesViral": 866, "deathConfirmed": null, "deathProbable": null, "totalTestEncountersViral": null, "totalTestsPeopleViral": 13435, "totalTestsAntibody": null, "positiveTestsAntibody": null, "negativeTestsAntibody": null, "totalTestsPeopleAntibody": null, "positiveTestsPeopleAntibody": null, "negativeTestsPeopleAntibody": null, "totalTestsPeopleAntigen": null, "positiveTestsPeopleAntigen": null, "totalTestsAntigen": null, "positiveTestsAntigen": null, "fips": "50", "positiveIncrease": 4, "negativeIncrease": 194, "total": 13435, "totalTestResultsIncrease": 256, "posNeg": 13435, "deathIncrease": 2, "hospitalizedIncrease": 0, "hash": "d951aff355c139b782eca1746a5ffacd048f2908", "commercialScore": 0, "negativeRegularScore": 0, "negativeScore": 0, "positiveScore": 0, "score": 0, "grade": "", "month_number_label": "2020-04", "date_label": "2020-04-30", "week_number_label": "2020W18", "week_start_label": "2020-04-27"}, {"date": 20200501, "state": "VT", "positive": 879, "probableCases": 0, "negative": 13093, "pending": null, "totalTestResultsSource": "totalTestsViral", "totalTestResults": 17899, "hospitalizedCurrently": 19, "hospitalizedCumulative": null, "inIcuCurrently": null, "inIcuCumulative": null, "onVentilatorCurrently": null, "onVentilatorCumulative": null, "recovered": null, "dataQualityGrade": "C", "lastUpdateEt": "5/1/2020 00:00", "dateModified": "2020-05-01T00:00:00Z", "checkTimeEt": "04/30 20:00", "death": 50, "hospitalized": null, "dateChecked": "2020-05-01T00:00:00Z", "totalTestsViral": 17899, "positiveTestsViral": null, "negativeTestsViral": null, "positiveCasesViral": 879, "deathConfirmed": null, "deathProbable": null, "totalTestEncountersViral": null, "totalTestsPeopleViral": 13972, "totalTestsAntibody": null, "positiveTestsAntibody": null, "negativeTestsAntibody": null, "totalTestsPeopleAntibody": null, "positiveTestsPeopleAntibody": null, "negativeTestsPeopleAntibody": null, "totalTestsPeopleAntigen": null, "positiveTestsPeopleAntigen": null, "totalTestsAntigen": null, "positiveTestsAntigen": null, "fips": "50", "positiveIncrease": 13, "negativeIncrease": 524, "total": 13972, "totalTestResultsIncrease": 1048, "posNeg": 13972, "deathIncrease": 1, "hospitalizedIncrease": 0, "hash": "01427efbd9b02eef70f6e36b6b3b046c01351543", "commercialScore": 0, "negativeRegularScore": 0, "negativeScore": 0, "positiveScore": 0, "score": 0, "grade": "", "month_number_label": "2020-05", "date_label": "2020-05-01", "week_number_label": "2020W18", "week_start_label": "2020-04-27"}, {"date": 20200502, "state": "VT", "positive": 885, "probableCases": 0, "negative": 13405, "pending": null, "totalTestResultsSource": "totalTestsViral", "totalTestResults": 18383, "hospitalizedCurrently": 11, "hospitalizedCumulative": null, "inIcuCurrently": null, "inIcuCumulative": null, "onVentilatorCurrently": null, "onVentilatorCumulative": null, "recovered": null, "dataQualityGrade": "C", "lastUpdateEt": "5/2/2020 00:00", "dateModified": "2020-05-02T00:00:00Z", "checkTimeEt": "05/01 20:00", "death": 51, "hospitalized": null, "dateChecked": "2020-05-02T00:00:00Z", "totalTestsViral": 18383, "positiveTestsViral": null, "negativeTestsViral": null, "positiveCasesViral": 885, "deathConfirmed": null, "deathProbable": null, "totalTestEncountersViral": null, "totalTestsPeopleViral": 14290, "totalTestsAntibody": null, "positiveTestsAntibody": null, "negativeTestsAntibody": null, "totalTestsPeopleAntibody": null, "positiveTestsPeopleAntibody": null, "negativeTestsPeopleAntibody": null, "totalTestsPeopleAntigen": null, "positiveTestsPeopleAntigen": null, "totalTestsAntigen": null, "positiveTestsAntigen": null, "fips": "50", "positiveIncrease": 6, "negativeIncrease": 312, "total": 14290, "totalTestResultsIncrease": 484, "posNeg": 14290, "deathIncrease": 1, "hospitalizedIncrease": 0, "hash": "fe8fbb2fc33c7a38c49264189059212a6d1a540b", "commercialScore": 0, "negativeRegularScore": 0, "negativeScore": 0, "positiveScore": 0, "score": 0, "grade": "", "month_number_label": "2020-05", "date_label": "2020-05-02", "week_number_label": "2020W18", "week_start_label": "2020-04-27"}, {"date": 20200503, "state": "VT", "positive": 896, "probableCases": 0, "negative": 13734, "pending": null, "totalTestResultsSource": "totalTestsViral", "totalTestResults": 18851, "hospitalizedCurrently": 19, "hospitalizedCumulative": null, "inIcuCurrently": null, "inIcuCumulative": null, "onVentilatorCurrently": null, "onVentilatorCumulative": null, "recovered": null, "dataQualityGrade": "C", "lastUpdateEt": "5/3/2020 00:00", "dateModified": "2020-05-03T00:00:00Z", "checkTimeEt": "05/02 20:00", "death": 52, "hospitalized": null, "dateChecked": "2020-05-03T00:00:00Z", "totalTestsViral": 18851, "positiveTestsViral": null, "negativeTestsViral": null, "positiveCasesViral": 896, "deathConfirmed": null, "deathProbable": null, "totalTestEncountersViral": null, "totalTestsPeopleViral": 14630, "totalTestsAntibody": null, "positiveTestsAntibody": null, "negativeTestsAntibody": null, "totalTestsPeopleAntibody": null, "positiveTestsPeopleAntibody": null, "negativeTestsPeopleAntibody": null, "totalTestsPeopleAntigen": null, "positiveTestsPeopleAntigen": null, "totalTestsAntigen": null, "positiveTestsAntigen": null, "fips": "50", "positiveIncrease": 11, "negativeIncrease": 329, "total": 14630, "totalTestResultsIncrease": 468, "posNeg": 14630, "deathIncrease": 1, "hospitalizedIncrease": 0, "hash": "695e969f54573cd1fe49fb712f72e9750734cb64", "commercialScore": 0, "negativeRegularScore": 0, "negativeScore": 0, "positiveScore": 0, "score": 0, "grade": "", "month_number_label": "2020-05", "date_label": "2020-05-03", "week_number_label": "2020W18", "week_start_label": "2020-04-27"}, {"date": 20200504, "state": "VT", "positive": 901, "probableCases": 0, "negative": 14049, "pending": null, "totalTestResultsSource": "totalTestsViral", "totalTestResults": 19414, "hospitalizedCurrently": 15, "hospitalizedCumulative": null, "inIcuCurrently": null, "inIcuCumulative": null, "onVentilatorCurrently": null, "onVentilatorCumulative": null, "recovered": null, "dataQualityGrade": "C", "lastUpdateEt": "5/4/2020 00:00", "dateModified": "2020-05-04T00:00:00Z", "checkTimeEt": "05/03 20:00", "death": 52, "hospitalized": null, "dateChecked": "2020-05-04T00:00:00Z", "totalTestsViral": 19414, "positiveTestsViral": null, "negativeTestsViral": null, "positiveCasesViral": 901, "deathConfirmed": 52, "deathProbable": null, "totalTestEncountersViral": null, "totalTestsPeopleViral": 14950, "totalTestsAntibody": null, "positiveTestsAntibody": null, "negativeTestsAntibody": null, "totalTestsPeopleAntibody": null, "positiveTestsPeopleAntibody": null, "negativeTestsPeopleAntibody": null, "totalTestsPeopleAntigen": null, "positiveTestsPeopleAntigen": null, "totalTestsAntigen": null, "positiveTestsAntigen": null, "fips": "50", "positiveIncrease": 5, "negativeIncrease": 315, "total": 14950, "totalTestResultsIncrease": 563, "posNeg": 14950, "deathIncrease": 0, "hospitalizedIncrease": 0, "hash": "5f0f9d71feb4e056b7c04c8424769e878db39fbd", "commercialScore": 0, "negativeRegularScore": 0, "negativeScore": 0, "positiveScore": 0, "score": 0, "grade": "", "month_number_label": "2020-05", "date_label": "2020-05-04", "week_number_label": "2020W19", "week_start_label": "2020-05-04"}, {"date": 20200505, "state": "VT", "positive": 906, "probableCases": 0, "negative": 14217, "pending": null, "totalTestResultsSource": "totalTestsViral", "totalTestResults": 19605, "hospitalizedCurrently": 33, "hospitalizedCumulative": null, "inIcuCurrently": 2, "inIcuCumulative": null, "onVentilatorCurrently": 0, "onVentilatorCumulative": null, "recovered": null, "dataQualityGrade": "B", "lastUpdateEt": "5/5/2020 00:00", "dateModified": "2020-05-05T00:00:00Z", "checkTi