[{"date": 20200307, "state": "AL", "positive": 0, "probableCases": null, "negative": null, "pending": null, "totalTestResultsSource": "totalTestsPeopleViral", "totalTestResults": 0, "hospitalizedCurrently": null, "hospitalizedCumulative": null, "inIcuCurrently": null, "inIcuCumulative": null, "onVentilatorCurrently": null, "onVentilatorCumulative": null, "recovered": null, "dataQualityGrade": null, "lastUpdateEt": null, "dateModified": null, "checkTimeEt": null, "death": null, "hospitalized": null, "dateChecked": null, "totalTestsViral": null, "positiveTestsViral": null, "negativeTestsViral": null, "positiveCasesViral": 0, "deathConfirmed": null, "deathProbable": null, "totalTestEncountersViral": null, "totalTestsPeopleViral": 0, "totalTestsAntibody": null, "positiveTestsAntibody": null, "negativeTestsAntibody": null, "totalTestsPeopleAntibody": null, "positiveTestsPeopleAntibody": null, "negativeTestsPeopleAntibody": null, "totalTestsPeopleAntigen": null, "positiveTestsPeopleAntigen": null, "totalTestsAntigen": null, "positiveTestsAntigen": null, "fips": "01", "positiveIncrease": 0, "negativeIncrease": 0, "total": 0, "totalTestResultsIncrease": 0, "posNeg": 0, "deathIncrease": 0, "hospitalizedIncrease": 0, "hash": "f13219e92a2a0abb73b4609f39597eaf7cfe8da6", "commercialScore": 0, "negativeRegularScore": 0, "negativeScore": 0, "positiveScore": 0, "score": 0, "grade": "", "month_number_label": "2020-03", "date_label": "2020-03-07", "week_number_label": "2020W10", "week_start_label": "2020-03-02"}, {"date": 20200308, "state": "AL", "positive": 0, "probableCases": null, "negative": null, "pending": null, "totalTestResultsSource": "totalTestsPeopleViral", "totalTestResults": 0, "hospitalizedCurrently": null, "hospitalizedCumulative": null, "inIcuCurrently": null, "inIcuCumulative": null, "onVentilatorCurrently": null, "onVentilatorCumulative": null, "recovered": null, "dataQualityGrade": null, "lastUpdateEt": null, "dateModified": null, "checkTimeEt": null, "death": null, "hospitalized": null, "dateChecked": null, "totalTestsViral": null, "positiveTestsViral": null, "negativeTestsViral": null, "positiveCasesViral": 0, "deathConfirmed": null, "deathProbable": null, "totalTestEncountersViral": null, "totalTestsPeopleViral": 0, "totalTestsAntibody": null, "positiveTestsAntibody": null, "negativeTestsAntibody": null, "totalTestsPeopleAntibody": null, "positiveTestsPeopleAntibody": null, "negativeTestsPeopleAntibody": null, "totalTestsPeopleAntigen": null, "positiveTestsPeopleAntigen": null, "totalTestsAntigen": null, "positiveTestsAntigen": null, "fips": "01", "positiveIncrease": 0, "negativeIncrease": 0, "total": 0, "totalTestResultsIncrease": 0, "posNeg": 0, "deathIncrease": 0, "hospitalizedIncrease": 0, "hash": "5dac8882a5bf45d03c2ebe4a94f0ad42d2699b23", "commercialScore": 0, "negativeRegularScore": 0, "negativeScore": 0, "positiveScore": 0, "score": 0, "grade": "", "month_number_label": "2020-03", "date_label": "2020-03-08", "week_number_label": "2020W10", "week_start_label": "2020-03-02"}, {"date": 20200309, "state": "AL", "positive": 0, "probableCases": null, "negative": null, "pending": null, "totalTestResultsSource": "totalTestsPeopleViral", "totalTestResults": 0, "hospitalizedCurrently": null, "hospitalizedCumulative": null, "inIcuCurrently": null, "inIcuCumulative": null, "onVentilatorCurrently": null, "onVentilatorCumulative": null, "recovered": null, "dataQualityGrade": null, "lastUpdateEt": null, "dateModified": null, "checkTimeEt": null, "death": null, "hospitalized": null, "dateChecked": null, "totalTestsViral": null, "positiveTestsViral": null, "negativeTestsViral": null, "positiveCasesViral": 0, "deathConfirmed": null, "deathProbable": null, "totalTestEncountersViral": null, "totalTestsPeopleViral": 0, "totalTestsAntibody": null, "positiveTestsAntibody": null, "negativeTestsAntibody": null, "totalTestsPeopleAntibody": null, "positiveTestsPeopleAntibody": null, "negativeTestsPeopleAntibody": null, "totalTestsPeopleAntigen": null, "positiveTestsPeopleAntigen": null, "totalTestsAntigen": null, "positiveTestsAntigen": null, "fips": "01", "positiveIncrease": 0, "negativeIncrease": 0, "total": 0, "totalTestResultsIncrease": 0, "posNeg": 0, "deathIncrease": 0, "hospitalizedIncrease": 0, "hash": "7a9245cd555e2fb96c415fa66002fb923970ad19", "commercialScore": 0, "negativeRegularScore": 0, "negativeScore": 0, "positiveScore": 0, "score": 0, "grade": "", "month_number_label": "2020-03", "date_label": "2020-03-09", "week_number_label": "2020W11", "week_start_label": "2020-03-09"}, {"date": 20200310, "state": "AL", "positive": 0, "probableCases": null, "negative": 0, "pending": 0, "totalTestResultsSource": "totalTestsPeopleViral", "totalTestResults": 0, "hospitalizedCurrently": null, "hospitalizedCumulative": null, "inIcuCurrently": null, "inIcuCumulative": null, "onVentilatorCurrently": null, "onVentilatorCumulative": null, "recovered": null, "dataQualityGrade": null, "lastUpdateEt": null, "dateModified": null, "checkTimeEt": null, "death": null, "hospitalized": null, "dateChecked": null, "totalTestsViral": null, "positiveTestsViral": null, "negativeTestsViral": null, "positiveCasesViral": 0, "deathConfirmed": null, "deathProbable": null, "totalTestEncountersViral": null, "totalTestsPeopleViral": 0, "totalTestsAntibody": null, "positiveTestsAntibody": null, "negativeTestsAntibody": null, "totalTestsPeopleAntibody": null, "positiveTestsPeopleAntibody": null, "negativeTestsPeopleAntibody": null, "totalTestsPeopleAntigen": null, "positiveTestsPeopleAntigen": null, "totalTestsAntigen": null, "positiveTestsAntigen": null, "fips": "01", "positiveIncrease": 0, "negativeIncrease": 0, "total": 0, "totalTestResultsIncrease": 0, "posNeg": 0, "deathIncrease": 0, "hospitalizedIncrease": 0, "hash": "19ba2b60958f0da19b21611736a2b819555f9d55", "commercialScore": 0, "negativeRegularScore": 0, "negativeScore": 0, "positiveScore": 0, "score": 0, "grade": "", "month_number_label": "2020-03", "date_label": "2020-03-10", "week_number_label": "2020W11", "week_start_label": "2020-03-09"}, {"date": 20200311, "state": "AL", "positive": 0, "probableCases": null, "negative": 10, "pending": null, "totalTestResultsSource": "totalTestsPeopleViral", "totalTestResults": 10, "hospitalizedCurrently": null, "hospitalizedCumulative": null, "inIcuCurrently": null, "inIcuCumulative": null, "onVentilatorCurrently": null, "onVentilatorCumulative": null, "recovered": null, "dataQualityGrade": null, "lastUpdateEt": "3/9/2020 00:00", "dateModified": "2020-03-09T00:00:00Z", "checkTimeEt": "03/08 20:00", "death": null, "hospitalized": null, "dateChecked": "2020-03-09T00:00:00Z", "totalTestsViral": null, "positiveTestsViral": null, "negativeTestsViral": null, "positiveCasesViral": 0, "deathConfirmed": null, "deathProbable": null, "totalTestEncountersViral": null, "totalTestsPeopleViral": 10, "totalTestsAntibody": null, "positiveTestsAntibody": null, "negativeTestsAntibody": null, "totalTestsPeopleAntibody": null, "positiveTestsPeopleAntibody": null, "negativeTestsPeopleAntibody": null, "totalTestsPeopleAntigen": null, "positiveTestsPeopleAntigen": null, "totalTestsAntigen": null, "positiveTestsAntigen": null, "fips": "01", "positiveIncrease": 0, "negativeIncrease": 10, "total": 10, "totalTestResultsIncrease": 10, "posNeg": 10, "deathIncrease": 0, "hospitalizedIncrease": 0, "hash": "d3f19d34b4c98e8c7602ce8bcdbd2c7d671c8d61", "commercialScore": 0, "negativeRegularScore": 0, "negativeScore": 0, "positiveScore": 0, "score": 0, "grade": "", "month_number_label": "2020-03", "date_label": "2020-03-11", "week_number_label": "2020W11", "week_start_label": "2020-03-09"}, {"date": 20200312, "state": "AL", "positive": 0, "probableCases": null, "negative": 10, "pending": null, "totalTestResultsSource": "totalTestsPeopleViral", "totalTestResults": 10, "hospitalizedCurrently": null, "hospitalizedCumulative": null, "inIcuCurrently": null, "inIcuCumulative": null, "onVentilatorCurrently": null, "onVentilatorCumulative": null, "recovered": null, "dataQualityGrade": null, "lastUpdateEt": "3/9/2020 00:00", "dateModified": "2020-03-09T00:00:00Z", "checkTimeEt": "03/08 20:00", "death": null, "hospitalized": null, "dateChecked": "2020-03-09T00:00:00Z", "totalTestsViral": null, "positiveTestsViral": null, "negativeTestsViral": null, "positiveCasesViral": 0, "deathConfirmed": null, "deathProbable": null, "totalTestEncountersViral": null, "totalTestsPeopleViral": 10, "totalTestsAntibody": null, "positiveTestsAntibody": null, "negativeTestsAntibody": null, "totalTestsPeopleAntibody": null, "positiveTestsPeopleAntibody": null, "negativeTestsPeopleAntibody": null, "totalTestsPeopleAntigen": null, "positiveTestsPeopleAntigen": null, "totalTestsAntigen": null, "positiveTestsAntigen": null, "fips": "01", "positiveIncrease": 0, "negativeIncrease": 0, "total": 10, "totalTestResultsIncrease": 0, "posNeg": 10, "deathIncrease": 0, "hospitalizedIncrease": 0, "hash": "937cbab90b52ef60349cfa61abc8bda2a9776b0f", "commercialScore": 0, "negativeRegularScore": 0, "negativeScore": 0, "positiveScore": 0, "score": 0, "grade": "", "month_number_label": "2020-03", "date_label": "2020-03-12", "week_number_label": "2020W11", "week_start_label": "2020-03-09"}, {"date": 20200313, "state": "AL", "positive": 1, "probableCases": null, "negative": 11, "pending": null, "totalTestResultsSource": "totalTestsPeopleViral", "totalTestResults": 12, "hospitalizedCurrently": null, "hospitalizedCumulative": null, "inIcuCurrently": null, "inIcuCumulative": null, "onVentilatorCurrently": null, "onVentilatorCumulative": null, "recovered": null, "dataQualityGrade": null, "lastUpdateEt": "3/13/2020 00:00", "dateModified": "2020-03-13T00:00:00Z", "checkTimeEt": "03/12 20:00", "death": null, "hospitalized": null, "dateChecked": "2020-03-13T00:00:00Z", "totalTestsViral": null, "positiveTestsViral": null, "negativeTestsViral": null, "positiveCasesViral": 1, "deathConfirmed": null, "deathProbable": null, "totalTestEncountersViral": null, "totalTestsPeopleViral": 12, "totalTestsAntibody": null, "positiveTestsAntibody": null, "negativeTestsAntibody": null, "totalTestsPeopleAntibody": null, "positiveTestsPeopleAntibody": null, "negativeTestsPeopleAntibody": null, "totalTestsPeopleAntigen": null, "positiveTestsPeopleAntigen": null, "totalTestsAntigen": null, "positiveTestsAntigen": null, "fips": "01", "positiveIncrease": 1, "negativeIncrease": 1, "total": 12, "totalTestResultsIncrease": 2, "posNeg": 12, "deathIncrease": 0, "hospitalizedIncrease": 0, "hash": "bda08ebbb85a2178e97acd9781ed756f8c505d68", "commercialScore": 0, "negativeRegularScore": 0, "negativeScore": 0, "positiveScore": 0, "score": 0, "grade": "", "month_number_label": "2020-03", "date_label": "2020-03-13", "week_number_label": "2020W11", "week_start_label": "2020-03-09"}, {"date": 20200314, "state": "AL", "positive": 6, "probableCases": null, "negative": 22, "pending": 46, "totalTestResultsSource": "totalTestsPeopleViral", "totalTestResults": 28, "hospitalizedCurrently": null, "hospitalizedCumulative": null, "inIcuCurrently": null, "inIcuCumulative": null, "onVentilatorCurrently": null, "onVentilatorCumulative": null, "recovered": null, "dataQualityGrade": null, "lastUpdateEt": "3/13/2020 00:00", "dateModified": "2020-03-13T00:00:00Z", "checkTimeEt": "03/12 20:00", "death": null, "hospitalized": null, "dateChecked": "2020-03-13T00:00:00Z", "totalTestsViral": null, "positiveTestsViral": null, "negativeTestsViral": null, "positiveCasesViral": 6, "deathConfirmed": null, "deathProbable": null, "totalTestEncountersViral": null, "totalTestsPeopleViral": 28, "totalTestsAntibody": null, "positiveTestsAntibody": null, "negativeTestsAntibody": null, "totalTestsPeopleAntibody": null, "positiveTestsPeopleAntibody": null, "negativeTestsPeopleAntibody": null, "totalTestsPeopleAntigen": null, "positiveTestsPeopleAntigen": null, "totalTestsAntigen": null, "positiveTestsAntigen": null, "fips": "01", "positiveIncrease": 5, "negativeIncrease": 11, "total": 74, "totalTestResultsIncrease": 16, "posNeg": 28, "deathIncrease": 0, "hospitalizedIncrease": 0, "hash": "892ad2056525fecc6a762df717eac27217b66956", "commercialScore": 0, "negativeRegularScore": 0, "negativeScore": 0, "positiveScore": 0, "score": 0, "grade": "", "month_number_label": "2020-03", "date_label": "2020-03-14", "week_number_label": "2020W11", "week_start_label": "2020-03-09"}, {"date": 20200315, "state": "AL", "positive": 12, "probableCases": null, "negative": 28, "pending": 46, "totalTestResultsSource": "totalTestsPeopleViral", "totalTestResults": 40, "hospitalizedCurrently": null, "hospitalizedCumulative": null, "inIcuCurrently": null, "inIcuCumulative": null, "onVentilatorCurrently": null, "onVentilatorCumulative": null, "recovered": null, "dataQualityGrade": null, "lastUpdateEt": "3/15/2020 14:12", "dateModified": "2020-03-15T14:12:00Z", "checkTimeEt": "03/15 10:12", "death": 0, "hospitalized": null, "dateChecked": "2020-03-15T14:12:00Z", "totalTestsViral": null, "positiveTestsViral": null, "negativeTestsViral": null, "positiveCasesViral": 12, "deathConfirmed": null, "deathProbable": null, "totalTestEncountersViral": null, "totalTestsPeopleViral": 40, "totalTestsAntibody": null, "positiveTestsAntibody": null, "negativeTestsAntibody": null, "totalTestsPeopleAntibody": null, "positiveTestsPeopleAntibody": null, "negativeTestsPeopleAntibody": null, "totalTestsPeopleAntigen": null, "positiveTestsPeopleAntigen": null, "totalTestsAntigen": null, "positiveTestsAntigen": null, "fips": "01", "positiveIncrease": 6, "negativeIncrease": 6, "total": 86, "totalTestResultsIncrease": 12, "posNeg": 40, "deathIncrease": 0, "hospitalizedIncrease": 0, "hash": "f3eb6e612ca73b144bd599b49edded198c827880", "commercialScore": 0, "negativeRegularScore": 0, "negativeScore": 0, "positiveScore": 0, "score": 0, "grade": "", "month_number_label": "2020-03", "date_label": "2020-03-15", "week_number_label": "2020W11", "week_start_label": "2020-03-09"}, {"date": 20200316, "state": "AL", "positive": 28, "probableCases": null, "negative": 28, "pending": 40, "totalTestResultsSource": "totalTestsPeopleViral", "totalTestResults": 56, "hospitalizedCurrently": null, "hospitalizedCumulative": null, "inIcuCurrently": null, "inIcuCumulative": null, "onVentilatorCurrently": null, "onVentilatorCumulative": null, "recovered": null, "dataQualityGrade": null, "lastUpdateEt": "3/16/2020 15:08", "dateModified": "2020-03-16T15:08:00Z", "checkTimeEt": "03/16 11:08", "death": 0, "hospitalized": null, "dateChecked": "2020-03-16T15:08:00Z", "totalTestsViral": null, "positiveTestsViral": null, "negativeTestsViral": null, "positiveCasesViral": 28, "deathConfirmed": null, "deathProbable": null, "totalTestEncountersViral": null, "totalTestsPeopleViral": 56, "totalTestsAntibody": null, "positiveTestsAntibody": null, "negativeTestsAntibody": null, "totalTestsPeopleAntibody": null, "positiveTestsPeopleAntibody": null, "negativeTestsPeopleAntibody": null, "totalTestsPeopleAntigen": null, "positiveTestsPeopleAntigen": null, "totalTestsAntigen": null, "positiveTestsAntigen": null, "fips": "01", "positiveIncrease": 16, "negativeIncrease": 0, "total": 96, "totalTestResultsIncrease": 16, "posNeg": 56, "deathIncrease": 0, "hospitalizedIncrease": 0, "hash": "21403de48429718f4104c5ec2698c5f6e4cb540e", "commercialScore": 0, "negativeRegularScore": 0, "negativeScore": 0, "positiveScore": 0, "score": 0, "grade": "", "month_number_label": "2020-03", "date_label": "2020-03-16", "week_number_label": "2020W12", "week_start_label": "2020-03-16"}, {"date": 20200317, "state": "AL", "positive": 36, "probableCases": null, "negative": 28, "pending": null, "totalTestResultsSource": "totalTestsPeopleViral", "totalTestResults": 64, "hospitalizedCurrently": null, "hospitalizedCumulative": null, "inIcuCurrently": null, "inIcuCumulative": null, "onVentilatorCurrently": null, "onVentilatorCumulative": null, "recovered": null, "dataQualityGrade": null, "lastUpdateEt": "3/17/2020 11:15", "dateModified": "2020-03-17T11:15:00Z", "checkTimeEt": "03/17 07:15", "death": 0, "hospitalized": null, "dateChecked": "2020-03-17T11:15:00Z", "totalTestsViral": null, "positiveTestsViral": null, "negativeTestsViral": null, "positiveCasesViral": 36, "deathConfirmed": null, "deathProbable": null, "totalTestEncountersViral": null, "totalTestsPeopleViral": 64, "totalTestsAntibody": null, "positiveTestsAntibody": null, "negativeTestsAntibody": null, "totalTestsPeopleAntibody": null, "positiveTestsPeopleAntibody": null, "negativeTestsPeopleAntibody": null, "totalTestsPeopleAntigen": null, "positiveTestsPeopleAntigen": null, "totalTestsAntigen": null, "positiveTestsAntigen": null, "fips": "01", "positiveIncrease": 8, "negativeIncrease": 0, "total": 64, "totalTestResultsIncrease": 8, "posNeg": 64, "deathIncrease": 0, "hospitalizedIncrease": 0, "hash": "8704ed87a4b3d0c65ca4f199e33a20bee53ff5ae", "commercialScore": 0, "negativeRegularScore": 0, "negativeScore": 0, "positiveScore": 0, "score": 0, "grade": "", "month_number_label": "2020-03", "date_label": "2020-03-17", "week_number_label": "2020W12", "week_start_label": "2020-03-16"}, {"date": 20200318, "state": "AL", "positive": 46, "probableCases": null, "negative": 28, "pending": null, "totalTestResultsSource": "totalTestsPeopleViral", "totalTestResults": 74, "hospitalizedCurrently": null, "hospitalizedCumulative": null, "inIcuCurrently": null, "inIcuCumulative": null, "onVentilatorCurrently": null, "onVentilatorCumulative": null, "recovered": null, "dataQualityGrade": null, "lastUpdateEt": "3/18/2020 11:05", "dateModified": "2020-03-18T11:05:00Z", "checkTimeEt": "03/18 07:05", "death": 0, "hospitalized": null, "dateChecked": "2020-03-18T11:05:00Z", "totalTestsViral": null, "positiveTestsViral": null, "negativeTestsViral": null, "positiveCasesViral": 46, "deathConfirmed": null, "deathProbable": null, "totalTestEncountersViral": null, "totalTestsPeopleViral": 74, "totalTestsAntibody": null, "positiveTestsAntibody": null, "negativeTestsAntibody": null, "totalTestsPeopleAntibody": null, "positiveTestsPeopleAntibody": null, "negativeTestsPeopleAntibody": null, "totalTestsPeopleAntigen": null, "positiveTestsPeopleAntigen": null, "totalTestsAntigen": null, "positiveTestsAntigen": null, "fips": "01", "positiveIncrease": 10, "negativeIncrease": 0, "total": 74, "totalTestResultsIncrease": 10, "posNeg": 74, "deathIncrease": 0, "hospitalizedIncrease": 0, "hash": "6a5ea1fd0401090af304db537097dcf3063bdbb8", "commercialScore": 0, "negativeRegularScore": 0, "negativeScore": 0, "positiveScore": 0, "score": 0, "grade": "", "month_number_label": "2020-03", "date_label": "2020-03-18", "week_number_label": "2020W12", "week_start_label": "2020-03-16"}, {"date": 20200319, "state": "AL", "positive": 68, "probableCases": null, "negative": 28, "pending": null, "totalTestResultsSource": "totalTestsPeopleViral", "totalTestResults": 96, "hospitalizedCurrently": null, "hospitalizedCumulative": null, "inIcuCurrently": null, "inIcuCumulative": null, "onVentilatorCurrently": null, "onVentilatorCumulative": null, "recovered": null, "dataQualityGrade": null, "lastUpdateEt": "3/19/2020 10:45", "dateModified": "2020-03-19T10:45:00Z", "checkTimeEt": "03/19 06:45", "death": 0, "hospitalized": null, "dateChecked": "2020-03-19T10:45:00Z", "totalTestsViral": null, "positiveTestsViral": null, "negativeTestsViral": null, "positiveCasesViral": 68, "deathConfirmed": null, "deathProbable": null, "totalTestEncountersViral": null, "totalTestsPeopleViral": 96, "totalTestsAntibody": null, "positiveTestsAntibody": null, "negativeTestsAntibody": null, "totalTestsPeopleAntibody": null, "positiveTestsPeopleAntibody": null, "negativeTestsPeopleAntibody": null, "totalTestsPeopleAntigen": null, "positiveTestsPeopleAntigen": null, "totalTestsAntigen": null, "positiveTestsAntigen": null, "fips": "01", "positiveIncrease": 22, "negativeIncrease": 0, "total": 96, "totalTestResultsIncrease": 22, "posNeg": 96, "deathIncrease": 0, "hospitalizedIncrease": 0, "hash": "eeccf9812f09927ae752f818bb4f291016d82b98", "commercialScore": 0, "negativeRegularScore": 0, "negativeScore": 0, "positiveScore": 0, "score": 0, "grade": "", "month_number_label": "2020-03", "date_label": "2020-03-19", "week_number_label": "2020W12", "week_start_label": "2020-03-16"}, {"date": 20200320, "state": "AL", "positive": 81, "probableCases": null, "negative": 28, "pending": null, "totalTestResultsSource": "totalTestsPeopleViral", "totalTestResults": 109, "hospitalizedCurrently": null, "hospitalizedCumulative": null, "inIcuCurrently": null, "inIcuCumulative": null, "onVentilatorCurrently": null, "onVentilatorCumulative": null, "recovered": null, "dataQualityGrade": null, "lastUpdateEt": "3/20/2020 11:00", "dateModified": "2020-03-20T11:00:00Z", "checkTimeEt": "03/20 07:00", "death": 0, "hospitalized": null, "dateChecked": "2020-03-20T11:00:00Z", "totalTestsViral": null, "positiveTestsViral": null, "negativeTestsViral": null, "positiveCasesViral": 81, "deathConfirmed": null, "deathProbable": null, "totalTestEncountersViral": null, "totalTestsPeopleViral": 109, "totalTestsAntibody": null, "positiveTestsAntibody": null, "negativeTestsAntibody": null, "totalTestsPeopleAntibody": null, "positiveTestsPeopleAntibody": null, "negativeTestsPeopleAntibody": null, "totalTestsPeopleAntigen": null, "positiveTestsPeopleAntigen": null, "totalTestsAntigen": null, "positiveTestsAntigen": null, "fips": "01", "positiveIncrease": 13, "negativeIncrease": 0, "total": 109, "totalTestResultsIncrease": 13, "posNeg": 109, "deathIncrease": 0, "hospitalizedIncrease": 0, "hash": "b1d871113b1b0485202380eaf0ebe44e17e6d6ad", "commercialScore": 0, "negativeRegularScore": 0, "negativeScore": 0, "positiveScore": 0, "score": 0, "grade": "", "month_number_label": "2020-03", "date_label": "2020-03-20", "week_number_label": "2020W12", "week_start_label": "2020-03-16"}, {"date": 20200321, "state": "AL", "positive": 124, "probableCases": null, "negative": 28, "pending": null, "totalTestResultsSource": "totalTestsPeopleViral", "totalTestResults": 152, "hospitalizedCurrently": null, "hospitalizedCumulative": null, "inIcuCurrently": null, "inIcuCumulative": null, "onVentilatorCurrently": null, "onVentilatorCumulative": null, "recovered": null, "dataQualityGrade": null, "lastUpdateEt": "3/21/2020 11:20", "dateModified": "2020-03-21T11:20:00Z", "checkTimeEt": "03/21 07:20", "death": 0, "hospitalized": null, "dateChecked": "2020-03-21T11:20:00Z", "totalTestsViral": null, "positiveTestsViral": null, "negativeTestsViral": null, "positiveCasesViral": 124, "deathConfirmed": null, "deathProbable": null, "totalTestEncountersViral": null, "totalTestsPeopleViral": 152, "totalTestsAntibody": null, "positiveTestsAntibody": null, "negativeTestsAntibody": null, "totalTestsPeopleAntibody": null, "positiveTestsPeopleAntibody": null, "negativeTestsPeopleAntibody": null, "totalTestsPeopleAntigen": null, "positiveTestsPeopleAntigen": null, "totalTestsAntigen": null, "positiveTestsAntigen": null, "fips": "01", "positiveIncrease": 43, "negativeIncrease": 0, "total": 152, "totalTestResultsIncrease": 43, "posNeg": 152, "deathIncrease": 0, "hospitalizedIncrease": 0, "hash": "4f5bb314eb45b75f34bbcf792ad5a2971587dffe", "commercialScore": 0, "negativeRegularScore": 0, "negativeScore": 0, "positiveScore": 0, "score": 0, "grade": "", "month_number_label": "2020-03", "date_label": "2020-03-21", "week_number_label": "2020W12", "week_start_label": "2020-03-16"}, {"date": 20200322, "state": "AL", "positive": 138, "probableCases": null, "negative": 1464, "pending": null, "totalTestResultsSource": "totalTestsPeopleViral", "totalTestResults": 1602, "hospitalizedCurrently": null, "hospitalizedCumulative": null, "inIcuCurrently": null, "inIcuCumulative": null, "onVentilatorCurrently": null, "onVentilatorCumulative": null, "recovered": null, "dataQualityGrade": null, "lastUpdateEt": "3/22/2020 10:37", "dateModified": "2020-03-22T10:37:00Z", "checkTimeEt": "03/22 06:37", "death": 0, "hospitalized": null, "dateChecked": "2020-03-22T10:37:00Z", "totalTestsViral": null, "positiveTestsViral": null, "negativeTestsViral": null, "positiveCasesViral": 138, "deathConfirmed": null, "deathProbable": null, "totalTestEncountersViral": null, "totalTestsPeopleViral": 1602, "totalTestsAntibody": null, "positiveTestsAntibody": null, "negativeTestsAntibody": null, "totalTestsPeopleAntibody": null, "positiveTestsPeopleAntibody": null, "negativeTestsPeopleAntibody": null, "totalTestsPeopleAntigen": null, "positiveTestsPeopleAntigen": null, "totalTestsAntigen": null, "positiveTestsAntigen": null, "fips": "01", "positiveIncrease": 14, "negativeIncrease": 1436, "total": 1602, "totalTestResultsIncrease": 1450, "posNeg": 1602, "deathIncrease": 0, "hospitalizedIncrease": 0, "hash": "ed4e9f0ce4982f49f1b0a2ac246c541e5e06acaa", "commercialScore": 0, "negativeRegularScore": 0, "negativeScore": 0, "positiveScore": 0, "score": 0, "grade": "", "month_number_label": "2020-03", "date_label": "2020-03-22", "week_number_label": "2020W12", "week_start_label": "2020-03-16"}, {"date": 20200323, "state": "AL", "positive": 167, "probableCases": null, "negative": 1665, "pending": null, "totalTestResultsSource": "totalTestsPeopleViral", "totalTestResults": 1832, "hospitalizedCurrently": null, "hospitalizedCumulative": null, "inIcuCurrently": null, "inIcuCumulative": null, "onVentilatorCurrently": null, "onVentilatorCumulative": null, "recovered": null, "dataQualityGrade": "C", "lastUpdateEt": "3/23/2020 12:00", "dateModified": "2020-03-23T12:00:00Z", "checkTimeEt": "03/23 08:00", "death": 0, "hospitalized": null, "dateChecked": "2020-03-23T12:00:00Z", "totalTestsViral": null, "positiveTestsViral": null, "negativeTestsViral": null, "positiveCasesViral": 167, "deathConfirmed": null, "deathProbable": null, "totalTestEncountersViral": null, "totalTestsPeopleViral": 1832, "totalTestsAntibody": null, "positiveTestsAntibody": null, "negativeTestsAntibody": null, "totalTestsPeopleAntibody": null, "positiveTestsPeopleAntibody": null, "negativeTestsPeopleAntibody": null, "totalTestsPeopleAntigen": null, "positiveTestsPeopleAntigen": null, "totalTestsAntigen": null, "positiveTestsAntigen": null, "fips": "01", "positiveIncrease": 29, "negativeIncrease": 201, "total": 1832, "totalTestResultsIncrease": 230, "posNeg": 1832, "deathIncrease": 0, "hospitalizedIncrease": 0, "hash": "520e45e7dc97e80e448904b433dcb648a039d8c7", "commercialScore": 0, "negativeRegularScore": 0, "negativeScore": 0, "positiveScore": 0, "score": 0, "grade": "", "month_number_label": "2020-03", "date_label": "2020-03-23", "week_number_label": "2020W13", "week_start_label": "2020-03-23"}, {"date": 20200324, "state": "AL", "positive": 215, "probableCases": null, "negative": 2106, "pending": null, "totalTestResultsSource": "totalTestsPeopleViral", "totalTestResults": 2321, "hospitalizedCurrently": 74, "hospitalizedCumulative": null, "inIcuCurrently": null, "inIcuCumulative": null, "onVentilatorCurrently": null, "onVentilatorCumulative": null, "recovered": null, "dataQualityGrade": "C", "lastUpdateEt": "3/24/2020 12:00", "dateModified": "2020-03-24T12:00:00Z", "checkTimeEt": "03/24 08:00", "death": 0, "hospitalized": null, "dateChecked": "2020-03-24T12:00:00Z", "totalTestsViral": null, "positiveTestsViral": null, "negativeTestsViral": null, "positiveCasesViral": 215, "deathConfirmed": null, "deathProbable": null, "totalTestEncountersViral": null, "totalTestsPeopleViral": 2321, "totalTestsAntibody": null, "positiveTestsAntibody": null, "negativeTestsAntibody": null, "totalTestsPeopleAntibody": null, "positiveTestsPeopleAntibody": null, "negativeTestsPeopleAntibody": null, "totalTestsPeopleAntigen": null, "positiveTestsPeopleAntigen": null, "totalTestsAntigen": null, "positiveTestsAntigen": null, "fips": "01", "positiveIncrease": 48, "negativeIncrease": 441, "total": 2321, "totalTestResultsIncrease": 489, "posNeg": 2321, "deathIncrease": 0, "hospitalizedIncrease": 0, "hash": "009d4e4c869bb9c72d4bfa8639674497e9459706", "commercialScore": 0, "negativeRegularScore": 0, "negativeScore": 0, "positiveScore": 0, "score": 0, "grade": "", "month_number_label": "2020-03", "date_label": "2020-03-24", "week_number_label": "2020W13", "week_start_label": "2020-03-23"}, {"date": 20200325, "state": "AL", "positive": 283, "probableCases": null, "negative": 2529, "pending": null, "totalTestResultsSource": "totalTestsPeopleViral", "totalTestResults": 2812, "hospitalizedCurrently": 91, "hospitalizedCumulative": null, "inIcuCurrently": null, "inIcuCumulative": null, "onVentilatorCurrently": null, "onVentilatorCumulative": null, "recovered": null, "dataQualityGrade": "C", "lastUpdateEt": "3/25/2020 11:30", "dateModified": "2020-03-25T11:30:00Z", "checkTimeEt": "03/25 07:30", "death": 0, "hospitalized": null, "dateChecked": "2020-03-25T11:30:00Z", "totalTestsViral": null, "positiveTestsViral": null, "negativeTestsViral": null, "positiveCasesViral": 283, "deathConfirmed": null, "deathProbable": null, "totalTestEncountersViral": null, "totalTestsPeopleViral": 2812, "totalTestsAntibody": null, "positiveTestsAntibody": null, "negativeTestsAntibody": null, "totalTestsPeopleAntibody": null, "positiveTestsPeopleAntibody": null, "negativeTestsPeopleAntibody": null, "totalTestsPeopleAntigen": null, "positiveTestsPeopleAntigen": null, "totalTestsAntigen": null, "positiveTestsAntigen": null, "fips": "01", "positiveIncrease": 68, "negativeIncrease": 423, "total": 2812, "totalTestResultsIncrease": 491, "posNeg": 2812, "deathIncrease": 0, "hospitalizedIncrease": 0, "hash": "0f4e0d6ab05674221b7196fc4042879a1ff5b047", "commercialScore": 0, "negativeRegularScore": 0, "negativeScore": 0, "positiveScore": 0, "score": 0, "grade": "", "month_number_label": "2020-03", "date_label": "2020-03-25", "week_number_label": "2020W13", "week_start_label": "2020-03-23"}, {"date": 20200326, "state": "AL", "positive": 506, "probableCases": null, "negative": 3593, "pending": null, "totalTestResultsSource": "totalTestsPeopleViral", "totalTestResults": 4099, "hospitalizedCurrently": 106, "hospitalizedCumulative": null, "inIcuCurrently": null, "inIcuCumulative": null, "onVentilatorCurrently": null, "onVentilatorCumulative": null, "recovered": null, "dataQualityGrade": "C", "lastUpdateEt": "3/26/2020 00:00", "dateModified": "2020-03-26T00:00:00Z", "checkTimeEt": "03/25 20:00", "death": 1, "hospitalized": null, "dateChecked": "2020-03-26T00:00:00Z", "totalTestsViral": null, "positiveTestsViral": null, "negativeTestsViral": null, "positiveCasesViral": 506, "deathConfirmed": null, "deathProbable": null, "totalTestEncountersViral": null, "totalTestsPeopleViral": 4099, "totalTestsAntibody": null, "positiveTestsAntibody": null, "negativeTestsAntibody": null, "totalTestsPeopleAntibody": null, "positiveTestsPeopleAntibody": null, "negativeTestsPeopleAntibody": null, "totalTestsPeopleAntigen": null, "positiveTestsPeopleAntigen": null, "totalTestsAntigen": null, "positiveTestsAntigen": null, "fips": "01", "positiveIncrease": 223, "negativeIncrease": 1064, "total": 4099, "totalTestResultsIncrease": 1287, "posNeg": 4099, "deathIncrease": 1, "hospitalizedIncrease": 0, "hash": "4759c98932d79239cae8980a2b04ffe0e6bacb48", "commercialScore": 0, "negativeRegularScore": 0, "negativeScore": 0, "positiveScore": 0, "score": 0, "grade": "", "month_number_label": "2020-03", "date_label": "2020-03-26", "week_number_label": "2020W13", "week_start_label": "2020-03-23"}, {"date": 20200327, "state": "AL", "positive": 587, "probableCases": null, "negative": 4184, "pending": null, "totalTestResultsSource": "totalTestsPeopleViral", "totalTestResults": 4771, "hospitalizedCurrently": 112, "hospitalizedCumulative": null, "inIcuCurrently": null, "inIcuCumulative": null, "onVentilatorCurrently": null, "onVentilatorCumulative": null, "recovered": null, "dataQualityGrade": "B", "lastUpdateEt": "3/27/2020 00:00", "dateModified": "2020-03-27T00:00:00Z", "checkTimeEt": "03/26 20:00", "death": 3, "hospitalized": null, "dateChecked": "2020-03-27T00:00:00Z", "totalTestsViral": null, "positiveTestsViral": null, "negativeTestsViral": null, "positiveCasesViral": 587, "deathConfirmed": null, "deathProbable": null, "totalTestEncountersViral": null, "totalTestsPeopleViral": 4771, "totalTestsAntibody": null, "positiveTestsAntibody": null, "negativeTestsAntibody": null, "totalTestsPeopleAntibody": null, "positiveTestsPeopleAntibody": null, "negativeTestsPeopleAntibody": null, "totalTestsPeopleAntigen": null, "positiveTestsPeopleAntigen": null, "totalTestsAntigen": null, "positiveTestsAntigen": null, "fips": "01", "positiveIncrease": 81, "negativeIncrease": 591, "total": 4771, "totalTestResultsIncrease": 672, "posNeg": 4771, "deathIncrease": 2, "hospitalizedIncrease": 0, "hash": "64a04fad183a5042d8d8694de84d460262e68aa9", "commercialScore": 0, "negativeRegularScore": 0, "negativeScore": 0, "positiveScore": 0, "score": 0, "grade": "", "month_number_label": "2020-03", "date_label": "2020-03-27", "week_number_label": "2020W13", "week_start_label": "2020-03-23"}, {"date": 20200328, "state": "AL", "positive": 696, "probableCases": null, "negative": 4184, "pending": null, "totalTestResultsSource": "totalTestsPeopleViral", "totalTestResults": 4880, "hospitalizedCurrently": 134, "hospitalizedCumulative": null, "inIcuCurrently": null, "inIcuCumulative": null, "onVentilatorCurrently": null, "onVentilatorCumulative": null, "recovered": null, "dataQualityGrade": "B", "lastUpdateEt": "3/28/2020 00:00", "dateModified": "2020-03-28T00:00:00Z", "checkTimeEt": "03/27 20:00", "death": 3, "hospitalized": null, "dateChecked": "2020-03-28T00:00:00Z", "totalTestsViral": null, "positiveTestsViral": null, "negativeTestsViral": null, "positiveCasesViral": 696, "deathConfirmed": null, "deathProbable": null, "totalTestEncountersViral": null, "totalTestsPeopleViral": 4880, "totalTestsAntibody": null, "positiveTestsAntibody": null, "negativeTestsAntibody": null, "totalTestsPeopleAntibody": null, "positiveTestsPeopleAntibody": null, "negativeTestsPeopleAntibody": null, "totalTestsPeopleAntigen": null, "positiveTestsPeopleAntigen": null, "totalTestsAntigen": null, "positiveTestsAntigen": null, "fips": "01", "positiveIncrease": 109, "negativeIncrease": 0, "total": 4880, "totalTestResultsIncrease": 109, "posNeg": 4880, "deathIncrease": 0, "hospitalizedIncrease": 0, "hash": "e4b3a8cba68a2c09c329fdb1a43495cafb0e4dfd", "commercialScore": 0, "negativeRegularScore": 0, "negativeScore": 0, "positiveScore": 0, "score": 0, "grade": "", "month_number_label": "2020-03", "date_label": "2020-03-28", "week_number_label": "2020W13", "week_start_label": "2020-03-23"}, {"date": 20200329, "state": "AL", "positive": 806, "probableCases": null, "negative": 4184, "pending": null, "totalTestResultsSource": "totalTestsPeopleViral", "totalTestResults": 4990, "hospitalizedCurrently": 158, "hospitalizedCumulative": null, "inIcuCurrently": null, "inIcuCumulative": null, "onVentilatorCurrently": null, "onVentilatorCumulative": null, "recovered": null, "dataQualityGrade": "B", "lastUpdateEt": "3/29/2020 00:00", "dateModified": "2020-03-29T00:00:00Z", "checkTimeEt": "03/28 20:00", "death": 4, "hospitalized": null, "dateChecked": "2020-03-29T00:00:00Z", "totalTestsViral": null, "positiveTestsViral": null, "negativeTestsViral": null, "positiveCasesViral": 806, "deathConfirmed": null, "deathProbable": null, "totalTestEncountersViral": null, "totalTestsPeopleViral": 4990, "totalTestsAntibody": null, "positiveTestsAntibody": null, "negativeTestsAntibody": null, "totalTestsPeopleAntibody": null, "positiveTestsPeopleAntibody": null, "negativeTestsPeopleAntibody": null, "totalTestsPeopleAntigen": null, "positiveTestsPeopleAntigen": null, "totalTestsAntigen": null, "positiveTestsAntigen": null, "fips": "01", "positiveIncrease": 110, "negativeIncrease": 0, "total": 4990, "totalTestResultsIncrease": 110, "posNeg": 4990, "deathIncrease": 1, "hospitalizedIncrease": 0, "hash": "daab4e6bdab0aa883899c400ded658e869dbdc43", "commercialScore": 0, "negativeRegularScore": 0, "negativeScore": 0, "positiveScore": 0, "score": 0, "grade": "", "month_number_label": "2020-03", "date_label": "2020-03-29", "week_number_label": "2020W13", "week_start_label": "2020-03-23"}, {"date": 20200330, "state": "AL", "positive": 859, "probableCases": null, "negative": 5694, "pending": null, "totalTestResultsSource": "totalTestsPeopleViral", "totalTestResults": 6553, "hospitalizedCurrently": 156, "hospitalizedCumulative": null, "inIcuCurrently": null, "inIcuCumulative": null, "onVentilatorCurrently": null, "onVentilatorCumulative": null, "recovered": null, "dataQualityGrade": "B", "lastUpdateEt": "3/29/2020 00:00", "dateModified": "2020-03-29T00:00:00Z", "checkTimeEt": "03/28 20:00", "death": 6, "hospitalized": null, "dateChecked": "2020-03-29T00:00:00Z", "totalTestsViral": null, "positiveTestsViral": null, "negativeTestsViral": null, "positiveCasesViral": 859, "deathConfirmed": null, "deathProbable": null, "totalTestEncountersViral": null, "totalTestsPeopleViral": 6553, "totalTestsAntibody": null, "positiveTestsAntibody": null, "negativeTestsAntibody": null, "totalTestsPeopleAntibody": null, "positiveTestsPeopleAntibody": null, "negativeTestsPeopleAntibody": null, "totalTestsPeopleAntigen": null, "positiveTestsPeopleAntigen": null, "totalTestsAntigen": null, "positiveTestsAntigen": null, "fips": "01", "positiveIncrease": 53, "negativeIncrease": 1510, "total": 6553, "totalTestResultsIncrease": 1563, "posNeg": 6553, "deathIncrease": 2, "hospitalizedIncrease": 0, "hash": "cb255c6b0a907699ff92e7c051617665f9985676", "commercialScore": 0, "negativeRegularScore": 0, "negativeScore": 0, "positiveScore": 0, "score": 0, "grade": "", "month_number_label": "2020-03", "date_label": "2020-03-30", "week_number_label": "2020W14", "week_start_label": "2020-03-30"}, {"date": 20200331, "state": "AL", "positive": 981, "probableCases": null, "negative": 6298, "pending": null, "totalTestResultsSource": "totalTestsPeopleViral", "totalTestResults": 7279, "hospitalizedCurrently": 172, "hospitalizedCumulative": null, "inIcuCurrently": null, "inIcuCumulative": null, "onVentilatorCurrently": null, "onVentilatorCumulative": null, "recovered": null, "dataQualityGrade": "B", "lastUpdateEt": "3/31/2020 00:00", "dateModified": "2020-03-31T00:00:00Z", "checkTimeEt": "03/30 20:00", "death": 13, "hospitalized": null, "dateChecked": "2020-03-31T00:00:00Z", "totalTestsViral": null, "positiveTestsViral": null, "negativeTestsViral": null, "positiveCasesViral": 981, "deathConfirmed": null, "deathProbable": null, "totalTestEncountersViral": null, "totalTestsPeopleViral": 7279, "totalTestsAntibody": null, "positiveTestsAntibody": null, "negativeTestsAntibody": null, "totalTestsPeopleAntibody": null, "positiveTestsPeopleAntibody": null, "negativeTestsPeopleAntibody": null, "totalTestsPeopleAntigen": null, "positiveTestsPeopleAntigen": null, "totalTestsAntigen": null, "positiveTestsAntigen": null, "fips": "01", "positiveIncrease": 122, "negativeIncrease": 604, "total": 7279, "totalTestResultsIncrease": 726, "posNeg": 7279, "deathIncrease": 7, "hospitalizedIncrease": 0, "hash": "376c3d247a86f5afe43ec78961abc4cdc66fa1ba", "commercialScore": 0, "negativeRegularScore": 0, "negativeScore": 0, "positiveScore": 0, "score": 0, "grade": "", "month_number_label": "2020-03", "date_label": "2020-03-31", "week_number_label": "2020W14", "week_start_label": "2020-03-30"}, {"date": 20200401, "state": "AL", "positive": 1077, "probableCases": null, "negative": 6697, "pending": null, "totalTestResultsSource": "totalTestsPeopleViral", "totalTestResults": 7774, "hospitalizedCurrently": 258, "hospitalizedCumulative": null, "inIcuCurrently": null, "inIcuCumulative": null, "onVentilatorCurrently": null, "onVentilatorCumulative": null, "recovered": null, "dataQualityGrade": "B", "lastUpdateEt": "4/1/2020 00:00", "dateModified": "2020-04-01T00:00:00Z", "checkTimeEt": "03/31 20:00", "death": 26, "hospitalized": null, "dateChecked": "2020-04-01T00:00:00Z", "totalTestsViral": null, "positiveTestsViral": null, "negativeTestsViral": null, "positiveCasesViral": 1077, "deathConfirmed": null, "deathProbable": null, "totalTestEncountersViral": null, "totalTestsPeopleViral": 7774, "totalTestsAntibody": null, "positiveTestsAntibody": null, "negativeTestsAntibody": null, "totalTestsPeopleAntibody": null, "positiveTestsPeopleAntibody": null, "negativeTestsPeopleAntibody": null, "totalTestsPeopleAntigen": null, "positiveTestsPeopleAntigen": null, "totalTestsAntigen": null, "positiveTestsAntigen": null, "fips": "01", "positiveIncrease": 96, "negativeIncrease": 399, "total": 7774, "totalTestResultsIncrease": 495, "posNeg": 7774, "deathIncrease": 13, "hospitalizedIncrease": 0, "hash": "8a4c93d28f820620cecdc69b2f86fd7ac0e87f9b", "commercialScore": 0, "negativeRegularScore": 0, "negativeScore": 0, "positiveScore": 0, "score": 0, "grade": "", "month_number_label": "2020-04", "date_label": "2020-04-01", "week_number_label": "2020W14", "week_start_label": "2020-03-30"}, {"date": 20200402, "state": "AL", "positive": 1233, "probableCases": null, "negative": 7503, "pending": null, "totalTestResultsSource": "totalTestsPeopleViral", "totalTestResults": 8736, "hospitalizedCurrently": 226, "hospitalizedCumulative": null, "inIcuCurrently": null, "inIcuCumulative": null, "onVentilatorCurrently": null, "onVentilatorCumulative": null, "recovered": null, "dataQualityGrade": "B", "lastUpdateEt": "4/2/2020 00:00", "dateModified": "2020-04-02T00:00:00Z", "checkTimeEt": "04/01 20:00", "death": 32, "hospitalized": null, "dateChecked": "2020-04-02T00:00:00Z", "totalTestsViral": null, "positiveTestsViral": null, "negativeTestsViral": null, "positiveCasesViral": 1233, "deathConfirmed": null, "deathProbable": null, "totalTestEncountersViral": null, "totalTestsPeopleViral": 8736, "totalTestsAntibody": null, "positiveTestsAntibody": null, "negativeTestsAntibody": null, "totalTestsPeopleAntibody": null, "positiveTestsPeopleAntibody": null, "negativeTestsPeopleAntibody": null, "totalTestsPeopleAntigen": null, "positiveTestsPeopleAntigen": null, "totalTestsAntigen": null, "positiveTestsAntigen": null, "fips": "01", "positiveIncrease": 156, "negativeIncrease": 806, "total": 8736, "totalTestResultsIncrease": 962, "posNeg": 8736, "deathIncrease": 6, "hospitalizedIncrease": 0, "hash": "75dac25c261fb9c7c06cee415db2f759cbfa8f0e", "commercialScore": 0, "negativeRegularScore": 0, "negativeScore": 0, "positiveScore": 0, "score": 0, "grade": "", "month_number_label": "2020-04", "date_label": "2020-04-02", "week_number_label": "2020W14", "week_start_label": "2020-03-30"}, {"date": 20200403, "state": "AL", "positive": 1432, "probableCases": null, "negative": 8187, "pending": null, "totalTestResultsSource": "totalTestsPeopleViral", "totalTestResults": 9619, "hospitalizedCurrently": 238, "hospitalizedCumulative": null, "inIcuCurrently": null, "inIcuCumulative": null, "onVentilatorCurrently": null, "onVentilatorCumulative": null, "recovered": null, "dataQualityGrade": "B", "lastUpdateEt": "4/3/2020 00:00", "dateModified": "2020-04-03T00:00:00Z", "checkTimeEt": "04/02 20:00", "death": 35, "hospitalized": null, "dateChecked": "2020-04-03T00:00:00Z", "totalTestsViral": null, "positiveTestsViral": null, "negativeTestsViral": null, "positiveCasesViral": 1432, "deathConfirmed": null, "deathProbable": null, "totalTestEncountersViral": null, "totalTestsPeopleViral": 9619, "totalTestsAntibody": null, "positiveTestsAntibody": null, "negativeTestsAntibody": null, "totalTestsPeopleAntibody": null, "positiveTestsPeopleAntibody": null, "negativeTestsPeopleAntibody": null, "totalTestsPeopleAntigen": null, "positiveTestsPeopleAntigen": null, "totalTestsAntigen": null, "positiveTestsAntigen": null, "fips": "01", "positiveIncrease": 199, "negativeIncrease": 684, "total": 9619, "totalTestResultsIncrease": 883, "posNeg": 9619, "deathIncrease": 3, "hospitalizedIncrease": 0, "hash": "94cdee3e2b1713c9617c8430ea5179d848997858", "commercialScore": 0, "negativeRegularScore": 0, "negativeScore": 0, "positiveScore": 0, "score": 0, "grade": "", "month_number_label": "2020-04", "date_label": "2020-04-03", "week_number_label": "2020W14", "week_start_label": "2020-03-30"}, {"date": 20200404, "state": "AL", "positive": 1580, "probableCases": null, "negative": 9273, "pending": null, "totalTestResultsSource": "totalTestsPeopleViral", "totalTestResults": 10853, "hospitalizedCurrently": 238, "hospitalizedCumulative": 212, "inIcuCurrently": null, "inIcuCumulative": null, "onVentilatorCurrently": null, "onVentilatorCumulative": null, "recovered": null, "dataQualityGrade": "B", "lastUpdateEt": "4/4/2020 00:00", "dateModified": "2020-04-04T00:00:00Z", "checkTimeEt": "04/03 20:00", "death": 43, "hospitalized": 212, "dateChecked": "2020-04-04T00:00:00Z", "totalTestsViral": null, "positiveTestsViral": null, "negativeTestsViral": null, "positiveCasesViral": 1580, "deathConfirmed": null, "deathProbable": null, "totalTestEncountersViral": null, "totalTestsPeopleViral": 10853, "totalTestsAntibody": null, "positiveTestsAntibody": null, "negativeTestsAntibody": null, "totalTestsPeopleAntibody": null, "positiveTestsPeopleAntibody": null, "negativeTestsPeopleAntibody": null, "totalTestsPeopleAntigen": null, "positiveTestsPeopleAntigen": null, "totalTestsAntigen": null, "positiveTestsAntigen": null, "fips": "01", "positiveIncrease": 148, "negativeIncrease": 1086, "total": 10853, "totalTestResultsIncrease": 1234, "posNeg": 10853, "deathIncrease": 8, "hospitalizedIncrease": 212, "hash": "2ef86b952bfada070e5b88cec1845166dbf154ed", "commercialScore": 0, "negativeRegularScore": 0, "negativeScore": 0, "positiveScore": 0, "score": 0, "grade": "", "month_number_label": "2020-04", "date_label": "2020-04-04", "week_number_label": "2020W14", "week_start_label": "2020-03-30"}, {"date": 20200405, "state": "AL", "positive": 1796, "probableCases": null, "negative": 11282, "pending": null, "totalTestResultsSource": "totalTestsPeopleViral", "totalTestResults": 13078, "hospitalizedCurrently": 282, "hospitalizedCumulative": 231, "inIcuCurrently": null, "inIcuCumulative": null, "onVentilatorCurrently": null, "onVentilatorCumulative": null, "recovered": null, "dataQualityGrade": "B", "lastUpdateEt": "4/5/2020 00:00", "dateModified": "2020-04-05T00:00:00Z", "checkTimeEt": "04/04 20:00", "death": 45, "hospitalized": 231, "dateChecked": "2020-04-05T00:00:00Z", "totalTestsViral": null, "positiveTestsViral": null, "negativeTestsViral": null, "positiveCasesViral": 1796, "deathConfirmed": null, "deathProbable": null, "totalTestEncountersViral": null, "totalTestsPeopleViral": 13078, "totalTestsAntibody": null, "positiveTestsAntibody": null, "negativeTestsAntibody": null, "totalTestsPeopleAntibody": null, "positiveTestsPeopleAntibody": null, "negativeTestsPeopleAntibody": null, "totalTestsPeopleAntigen": null, "positiveTestsPeopleAntigen": null, "totalTestsAntigen": null, "positiveTestsAntigen": null, "fips": "01", "positiveIncrease": 216, "negativeIncrease": 2009, "total": 13078, "totalTestResultsIncrease": 2225, "posNeg": 13078, "deathIncrease": 2, "hospitalizedIncrease": 19, "hash": "9a9590f531510be990483da07889e0f0190415b6", "commercialScore": 0, "negativeRegularScore": 0, "negativeScore": 0, "positiveScore": 0, "score": 0, "grade": "", "month_number_label": "2020-04", "date_label": "2020-04-05", "week_number_label": "2020W14", "week_start_label": "2020-03-30"}, {"date": 20200406, "state": "AL", "positive": 1968, "probableCases": null, "negative": 12797, "pending": null, "totalTestResultsSource": "totalTestsPeopleViral", "totalTestResults": 14765, "hospitalizedCurrently": 297, "hospitalizedCumulative": 240, "inIcuCurrently": null, "inIcuCumulative": null, "onVentilatorCurrently": null, "onVentilatorCumulative": null, "recovered": null, "dataQualityGrade": "B", "lastUpdateEt": "4/6/2020 00:00", "dateModified": "2020-04-06T00:00:00Z", "checkTimeEt": "04/05 20:00", "death": 50, "hospitalized": 240, "dateChecked": "2020-04-06T00:00:00Z", "totalTestsViral": null, "positiveTestsViral": null, "negativeTestsViral": null, "positiveCasesViral": 1968, "deathConfirmed": null, "deathProbable": null, "totalTestEncountersViral": null, "totalTestsPeopleViral": 14765, "totalTestsAntibody": null, "positiveTestsAntibody": null, "negativeTestsAntibody": null, "totalTestsPeopleAntibody": null, "positiveTestsPeopleAntibody": null, "negativeTestsPeopleAntibody": null, "totalTestsPeopleAntigen": null, "positiveTestsPeopleAntigen": null, "totalTestsAntigen": null, "positiveTestsAntigen": null, "fips": "01", "positiveIncrease": 172, "negativeIncrease": 1515, "total": 14765, "totalTestResultsIncrease": 1687, "posNeg": 14765, "deathIncrease": 5, "hospitalizedIncrease": 9, "hash": "77ebde2eabdde2d9c66f1b9441785d7ab7294f4a", "commercialScore": 0, "negativeRegularScore": 0, "negativeScore": 0, "positiveScore": 0, "score": 0, "grade": "", "month_number_label": "2020-04", "date_label": "2020-04-06", "week_number_label": "2020W15", "week_start_label": "2020-04-06"}, {"date": 20200407, "state": "AL", "positive": 2119, "probableCases": null, "negative": 12797, "pending": null, "totalTestResultsSource": "totalTestsPeopleViral", "totalTestResults": 14916, "hospitalizedCurrently": 302, "hospitalizedCumulative": 271, "inIcuCurrently": null, "inIcuCumulative": null, "onVentilatorCurrently": null, "onVentilatorCumulative": null, "recovered": null, "dataQualityGrade": "B", "lastUpdateEt": "4/7/2020 00:00", "dateModified": "2020-04-07T00:00:00Z", "checkTimeEt": "04/06 20:00", "death": 56, "hospitalized": 271, "dateChecked": "2020-04-07T00:00:00Z", "totalTestsViral": null, "positiveTestsViral": null, "negativeTestsViral": null, "positiveCasesViral": 2119, "deathConfirmed": null, "deathProbable": null, "totalTestEncountersViral": null, "totalTestsPeopleViral": 14916, "totalTestsAntibody": null, "positiveTestsAntibody": null, "negativeTestsAntibody": null, "totalTestsPeopleAntibody": null, "positiveTestsPeopleAntibody": null, "negativeTestsPeopleAntibody": null, "totalTestsPeopleAntigen": null, "positiveTestsPeopleAntigen": null, "totalTestsAntigen": null, "positiveTestsAntigen": null, "fips": "01", "positiveIncrease": 151, "negativeIncrease": 0, "total": 14916, "totalTestResultsIncrease": 151, "posNeg": 14916, "deathIncrease": 6, "hospitalizedIncrease": 31, "hash": "61b61c38b99b4eaeee2555177caa9cdda850b2f8", "commercialScore": 0, "negativeRegularScore": 0, "negativeScore": 0, "positiveScore": 0, "score": 0, "grade": "", "month_number_label": "2020-04", "date_label": "2020-04-07", "week_number_label": "2020W15", "week_start_label": "2020-04-06"}, {"date": 20200408, "state": "AL", "positive": 2369, "probableCases": null, "negative": 16753, "pending": null, "totalTestResultsSource": "totalTestsPeopleViral", "totalTestResults": 19122, "hospitalizedCurrently": 308, "hospitalizedCumulative": 314, "inIcuCurrently": null, "inIcuCumulative": null, "onVentilatorCurrently": null, "onVentilatorCumulative": null, "recovered": null, "dataQualityGrade": "B", "lastUpdateEt": "4/8/2020 00:00", "dateModified": "2020-04-08T00:00:00Z", "checkTimeEt": "04/07 20:00", "death": 66, "hospitalized": 314, "dateChecked": "2020-04-08T00:00:00Z", "totalTestsViral": null, "positiveTestsViral": null, "negativeTestsViral": null, "positiveCasesViral": 2369, "deathConfirmed": null, "deathProbable": null, "totalTestEncountersViral": null, "totalTestsPeopleViral": 19122, "totalTestsAntibody": null, "positiveTestsAntibody": null, "negativeTestsAntibody": null, "totalTestsPeopleAntibody": null, "positiveTestsPeopleAntibody": null, "negativeTestsPeopleAntibody": null, "totalTestsPeopleAntigen": null, "positiveTestsPeopleAntigen": null, "totalTestsAntigen": null, "positiveTestsAntigen": null, "fips": "01", "positiveIncrease": 250, "negativeIncrease": 3956, "total": 19122, "totalTestResultsIncrease": 4206, "posNeg": 19122, "deathIncrease": 10, "hospitalizedIncrease": 43, "hash": "7bd197586319d9b06add8b3fac956d92dce4880c", "commercialScore": 0, "negativeRegularScore": 0, "negativeScore": 0, "positiveScore": 0, "score": 0, "grade": "", "month_number_label": "2020-04", "date_label": "2020-04-08", "week_number_label": "2020W15", "week_start_label": "2020-04-06"}, {"date": 20200409, "state": "AL", "positive": 2769, "probableCases": null, "negative": 18058, "pending": null, "totalTestResultsSource": "totalTestsPeopleViral", "totalTestResults": 20827, "hospitalizedCurrently": 324, "hospitalizedCumulative": 333, "inIcuCurrently": null, "inIcuCumulative": null, "onVentilatorCurrently": null, "onVentilatorCumulative": null, "recovered": null, "dataQualityGrade": "B", "lastUpdateEt": "4/9/2020 00:00", "dateModified": "2020-04-09T00:00:00Z", "checkTimeEt": "04/08 20:00", "death": 74, "hospitalized": 333, "dateChecked": "2020-04-09T00:00:00Z", "totalTestsViral": null, "positiveTestsViral": null, "negativeTestsViral": null, "positiveCasesViral": 2769, "deathConfirmed": null, "deathProbable": null, "totalTestEncountersViral": null, "totalTestsPeopleViral": 20827, "totalTestsAntibody": null, "positiveTestsAntibody": null, "negativeTestsAntibody": null, "totalTestsPeopleAntibody": null, "positiveTestsPeopleAntibody": null, "negativeTestsPeopleAntibody": null, "totalTestsPeopleAntigen": null, "positiveTestsPeopleAntigen": null, "totalTestsAntigen": null, "positiveTestsAntigen": null, "fips": "01", "positiveIncrease": 400, "negativeIncrease": 1305, "total": 20827, "totalTestResultsIncrease": 1705, "posNeg": 20827, "deathIncrease": 8, "hospitalizedIncrease": 19, "hash": "0d79aaa7fed389e80e2ccf4dd15a7678965553aa", "commercialScore": 0, "negativeRegularScore": 0, "negativeScore": 0, "positiveScore": 0, "score": 0, "grade": "", "month_number_label": "2020-04", "date_label": "2020-04-09", "week_number_label": "2020W15", "week_start_label": "2020-04-06"}, {"date": 20200410, "state": "AL", "positive": 2968, "probableCases": null, "negative": 18058, "pending": null, "totalTestResultsSource": "totalTestsPeopleViral", "totalTestResults": 21026, "hospitalizedCurrently": 350, "hospitalizedCumulative": 368, "inIcuCurrently": null, "inIcuCumulative": null, "onVentilatorCurrently": null, "onVentilatorCumulative": null, "recovered": null, "dataQualityGrade": "B", "lastUpdateEt": "4/10/2020 00:00", "dateModified": "2020-04-10T00:00:00Z", "checkTimeEt": "04/09 20:00", "death": 80, "hospitalized": 368, "dateChecked": "2020-04-10T00:00:00Z", "totalTestsViral": null, "positiveTestsViral": null, "negativeTestsViral": null, "positiveCasesViral": 2968, "deathConfirmed": null, "deathProbable": null, "totalTestEncountersViral": null, "totalTestsPeopleViral": 21026, "totalTestsAntibody": null, "positiveTestsAntibody": null, "negativeTestsAntibody": null, "totalTestsPeopleAntibody": null, "positiveTestsPeopleAntibody": null, "negativeTestsPeopleAntibody": null, "totalTestsPeopleAntigen": null, "positiveTestsPeopleAntigen": null, "totalTestsAntigen": null, "positiveTestsAntigen": null, "fips": "01", "positiveIncrease": 199, "negativeIncrease": 0, "total": 21026, "totalTestResultsIncrease": 199, "posNeg": 21026, "deathIncrease": 6, "hospitalizedIncrease": 35, "hash": "940ea7c9a0fd37541343b00c806f4d61e58212b3", "commercialScore": 0, "negativeRegularScore": 0, "negativeScore": 0, "positiveScore": 0, "score": 0, "grade": "", "month_number_label": "2020-04", "date_label": "2020-04-10", "week_number_label": "2020W15", "week_start_label": "2020-04-06"}, {"date": 20200411, "state": "AL", "positive": 3191, "probableCases": null, "negative": 18058, "pending": null, "totalTestResultsSource": "totalTestsPeopleViral", "totalTestResults": 21249, "hospitalizedCurrently": 343, "hospitalizedCumulative": 402, "inIcuCurrently": null, "inIcuCumulative": 177, "onVentilatorCurrently": null, "onVentilatorCumulative": 113, "recovered": null, "dataQualityGrade": "B", "lastUpdateEt": "4/11/2020 00:00", "dateModified": "2020-04-11T00:00:00Z", "checkTimeEt": "04/10 20:00", "death": 91, "hospitalized": 402, "dateChecked": "2020-04-11T00:00:00Z", "totalTestsViral": null, "positiveTestsViral": null, "negativeTestsViral": null, "positiveCasesViral": 3191, "deathConfirmed": null, "deathProbable": null, "totalTestEncountersViral": null, "totalTestsPeopleViral": 21249, "totalTestsAntibody": null, "positiveTestsAntibody": null, "negativeTestsAntibody": null, "totalTestsPeopleAntibody": null, "positiveTestsPeopleAntibody": null, "negativeTestsPeopleAntibody": null, "totalTestsPeopleAntigen": null, "positiveTestsPeopleAntigen": null, "totalTestsAntigen": null, "positiveTestsAntigen": null, "fips": "01", "positiveIncrease": 223, "negativeIncrease": 0, "total": 21249, "totalTestResultsIncrease": 223, "posNeg": 21249, "deathIncrease": 11, "hospitalizedIncrease": 34, "hash": "250672754fa20bd41e88ad2eea0c225679594aef", "commercialScore": 0, "negativeRegularScore": 0, "negativeScore": 0, "positiveScore": 0, "score": 0, "grade": "", "month_number_label": "2020-04", "date_label": "2020-04-11", "week_number_label": "2020W15", "week_start_label": "2020-04-06"}, {"date": 20200412, "state": "AL", "positive": 3525, "probableCases": null, "negative": 18058, "pending": null, "totalTestResultsSource": "totalTestsPeopleViral", "totalTestResults": 21583, "hospitalizedCurrently": 290, "hospitalizedCumulative": 437, "inIcuCurrently": null, "inIcuCumulative": 189, "onVentilatorCurrently": null, "onVentilatorCumulative": 119, "recovered": null, "dataQualityGrade": "B", "lastUpdateEt": "4/12/2020 00:00", "dateModified": "2020-04-12T00:00:00Z", "checkTimeEt": "04/11 20:00", "death": 93, "hospitalized": 437, "dateChecked": "2020-04-12T00:00:00Z", "totalTestsViral": null, "positiveTestsViral": null, "negativeTestsViral": null, "positiveCasesViral": 3525, "deathConfirmed": null, "deathProbable": null, "totalTestEncountersViral": null, "totalTestsPeopleViral": 21583, "totalTestsAntibody": null, "positiveTestsAntibody": null, "negativeTestsAntibody": null, "totalTestsPeopleAntibody": null, "positiveTestsPeopleAntibody": null, "negativeTestsPeopleAntibody": null, "totalTestsPeopleAntigen": null, "positiveTestsPeopleAntigen": null, "totalTestsAntigen": null, "positiveTestsAntigen": null, "fips": "01", "positiveIncrease": 334, "negativeIncrease": 0, "total": 21583, "totalTestResultsIncrease": 334, "posNeg": 21583, "deathIncrease": 2, "hospitalizedIncrease": 35, "hash": "99674055d42d3377d2c3683dd39054b3864fb9e3", "commercialScore": 0, "negativeRegularScore": 0, "negativeScore": 0, "positiveScore": 0, "score": 0, "grade": "", "month_number_label": "2020-04", "date_label": "2020-04-12", "week_number_label": "2020W15", "week_start_label": "2020-04-06"}, {"date": 20200413, "state": "AL", "positive": 3734, "probableCases": null, "negative": 25448, "pending": null, "totalTestResultsSource": "totalTestsPeopleViral", "totalTestResults": 29182, "hospitalizedCurrently": 380, "hospitalizedCumulative": 457, "inIcuCurrently": null, "inIcuCumulative": 189, "onVentilatorCurrently": null, "onVentilatorCumulative": 119, "recovered": null, "dataQualityGrade": "B", "lastUpdateEt": "4/13/2020 00:00", "dateModified": "2020-04-13T00:00:00Z", "checkTimeEt": "04/12 20:00", "death": 99, "hospitalized": 457, "dateChecked": "2020-04-13T00:00:00Z", "totalTestsViral": null, "positiveTestsViral": null, "negativeTestsViral": null, "positiveCasesViral": 3734, "deathConfirmed": null, "deathProbable": null, "totalTestEncountersViral": null, "totalTestsPeopleViral": 29182, "totalTestsAntibody": null, "positiveTestsAntibody": null, "negativeTestsAntibody": null, "totalTestsPeopleAntibody": null, "positiveTestsPeopleAntibody": null, "negativeTestsPeopleAntibody": null, "totalTestsPeopleAntigen": null, "positiveTestsPeopleAntigen": null, "totalTestsAntigen": null, "positiveTestsAntigen": null, "fips": "01", "positiveIncrease": 209, "negativeIncrease": 7390, "total": 29182, "totalTestResultsIncrease": 7599, "posNeg": 29182, "deathIncrease": 6, "hospitalizedIncrease": 20, "hash": "f9bbbf46d2b59c7fc958701c6c3dd4ad796a7e5b", "commercialScore": 0, "negativeRegularScore": 0, "negativeScore": 0, "positiveScore": 0, "score": 0, "grade": "", "month_number_label": "2020-04", "date_label": "2020-04-13", "week_number_label": "2020W16", "week_start_label": "2020-04-13"}, {"date": 20200414, "state": "AL", "positive": 3876, "probableCases": null, "negative": 29241, "pending": null, "totalTestResultsSource": "totalTestsPeopleViral", "totalTestResults": 33117, "hospitalizedCurrently": 380, "hospitalizedCumulative": 493, "inIcuCurrently": null, "inIcuCumulative": 210, "onVentilatorCurrently": null, "onVentilatorCumulative": 132, "recovered": null, "dataQualityGrade": "B", "lastUpdateEt": "4/14/2020 00:00", "dateModified": "2020-04-14T00:00:00Z", "checkTimeEt": "04/13 20:00", "death": 110, "hospitalized": 493, "dateChecked": "2020-04-14T00:00:00Z", "totalTestsViral": null, "positiveTestsViral": null, "negativeTestsViral": null, "positiveCasesViral": 3876, "deathConfirmed": null, "deathProbable": null, "totalTestEncountersViral": null, "totalTestsPeopleViral": 33117, "totalTestsAntibody": null, "positiveTestsAntibody": null, "negativeTestsAntibody": null, "totalTestsPeopleAntibody": null, "positiveTestsPeopleAntibody": null, "negativeTestsPeopleAntibody": null, "totalTestsPeopleAntigen": null, "positiveTestsPeopleAntigen": null, "totalTestsAntigen": null, "positiveTestsAntigen": null, "fips": "01", "positiveIncrease": 142, "negativeIncrease": 3793, "total": 33117, "totalTestResultsIncrease": 3935, "posNeg": 33117, "deathIncrease": 11, "hospitalizedIncrease": 36, "hash": "7ab5d87e470ef1844974981f3425ebe1d4a8ba04", "commercialScore": 0, "negativeRegularScore": 0, "negativeScore": 0, "positiveScore": 0, "score": 0, "grade": "", "month_number_label": "2020-04", "date_label": "2020-04-14", "week_number_label": "2020W16", "week_start_label": "2020-04-13"}, {"date": 20200415, "state": "AL", "positive": 4113, "probableCases": null, "negative": 29964, "pending": null, "totalTestResultsSource": "totalTestsPeopleViral", "totalTestResults": 34077, "hospitalizedCurrently": 402, "hospitalizedCumulative": 525, "inIcuCurrently": null, "inIcuCumulative": 219, "onVentilatorCurrently": null, "onVentilatorCumulative": 134, "recovered": null, "dataQualityGrade": "B", "lastUpdateEt": "4/15/2020 00:00", "dateModified": "2020-04-15T00:00:00Z", "checkTimeEt": "04/14 20:00", "death": 121, "hospitalized": 525, "dateChecked": "2020-04-15T00:00:00Z", "totalTestsViral": null, "positiveTestsViral": null, "negativeTestsViral": null, "positiveCasesViral": 4113, "deathConfirmed": null, "deathProbable": null, "totalTestEncountersViral": null, "totalTestsPeopleViral": 34077, "totalTestsAntibody": null, "positiveTestsAntibody": null, "negativeTestsAntibody": null, "totalTestsPeopleAntibody": null, "positiveTestsPeopleAntibody": null, "negativeTestsPeopleAntibody": null, "totalTestsPeopleAntigen": null, "positiveTestsPeopleAntigen": null, "totalTestsAntigen": null, "positiveTestsAntigen": null, "fips": "01", "positiveIncrease": 237, "negativeIncrease": 723, "total": 34077, "totalTestResultsIncrease": 960, "posNeg": 34077, "deathIncrease": 11, "hospitalizedIncrease": 32, "hash": "6350361c7d93592eb6b78e7a3bd5cad04c8babc8", "commercialScore": 0, "negativeRegularScore": 0, "negativeScore": 0, "positiveScore": 0, "score": 0, "grade": "", "month_number_label": "2020-04", "date_label": "2020-04-15", "week_number_label": "2020W16", "week_start_label": "2020-04-13"}, {"date": 20200416, "state": "AL", "positive": 4345, "probableCases": null, "negative": 32046, "pending": null, "totalTestResultsSource": "totalTestsPeopleViral", "totalTestResults": 36391, "hospitalizedCurrently": 360, "hospitalizedCumulative": 553, "inIcuCurrently": null, "inIcuCumulative": 227, "onVentilatorCurrently": null, "onVentilatorCumulative": 137, "recovered": null, "dataQualityGrade": "B", "lastUpdateEt": "4/16/2020 00:00", "dateModified": "2020-04-16T00:00:00Z", "checkTimeEt": "04/15 20:00", "death": 133, "hospitalized": 553, "dateChecked": "2020-04-16T00:00:00Z", "totalTestsViral": null, "positiveTestsViral": null, "negativeTestsViral": null, "positiveCasesViral": 4345, "deathConfirmed": null, "deathProbable": null, "totalTestEncountersViral": null, "totalTestsPeopleViral": 36391, "totalTestsAntibody": null, "positiveTestsAntibody": null, "negativeTestsAntibody": null, "totalTestsPeopleAntibody": null, "positiveTestsPeopleAntibody": null, "negativeTestsPeopleAntibody": null, "totalTestsPeopleAntigen": null, "positiveTestsPeopleAntigen": null, "totalTestsAntigen": null, "positiveTestsAntigen": null, "fips": "01", "positiveIncrease": 232, "negativeIncrease": 2082, "total": 36391, "totalTestResultsIncrease": 2314, "posNeg": 36391, "deathIncrease": 12, "hospitalizedIncrease": 28, "hash": "cd578f4adea68794f83926eff02d85b917cfc471", "commercialScore": 0, "negativeRegularScore": 0, "negativeScore": 0, "positiveScore": 0, "score": 0, "grade": "", "month_number_label": "2020-04", "date_label": "2020-04-16", "week_number_label": "2020W16", "week_start_label": "2020-04-13"}, {"date": 20200417, "state": "AL", "positive": 4530, "probableCases": null, "negative": 33318, "pending": null, "totalTestResultsSource": "totalTestsPeopleViral", "totalTestResults": 37848, "hospitalizedCurrently": 364, "hospitalizedCumulative": 594, "inIcuCurrently": null, "inIcuCumulative": 247, "onVentilatorCurrently": null, "onVentilatorCumulative": 148, "recovered": null, "dataQualityGrade": "B", "lastUpdateEt": "4/17/2020 00:00", "dateModified": "2020-04-17T00:00:00Z", "checkTimeEt": "04/16 20:00", "death": 144, "hospitalized": 594, "dateChecked": "2020-04-17T00:00:00Z", "totalTestsViral": null, "positiveTestsViral": null, "negativeTestsViral": null, "positiveCasesViral": 4530, "deathConfirmed": null, "deathProbable": null, "totalTestEncountersViral": null, "totalTestsPeopleViral": 37848, "totalTestsAntibody": null, "positiveTestsAntibody": null, "negativeTestsAntibody": null, "totalTestsPeopleAntibody": null, "positiveTestsPeopleAntibody": null, "negativeTestsPeopleAntibody": null, "totalTestsPeopleAntigen": null, "positiveTestsPeopleAntigen": null, "totalTestsAntigen": null, "positiveTestsAntigen": null, "fips": "01", "positiveIncrease": 185, "negativeIncrease": 1272, "total": 37848, "totalTestResultsIncrease": 1457, "posNeg": 37848, "deathIncrease": 11, "hospitalizedIncrease": 41, "hash": "4da14596b46ed28512f341c8cf981c2071f9e2aa", "commercialScore": 0, "negativeRegularScore": 0, "negativeScore": 0, "positiveScore": 0, "score": 0, "grade": "", "month_number_label": "2020-04", "date_label": "2020-04-17", "week_number_label": "2020W16", "week_start_label": "2020-04-13"}, {"date": 20200418, "state": "AL", "positive": 4655, "probableCases": null, "negative": 37883, "pending": null, "totalTestResultsSource": "totalTestsPeopleViral", "totalTestResults": 42538, "hospitalizedCurrently": 359, "hospitalizedCumulative": 620, "inIcuCurrently": null, "inIcuCumulative": 247, "onVentilatorCurrently": null, "onVentilatorCumulative": 148, "recovered": null, "dataQualityGrade": "B", "lastUpdateEt": "4/18/2020 00:00", "dateModified": "2020-04-18T00:00:00Z", "checkTimeEt": "04/17 20:00", "death": 146, "hospitalized": 620, "dateChecked": "2020-04-18T00:00:00Z", "totalTestsViral": null, "positiveTestsViral": null, "negativeTestsViral": null, "positiveCasesViral": 4655, "deathConfirmed": null, "deathProbable": null, "totalTestEncountersViral": null, "totalTestsPeopleViral": 42538, "totalTestsAntibody": null, "positiveTestsAntibody": null, "negativeTestsAntibody": null, "totalTestsPeopleAntibody": null, "positiveTestsPeopleAntibody": null, "negativeTestsPeopleAntibody": null, "totalTestsPeopleAntigen": null, "positiveTestsPeopleAntigen": null, "totalTestsAntigen": null, "positiveTestsAntigen": null, "fips": "01", "positiveIncrease": 125, "negativeIncrease": 4565, "total": 42538, "totalTestResultsIncrease": 4690, "posNeg": 42538, "deathIncrease": 2, "hospitalizedIncrease": 26, "hash": "b7f5e715e3a939fc26f99b235c7014d455f7e954", "commercialScore": 0, "negativeRegularScore": 0, "negativeScore": 0, "positiveScore": 0, "score": 0, "grade": "", "month_number_label": "2020-04", "date_label": "2020-04-18", "week_number_label": "2020W16", "week_start_label": "2020-04-13"}, {"date": 20200419, "state": "AL", "positive": 4837, "probableCases": null, "negative": 40875, "pending": null, "totalTestResultsSource": "totalTestsPeopleViral", "totalTestResults": 45712, "hospitalizedCurrently": 360, "hospitalizedCumulative": 641, "inIcuCurrently": null, "inIcuCumulative": 260, "onVentilatorCurrently": null, "onVentilatorCumulative": 157, "recovered": null, "dataQualityGrade": "B", "lastUpdateEt": "4/19/2020 00:00", "dateModified": "2020-04-19T00:00:00Z", "checkTimeEt": "04/18 20:00", "death": 154, "hospitalized": 641, "dateChecked": "2020-04-19T00:00:00Z", "totalTestsViral": null, "positiveTestsViral": null, "negativeTestsViral": null, "positiveCasesViral": 4837, "deathConfirmed": null, "deathProbable": null, "totalTestEncountersViral": null, "totalTestsPeopleViral": 45712, "totalTestsAntibody": null, "positiveTestsAntibody": null, "negativeTestsAntibody": null, "totalTestsPeopleAntibody": null, "positiveTestsPeopleAntibody": null, "negativeTestsPeopleAntibody": null, "totalTestsPeopleAntigen": null, "positiveTestsPeopleAntigen": null, "totalTestsAntigen": null, "positiveTestsAntigen": null, "fips": "01", "positiveIncrease": 182, "negativeIncrease": 2992, "total": 45712, "totalTestResultsIncrease": 3174, "posNeg": 45712, "deathIncrease": 8, "hospitalizedIncrease": 21, "hash": "12bb515bdb528ed075888bbacee052d1dc09b826", "commercialScore": 0, "negativeRegularScore": 0, "negativeScore": 0, "positiveScore": 0, "score": 0, "grade": "", "month_number_label": "2020-04", "date_label": "2020-04-19", "week_number_label": "2020W16", "week_start_label": "2020-04-13"}, {"date": 20200420, "state": "AL", "positive": 5025, "probableCases": null, "negative": 40875, "pending": null, "totalTestResultsSource": "totalTestsPeopleViral", "totalTestResults": 45900, "hospitalizedCurrently": 397, "hospitalizedCumulative": 641, "inIcuCurrently": null, "inIcuCumulative": 260, "onVentilatorCurrently": null, "onVentilatorCumulative": 157, "recovered": null, "dataQualityGrade": "B", "lastUpdateEt": "4/20/2020 00:00", "dateModified": "2020-04-20T00:00:00Z", "checkTimeEt": "04/19 20:00", "death": 167, "hospitalized": 641, "dateChecked": "2020-04-20T00:00:00Z", "totalTestsViral": null, "positiveTestsViral": null, "negativeTestsViral": null, "positiveCasesViral": 5025, "deathConfirmed": null, "deathProbable": null, "totalTestEncountersViral": null, "totalTestsPeopleViral": 45900, "totalTestsAntibody": null, "positiveTestsAntibody": null, "negativeTestsAntibody": null, "totalTestsPeopleAntibody": null, "positiveTestsPeopleAntibody": null, "negativeTestsPeopleAntibody": null, "totalTestsPeopleAntigen": null, "positiveTestsPeopleAntigen": null, "totalTestsAntigen": null, "positiveTestsAntigen": null, "fips": "01", "positiveIncrease": 188, "negativeIncrease": 0, "total": 45900, "totalTestResultsIncrease": 188, "posNeg": 45900, "deathIncrease": 13, "hospitalizedIncrease": 0, "hash": "1f871aa4189ca7279564c277f351acf45e3a6b4f", "commercialScore": 0, "negativeRegularScore": 0, "negativeScore": 0, "positiveScore": 0, "score": 0, "grade": "", "month_number_label": "2020-04", "date_label": "2020-04-20", "week_number_label": "2020W17", "week_start_label": "2020-04-20"}, {"date": 20200421, "state": "AL", "positive": 5231, "probableCases": null, "negative": 43295, "pending": null, "totalTestResultsSource": "totalTestsPeopleViral", "totalTestResults": 48526, "hospitalizedCurrently": 401, "hospitalizedCumulative": 699, "inIcuCurrently": null, "inIcuCumulative": 260, "onVentilatorCurrently": null, "onVentilatorCumulative": 157, "recovered": null, "dataQualityGrade": "B", "lastUpdateEt": "4/21/2020 00:00", "dateModified": "2020-04-21T00:00:00Z", "checkTimeEt": "04/20 20:00", "death": 177, "hospitalized": 699, "dateChecked": "2020-04-21T00:00:00Z", "totalTestsViral": null, "positiveTestsViral": null, "negativeTestsViral": null, "positiveCasesViral": 5231, "deathConfirmed": null, "deathProbable": null, "totalTestEncountersViral": null, "totalTestsPeopleViral": 48526, "totalTestsAntibody": null, "positiveTestsAntibody": null, "negativeTestsAntibody": null, "totalTestsPeopleAntibody": null, "positiveTestsPeopleAntibody": null, "negativeTestsPeopleAntibody": null, "totalTestsPeopleAntigen": null, "positiveTestsPeopleAntigen": null, "totalTestsAntigen": null, "positiveTestsAntigen": null, "fips": "01", "positiveIncrease": 206, "negativeIncrease": 2420, "total": 48526, "totalTestResultsIncrease": 2626, "posNeg": 48526, "deathIncrease": 10, "hospitalizedIncrease": 58, "hash": "14183d2a2ccc1b5cb411fff6080bc8188060c25c", "commercialScore": 0, "negativeRegularScore": 0, "negativeScore": 0, "positiveScore": 0, "score": 0, "grade": "", "month_number_label": "2020-04", "date_label": "2020-04-21", "week_number_label": "2020W17", "week_start_label": "2020-04-20"}, {"date": 20200422, "state": "AL", "positive": 5465, "probableCases": null, "negative": 43295, "pending": null, "totalTestResultsSource": "totalTestsPeopleViral", "totalTestResults": 48760, "hospitalizedCurrently": 440, "hospitalizedCumulative": 730, "inIcuCurrently": null, "inIcuCumulative": 288, "onVentilatorCurrently": null, "onVentilatorCumulative": 170, "recovered": null, "dataQualityGrade": "B", "lastUpdateEt": "4/22/2020 00:00", "dateModified": "2020-04-22T00:00:00Z", "checkTimeEt": "04/21 20:00", "death": 194, "hospitalized": 730, "dateChecked": "2020-04-22T00:00:00Z", "totalTestsViral": null, "positiveTestsViral": null, "negativeTestsViral": null, "positiveCasesViral": 5465, "deathConfirmed": null, "deathProbable": null, "totalTestEncountersViral": null, "totalTestsPeopleViral": 48760, "totalTestsAntibody": null, "positiveTestsAntibody": null, "negativeTestsAntibody": null, "totalTestsPeopleAntibody": null, "positiveTestsPeopleAntibody": null, "negativeTestsPeopleAntibody": null, "totalTestsPeopleAntigen": null, "positiveTestsPeopleAntigen": null, "totalTestsAntigen": null, "positiveTestsAntigen": null, "fips": "01", "positiveIncrease": 234, "negativeIncrease": 0, "total": 48760, "totalTestResultsIncrease": 234, "posNeg": 48760, "deathIncrease": 17, "hospitalizedIncrease": 31, "hash": "78630a3a19291d5575fe8d585bf27539742819c7", "commercialScore": 0, "negativeRegularScore": 0, "negativeScore": 0, "positiveScore": 0, "score": 0, "grade": "", "month_number_label": "2020-04", "date_label": "2020-04-22", "week_number_label": "2020W17", "week_start_label": "2020-04-20"}, {"date": 20200423, "state": "AL", "positive": 5778, "probableCases": null, "negative": 46863, "pending": null, "totalTestResultsSource": "totalTestsPeopleViral", "totalTestResults": 52641, "hospitalizedCurrently": 406, "hospitalizedCumulative": 768, "inIcuCurrently": null, "inIcuCumulative": 288, "onVentilatorCurrently": null, "onVentilatorCumulative": 170, "recovered": null, "dataQualityGrade": "B", "lastUpdateEt": "4/23/2020 00:00", "dateModified": "2020-04-23T00:00:00Z", "checkTimeEt": "04/22 20:00", "death": 197, "hospitalized": 768, "dateChecked": "2020-04-23T00:00:00Z", "totalTestsViral": null, "positiveTestsViral": null, "negativeTestsViral": null, "positiveCasesViral": 5778, "deathConfirmed": null, "deathProbable": null, "totalTestEncountersViral": null, "totalTestsPeopleViral": 52641, "totalTestsAntibody": null, "positiveTestsAntibody": null, "negativeTestsAntibody": null, "totalTestsPeopleAntibody": null, "positiveTestsPeopleAntibody": null, "negativeTestsPeopleAntibody": null, "totalTestsPeopleAntigen": null, "positiveTestsPeopleAntigen": null, "totalTestsAntigen": null, "positiveTestsAntigen": null, "fips": "01", "positiveIncrease": 313, "negativeIncrease": 3568, "total": 52641, "totalTestResultsIncrease": 3881, "posNeg": 52641, "deathIncrease": 3, "hospitalizedIncrease": 38, "hash": "c5c296b3f5e0b187783b514b61c6571c59a1db92", "commercialScore": 0, "negativeRegularScore": 0, "negativeScore": 0, "positiveScore": 0, "score": 0, "grade": "", "month_number_label": "2020-04", "date_label": "2020-04-23", "week_number_label": "2020W17", "week_start_label": "2020-04-20"}, {"date": 20200424, "state": "AL", "positive": 5832, "probableCases": null, "negative": 46863, "pending": null, "totalTestResultsSource": "totalTestsPeopleViral", "totalTestResults": 52695, "hospitalizedCurrently": 429, "hospitalizedCumulative": 768, "inIcuCurrently": null, "inIcuCumulative": 288, "onVentilatorCurrently": null, "onVentilatorCumulative": 170, "recovered": null, "dataQualityGrade": "B", "lastUpdateEt": "4/24/2020 00:00", "dateModified": "2020-04-24T00:00:00Z", "checkTimeEt": "04/23 20:00", "death": 197, "hospitalized": 768, "dateChecked": "2020-04-24T00:00:00Z", "totalTestsViral": null, "positiveTestsViral": null, "negativeTestsViral": null, "positiveCasesViral": 5832, "deathConfirmed": null, "deathProbable": null, "totalTestEncountersViral": null, "totalTestsPeopleViral": 52695, "totalTestsAntibody": null, "positiveTestsAntibody": null, "negativeTestsAntibody": null, "totalTestsPeopleAntibody": null, "positiveTestsPeopleAntibody": null, "negativeTestsPeopleAntibody": null, "totalTestsPeopleAntigen": null, "positiveTestsPeopleAntigen": null, "totalTestsAntigen": null, "positiveTestsAntigen": null, "fips": "01", "positiveIncrease": 54, "negativeIncrease": 0, "total": 52695, "totalTestResultsIncrease": 54, "posNeg": 52695, "deathIncrease": 0, "hospitalizedIncrease": 0, "hash": "e902ae933ab04d023f50e2752d24120a405b66d3", "commercialScore": 0, "negativeRegularScore": 0, "negativeScore": 0, "positiveScore": 0, "score": 0, "grade": "", "month_number_label": "2020-04", "date_label": "2020-04-24", "week_number_label": "2020W17", "week_start_label": "2020-04-20"}, {"date": 20200425, "state": "AL", "positive": 6137, "probableCases": null, "negative": 65207, "pending": null, "totalTestResultsSource": "totalTestsPeopleViral", "totalTestResults": 71344, "hospitalizedCurrently": 351, "hospitalizedCumulative": 839, "inIcuCurrently": null, "inIcuCumulative": 288, "onVentilatorCurrently": null, "onVentilatorCumulative": 170, "recovered": null, "dataQualityGrade": "B", "lastUpdateEt": "4/25/2020 00:00", "dateModified": "2020-04-25T00:00:00Z", "checkTimeEt": "04/24 20:00", "death": 212, "hospitalized": 839, "dateChecked": "2020-04-25T00:00:00Z", "totalTestsViral": null, "positiveTestsViral": null, "negativeTestsViral": null, "positiveCasesViral": 6137, "deathConfirmed": null, "deathProbable": null, "totalTestEncountersViral": null, "totalTestsPeopleViral": 71344, "totalTestsAntibody": null, "positiveTestsAntibody": null, "negativeTestsAntibody": null, "totalTestsPeopleAntibody": null, "positiveTestsPeopleAntibody": null, "negativeTestsPeopleAntibody": null, "totalTestsPeopleAntigen": null, "positiveTestsPeopleAntigen": null, "totalTestsAntigen": null, "positiveTestsAntigen": null, "fips": "01", "positiveIncrease": 305, "negativeIncrease": 18344, "total": 71344, "totalTestResultsIncrease": 18649, "posNeg": 71344, "deathIncrease": 15, "hospitalizedIncrease": 71, "hash": "da4c1d3078f0a260effa23f956df04c0f4a71aba", "commercialScore": 0, "negativeRegularScore": 0, "negativeScore": 0, "positiveScore": 0, "score": 0, "grade": "", "month_number_label": "2020-04", "date_label": "2020-04-25", "week_number_label": "2020W17", "week_start_label": "2020-04-20"}, {"date": 20200426, "state": "AL", "positive": 6270, "probableCases": null, "negative": 67281, "pending": null, "totalTestResultsSource": "totalTestsPeopleViral", "totalTestResults": 73551, "hospitalizedCurrently": 384, "hospitalizedCumulative": 845, "inIcuCurrently": null, "inIcuCumulative": 288, "onVentilatorCurrently": null, "onVentilatorCumulative": 170, "recovered": null, "dataQualityGrade": "B", "lastUpdateEt": "4/26/2020 00:00", "dateModified": "2020-04-26T00:00:00Z", "checkTimeEt": "04/25 20:00", "death": 216, "hospitalized": 845, "dateChecked": "2020-04-26T00:00:00Z", "totalTestsViral": null, "positiveTestsViral": null, "negativeTestsViral": null, "positiveCasesViral": 6270, "deathConfirmed": null, "deathProbable": null, "totalTestEncountersViral": null, "totalTestsPeopleViral": 73551, "totalTestsAntibody": null, "positiveTestsAntibody": null, "negativeTestsAntibody": null, "totalTestsPeopleAntibody": null, "positiveTestsPeopleAntibody": null, "negativeTestsPeopleAntibody": null, "totalTestsPeopleAntigen": null, "positiveTestsPeopleAntigen": null, "totalTestsAntigen": null, "positiveTestsAntigen": null, "fips": "01", "positiveIncrease": 133, "negativeIncrease": 2074, "total": 73551, "totalTestResultsIncrease": 2207, "posNeg": 73551, "deathIncrease": 4, "hospitalizedIncrease": 6, "hash": "ffd0519e21c8ecea5986cbb93147a8432726d44f", "commercialScore": 0, "negativeRegularScore": 0, "negativeScore": 0, "positiveScore": 0, "score": 0, "grade": "", "month_number_label": "2020-04", "date_label": "2020-04-26", "week_number_label": "2020W17", "week_start_label": "2020-04-20"}, {"date": 20200427, "state": "AL", "positive": 6499, "probableCases": null, "negative": 67498, "pending": null, "totalTestResultsSource": "totalTestsPeopleViral", "totalTestResults": 73997, "hospitalizedCurrently": 426, "hospitalizedCumulative": 872, "inIcuCurrently": null, "inIcuCumulative": 335, "onVentilatorCurrently": null, "onVentilatorCumulative": 195, "recovered": null, "dataQualityGrade": "B", "lastUpdateEt": "4/27/2020 00:00", "dateModified": "2020-04-27T00:00:00Z", "checkTimeEt": "04/26 20:00", "death": 222, "hospitalized": 872, "dateChecked": "2020-04-27T00:00:00Z", "totalTestsViral": null, "positiveTestsViral": null, "negativeTestsViral": null, "positiveCasesViral": 6499, "deathConfirmed": null, "deathProbable": null, "totalTestEncountersViral": null, "totalTestsPeopleViral": 73997, "totalTestsAntibody": null, "positiveTestsAntibody": null, "negativeTestsAntibody": null, "totalTestsPeopleAntibody": null, "positiveTestsPeopleAntibody": null, "negativeTestsPeopleAntibody": null, "totalTestsPeopleAntigen": null, "positiveTestsPeopleAntigen": null, "totalTestsAntigen": null, "positiveTestsAntigen": null, "fips": "01", "positiveIncrease": 229, "negativeIncrease": 217, "total": 73997, "totalTestResultsIncrease": 446, "posNeg": 73997, "deathIncrease": 6, "hospitalizedIncrease": 27, "hash": "368c4e97f3cbf8fc98591c0f698cdb47563f7e6a", "commercialScore": 0, "negativeRegularScore": 0, "negativeScore": 0, "positiveScore": 0, "score": 0, "grade": "", "month_number_label": "2020-04", "date_label": "2020-04-27", "week_number_label": "2020W18", "week_start_label": "2020-04-27"}, {"date": 20200428, "state": "AL", "positive": 6687, "probableCases": null, "negative": 69140, "pending": null, "totalTestResultsSource": "totalTestsPeopleViral", "totalTestResults": 75827, "hospitalizedCurrently": 530, "hospitalizedCumulative": 911, "inIcuCurrently": null, "inIcuCumulative": 335, "onVentilatorCurrently": null, "onVentilatorCumulative": 195, "recovered": null, "dataQualityGrade": "B", "lastUpdateEt": "4/28/2020 00:00", "dateModified": "2020-04-28T00:00:00Z", "checkTimeEt": "04/27 20:00", "death": 242, "hospitalized": 911, "dateChecked": "2020-04-28T00:00:00Z", "totalTestsViral": null, "positiveTestsViral": null, "negativeTestsViral": null, "positiveCasesViral": 6687, "deathConfirmed": null, "deathProbable": null, "totalTestEncountersViral": null, "totalTestsPeopleViral": 75827, "totalTestsAntibody": null, "positiveTestsAntibody": null, "negativeTestsAntibody": null, "totalTestsPeopleAntibody": null, "positiveTestsPeopleAntibody": null, "negativeTestsPeopleAntibody": null, "totalTestsPeopleAntigen": null, "positiveTestsPeopleAntigen": null, "totalTestsAntigen": null, "positiveTestsAntigen": null, "fips": "01", "positiveIncrease": 188, "negativeIncrease": 1642, "total": 75827, "totalTestResultsIncrease": 1830, "posNeg": 75827, "deathIncrease": 20, "hospitalizedIncrease": 39, "hash": "8d50ac5c7c21122a0badc1582a9f7ead03552e55", "commercialScore": 0, "negativeRegularScore": 0, "negativeScore": 0, "positiveScore": 0, "score": 0, "grade": "", "month_number_label": "2020-04", "date_label": "2020-04-28", "week_number_label": "2020W18", "week_start_label": "2020-04-27"}, {"date": 20200429, "state": "AL", "positive": 6842, "probableCases": null, "negative": 73607, "pending": null, "totalTestResultsSource": "totalTestsPeopleViral", "totalTestResults": 80449, "hospitalizedCurrently": 498, "hospitalizedCumulative": 945, "inIcuCurrently": null, "inIcuCumulative": 335, "onVentilatorCurrently": null, "onVentilatorCumulative": 195, "recovered": null, "dataQualityGrade": "B", "lastUpdateEt": "4/29/2020 00:00", "dateModified": "2020-04-29T00:00:00Z", "checkTimeEt": "04/28 20:00", "death": 245, "hospitalized": 945, "dateChecked": "2020-04-29T00:00:00Z", "totalTestsViral": null, "positiveTestsViral": null, "negativeTestsViral": null, "positiveCasesViral": 6842, "deathConfirmed": null, "deathProbable": null, "totalTestEncountersViral": null, "totalTestsPeopleViral": 80449, "totalTestsAntibody": null, "positiveTestsAntibody": null, "negativeTestsAntibody": null, "totalTestsPeopleAntibody": null, "positiveTestsPeopleAntibody": null, "negativeTestsPeopleAntibody": null, "totalTestsPeopleAntigen": null, "positiveTestsPeopleAntigen": null, "totalTestsAntigen": null, "positiveTestsAntigen": null, "fips": "01", "positiveIncrease": 155, "negativeIncrease": 4467, "total": 80449, "totalTestResultsIncrease": 4622, "posNeg": 80449, "deathIncrease": 3, "hospitalizedIncrease": 34, "hash": "dc0970d0108a22efd88710d6654eb67f8b193a5a", "commercialScore": 0, "negativeRegularScore": 0, "negativeScore": 0, "positiveScore": 0, "score": 0, "grade": "", "month_number_label": "2020-04", "date_label": "2020-04-29", "week_number_label": "2020W18", "week_start_label": "2020-04-27"}, {"date": 20200430, "state": "AL", "positive": 7019, "probableCases": null, "negative": 80177, "pending": null, "totalTestResultsSource": "totalTestsPeopleViral", "totalTestResults": 87196, "hospitalizedCurrently": 479, "hospitalizedCumulative": 978, "inIcuCurrently": null, "inIcuCumulative": 335, "onVentilatorCurrently": null, "onVentilatorCumulative": 195, "recovered": null, "dataQualityGrade": "B", "lastUpdateEt": "4/30/2020 00:00", "dateModified": "2020-04-30T00:00:00Z", "checkTimeEt": "04/29 20:00", "death": 269, "hospitalized": 978, "dateChecked": "2020-04-30T00:00:00Z", "totalTestsViral": null, "positiveTestsViral": null, "negativeTestsViral": null, "positiveCasesViral": 7019, "deathConfirmed": null, "deathProbable": null, "totalTestEncountersViral": null, "totalTestsPeopleViral": 87196, "totalTestsAntibody": null, "positiveTestsAntibody": null, "negativeTestsAntibody": null, "totalTestsPeopleAntibody": null, "positiveTestsPeopleAntibody": null, "negativeTestsPeopleAntibody": null, "totalTestsPeopleAntigen": null, "positiveTestsPeopleAntigen": null, "totalTestsAntigen": null, "positiveTestsAntigen": null, "fips": "01", "positiveIncrease": 177, "negativeIncrease": 6570, "total": 87196, "totalTestResultsIncrease": 6747, "posNeg": 87196, "deathIncrease": 24, "hospitalizedIncrease": 33, "hash": "b5e143caf2c12e6c49b9098b37bd511e373af83b", "commercialScore": 0, "negativeRegularScore": 0, "negativeScore": 0, "positiveScore": 0, "score": 0, "grade": "", "month_number_label": "2020-04", "date_label": "2020-04-30", "week_number_label": "2020W18", "week_start_label": "2020-04-27"}, {"date": 20200501, "state": "AL", "positive": 7158, "probableCases": null, "negative": 84775, "pending": null, "totalTestResultsSource": "totalTestsPeopleViral", "totalTestResults": 91933, "hospitalizedCurrently": 495, "hospitalizedCumulative": 1008, "inIcuCurrently": null, "inIcuCumulative": 335, "onVentilatorCurrently": null, "onVentilatorCumulative": 195, "recovered": null, "dataQualityGrade": "B", "lastUpdateEt": "5/1/2020 00:00", "dateModified": "2020-05-01T00:00:00Z", "checkTimeEt": "04/30 20:00", "death": 279, "hospitalized": 1008, "dateChecked": "2020-05-01T00:00:00Z", "totalTestsViral": null, "positiveTestsViral": null, "negativeTestsViral": null, "positiveCasesViral": 7158, "deathConfirmed": null, "deathProbable": null, "totalTestEncountersViral": null, "totalTestsPeopleViral": 91933, "totalTestsAntibody": null, "positiveTestsAntibody": null, "negativeTestsAntibody": null, "totalTestsPeopleAntibody": null, "positiveTestsPeopleAntibody": null, "negativeTestsPeopleAntibody": null, "totalTestsPeopleAntigen": null, "positiveTestsPeopleAntigen": null, "totalTestsAntigen": null, "positiveTestsAntigen": null, "fips": "01", "positiveIncrease": 139, "negativeIncrease": 4598, "total": 91933, "totalTestResultsIncrease": 4737, "posNeg": 91933, "deathIncrease": 10, "hospitalizedIncrease": 30, "hash": "1ffaa9f455f72467bbb2cb035c8083954f31fe0c", "commercialScore": 0, "negativeRegularScore": 0, "negativeScore": 0, "positiveScore": 0, "score": 0, "grade": "", "month_number_label": "2020-05", "date_label": "2020-05-01", "week_number_label": "2020W18", "week_start_label": "2020-04-27"}, {"date": 20200502, "state": "AL", "positive": 7434, "probableCases": null, "negative": 84775, "pending": null, "totalTestResultsSource": "totalTestsPeopleViral", "totalTestResults": 92209, "hospitalizedCurrently": 420, "hospitalizedCumulative": 1023, "inIcuCurrently": null, "inIcuCumulative": 335, "onVentilatorCurrently": null, "onVentilatorCumulative": 195, "recovered": null, "dataQualityGrade": "B", "lastUpdateEt": "5/2/2020 00:00", "dateModified": "2020-05-02T00:00:00Z", "checkTimeEt": "05/01 20:00", "death": 288, "hospitalized": 1023, "dateChecked": "2020-05-02T00:00:00Z", "totalTestsViral": null, "positiveTestsViral": null, "negativeTestsViral": null, "positiveCasesViral": 7434, "deathConfirmed": null, "deathProbable": null, "totalTestEncountersViral": null, "totalTestsPeopleViral": 92209, "totalTestsAntibody": null, "positiveTestsAntibody": null, "negativeTestsAntibody": null, "totalTestsPeopleAntibody": null, "positiveTestsPeopleAntibody": null, "negativeTestsPeopleAntibody": null, "totalTestsPeopleAntigen": null, "positiveTestsPeopleAntigen": null, "totalTestsAntigen": null, "positiveTestsAntigen": null, "fips": "01", "positiveIncrease": 276, "negativeIncrease": 0, "total": 92209, "totalTestResultsIncrease": 276, "posNeg": 92209, "deathIncrease": 9, "hospitalizedIncrease": 15, "hash": "93d6b451c858d606e671792c772ac91a2aa2cdc8", "commercialScore": 0, "negativeRegularScore": 0, "negativeScore": 0, "positiveScore": 0, "score": 0, "grade": "", "month_number_label": "2020-05", "date_label": "2020-05-02", "week_number_label": "2020W18", "week_start_label": "2020-04-27"}, {"date": 20200503, "state": "AL", "positive": 7725, "probableCases": null, "negative": 84775, "pending": null, "totalTestResultsSource": "totalTestsPeopleViral", "totalTestResults": 92500, "hospitalizedCurrently": 427, "hospitalizedCumulative": 1035, "inIcuCurrently": null, "inIcuCumulative": 403, "onVentilatorCurrently": null, "onVentilatorCumulative": 242, "recovered": null, "dataQualityGrade": "B", "lastUpdateEt": "5/3/2020 00:00", "dateModified": "2020-05-03T00:00:00Z", "checkTimeEt": "05/02 20:00", "death": 290, "hospitalized": 1035, "dateChecked": "2020-05-03T00:00:00Z", "totalTestsViral": null, "positiveTestsViral": null, "negativeTestsViral": null, "positiveCasesViral": 7725, "deathConfirmed": 290, "deathProbable": null, "totalTestEncountersViral": null, "totalTestsPeopleViral": 92500, "totalTestsAntibody": null, "positiveTestsAntibody": null, "negativeTestsAntibody": null, "totalTestsPeopleAntibody": null, "positiveTestsPeopleAntibody": null, "negativeTestsPeopleAntibody": null, "totalTestsPeopleAntigen": null, "positiveTestsPeopleAntigen": null, "totalTestsAntigen": null, "positiveTestsAntigen": null, "fips": "01", "positiveIncrease": 291, "negativeIncrease": 0, "total": 92500, "totalTestResultsIncrease": 291, "posNeg": 92500, "deathIncrease": 2, "hospitalizedIncrease": 12, "hash": "67751bd79937cd258c71356bbbfab0d5d9bf7d7a", "commercialScore": 0, "negativeRegularScore": 0, "negativeScore": 0, "positiveScore": 0, "score": 0, "grade": "", "month_number_label": "2020-05", "date_label": "2020-05-03", "week_number_label": "2020W18", "week_start_label": "2020-04-27"}, {"date": 20200504, "state": "AL", "positive": 8025, "probableCases": null, "negative": 95092, "pending": null, "totalTestResultsSource": "totalTestsPeopleViral", "totalTestResults": 103117, "hospitalizedCurrently": 517, "hospitalizedCumulative": 1064, "inIcuCurrently": null, "inIcuCumulative": 411, "onVentilatorCurrently": null, "onVentilatorCumulative": 247, "recovered": null, "dataQualityGrade": "B", "lastUpdateEt": "5/4/2020 00:00", "dateModified": "2020-05-04T00:00:00Z", "checkTimeEt": "05/03 20:00", "death": 296, "hospitalized": 1064, "dateChecked": "2020-05-04T00:00:00Z", "totalTestsViral": null, "positiveTestsViral": null, "negativeTestsViral": null, "positiveCasesViral": 8025, "deathConfirmed": 296, "deathProbable": null, "totalTestEncountersViral": null, "totalTestsPeopleViral": 103117, "totalTestsAntibody": null, "positiveTestsAntibody": null, "negativeTestsAntibody": null, "totalTestsPeopleAntibody": null, "positiveTestsPeopleAntibody": null, "negativeTestsPeopleAntibody": null, "totalTestsPeopleAntigen": null, "positiveTestsPeopleAntigen": null, "totalTestsAntigen": null, "positiveTestsAntigen": null, "fips": "01", "positiveIncrease": 300, "negativeIncrease": 10317, "total": 103117, "totalTestResultsIncrease": 10617, "posNeg": 103117, "deathIncrease": 6, "hospitalizedIncrease": 29, "hash": "682911686967391783e963d4465ef04eb05738bc", "commercialScore": 0, "negativeRegularScore": 0, "negativeScore": 0, "positiveScore": 0, "score": 0, "grade": "", "month_number_label": "2020-05", "date_label": "2020-05-04", "week_number_label": "2020W19", "week_start_label": "2020-05-04"}, {"date": 20200505, "state": "AL", "positive": 8285, "probableCases": null, "negative": 98481, "pending": null, "totalTestResultsSource": "totalTestsPeopleViral", "totalTestResults": 106766, "hospitalizedCurrently": 522, "hospitalizedCumulative": 1107, "inIcuCurrently": null, "inIcuCumulative": 428, "onVentilatorCurrently": null, "onVentilatorCumulative": 255, "recovered": null, "dataQualityGrade": "B", "lastUpdateEt": "5/5/2020 00:00", "dateModified": "2020-05-05T00:00:00Z", "checkTimeEt": "05/04 20:00", "death": 313, "hospitalized": 1107, "dateChecked": "2020-05-05T00:00:00Z", "totalTestsViral": null, "positiveTestsViral": null, "negativeTestsViral": null, "positiveCasesViral": 8285, "deathConfirmed": 313, "deathProbable": null, "totalTestEncountersViral": null, "totalTestsPeopleViral": 106766, "totalTestsAntibody": null, "positiveTestsAntibody": null, "negativeTestsAntibody": null, "totalTestsPeopleAntibody": null, "positiveTestsPeopleAntibody": null, "negativeTestsPeopleAntibody": null, "totalTestsPeopleAntigen": null, "positiveTestsPeopleAntigen": null, "totalTestsAntigen": null, "positiveTestsAntigen": null, "fips": "01", "positiveIncrease": 260, "negativeIncrease": 3389, "total": 106766, "totalTestResultsIncrease": 3649, "posNeg": 106766, "deathIncrease": 17, "hospitalizedIncrease": 43, "hash": "f033439123fa9e60eb0c78f0a7f7b40f121ad8f9", "commercialScore": 0, "negativeRegularScore": 0, "negativeScore": 0, "positiveScore": 0, "score": 0, "grade": "", "month_number_label": "2020-05", "date_label": "2020-05-05", "week_number_label": "2020W19", "week_start_label": "2020-05-04"}, {"date": 20200506, "state": "AL", "positive": 8581, "probableCases": null, "negative": 100935, "pending": null, "totalTestResultsSource": "totalTestsPeopleViral", "totalTestResults": 109516, "hospitalizedCurrently": 485, "hospitalizedCumulative": 1158, "inIcuCurrently": null, "inIcuCumulative": 442, "onVentilatorCurrently": null, "onVentilatorCumulative": 264, "recovered": null, "dataQualityGrade": "B", "lastUpdateEt": "5/6/2020 00:00", "dateModified": "2020-05-06T00:00:00Z", "checkTimeEt": "05/05 20:00", "death": 340, "hospitalized": 1158, "dateChecked": "2020-05-06T00:00:00Z", "totalTestsViral": null, "positiveTestsViral": null, "negativeTestsViral": null, "positiveCasesViral": 8581, "deathConfirmed": 340, "deathProbable": null, "totalTestEncountersViral": null, "totalTestsPeopleViral": 109516, "totalTestsAntibody": null, "positiveTestsAntibody": null, "negativeTestsAntibody": null, "totalTestsPeopleAntibody": null, "positiveTestsPeopleAntibody": null, "negativeTestsPeopleAntibody": null, "totalTestsPeopleAntigen": null, "positiveTestsPeopleAntigen": null, "totalTestsAntigen": null, "positiveTestsAntigen": null, "fips": "01", "positiveIncrease": 296, "negativeIncrease": 2454, "total": 109516, "totalTestResultsIncrease": 2750, "posNeg": 109516, "deathIncrease": 27, "hospitalizedIncrease": 51, "hash": "ca168284560cc2739b5b9c8b7701075b7b59a9f6", "commercialScore": 0, "negativeRegularScore": 0, "negativeScore": 0, "positiveScore": 0, "score": 0, "grade": "", "month_number_label": "2020-05", "date_label": "2020-05-06", "week_number_label": "2020W19", "week_start_label": "2020-05-04"}, {"date": 20200507, "state": "AL", "positive": 8898, "probableCases": null, "negative": 106275, "pending": null, "totalTestResultsSource": "totalTestsPeopleViral", "totalTestResults": 115173, "hospitalizedCurrently": 502, "hospitalizedCumulative": 1178, "inIcuCurrently": null, "inIcuCumulative": 448, "onVentilatorCurrently": null, "onVentilatorCumulative": 266, "recovered": null, "dataQualityGrade": "B", "lastUpdateEt": "5/7/2020 00:00", "dateModified": "2020-05-07T00:00:00Z", "checkTimeEt": "05/06 20:00", "death": 349, "hospitalized": 1178, "dateChecked": "2020-05-07T00:00:00Z", "totalTestsViral": null, "positiveTestsViral": null, "negativeTestsViral": null, "positiveCasesViral": 8898, "deathConfirmed": 349, "deathProbable": null, "totalTestEncountersViral": null, "totalTestsPeopleViral": 115173, "totalTestsAntibody": null, "positiveTestsAntibody": null, "negativeTestsAntibody": null, "totalTestsPeopleAntibody": null, "positiveTestsPeopleAntibody": null, "negativeTestsPeopleAntibody": null, "totalTestsPeopleAntigen": null, "positiveTestsPeopleAntigen": null, "totalTestsAntigen": null, "positiveTestsAntigen": null, "fips": "01", "positiveIncrease": 317, "negativeIncrease": 5340, "total": 115173, "totalTestResultsIncrease": 5657, "posNeg": 115173, "deathIncrease": 9, "hospitalizedIncrease": 20, "hash": "e8353a336fb6f01df6e4b6d023baa2fa8b7331a9", "commercialScore": 0, "negativeRegularScore": 0, "negativeScore": 0, "positiveScore": 0, "score": 0, "grade": "", "month_number_label": "2020-05", "date_label": "2020-05-07", "week_number_label": "2020W19", "week_start_label": "2020-05-04"}, {"date": 20200508, "state": "AL", "positive": 9221, "probableCases": null, "negative": 110893, "pending": null, "totalTestResultsSource": "totalTestsPeopleViral", "totalTestResults": 120114, "hospitalizedCurrently": 481, "hospitalizedCumulative": 1207, "inIcuCurrently": null, "inIcuCumulative": 454, "onVentilatorCurrently": null, "onVentilatorCumulative": 266, "recovered": null, "dataQualityGrade": "B", "lastUpdateEt": "5/8/2020 00:00", "dateModified": "2020-05-08T00:00:00Z", "checkTimeEt": "05/07 20:00", "death": 375, "hospitalized": 1207, "dateChecked": "2020-05-08T00:00:00Z", "totalTestsViral": null, "positiveTestsViral": null, "negativeTestsViral": null, "positiveCasesViral": 9221, "deathConfirmed": 375, "deathProbable": null, "totalTestEncountersViral": null, "totalTestsPeopleViral": 120114, "totalTestsAntibody": null, "positiveTestsAntibody": null, "negativeTestsAntibody": null, "totalTestsPeopleAntibody": null, "positiveTestsPeopleAntibody": null, "negativeTestsPeopleAntibody": null, "totalTestsPeopleAntigen": null, "positiveTestsPeopleAntigen": null, "totalTestsAntigen": null, "positiveTestsAntigen": null, "fips": "01", "positiveIncrease": 323, "negativeIncrease": 4618, "total": 120114, "totalTestResultsIncrease": 4941, "posNeg": 120114, "deathIncrease": 26, "hospitalizedInc