[{"date": 20200306, "state": "AK", "positive": null, "probableCases": null, "negative": 8, "pending": 1, "totalTestResultsSource": "totalTestsViral", "totalTestResults": 8, "hospitalizedCurrently": null, "hospitalizedCumulative": null, "inIcuCurrently": null, "inIcuCumulative": null, "onVentilatorCurrently": null, "onVentilatorCumulative": null, "recovered": null, "dataQualityGrade": null, "lastUpdateEt": null, "dateModified": null, "checkTimeEt": null, "death": 0, "hospitalized": null, "dateChecked": null, "totalTestsViral": 8, "positiveTestsViral": null, "negativeTestsViral": null, "positiveCasesViral": null, "deathConfirmed": null, "deathProbable": null, "totalTestEncountersViral": null, "totalTestsPeopleViral": null, "totalTestsAntibody": null, "positiveTestsAntibody": null, "negativeTestsAntibody": null, "totalTestsPeopleAntibody": null, "positiveTestsPeopleAntibody": null, "negativeTestsPeopleAntibody": null, "totalTestsPeopleAntigen": null, "positiveTestsPeopleAntigen": null, "totalTestsAntigen": null, "positiveTestsAntigen": null, "fips": "02", "positiveIncrease": 0, "negativeIncrease": 0, "total": 9, "totalTestResultsIncrease": 0, "posNeg": 8, "deathIncrease": 0, "hospitalizedIncrease": 0, "hash": "1cccb785fe70d960475d4b202a3d0fc678c81e41", "commercialScore": 0, "negativeRegularScore": 0, "negativeScore": 0, "positiveScore": 0, "score": 0, "grade": "", "month_number_label": "2020-03", "date_label": "2020-03-06", "week_number_label": "2020W10", "week_start_label": "2020-03-02"}, {"date": 20200307, "state": "AK", "positive": null, "probableCases": null, "negative": 12, "pending": 2, "totalTestResultsSource": "totalTestsViral", "totalTestResults": 12, "hospitalizedCurrently": null, "hospitalizedCumulative": null, "inIcuCurrently": null, "inIcuCumulative": null, "onVentilatorCurrently": null, "onVentilatorCumulative": null, "recovered": null, "dataQualityGrade": null, "lastUpdateEt": null, "dateModified": null, "checkTimeEt": null, "death": 0, "hospitalized": null, "dateChecked": null, "totalTestsViral": 12, "positiveTestsViral": null, "negativeTestsViral": null, "positiveCasesViral": null, "deathConfirmed": null, "deathProbable": null, "totalTestEncountersViral": null, "totalTestsPeopleViral": null, "totalTestsAntibody": null, "positiveTestsAntibody": null, "negativeTestsAntibody": null, "totalTestsPeopleAntibody": null, "positiveTestsPeopleAntibody": null, "negativeTestsPeopleAntibody": null, "totalTestsPeopleAntigen": null, "positiveTestsPeopleAntigen": null, "totalTestsAntigen": null, "positiveTestsAntigen": null, "fips": "02", "positiveIncrease": 0, "negativeIncrease": 4, "total": 14, "totalTestResultsIncrease": 4, "posNeg": 12, "deathIncrease": 0, "hospitalizedIncrease": 0, "hash": "a2776acac3d2b1dea060a3c20f4b508d5c00fd3d", "commercialScore": 0, "negativeRegularScore": 0, "negativeScore": 0, "positiveScore": 0, "score": 0, "grade": "", "month_number_label": "2020-03", "date_label": "2020-03-07", "week_number_label": "2020W10", "week_start_label": "2020-03-02"}, {"date": 20200308, "state": "AK", "positive": null, "probableCases": null, "negative": 14, "pending": 6, "totalTestResultsSource": "totalTestsViral", "totalTestResults": 14, "hospitalizedCurrently": null, "hospitalizedCumulative": null, "inIcuCurrently": null, "inIcuCumulative": null, "onVentilatorCurrently": null, "onVentilatorCumulative": null, "recovered": null, "dataQualityGrade": null, "lastUpdateEt": null, "dateModified": null, "checkTimeEt": null, "death": 0, "hospitalized": null, "dateChecked": null, "totalTestsViral": 14, "positiveTestsViral": null, "negativeTestsViral": null, "positiveCasesViral": null, "deathConfirmed": null, "deathProbable": null, "totalTestEncountersViral": null, "totalTestsPeopleViral": null, "totalTestsAntibody": null, "positiveTestsAntibody": null, "negativeTestsAntibody": null, "totalTestsPeopleAntibody": null, "positiveTestsPeopleAntibody": null, "negativeTestsPeopleAntibody": null, "totalTestsPeopleAntigen": null, "positiveTestsPeopleAntigen": null, "totalTestsAntigen": null, "positiveTestsAntigen": null, "fips": "02", "positiveIncrease": 0, "negativeIncrease": 2, "total": 20, "totalTestResultsIncrease": 2, "posNeg": 14, "deathIncrease": 0, "hospitalizedIncrease": 0, "hash": "ec0512b5cc8703196f5901589feb0640e43a851a", "commercialScore": 0, "negativeRegularScore": 0, "negativeScore": 0, "positiveScore": 0, "score": 0, "grade": "", "month_number_label": "2020-03", "date_label": "2020-03-08", "week_number_label": "2020W10", "week_start_label": "2020-03-02"}, {"date": 20200309, "state": "AK", "positive": null, "probableCases": null, "negative": 23, "pending": 9, "totalTestResultsSource": "totalTestsViral", "totalTestResults": 23, "hospitalizedCurrently": null, "hospitalizedCumulative": 1, "inIcuCurrently": null, "inIcuCumulative": null, "onVentilatorCurrently": null, "onVentilatorCumulative": null, "recovered": null, "dataQualityGrade": null, "lastUpdateEt": null, "dateModified": null, "checkTimeEt": null, "death": 0, "hospitalized": 1, "dateChecked": null, "totalTestsViral": 23, "positiveTestsViral": null, "negativeTestsViral": null, "positiveCasesViral": null, "deathConfirmed": null, "deathProbable": null, "totalTestEncountersViral": null, "totalTestsPeopleViral": null, "totalTestsAntibody": null, "positiveTestsAntibody": null, "negativeTestsAntibody": null, "totalTestsPeopleAntibody": null, "positiveTestsPeopleAntibody": null, "negativeTestsPeopleAntibody": null, "totalTestsPeopleAntigen": null, "positiveTestsPeopleAntigen": null, "totalTestsAntigen": null, "positiveTestsAntigen": null, "fips": "02", "positiveIncrease": 0, "negativeIncrease": 9, "total": 32, "totalTestResultsIncrease": 9, "posNeg": 23, "deathIncrease": 0, "hospitalizedIncrease": 1, "hash": "d079fbd221af733f452c4c09a96059c1b7403d68", "commercialScore": 0, "negativeRegularScore": 0, "negativeScore": 0, "positiveScore": 0, "score": 0, "grade": "", "month_number_label": "2020-03", "date_label": "2020-03-09", "week_number_label": "2020W11", "week_start_label": "2020-03-09"}, {"date": 20200310, "state": "AK", "positive": null, "probableCases": null, "negative": 23, "pending": 9, "totalTestResultsSource": "totalTestsViral", "totalTestResults": 23, "hospitalizedCurrently": null, "hospitalizedCumulative": 1, "inIcuCurrently": null, "inIcuCumulative": null, "onVentilatorCurrently": null, "onVentilatorCumulative": null, "recovered": null, "dataQualityGrade": null, "lastUpdateEt": null, "dateModified": null, "checkTimeEt": null, "death": 0, "hospitalized": 1, "dateChecked": null, "totalTestsViral": 23, "positiveTestsViral": null, "negativeTestsViral": null, "positiveCasesViral": null, "deathConfirmed": null, "deathProbable": null, "totalTestEncountersViral": null, "totalTestsPeopleViral": null, "totalTestsAntibody": null, "positiveTestsAntibody": null, "negativeTestsAntibody": null, "totalTestsPeopleAntibody": null, "positiveTestsPeopleAntibody": null, "negativeTestsPeopleAntibody": null, "totalTestsPeopleAntigen": null, "positiveTestsPeopleAntigen": null, "totalTestsAntigen": null, "positiveTestsAntigen": null, "fips": "02", "positiveIncrease": 0, "negativeIncrease": 0, "total": 32, "totalTestResultsIncrease": 0, "posNeg": 23, "deathIncrease": 0, "hospitalizedIncrease": 0, "hash": "3dc91f117f02b4ceb2740f1b7a0f50fe7f7a67e7", "commercialScore": 0, "negativeRegularScore": 0, "negativeScore": 0, "positiveScore": 0, "score": 0, "grade": "", "month_number_label": "2020-03", "date_label": "2020-03-10", "week_number_label": "2020W11", "week_start_label": "2020-03-09"}, {"date": 20200311, "state": "AK", "positive": null, "probableCases": null, "negative": 46, "pending": 14, "totalTestResultsSource": "totalTestsViral", "totalTestResults": 46, "hospitalizedCurrently": null, "hospitalizedCumulative": 1, "inIcuCurrently": null, "inIcuCumulative": null, "onVentilatorCurrently": null, "onVentilatorCumulative": null, "recovered": null, "dataQualityGrade": null, "lastUpdateEt": null, "dateModified": null, "checkTimeEt": null, "death": 0, "hospitalized": 1, "dateChecked": null, "totalTestsViral": 46, "positiveTestsViral": null, "negativeTestsViral": null, "positiveCasesViral": null, "deathConfirmed": null, "deathProbable": null, "totalTestEncountersViral": null, "totalTestsPeopleViral": null, "totalTestsAntibody": null, "positiveTestsAntibody": null, "negativeTestsAntibody": null, "totalTestsPeopleAntibody": null, "positiveTestsPeopleAntibody": null, "negativeTestsPeopleAntibody": null, "totalTestsPeopleAntigen": null, "positiveTestsPeopleAntigen": null, "totalTestsAntigen": null, "positiveTestsAntigen": null, "fips": "02", "positiveIncrease": 0, "negativeIncrease": 23, "total": 60, "totalTestResultsIncrease": 23, "posNeg": 46, "deathIncrease": 0, "hospitalizedIncrease": 0, "hash": "9acac4437795556e9b76010ca865b1772203acd3", "commercialScore": 0, "negativeRegularScore": 0, "negativeScore": 0, "positiveScore": 0, "score": 0, "grade": "", "month_number_label": "2020-03", "date_label": "2020-03-11", "week_number_label": "2020W11", "week_start_label": "2020-03-09"}, {"date": 20200312, "state": "AK", "positive": null, "probableCases": null, "negative": 46, "pending": 14, "totalTestResultsSource": "totalTestsViral", "totalTestResults": 46, "hospitalizedCurrently": null, "hospitalizedCumulative": 1, "inIcuCurrently": null, "inIcuCumulative": null, "onVentilatorCurrently": null, "onVentilatorCumulative": null, "recovered": null, "dataQualityGrade": null, "lastUpdateEt": "3/11/2020 16:30", "dateModified": "2020-03-11T16:30:00Z", "checkTimeEt": "03/11 12:30", "death": 0, "hospitalized": 1, "dateChecked": "2020-03-11T16:30:00Z", "totalTestsViral": 46, "positiveTestsViral": null, "negativeTestsViral": null, "positiveCasesViral": null, "deathConfirmed": null, "deathProbable": null, "totalTestEncountersViral": null, "totalTestsPeopleViral": null, "totalTestsAntibody": null, "positiveTestsAntibody": null, "negativeTestsAntibody": null, "totalTestsPeopleAntibody": null, "positiveTestsPeopleAntibody": null, "negativeTestsPeopleAntibody": null, "totalTestsPeopleAntigen": null, "positiveTestsPeopleAntigen": null, "totalTestsAntigen": null, "positiveTestsAntigen": null, "fips": "02", "positiveIncrease": 0, "negativeIncrease": 0, "total": 60, "totalTestResultsIncrease": 0, "posNeg": 46, "deathIncrease": 0, "hospitalizedIncrease": 0, "hash": "dd095b2ece2ff9a3e2bef7e2f576c8ad65504f00", "commercialScore": 0, "negativeRegularScore": 0, "negativeScore": 0, "positiveScore": 0, "score": 0, "grade": "", "month_number_label": "2020-03", "date_label": "2020-03-12", "week_number_label": "2020W11", "week_start_label": "2020-03-09"}, {"date": 20200313, "state": "AK", "positive": null, "probableCases": null, "negative": 60, "pending": null, "totalTestResultsSource": "totalTestsViral", "totalTestResults": 60, "hospitalizedCurrently": null, "hospitalizedCumulative": 1, "inIcuCurrently": null, "inIcuCumulative": null, "onVentilatorCurrently": null, "onVentilatorCumulative": null, "recovered": null, "dataQualityGrade": null, "lastUpdateEt": "3/13/2020 00:00", "dateModified": "2020-03-13T00:00:00Z", "checkTimeEt": "03/12 20:00", "death": 0, "hospitalized": 1, "dateChecked": "2020-03-13T00:00:00Z", "totalTestsViral": 60, "positiveTestsViral": null, "negativeTestsViral": null, "positiveCasesViral": null, "deathConfirmed": null, "deathProbable": null, "totalTestEncountersViral": null, "totalTestsPeopleViral": null, "totalTestsAntibody": null, "positiveTestsAntibody": null, "negativeTestsAntibody": null, "totalTestsPeopleAntibody": null, "positiveTestsPeopleAntibody": null, "negativeTestsPeopleAntibody": null, "totalTestsPeopleAntigen": null, "positiveTestsPeopleAntigen": null, "totalTestsAntigen": null, "positiveTestsAntigen": null, "fips": "02", "positiveIncrease": 0, "negativeIncrease": 14, "total": 60, "totalTestResultsIncrease": 14, "posNeg": 60, "deathIncrease": 0, "hospitalizedIncrease": 0, "hash": "b761a4d6c846c55221ee41189f5197528e1afe7e", "commercialScore": 0, "negativeRegularScore": 0, "negativeScore": 0, "positiveScore": 0, "score": 0, "grade": "", "month_number_label": "2020-03", "date_label": "2020-03-13", "week_number_label": "2020W11", "week_start_label": "2020-03-09"}, {"date": 20200314, "state": "AK", "positive": null, "probableCases": null, "negative": 144, "pending": null, "totalTestResultsSource": "totalTestsViral", "totalTestResults": 144, "hospitalizedCurrently": null, "hospitalizedCumulative": 1, "inIcuCurrently": null, "inIcuCumulative": null, "onVentilatorCurrently": null, "onVentilatorCumulative": null, "recovered": null, "dataQualityGrade": null, "lastUpdateEt": "3/13/2020 16:30", "dateModified": "2020-03-13T16:30:00Z", "checkTimeEt": "03/13 12:30", "death": 0, "hospitalized": 1, "dateChecked": "2020-03-13T16:30:00Z", "totalTestsViral": 144, "positiveTestsViral": null, "negativeTestsViral": null, "positiveCasesViral": null, "deathConfirmed": null, "deathProbable": null, "totalTestEncountersViral": null, "totalTestsPeopleViral": null, "totalTestsAntibody": null, "positiveTestsAntibody": null, "negativeTestsAntibody": null, "totalTestsPeopleAntibody": null, "positiveTestsPeopleAntibody": null, "negativeTestsPeopleAntibody": null, "totalTestsPeopleAntigen": null, "positiveTestsPeopleAntigen": null, "totalTestsAntigen": null, "positiveTestsAntigen": null, "fips": "02", "positiveIncrease": 0, "negativeIncrease": 84, "total": 144, "totalTestResultsIncrease": 84, "posNeg": 144, "deathIncrease": 0, "hospitalizedIncrease": 0, "hash": "aedc7c343d2a378cb2fe8465a130a418be175fd9", "commercialScore": 0, "negativeRegularScore": 0, "negativeScore": 0, "positiveScore": 0, "score": 0, "grade": "", "month_number_label": "2020-03", "date_label": "2020-03-14", "week_number_label": "2020W11", "week_start_label": "2020-03-09"}, {"date": 20200315, "state": "AK", "positive": null, "probableCases": null, "negative": 144, "pending": null, "totalTestResultsSource": "totalTestsViral", "totalTestResults": 144, "hospitalizedCurrently": null, "hospitalizedCumulative": 1, "inIcuCurrently": null, "inIcuCumulative": null, "onVentilatorCurrently": null, "onVentilatorCumulative": null, "recovered": null, "dataQualityGrade": null, "lastUpdateEt": "3/13/2020 16:30", "dateModified": "2020-03-13T16:30:00Z", "checkTimeEt": "03/13 12:30", "death": 0, "hospitalized": 1, "dateChecked": "2020-03-13T16:30:00Z", "totalTestsViral": 144, "positiveTestsViral": null, "negativeTestsViral": null, "positiveCasesViral": null, "deathConfirmed": null, "deathProbable": null, "totalTestEncountersViral": null, "totalTestsPeopleViral": null, "totalTestsAntibody": null, "positiveTestsAntibody": null, "negativeTestsAntibody": null, "totalTestsPeopleAntibody": null, "positiveTestsPeopleAntibody": null, "negativeTestsPeopleAntibody": null, "totalTestsPeopleAntigen": null, "positiveTestsPeopleAntigen": null, "totalTestsAntigen": null, "positiveTestsAntigen": null, "fips": "02", "positiveIncrease": 0, "negativeIncrease": 0, "total": 144, "totalTestResultsIncrease": 0, "posNeg": 144, "deathIncrease": 0, "hospitalizedIncrease": 0, "hash": "3e9c2cd755361d6c5bc0e80e6e23b341461bd10f", "commercialScore": 0, "negativeRegularScore": 0, "negativeScore": 0, "positiveScore": 0, "score": 0, "grade": "", "month_number_label": "2020-03", "date_label": "2020-03-15", "week_number_label": "2020W11", "week_start_label": "2020-03-09"}, {"date": 20200316, "state": "AK", "positive": null, "probableCases": null, "negative": 144, "pending": null, "totalTestResultsSource": "totalTestsViral", "totalTestResults": 144, "hospitalizedCurrently": null, "hospitalizedCumulative": 1, "inIcuCurrently": null, "inIcuCumulative": null, "onVentilatorCurrently": null, "onVentilatorCumulative": null, "recovered": null, "dataQualityGrade": null, "lastUpdateEt": "3/16/2020 15:06", "dateModified": "2020-03-16T15:06:00Z", "checkTimeEt": "03/16 11:06", "death": 0, "hospitalized": 1, "dateChecked": "2020-03-16T15:06:00Z", "totalTestsViral": 144, "positiveTestsViral": null, "negativeTestsViral": null, "positiveCasesViral": null, "deathConfirmed": null, "deathProbable": null, "totalTestEncountersViral": null, "totalTestsPeopleViral": null, "totalTestsAntibody": null, "positiveTestsAntibody": null, "negativeTestsAntibody": null, "totalTestsPeopleAntibody": null, "positiveTestsPeopleAntibody": null, "negativeTestsPeopleAntibody": null, "totalTestsPeopleAntigen": null, "positiveTestsPeopleAntigen": null, "totalTestsAntigen": null, "positiveTestsAntigen": null, "fips": "02", "positiveIncrease": 0, "negativeIncrease": 0, "total": 144, "totalTestResultsIncrease": 0, "posNeg": 144, "deathIncrease": 0, "hospitalizedIncrease": 0, "hash": "30d7633fa9e0f653ae254621850ad7b46822a4fd", "commercialScore": 0, "negativeRegularScore": 0, "negativeScore": 0, "positiveScore": 0, "score": 0, "grade": "", "month_number_label": "2020-03", "date_label": "2020-03-16", "week_number_label": "2020W12", "week_start_label": "2020-03-16"}, {"date": 20200317, "state": "AK", "positive": 3, "probableCases": null, "negative": 334, "pending": null, "totalTestResultsSource": "totalTestsViral", "totalTestResults": 337, "hospitalizedCurrently": null, "hospitalizedCumulative": 1, "inIcuCurrently": null, "inIcuCumulative": null, "onVentilatorCurrently": null, "onVentilatorCumulative": null, "recovered": null, "dataQualityGrade": null, "lastUpdateEt": "3/17/2020 00:01", "dateModified": "2020-03-17T00:01:00Z", "checkTimeEt": "03/16 20:01", "death": 0, "hospitalized": 1, "dateChecked": "2020-03-17T00:01:00Z", "totalTestsViral": 337, "positiveTestsViral": null, "negativeTestsViral": null, "positiveCasesViral": null, "deathConfirmed": null, "deathProbable": null, "totalTestEncountersViral": null, "totalTestsPeopleViral": null, "totalTestsAntibody": null, "positiveTestsAntibody": null, "negativeTestsAntibody": null, "totalTestsPeopleAntibody": null, "positiveTestsPeopleAntibody": null, "negativeTestsPeopleAntibody": null, "totalTestsPeopleAntigen": null, "positiveTestsPeopleAntigen": null, "totalTestsAntigen": null, "positiveTestsAntigen": null, "fips": "02", "positiveIncrease": 3, "negativeIncrease": 190, "total": 337, "totalTestResultsIncrease": 193, "posNeg": 337, "deathIncrease": 0, "hospitalizedIncrease": 0, "hash": "98e9ee2d33ffd4d20d81ea4addd24cf2ccb44f2f", "commercialScore": 0, "negativeRegularScore": 0, "negativeScore": 0, "positiveScore": 0, "score": 0, "grade": "", "month_number_label": "2020-03", "date_label": "2020-03-17", "week_number_label": "2020W12", "week_start_label": "2020-03-16"}, {"date": 20200318, "state": "AK", "positive": 8, "probableCases": null, "negative": 404, "pending": null, "totalTestResultsSource": "totalTestsViral", "totalTestResults": 412, "hospitalizedCurrently": null, "hospitalizedCumulative": 1, "inIcuCurrently": null, "inIcuCumulative": null, "onVentilatorCurrently": null, "onVentilatorCumulative": null, "recovered": null, "dataQualityGrade": null, "lastUpdateEt": "3/17/2020 23:00", "dateModified": "2020-03-17T23:00:00Z", "checkTimeEt": "03/17 19:00", "death": 0, "hospitalized": 1, "dateChecked": "2020-03-17T23:00:00Z", "totalTestsViral": 412, "positiveTestsViral": null, "negativeTestsViral": null, "positiveCasesViral": null, "deathConfirmed": null, "deathProbable": null, "totalTestEncountersViral": null, "totalTestsPeopleViral": null, "totalTestsAntibody": null, "positiveTestsAntibody": null, "negativeTestsAntibody": null, "totalTestsPeopleAntibody": null, "positiveTestsPeopleAntibody": null, "negativeTestsPeopleAntibody": null, "totalTestsPeopleAntigen": null, "positiveTestsPeopleAntigen": null, "totalTestsAntigen": null, "positiveTestsAntigen": null, "fips": "02", "positiveIncrease": 5, "negativeIncrease": 70, "total": 412, "totalTestResultsIncrease": 75, "posNeg": 412, "deathIncrease": 0, "hospitalizedIncrease": 0, "hash": "b116e68d3d82c2ecae3654b73f4eb70641c0d82d", "commercialScore": 0, "negativeRegularScore": 0, "negativeScore": 0, "positiveScore": 0, "score": 0, "grade": "", "month_number_label": "2020-03", "date_label": "2020-03-18", "week_number_label": "2020W12", "week_start_label": "2020-03-16"}, {"date": 20200319, "state": "AK", "positive": 11, "probableCases": null, "negative": 427, "pending": null, "totalTestResultsSource": "totalTestsViral", "totalTestResults": 438, "hospitalizedCurrently": null, "hospitalizedCumulative": 1, "inIcuCurrently": null, "inIcuCumulative": null, "onVentilatorCurrently": null, "onVentilatorCumulative": null, "recovered": null, "dataQualityGrade": null, "lastUpdateEt": "3/18/2020 16:30", "dateModified": "2020-03-18T16:30:00Z", "checkTimeEt": "03/18 12:30", "death": 0, "hospitalized": 1, "dateChecked": "2020-03-18T16:30:00Z", "totalTestsViral": 438, "positiveTestsViral": null, "negativeTestsViral": null, "positiveCasesViral": null, "deathConfirmed": null, "deathProbable": null, "totalTestEncountersViral": null, "totalTestsPeopleViral": null, "totalTestsAntibody": null, "positiveTestsAntibody": null, "negativeTestsAntibody": null, "totalTestsPeopleAntibody": null, "positiveTestsPeopleAntibody": null, "negativeTestsPeopleAntibody": null, "totalTestsPeopleAntigen": null, "positiveTestsPeopleAntigen": null, "totalTestsAntigen": null, "positiveTestsAntigen": null, "fips": "02", "positiveIncrease": 3, "negativeIncrease": 23, "total": 438, "totalTestResultsIncrease": 26, "posNeg": 438, "deathIncrease": 0, "hospitalizedIncrease": 0, "hash": "9689f598567e3ead2a95fddc709e30e63ef45251", "commercialScore": 0, "negativeRegularScore": 0, "negativeScore": 0, "positiveScore": 0, "score": 0, "grade": "", "month_number_label": "2020-03", "date_label": "2020-03-19", "week_number_label": "2020W12", "week_start_label": "2020-03-16"}, {"date": 20200320, "state": "AK", "positive": 14, "probableCases": null, "negative": 684, "pending": null, "totalTestResultsSource": "totalTestsViral", "totalTestResults": 698, "hospitalizedCurrently": null, "hospitalizedCumulative": 1, "inIcuCurrently": null, "inIcuCumulative": null, "onVentilatorCurrently": null, "onVentilatorCumulative": null, "recovered": null, "dataQualityGrade": null, "lastUpdateEt": "3/20/2020 16:30", "dateModified": "2020-03-20T16:30:00Z", "checkTimeEt": "03/20 12:30", "death": 0, "hospitalized": 1, "dateChecked": "2020-03-20T16:30:00Z", "totalTestsViral": 698, "positiveTestsViral": null, "negativeTestsViral": null, "positiveCasesViral": null, "deathConfirmed": null, "deathProbable": null, "totalTestEncountersViral": null, "totalTestsPeopleViral": null, "totalTestsAntibody": null, "positiveTestsAntibody": null, "negativeTestsAntibody": null, "totalTestsPeopleAntibody": null, "positiveTestsPeopleAntibody": null, "negativeTestsPeopleAntibody": null, "totalTestsPeopleAntigen": null, "positiveTestsPeopleAntigen": null, "totalTestsAntigen": null, "positiveTestsAntigen": null, "fips": "02", "positiveIncrease": 3, "negativeIncrease": 257, "total": 698, "totalTestResultsIncrease": 260, "posNeg": 698, "deathIncrease": 0, "hospitalizedIncrease": 0, "hash": "9699c22b94bff2426d0408380c0761314789d4fe", "commercialScore": 0, "negativeRegularScore": 0, "negativeScore": 0, "positiveScore": 0, "score": 0, "grade": "", "month_number_label": "2020-03", "date_label": "2020-03-20", "week_number_label": "2020W12", "week_start_label": "2020-03-16"}, {"date": 20200321, "state": "AK", "positive": 15, "probableCases": null, "negative": 757, "pending": null, "totalTestResultsSource": "totalTestsViral", "totalTestResults": 772, "hospitalizedCurrently": null, "hospitalizedCumulative": 1, "inIcuCurrently": null, "inIcuCumulative": null, "onVentilatorCurrently": null, "onVentilatorCumulative": null, "recovered": null, "dataQualityGrade": null, "lastUpdateEt": "3/21/2020 16:30", "dateModified": "2020-03-21T16:30:00Z", "checkTimeEt": "03/21 12:30", "death": 0, "hospitalized": 1, "dateChecked": "2020-03-21T16:30:00Z", "totalTestsViral": 772, "positiveTestsViral": null, "negativeTestsViral": null, "positiveCasesViral": null, "deathConfirmed": null, "deathProbable": null, "totalTestEncountersViral": null, "totalTestsPeopleViral": null, "totalTestsAntibody": null, "positiveTestsAntibody": null, "negativeTestsAntibody": null, "totalTestsPeopleAntibody": null, "positiveTestsPeopleAntibody": null, "negativeTestsPeopleAntibody": null, "totalTestsPeopleAntigen": null, "positiveTestsPeopleAntigen": null, "totalTestsAntigen": null, "positiveTestsAntigen": null, "fips": "02", "positiveIncrease": 1, "negativeIncrease": 73, "total": 772, "totalTestResultsIncrease": 74, "posNeg": 772, "deathIncrease": 0, "hospitalizedIncrease": 0, "hash": "071bb7419b3c5c4bab097892c199aad0c6256652", "commercialScore": 0, "negativeRegularScore": 0, "negativeScore": 0, "positiveScore": 0, "score": 0, "grade": "", "month_number_label": "2020-03", "date_label": "2020-03-21", "week_number_label": "2020W12", "week_start_label": "2020-03-16"}, {"date": 20200322, "state": "AK", "positive": 25, "probableCases": null, "negative": 943, "pending": null, "totalTestResultsSource": "totalTestsViral", "totalTestResults": 968, "hospitalizedCurrently": null, "hospitalizedCumulative": 1, "inIcuCurrently": null, "inIcuCumulative": null, "onVentilatorCurrently": null, "onVentilatorCumulative": null, "recovered": null, "dataQualityGrade": null, "lastUpdateEt": "3/21/2020 16:30", "dateModified": "2020-03-21T16:30:00Z", "checkTimeEt": "03/21 12:30", "death": 0, "hospitalized": 1, "dateChecked": "2020-03-21T16:30:00Z", "totalTestsViral": 968, "positiveTestsViral": null, "negativeTestsViral": null, "positiveCasesViral": null, "deathConfirmed": null, "deathProbable": null, "totalTestEncountersViral": null, "totalTestsPeopleViral": null, "totalTestsAntibody": null, "positiveTestsAntibody": null, "negativeTestsAntibody": null, "totalTestsPeopleAntibody": null, "positiveTestsPeopleAntibody": null, "negativeTestsPeopleAntibody": null, "totalTestsPeopleAntigen": null, "positiveTestsPeopleAntigen": null, "totalTestsAntigen": null, "positiveTestsAntigen": null, "fips": "02", "positiveIncrease": 10, "negativeIncrease": 186, "total": 968, "totalTestResultsIncrease": 196, "posNeg": 968, "deathIncrease": 0, "hospitalizedIncrease": 0, "hash": "82b1004aad71c2ea80f045d4aae09159605267be", "commercialScore": 0, "negativeRegularScore": 0, "negativeScore": 0, "positiveScore": 0, "score": 0, "grade": "", "month_number_label": "2020-03", "date_label": "2020-03-22", "week_number_label": "2020W12", "week_start_label": "2020-03-16"}, {"date": 20200323, "state": "AK", "positive": 38, "probableCases": null, "negative": 930, "pending": null, "totalTestResultsSource": "totalTestsViral", "totalTestResults": 968, "hospitalizedCurrently": null, "hospitalizedCumulative": 1, "inIcuCurrently": null, "inIcuCumulative": null, "onVentilatorCurrently": null, "onVentilatorCumulative": null, "recovered": null, "dataQualityGrade": "A", "lastUpdateEt": "3/21/2020 16:30", "dateModified": "2020-03-21T16:30:00Z", "checkTimeEt": "03/21 12:30", "death": 0, "hospitalized": 1, "dateChecked": "2020-03-21T16:30:00Z", "totalTestsViral": 968, "positiveTestsViral": null, "negativeTestsViral": null, "positiveCasesViral": null, "deathConfirmed": null, "deathProbable": null, "totalTestEncountersViral": null, "totalTestsPeopleViral": null, "totalTestsAntibody": null, "positiveTestsAntibody": null, "negativeTestsAntibody": null, "totalTestsPeopleAntibody": null, "positiveTestsPeopleAntibody": null, "negativeTestsPeopleAntibody": null, "totalTestsPeopleAntigen": null, "positiveTestsPeopleAntigen": null, "totalTestsAntigen": null, "positiveTestsAntigen": null, "fips": "02", "positiveIncrease": 13, "negativeIncrease": -13, "total": 968, "totalTestResultsIncrease": 0, "posNeg": 968, "deathIncrease": 0, "hospitalizedIncrease": 0, "hash": "403485d9f021d835ffbe6895e77b8bc474745bbb", "commercialScore": 0, "negativeRegularScore": 0, "negativeScore": 0, "positiveScore": 0, "score": 0, "grade": "", "month_number_label": "2020-03", "date_label": "2020-03-23", "week_number_label": "2020W13", "week_start_label": "2020-03-23"}, {"date": 20200324, "state": "AK", "positive": 42, "probableCases": null, "negative": 980, "pending": null, "totalTestResultsSource": "totalTestsViral", "totalTestResults": 1022, "hospitalizedCurrently": null, "hospitalizedCumulative": 2, "inIcuCurrently": null, "inIcuCumulative": null, "onVentilatorCurrently": null, "onVentilatorCumulative": null, "recovered": null, "dataQualityGrade": "A", "lastUpdateEt": "3/23/2020 19:00", "dateModified": "2020-03-23T19:00:00Z", "checkTimeEt": "03/23 15:00", "death": 0, "hospitalized": 2, "dateChecked": "2020-03-23T19:00:00Z", "totalTestsViral": 1022, "positiveTestsViral": null, "negativeTestsViral": null, "positiveCasesViral": null, "deathConfirmed": null, "deathProbable": null, "totalTestEncountersViral": null, "totalTestsPeopleViral": null, "totalTestsAntibody": null, "positiveTestsAntibody": null, "negativeTestsAntibody": null, "totalTestsPeopleAntibody": null, "positiveTestsPeopleAntibody": null, "negativeTestsPeopleAntibody": null, "totalTestsPeopleAntigen": null, "positiveTestsPeopleAntigen": null, "totalTestsAntigen": null, "positiveTestsAntigen": null, "fips": "02", "positiveIncrease": 4, "negativeIncrease": 50, "total": 1022, "totalTestResultsIncrease": 54, "posNeg": 1022, "deathIncrease": 0, "hospitalizedIncrease": 1, "hash": "e4df38e82cd72ffdc5cf01e3880e5598c6c90362", "commercialScore": 0, "negativeRegularScore": 0, "negativeScore": 0, "positiveScore": 0, "score": 0, "grade": "", "month_number_label": "2020-03", "date_label": "2020-03-24", "week_number_label": "2020W13", "week_start_label": "2020-03-23"}, {"date": 20200325, "state": "AK", "positive": 49, "probableCases": null, "negative": 1642, "pending": null, "totalTestResultsSource": "totalTestsViral", "totalTestResults": 1691, "hospitalizedCurrently": null, "hospitalizedCumulative": 3, "inIcuCurrently": null, "inIcuCumulative": null, "onVentilatorCurrently": null, "onVentilatorCumulative": null, "recovered": null, "dataQualityGrade": "A", "lastUpdateEt": "3/24/2020 21:00", "dateModified": "2020-03-24T21:00:00Z", "checkTimeEt": "03/24 17:00", "death": 1, "hospitalized": 3, "dateChecked": "2020-03-24T21:00:00Z", "totalTestsViral": 1691, "positiveTestsViral": null, "negativeTestsViral": null, "positiveCasesViral": null, "deathConfirmed": null, "deathProbable": null, "totalTestEncountersViral": null, "totalTestsPeopleViral": null, "totalTestsAntibody": null, "positiveTestsAntibody": null, "negativeTestsAntibody": null, "totalTestsPeopleAntibody": null, "positiveTestsPeopleAntibody": null, "negativeTestsPeopleAntibody": null, "totalTestsPeopleAntigen": null, "positiveTestsPeopleAntigen": null, "totalTestsAntigen": null, "positiveTestsAntigen": null, "fips": "02", "positiveIncrease": 7, "negativeIncrease": 662, "total": 1691, "totalTestResultsIncrease": 669, "posNeg": 1691, "deathIncrease": 1, "hospitalizedIncrease": 1, "hash": "0d04dfe95fe978382b625396354bcc22a06a56b5", "commercialScore": 0, "negativeRegularScore": 0, "negativeScore": 0, "positiveScore": 0, "score": 0, "grade": "", "month_number_label": "2020-03", "date_label": "2020-03-25", "week_number_label": "2020W13", "week_start_label": "2020-03-23"}, {"date": 20200326, "state": "AK", "positive": 63, "probableCases": null, "negative": 1797, "pending": null, "totalTestResultsSource": "totalTestsViral", "totalTestResults": 1860, "hospitalizedCurrently": null, "hospitalizedCumulative": 4, "inIcuCurrently": null, "inIcuCumulative": null, "onVentilatorCurrently": null, "onVentilatorCumulative": null, "recovered": null, "dataQualityGrade": "A", "lastUpdateEt": "3/25/2020 21:00", "dateModified": "2020-03-25T21:00:00Z", "checkTimeEt": "03/25 17:00", "death": 1, "hospitalized": 4, "dateChecked": "2020-03-25T21:00:00Z", "totalTestsViral": 1860, "positiveTestsViral": null, "negativeTestsViral": null, "positiveCasesViral": null, "deathConfirmed": null, "deathProbable": null, "totalTestEncountersViral": null, "totalTestsPeopleViral": null, "totalTestsAntibody": null, "positiveTestsAntibody": null, "negativeTestsAntibody": null, "totalTestsPeopleAntibody": null, "positiveTestsPeopleAntibody": null, "negativeTestsPeopleAntibody": null, "totalTestsPeopleAntigen": null, "positiveTestsPeopleAntigen": null, "totalTestsAntigen": null, "positiveTestsAntigen": null, "fips": "02", "positiveIncrease": 14, "negativeIncrease": 155, "total": 1860, "totalTestResultsIncrease": 169, "posNeg": 1860, "deathIncrease": 0, "hospitalizedIncrease": 1, "hash": "322d68d3cb3a3b7c6ca8f01ce6294a8c139b8fa3", "commercialScore": 0, "negativeRegularScore": 0, "negativeScore": 0, "positiveScore": 0, "score": 0, "grade": "", "month_number_label": "2020-03", "date_label": "2020-03-26", "week_number_label": "2020W13", "week_start_label": "2020-03-23"}, {"date": 20200327, "state": "AK", "positive": 74, "probableCases": null, "negative": 2314, "pending": 13, "totalTestResultsSource": "totalTestsViral", "totalTestResults": 2388, "hospitalizedCurrently": null, "hospitalizedCumulative": 6, "inIcuCurrently": null, "inIcuCumulative": null, "onVentilatorCurrently": null, "onVentilatorCumulative": null, "recovered": null, "dataQualityGrade": "A", "lastUpdateEt": "3/26/2020 21:00", "dateModified": "2020-03-26T21:00:00Z", "checkTimeEt": "03/26 17:00", "death": 1, "hospitalized": 6, "dateChecked": "2020-03-26T21:00:00Z", "totalTestsViral": 2388, "positiveTestsViral": null, "negativeTestsViral": null, "positiveCasesViral": null, "deathConfirmed": null, "deathProbable": null, "totalTestEncountersViral": null, "totalTestsPeopleViral": null, "totalTestsAntibody": null, "positiveTestsAntibody": null, "negativeTestsAntibody": null, "totalTestsPeopleAntibody": null, "positiveTestsPeopleAntibody": null, "negativeTestsPeopleAntibody": null, "totalTestsPeopleAntigen": null, "positiveTestsPeopleAntigen": null, "totalTestsAntigen": null, "positiveTestsAntigen": null, "fips": "02", "positiveIncrease": 11, "negativeIncrease": 517, "total": 2401, "totalTestResultsIncrease": 528, "posNeg": 2388, "deathIncrease": 0, "hospitalizedIncrease": 2, "hash": "04b7a16607362f50429be51919cb1823cb69dc58", "commercialScore": 0, "negativeRegularScore": 0, "negativeScore": 0, "positiveScore": 0, "score": 0, "grade": "", "month_number_label": "2020-03", "date_label": "2020-03-27", "week_number_label": "2020W13", "week_start_label": "2020-03-23"}, {"date": 20200328, "state": "AK", "positive": 91, "probableCases": null, "negative": 2830, "pending": null, "totalTestResultsSource": "totalTestsViral", "totalTestResults": 2921, "hospitalizedCurrently": null, "hospitalizedCumulative": 10, "inIcuCurrently": null, "inIcuCumulative": null, "onVentilatorCurrently": null, "onVentilatorCumulative": null, "recovered": null, "dataQualityGrade": "A", "lastUpdateEt": "3/27/2020 19:00", "dateModified": "2020-03-27T19:00:00Z", "checkTimeEt": "03/27 15:00", "death": 2, "hospitalized": 10, "dateChecked": "2020-03-27T19:00:00Z", "totalTestsViral": 2921, "positiveTestsViral": null, "negativeTestsViral": null, "positiveCasesViral": null, "deathConfirmed": null, "deathProbable": null, "totalTestEncountersViral": null, "totalTestsPeopleViral": null, "totalTestsAntibody": null, "positiveTestsAntibody": null, "negativeTestsAntibody": null, "totalTestsPeopleAntibody": null, "positiveTestsPeopleAntibody": null, "negativeTestsPeopleAntibody": null, "totalTestsPeopleAntigen": null, "positiveTestsPeopleAntigen": null, "totalTestsAntigen": null, "positiveTestsAntigen": null, "fips": "02", "positiveIncrease": 17, "negativeIncrease": 516, "total": 2921, "totalTestResultsIncrease": 533, "posNeg": 2921, "deathIncrease": 1, "hospitalizedIncrease": 4, "hash": "9a3c5cca8904f8a0b16c0c2ece99ebad1e8a5270", "commercialScore": 0, "negativeRegularScore": 0, "negativeScore": 0, "positiveScore": 0, "score": 0, "grade": "", "month_number_label": "2020-03", "date_label": "2020-03-28", "week_number_label": "2020W13", "week_start_label": "2020-03-23"}, {"date": 20200329, "state": "AK", "positive": 110, "probableCases": null, "negative": 3224, "pending": null, "totalTestResultsSource": "totalTestsViral", "totalTestResults": 3334, "hospitalizedCurrently": null, "hospitalizedCumulative": 10, "inIcuCurrently": null, "inIcuCumulative": null, "onVentilatorCurrently": null, "onVentilatorCumulative": null, "recovered": null, "dataQualityGrade": "A", "lastUpdateEt": "3/28/2020 19:00", "dateModified": "2020-03-28T19:00:00Z", "checkTimeEt": "03/28 15:00", "death": 2, "hospitalized": 10, "dateChecked": "2020-03-28T19:00:00Z", "totalTestsViral": 3334, "positiveTestsViral": null, "negativeTestsViral": null, "positiveCasesViral": null, "deathConfirmed": null, "deathProbable": null, "totalTestEncountersViral": null, "totalTestsPeopleViral": null, "totalTestsAntibody": null, "positiveTestsAntibody": null, "negativeTestsAntibody": null, "totalTestsPeopleAntibody": null, "positiveTestsPeopleAntibody": null, "negativeTestsPeopleAntibody": null, "totalTestsPeopleAntigen": null, "positiveTestsPeopleAntigen": null, "totalTestsAntigen": null, "positiveTestsAntigen": null, "fips": "02", "positiveIncrease": 19, "negativeIncrease": 394, "total": 3334, "totalTestResultsIncrease": 413, "posNeg": 3334, "deathIncrease": 0, "hospitalizedIncrease": 0, "hash": "40858b0b86b1dde2fe523a8e8440172cfcade6d2", "commercialScore": 0, "negativeRegularScore": 0, "negativeScore": 0, "positiveScore": 0, "score": 0, "grade": "", "month_number_label": "2020-03", "date_label": "2020-03-29", "week_number_label": "2020W13", "week_start_label": "2020-03-23"}, {"date": 20200330, "state": "AK", "positive": 118, "probableCases": null, "negative": 3536, "pending": null, "totalTestResultsSource": "totalTestsViral", "totalTestResults": 3654, "hospitalizedCurrently": null, "hospitalizedCumulative": 10, "inIcuCurrently": null, "inIcuCumulative": null, "onVentilatorCurrently": null, "onVentilatorCumulative": null, "recovered": null, "dataQualityGrade": "A", "lastUpdateEt": "3/29/2020 19:00", "dateModified": "2020-03-29T19:00:00Z", "checkTimeEt": "03/29 15:00", "death": 3, "hospitalized": 10, "dateChecked": "2020-03-29T19:00:00Z", "totalTestsViral": 3654, "positiveTestsViral": null, "negativeTestsViral": null, "positiveCasesViral": null, "deathConfirmed": null, "deathProbable": null, "totalTestEncountersViral": null, "totalTestsPeopleViral": null, "totalTestsAntibody": null, "positiveTestsAntibody": null, "negativeTestsAntibody": null, "totalTestsPeopleAntibody": null, "positiveTestsPeopleAntibody": null, "negativeTestsPeopleAntibody": null, "totalTestsPeopleAntigen": null, "positiveTestsPeopleAntigen": null, "totalTestsAntigen": null, "positiveTestsAntigen": null, "fips": "02", "positiveIncrease": 8, "negativeIncrease": 312, "total": 3654, "totalTestResultsIncrease": 320, "posNeg": 3654, "deathIncrease": 1, "hospitalizedIncrease": 0, "hash": "483877777b3762f7b1642188ef0dd5be5ef75804", "commercialScore": 0, "negativeRegularScore": 0, "negativeScore": 0, "positiveScore": 0, "score": 0, "grade": "", "month_number_label": "2020-03", "date_label": "2020-03-30", "week_number_label": "2020W14", "week_start_label": "2020-03-30"}, {"date": 20200331, "state": "AK", "positive": 128, "probableCases": null, "negative": 3585, "pending": null, "totalTestResultsSource": "totalTestsViral", "totalTestResults": 3713, "hospitalizedCurrently": null, "hospitalizedCumulative": 12, "inIcuCurrently": null, "inIcuCumulative": null, "onVentilatorCurrently": null, "onVentilatorCumulative": null, "recovered": null, "dataQualityGrade": "A", "lastUpdateEt": "3/30/2020 19:00", "dateModified": "2020-03-30T19:00:00Z", "checkTimeEt": "03/30 15:00", "death": 3, "hospitalized": 12, "dateChecked": "2020-03-30T19:00:00Z", "totalTestsViral": 3713, "positiveTestsViral": null, "negativeTestsViral": null, "positiveCasesViral": null, "deathConfirmed": null, "deathProbable": null, "totalTestEncountersViral": null, "totalTestsPeopleViral": null, "totalTestsAntibody": null, "positiveTestsAntibody": null, "negativeTestsAntibody": null, "totalTestsPeopleAntibody": null, "positiveTestsPeopleAntibody": null, "negativeTestsPeopleAntibody": null, "totalTestsPeopleAntigen": null, "positiveTestsPeopleAntigen": null, "totalTestsAntigen": null, "positiveTestsAntigen": null, "fips": "02", "positiveIncrease": 10, "negativeIncrease": 49, "total": 3713, "totalTestResultsIncrease": 59, "posNeg": 3713, "deathIncrease": 0, "hospitalizedIncrease": 2, "hash": "6d3bba0993b0e74e059bff70d9c86fe81aabdb63", "commercialScore": 0, "negativeRegularScore": 0, "negativeScore": 0, "positiveScore": 0, "score": 0, "grade": "", "month_number_label": "2020-03", "date_label": "2020-03-31", "week_number_label": "2020W14", "week_start_label": "2020-03-30"}, {"date": 20200401, "state": "AK", "positive": 141, "probableCases": null, "negative": 4462, "pending": null, "totalTestResultsSource": "totalTestsViral", "totalTestResults": 4603, "hospitalizedCurrently": null, "hospitalizedCumulative": 15, "inIcuCurrently": null, "inIcuCumulative": null, "onVentilatorCurrently": null, "onVentilatorCumulative": null, "recovered": null, "dataQualityGrade": "A", "lastUpdateEt": "3/31/2020 19:00", "dateModified": "2020-03-31T19:00:00Z", "checkTimeEt": "03/31 15:00", "death": 3, "hospitalized": 15, "dateChecked": "2020-03-31T19:00:00Z", "totalTestsViral": 4603, "positiveTestsViral": null, "negativeTestsViral": null, "positiveCasesViral": null, "deathConfirmed": null, "deathProbable": null, "totalTestEncountersViral": null, "totalTestsPeopleViral": null, "totalTestsAntibody": null, "positiveTestsAntibody": null, "negativeTestsAntibody": null, "totalTestsPeopleAntibody": null, "positiveTestsPeopleAntibody": null, "negativeTestsPeopleAntibody": null, "totalTestsPeopleAntigen": null, "positiveTestsPeopleAntigen": null, "totalTestsAntigen": null, "positiveTestsAntigen": null, "fips": "02", "positiveIncrease": 13, "negativeIncrease": 877, "total": 4603, "totalTestResultsIncrease": 890, "posNeg": 4603, "deathIncrease": 0, "hospitalizedIncrease": 3, "hash": "4bd3d80b26f1fa3308dd7171ca3ca930ab00b86e", "commercialScore": 0, "negativeRegularScore": 0, "negativeScore": 0, "positiveScore": 0, "score": 0, "grade": "", "month_number_label": "2020-04", "date_label": "2020-04-01", "week_number_label": "2020W14", "week_start_label": "2020-03-30"}, {"date": 20200402, "state": "AK", "positive": 149, "probableCases": null, "negative": 4873, "pending": null, "totalTestResultsSource": "totalTestsViral", "totalTestResults": 5022, "hospitalizedCurrently": null, "hospitalizedCumulative": 16, "inIcuCurrently": null, "inIcuCumulative": null, "onVentilatorCurrently": null, "onVentilatorCumulative": null, "recovered": null, "dataQualityGrade": "A", "lastUpdateEt": "4/1/2020 21:00", "dateModified": "2020-04-01T21:00:00Z", "checkTimeEt": "04/01 17:00", "death": 3, "hospitalized": 16, "dateChecked": "2020-04-01T21:00:00Z", "totalTestsViral": 5022, "positiveTestsViral": null, "negativeTestsViral": null, "positiveCasesViral": null, "deathConfirmed": null, "deathProbable": null, "totalTestEncountersViral": null, "totalTestsPeopleViral": null, "totalTestsAntibody": null, "positiveTestsAntibody": null, "negativeTestsAntibody": null, "totalTestsPeopleAntibody": null, "positiveTestsPeopleAntibody": null, "negativeTestsPeopleAntibody": null, "totalTestsPeopleAntigen": null, "positiveTestsPeopleAntigen": null, "totalTestsAntigen": null, "positiveTestsAntigen": null, "fips": "02", "positiveIncrease": 8, "negativeIncrease": 411, "total": 5022, "totalTestResultsIncrease": 419, "posNeg": 5022, "deathIncrease": 0, "hospitalizedIncrease": 1, "hash": "a44c426975947fb22bc3ccc5f7fa2bf3b8abaff3", "commercialScore": 0, "negativeRegularScore": 0, "negativeScore": 0, "positiveScore": 0, "score": 0, "grade": "", "month_number_label": "2020-04", "date_label": "2020-04-02", "week_number_label": "2020W14", "week_start_label": "2020-03-30"}, {"date": 20200403, "state": "AK", "positive": 160, "probableCases": null, "negative": 5856, "pending": null, "totalTestResultsSource": "totalTestsViral", "totalTestResults": 6016, "hospitalizedCurrently": null, "hospitalizedCumulative": 17, "inIcuCurrently": null, "inIcuCumulative": null, "onVentilatorCurrently": null, "onVentilatorCumulative": null, "recovered": null, "dataQualityGrade": "A", "lastUpdateEt": "4/3/2020 16:00", "dateModified": "2020-04-03T16:00:00Z", "checkTimeEt": "04/03 12:00", "death": 3, "hospitalized": 17, "dateChecked": "2020-04-03T16:00:00Z", "totalTestsViral": 6016, "positiveTestsViral": null, "negativeTestsViral": null, "positiveCasesViral": null, "deathConfirmed": null, "deathProbable": null, "totalTestEncountersViral": null, "totalTestsPeopleViral": null, "totalTestsAntibody": null, "positiveTestsAntibody": null, "negativeTestsAntibody": null, "totalTestsPeopleAntibody": null, "positiveTestsPeopleAntibody": null, "negativeTestsPeopleAntibody": null, "totalTestsPeopleAntigen": null, "positiveTestsPeopleAntigen": null, "totalTestsAntigen": null, "positiveTestsAntigen": null, "fips": "02", "positiveIncrease": 11, "negativeIncrease": 983, "total": 6016, "totalTestResultsIncrease": 994, "posNeg": 6016, "deathIncrease": 0, "hospitalizedIncrease": 1, "hash": "01508dca70d201375c86ddcf47566d316e5dae84", "commercialScore": 0, "negativeRegularScore": 0, "negativeScore": 0, "positiveScore": 0, "score": 0, "grade": "", "month_number_label": "2020-04", "date_label": "2020-04-03", "week_number_label": "2020W14", "week_start_label": "2020-03-30"}, {"date": 20200404, "state": "AK", "positive": 171, "probableCases": null, "negative": 5869, "pending": null, "totalTestResultsSource": "totalTestsViral", "totalTestResults": 6040, "hospitalizedCurrently": null, "hospitalizedCumulative": 17, "inIcuCurrently": null, "inIcuCumulative": null, "onVentilatorCurrently": null, "onVentilatorCumulative": null, "recovered": null, "dataQualityGrade": "A", "lastUpdateEt": "4/4/2020 16:00", "dateModified": "2020-04-04T16:00:00Z", "checkTimeEt": "04/04 12:00", "death": 5, "hospitalized": 17, "dateChecked": "2020-04-04T16:00:00Z", "totalTestsViral": 6040, "positiveTestsViral": null, "negativeTestsViral": null, "positiveCasesViral": null, "deathConfirmed": null, "deathProbable": null, "totalTestEncountersViral": null, "totalTestsPeopleViral": null, "totalTestsAntibody": null, "positiveTestsAntibody": null, "negativeTestsAntibody": null, "totalTestsPeopleAntibody": null, "positiveTestsPeopleAntibody": null, "negativeTestsPeopleAntibody": null, "totalTestsPeopleAntigen": null, "positiveTestsPeopleAntigen": null, "totalTestsAntigen": null, "positiveTestsAntigen": null, "fips": "02", "positiveIncrease": 11, "negativeIncrease": 13, "total": 6040, "totalTestResultsIncrease": 24, "posNeg": 6040, "deathIncrease": 2, "hospitalizedIncrease": 0, "hash": "eea6c0ef50c68f9c76f7e8089489d533e3fd8639", "commercialScore": 0, "negativeRegularScore": 0, "negativeScore": 0, "positiveScore": 0, "score": 0, "grade": "", "month_number_label": "2020-04", "date_label": "2020-04-04", "week_number_label": "2020W14", "week_start_label": "2020-03-30"}, {"date": 20200405, "state": "AK", "positive": 185, "probableCases": null, "negative": 6099, "pending": null, "totalTestResultsSource": "totalTestsViral", "totalTestResults": 6284, "hospitalizedCurrently": null, "hospitalizedCumulative": 21, "inIcuCurrently": null, "inIcuCumulative": null, "onVentilatorCurrently": null, "onVentilatorCumulative": null, "recovered": null, "dataQualityGrade": "A", "lastUpdateEt": "4/5/2020 00:00", "dateModified": "2020-04-05T00:00:00Z", "checkTimeEt": "04/04 20:00", "death": 6, "hospitalized": 21, "dateChecked": "2020-04-05T00:00:00Z", "totalTestsViral": 6284, "positiveTestsViral": null, "negativeTestsViral": null, "positiveCasesViral": null, "deathConfirmed": null, "deathProbable": null, "totalTestEncountersViral": null, "totalTestsPeopleViral": null, "totalTestsAntibody": null, "positiveTestsAntibody": null, "negativeTestsAntibody": null, "totalTestsPeopleAntibody": null, "positiveTestsPeopleAntibody": null, "negativeTestsPeopleAntibody": null, "totalTestsPeopleAntigen": null, "positiveTestsPeopleAntigen": null, "totalTestsAntigen": null, "positiveTestsAntigen": null, "fips": "02", "positiveIncrease": 14, "negativeIncrease": 230, "total": 6284, "totalTestResultsIncrease": 244, "posNeg": 6284, "deathIncrease": 1, "hospitalizedIncrease": 4, "hash": "448b2fa89f257b8dee0188b47cb9ac02c92b4a2c", "commercialScore": 0, "negativeRegularScore": 0, "negativeScore": 0, "positiveScore": 0, "score": 0, "grade": "", "month_number_label": "2020-04", "date_label": "2020-04-05", "week_number_label": "2020W14", "week_start_label": "2020-03-30"}, {"date": 20200406, "state": "AK", "positive": 191, "probableCases": null, "negative": 6692, "pending": null, "totalTestResultsSource": "totalTestsViral", "totalTestResults": 6883, "hospitalizedCurrently": null, "hospitalizedCumulative": 25, "inIcuCurrently": null, "inIcuCumulative": null, "onVentilatorCurrently": null, "onVentilatorCumulative": null, "recovered": null, "dataQualityGrade": "A", "lastUpdateEt": "4/6/2020 14:45", "dateModified": "2020-04-06T14:45:00Z", "checkTimeEt": "04/06 10:45", "death": 6, "hospitalized": 25, "dateChecked": "2020-04-06T14:45:00Z", "totalTestsViral": 6883, "positiveTestsViral": null, "negativeTestsViral": null, "positiveCasesViral": null, "deathConfirmed": null, "deathProbable": null, "totalTestEncountersViral": null, "totalTestsPeopleViral": null, "totalTestsAntibody": null, "positiveTestsAntibody": null, "negativeTestsAntibody": null, "totalTestsPeopleAntibody": null, "positiveTestsPeopleAntibody": null, "negativeTestsPeopleAntibody": null, "totalTestsPeopleAntigen": null, "positiveTestsPeopleAntigen": null, "totalTestsAntigen": null, "positiveTestsAntigen": null, "fips": "02", "positiveIncrease": 6, "negativeIncrease": 593, "total": 6883, "totalTestResultsIncrease": 599, "posNeg": 6883, "deathIncrease": 0, "hospitalizedIncrease": 4, "hash": "244187b858f3f5eb2e40f2a9519fc9406b02b3ec", "commercialScore": 0, "negativeRegularScore": 0, "negativeScore": 0, "positiveScore": 0, "score": 0, "grade": "", "month_number_label": "2020-04", "date_label": "2020-04-06", "week_number_label": "2020W15", "week_start_label": "2020-04-06"}, {"date": 20200407, "state": "AK", "positive": 213, "probableCases": null, "negative": 6700, "pending": null, "totalTestResultsSource": "totalTestsViral", "totalTestResults": 6913, "hospitalizedCurrently": null, "hospitalizedCumulative": 26, "inIcuCurrently": null, "inIcuCumulative": null, "onVentilatorCurrently": null, "onVentilatorCumulative": null, "recovered": 29, "dataQualityGrade": "A", "lastUpdateEt": "4/7/2020 15:15", "dateModified": "2020-04-07T15:15:00Z", "checkTimeEt": "04/07 11:15", "death": 6, "hospitalized": 26, "dateChecked": "2020-04-07T15:15:00Z", "totalTestsViral": 6913, "positiveTestsViral": null, "negativeTestsViral": null, "positiveCasesViral": null, "deathConfirmed": null, "deathProbable": null, "totalTestEncountersViral": null, "totalTestsPeopleViral": null, "totalTestsAntibody": null, "positiveTestsAntibody": null, "negativeTestsAntibody": null, "totalTestsPeopleAntibody": null, "positiveTestsPeopleAntibody": null, "negativeTestsPeopleAntibody": null, "totalTestsPeopleAntigen": null, "positiveTestsPeopleAntigen": null, "totalTestsAntigen": null, "positiveTestsAntigen": null, "fips": "02", "positiveIncrease": 22, "negativeIncrease": 8, "total": 6913, "totalTestResultsIncrease": 30, "posNeg": 6913, "deathIncrease": 0, "hospitalizedIncrease": 1, "hash": "8f1421cdf3c3bcc9388e60b79d3826e425d71eb1", "commercialScore": 0, "negativeRegularScore": 0, "negativeScore": 0, "positiveScore": 0, "score": 0, "grade": "", "month_number_label": "2020-04", "date_label": "2020-04-07", "week_number_label": "2020W15", "week_start_label": "2020-04-06"}, {"date": 20200408, "state": "AK", "positive": 226, "probableCases": null, "negative": 6842, "pending": null, "totalTestResultsSource": "totalTestsViral", "totalTestResults": 7068, "hospitalizedCurrently": null, "hospitalizedCumulative": 28, "inIcuCurrently": null, "inIcuCumulative": null, "onVentilatorCurrently": null, "onVentilatorCumulative": null, "recovered": 32, "dataQualityGrade": "A", "lastUpdateEt": "4/8/2020 15:00", "dateModified": "2020-04-08T15:00:00Z", "checkTimeEt": "04/08 11:00", "death": 7, "hospitalized": 28, "dateChecked": "2020-04-08T15:00:00Z", "totalTestsViral": 7068, "positiveTestsViral": null, "negativeTestsViral": null, "positiveCasesViral": null, "deathConfirmed": null, "deathProbable": null, "totalTestEncountersViral": null, "totalTestsPeopleViral": null, "totalTestsAntibody": null, "positiveTestsAntibody": null, "negativeTestsAntibody": null, "totalTestsPeopleAntibody": null, "positiveTestsPeopleAntibody": null, "negativeTestsPeopleAntibody": null, "totalTestsPeopleAntigen": null, "positiveTestsPeopleAntigen": null, "totalTestsAntigen": null, "positiveTestsAntigen": null, "fips": "02", "positiveIncrease": 13, "negativeIncrease": 142, "total": 7068, "totalTestResultsIncrease": 155, "posNeg": 7068, "deathIncrease": 1, "hospitalizedIncrease": 2, "hash": "8b5968624c5f1130b18c52dfdaa4c202c72d52d3", "commercialScore": 0, "negativeRegularScore": 0, "negativeScore": 0, "positiveScore": 0, "score": 0, "grade": "", "month_number_label": "2020-04", "date_label": "2020-04-08", "week_number_label": "2020W15", "week_start_label": "2020-04-06"}, {"date": 20200409, "state": "AK", "positive": 235, "probableCases": null, "negative": 6988, "pending": null, "totalTestResultsSource": "totalTestsViral", "totalTestResults": 7223, "hospitalizedCurrently": null, "hospitalizedCumulative": 30, "inIcuCurrently": null, "inIcuCumulative": null, "onVentilatorCurrently": null, "onVentilatorCumulative": null, "recovered": 49, "dataQualityGrade": "A", "lastUpdateEt": "4/9/2020 16:00", "dateModified": "2020-04-09T16:00:00Z", "checkTimeEt": "04/09 12:00", "death": 7, "hospitalized": 30, "dateChecked": "2020-04-09T16:00:00Z", "totalTestsViral": 7223, "positiveTestsViral": null, "negativeTestsViral": null, "positiveCasesViral": null, "deathConfirmed": null, "deathProbable": null, "totalTestEncountersViral": null, "totalTestsPeopleViral": null, "totalTestsAntibody": null, "positiveTestsAntibody": null, "negativeTestsAntibody": null, "totalTestsPeopleAntibody": null, "positiveTestsPeopleAntibody": null, "negativeTestsPeopleAntibody": null, "totalTestsPeopleAntigen": null, "positiveTestsPeopleAntigen": null, "totalTestsAntigen": null, "positiveTestsAntigen": null, "fips": "02", "positiveIncrease": 9, "negativeIncrease": 146, "total": 7223, "totalTestResultsIncrease": 155, "posNeg": 7223, "deathIncrease": 0, "hospitalizedIncrease": 2, "hash": "76239dd4c4e1970537fe1208d2292a78f8704bb0", "commercialScore": 0, "negativeRegularScore": 0, "negativeScore": 0, "positiveScore": 0, "score": 0, "grade": "", "month_number_label": "2020-04", "date_label": "2020-04-09", "week_number_label": "2020W15", "week_start_label": "2020-04-06"}, {"date": 20200410, "state": "AK", "positive": 246, "probableCases": null, "negative": 7186, "pending": null, "totalTestResultsSource": "totalTestsViral", "totalTestResults": 7432, "hospitalizedCurrently": null, "hospitalizedCumulative": 30, "inIcuCurrently": null, "inIcuCumulative": null, "onVentilatorCurrently": null, "onVentilatorCumulative": null, "recovered": 55, "dataQualityGrade": "A", "lastUpdateEt": "4/10/2020 15:30", "dateModified": "2020-04-10T15:30:00Z", "checkTimeEt": "04/10 11:30", "death": 7, "hospitalized": 30, "dateChecked": "2020-04-10T15:30:00Z", "totalTestsViral": 7432, "positiveTestsViral": null, "negativeTestsViral": null, "positiveCasesViral": null, "deathConfirmed": null, "deathProbable": null, "totalTestEncountersViral": null, "totalTestsPeopleViral": null, "totalTestsAntibody": null, "positiveTestsAntibody": null, "negativeTestsAntibody": null, "totalTestsPeopleAntibody": null, "positiveTestsPeopleAntibody": null, "negativeTestsPeopleAntibody": null, "totalTestsPeopleAntigen": null, "positiveTestsPeopleAntigen": null, "totalTestsAntigen": null, "positiveTestsAntigen": null, "fips": "02", "positiveIncrease": 11, "negativeIncrease": 198, "total": 7432, "totalTestResultsIncrease": 209, "posNeg": 7432, "deathIncrease": 0, "hospitalizedIncrease": 0, "hash": "df27d894168329619bc220162794249709190ea1", "commercialScore": 0, "negativeRegularScore": 0, "negativeScore": 0, "positiveScore": 0, "score": 0, "grade": "", "month_number_label": "2020-04", "date_label": "2020-04-10", "week_number_label": "2020W15", "week_start_label": "2020-04-06"}, {"date": 20200411, "state": "AK", "positive": 257, "probableCases": null, "negative": 7475, "pending": null, "totalTestResultsSource": "totalTestsViral", "totalTestResults": 7732, "hospitalizedCurrently": null, "hospitalizedCumulative": 32, "inIcuCurrently": null, "inIcuCumulative": null, "onVentilatorCurrently": null, "onVentilatorCumulative": null, "recovered": 63, "dataQualityGrade": "A", "lastUpdateEt": "4/11/2020 14:45", "dateModified": "2020-04-11T14:45:00Z", "checkTimeEt": "04/11 10:45", "death": 8, "hospitalized": 32, "dateChecked": "2020-04-11T14:45:00Z", "totalTestsViral": 7732, "positiveTestsViral": null, "negativeTestsViral": null, "positiveCasesViral": null, "deathConfirmed": null, "deathProbable": null, "totalTestEncountersViral": null, "totalTestsPeopleViral": null, "totalTestsAntibody": null, "positiveTestsAntibody": null, "negativeTestsAntibody": null, "totalTestsPeopleAntibody": null, "positiveTestsPeopleAntibody": null, "negativeTestsPeopleAntibody": null, "totalTestsPeopleAntigen": null, "positiveTestsPeopleAntigen": null, "totalTestsAntigen": null, "positiveTestsAntigen": null, "fips": "02", "positiveIncrease": 11, "negativeIncrease": 289, "total": 7732, "totalTestResultsIncrease": 300, "posNeg": 7732, "deathIncrease": 1, "hospitalizedIncrease": 2, "hash": "67f52b97638335acf6306f2a1406d8fc8813c3b7", "commercialScore": 0, "negativeRegularScore": 0, "negativeScore": 0, "positiveScore": 0, "score": 0, "grade": "", "month_number_label": "2020-04", "date_label": "2020-04-11", "week_number_label": "2020W15", "week_start_label": "2020-04-06"}, {"date": 20200412, "state": "AK", "positive": 272, "probableCases": null, "negative": 7766, "pending": null, "totalTestResultsSource": "totalTestsViral", "totalTestResults": 8038, "hospitalizedCurrently": null, "hospitalizedCumulative": 33, "inIcuCurrently": null, "inIcuCumulative": null, "onVentilatorCurrently": null, "onVentilatorCumulative": null, "recovered": 66, "dataQualityGrade": "A", "lastUpdateEt": "4/12/2020 14:50", "dateModified": "2020-04-12T14:50:00Z", "checkTimeEt": "04/12 10:50", "death": 8, "hospitalized": 33, "dateChecked": "2020-04-12T14:50:00Z", "totalTestsViral": 8038, "positiveTestsViral": null, "negativeTestsViral": null, "positiveCasesViral": null, "deathConfirmed": null, "deathProbable": null, "totalTestEncountersViral": null, "totalTestsPeopleViral": null, "totalTestsAntibody": null, "positiveTestsAntibody": null, "negativeTestsAntibody": null, "totalTestsPeopleAntibody": null, "positiveTestsPeopleAntibody": null, "negativeTestsPeopleAntibody": null, "totalTestsPeopleAntigen": null, "positiveTestsPeopleAntigen": null, "totalTestsAntigen": null, "positiveTestsAntigen": null, "fips": "02", "positiveIncrease": 15, "negativeIncrease": 291, "total": 8038, "totalTestResultsIncrease": 306, "posNeg": 8038, "deathIncrease": 0, "hospitalizedIncrease": 1, "hash": "b23522ba0eb2c509ac47449edc00b173928e4c80", "commercialScore": 0, "negativeRegularScore": 0, "negativeScore": 0, "positiveScore": 0, "score": 0, "grade": "", "month_number_label": "2020-04", "date_label": "2020-04-12", "week_number_label": "2020W15", "week_start_label": "2020-04-06"}, {"date": 20200413, "state": "AK", "positive": 277, "probableCases": null, "negative": 7553, "pending": null, "totalTestResultsSource": "totalTestsViral", "totalTestResults": 7830, "hospitalizedCurrently": null, "hospitalizedCumulative": 33, "inIcuCurrently": null, "inIcuCumulative": null, "onVentilatorCurrently": null, "onVentilatorCumulative": null, "recovered": 85, "dataQualityGrade": "A", "lastUpdateEt": "4/13/2020 00:00", "dateModified": "2020-04-13T00:00:00Z", "checkTimeEt": "04/12 20:00", "death": 8, "hospitalized": 33, "dateChecked": "2020-04-13T00:00:00Z", "totalTestsViral": 7830, "positiveTestsViral": null, "negativeTestsViral": null, "positiveCasesViral": null, "deathConfirmed": null, "deathProbable": null, "totalTestEncountersViral": null, "totalTestsPeopleViral": null, "totalTestsAntibody": null, "positiveTestsAntibody": null, "negativeTestsAntibody": null, "totalTestsPeopleAntibody": null, "positiveTestsPeopleAntibody": null, "negativeTestsPeopleAntibody": null, "totalTestsPeopleAntigen": null, "positiveTestsPeopleAntigen": null, "totalTestsAntigen": null, "positiveTestsAntigen": null, "fips": "02", "positiveIncrease": 5, "negativeIncrease": -213, "total": 7830, "totalTestResultsIncrease": -208, "posNeg": 7830, "deathIncrease": 0, "hospitalizedIncrease": 0, "hash": "c65eda15306c7f98be8232d166f2012e0af67a07", "commercialScore": 0, "negativeRegularScore": 0, "negativeScore": 0, "positiveScore": 0, "score": 0, "grade": "", "month_number_label": "2020-04", "date_label": "2020-04-13", "week_number_label": "2020W16", "week_start_label": "2020-04-13"}, {"date": 20200414, "state": "AK", "positive": 285, "probableCases": null, "negative": 8063, "pending": null, "totalTestResultsSource": "totalTestsViral", "totalTestResults": 8348, "hospitalizedCurrently": null, "hospitalizedCumulative": 33, "inIcuCurrently": null, "inIcuCumulative": null, "onVentilatorCurrently": null, "onVentilatorCumulative": null, "recovered": 98, "dataQualityGrade": "A", "lastUpdateEt": "4/14/2020 14:15", "dateModified": "2020-04-14T14:15:00Z", "checkTimeEt": "04/14 10:15", "death": 9, "hospitalized": 33, "dateChecked": "2020-04-14T14:15:00Z", "totalTestsViral": 8348, "positiveTestsViral": null, "negativeTestsViral": null, "positiveCasesViral": null, "deathConfirmed": null, "deathProbable": null, "totalTestEncountersViral": null, "totalTestsPeopleViral": null, "totalTestsAntibody": null, "positiveTestsAntibody": null, "negativeTestsAntibody": null, "totalTestsPeopleAntibody": null, "positiveTestsPeopleAntibody": null, "negativeTestsPeopleAntibody": null, "totalTestsPeopleAntigen": null, "positiveTestsPeopleAntigen": null, "totalTestsAntigen": null, "positiveTestsAntigen": null, "fips": "02", "positiveIncrease": 8, "negativeIncrease": 510, "total": 8348, "totalTestResultsIncrease": 518, "posNeg": 8348, "deathIncrease": 1, "hospitalizedIncrease": 0, "hash": "70abe219f0d519a410f087a3b7774f1694e9878a", "commercialScore": 0, "negativeRegularScore": 0, "negativeScore": 0, "positiveScore": 0, "score": 0, "grade": "", "month_number_label": "2020-04", "date_label": "2020-04-14", "week_number_label": "2020W16", "week_start_label": "2020-04-13"}, {"date": 20200415, "state": "AK", "positive": 293, "probableCases": null, "negative": 8371, "pending": null, "totalTestResultsSource": "totalTestsViral", "totalTestResults": 8664, "hospitalizedCurrently": null, "hospitalizedCumulative": 33, "inIcuCurrently": null, "inIcuCumulative": null, "onVentilatorCurrently": null, "onVentilatorCumulative": null, "recovered": 106, "dataQualityGrade": "A", "lastUpdateEt": "4/15/2020 15:15", "dateModified": "2020-04-15T15:15:00Z", "checkTimeEt": "04/15 11:15", "death": 9, "hospitalized": 33, "dateChecked": "2020-04-15T15:15:00Z", "totalTestsViral": 8664, "positiveTestsViral": null, "negativeTestsViral": null, "positiveCasesViral": null, "deathConfirmed": null, "deathProbable": null, "totalTestEncountersViral": null, "totalTestsPeopleViral": null, "totalTestsAntibody": null, "positiveTestsAntibody": null, "negativeTestsAntibody": null, "totalTestsPeopleAntibody": null, "positiveTestsPeopleAntibody": null, "negativeTestsPeopleAntibody": null, "totalTestsPeopleAntigen": null, "positiveTestsPeopleAntigen": null, "totalTestsAntigen": null, "positiveTestsAntigen": null, "fips": "02", "positiveIncrease": 8, "negativeIncrease": 308, "total": 8664, "totalTestResultsIncrease": 316, "posNeg": 8664, "deathIncrease": 0, "hospitalizedIncrease": 0, "hash": "c473c9539d7375ba49bb23cef3ad21647db9e095", "commercialScore": 0, "negativeRegularScore": 0, "negativeScore": 0, "positiveScore": 0, "score": 0, "grade": "", "month_number_label": "2020-04", "date_label": "2020-04-15", "week_number_label": "2020W16", "week_start_label": "2020-04-13"}, {"date": 20200416, "state": "AK", "positive": 300, "probableCases": null, "negative": 8435, "pending": null, "totalTestResultsSource": "totalTestsViral", "totalTestResults": 8735, "hospitalizedCurrently": null, "hospitalizedCumulative": 36, "inIcuCurrently": null, "inIcuCumulative": null, "onVentilatorCurrently": null, "onVentilatorCumulative": null, "recovered": 110, "dataQualityGrade": "A", "lastUpdateEt": "4/16/2020 15:30", "dateModified": "2020-04-16T15:30:00Z", "checkTimeEt": "04/16 11:30", "death": 9, "hospitalized": 36, "dateChecked": "2020-04-16T15:30:00Z", "totalTestsViral": 8735, "positiveTestsViral": null, "negativeTestsViral": null, "positiveCasesViral": null, "deathConfirmed": null, "deathProbable": null, "totalTestEncountersViral": null, "totalTestsPeopleViral": null, "totalTestsAntibody": null, "positiveTestsAntibody": null, "negativeTestsAntibody": null, "totalTestsPeopleAntibody": null, "positiveTestsPeopleAntibody": null, "negativeTestsPeopleAntibody": null, "totalTestsPeopleAntigen": null, "positiveTestsPeopleAntigen": null, "totalTestsAntigen": null, "positiveTestsAntigen": null, "fips": "02", "positiveIncrease": 7, "negativeIncrease": 64, "total": 8735, "totalTestResultsIncrease": 71, "posNeg": 8735, "deathIncrease": 0, "hospitalizedIncrease": 3, "hash": "7c4a5f02f116f2c86cc7b68adadf9a584ff3126a", "commercialScore": 0, "negativeRegularScore": 0, "negativeScore": 0, "positiveScore": 0, "score": 0, "grade": "", "month_number_label": "2020-04", "date_label": "2020-04-16", "week_number_label": "2020W16", "week_start_label": "2020-04-13"}, {"date": 20200417, "state": "AK", "positive": 309, "probableCases": null, "negative": 9141, "pending": null, "totalTestResultsSource": "totalTestsViral", "totalTestResults": 9450, "hospitalizedCurrently": null, "hospitalizedCumulative": 37, "inIcuCurrently": null, "inIcuCumulative": null, "onVentilatorCurrently": null, "onVentilatorCumulative": null, "recovered": 128, "dataQualityGrade": "A", "lastUpdateEt": "4/16/2020 00:00", "dateModified": "2020-04-16T00:00:00Z", "checkTimeEt": "04/15 20:00", "death": 9, "hospitalized": 37, "dateChecked": "2020-04-16T00:00:00Z", "totalTestsViral": 9450, "positiveTestsViral": null, "negativeTestsViral": null, "positiveCasesViral": null, "deathConfirmed": null, "deathProbable": null, "totalTestEncountersViral": null, "totalTestsPeopleViral": null, "totalTestsAntibody": null, "positiveTestsAntibody": null, "negativeTestsAntibody": null, "totalTestsPeopleAntibody": null, "positiveTestsPeopleAntibody": null, "negativeTestsPeopleAntibody": null, "totalTestsPeopleAntigen": null, "positiveTestsPeopleAntigen": null, "totalTestsAntigen": null, "positiveTestsAntigen": null, "fips": "02", "positiveIncrease": 9, "negativeIncrease": 706, "total": 9450, "totalTestResultsIncrease": 715, "posNeg": 9450, "deathIncrease": 0, "hospitalizedIncrease": 1, "hash": "93c863a749ef18e6617c295db90b422936237b19", "commercialScore": 0, "negativeRegularScore": 0, "negativeScore": 0, "positiveScore": 0, "score": 0, "grade": "", "month_number_label": "2020-04", "date_label": "2020-04-17", "week_number_label": "2020W16", "week_start_label": "2020-04-13"}, {"date": 20200418, "state": "AK", "positive": 314, "probableCases": null, "negative": 9341, "pending": null, "totalTestResultsSource": "totalTestsViral", "totalTestResults": 9655, "hospitalizedCurrently": 39, "hospitalizedCumulative": 37, "inIcuCurrently": null, "inIcuCumulative": null, "onVentilatorCurrently": null, "onVentilatorCumulative": null, "recovered": 147, "dataQualityGrade": "A", "lastUpdateEt": "4/18/2020 14:15", "dateModified": "2020-04-18T14:15:00Z", "checkTimeEt": "04/18 10:15", "death": 9, "hospitalized": 37, "dateChecked": "2020-04-18T14:15:00Z", "totalTestsViral": 9655, "positiveTestsViral": null, "negativeTestsViral": null, "positiveCasesViral": null, "deathConfirmed": null, "deathProbable": null, "totalTestEncountersViral": null, "totalTestsPeopleViral": null, "totalTestsAntibody": null, "positiveTestsAntibody": null, "negativeTestsAntibody": null, "totalTestsPeopleAntibody": null, "positiveTestsPeopleAntibody": null, "negativeTestsPeopleAntibody": null, "totalTestsPeopleAntigen": null, "positiveTestsPeopleAntigen": null, "totalTestsAntigen": null, "positiveTestsAntigen": null, "fips": "02", "positiveIncrease": 5, "negativeIncrease": 200, "total": 9655, "totalTestResultsIncrease": 205, "posNeg": 9655, "deathIncrease": 0, "hospitalizedIncrease": 0, "hash": "7e765203335f4ec4b18b4c217590f04dc5f47884", "commercialScore": 0, "negativeRegularScore": 0, "negativeScore": 0, "positiveScore": 0, "score": 0, "grade": "", "month_number_label": "2020-04", "date_label": "2020-04-18", "week_number_label": "2020W16", "week_start_label": "2020-04-13"}, {"date": 20200419, "state": "AK", "positive": 319, "probableCases": null, "negative": 9576, "pending": null, "totalTestResultsSource": "totalTestsViral", "totalTestResults": 9895, "hospitalizedCurrently": 37, "hospitalizedCumulative": 37, "inIcuCurrently": null, "inIcuCumulative": null, "onVentilatorCurrently": null, "onVentilatorCumulative": null, "recovered": 153, "dataQualityGrade": "A", "lastUpdateEt": "4/18/2020 17:45", "dateModified": "2020-04-18T17:45:00Z", "checkTimeEt": "04/18 13:45", "death": 9, "hospitalized": 37, "dateChecked": "2020-04-18T17:45:00Z", "totalTestsViral": 9895, "positiveTestsViral": null, "negativeTestsViral": null, "positiveCasesViral": null, "deathConfirmed": null, "deathProbable": null, "totalTestEncountersViral": null, "totalTestsPeopleViral": null, "totalTestsAntibody": null, "positiveTestsAntibody": null, "negativeTestsAntibody": null, "totalTestsPeopleAntibody": null, "positiveTestsPeopleAntibody": null, "negativeTestsPeopleAntibody": null, "totalTestsPeopleAntigen": null, "positiveTestsPeopleAntigen": null, "totalTestsAntigen": null, "positiveTestsAntigen": null, "fips": "02", "positiveIncrease": 5, "negativeIncrease": 235, "total": 9895, "totalTestResultsIncrease": 240, "posNeg": 9895, "deathIncrease": 0, "hospitalizedIncrease": 0, "hash": "0bd27acfb1aea5f52c4cd6f7de305bf51621df61", "commercialScore": 0, "negativeRegularScore": 0, "negativeScore": 0, "positiveScore": 0, "score": 0, "grade": "", "month_number_label": "2020-04", "date_label": "2020-04-19", "week_number_label": "2020W16", "week_start_label": "2020-04-13"}, {"date": 20200420, "state": "AK", "positive": 321, "probableCases": null, "negative": 9803, "pending": null, "totalTestResultsSource": "totalTestsViral", "totalTestResults": 10124, "hospitalizedCurrently": 46, "hospitalizedCumulative": 37, "inIcuCurrently": null, "inIcuCumulative": null, "onVentilatorCurrently": null, "onVentilatorCumulative": null, "recovered": 161, "dataQualityGrade": "A", "lastUpdateEt": "4/20/2020 14:00", "dateModified": "2020-04-20T14:00:00Z", "checkTimeEt": "04/20 10:00", "death": 9, "hospitalized": 37, "dateChecked": "2020-04-20T14:00:00Z", "totalTestsViral": 10124, "positiveTestsViral": null, "negativeTestsViral": null, "positiveCasesViral": null, "deathConfirmed": null, "deathProbable": null, "totalTestEncountersViral": null, "totalTestsPeopleViral": null, "totalTestsAntibody": null, "positiveTestsAntibody": null, "negativeTestsAntibody": null, "totalTestsPeopleAntibody": null, "positiveTestsPeopleAntibody": null, "negativeTestsPeopleAntibody": null, "totalTestsPeopleAntigen": null, "positiveTestsPeopleAntigen": null, "totalTestsAntigen": null, "positiveTestsAntigen": null, "fips": "02", "positiveIncrease": 2, "negativeIncrease": 227, "total": 10124, "totalTestResultsIncrease": 229, "posNeg": 10124, "deathIncrease": 0, "hospitalizedIncrease": 0, "hash": "a94c63d09560117b7bfd40830b63dd58d5c266a1", "commercialScore": 0, "negativeRegularScore": 0, "negativeScore": 0, "positiveScore": 0, "score": 0, "grade": "", "month_number_label": "2020-04", "date_label": "2020-04-20", "week_number_label": "2020W17", "week_start_label": "2020-04-20"}, {"date": 20200421, "state": "AK", "positive": 329, "probableCases": null, "negative": 10790, "pending": null, "totalTestResultsSource": "totalTestsViral", "totalTestResults": 11119, "hospitalizedCurrently": 42, "hospitalizedCumulative": 37, "inIcuCurrently": null, "inIcuCumulative": null, "onVentilatorCurrently": null, "onVentilatorCumulative": null, "recovered": 168, "dataQualityGrade": "A", "lastUpdateEt": "4/21/2020 15:15", "dateModified": "2020-04-21T15:15:00Z", "checkTimeEt": "04/21 11:15", "death": 9, "hospitalized": 37, "dateChecked": "2020-04-21T15:15:00Z", "totalTestsViral": 11119, "positiveTestsViral": null, "negativeTestsViral": null, "positiveCasesViral": null, "deathConfirmed": null, "deathProbable": null, "totalTestEncountersViral": null, "totalTestsPeopleViral": null, "totalTestsAntibody": null, "positiveTestsAntibody": null, "negativeTestsAntibody": null, "totalTestsPeopleAntibody": null, "positiveTestsPeopleAntibody": null, "negativeTestsPeopleAntibody": null, "totalTestsPeopleAntigen": null, "positiveTestsPeopleAntigen": null, "totalTestsAntigen": null, "positiveTestsAntigen": null, "fips": "02", "positiveIncrease": 8, "negativeIncrease": 987, "total": 11119, "totalTestResultsIncrease": 995, "posNeg": 11119, "deathIncrease": 0, "hospitalizedIncrease": 0, "hash": "c2787040e2f1e3b516fd7adef374ef0929c425ea", "commercialScore": 0, "negativeRegularScore": 0, "negativeScore": 0, "positiveScore": 0, "score": 0, "grade": "", "month_number_label": "2020-04", "date_label": "2020-04-21", "week_number_label": "2020W17", "week_start_label": "2020-04-20"}, {"date": 20200422, "state": "AK", "positive": 335, "probableCases": null, "negative": 11824, "pending": null, "totalTestResultsSource": "totalTestsViral", "totalTestResults": 12159, "hospitalizedCurrently": 39, "hospitalizedCumulative": 37, "inIcuCurrently": null, "inIcuCumulative": null, "onVentilatorCurrently": null, "onVentilatorCumulative": null, "recovered": 196, "dataQualityGrade": "A", "lastUpdateEt": "4/22/2020 14:00", "dateModified": "2020-04-22T14:00:00Z", "checkTimeEt": "04/22 10:00", "death": 9, "hospitalized": 37, "dateChecked": "2020-04-22T14:00:00Z", "totalTestsViral": 12159, "positiveTestsViral": null, "negativeTestsViral": null, "positiveCasesViral": null, "deathConfirmed": null, "deathProbable": null, "totalTestEncountersViral": null, "totalTestsPeopleViral": null, "totalTestsAntibody": null, "positiveTestsAntibody": null, "negativeTestsAntibody": null, "totalTestsPeopleAntibody": null, "positiveTestsPeopleAntibody": null, "negativeTestsPeopleAntibody": null, "totalTestsPeopleAntigen": null, "positiveTestsPeopleAntigen": null, "totalTestsAntigen": null, "positiveTestsAntigen": null, "fips": "02", "positiveIncrease": 6, "negativeIncrease": 1034, "total": 12159, "totalTestResultsIncrease": 1040, "posNeg": 12159, "deathIncrease": 0, "hospitalizedIncrease": 0, "hash": "e73a35e459d8222267b18ba6aca6fec840ac00f7", "commercialScore": 0, "negativeRegularScore": 0, "negativeScore": 0, "positiveScore": 0, "score": 0, "grade": "", "month_number_label": "2020-04", "date_label": "2020-04-22", "week_number_label": "2020W17", "week_start_label": "2020-04-20"}, {"date": 20200423, "state": "AK", "positive": 337, "probableCases": null, "negative": 11824, "pending": null, "totalTestResultsSource": "totalTestsViral", "totalTestResults": 12161, "hospitalizedCurrently": 42, "hospitalizedCumulative": 37, "inIcuCurrently": null, "inIcuCumulative": null, "onVentilatorCurrently": null, "onVentilatorCumulative": null, "recovered": 209, "dataQualityGrade": "A", "lastUpdateEt": "4/23/2020 14:00", "dateModified": "2020-04-23T14:00:00Z", "checkTimeEt": "04/23 10:00", "death": 9, "hospitalized": 37, "dateChecked": "2020-04-23T14:00:00Z", "totalTestsViral": 12161, "positiveTestsViral": null, "negativeTestsViral": null, "positiveCasesViral": null, "deathConfirmed": null, "deathProbable": null, "totalTestEncountersViral": null, "totalTestsPeopleViral": null, "totalTestsAntibody": null, "positiveTestsAntibody": null, "negativeTestsAntibody": null, "totalTestsPeopleAntibody": null, "positiveTestsPeopleAntibody": null, "negativeTestsPeopleAntibody": null, "totalTestsPeopleAntigen": null, "positiveTestsPeopleAntigen": null, "totalTestsAntigen": null, "positiveTestsAntigen": null, "fips": "02", "positiveIncrease": 2, "negativeIncrease": 0, "total": 12161, "totalTestResultsIncrease": 2, "posNeg": 12161, "deathIncrease": 0, "hospitalizedIncrease": 0, "hash": "2baa9e52e73bc51260f3507c063ec1b16328e148", "commercialScore": 0, "negativeRegularScore": 0, "negativeScore": 0, "positiveScore": 0, "score": 0, "grade": "", "month_number_label": "2020-04", "date_label": "2020-04-23", "week_number_label": "2020W17", "week_start_label": "2020-04-20"}, {"date": 20200424, "state": "AK", "positive": 339, "probableCases": null, "negative": 11942, "pending": null, "totalTestResultsSource": "totalTestsViral", "totalTestResults": 12281, "hospitalizedCurrently": 36, "hospitalizedCumulative": 37, "inIcuCurrently": null, "inIcuCumulative": null, "onVentilatorCurrently": null, "onVentilatorCumulative": null, "recovered": 208, "dataQualityGrade": "A", "lastUpdateEt": "4/24/2020 15:00", "dateModified": "2020-04-24T15:00:00Z", "checkTimeEt": "04/24 11:00", "death": 9, "hospitalized": 37, "dateChecked": "2020-04-24T15:00:00Z", "totalTestsViral": 12281, "positiveTestsViral": null, "negativeTestsViral": null, "positiveCasesViral": null, "deathConfirmed": null, "deathProbable": null, "totalTestEncountersViral": null, "totalTestsPeopleViral": null, "totalTestsAntibody": null, "positiveTestsAntibody": null, "negativeTestsAntibody": null, "totalTestsPeopleAntibody": null, "positiveTestsPeopleAntibody": null, "negativeTestsPeopleAntibody": null, "totalTestsPeopleAntigen": null, "positiveTestsPeopleAntigen": null, "totalTestsAntigen": null, "positiveTestsAntigen": null, "fips": "02", "positiveIncrease": 2, "negativeIncrease": 118, "total": 12281, "totalTestResultsIncrease": 120, "posNeg": 12281, "deathIncrease": 0, "hospitalizedIncrease": 0, "hash": "d38255abfac81a1f33423897cf00a29c6099bca4", "commercialScore": 0, "negativeRegularScore": 0, "negativeScore": 0, "positiveScore": 0, "score": 0, "grade": "", "month_number_label": "2020-04", "date_label": "2020-04-24", "week_number_label": "2020W17", "week_start_label": "2020-04-20"}, {"date": 20200425, "state": "AK", "positive": 339, "probableCases": null, "negative": 15393, "pending": null, "totalTestResultsSource": "totalTestsViral", "totalTestResults": 15732, "hospitalizedCurrently": 32, "hospitalizedCumulative": 37, "inIcuCurrently": null, "inIcuCumulative": null, "onVentilatorCurrently": null, "onVentilatorCumulative": null, "recovered": 217, "dataQualityGrade": "B", "lastUpdateEt": "4/25/2020 16:00", "dateModified": "2020-04-25T16:00:00Z", "checkTimeEt": "04/25 12:00", "death": 9, "hospitalized": 37, "dateChecked": "2020-04-25T16:00:00Z", "totalTestsViral": 15732, "positiveTestsViral": null, "negativeTestsViral": null, "positiveCasesViral": null, "deathConfirmed": null, "deathProbable": null, "totalTestEncountersViral": null, "totalTestsPeopleViral": null, "totalTestsAntibody": null, "positiveTestsAntibody": null, "negativeTestsAntibody": null, "totalTestsPeopleAntibody": null, "positiveTestsPeopleAntibody": null, "negativeTestsPeopleAntibody": null, "totalTestsPeopleAntigen": null, "positiveTestsPeopleAntigen": null, "totalTestsAntigen": null, "positiveTestsAntigen": null, "fips": "02", "positiveIncrease": 0, "negativeIncrease": 3451, "total": 15732, "totalTestResultsIncrease": 3451, "posNeg": 15732, "deathIncrease": 0, "hospitalizedIncrease": 0, "hash": "afb7f2aa090936246b99926df1bc110511d9665f", "commercialScore": 0, "negativeRegularScore": 0, "negativeScore": 0, "positiveScore": 0, "score": 0, "grade": "", "month_number_label": "2020-04", "date_label": "2020-04-25", "week_number_label": "2020W17", "week_start_label": "2020-04-20"}, {"date": 20200426, "state": "AK", "positive": 341, "probableCases": null, "negative": 15836, "pending": null, "totalTestResultsSource": "totalTestsViral", "totalTestResults": 16177, "hospitalizedCurrently": 14, "hospitalizedCumulative": 37, "inIcuCurrently": null, "inIcuCumulative": null, "onVentilatorCurrently": null, "onVentilatorCumulative": null, "recovered": 217, "dataQualityGrade": "B", "lastUpdateEt": "4/26/2020 14:15", "dateModified": "2020-04-26T14:15:00Z", "checkTimeEt": "04/26 10:15", "death": 9, "hospitalized": 37, "dateChecked": "2020-04-26T14:15:00Z", "totalTestsViral": 16177, "positiveTestsViral": null, "negativeTestsViral": null, "positiveCasesViral": null, "deathConfirmed": null, "deathProbable": null, "totalTestEncountersViral": null, "totalTestsPeopleViral": null, "totalTestsAntibody": null, "positiveTestsAntibody": null, "negativeTestsAntibody": null, "totalTestsPeopleAntibody": null, "positiveTestsPeopleAntibody": null, "negativeTestsPeopleAntibody": null, "totalTestsPeopleAntigen": null, "positiveTestsPeopleAntigen": null, "totalTestsAntigen": null, "positiveTestsAntigen": null, "fips": "02", "positiveIncrease": 2, "negativeIncrease": 443, "total": 16177, "totalTestResultsIncrease": 445, "posNeg": 16177, "deathIncrease": 0, "hospitalizedIncrease": 0, "hash": "3980ea92ef85c0f207bba8b3128a1a8cc6d26dbe", "commercialScore": 0, "negativeRegularScore": 0, "negativeScore": 0, "positiveScore": 0, "score": 0, "grade": "", "month_number_label": "2020-04", "date_label": "2020-04-26", "week_number_label": "2020W17", "week_start_label": "2020-04-20"}, {"date": 20200427, "state": "AK", "positive": 345, "probableCases": null, "negative": 15911, "pending": null, "totalTestResultsSource": "totalTestsViral", "totalTestResults": 16256, "hospitalizedCurrently": 10, "hospitalizedCumulative": 37, "inIcuCurrently": null, "inIcuCumulative": null, "onVentilatorCurrently": null, "onVentilatorCumulative": null, "recovered": 218, "dataQualityGrade": "B", "lastUpdateEt": "4/27/2020 14:00", "dateModified": "2020-04-27T14:00:00Z", "checkTimeEt": "04/27 10:00", "death": 9, "hospitalized": 37, "dateChecked": "2020-04-27T14:00:00Z", "totalTestsViral": 16256, "positiveTestsViral": null, "negativeTestsViral": null, "positiveCasesViral": null, "deathConfirmed": null, "deathProbable": null, "totalTestEncountersViral": null, "totalTestsPeopleViral": null, "totalTestsAntibody": null, "positiveTestsAntibody": null, "negativeTestsAntibody": null, "totalTestsPeopleAntibody": null, "positiveTestsPeopleAntibody": null, "negativeTestsPeopleAntibody": null, "totalTestsPeopleAntigen": null, "positiveTestsPeopleAntigen": null, "totalTestsAntigen": null, "positiveTestsAntigen": null, "fips": "02", "positiveIncrease": 4, "negativeIncrease": 75, "total": 16256, "totalTestResultsIncrease": 79, "posNeg": 16256, "deathIncrease": 0, "hospitalizedIncrease": 0, "hash": "b385d8ca64a76d97fd3a0bfe1a62a1f918697264", "commercialScore": 0, "negativeRegularScore": 0, "negativeScore": 0, "positiveScore": 0, "score": 0, "grade": "", "month_number_label": "2020-04", "date_label": "2020-04-27", "week_number_label": "2020W18", "week_start_label": "2020-04-27"}, {"date": 20200428, "state": "AK", "positive": 351, "probableCases": null, "negative": 16738, "pending": null, "totalTestResultsSource": "totalTestsViral", "totalTestResults": 17089, "hospitalizedCurrently": 16, "hospitalizedCumulative": 38, "inIcuCurrently": null, "inIcuCumulative": null, "onVentilatorCurrently": null, "onVentilatorCumulative": null, "recovered": 228, "dataQualityGrade": "B", "lastUpdateEt": "4/28/2020 14:50", "dateModified": "2020-04-28T14:50:00Z", "checkTimeEt": "04/28 10:50", "death": 9, "hospitalized": 38, "dateChecked": "2020-04-28T14:50:00Z", "totalTestsViral": 17089, "positiveTestsViral": null, "negativeTestsViral": null, "positiveCasesViral": null, "deathConfirmed": null, "deathProbable": null, "totalTestEncountersViral": null, "totalTestsPeopleViral": null, "totalTestsAntibody": null, "positiveTestsAntibody": null, "negativeTestsAntibody": null, "totalTestsPeopleAntibody": null, "positiveTestsPeopleAntibody": null, "negativeTestsPeopleAntibody": null, "totalTestsPeopleAntigen": null, "positiveTestsPeopleAntigen": null, "totalTestsAntigen": null, "positiveTestsAntigen": null, "fips": "02", "positiveIncrease": 6, "negativeIncrease": 827, "total": 17089, "totalTestResultsIncrease": 833, "posNeg": 17089, "deathIncrease": 0, "hospitalizedIncrease": 1, "hash": "174c31159794201ceebd938bfd3ca267430cbc2b", "commercialScore": 0, "negativeRegularScore": 0, "negativeScore": 0, "positiveScore": 0, "score": 0, "grade": "", "month_number_label": "2020-04", "date_label": "2020-04-28", "week_number_label": "2020W18", "week_start_label": "2020-04-27"}, {"date": 20200429, "state": "AK", "positive": 355, "probableCases": null, "negative": 18764, "pending": null, "totalTestResultsSource": "totalTestsViral", "totalTestResults": 19119, "hospitalizedCurrently": 14, "hospitalizedCumulative": 38, "inIcuCurrently": null, "inIcuCumulative": null, "onVentilatorCurrently": null, "onVentilatorCumulative": null, "recovered": 240, "dataQualityGrade": "B", "lastUpdateEt": "4/28/2020 14:50", "dateModified": "2020-04-28T14:50:00Z", "checkTimeEt": "04/28 10:50", "death": 9, "hospitalized": 38, "dateChecked": "2020-04-28T14:50:00Z", "totalTestsViral": 19119, "positiveTestsViral": null, "negativeTestsViral": null, "positiveCasesViral": null, "deathConfirmed": null, "deathProbable": null, "totalTestEncountersViral": null, "totalTestsPeopleViral": null, "totalTestsAntibody": null, "positiveTestsAntibody": null, "negativeTestsAntibody": null, "totalTestsPeopleAntibody": null, "positiveTestsPeopleAntibody": null, "negativeTestsPeopleAntibody": null, "totalTestsPeopleAntigen": null, "positiveTestsPeopleAntigen": null, "totalTestsAntigen": null, "positiveTestsAntigen": null, "fips": "02", "positiveIncrease": 4, "negativeIncrease": 2026, "total": 19119, "totalTestResultsIncrease": 2030, "posNeg": 19119, "deathIncrease": 0, "hospitalizedIncrease": 0, "hash": "b4bdd28b27f1896c93fa2f700810e33ec2e709a4", "commercialScore": 0, "negativeRegularScore": 0, "negativeScore": 0, "positiveScore": 0, "score": 0, "grade": "", "month_number_label": "2020-04", "date_label": "2020-04-29", "week_number_label": "2020W18", "week_start_label": "2020-04-27"}, {"date": 20200430, "state": "AK", "positive": 355, "probableCases": null, "negative": 18764, "pending": null, "totalTestResultsSource": "totalTestsViral", "totalTestResults": 19119, "hospitalizedCurrently": 19, "hospitalizedCumulative": 38, "inIcuCurrently": null, "inIcuCumulative": null, "onVentilatorCurrently": null, "onVentilatorCumulative": null, "recovered": 252, "dataQualityGrade": "C", "lastUpdateEt": "4/30/2020 15:00", "dateModified": "2020-04-30T15:00:00Z", "checkTimeEt": "04/30 11:00", "death": 9, "hospitalized": 38, "dateChecked": "2020-04-30T15:00:00Z", "totalTestsViral": 19119, "positiveTestsViral": null, "negativeTestsViral": null, "positiveCasesViral": null, "deathConfirmed": null, "deathProbable": null, "totalTestEncountersViral": null, "totalTestsPeopleViral": null, "totalTestsAntibody": null, "positiveTestsAntibody": null, "negativeTestsAntibody": null, "totalTestsPeopleAntibody": null, "positiveTestsPeopleAntibody": null, "negativeTestsPeopleAntibody": null, "totalTestsPeopleAntigen": null, "positiveTestsPeopleAntigen": null, "totalTestsAntigen": null, "positiveTestsAntigen": null, "fips": "02", "positiveIncrease": 0, "negativeIncrease": 0, "total": 19119, "totalTestResultsIncrease": 0, "posNeg": 19119, "deathIncrease": 0, "hospitalizedIncrease": 0, "hash": "1d86000493148bd1331cc90d304d22e4f2d4e037", "commercialScore": 0, "negativeRegularScore": 0, "negativeScore": 0, "positiveScore": 0, "score": 0, "grade": "", "month_number_label": "2020-04", "date_label": "2020-04-30", "week_number_label": "2020W18", "week_start_label": "2020-04-27"}, {"date": 20200501, "state": "AK", "positive": 364, "probableCases": null, "negative": 19961, "pending": null, "totalTestResultsSource": "totalTestsViral", "totalTestResults": 20325, "hospitalizedCurrently": 25, "hospitalizedCumulative": 39, "inIcuCurrently": null, "inIcuCumulative": null, "onVentilatorCurrently": null, "onVentilatorCumulative": null, "recovered": 254, "dataQualityGrade": "C", "lastUpdateEt": "5/1/2020 14:00", "dateModified": "2020-05-01T14:00:00Z", "checkTimeEt": "05/01 10:00", "death": 9, "hospitalized": 39, "dateChecked": "2020-05-01T14:00:00Z", "totalTestsViral": 20325, "positiveTestsViral": null, "negativeTestsViral": null, "positiveCasesViral": null, "deathConfirmed": null, "deathProbable": null, "totalTestEncountersViral": null, "totalTestsPeopleViral": null, "totalTestsAntibody": null, "positiveTestsAntibody": null, "negativeTestsAntibody": null, "totalTestsPeopleAntibody": null, "positiveTestsPeopleAntibody": null, "negativeTestsPeopleAntibody": null, "totalTestsPeopleAntigen": null, "positiveTestsPeopleAntigen": null, "totalTestsAntigen": null, "positiveTestsAntigen": null, "fips": "02", "positiveIncrease": 9, "negativeIncrease": 1197, "total": 20325, "totalTestResultsIncrease": 1206, "posNeg": 20325, "deathIncrease": 0, "hospitalizedIncrease": 1, "hash": "474dcb46c407c8b82c691d3b8911a6fc46f26944", "commercialScore": 0, "negativeRegularScore": 0, "negativeScore": 0, "positiveScore": 0, "score": 0, "grade": "", "month_number_label": "2020-05", "date_label": "2020-05-01", "week_number_label": "2020W18", "week_start_label": "2020-04-27"}, {"date": 20200502, "state": "AK", "positive": 365, "probableCases": null, "negative": 21034, "pending": null, "totalTestResultsSource": "totalTestsViral", "totalTestResults": 21399, "hospitalizedCurrently": 10, "hospitalizedCumulative": 39, "inIcuCurrently": null, "inIcuCumulative": null, "onVentilatorCurrently": null, "onVentilatorCumulative": null, "recovered": 261, "dataQualityGrade": "C", "lastUpdateEt": "5/2/2020 00:00", "dateModified": "2020-05-02T00:00:00Z", "checkTimeEt": "05/01 20:00", "death": 9, "hospitalized": 39, "dateChecked": "2020-05-02T00:00:00Z", "totalTestsViral": 21399, "positiveTestsViral": null, "negativeTestsViral": null, "positiveCasesViral": null, "deathConfirmed": null, "deathProbable": null, "totalTestEncountersViral": null, "totalTestsPeopleViral": null, "totalTestsAntibody": null, "positiveTestsAntibody": null, "negativeTestsAntibody": null, "totalTestsPeopleAntibody": null, "positiveTestsPeopleAntibody": null, "negativeTestsPeopleAntibody": null, "totalTestsPeopleAntigen": null, "positiveTestsPeopleAntigen": null, "totalTestsAntigen": null, "positiveTestsAntigen": null, "fips": "02", "positiveIncrease": 1, "negativeIncrease": 1073, "total": 21399, "totalTestResultsIncrease": 1074, "posNeg": 21399, "deathIncrease": 0, "hospitalizedIncrease": 0, "hash": "0a9422feb3c9113be9dc6cabdd1a8b44a401b4e1", "commercialScore": 0, "negativeRegularScore": 0, "negativeScore": 0, "positiveScore": 0, "score": 0, "grade": "", "month_number_label": "2020-05", "date_label": "2020-05-02", "week_number_label": "2020W18", "week_start_label": "2020-04-27"}, {"date": 20200503, "state": "AK", "positive": 368, "probableCases": null, "negative": 21210, "pending": null, "totalTestResultsSource": "totalTestsViral", "totalTestResults": 21578, "hospitalizedCurrently": 12, "hospitalizedCumulative": 39, "inIcuCurrently": null, "inIcuCumulative": null, "onVentilatorCurrently": null, "onVentilatorCumulative": null, "recovered": 262, "dataQualityGrade": "C", "lastUpdateEt": "5/3/2020 14:15", "dateModified": "2020-05-03T14:15:00Z", "checkTimeEt": "05/03 10:15", "death": 9, "hospitalized": 39, "dateChecked": "2020-05-03T14:15:00Z", "totalTestsViral": 21578, "positiveTestsViral": null, "negativeTestsViral": null, "positiveCasesViral": null, "deathConfirmed": 9, "deathProbable": null, "totalTestEncountersViral": null, "totalTestsPeopleViral": null, "totalTestsAntibody": null, "positiveTestsAntibody": null, "negativeTestsAntibody": null, "totalTestsPeopleAntibody": null, "positiveTestsPeopleAntibody": null, "negativeTestsPeopleAntibody": null, "totalTestsPeopleAntigen": null, "positiveTestsPeopleAntigen": null, "totalTestsAntigen": null, "positiveTestsAntigen": null, "fips": "02", "positiveIncrease": 3, "negativeIncrease": 176, "total": 21578, "totalTestResultsIncrease": 179, "posNeg": 21578, "deathIncrease": 0, "hospitalizedIncrease": 0, "hash": "3f6ab9bd952c2a00947651c9dda92aaf5709423b", "commercialScore": 0, "negativeRegularScore": 0, "negativeScore": 0, "positiveScore": 0, "score": 0, "grade": "", "month_number_label": "2020-05", "date_label": "2020-05-03", "week_number_label": "2020W18", "week_start_label": "2020-04-27"}, {"date": 20200504, "state": "AK", "positive": 370, "probableCases": null, "negative": 21353, "pending": null, "totalTestResultsSource": "totalTestsViral", "totalTestResults": 21723, "hospitalizedCurrently": 12, "hospitalizedCumulative": 39, "inIcuCurrently": null, "inIcuCumulative": null, "onVentilatorCurrently": null, "onVentilatorCumulative": null, "recovered": 263, "dataQualityGrade": "C", "lastUpdateEt": "5/4/2020 00:00", "dateModified": "2020-05-04T00:00:00Z", "checkTimeEt": "05/03 20:00", "death": 9, "hospitalized": 39, "dateChecked": "2020-05-04T00:00:00Z", "totalTestsViral": 21723, "positiveTestsViral": null, "negativeTestsViral": null, "positiveCasesViral": null, "deathConfirmed": 9, "deathProbable": null, "totalTestEncountersViral": null, "totalTestsPeopleViral": null, "totalTestsAntibody": null, "positiveTestsAntibody": null, "negativeTestsAntibody": null, "totalTestsPeopleAntibody": null, "positiveTestsPeopleAntibody": null, "negativeTestsPeopleAntibody": null, "totalTestsPeopleAntigen": null, "positiveTestsPeopleAntigen": null, "totalTestsAntigen": null, "positiveTestsAntigen": null, "fips": "02", "positiveIncrease": 2, "negativeIncrease": 143, "total": 21723, "totalTestResultsIncrease": 145, "posNeg": 21723, "deathIncrease": 0, "hospitalizedIncrease": 0, "hash": "88b9e1d2da9cb01eaccb13301b60eacf9990972d", "commercialScore": 0, "negativeRegularScore": 0, "negativeScore": 0, "positiveScore": 0, "score": 0, "grade": "", "month_number_label": "2020-05", "date_label": "2020-05-04", "week_number_label": "2020W19", "week_start_label": "2020-05-04"}, {"date": 20200505, "state": "AK", "positive": 371, "probableCases": null, "negative": 22321, "pending": null, "totalTestResultsSource": "totalTestsViral", "totalTestResults": 22692, "hospitalizedCurrently": 13, "hospitalizedCumulative": 40, "inIcuCurrently": null, "inIcuCumulative": null, "onVentilatorCurrently": null, "onVentilatorCumulative": null, "recovered": 277, "dataQualityGrade": "C", "lastUpdateEt": "5/5/2020 00:00", "dateModified": "2020-05-05T00:00:00Z", "checkTimeEt": "05/04 20:00", "death": 9, "hospitalized": 40, "dateChecked": "2020-05-05T00:00:00Z", "totalTestsViral": 22692, "positiveTestsViral": null, "negativeTestsViral": null, "positiveCasesViral": null, "deathConfirmed": 9, "deathProbable": null, "totalTestEncountersViral": null, "totalTestsPeopleViral": null, "totalTestsAntibody": null, "positiveTestsAntibody": null, "negativeTestsAntibody": null, "totalTestsPeopleAntibody": null, "positiveTestsPeopleAntibody": null, "negativeTestsPeopleAntibody": null, "totalTestsPeopleAntigen": null, "positiveTestsPeopleAntigen": null, "totalTestsAntigen": null, "positiveTestsAntigen": null, "fips": "02", "positiveIncrease": 1, "negativeIncrease": 968, "total": 22692, "totalTestResultsIncrease": 969, "posNeg": 22692, "deathIncrease": 0, "hospitalizedIncrease": 1, "hash": "c94752f3a1745cbc76d012364b3178bbce1f9796", "commercialScore": 0, "negativeRegularScore": 0, "negativeScore": 0, "positiveScore": 0, "score": 0, "grade": "", "month_number_label": "2020-05", "date_label": "2020-05-05", "week_number_label": "2020W19", "week_start_label": "2020-05-04"}, {"date": 20200506, "state": "AK", "positive": 372, "probableCases": null, "negative": 23283, "pending": null, "totalTestResultsSource": "totalTestsViral", "totalTestResults": 23655, "hospitalizedCurrently": 8, "hospitalizedCumulative": 41, "inIcuCurrently": null, "inIcuCumulative": null, "onVentilatorCurrently": null, "onVentilatorCumulative": null, "recovered": 284, "dataQualityGrade": "C", "lastUpdateEt": "5/6/2020 00:00", "dateModified": "2020-05-06T00:00:00Z", "checkTimeEt": "05/05 20:00", "death": 10, "hospitalized": 41, "dateChecked": "2020-05-06T00:00:00Z", "totalTestsViral": 23655, "positiveTestsViral": null, "negativeTestsViral": null, "positiveCasesViral": null, "deathConfirmed": 10, "deathProbable": null, "totalTestEncountersViral": null, "totalTestsPeopleViral": null, "totalTestsAntibody": null, "positiveTestsAntibody": null, "negativeTestsAntibody": null, "totalTestsPeopleAntibody": null, "positiveTestsPeopleAntibody": null, "negativeTestsPeopleAntibody": null, "totalTestsPeopleAntigen": null, "positiveTestsPeopleAntigen": null, "totalTestsAntigen": null, "positiveTestsAntigen": null, "fips": "02", "positiveIncrease": 1, "negativeIncrease": 962, "total": 23655, "totalTestResultsIncrease": 963, "posNeg": 23655, "deathIncrease": 1, "hospitalizedIncrease": 1, "hash": "a9c515dd4ceedeb26446ba2d334548e12d20a352", "commercialScore": 0, "negativeRegularScore": 0, "negativeScore": 0, "positiveScore": 0, "score": 0, "grade": "", "month_number_label": "2020-05", "date_label": "2020-05-06", "week_number_label": "2020W19", "week_start_label": "2020-05-04"}, {"date": 20200507, "state": "AK", "positive": 374, "probableCases": null, "negative": 23967, "pending": null, "totalTestResultsSource": "totalTestsViral", "totalTestResults": 24341, "hospitalizedCurrently": 12, "hospitalizedCumulative": 41, "inIcuCurrently": null, "inIcuCumulative": null, "onVentilatorCurrently": null, "onVentilatorCumulative": null, "recovered": 291, "dataQualityGrade": "C", "lastUpdateEt": "5/7/2020 00:00", "dateModified": "2020-05-07T00:00:00Z", "checkTimeEt": "05/06 20:00", "death": 10, "hospitalized": 41, "dateChecked": "2020-05-07T00:00:00Z", "totalTestsViral": 24341, "positiveTestsViral": null, "negativeTestsViral": null, "positiveCasesViral": null, "deathConfirmed": 10, "deathProbable": null, "totalTestEncountersViral": null, "totalTestsPeopleViral": null, "totalTestsAntibody": null, "positiveTestsAntibody": null, "negativeTestsAntibody": null, "totalTestsPeopleAntibody": null, "positiveTestsPeopleAntibody": null, "negativeTestsPeopleAntibody": null, "totalTestsPeopleAntigen": null, "positiveTestsPeopleAntigen": null, "totalTestsAntigen": null, "positiveTestsAntigen": null, "fips": "02", "positiveIncrease": 2, "negativeIncrease": 684, "total": 24341, "totalTestResultsIncrease": 686, "posNeg": 24341, "deathIncrease": 0, "hospitalizedIncrease": 0, "hash": "b4a4a6c6a028620dc32bb87391834438ade59898", "commercialScore": 0, "negativeRegularScore": 0, "negativeScore": 0, "positiveScore": 0, "score": 0, "grade": "", "month_number_label": "2020-05", "date_label": "2020-05-07", "week_number_label": "2020W19", "week_start_label": "2020-05-04"}, {"date": 20200508, "state": "AK", "positive": 377, "probableCases": null, "negative": 25096, "pending": null, "totalTestResultsSource": "totalTestsViral", "totalTestResults": 25473, "hospitalizedCurrently": 16, "hospitalizedCumulative": 41, "inIcuCurrently": null, "inIcuCumulative": null, "onVentilatorCurrently": null, "onVentilatorCumulative": null, "recovered": 305, "dataQualityGrade": "C", "lastUpdateEt": "5/8/2020 00:00", "dateModified": "2020-05-08T00:00:00Z", "checkTimeEt": "05/07 20:00", "death": 10, "hospitalized": 41, "dateChecked": "2020-05-08T00:00:00Z", "totalTestsViral": 25473, "positiveTestsViral": null, "negativeTestsViral": null, "positiveCasesViral": null, "deathConfirmed": 10, "deathProbabl