[{"date": 20200301, "state": "WY", "positive": null, "probableCases": null, "negative": null, "pending": null, "totalTestResultsSource": "totalTestsViral", "totalTestResults": 1, "hospitalizedCurrently": null, "hospitalizedCumulative": null, "inIcuCurrently": null, "inIcuCumulative": null, "onVentilatorCurrently": null, "onVentilatorCumulative": null, "recovered": null, "dataQualityGrade": null, "lastUpdateEt": null, "dateModified": null, "checkTimeEt": null, "death": null, "hospitalized": null, "dateChecked": null, "totalTestsViral": 1, "positiveTestsViral": 0, "negativeTestsViral": 1, "positiveCasesViral": null, "deathConfirmed": null, "deathProbable": null, "totalTestEncountersViral": null, "totalTestsPeopleViral": null, "totalTestsAntibody": null, "positiveTestsAntibody": null, "negativeTestsAntibody": null, "totalTestsPeopleAntibody": null, "positiveTestsPeopleAntibody": null, "negativeTestsPeopleAntibody": null, "totalTestsPeopleAntigen": null, "positiveTestsPeopleAntigen": null, "totalTestsAntigen": null, "positiveTestsAntigen": null, "fips": "56", "positiveIncrease": 0, "negativeIncrease": 0, "total": 0, "totalTestResultsIncrease": 0, "posNeg": 0, "deathIncrease": 0, "hospitalizedIncrease": 0, "hash": "5239a8cdd70a63bcaa9fad1541a3b6102e2ef445", "commercialScore": 0, "negativeRegularScore": 0, "negativeScore": 0, "positiveScore": 0, "score": 0, "grade": "", "month_number_label": "2020-03", "date_label": "2020-03-01", "week_number_label": "2020W09", "week_start_label": "2020-02-24"}, {"date": 20200302, "state": "WY", "positive": null, "probableCases": null, "negative": null, "pending": null, "totalTestResultsSource": "totalTestsViral", "totalTestResults": 1, "hospitalizedCurrently": null, "hospitalizedCumulative": null, "inIcuCurrently": null, "inIcuCumulative": null, "onVentilatorCurrently": null, "onVentilatorCumulative": null, "recovered": null, "dataQualityGrade": null, "lastUpdateEt": null, "dateModified": null, "checkTimeEt": null, "death": null, "hospitalized": null, "dateChecked": null, "totalTestsViral": 1, "positiveTestsViral": 0, "negativeTestsViral": 1, "positiveCasesViral": null, "deathConfirmed": null, "deathProbable": null, "totalTestEncountersViral": null, "totalTestsPeopleViral": null, "totalTestsAntibody": null, "positiveTestsAntibody": null, "negativeTestsAntibody": null, "totalTestsPeopleAntibody": null, "positiveTestsPeopleAntibody": null, "negativeTestsPeopleAntibody": null, "totalTestsPeopleAntigen": null, "positiveTestsPeopleAntigen": null, "totalTestsAntigen": null, "positiveTestsAntigen": null, "fips": "56", "positiveIncrease": 0, "negativeIncrease": 0, "total": 0, "totalTestResultsIncrease": 0, "posNeg": 0, "deathIncrease": 0, "hospitalizedIncrease": 0, "hash": "7092f1f9101b03e9c7c7debfa854d979c6069e0d", "commercialScore": 0, "negativeRegularScore": 0, "negativeScore": 0, "positiveScore": 0, "score": 0, "grade": "", "month_number_label": "2020-03", "date_label": "2020-03-02", "week_number_label": "2020W10", "week_start_label": "2020-03-02"}, {"date": 20200303, "state": "WY", "positive": null, "probableCases": null, "negative": null, "pending": null, "totalTestResultsSource": "totalTestsViral", "totalTestResults": 1, "hospitalizedCurrently": null, "hospitalizedCumulative": null, "inIcuCurrently": null, "inIcuCumulative": null, "onVentilatorCurrently": null, "onVentilatorCumulative": null, "recovered": null, "dataQualityGrade": null, "lastUpdateEt": null, "dateModified": null, "checkTimeEt": null, "death": null, "hospitalized": null, "dateChecked": null, "totalTestsViral": 1, "positiveTestsViral": 0, "negativeTestsViral": 1, "positiveCasesViral": null, "deathConfirmed": null, "deathProbable": null, "totalTestEncountersViral": null, "totalTestsPeopleViral": null, "totalTestsAntibody": null, "positiveTestsAntibody": null, "negativeTestsAntibody": null, "totalTestsPeopleAntibody": null, "positiveTestsPeopleAntibody": null, "negativeTestsPeopleAntibody": null, "totalTestsPeopleAntigen": null, "positiveTestsPeopleAntigen": null, "totalTestsAntigen": null, "positiveTestsAntigen": null, "fips": "56", "positiveIncrease": 0, "negativeIncrease": 0, "total": 0, "totalTestResultsIncrease": 0, "posNeg": 0, "deathIncrease": 0, "hospitalizedIncrease": 0, "hash": "7b7dea974e701111bdd97b0e6c52963f1a733080", "commercialScore": 0, "negativeRegularScore": 0, "negativeScore": 0, "positiveScore": 0, "score": 0, "grade": "", "month_number_label": "2020-03", "date_label": "2020-03-03", "week_number_label": "2020W10", "week_start_label": "2020-03-02"}, {"date": 20200304, "state": "WY", "positive": null, "probableCases": null, "negative": null, "pending": null, "totalTestResultsSource": "totalTestsViral", "totalTestResults": 4, "hospitalizedCurrently": null, "hospitalizedCumulative": null, "inIcuCurrently": null, "inIcuCumulative": null, "onVentilatorCurrently": null, "onVentilatorCumulative": null, "recovered": null, "dataQualityGrade": null, "lastUpdateEt": null, "dateModified": null, "checkTimeEt": null, "death": null, "hospitalized": null, "dateChecked": null, "totalTestsViral": 4, "positiveTestsViral": 0, "negativeTestsViral": 4, "positiveCasesViral": null, "deathConfirmed": null, "deathProbable": null, "totalTestEncountersViral": null, "totalTestsPeopleViral": null, "totalTestsAntibody": null, "positiveTestsAntibody": null, "negativeTestsAntibody": null, "totalTestsPeopleAntibody": null, "positiveTestsPeopleAntibody": null, "negativeTestsPeopleAntibody": null, "totalTestsPeopleAntigen": null, "positiveTestsPeopleAntigen": null, "totalTestsAntigen": null, "positiveTestsAntigen": null, "fips": "56", "positiveIncrease": 0, "negativeIncrease": 0, "total": 0, "totalTestResultsIncrease": 3, "posNeg": 0, "deathIncrease": 0, "hospitalizedIncrease": 0, "hash": "ba5acffc398cd7acb48f18ab2322ebb321f0b7d8", "commercialScore": 0, "negativeRegularScore": 0, "negativeScore": 0, "positiveScore": 0, "score": 0, "grade": "", "month_number_label": "2020-03", "date_label": "2020-03-04", "week_number_label": "2020W10", "week_start_label": "2020-03-02"}, {"date": 20200305, "state": "WY", "positive": null, "probableCases": null, "negative": null, "pending": null, "totalTestResultsSource": "totalTestsViral", "totalTestResults": 8, "hospitalizedCurrently": null, "hospitalizedCumulative": null, "inIcuCurrently": null, "inIcuCumulative": null, "onVentilatorCurrently": null, "onVentilatorCumulative": null, "recovered": null, "dataQualityGrade": null, "lastUpdateEt": null, "dateModified": null, "checkTimeEt": null, "death": null, "hospitalized": null, "dateChecked": null, "totalTestsViral": 8, "positiveTestsViral": 0, "negativeTestsViral": 8, "positiveCasesViral": null, "deathConfirmed": null, "deathProbable": null, "totalTestEncountersViral": null, "totalTestsPeopleViral": null, "totalTestsAntibody": null, "positiveTestsAntibody": null, "negativeTestsAntibody": null, "totalTestsPeopleAntibody": null, "positiveTestsPeopleAntibody": null, "negativeTestsPeopleAntibody": null, "totalTestsPeopleAntigen": null, "positiveTestsPeopleAntigen": null, "totalTestsAntigen": null, "positiveTestsAntigen": null, "fips": "56", "positiveIncrease": 0, "negativeIncrease": 0, "total": 0, "totalTestResultsIncrease": 4, "posNeg": 0, "deathIncrease": 0, "hospitalizedIncrease": 0, "hash": "0d196748ebd82f58ebb5f3ed0f179f24415238dd", "commercialScore": 0, "negativeRegularScore": 0, "negativeScore": 0, "positiveScore": 0, "score": 0, "grade": "", "month_number_label": "2020-03", "date_label": "2020-03-05", "week_number_label": "2020W10", "week_start_label": "2020-03-02"}, {"date": 20200306, "state": "WY", "positive": null, "probableCases": null, "negative": null, "pending": null, "totalTestResultsSource": "totalTestsViral", "totalTestResults": 8, "hospitalizedCurrently": null, "hospitalizedCumulative": null, "inIcuCurrently": null, "inIcuCumulative": null, "onVentilatorCurrently": null, "onVentilatorCumulative": null, "recovered": null, "dataQualityGrade": null, "lastUpdateEt": null, "dateModified": null, "checkTimeEt": null, "death": null, "hospitalized": null, "dateChecked": null, "totalTestsViral": 8, "positiveTestsViral": 0, "negativeTestsViral": 8, "positiveCasesViral": null, "deathConfirmed": null, "deathProbable": null, "totalTestEncountersViral": null, "totalTestsPeopleViral": null, "totalTestsAntibody": null, "positiveTestsAntibody": null, "negativeTestsAntibody": null, "totalTestsPeopleAntibody": null, "positiveTestsPeopleAntibody": null, "negativeTestsPeopleAntibody": null, "totalTestsPeopleAntigen": null, "positiveTestsPeopleAntigen": null, "totalTestsAntigen": null, "positiveTestsAntigen": null, "fips": "56", "positiveIncrease": 0, "negativeIncrease": 0, "total": 0, "totalTestResultsIncrease": 0, "posNeg": 0, "deathIncrease": 0, "hospitalizedIncrease": 0, "hash": "3313f4313d5cce2172645920481ce5152a2e2e06", "commercialScore": 0, "negativeRegularScore": 0, "negativeScore": 0, "positiveScore": 0, "score": 0, "grade": "", "month_number_label": "2020-03", "date_label": "2020-03-06", "week_number_label": "2020W10", "week_start_label": "2020-03-02"}, {"date": 20200307, "state": "WY", "positive": 0, "probableCases": null, "negative": null, "pending": null, "totalTestResultsSource": "totalTestsViral", "totalTestResults": 8, "hospitalizedCurrently": null, "hospitalizedCumulative": null, "inIcuCurrently": null, "inIcuCumulative": null, "onVentilatorCurrently": null, "onVentilatorCumulative": null, "recovered": null, "dataQualityGrade": null, "lastUpdateEt": null, "dateModified": null, "checkTimeEt": null, "death": null, "hospitalized": null, "dateChecked": null, "totalTestsViral": 8, "positiveTestsViral": 0, "negativeTestsViral": 8, "positiveCasesViral": null, "deathConfirmed": null, "deathProbable": null, "totalTestEncountersViral": null, "totalTestsPeopleViral": null, "totalTestsAntibody": null, "positiveTestsAntibody": null, "negativeTestsAntibody": null, "totalTestsPeopleAntibody": null, "positiveTestsPeopleAntibody": null, "negativeTestsPeopleAntibody": null, "totalTestsPeopleAntigen": null, "positiveTestsPeopleAntigen": null, "totalTestsAntigen": null, "positiveTestsAntigen": null, "fips": "56", "positiveIncrease": 0, "negativeIncrease": 0, "total": 0, "totalTestResultsIncrease": 0, "posNeg": 0, "deathIncrease": 0, "hospitalizedIncrease": 0, "hash": "7503b3dde66b189d678aad40281e3f3a1644db87", "commercialScore": 0, "negativeRegularScore": 0, "negativeScore": 0, "positiveScore": 0, "score": 0, "grade": "", "month_number_label": "2020-03", "date_label": "2020-03-07", "week_number_label": "2020W10", "week_start_label": "2020-03-02"}, {"date": 20200308, "state": "WY", "positive": 0, "probableCases": null, "negative": null, "pending": null, "totalTestResultsSource": "totalTestsViral", "totalTestResults": 9, "hospitalizedCurrently": null, "hospitalizedCumulative": null, "inIcuCurrently": null, "inIcuCumulative": null, "onVentilatorCurrently": null, "onVentilatorCumulative": null, "recovered": null, "dataQualityGrade": null, "lastUpdateEt": null, "dateModified": null, "checkTimeEt": null, "death": null, "hospitalized": null, "dateChecked": null, "totalTestsViral": 9, "positiveTestsViral": 0, "negativeTestsViral": 9, "positiveCasesViral": null, "deathConfirmed": null, "deathProbable": null, "totalTestEncountersViral": null, "totalTestsPeopleViral": null, "totalTestsAntibody": null, "positiveTestsAntibody": null, "negativeTestsAntibody": null, "totalTestsPeopleAntibody": null, "positiveTestsPeopleAntibody": null, "negativeTestsPeopleAntibody": null, "totalTestsPeopleAntigen": null, "positiveTestsPeopleAntigen": null, "totalTestsAntigen": null, "positiveTestsAntigen": null, "fips": "56", "positiveIncrease": 0, "negativeIncrease": 0, "total": 0, "totalTestResultsIncrease": 1, "posNeg": 0, "deathIncrease": 0, "hospitalizedIncrease": 0, "hash": "76aa28475fb505a97579bd7a3c08d5031e58a72e", "commercialScore": 0, "negativeRegularScore": 0, "negativeScore": 0, "positiveScore": 0, "score": 0, "grade": "", "month_number_label": "2020-03", "date_label": "2020-03-08", "week_number_label": "2020W10", "week_start_label": "2020-03-02"}, {"date": 20200309, "state": "WY", "positive": 0, "probableCases": null, "negative": null, "pending": null, "totalTestResultsSource": "totalTestsViral", "totalTestResults": 19, "hospitalizedCurrently": null, "hospitalizedCumulative": null, "inIcuCurrently": null, "inIcuCumulative": null, "onVentilatorCurrently": null, "onVentilatorCumulative": null, "recovered": null, "dataQualityGrade": null, "lastUpdateEt": null, "dateModified": null, "checkTimeEt": null, "death": null, "hospitalized": null, "dateChecked": null, "totalTestsViral": 19, "positiveTestsViral": 0, "negativeTestsViral": 19, "positiveCasesViral": null, "deathConfirmed": null, "deathProbable": null, "totalTestEncountersViral": null, "totalTestsPeopleViral": null, "totalTestsAntibody": null, "positiveTestsAntibody": null, "negativeTestsAntibody": null, "totalTestsPeopleAntibody": null, "positiveTestsPeopleAntibody": null, "negativeTestsPeopleAntibody": null, "totalTestsPeopleAntigen": null, "positiveTestsPeopleAntigen": null, "totalTestsAntigen": null, "positiveTestsAntigen": null, "fips": "56", "positiveIncrease": 0, "negativeIncrease": 0, "total": 0, "totalTestResultsIncrease": 10, "posNeg": 0, "deathIncrease": 0, "hospitalizedIncrease": 0, "hash": "cb35128ada2cc047026a504165f3ea94a043fcdf", "commercialScore": 0, "negativeRegularScore": 0, "negativeScore": 0, "positiveScore": 0, "score": 0, "grade": "", "month_number_label": "2020-03", "date_label": "2020-03-09", "week_number_label": "2020W11", "week_start_label": "2020-03-09"}, {"date": 20200310, "state": "WY", "positive": 0, "probableCases": null, "negative": 0, "pending": 0, "totalTestResultsSource": "totalTestsViral", "totalTestResults": 26, "hospitalizedCurrently": null, "hospitalizedCumulative": null, "inIcuCurrently": null, "inIcuCumulative": null, "onVentilatorCurrently": null, "onVentilatorCumulative": null, "recovered": null, "dataQualityGrade": null, "lastUpdateEt": null, "dateModified": null, "checkTimeEt": null, "death": null, "hospitalized": null, "dateChecked": null, "totalTestsViral": 26, "positiveTestsViral": 0, "negativeTestsViral": 26, "positiveCasesViral": null, "deathConfirmed": null, "deathProbable": null, "totalTestEncountersViral": null, "totalTestsPeopleViral": null, "totalTestsAntibody": null, "positiveTestsAntibody": null, "negativeTestsAntibody": null, "totalTestsPeopleAntibody": null, "positiveTestsPeopleAntibody": null, "negativeTestsPeopleAntibody": null, "totalTestsPeopleAntigen": null, "positiveTestsPeopleAntigen": null, "totalTestsAntigen": null, "positiveTestsAntigen": null, "fips": "56", "positiveIncrease": 0, "negativeIncrease": 0, "total": 0, "totalTestResultsIncrease": 7, "posNeg": 0, "deathIncrease": 0, "hospitalizedIncrease": 0, "hash": "9140ca95a975e87b1853940e332dbd9175c2bbc8", "commercialScore": 0, "negativeRegularScore": 0, "negativeScore": 0, "positiveScore": 0, "score": 0, "grade": "", "month_number_label": "2020-03", "date_label": "2020-03-10", "week_number_label": "2020W11", "week_start_label": "2020-03-09"}, {"date": 20200311, "state": "WY", "positive": 0, "probableCases": null, "negative": null, "pending": null, "totalTestResultsSource": "totalTestsViral", "totalTestResults": 37, "hospitalizedCurrently": null, "hospitalizedCumulative": null, "inIcuCurrently": null, "inIcuCumulative": null, "onVentilatorCurrently": null, "onVentilatorCumulative": null, "recovered": null, "dataQualityGrade": null, "lastUpdateEt": null, "dateModified": null, "checkTimeEt": null, "death": null, "hospitalized": null, "dateChecked": null, "totalTestsViral": 37, "positiveTestsViral": 0, "negativeTestsViral": 37, "positiveCasesViral": null, "deathConfirmed": null, "deathProbable": null, "totalTestEncountersViral": null, "totalTestsPeopleViral": null, "totalTestsAntibody": null, "positiveTestsAntibody": null, "negativeTestsAntibody": null, "totalTestsPeopleAntibody": null, "positiveTestsPeopleAntibody": null, "negativeTestsPeopleAntibody": null, "totalTestsPeopleAntigen": null, "positiveTestsPeopleAntigen": null, "totalTestsAntigen": null, "positiveTestsAntigen": null, "fips": "56", "positiveIncrease": 0, "negativeIncrease": 0, "total": 0, "totalTestResultsIncrease": 11, "posNeg": 0, "deathIncrease": 0, "hospitalizedIncrease": 0, "hash": "54bef68b0b9792d5a1ed5ebf86c77536912c7246", "commercialScore": 0, "negativeRegularScore": 0, "negativeScore": 0, "positiveScore": 0, "score": 0, "grade": "", "month_number_label": "2020-03", "date_label": "2020-03-11", "week_number_label": "2020W11", "week_start_label": "2020-03-09"}, {"date": 20200312, "state": "WY", "positive": 1, "probableCases": null, "negative": null, "pending": null, "totalTestResultsSource": "totalTestsViral", "totalTestResults": 75, "hospitalizedCurrently": null, "hospitalizedCumulative": null, "inIcuCurrently": null, "inIcuCumulative": null, "onVentilatorCurrently": null, "onVentilatorCumulative": null, "recovered": null, "dataQualityGrade": null, "lastUpdateEt": "3/11/2020 00:00", "dateModified": "2020-03-11T00:00:00Z", "checkTimeEt": "03/10 20:00", "death": null, "hospitalized": null, "dateChecked": "2020-03-11T00:00:00Z", "totalTestsViral": 75, "positiveTestsViral": 1, "negativeTestsViral": 74, "positiveCasesViral": 1, "deathConfirmed": null, "deathProbable": null, "totalTestEncountersViral": null, "totalTestsPeopleViral": null, "totalTestsAntibody": null, "positiveTestsAntibody": null, "negativeTestsAntibody": null, "totalTestsPeopleAntibody": null, "positiveTestsPeopleAntibody": null, "negativeTestsPeopleAntibody": null, "totalTestsPeopleAntigen": null, "positiveTestsPeopleAntigen": null, "totalTestsAntigen": null, "positiveTestsAntigen": null, "fips": "56", "positiveIncrease": 1, "negativeIncrease": 0, "total": 1, "totalTestResultsIncrease": 38, "posNeg": 1, "deathIncrease": 0, "hospitalizedIncrease": 0, "hash": "f9e6342502f10adaa238c6b91da6773bd2a39692", "commercialScore": 0, "negativeRegularScore": 0, "negativeScore": 0, "positiveScore": 0, "score": 0, "grade": "", "month_number_label": "2020-03", "date_label": "2020-03-12", "week_number_label": "2020W11", "week_start_label": "2020-03-09"}, {"date": 20200313, "state": "WY", "positive": 1, "probableCases": null, "negative": null, "pending": null, "totalTestResultsSource": "totalTestsViral", "totalTestResults": 108, "hospitalizedCurrently": null, "hospitalizedCumulative": null, "inIcuCurrently": null, "inIcuCumulative": null, "onVentilatorCurrently": null, "onVentilatorCumulative": null, "recovered": null, "dataQualityGrade": null, "lastUpdateEt": "3/12/2020 00:00", "dateModified": "2020-03-12T00:00:00Z", "checkTimeEt": "03/11 20:00", "death": null, "hospitalized": null, "dateChecked": "2020-03-12T00:00:00Z", "totalTestsViral": 108, "positiveTestsViral": 1, "negativeTestsViral": 107, "positiveCasesViral": 2, "deathConfirmed": null, "deathProbable": null, "totalTestEncountersViral": null, "totalTestsPeopleViral": null, "totalTestsAntibody": null, "positiveTestsAntibody": null, "negativeTestsAntibody": null, "totalTestsPeopleAntibody": null, "positiveTestsPeopleAntibody": null, "negativeTestsPeopleAntibody": null, "totalTestsPeopleAntigen": null, "positiveTestsPeopleAntigen": null, "totalTestsAntigen": null, "positiveTestsAntigen": null, "fips": "56", "positiveIncrease": 0, "negativeIncrease": 0, "total": 1, "totalTestResultsIncrease": 33, "posNeg": 1, "deathIncrease": 0, "hospitalizedIncrease": 0, "hash": "13b831f61a3a54bbf58516f5741481366a6fecfa", "commercialScore": 0, "negativeRegularScore": 0, "negativeScore": 0, "positiveScore": 0, "score": 0, "grade": "", "month_number_label": "2020-03", "date_label": "2020-03-13", "week_number_label": "2020W11", "week_start_label": "2020-03-09"}, {"date": 20200314, "state": "WY", "positive": 2, "probableCases": null, "negative": null, "pending": null, "totalTestResultsSource": "totalTestsViral", "totalTestResults": 151, "hospitalizedCurrently": null, "hospitalizedCumulative": null, "inIcuCurrently": null, "inIcuCumulative": null, "onVentilatorCurrently": null, "onVentilatorCumulative": null, "recovered": null, "dataQualityGrade": null, "lastUpdateEt": "3/13/2020 00:00", "dateModified": "2020-03-13T00:00:00Z", "checkTimeEt": "03/12 20:00", "death": null, "hospitalized": null, "dateChecked": "2020-03-13T00:00:00Z", "totalTestsViral": 151, "positiveTestsViral": 6, "negativeTestsViral": 145, "positiveCasesViral": 2, "deathConfirmed": null, "deathProbable": null, "totalTestEncountersViral": null, "totalTestsPeopleViral": null, "totalTestsAntibody": null, "positiveTestsAntibody": null, "negativeTestsAntibody": null, "totalTestsPeopleAntibody": null, "positiveTestsPeopleAntibody": null, "negativeTestsPeopleAntibody": null, "totalTestsPeopleAntigen": null, "positiveTestsPeopleAntigen": null, "totalTestsAntigen": null, "positiveTestsAntigen": null, "fips": "56", "positiveIncrease": 1, "negativeIncrease": 0, "total": 2, "totalTestResultsIncrease": 43, "posNeg": 2, "deathIncrease": 0, "hospitalizedIncrease": 0, "hash": "3ecc43f4c40f8764e3c7bfa307697cc3fbffed53", "commercialScore": 0, "negativeRegularScore": 0, "negativeScore": 0, "positiveScore": 0, "score": 0, "grade": "", "month_number_label": "2020-03", "date_label": "2020-03-14", "week_number_label": "2020W11", "week_start_label": "2020-03-09"}, {"date": 20200315, "state": "WY", "positive": 3, "probableCases": null, "negative": null, "pending": null, "totalTestResultsSource": "totalTestsViral", "totalTestResults": 178, "hospitalizedCurrently": null, "hospitalizedCumulative": null, "inIcuCurrently": null, "inIcuCumulative": null, "onVentilatorCurrently": null, "onVentilatorCumulative": null, "recovered": null, "dataQualityGrade": null, "lastUpdateEt": "3/14/2020 00:00", "dateModified": "2020-03-14T00:00:00Z", "checkTimeEt": "03/13 20:00", "death": null, "hospitalized": null, "dateChecked": "2020-03-14T00:00:00Z", "totalTestsViral": 178, "positiveTestsViral": 12, "negativeTestsViral": 166, "positiveCasesViral": 3, "deathConfirmed": null, "deathProbable": null, "totalTestEncountersViral": null, "totalTestsPeopleViral": null, "totalTestsAntibody": null, "positiveTestsAntibody": null, "negativeTestsAntibody": null, "totalTestsPeopleAntibody": null, "positiveTestsPeopleAntibody": null, "negativeTestsPeopleAntibody": null, "totalTestsPeopleAntigen": null, "positiveTestsPeopleAntigen": null, "totalTestsAntigen": null, "positiveTestsAntigen": null, "fips": "56", "positiveIncrease": 1, "negativeIncrease": 0, "total": 3, "totalTestResultsIncrease": 27, "posNeg": 3, "deathIncrease": 0, "hospitalizedIncrease": 0, "hash": "614f4009f7563f13bdec888f2b010ea6720ce492", "commercialScore": 0, "negativeRegularScore": 0, "negativeScore": 0, "positiveScore": 0, "score": 0, "grade": "", "month_number_label": "2020-03", "date_label": "2020-03-15", "week_number_label": "2020W11", "week_start_label": "2020-03-09"}, {"date": 20200316, "state": "WY", "positive": 3, "probableCases": null, "negative": null, "pending": null, "totalTestResultsSource": "totalTestsViral", "totalTestResults": 300, "hospitalizedCurrently": null, "hospitalizedCumulative": null, "inIcuCurrently": null, "inIcuCumulative": null, "onVentilatorCurrently": null, "onVentilatorCumulative": null, "recovered": null, "dataQualityGrade": null, "lastUpdateEt": "3/16/2020 15:04", "dateModified": "2020-03-16T15:04:00Z", "checkTimeEt": "03/16 11:04", "death": null, "hospitalized": null, "dateChecked": "2020-03-16T15:04:00Z", "totalTestsViral": 300, "positiveTestsViral": 14, "negativeTestsViral": 286, "positiveCasesViral": 3, "deathConfirmed": null, "deathProbable": null, "totalTestEncountersViral": null, "totalTestsPeopleViral": null, "totalTestsAntibody": null, "positiveTestsAntibody": null, "negativeTestsAntibody": null, "totalTestsPeopleAntibody": null, "positiveTestsPeopleAntibody": null, "negativeTestsPeopleAntibody": null, "totalTestsPeopleAntigen": null, "positiveTestsPeopleAntigen": null, "totalTestsAntigen": null, "positiveTestsAntigen": null, "fips": "56", "positiveIncrease": 0, "negativeIncrease": 0, "total": 3, "totalTestResultsIncrease": 122, "posNeg": 3, "deathIncrease": 0, "hospitalizedIncrease": 0, "hash": "1f15c88f9e1380c6b8025c16ca61fc329597e4bc", "commercialScore": 0, "negativeRegularScore": 0, "negativeScore": 0, "positiveScore": 0, "score": 0, "grade": "", "month_number_label": "2020-03", "date_label": "2020-03-16", "week_number_label": "2020W12", "week_start_label": "2020-03-16"}, {"date": 20200317, "state": "WY", "positive": 10, "probableCases": null, "negative": 95, "pending": null, "totalTestResultsSource": "totalTestsViral", "totalTestResults": 461, "hospitalizedCurrently": null, "hospitalizedCumulative": null, "inIcuCurrently": null, "inIcuCumulative": null, "onVentilatorCurrently": null, "onVentilatorCumulative": null, "recovered": null, "dataQualityGrade": null, "lastUpdateEt": "3/17/2020 00:00", "dateModified": "2020-03-17T00:00:00Z", "checkTimeEt": "03/16 20:00", "death": null, "hospitalized": null, "dateChecked": "2020-03-17T00:00:00Z", "totalTestsViral": 461, "positiveTestsViral": 17, "negativeTestsViral": 444, "positiveCasesViral": 11, "deathConfirmed": null, "deathProbable": null, "totalTestEncountersViral": null, "totalTestsPeopleViral": null, "totalTestsAntibody": null, "positiveTestsAntibody": null, "negativeTestsAntibody": null, "totalTestsPeopleAntibody": null, "positiveTestsPeopleAntibody": null, "negativeTestsPeopleAntibody": null, "totalTestsPeopleAntigen": null, "positiveTestsPeopleAntigen": null, "totalTestsAntigen": null, "positiveTestsAntigen": null, "fips": "56", "positiveIncrease": 7, "negativeIncrease": 95, "total": 105, "totalTestResultsIncrease": 161, "posNeg": 105, "deathIncrease": 0, "hospitalizedIncrease": 0, "hash": "71b18590f3cfc4dede1cdc783ba0012053245ac6", "commercialScore": 0, "negativeRegularScore": 0, "negativeScore": 0, "positiveScore": 0, "score": 0, "grade": "", "month_number_label": "2020-03", "date_label": "2020-03-17", "week_number_label": "2020W12", "week_start_label": "2020-03-16"}, {"date": 20200318, "state": "WY", "positive": 15, "probableCases": null, "negative": 178, "pending": null, "totalTestResultsSource": "totalTestsViral", "totalTestResults": 601, "hospitalizedCurrently": null, "hospitalizedCumulative": null, "inIcuCurrently": null, "inIcuCumulative": null, "onVentilatorCurrently": null, "onVentilatorCumulative": null, "recovered": null, "dataQualityGrade": null, "lastUpdateEt": "3/18/2020 00:00", "dateModified": "2020-03-18T00:00:00Z", "checkTimeEt": "03/17 20:00", "death": null, "hospitalized": null, "dateChecked": "2020-03-18T00:00:00Z", "totalTestsViral": 601, "positiveTestsViral": 21, "negativeTestsViral": 580, "positiveCasesViral": 16, "deathConfirmed": null, "deathProbable": null, "totalTestEncountersViral": null, "totalTestsPeopleViral": null, "totalTestsAntibody": null, "positiveTestsAntibody": null, "negativeTestsAntibody": null, "totalTestsPeopleAntibody": null, "positiveTestsPeopleAntibody": null, "negativeTestsPeopleAntibody": null, "totalTestsPeopleAntigen": null, "positiveTestsPeopleAntigen": null, "totalTestsAntigen": null, "positiveTestsAntigen": null, "fips": "56", "positiveIncrease": 5, "negativeIncrease": 83, "total": 193, "totalTestResultsIncrease": 140, "posNeg": 193, "deathIncrease": 0, "hospitalizedIncrease": 0, "hash": "10ef05a7af49b6543227a6ea6bddd8048594a49b", "commercialScore": 0, "negativeRegularScore": 0, "negativeScore": 0, "positiveScore": 0, "score": 0, "grade": "", "month_number_label": "2020-03", "date_label": "2020-03-18", "week_number_label": "2020W12", "week_start_label": "2020-03-16"}, {"date": 20200319, "state": "WY", "positive": 18, "probableCases": null, "negative": 271, "pending": null, "totalTestResultsSource": "totalTestsViral", "totalTestResults": 744, "hospitalizedCurrently": null, "hospitalizedCumulative": null, "inIcuCurrently": null, "inIcuCumulative": null, "onVentilatorCurrently": null, "onVentilatorCumulative": null, "recovered": null, "dataQualityGrade": null, "lastUpdateEt": "3/19/2020 16:45", "dateModified": "2020-03-19T16:45:00Z", "checkTimeEt": "03/19 12:45", "death": null, "hospitalized": null, "dateChecked": "2020-03-19T16:45:00Z", "totalTestsViral": 744, "positiveTestsViral": 28, "negativeTestsViral": 716, "positiveCasesViral": 18, "deathConfirmed": null, "deathProbable": null, "totalTestEncountersViral": null, "totalTestsPeopleViral": null, "totalTestsAntibody": null, "positiveTestsAntibody": null, "negativeTestsAntibody": null, "totalTestsPeopleAntibody": null, "positiveTestsPeopleAntibody": null, "negativeTestsPeopleAntibody": null, "totalTestsPeopleAntigen": null, "positiveTestsPeopleAntigen": null, "totalTestsAntigen": null, "positiveTestsAntigen": null, "fips": "56", "positiveIncrease": 3, "negativeIncrease": 93, "total": 289, "totalTestResultsIncrease": 143, "posNeg": 289, "deathIncrease": 0, "hospitalizedIncrease": 0, "hash": "d76d7940bf5e990eb554f59f4503b46151cdba3b", "commercialScore": 0, "negativeRegularScore": 0, "negativeScore": 0, "positiveScore": 0, "score": 0, "grade": "", "month_number_label": "2020-03", "date_label": "2020-03-19", "week_number_label": "2020W12", "week_start_label": "2020-03-16"}, {"date": 20200320, "state": "WY", "positive": 19, "probableCases": null, "negative": 331, "pending": null, "totalTestResultsSource": "totalTestsViral", "totalTestResults": 942, "hospitalizedCurrently": null, "hospitalizedCumulative": null, "inIcuCurrently": null, "inIcuCumulative": null, "onVentilatorCurrently": null, "onVentilatorCumulative": null, "recovered": null, "dataQualityGrade": null, "lastUpdateEt": "3/20/2020 13:30", "dateModified": "2020-03-20T13:30:00Z", "checkTimeEt": "03/20 09:30", "death": null, "hospitalized": null, "dateChecked": "2020-03-20T13:30:00Z", "totalTestsViral": 942, "positiveTestsViral": 32, "negativeTestsViral": 910, "positiveCasesViral": 22, "deathConfirmed": null, "deathProbable": null, "totalTestEncountersViral": null, "totalTestsPeopleViral": null, "totalTestsAntibody": null, "positiveTestsAntibody": null, "negativeTestsAntibody": null, "totalTestsPeopleAntibody": null, "positiveTestsPeopleAntibody": null, "negativeTestsPeopleAntibody": null, "totalTestsPeopleAntigen": null, "positiveTestsPeopleAntigen": null, "totalTestsAntigen": null, "positiveTestsAntigen": null, "fips": "56", "positiveIncrease": 1, "negativeIncrease": 60, "total": 350, "totalTestResultsIncrease": 198, "posNeg": 350, "deathIncrease": 0, "hospitalizedIncrease": 0, "hash": "f2c8a2c1e078facb17a170798c7132ddd41c2a6c", "commercialScore": 0, "negativeRegularScore": 0, "negativeScore": 0, "positiveScore": 0, "score": 0, "grade": "", "month_number_label": "2020-03", "date_label": "2020-03-20", "week_number_label": "2020W12", "week_start_label": "2020-03-16"}, {"date": 20200321, "state": "WY", "positive": 23, "probableCases": null, "negative": 438, "pending": null, "totalTestResultsSource": "totalTestsViral", "totalTestResults": 1020, "hospitalizedCurrently": null, "hospitalizedCumulative": null, "inIcuCurrently": null, "inIcuCumulative": null, "onVentilatorCurrently": null, "onVentilatorCumulative": null, "recovered": null, "dataQualityGrade": null, "lastUpdateEt": "3/21/2020 12:30", "dateModified": "2020-03-21T12:30:00Z", "checkTimeEt": "03/21 08:30", "death": null, "hospitalized": null, "dateChecked": "2020-03-21T12:30:00Z", "totalTestsViral": 1020, "positiveTestsViral": 36, "negativeTestsViral": 984, "positiveCasesViral": 24, "deathConfirmed": null, "deathProbable": null, "totalTestEncountersViral": null, "totalTestsPeopleViral": null, "totalTestsAntibody": null, "positiveTestsAntibody": null, "negativeTestsAntibody": null, "totalTestsPeopleAntibody": null, "positiveTestsPeopleAntibody": null, "negativeTestsPeopleAntibody": null, "totalTestsPeopleAntigen": null, "positiveTestsPeopleAntigen": null, "totalTestsAntigen": null, "positiveTestsAntigen": null, "fips": "56", "positiveIncrease": 4, "negativeIncrease": 107, "total": 461, "totalTestResultsIncrease": 78, "posNeg": 461, "deathIncrease": 0, "hospitalizedIncrease": 0, "hash": "4aeee1af2a8105abc137713024cddc4678d20e04", "commercialScore": 0, "negativeRegularScore": 0, "negativeScore": 0, "positiveScore": 0, "score": 0, "grade": "", "month_number_label": "2020-03", "date_label": "2020-03-21", "week_number_label": "2020W12", "week_start_label": "2020-03-16"}, {"date": 20200322, "state": "WY", "positive": 24, "probableCases": null, "negative": 438, "pending": null, "totalTestResultsSource": "totalTestsViral", "totalTestResults": 1086, "hospitalizedCurrently": null, "hospitalizedCumulative": null, "inIcuCurrently": null, "inIcuCumulative": null, "onVentilatorCurrently": null, "onVentilatorCumulative": null, "recovered": null, "dataQualityGrade": null, "lastUpdateEt": "3/21/2020 23:00", "dateModified": "2020-03-21T23:00:00Z", "checkTimeEt": "03/21 19:00", "death": null, "hospitalized": null, "dateChecked": "2020-03-21T23:00:00Z", "totalTestsViral": 1086, "positiveTestsViral": 37, "negativeTestsViral": 1049, "positiveCasesViral": 26, "deathConfirmed": null, "deathProbable": null, "totalTestEncountersViral": null, "totalTestsPeopleViral": null, "totalTestsAntibody": null, "positiveTestsAntibody": null, "negativeTestsAntibody": null, "totalTestsPeopleAntibody": null, "positiveTestsPeopleAntibody": null, "negativeTestsPeopleAntibody": null, "totalTestsPeopleAntigen": null, "positiveTestsPeopleAntigen": null, "totalTestsAntigen": null, "positiveTestsAntigen": null, "fips": "56", "positiveIncrease": 1, "negativeIncrease": 0, "total": 462, "totalTestResultsIncrease": 66, "posNeg": 462, "deathIncrease": 0, "hospitalizedIncrease": 0, "hash": "875b97b3595394bf8fa282b8bf955faa718c9412", "commercialScore": 0, "negativeRegularScore": 0, "negativeScore": 0, "positiveScore": 0, "score": 0, "grade": "", "month_number_label": "2020-03", "date_label": "2020-03-22", "week_number_label": "2020W12", "week_start_label": "2020-03-16"}, {"date": 20200323, "state": "WY", "positive": 26, "probableCases": null, "negative": 592, "pending": null, "totalTestResultsSource": "totalTestsViral", "totalTestResults": 1307, "hospitalizedCurrently": null, "hospitalizedCumulative": null, "inIcuCurrently": null, "inIcuCumulative": null, "onVentilatorCurrently": null, "onVentilatorCumulative": null, "recovered": null, "dataQualityGrade": "A", "lastUpdateEt": "3/23/2020 14:00", "dateModified": "2020-03-23T14:00:00Z", "checkTimeEt": "03/23 10:00", "death": null, "hospitalized": null, "dateChecked": "2020-03-23T14:00:00Z", "totalTestsViral": 1307, "positiveTestsViral": 48, "negativeTestsViral": 1259, "positiveCasesViral": 28, "deathConfirmed": null, "deathProbable": null, "totalTestEncountersViral": null, "totalTestsPeopleViral": null, "totalTestsAntibody": null, "positiveTestsAntibody": null, "negativeTestsAntibody": null, "totalTestsPeopleAntibody": null, "positiveTestsPeopleAntibody": null, "negativeTestsPeopleAntibody": null, "totalTestsPeopleAntigen": null, "positiveTestsPeopleAntigen": null, "totalTestsAntigen": null, "positiveTestsAntigen": null, "fips": "56", "positiveIncrease": 2, "negativeIncrease": 154, "total": 618, "totalTestResultsIncrease": 221, "posNeg": 618, "deathIncrease": 0, "hospitalizedIncrease": 0, "hash": "02c594d41286f1f2a902dacbd4b3fcae0be38c42", "commercialScore": 0, "negativeRegularScore": 0, "negativeScore": 0, "positiveScore": 0, "score": 0, "grade": "", "month_number_label": "2020-03", "date_label": "2020-03-23", "week_number_label": "2020W13", "week_start_label": "2020-03-23"}, {"date": 20200324, "state": "WY", "positive": 29, "probableCases": null, "negative": 710, "pending": null, "totalTestResultsSource": "totalTestsViral", "totalTestResults": 1467, "hospitalizedCurrently": null, "hospitalizedCumulative": null, "inIcuCurrently": null, "inIcuCumulative": null, "onVentilatorCurrently": null, "onVentilatorCumulative": null, "recovered": null, "dataQualityGrade": "A", "lastUpdateEt": "3/24/2020 00:00", "dateModified": "2020-03-24T00:00:00Z", "checkTimeEt": "03/23 20:00", "death": null, "hospitalized": null, "dateChecked": "2020-03-24T00:00:00Z", "totalTestsViral": 1467, "positiveTestsViral": 64, "negativeTestsViral": 1403, "positiveCasesViral": 30, "deathConfirmed": null, "deathProbable": null, "totalTestEncountersViral": null, "totalTestsPeopleViral": null, "totalTestsAntibody": null, "positiveTestsAntibody": null, "negativeTestsAntibody": null, "totalTestsPeopleAntibody": null, "positiveTestsPeopleAntibody": null, "negativeTestsPeopleAntibody": null, "totalTestsPeopleAntigen": null, "positiveTestsPeopleAntigen": null, "totalTestsAntigen": null, "positiveTestsAntigen": null, "fips": "56", "positiveIncrease": 3, "negativeIncrease": 118, "total": 739, "totalTestResultsIncrease": 160, "posNeg": 739, "deathIncrease": 0, "hospitalizedIncrease": 0, "hash": "093ea997f25f68550aecb565cd78ef4615438ceb", "commercialScore": 0, "negativeRegularScore": 0, "negativeScore": 0, "positiveScore": 0, "score": 0, "grade": "", "month_number_label": "2020-03", "date_label": "2020-03-24", "week_number_label": "2020W13", "week_start_label": "2020-03-23"}, {"date": 20200325, "state": "WY", "positive": 44, "probableCases": null, "negative": 954, "pending": null, "totalTestResultsSource": "totalTestsViral", "totalTestResults": 1733, "hospitalizedCurrently": null, "hospitalizedCumulative": null, "inIcuCurrently": null, "inIcuCumulative": null, "onVentilatorCurrently": null, "onVentilatorCumulative": null, "recovered": 7, "dataQualityGrade": "A", "lastUpdateEt": "3/25/2020 12:45", "dateModified": "2020-03-25T12:45:00Z", "checkTimeEt": "03/25 08:45", "death": null, "hospitalized": null, "dateChecked": "2020-03-25T12:45:00Z", "totalTestsViral": 1733, "positiveTestsViral": 79, "negativeTestsViral": 1654, "positiveCasesViral": 49, "deathConfirmed": null, "deathProbable": null, "totalTestEncountersViral": null, "totalTestsPeopleViral": null, "totalTestsAntibody": null, "positiveTestsAntibody": null, "negativeTestsAntibody": null, "totalTestsPeopleAntibody": null, "positiveTestsPeopleAntibody": null, "negativeTestsPeopleAntibody": null, "totalTestsPeopleAntigen": null, "positiveTestsPeopleAntigen": null, "totalTestsAntigen": null, "positiveTestsAntigen": null, "fips": "56", "positiveIncrease": 15, "negativeIncrease": 244, "total": 998, "totalTestResultsIncrease": 266, "posNeg": 998, "deathIncrease": 0, "hospitalizedIncrease": 0, "hash": "f87dce1e7ee4a1149330f8d1d880fb4a3ad278df", "commercialScore": 0, "negativeRegularScore": 0, "negativeScore": 0, "positiveScore": 0, "score": 0, "grade": "", "month_number_label": "2020-03", "date_label": "2020-03-25", "week_number_label": "2020W13", "week_start_label": "2020-03-23"}, {"date": 20200326, "state": "WY", "positive": 53, "probableCases": null, "negative": 1052, "pending": null, "totalTestResultsSource": "totalTestsViral", "totalTestResults": 1977, "hospitalizedCurrently": null, "hospitalizedCumulative": null, "inIcuCurrently": null, "inIcuCumulative": null, "onVentilatorCurrently": null, "onVentilatorCumulative": null, "recovered": 12, "dataQualityGrade": "A", "lastUpdateEt": "3/26/2020 00:00", "dateModified": "2020-03-26T00:00:00Z", "checkTimeEt": "03/25 20:00", "death": null, "hospitalized": null, "dateChecked": "2020-03-26T00:00:00Z", "totalTestsViral": 1977, "positiveTestsViral": 90, "negativeTestsViral": 1887, "positiveCasesViral": 53, "deathConfirmed": null, "deathProbable": null, "totalTestEncountersViral": null, "totalTestsPeopleViral": null, "totalTestsAntibody": null, "positiveTestsAntibody": null, "negativeTestsAntibody": null, "totalTestsPeopleAntibody": null, "positiveTestsPeopleAntibody": null, "negativeTestsPeopleAntibody": null, "totalTestsPeopleAntigen": null, "positiveTestsPeopleAntigen": null, "totalTestsAntigen": null, "positiveTestsAntigen": null, "fips": "56", "positiveIncrease": 9, "negativeIncrease": 98, "total": 1105, "totalTestResultsIncrease": 244, "posNeg": 1105, "deathIncrease": 0, "hospitalizedIncrease": 0, "hash": "be13fb48a5f7ed997a76cd43d65c328fe07fb1c2", "commercialScore": 0, "negativeRegularScore": 0, "negativeScore": 0, "positiveScore": 0, "score": 0, "grade": "", "month_number_label": "2020-03", "date_label": "2020-03-26", "week_number_label": "2020W13", "week_start_label": "2020-03-23"}, {"date": 20200327, "state": "WY", "positive": 70, "probableCases": null, "negative": 1211, "pending": null, "totalTestResultsSource": "totalTestsViral", "totalTestResults": 2204, "hospitalizedCurrently": null, "hospitalizedCumulative": 11, "inIcuCurrently": null, "inIcuCumulative": null, "onVentilatorCurrently": null, "onVentilatorCumulative": null, "recovered": 17, "dataQualityGrade": "A", "lastUpdateEt": "3/27/2020 12:50", "dateModified": "2020-03-27T12:50:00Z", "checkTimeEt": "03/27 08:50", "death": 0, "hospitalized": 11, "dateChecked": "2020-03-27T12:50:00Z", "totalTestsViral": 2204, "positiveTestsViral": 111, "negativeTestsViral": 2093, "positiveCasesViral": 73, "deathConfirmed": null, "deathProbable": null, "totalTestEncountersViral": null, "totalTestsPeopleViral": null, "totalTestsAntibody": null, "positiveTestsAntibody": null, "negativeTestsAntibody": null, "totalTestsPeopleAntibody": null, "positiveTestsPeopleAntibody": null, "negativeTestsPeopleAntibody": null, "totalTestsPeopleAntigen": null, "positiveTestsPeopleAntigen": null, "totalTestsAntigen": null, "positiveTestsAntigen": null, "fips": "56", "positiveIncrease": 17, "negativeIncrease": 159, "total": 1281, "totalTestResultsIncrease": 227, "posNeg": 1281, "deathIncrease": 0, "hospitalizedIncrease": 11, "hash": "e3205c46361636905f792032f61b355200596501", "commercialScore": 0, "negativeRegularScore": 0, "negativeScore": 0, "positiveScore": 0, "score": 0, "grade": "", "month_number_label": "2020-03", "date_label": "2020-03-27", "week_number_label": "2020W13", "week_start_label": "2020-03-23"}, {"date": 20200328, "state": "WY", "positive": 82, "probableCases": null, "negative": 1475, "pending": null, "totalTestResultsSource": "totalTestsViral", "totalTestResults": 2306, "hospitalizedCurrently": null, "hospitalizedCumulative": 14, "inIcuCurrently": null, "inIcuCumulative": null, "onVentilatorCurrently": null, "onVentilatorCumulative": null, "recovered": 18, "dataQualityGrade": "A", "lastUpdateEt": "3/28/2020 00:00", "dateModified": "2020-03-28T00:00:00Z", "checkTimeEt": "03/27 20:00", "death": 0, "hospitalized": 14, "dateChecked": "2020-03-28T00:00:00Z", "totalTestsViral": 2306, "positiveTestsViral": 113, "negativeTestsViral": 2193, "positiveCasesViral": 84, "deathConfirmed": null, "deathProbable": null, "totalTestEncountersViral": null, "totalTestsPeopleViral": null, "totalTestsAntibody": null, "positiveTestsAntibody": null, "negativeTestsAntibody": null, "totalTestsPeopleAntibody": null, "positiveTestsPeopleAntibody": null, "negativeTestsPeopleAntibody": null, "totalTestsPeopleAntigen": null, "positiveTestsPeopleAntigen": null, "totalTestsAntigen": null, "positiveTestsAntigen": null, "fips": "56", "positiveIncrease": 12, "negativeIncrease": 264, "total": 1557, "totalTestResultsIncrease": 102, "posNeg": 1557, "deathIncrease": 0, "hospitalizedIncrease": 3, "hash": "de366cb64fdc7f6a0b14db59929f0c83a5487390", "commercialScore": 0, "negativeRegularScore": 0, "negativeScore": 0, "positiveScore": 0, "score": 0, "grade": "", "month_number_label": "2020-03", "date_label": "2020-03-28", "week_number_label": "2020W13", "week_start_label": "2020-03-23"}, {"date": 20200329, "state": "WY", "positive": 86, "probableCases": null, "negative": 1554, "pending": null, "totalTestResultsSource": "totalTestsViral", "totalTestResults": 2384, "hospitalizedCurrently": null, "hospitalizedCumulative": 15, "inIcuCurrently": null, "inIcuCumulative": null, "onVentilatorCurrently": null, "onVentilatorCumulative": null, "recovered": 20, "dataQualityGrade": "A", "lastUpdateEt": "3/29/2020 00:00", "dateModified": "2020-03-29T00:00:00Z", "checkTimeEt": "03/28 20:00", "death": 0, "hospitalized": 15, "dateChecked": "2020-03-29T00:00:00Z", "totalTestsViral": 2384, "positiveTestsViral": 117, "negativeTestsViral": 2267, "positiveCasesViral": 87, "deathConfirmed": null, "deathProbable": null, "totalTestEncountersViral": null, "totalTestsPeopleViral": null, "totalTestsAntibody": null, "positiveTestsAntibody": null, "negativeTestsAntibody": null, "totalTestsPeopleAntibody": null, "positiveTestsPeopleAntibody": null, "negativeTestsPeopleAntibody": null, "totalTestsPeopleAntigen": null, "positiveTestsPeopleAntigen": null, "totalTestsAntigen": null, "positiveTestsAntigen": null, "fips": "56", "positiveIncrease": 4, "negativeIncrease": 79, "total": 1640, "totalTestResultsIncrease": 78, "posNeg": 1640, "deathIncrease": 0, "hospitalizedIncrease": 1, "hash": "bb404441e57db26c84e7934bd2f7b283ae5087df", "commercialScore": 0, "negativeRegularScore": 0, "negativeScore": 0, "positiveScore": 0, "score": 0, "grade": "", "month_number_label": "2020-03", "date_label": "2020-03-29", "week_number_label": "2020W13", "week_start_label": "2020-03-23"}, {"date": 20200330, "state": "WY", "positive": 94, "probableCases": null, "negative": 1840, "pending": null, "totalTestResultsSource": "totalTestsViral", "totalTestResults": 2641, "hospitalizedCurrently": null, "hospitalizedCumulative": 17, "inIcuCurrently": null, "inIcuCumulative": null, "onVentilatorCurrently": null, "onVentilatorCumulative": null, "recovered": 24, "dataQualityGrade": "A", "lastUpdateEt": "3/30/2020 00:00", "dateModified": "2020-03-30T00:00:00Z", "checkTimeEt": "03/29 20:00", "death": 0, "hospitalized": 17, "dateChecked": "2020-03-30T00:00:00Z", "totalTestsViral": 2641, "positiveTestsViral": 145, "negativeTestsViral": 2496, "positiveCasesViral": 95, "deathConfirmed": null, "deathProbable": null, "totalTestEncountersViral": null, "totalTestsPeopleViral": null, "totalTestsAntibody": null, "positiveTestsAntibody": null, "negativeTestsAntibody": null, "totalTestsPeopleAntibody": null, "positiveTestsPeopleAntibody": null, "negativeTestsPeopleAntibody": null, "totalTestsPeopleAntigen": null, "positiveTestsPeopleAntigen": null, "totalTestsAntigen": null, "positiveTestsAntigen": null, "fips": "56", "positiveIncrease": 8, "negativeIncrease": 286, "total": 1934, "totalTestResultsIncrease": 257, "posNeg": 1934, "deathIncrease": 0, "hospitalizedIncrease": 2, "hash": "934cce2526ebebbb0d6d38911bdcef2f7ef3a940", "commercialScore": 0, "negativeRegularScore": 0, "negativeScore": 0, "positiveScore": 0, "score": 0, "grade": "", "month_number_label": "2020-03", "date_label": "2020-03-30", "week_number_label": "2020W14", "week_start_label": "2020-03-30"}, {"date": 20200331, "state": "WY", "positive": 109, "probableCases": null, "negative": 1999, "pending": null, "totalTestResultsSource": "totalTestsViral", "totalTestResults": 2922, "hospitalizedCurrently": null, "hospitalizedCumulative": 17, "inIcuCurrently": null, "inIcuCumulative": null, "onVentilatorCurrently": null, "onVentilatorCumulative": null, "recovered": 26, "dataQualityGrade": "A", "lastUpdateEt": "3/31/2020 10:37", "dateModified": "2020-03-31T10:37:00Z", "checkTimeEt": "03/31 06:37", "death": 0, "hospitalized": 17, "dateChecked": "2020-03-31T10:37:00Z", "totalTestsViral": 2922, "positiveTestsViral": 158, "negativeTestsViral": 2764, "positiveCasesViral": 120, "deathConfirmed": null, "deathProbable": null, "totalTestEncountersViral": null, "totalTestsPeopleViral": null, "totalTestsAntibody": null, "positiveTestsAntibody": null, "negativeTestsAntibody": null, "totalTestsPeopleAntibody": null, "positiveTestsPeopleAntibody": null, "negativeTestsPeopleAntibody": null, "totalTestsPeopleAntigen": null, "positiveTestsPeopleAntigen": null, "totalTestsAntigen": null, "positiveTestsAntigen": null, "fips": "56", "positiveIncrease": 15, "negativeIncrease": 159, "total": 2108, "totalTestResultsIncrease": 281, "posNeg": 2108, "deathIncrease": 0, "hospitalizedIncrease": 0, "hash": "f4d6e522e83c6bda9931e063fc8de8d258da3d30", "commercialScore": 0, "negativeRegularScore": 0, "negativeScore": 0, "positiveScore": 0, "score": 0, "grade": "", "month_number_label": "2020-03", "date_label": "2020-03-31", "week_number_label": "2020W14", "week_start_label": "2020-03-30"}, {"date": 20200401, "state": "WY", "positive": 130, "probableCases": null, "negative": 2218, "pending": null, "totalTestResultsSource": "totalTestsViral", "totalTestResults": 3238, "hospitalizedCurrently": null, "hospitalizedCumulative": 18, "inIcuCurrently": null, "inIcuCumulative": null, "onVentilatorCurrently": null, "onVentilatorCumulative": null, "recovered": 31, "dataQualityGrade": "A", "lastUpdateEt": "3/31/2020 19:44", "dateModified": "2020-03-31T19:44:00Z", "checkTimeEt": "03/31 15:44", "death": 0, "hospitalized": 18, "dateChecked": "2020-03-31T19:44:00Z", "totalTestsViral": 3238, "positiveTestsViral": 188, "negativeTestsViral": 3050, "positiveCasesViral": 137, "deathConfirmed": null, "deathProbable": null, "totalTestEncountersViral": null, "totalTestsPeopleViral": null, "totalTestsAntibody": null, "positiveTestsAntibody": null, "negativeTestsAntibody": null, "totalTestsPeopleAntibody": null, "positiveTestsPeopleAntibody": null, "negativeTestsPeopleAntibody": null, "totalTestsPeopleAntigen": null, "positiveTestsPeopleAntigen": null, "totalTestsAntigen": null, "positiveTestsAntigen": null, "fips": "56", "positiveIncrease": 21, "negativeIncrease": 219, "total": 2348, "totalTestResultsIncrease": 316, "posNeg": 2348, "deathIncrease": 0, "hospitalizedIncrease": 1, "hash": "449241dbc51adbccc30a91c80e536fde68860040", "commercialScore": 0, "negativeRegularScore": 0, "negativeScore": 0, "positiveScore": 0, "score": 0, "grade": "", "month_number_label": "2020-04", "date_label": "2020-04-01", "week_number_label": "2020W14", "week_start_label": "2020-03-30"}, {"date": 20200402, "state": "WY", "positive": 150, "probableCases": null, "negative": 2439, "pending": null, "totalTestResultsSource": "totalTestsViral", "totalTestResults": 3663, "hospitalizedCurrently": null, "hospitalizedCumulative": 19, "inIcuCurrently": null, "inIcuCumulative": null, "onVentilatorCurrently": null, "onVentilatorCumulative": null, "recovered": 31, "dataQualityGrade": "A", "lastUpdateEt": "4/2/2020 10:30", "dateModified": "2020-04-02T10:30:00Z", "checkTimeEt": "04/02 06:30", "death": 0, "hospitalized": 19, "dateChecked": "2020-04-02T10:30:00Z", "totalTestsViral": 3663, "positiveTestsViral": 203, "negativeTestsViral": 3460, "positiveCasesViral": 153, "deathConfirmed": null, "deathProbable": null, "totalTestEncountersViral": null, "totalTestsPeopleViral": null, "totalTestsAntibody": null, "positiveTestsAntibody": null, "negativeTestsAntibody": null, "totalTestsPeopleAntibody": null, "positiveTestsPeopleAntibody": null, "negativeTestsPeopleAntibody": null, "totalTestsPeopleAntigen": null, "positiveTestsPeopleAntigen": null, "totalTestsAntigen": null, "positiveTestsAntigen": null, "fips": "56", "positiveIncrease": 20, "negativeIncrease": 221, "total": 2589, "totalTestResultsIncrease": 425, "posNeg": 2589, "deathIncrease": 0, "hospitalizedIncrease": 1, "hash": "f127b1391805844e2e13b3eac8c84601bdd60852", "commercialScore": 0, "negativeRegularScore": 0, "negativeScore": 0, "positiveScore": 0, "score": 0, "grade": "", "month_number_label": "2020-04", "date_label": "2020-04-02", "week_number_label": "2020W14", "week_start_label": "2020-03-30"}, {"date": 20200403, "state": "WY", "positive": 162, "probableCases": null, "negative": 2704, "pending": null, "totalTestResultsSource": "totalTestsViral", "totalTestResults": 4067, "hospitalizedCurrently": null, "hospitalizedCumulative": 21, "inIcuCurrently": null, "inIcuCumulative": null, "onVentilatorCurrently": null, "onVentilatorCumulative": null, "recovered": 37, "dataQualityGrade": "A", "lastUpdateEt": "4/3/2020 10:42", "dateModified": "2020-04-03T10:42:00Z", "checkTimeEt": "04/03 06:42", "death": 0, "hospitalized": 21, "dateChecked": "2020-04-03T10:42:00Z", "totalTestsViral": 4067, "positiveTestsViral": 210, "negativeTestsViral": 3857, "positiveCasesViral": 162, "deathConfirmed": null, "deathProbable": null, "totalTestEncountersViral": null, "totalTestsPeopleViral": null, "totalTestsAntibody": null, "positiveTestsAntibody": null, "negativeTestsAntibody": null, "totalTestsPeopleAntibody": null, "positiveTestsPeopleAntibody": null, "negativeTestsPeopleAntibody": null, "totalTestsPeopleAntigen": null, "positiveTestsPeopleAntigen": null, "totalTestsAntigen": null, "positiveTestsAntigen": null, "fips": "56", "positiveIncrease": 12, "negativeIncrease": 265, "total": 2866, "totalTestResultsIncrease": 404, "posNeg": 2866, "deathIncrease": 0, "hospitalizedIncrease": 2, "hash": "ab799c2d7927acbc3a65a64103be08775f8a4fa2", "commercialScore": 0, "negativeRegularScore": 0, "negativeScore": 0, "positiveScore": 0, "score": 0, "grade": "", "month_number_label": "2020-04", "date_label": "2020-04-03", "week_number_label": "2020W14", "week_start_label": "2020-03-30"}, {"date": 20200404, "state": "WY", "positive": 187, "probableCases": null, "negative": 2945, "pending": null, "totalTestResultsSource": "totalTestsViral", "totalTestResults": 4232, "hospitalizedCurrently": null, "hospitalizedCumulative": 23, "inIcuCurrently": null, "inIcuCumulative": null, "onVentilatorCurrently": null, "onVentilatorCumulative": null, "recovered": 49, "dataQualityGrade": "A", "lastUpdateEt": "4/4/2020 09:49", "dateModified": "2020-04-04T09:49:00Z", "checkTimeEt": "04/04 05:49", "death": 0, "hospitalized": 23, "dateChecked": "2020-04-04T09:49:00Z", "totalTestsViral": 4232, "positiveTestsViral": 217, "negativeTestsViral": 4015, "positiveCasesViral": 187, "deathConfirmed": null, "deathProbable": null, "totalTestEncountersViral": null, "totalTestsPeopleViral": null, "totalTestsAntibody": null, "positiveTestsAntibody": null, "negativeTestsAntibody": null, "totalTestsPeopleAntibody": null, "positiveTestsPeopleAntibody": null, "negativeTestsPeopleAntibody": null, "totalTestsPeopleAntigen": null, "positiveTestsPeopleAntigen": null, "totalTestsAntigen": null, "positiveTestsAntigen": null, "fips": "56", "positiveIncrease": 25, "negativeIncrease": 241, "total": 3132, "totalTestResultsIncrease": 165, "posNeg": 3132, "deathIncrease": 0, "hospitalizedIncrease": 2, "hash": "0d5e337447629eee5a0280ca72635aab4f53adaa", "commercialScore": 0, "negativeRegularScore": 0, "negativeScore": 0, "positiveScore": 0, "score": 0, "grade": "", "month_number_label": "2020-04", "date_label": "2020-04-04", "week_number_label": "2020W14", "week_start_label": "2020-03-30"}, {"date": 20200405, "state": "WY", "positive": 197, "probableCases": null, "negative": 3040, "pending": null, "totalTestResultsSource": "totalTestsViral", "totalTestResults": 4380, "hospitalizedCurrently": null, "hospitalizedCumulative": 23, "inIcuCurrently": null, "inIcuCumulative": null, "onVentilatorCurrently": null, "onVentilatorCumulative": null, "recovered": 50, "dataQualityGrade": "A", "lastUpdateEt": "4/5/2020 09:23", "dateModified": "2020-04-05T09:23:00Z", "checkTimeEt": "04/05 05:23", "death": 0, "hospitalized": 23, "dateChecked": "2020-04-05T09:23:00Z", "totalTestsViral": 4380, "positiveTestsViral": 221, "negativeTestsViral": 4159, "positiveCasesViral": 200, "deathConfirmed": null, "deathProbable": null, "totalTestEncountersViral": null, "totalTestsPeopleViral": null, "totalTestsAntibody": null, "positiveTestsAntibody": null, "negativeTestsAntibody": null, "totalTestsPeopleAntibody": null, "positiveTestsPeopleAntibody": null, "negativeTestsPeopleAntibody": null, "totalTestsPeopleAntigen": null, "positiveTestsPeopleAntigen": null, "totalTestsAntigen": null, "positiveTestsAntigen": null, "fips": "56", "positiveIncrease": 10, "negativeIncrease": 95, "total": 3237, "totalTestResultsIncrease": 148, "posNeg": 3237, "deathIncrease": 0, "hospitalizedIncrease": 0, "hash": "47f27553e4e655b5ac10258f7554f33ebb663bcf", "commercialScore": 0, "negativeRegularScore": 0, "negativeScore": 0, "positiveScore": 0, "score": 0, "grade": "", "month_number_label": "2020-04", "date_label": "2020-04-05", "week_number_label": "2020W14", "week_start_label": "2020-03-30"}, {"date": 20200406, "state": "WY", "positive": 210, "probableCases": null, "negative": 3719, "pending": null, "totalTestResultsSource": "totalTestsViral", "totalTestResults": 4813, "hospitalizedCurrently": null, "hospitalizedCumulative": 23, "inIcuCurrently": null, "inIcuCumulative": null, "onVentilatorCurrently": null, "onVentilatorCumulative": null, "recovered": 52, "dataQualityGrade": "A", "lastUpdateEt": "4/6/2020 11:32", "dateModified": "2020-04-06T11:32:00Z", "checkTimeEt": "04/06 07:32", "death": 0, "hospitalized": 23, "dateChecked": "2020-04-06T11:32:00Z", "totalTestsViral": 4813, "positiveTestsViral": 228, "negativeTestsViral": 4585, "positiveCasesViral": 210, "deathConfirmed": null, "deathProbable": null, "totalTestEncountersViral": null, "totalTestsPeopleViral": null, "totalTestsAntibody": null, "positiveTestsAntibody": null, "negativeTestsAntibody": null, "totalTestsPeopleAntibody": null, "positiveTestsPeopleAntibody": null, "negativeTestsPeopleAntibody": null, "totalTestsPeopleAntigen": null, "positiveTestsPeopleAntigen": null, "totalTestsAntigen": null, "positiveTestsAntigen": null, "fips": "56", "positiveIncrease": 13, "negativeIncrease": 679, "total": 3929, "totalTestResultsIncrease": 433, "posNeg": 3929, "deathIncrease": 0, "hospitalizedIncrease": 0, "hash": "15dcf2d49863879ea18083513e901c9e551e1cb8", "commercialScore": 0, "negativeRegularScore": 0, "negativeScore": 0, "positiveScore": 0, "score": 0, "grade": "", "month_number_label": "2020-04", "date_label": "2020-04-06", "week_number_label": "2020W15", "week_start_label": "2020-04-06"}, {"date": 20200407, "state": "WY", "positive": 216, "probableCases": null, "negative": 3789, "pending": null, "totalTestResultsSource": "totalTestsViral", "totalTestResults": 5180, "hospitalizedCurrently": null, "hospitalizedCumulative": 33, "inIcuCurrently": null, "inIcuCumulative": null, "onVentilatorCurrently": null, "onVentilatorCumulative": null, "recovered": 62, "dataQualityGrade": "A", "lastUpdateEt": "4/7/2020 10:57", "dateModified": "2020-04-07T10:57:00Z", "checkTimeEt": "04/07 06:57", "death": 0, "hospitalized": 33, "dateChecked": "2020-04-07T10:57:00Z", "totalTestsViral": 5180, "positiveTestsViral": 241, "negativeTestsViral": 4939, "positiveCasesViral": 216, "deathConfirmed": null, "deathProbable": null, "totalTestEncountersViral": null, "totalTestsPeopleViral": null, "totalTestsAntibody": null, "positiveTestsAntibody": null, "negativeTestsAntibody": null, "totalTestsPeopleAntibody": null, "positiveTestsPeopleAntibody": null, "negativeTestsPeopleAntibody": null, "totalTestsPeopleAntigen": null, "positiveTestsPeopleAntigen": null, "totalTestsAntigen": null, "positiveTestsAntigen": null, "fips": "56", "positiveIncrease": 6, "negativeIncrease": 70, "total": 4005, "totalTestResultsIncrease": 367, "posNeg": 4005, "deathIncrease": 0, "hospitalizedIncrease": 10, "hash": "987cb45a5aec443fd43287d09ca36eb8cf2ab52a", "commercialScore": 0, "negativeRegularScore": 0, "negativeScore": 0, "positiveScore": 0, "score": 0, "grade": "", "month_number_label": "2020-04", "date_label": "2020-04-07", "week_number_label": "2020W15", "week_start_label": "2020-04-06"}, {"date": 20200408, "state": "WY", "positive": 303, "probableCases": 73, "negative": 3843, "pending": null, "totalTestResultsSource": "totalTestsViral", "totalTestResults": 5459, "hospitalizedCurrently": null, "hospitalizedCumulative": 33, "inIcuCurrently": null, "inIcuCumulative": null, "onVentilatorCurrently": null, "onVentilatorCumulative": null, "recovered": 62, "dataQualityGrade": "A", "lastUpdateEt": "4/7/2020 18:21", "dateModified": "2020-04-07T18:21:00Z", "checkTimeEt": "04/07 14:21", "death": 0, "hospitalized": 33, "dateChecked": "2020-04-07T18:21:00Z", "totalTestsViral": 5459, "positiveTestsViral": 256, "negativeTestsViral": 5203, "positiveCasesViral": 230, "deathConfirmed": null, "deathProbable": null, "totalTestEncountersViral": null, "totalTestsPeopleViral": null, "totalTestsAntibody": null, "positiveTestsAntibody": null, "negativeTestsAntibody": null, "totalTestsPeopleAntibody": null, "positiveTestsPeopleAntibody": null, "negativeTestsPeopleAntibody": null, "totalTestsPeopleAntigen": null, "positiveTestsPeopleAntigen": null, "totalTestsAntigen": null, "positiveTestsAntigen": null, "fips": "56", "positiveIncrease": 87, "negativeIncrease": 54, "total": 4146, "totalTestResultsIncrease": 279, "posNeg": 4146, "deathIncrease": 0, "hospitalizedIncrease": 0, "hash": "5c00ea82e6d047bafe33f7eea65ddfcad1a484c4", "commercialScore": 0, "negativeRegularScore": 0, "negativeScore": 0, "positiveScore": 0, "score": 0, "grade": "", "month_number_label": "2020-04", "date_label": "2020-04-08", "week_number_label": "2020W15", "week_start_label": "2020-04-06"}, {"date": 20200409, "state": "WY", "positive": 320, "probableCases": 81, "negative": 3920, "pending": null, "totalTestResultsSource": "totalTestsViral", "totalTestResults": 5787, "hospitalizedCurrently": null, "hospitalizedCumulative": 34, "inIcuCurrently": null, "inIcuCumulative": null, "onVentilatorCurrently": null, "onVentilatorCumulative": null, "recovered": 94, "dataQualityGrade": "A", "lastUpdateEt": "4/8/2020 16:59", "dateModified": "2020-04-08T16:59:00Z", "checkTimeEt": "04/08 12:59", "death": 0, "hospitalized": 34, "dateChecked": "2020-04-08T16:59:00Z", "totalTestsViral": 5787, "positiveTestsViral": 270, "negativeTestsViral": 5517, "positiveCasesViral": 239, "deathConfirmed": null, "deathProbable": null, "totalTestEncountersViral": null, "totalTestsPeopleViral": null, "totalTestsAntibody": null, "positiveTestsAntibody": null, "negativeTestsAntibody": null, "totalTestsPeopleAntibody": null, "positiveTestsPeopleAntibody": null, "negativeTestsPeopleAntibody": null, "totalTestsPeopleAntigen": null, "positiveTestsPeopleAntigen": null, "totalTestsAntigen": null, "positiveTestsAntigen": null, "fips": "56", "positiveIncrease": 17, "negativeIncrease": 77, "total": 4240, "totalTestResultsIncrease": 328, "posNeg": 4240, "deathIncrease": 0, "hospitalizedIncrease": 1, "hash": "b8edfa239e778e2f2224b73b714ff05c2fd6f36b", "commercialScore": 0, "negativeRegularScore": 0, "negativeScore": 0, "positiveScore": 0, "score": 0, "grade": "", "month_number_label": "2020-04", "date_label": "2020-04-09", "week_number_label": "2020W15", "week_start_label": "2020-04-06"}, {"date": 20200410, "state": "WY", "positive": 340, "probableCases": 87, "negative": 4736, "pending": null, "totalTestResultsSource": "totalTestsViral", "totalTestResults": 6059, "hospitalizedCurrently": null, "hospitalizedCumulative": 37, "inIcuCurrently": null, "inIcuCumulative": null, "onVentilatorCurrently": null, "onVentilatorCumulative": null, "recovered": 105, "dataQualityGrade": "A", "lastUpdateEt": "4/9/2020 18:00", "dateModified": "2020-04-09T18:00:00Z", "checkTimeEt": "04/09 14:00", "death": 0, "hospitalized": 37, "dateChecked": "2020-04-09T18:00:00Z", "totalTestsViral": 6059, "positiveTestsViral": 281, "negativeTestsViral": 5778, "positiveCasesViral": 253, "deathConfirmed": null, "deathProbable": null, "totalTestEncountersViral": null, "totalTestsPeopleViral": null, "totalTestsAntibody": null, "positiveTestsAntibody": null, "negativeTestsAntibody": null, "totalTestsPeopleAntibody": null, "positiveTestsPeopleAntibody": null, "negativeTestsPeopleAntibody": null, "totalTestsPeopleAntigen": null, "positiveTestsPeopleAntigen": null, "totalTestsAntigen": null, "positiveTestsAntigen": null, "fips": "56", "positiveIncrease": 20, "negativeIncrease": 816, "total": 5076, "totalTestResultsIncrease": 272, "posNeg": 5076, "deathIncrease": 0, "hospitalizedIncrease": 3, "hash": "f9f5f57110073b3b281887ae182c41ab6088b938", "commercialScore": 0, "negativeRegularScore": 0, "negativeScore": 0, "positiveScore": 0, "score": 0, "grade": "", "month_number_label": "2020-04", "date_label": "2020-04-10", "week_number_label": "2020W15", "week_start_label": "2020-04-06"}, {"date": 20200411, "state": "WY", "positive": 343, "probableCases": 82, "negative": 5198, "pending": null, "totalTestResultsSource": "totalTestsViral", "totalTestResults": 6163, "hospitalizedCurrently": null, "hospitalizedCumulative": 37, "inIcuCurrently": null, "inIcuCumulative": null, "onVentilatorCurrently": null, "onVentilatorCumulative": null, "recovered": 129, "dataQualityGrade": "A", "lastUpdateEt": "4/11/2020 18:00", "dateModified": "2020-04-11T18:00:00Z", "checkTimeEt": "04/11 14:00", "death": 0, "hospitalized": 37, "dateChecked": "2020-04-11T18:00:00Z", "totalTestsViral": 6163, "positiveTestsViral": 287, "negativeTestsViral": 5876, "positiveCasesViral": 261, "deathConfirmed": null, "deathProbable": null, "totalTestEncountersViral": null, "totalTestsPeopleViral": null, "totalTestsAntibody": null, "positiveTestsAntibody": null, "negativeTestsAntibody": null, "totalTestsPeopleAntibody": null, "positiveTestsPeopleAntibody": null, "negativeTestsPeopleAntibody": null, "totalTestsPeopleAntigen": null, "positiveTestsPeopleAntigen": null, "totalTestsAntigen": null, "positiveTestsAntigen": null, "fips": "56", "positiveIncrease": 3, "negativeIncrease": 462, "total": 5541, "totalTestResultsIncrease": 104, "posNeg": 5541, "deathIncrease": 0, "hospitalizedIncrease": 0, "hash": "5ed0fdfa5a6fb27e62cf0cef6614226301a2e999", "commercialScore": 0, "negativeRegularScore": 0, "negativeScore": 0, "positiveScore": 0, "score": 0, "grade": "", "month_number_label": "2020-04", "date_label": "2020-04-11", "week_number_label": "2020W15", "week_start_label": "2020-04-06"}, {"date": 20200412, "state": "WY", "positive": 364, "probableCases": 94, "negative": 5198, "pending": null, "totalTestResultsSource": "totalTestsViral", "totalTestResults": 6210, "hospitalizedCurrently": null, "hospitalizedCumulative": 40, "inIcuCurrently": null, "inIcuCumulative": null, "onVentilatorCurrently": null, "onVentilatorCumulative": null, "recovered": 137, "dataQualityGrade": "A", "lastUpdateEt": "4/11/2020 18:00", "dateModified": "2020-04-11T18:00:00Z", "checkTimeEt": "04/11 14:00", "death": 0, "hospitalized": 40, "dateChecked": "2020-04-11T18:00:00Z", "totalTestsViral": 6210, "positiveTestsViral": 287, "negativeTestsViral": 5923, "positiveCasesViral": 270, "deathConfirmed": null, "deathProbable": null, "totalTestEncountersViral": null, "totalTestsPeopleViral": null, "totalTestsAntibody": null, "positiveTestsAntibody": null, "negativeTestsAntibody": null, "totalTestsPeopleAntibody": null, "positiveTestsPeopleAntibody": null, "negativeTestsPeopleAntibody": null, "totalTestsPeopleAntigen": null, "positiveTestsPeopleAntigen": null, "totalTestsAntigen": null, "positiveTestsAntigen": null, "fips": "56", "positiveIncrease": 21, "negativeIncrease": 0, "total": 5562, "totalTestResultsIncrease": 47, "posNeg": 5562, "deathIncrease": 0, "hospitalizedIncrease": 3, "hash": "60c995dcc533f2687cd890f4bce03bf03b010b1d", "commercialScore": 0, "negativeRegularScore": 0, "negativeScore": 0, "positiveScore": 0, "score": 0, "grade": "", "month_number_label": "2020-04", "date_label": "2020-04-12", "week_number_label": "2020W15", "week_start_label": "2020-04-06"}, {"date": 20200413, "state": "WY", "positive": 373, "probableCases": 98, "negative": 5689, "pending": null, "totalTestResultsSource": "totalTestsViral", "totalTestResults": 6524, "hospitalizedCurrently": null, "hospitalizedCumulative": 41, "inIcuCurrently": null, "inIcuCumulative": null, "onVentilatorCurrently": null, "onVentilatorCumulative": null, "recovered": 138, "dataQualityGrade": "A", "lastUpdateEt": "4/13/2020 15:19", "dateModified": "2020-04-13T15:19:00Z", "checkTimeEt": "04/13 11:19", "death": 1, "hospitalized": 41, "dateChecked": "2020-04-13T15:19:00Z", "totalTestsViral": 6524, "positiveTestsViral": 295, "negativeTestsViral": 6229, "positiveCasesViral": 275, "deathConfirmed": null, "deathProbable": null, "totalTestEncountersViral": null, "totalTestsPeopleViral": null, "totalTestsAntibody": null, "positiveTestsAntibody": null, "negativeTestsAntibody": null, "totalTestsPeopleAntibody": null, "positiveTestsPeopleAntibody": null, "negativeTestsPeopleAntibody": null, "totalTestsPeopleAntigen": null, "positiveTestsPeopleAntigen": null, "totalTestsAntigen": null, "positiveTestsAntigen": null, "fips": "56", "positiveIncrease": 9, "negativeIncrease": 491, "total": 6062, "totalTestResultsIncrease": 314, "posNeg": 6062, "deathIncrease": 1, "hospitalizedIncrease": 1, "hash": "115ddcb7ad607ba00f05a21d90d7983affad1d75", "commercialScore": 0, "negativeRegularScore": 0, "negativeScore": 0, "positiveScore": 0, "score": 0, "grade": "", "month_number_label": "2020-04", "date_label": "2020-04-13", "week_number_label": "2020W16", "week_start_label": "2020-04-13"}, {"date": 20200414, "state": "WY", "positive": 383, "probableCases": 101, "negative": 5689, "pending": null, "totalTestResultsSource": "totalTestsViral", "totalTestResults": 6831, "hospitalizedCurrently": null, "hospitalizedCumulative": 43, "inIcuCurrently": null, "inIcuCumulative": null, "onVentilatorCurrently": null, "onVentilatorCumulative": null, "recovered": 140, "dataQualityGrade": "A", "lastUpdateEt": "4/14/2020 16:05", "dateModified": "2020-04-14T16:05:00Z", "checkTimeEt": "04/14 12:05", "death": 1, "hospitalized": 43, "dateChecked": "2020-04-14T16:05:00Z", "totalTestsViral": 6831, "positiveTestsViral": 310, "negativeTestsViral": 6521, "positiveCasesViral": 282, "deathConfirmed": null, "deathProbable": null, "totalTestEncountersViral": null, "totalTestsPeopleViral": null, "totalTestsAntibody": null, "positiveTestsAntibody": null, "negativeTestsAntibody": null, "totalTestsPeopleAntibody": null, "positiveTestsPeopleAntibody": null, "negativeTestsPeopleAntibody": null, "totalTestsPeopleAntigen": null, "positiveTestsPeopleAntigen": null, "totalTestsAntigen": null, "positiveTestsAntigen": null, "fips": "56", "positiveIncrease": 10, "negativeIncrease": 0, "total": 6072, "totalTestResultsIncrease": 307, "posNeg": 6072, "deathIncrease": 0, "hospitalizedIncrease": 2, "hash": "1cfd9ab9d4c906702cd105b0d272e81d12dd5e3c", "commercialScore": 0, "negativeRegularScore": 0, "negativeScore": 0, "positiveScore": 0, "score": 0, "grade": "", "month_number_label": "2020-04", "date_label": "2020-04-14", "week_number_label": "2020W16", "week_start_label": "2020-04-13"}, {"date": 20200415, "state": "WY", "positive": 393, "probableCases": 105, "negative": 6042, "pending": null, "totalTestResultsSource": "totalTestsViral", "totalTestResults": 7066, "hospitalizedCurrently": null, "hospitalizedCumulative": 43, "inIcuCurrently": null, "inIcuCumulative": null, "onVentilatorCurrently": null, "onVentilatorCumulative": null, "recovered": 129, "dataQualityGrade": "A", "lastUpdateEt": "4/15/2020 12:30", "dateModified": "2020-04-15T12:30:00Z", "checkTimeEt": "04/15 08:30", "death": 2, "hospitalized": 43, "dateChecked": "2020-04-15T12:30:00Z", "totalTestsViral": 7066, "positiveTestsViral": 318, "negativeTestsViral": 6748, "positiveCasesViral": 288, "deathConfirmed": null, "deathProbable": null, "totalTestEncountersViral": null, "totalTestsPeopleViral": null, "totalTestsAntibody": null, "positiveTestsAntibody": null, "negativeTestsAntibody": null, "totalTestsPeopleAntibody": null, "positiveTestsPeopleAntibody": null, "negativeTestsPeopleAntibody": null, "totalTestsPeopleAntigen": null, "positiveTestsPeopleAntigen": null, "totalTestsAntigen": null, "positiveTestsAntigen": null, "fips": "56", "positiveIncrease": 10, "negativeIncrease": 353, "total": 6435, "totalTestResultsIncrease": 235, "posNeg": 6435, "deathIncrease": 1, "hospitalizedIncrease": 0, "hash": "83f57018598a7dfe2d52be547f9587fa85a730a6", "commercialScore": 0, "negativeRegularScore": 0, "negativeScore": 0, "positiveScore": 0, "score": 0, "grade": "", "month_number_label": "2020-04", "date_label": "2020-04-15", "week_number_label": "2020W16", "week_start_label": "2020-04-13"}, {"date": 20200416, "state": "WY", "positive": 401, "probableCases": 105, "negative": 6131, "pending": null, "totalTestResultsSource": "totalTestsViral", "totalTestResults": 7306, "hospitalizedCurrently": 19, "hospitalizedCumulative": 43, "inIcuCurrently": null, "inIcuCumulative": null, "onVentilatorCurrently": null, "onVentilatorCumulative": null, "recovered": 148, "dataQualityGrade": "A", "lastUpdateEt": "4/16/2020 20:15", "dateModified": "2020-04-16T20:15:00Z", "checkTimeEt": "04/16 16:15", "death": 2, "hospitalized": 43, "dateChecked": "2020-04-16T20:15:00Z", "totalTestsViral": 7306, "positiveTestsViral": 323, "negativeTestsViral": 6983, "positiveCasesViral": 296, "deathConfirmed": null, "deathProbable": null, "totalTestEncountersViral": null, "totalTestsPeopleViral": null, "totalTestsAntibody": null, "positiveTestsAntibody": null, "negativeTestsAntibody": null, "totalTestsPeopleAntibody": null, "positiveTestsPeopleAntibody": null, "negativeTestsPeopleAntibody": null, "totalTestsPeopleAntigen": null, "positiveTestsPeopleAntigen": null, "totalTestsAntigen": null, "positiveTestsAntigen": null, "fips": "56", "positiveIncrease": 8, "negativeIncrease": 89, "total": 6532, "totalTestResultsIncrease": 240, "posNeg": 6532, "deathIncrease": 0, "hospitalizedIncrease": 0, "hash": "0477f17134337999bf245588d88e837f4417b307", "commercialScore": 0, "negativeRegularScore": 0, "negativeScore": 0, "positiveScore": 0, "score": 0, "grade": "", "month_number_label": "2020-04", "date_label": "2020-04-16", "week_number_label": "2020W16", "week_start_label": "2020-04-13"}, {"date": 20200417, "state": "WY", "positive": 412, "probableCases": 107, "negative": 6131, "pending": null, "totalTestResultsSource": "totalTestsViral", "totalTestResults": 7602, "hospitalizedCurrently": 19, "hospitalizedCumulative": 43, "inIcuCurrently": null, "inIcuCumulative": null, "onVentilatorCurrently": null, "onVentilatorCumulative": null, "recovered": 148, "dataQualityGrade": "A", "lastUpdateEt": "4/17/2020 16:02", "dateModified": "2020-04-17T16:02:00Z", "checkTimeEt": "04/17 12:02", "death": 2, "hospitalized": 43, "dateChecked": "2020-04-17T16:02:00Z", "totalTestsViral": 7602, "positiveTestsViral": 330, "negativeTestsViral": 7272, "positiveCasesViral": 305, "deathConfirmed": null, "deathProbable": null, "totalTestEncountersViral": null, "totalTestsPeopleViral": null, "totalTestsAntibody": null, "positiveTestsAntibody": null, "negativeTestsAntibody": null, "totalTestsPeopleAntibody": null, "positiveTestsPeopleAntibody": null, "negativeTestsPeopleAntibody": null, "totalTestsPeopleAntigen": null, "positiveTestsPeopleAntigen": null, "totalTestsAntigen": null, "positiveTestsAntigen": null, "fips": "56", "positiveIncrease": 11, "negativeIncrease": 0, "total": 6543, "totalTestResultsIncrease": 296, "posNeg": 6543, "deathIncrease": 0, "hospitalizedIncrease": 0, "hash": "2b168214ec9329d6ff9e955cf42e0f362a10d818", "commercialScore": 0, "negativeRegularScore": 0, "negativeScore": 0, "positiveScore": 0, "score": 0, "grade": "", "month_number_label": "2020-04", "date_label": "2020-04-17", "week_number_label": "2020W16", "week_start_label": "2020-04-13"}, {"date": 20200418, "state": "WY", "positive": 422, "probableCases": 113, "negative": 6217, "pending": null, "totalTestResultsSource": "totalTestsViral", "totalTestResults": 7701, "hospitalizedCurrently": 19, "hospitalizedCumulative": 50, "inIcuCurrently": null, "inIcuCumulative": null, "onVentilatorCurrently": null, "onVentilatorCumulative": null, "recovered": 206, "dataQualityGrade": "A", "lastUpdateEt": "4/17/2020 16:02", "dateModified": "2020-04-17T16:02:00Z", "checkTimeEt": "04/17 12:02", "death": 2, "hospitalized": 50, "dateChecked": "2020-04-17T16:02:00Z", "totalTestsViral": 7701, "positiveTestsViral": 334, "negativeTestsViral": 7367, "positiveCasesViral": 309, "deathConfirmed": null, "deathProbable": null, "totalTestEncountersViral": null, "totalTestsPeopleViral": null, "totalTestsAntibody": null, "positiveTestsAntibody": null, "negativeTestsAntibody": null, "totalTestsPeopleAntibody": null, "positiveTestsPeopleAntibody": null, "negativeTestsPeopleAntibody": null, "totalTestsPeopleAntigen": null, "positiveTestsPeopleAntigen": null, "totalTestsAntigen": null, "positiveTestsAntigen": null, "fips": "56", "positiveIncrease": 10, "negativeIncrease": 86, "total": 6639, "totalTestResultsIncrease": 99, "posNeg": 6639, "deathIncrease": 0, "hospitalizedIncrease": 7, "hash": "76869262346c51f8e5e3d3a7544f8eef83ed8fa8", "commercialScore": 0, "negativeRegularScore": 0, "negativeScore": 0, "positiveScore": 0, "score": 0, "grade": "", "month_number_label": "2020-04", "date_label": "2020-04-18", "week_number_label": "2020W16", "week_start_label": "2020-04-13"}, {"date": 20200419, "state": "WY", "positive": 426, "probableCases": 113, "negative": 6972, "pending": null, "totalTestResultsSource": "totalTestsViral", "totalTestResults": 7784, "hospitalizedCurrently": 19, "hospitalizedCumulative": 50, "inIcuCurrently": null, "inIcuCumulative": null, "onVentilatorCurrently": null, "onVentilatorCumulative": null, "recovered": 227, "dataQualityGrade": "A", "lastUpdateEt": "4/19/2020 00:00", "dateModified": "2020-04-19T00:00:00Z", "checkTimeEt": "04/18 20:00", "death": 2, "hospitalized": 50, "dateChecked": "2020-04-19T00:00:00Z", "totalTestsViral": 7784, "positiveTestsViral": 338, "negativeTestsViral": 7446, "positiveCasesViral": 313, "deathConfirmed": null, "deathProbable": null, "totalTestEncountersViral": null, "totalTestsPeopleViral": null, "totalTestsAntibody": null, "positiveTestsAntibody": null, "negativeTestsAntibody": null, "totalTestsPeopleAntibody": null, "positiveTestsPeopleAntibody": null, "negativeTestsPeopleAntibody": null, "totalTestsPeopleAntigen": null, "positiveTestsPeopleAntigen": null, "totalTestsAntigen": null, "positiveTestsAntigen": null, "fips": "56", "positiveIncrease": 4, "negativeIncrease": 755, "total": 7398, "totalTestResultsIncrease": 83, "posNeg": 7398, "deathIncrease": 0, "hospitalizedIncrease": 0, "hash": "273fdf2824c2157c8a8a910bfd9d9b8aaa604d6c", "commercialScore": 0, "negativeRegularScore": 0, "negativeScore": 0, "positiveScore": 0, "score": 0, "grade": "", "month_number_label": "2020-04", "date_label": "2020-04-19", "week_number_label": "2020W16", "week_start_label": "2020-04-13"}, {"date": 20200420, "state": "WY", "positive": 428, "probableCases": 111, "negative": 7073, "pending": null, "totalTestResultsSource": "totalTestsViral", "totalTestResults": 8083, "hospitalizedCurrently": 19, "hospitalizedCumulative": 51, "inIcuCurrently": null, "inIcuCumulative": null, "onVentilatorCurrently": null, "onVentilatorCumulative": null, "recovered": 233, "dataQualityGrade": "A", "lastUpdateEt": "4/19/2020 00:00", "dateModified": "2020-04-19T00:00:00Z", "checkTimeEt": "04/18 20:00", "death": 2, "hospitalized": 51, "dateChecked": "2020-04-19T00:00:00Z", "totalTestsViral": 8083, "positiveTestsViral": 347, "negativeTestsViral": 7736, "positiveCasesViral": 317, "deathConfirmed": null, "deathProbable": null, "totalTestEncountersViral": null, "totalTestsPeopleViral": null, "totalTestsAntibody": null, "positiveTestsAntibody": null, "negativeTestsAntibody": null, "totalTestsPeopleAntibody": null, "positiveTestsPeopleAntibody": null, "negativeTestsPeopleAntibody": null, "totalTestsPeopleAntigen": null, "positiveTestsPeopleAntigen": null, "totalTestsAntigen": null, "positiveTestsAntigen": null, "fips": "56", "positiveIncrease": 2, "negativeIncrease": 101, "total": 7501, "totalTestResultsIncrease": 299, "posNeg": 7501, "deathIncrease": 0, "hospitalizedIncrease": 1, "hash": "79848cb54f947785a9033622b8c48cf6209c2a28", "commercialScore": 0, "negativeRegularScore": 0, "negativeScore": 0, "positiveScore": 0, "score": 0, "grade": "", "month_number_label": "2020-04", "date_label": "2020-04-20", "week_number_label": "2020W17", "week_start_label": "2020-04-20"}, {"date": 20200421, "state": "WY", "positive": 441, "probableCases": 119, "negative": 7301, "pending": null, "totalTestResultsSource": "totalTestsViral", "totalTestResults": 8380, "hospitalizedCurrently": 19, "hospitalizedCumulative": 52, "inIcuCurrently": null, "inIcuCumulative": null, "onVentilatorCurrently": null, "onVentilatorCumulative": null, "recovered": 237, "dataQualityGrade": "A", "lastUpdateEt": "4/21/2020 16:20", "dateModified": "2020-04-21T16:20:00Z", "checkTimeEt": "04/21 12:20", "death": 6, "hospitalized": 52, "dateChecked": "2020-04-21T16:20:00Z", "totalTestsViral": 8380, "positiveTestsViral": 356, "negativeTestsViral": 8024, "positiveCasesViral": 322, "deathConfirmed": null, "deathProbable": null, "totalTestEncountersViral": null, "totalTestsPeopleViral": null, "totalTestsAntibody": null, "positiveTestsAntibody": null, "negativeTestsAntibody": null, "totalTestsPeopleAntibody": null, "positiveTestsPeopleAntibody": null, "negativeTestsPeopleAntibody": null, "totalTestsPeopleAntigen": null, "positiveTestsPeopleAntigen": null, "totalTestsAntigen": null, "positiveTestsAntigen": null, "fips": "56", "positiveIncrease": 13, "negativeIncrease": 228, "total": 7742, "totalTestResultsIncrease": 297, "posNeg": 7742, "deathIncrease": 4, "hospitalizedIncrease": 1, "hash": "43ff55c0602a2b05fd2134c52e261967894d83d3", "commercialScore": 0, "negativeRegularScore": 0, "negativeScore": 0, "positiveScore": 0, "score": 0, "grade": "", "month_number_label": "2020-04", "date_label": "2020-04-21", "week_number_label": "2020W17", "week_start_label": "2020-04-20"}, {"date": 20200422, "state": "WY", "positive": 447, "probableCases": 121, "negative": 7301, "pending": null, "totalTestResultsSource": "totalTestsViral", "totalTestResults": 8669, "hospitalizedCurrently": 19, "hospitalizedCumulative": 52, "inIcuCurrently": null, "inIcuCumulative": null, "onVentilatorCurrently": null, "onVentilatorCumulative": null, "recovered": 254, "dataQualityGrade": "A", "lastUpdateEt": "4/22/2020 23:00", "dateModified": "2020-04-22T23:00:00Z", "checkTimeEt": "04/22 19:00", "death": 6, "hospitalized": 52, "dateChecked": "2020-04-22T23:00:00Z", "totalTestsViral": 8669, "positiveTestsViral": 373, "negativeTestsViral": 8296, "positiveCasesViral": 326, "deathConfirmed": null, "deathProbable": null, "totalTestEncountersViral": null, "totalTestsPeopleViral": null, "totalTestsAntibody": null, "positiveTestsAntibody": null, "negativeTestsAntibody": null, "totalTestsPeopleAntibody": null, "positiveTestsPeopleAntibody": null, "negativeTestsPeopleAntibody": null, "totalTestsPeopleAntigen": null, "positiveTestsPeopleAntigen": null, "totalTestsAntigen": null, "positiveTestsAntigen": null, "fips": "56", "positiveIncrease": 6, "negativeIncrease": 0, "total": 7748, "totalTestResultsIncrease": 289, "posNeg": 7748, "deathIncrease": 0, "hospitalizedIncrease": 0, "hash": "66f95e0653866e7efb40195e0dae818165f43256", "commercialScore": 0, "negativeRegularScore": 0, "negativeScore": 0, "positiveScore": 0, "score": 0, "grade": "", "month_number_label": "2020-04", "date_label": "2020-04-22", "week_number_label": "2020W17", "week_start_label": "2020-04-20"}, {"date": 20200423, "state": "WY", "positive": 453, "probableCases": 121, "negative": 7241, "pending": null, "totalTestResultsSource": "totalTestsViral", "totalTestResults": 8938, "hospitalizedCurrently": null, "hospitalizedCumulative": 52, "inIcuCurrently": null, "inIcuCumulative": null, "onVentilatorCurrently": null, "onVentilatorCumulative": null, "recovered": 275, "dataQualityGrade": "A", "lastUpdateEt": "4/23/2020 16:27", "dateModified": "2020-04-23T16:27:00Z", "checkTimeEt": "04/23 12:27", "death": 7, "hospitalized": 52, "dateChecked": "2020-04-23T16:27:00Z", "totalTestsViral": 8938, "positiveTestsViral": 396, "negativeTestsViral": 8542, "positiveCasesViral": 332, "deathConfirmed": null, "deathProbable": null, "totalTestEncountersViral": null, "totalTestsPeopleViral": null, "totalTestsAntibody": null, "positiveTestsAntibody": null, "negativeTestsAntibody": null, "totalTestsPeopleAntibody": null, "positiveTestsPeopleAntibody": null, "negativeTestsPeopleAntibody": null, "totalTestsPeopleAntigen": null, "positiveTestsPeopleAntigen": null, "totalTestsAntigen": null, "positiveTestsAntigen": null, "fips": "56", "positiveIncrease": 6, "negativeIncrease": -60, "total": 7694, "totalTestResultsIncrease": 269, "posNeg": 7694, "deathIncrease": 1, "hospitalizedIncrease": 0, "hash": "805046888b61915ef81d5f43a6c27de1617c51a3", "commercialScore": 0, "negativeRegularScore": 0, "negativeScore": 0, "positiveScore": 0, "score": 0, "grade": "", "month_number_label": "2020-04", "date_label": "2020-04-23", "week_number_label": "2020W17", "week_start_label": "2020-04-20"}, {"date": 20200424, "state": "WY", "positive": 473, "probableCases": 124, "negative": 7696, "pending": null, "totalTestResultsSource": "totalTestsViral", "totalTestResults": 9356, "hospitalizedCurrently": 16, "hospitalizedCumulative": 54, "inIcuCurrently": null, "inIcuCumulative": null, "onVentilatorCurrently": null, "onVentilatorCumulative": null, "recovered": 321, "dataQualityGrade": "A", "lastUpdateEt": "4/24/2020 00:00", "dateModified": "2020-04-24T00:00:00Z", "checkTimeEt": "04/23 20:00", "death": 7, "hospitalized": 54, "dateChecked": "2020-04-24T00:00:00Z", "totalTestsViral": 9356, "positiveTestsViral": 420, "negativeTestsViral": 8936, "positiveCasesViral": 349, "deathConfirmed": null, "deathProbable": null, "totalTestEncountersViral": null, "totalTestsPeopleViral": null, "totalTestsAntibody": null, "positiveTestsAntibody": null, "negativeTestsAntibody": null, "totalTestsPeopleAntibody": null, "positiveTestsPeopleAntibody": null, "negativeTestsPeopleAntibody": null, "totalTestsPeopleAntigen": null, "positiveTestsPeopleAntigen": null, "totalTestsAntigen": null, "positiveTestsAntigen": null, "fips": "56", "positiveIncrease": 20, "negativeIncrease": 455, "total": 8169, "totalTestResultsIncrease": 418, "posNeg": 8169, "deathIncrease": 0, "hospitalizedIncrease": 2, "hash": "4e2d1092c06a93206665d9a07fb5dda6c4bfca82", "commercialScore": 0, "negativeRegularScore": 0, "negativeScore": 0, "positiveScore": 0, "score": 0, "grade": "", "month_number_label": "2020-04", "date_label": "2020-04-24", "week_number_label": "2020W17", "week_start_label": "2020-04-20"}, {"date": 20200425, "state": "WY", "positive": 491, "probableCases": 129, "negative": 7797, "pending": null, "totalTestResultsSource": "totalTestsViral", "totalTestResults": 9453, "hospitalizedCurrently": 16, "hospitalizedCumulative": 54, "inIcuCurrently": null, "inIcuCumulative": null, "onVentilatorCurrently": null, "onVentilatorCumulative": null, "recovered": 321, "dataQualityGrade": "C", "lastUpdateEt": "4/24/2020 16:02", "dateModified": "2020-04-24T16:02:00Z", "checkTimeEt": "04/24 12:02", "death": 7, "hospitalized": 54, "dateChecked": "2020-04-24T16:02:00Z", "totalTestsViral": 9453, "positiveTestsViral": 423, "negativeTestsViral": 9030, "positiveCasesViral": 362, "deathConfirmed": null, "deathProbable": null, "totalTestEncountersViral": null, "totalTestsPeopleViral": null, "totalTestsAntibody": null, "positiveTestsAntibody": null, "negativeTestsAntibody": null, "totalTestsPeopleAntibody": null, "positiveTestsPeopleAntibody": null, "negativeTestsPeopleAntibody": null, "totalTestsPeopleAntigen": null, "positiveTestsPeopleAntigen": null, "totalTestsAntigen": null, "positiveTestsAntigen": null, "fips": "56", "positiveIncrease": 18, "negativeIncrease": 101, "total": 8288, "totalTestResultsIncrease": 97, "posNeg": 8288, "deathIncrease": 0, "hospitalizedIncrease": 0, "hash": "f2f5a0d5b5fbd448b5b7be7a74df48fddcb81ea5", "commercialScore": 0, "negativeRegularScore": 0, "negativeScore": 0, "positiveScore": 0, "score": 0, "grade": "", "month_number_label": "2020-04", "date_label": "2020-04-25", "week_number_label": "2020W17", "week_start_label": "2020-04-20"}, {"date": 20200426, "state": "WY", "positive": 502, "probableCases": 132, "negative": 7797, "pending": null, "totalTestResultsSource": "totalTestsViral", "totalTestResults": 9530, "hospitalizedCurrently": 16, "hospitalizedCumulative": 54, "inIcuCurrently": null, "inIcuCumulative": null, "onVentilatorCurrently": null, "onVentilatorCumulative": null, "recovered": 334, "dataQualityGrade": "C", "lastUpdateEt": "4/25/2020 17:20", "dateModified": "2020-04-25T17:20:00Z", "checkTimeEt": "04/25 13:20", "death": 7, "hospitalized": 54, "dateChecked": "2020-04-25T17:20:00Z", "totalTestsViral": 9530, "positiveTestsViral": 427, "negativeTestsViral": 9103, "positiveCasesViral": 370, "deathConfirmed": null, "deathProbable": null, "totalTestEncountersViral": null, "totalTestsPeopleViral": null, "totalTestsAntibody": null, "positiveTestsAntibody": null, "negativeTestsAntibody": null, "totalTestsPeopleAntibody": null, "positiveTestsPeopleAntibody": null, "negativeTestsPeopleAntibody": null, "totalTestsPeopleAntigen": null, "positiveTestsPeopleAntigen": null, "totalTestsAntigen": null, "positiveTestsAntigen": null, "fips": "56", "positiveIncrease": 11, "negativeIncrease": 0, "total": 8299, "totalTestResultsIncrease": 77, "posNeg": 8299, "deathIncrease": 0, "hospitalizedIncrease": 0, "hash": "0ff8183655099da360373bbff50b9e423375f4bf", "commercialScore": 0, "negativeRegularScore": 0, "negativeScore": 0, "positiveScore": 0, "score": 0, "grade": "", "month_number_label": "2020-04", "date_label": "2020-04-26", "week_number_label": "2020W17", "week_start_label": "2020-04-20"}, {"date": 20200427, "state": "WY", "positive": 520, "probableCases": 131, "negative": 7797, "pending": null, "totalTestResultsSource": "totalTestsViral", "totalTestResults": 10111, "hospitalizedCurrently": 16, "hospitalizedCumulative": 54, "inIcuCurrently": null, "inIcuCumulative": null, "onVentilatorCurrently": null, "onVentilatorCumulative": null, "recovered": 342, "dataQualityGrade": "C", "lastUpdateEt": "4/26/2020 13:58", "dateModified": "2020-04-26T13:58:00Z", "checkTimeEt": "04/26 09:58", "death": 7, "hospitalized": 54, "dateChecked": "2020-04-26T13:58:00Z", "totalTestsViral": 10111, "positiveTestsViral": 441, "negativeTestsViral": 9670, "positiveCasesViral": 389, "deathConfirmed": null, "deathProbable": null, "totalTestEncountersViral": null, "totalTestsPeopleViral": null, "totalTestsAntibody": null, "positiveTestsAntibody": null, "negativeTestsAntibody": null, "totalTestsPeopleAntibody": null, "positiveTestsPeopleAntibody": null, "negativeTestsPeopleAntibody": null, "totalTestsPeopleAntigen": null, "positiveTestsPeopleAntigen": null, "totalTestsAntigen": null, "positiveTestsAntigen": null, "fips": "56", "positiveIncrease": 18, "negativeIncrease": 0, "total": 8317, "totalTestResultsIncrease": 581, "posNeg": 8317, "deathIncrease": 0, "hospitalizedIncrease": 0, "hash": "9cfa14980c4c8eab9d4552b4bd8d680f5cba1f80", "commercialScore": 0, "negativeRegularScore": 0, "negativeScore": 0, "positiveScore": 0, "score": 0, "grade": "", "month_number_label": "2020-04", "date_label": "2020-04-27", "week_number_label": "2020W18", "week_start_label": "2020-04-27"}, {"date": 20200428, "state": "WY", "positive": 536, "probableCases": 140, "negative": 8226, "pending": null, "totalTestResultsSource": "totalTestsViral", "totalTestResults": 10782, "hospitalizedCurrently": 16, "hospitalizedCumulative": 56, "inIcuCurrently": null, "inIcuCumulative": null, "onVentilatorCurrently": null, "onVentilatorCumulative": null, "recovered": 343, "dataQualityGrade": "C", "lastUpdateEt": "4/27/2020 17:05", "dateModified": "2020-04-27T17:05:00Z", "checkTimeEt": "04/27 13:05", "death": 7, "hospitalized": 56, "dateChecked": "2020-04-27T17:05:00Z", "totalTestsViral": 10782, "positiveTestsViral": 453, "negativeTestsViral": 10329, "positiveCasesViral": 396, "deathConfirmed": null, "deathProbable": null, "totalTestEncountersViral": null, "totalTestsPeopleViral": null, "totalTestsAntibody": null, "positiveTestsAntibody": null, "negativeTestsAntibody": null, "totalTestsPeopleAntibody": null, "positiveTestsPeopleAntibody": null, "negativeTestsPeopleAntibody": null, "totalTestsPeopleAntigen": null, "positiveTestsPeopleAntigen": null, "totalTestsAntigen": null, "positiveTestsAntigen": null, "fips": "56", "positiveIncrease": 16, "negativeIncrease": 429, "total": 8762, "totalTestResultsIncrease": 671, "posNeg": 8762, "deathIncrease": 0, "hospitalizedIncrease": 2, "hash": "ad372c7be82985d1715f6677a2cf24ecc7b3aaa9", "commercialScore": 0, "negativeRegularScore": 0, "negativeScore": 0, "positiveScore": 0, "score": 0, "grade": "", "month_number_label": "2020-04", "date_label": "2020-04-28", "week_number_label": "2020W18", "week_start_label": "2020-04-27"}, {"date": 20200429, "state": "WY", "positive": 544, "probableCases": 140, "negative": 8681, "pending": null, "totalTestResultsSource": "totalTestsViral", "totalTestResults": 11226, "hospitalizedCurrently": 12, "hospitalizedCumulative": 56, "inIcuCurrently": null, "inIcuCumulative": null, "onVentilatorCurrently": null, "onVentilatorCumulative": null, "recovered": 362, "dataQualityGrade": "C", "lastUpdateEt": "4/29/2020 00:00", "dateModified": "2020-04-29T00:00:00Z", "checkTimeEt": "04/28 20:00", "death": 7, "hospitalized": 56, "dateChecked": "2020-04-29T00:00:00Z", "totalTestsViral": 11226, "positiveTestsViral": 460, "negativeTestsViral": 10766, "positiveCasesViral": 404, "deathConfirmed": null, "deathProbable": null, "totalTestEncountersViral": null, "totalTestsPeopleViral": null, "totalTestsAntibody": null, "positiveTestsAntibody": null, "negativeTestsAntibody": null, "totalTestsPeopleAntibody": null, "positiveTestsPeopleAntibody": null, "negativeTestsPeopleAntibody": null, "totalTestsPeopleAntigen": null, "positiveTestsPeopleAntigen": null, "totalTestsAntigen": null, "positiveTestsAntigen": null, "fips": "56", "positiveIncrease": 8, "negativeIncrease": 455, "total": 9225, "totalTestResultsIncrease": 444, "posNeg": 9225, "deathIncrease": 0, "hospitalizedIncrease": 0, "hash": "a607c865c5ec16e3cd2f592b8854700498f7a72a", "commercialScore": 0, "negativeRegularScore": 0, "negativeScore": 0, "positiveScore": 0, "score": 0, "grade": "", "month_number_label": "2020-04", "date_label": "2020-04-29", "week_number_label": "2020W18", "week_start_label": "2020-04-27"}, {"date": 20200430, "state": "WY", "positive": 559, "probableCases": 144, "negative": 8902, "pending": null, "totalTestResultsSource": "totalTestsViral", "totalTestResults": 11660, "hospitalizedCurrently": 13, "hospitalizedCumulative": 56, "inIcuCurrently": null, "inIcuCumulative": null, "onVentilatorCurrently": null, "onVentilatorCumulative": null, "recovered": 371, "dataQualityGrade": "C", "lastUpdateEt": "4/29/2020 00:00", "dateModified": "2020-04-29T00:00:00Z", "checkTimeEt": "04/28 20:00", "death": 7, "hospitalized": 56, "dateChecked": "2020-04-29T00:00:00Z", "totalTestsViral": 11660, "positiveTestsViral": 471, "negativeTestsViral": 11189, "positiveCasesViral": 415, "deathConfirmed": null, "deathProbable": null, "totalTestEncountersViral": null, "totalTestsPeopleViral": null, "totalTestsAntibody": null, "positiveTestsAntibody": null, "negativeTestsAntibody": null, "totalTestsPeopleAntibody": null, "positiveTestsPeopleAntibody": null, "negativeTestsPeopleAntibody": null, "totalTestsPeopleAntigen": null, "positiveTestsPeopleAntigen": null, "totalTestsAntigen": null, "positiveTestsAntigen": null, "fips": "56", "positiveIncrease": 15, "negativeIncrease": 221, "total": 9461, "totalTestResultsIncrease": 434, "posNeg": 9461, "deathIncrease": 0, "hospitalizedIncrease": 0, "hash": "dd5bba3f1f2cab1ffedfd53ad294e05cbd21f72d", "commercialScore": 0, "negativeRegularScore": 0, "negativeScore": 0, "positiveScore": 0, "score": 0, "grade": "", "month_number_label": "2020-04", "date_label": "2020-04-30", "week_number_label": "2020W18", "week_start_label": "2020-04-27"}, {"date": 20200501, "state": "WY", "positive": 566, "probableCases": 146, "negative": 9136, "pending": null, "totalTestResultsSource": "totalTestsViral", "totalTestResults": 12279, "hospitalizedCurrently": 13, "hospitalizedCumulative": 56, "inIcuCurrently": null, "inIcuCumulative": null, "onVentilatorCurrently": null, "onVentilatorCumulative": null, "recovered": 373, "dataQualityGrade": "C", "lastUpdateEt": "4/30/2020 00:00", "dateModified": "2020-04-30T00:00:00Z", "checkTimeEt": "04/29 20:00", "death": 7, "hospitalized": 56, "dateChecked": "2020-04-30T00:00:00Z", "totalTestsViral": 12279, "positiveTestsViral": 487, "negativeTestsViral": 11792, "positiveCasesViral": 420, "deathConfirmed": null, "deathProbable": null, "totalTestEncountersViral": null, "totalTestsPeopleViral": null, "totalTestsAntibody": null, "positiveTestsAntibody": null, "negativeTestsAntibody": null, "totalTestsPeopleAntibody": null, "positiveTestsPeopleAntibody": null, "negativeTestsPeopleAntibody": null, "totalTestsPeopleAntigen": null, "positiveTestsPeopleAntigen": null, "totalTestsAntigen": null, "positiveTestsAntigen": null, "fips": "56", "positiveIncrease": 7, "negativeIncrease": 234, "total": 9702, "totalTestResultsIncrease": 619, "posNeg": 9702, "deathIncrease": 0, "hospitalizedIncrease": 0, "hash": "fb2d54445b21ba9e9f553893efbb43a41b505b09", "commercialScore": 0, "negativeRegularScore": 0, "negativeScore": 0, "positiveScore": 0, "score": 0, "grade": "", "month_number_label": "2020-05", "date_label": "2020-05-01", "week_number_label": "2020W18", "week_start_label": "2020-04-27"}, {"date": 20200502, "state": "WY", "positive": 579, "probableCases": 150, "negative": 9463, "pending": null, "totalTestResultsSource": "totalTestsViral", "totalTestResults": 12402, "hospitalizedCurrently": 13, "hospitalizedCumulative": 58, "inIcuCurrently": null, "inIcuCumulative": null, "onVentilatorCurrently": null, "onVentilatorCumulative": null, "recovered": 387, "dataQualityGrade": "C", "lastUpdateEt": "5/1/2020 15:49", "dateModified": "2020-05-01T15:49:00Z", "checkTimeEt": "05/01 11:49", "death": 7, "hospitalized": 58, "dateChecked": "2020-05-01T15:49:00Z", "totalTestsViral": 12402, "positiveTestsViral": 493, "negativeTestsViral": 11909, "positiveCasesViral": 429, "deathConfirmed": null, "deathProbable": null, "totalTestEncountersViral": null, "totalTestsPeopleViral": null, "totalTestsAntibody": null, "positiveTestsAntibody": null, "negativeTestsAntibody": null, "totalTestsPeopleAntibody": null, "positiveTestsPeopleAntibody": null, "negativeTestsPeopleAntibody": null, "totalTestsPeopleAntigen": null, "positiveTestsPeopleAntigen": null, "totalTestsAntigen": null, "positiveTestsAntigen": null, "fips": "56", "positiveIncrease": 13, "negativeIncrease": 327, "total": 10042, "totalTestResultsIncrease": 123, "posNeg": 10042, "deathIncrease": 0, "hospitalizedIncrease": 2, "hash": "f92dc618a9975535be2194bdb95e32af19d48804", "commercialScore": 0, "negativeRegularScore": 0, "negativeScore": 0, "positiveScore": 0, "score": 0, "grade": "", "month_number_label": "2020-05", "date_label": "2020-05-02", "week_number_label": "2020W18", "week_start_label": "2020-04-27"}, {"date": 20200503, "state": "WY", "positive": 586, "probableCases": 151, "negative": 9640, "pending": null, "totalTestResultsSource": "totalTestsViral", "totalTestResults": 12528, "hospitalizedCurrently": 13, "hospitalizedCumulative": 60, "inIcuCurrently": null, "inIcuCumulative": null, "onVentilatorCurrently": null, "onVentilatorCumulative": null, "recovered": 391, "dataQualityGrade": "C", "lastUpdateEt": "5/2/2020 13:12", "dateModified": "2020-05-02T13:12:00Z", "checkTimeEt": "05/02 09:12", "death": 7, "hospitalized": 60, "dateChecked": "2020-05-02T13:12:00Z", "totalTestsViral": 12528, "positiveTestsViral": 493, "negativeTestsViral": 12035, "positiveCasesViral": 435, "deathConfirmed": null, "deathProbable": null, "totalTestEncountersViral": null, "totalTestsPeopleViral": null, "totalTestsAntibody": null, "positiveTestsAntibody": null, "negativeTestsAntibody": null, "totalTestsPeopleAntibody": null, "positiveTestsPeopleAntibody": null, "negativeTestsPeopleAntibody": null, "totalTestsPeopleAntigen": null, "positiveTestsPeopleAntigen": null, "totalTestsAntigen": null, "positiveTestsAntigen": null, "fips": "56", "positiveIncrease": 7, "negativeIncrease": 177, "total": 10226, "totalTestResult