[{"date": 20200307, "state": "LA", "positive": 0, "probableCases": null, "negative": null, "pending": null, "totalTestResultsSource": "posNeg", "totalTestResults": 0, "hospitalizedCurrently": null, "hospitalizedCumulative": null, "inIcuCurrently": null, "inIcuCumulative": null, "onVentilatorCurrently": null, "onVentilatorCumulative": null, "recovered": null, "dataQualityGrade": null, "lastUpdateEt": null, "dateModified": null, "checkTimeEt": null, "death": null, "hospitalized": null, "dateChecked": null, "totalTestsViral": null, "positiveTestsViral": null, "negativeTestsViral": null, "positiveCasesViral": 0, "deathConfirmed": null, "deathProbable": null, "totalTestEncountersViral": null, "totalTestsPeopleViral": null, "totalTestsAntibody": null, "positiveTestsAntibody": null, "negativeTestsAntibody": null, "totalTestsPeopleAntibody": null, "positiveTestsPeopleAntibody": null, "negativeTestsPeopleAntibody": null, "totalTestsPeopleAntigen": null, "positiveTestsPeopleAntigen": null, "totalTestsAntigen": null, "positiveTestsAntigen": null, "fips": "22", "positiveIncrease": 0, "negativeIncrease": 0, "total": 0, "totalTestResultsIncrease": 0, "posNeg": 0, "deathIncrease": 0, "hospitalizedIncrease": 0, "hash": "4c0d8d082259b6ab8966808ddcfb80878fd10a82", "commercialScore": 0, "negativeRegularScore": 0, "negativeScore": 0, "positiveScore": 0, "score": 0, "grade": "", "month_number_label": "2020-03", "date_label": "2020-03-07", "week_number_label": "2020W10", "week_start_label": "2020-03-02"}, {"date": 20200308, "state": "LA", "positive": 0, "probableCases": null, "negative": 5, "pending": null, "totalTestResultsSource": "posNeg", "totalTestResults": 5, "hospitalizedCurrently": null, "hospitalizedCumulative": null, "inIcuCurrently": null, "inIcuCumulative": null, "onVentilatorCurrently": null, "onVentilatorCumulative": null, "recovered": null, "dataQualityGrade": null, "lastUpdateEt": null, "dateModified": null, "checkTimeEt": null, "death": null, "hospitalized": null, "dateChecked": null, "totalTestsViral": null, "positiveTestsViral": null, "negativeTestsViral": null, "positiveCasesViral": 0, "deathConfirmed": null, "deathProbable": null, "totalTestEncountersViral": null, "totalTestsPeopleViral": null, "totalTestsAntibody": null, "positiveTestsAntibody": null, "negativeTestsAntibody": null, "totalTestsPeopleAntibody": null, "positiveTestsPeopleAntibody": null, "negativeTestsPeopleAntibody": null, "totalTestsPeopleAntigen": null, "positiveTestsPeopleAntigen": null, "totalTestsAntigen": null, "positiveTestsAntigen": null, "fips": "22", "positiveIncrease": 0, "negativeIncrease": 5, "total": 5, "totalTestResultsIncrease": 5, "posNeg": 5, "deathIncrease": 0, "hospitalizedIncrease": 0, "hash": "f77f1ddccdfc1dde11ea0a907a121ddb7a8ee305", "commercialScore": 0, "negativeRegularScore": 0, "negativeScore": 0, "positiveScore": 0, "score": 0, "grade": "", "month_number_label": "2020-03", "date_label": "2020-03-08", "week_number_label": "2020W10", "week_start_label": "2020-03-02"}, {"date": 20200309, "state": "LA", "positive": 1, "probableCases": null, "negative": 5, "pending": null, "totalTestResultsSource": "posNeg", "totalTestResults": 6, "hospitalizedCurrently": null, "hospitalizedCumulative": null, "inIcuCurrently": null, "inIcuCumulative": null, "onVentilatorCurrently": null, "onVentilatorCumulative": null, "recovered": null, "dataQualityGrade": null, "lastUpdateEt": null, "dateModified": null, "checkTimeEt": null, "death": null, "hospitalized": null, "dateChecked": null, "totalTestsViral": null, "positiveTestsViral": null, "negativeTestsViral": null, "positiveCasesViral": 1, "deathConfirmed": null, "deathProbable": null, "totalTestEncountersViral": null, "totalTestsPeopleViral": null, "totalTestsAntibody": null, "positiveTestsAntibody": null, "negativeTestsAntibody": null, "totalTestsPeopleAntibody": null, "positiveTestsPeopleAntibody": null, "negativeTestsPeopleAntibody": null, "totalTestsPeopleAntigen": null, "positiveTestsPeopleAntigen": null, "totalTestsAntigen": null, "positiveTestsAntigen": null, "fips": "22", "positiveIncrease": 1, "negativeIncrease": 0, "total": 6, "totalTestResultsIncrease": 1, "posNeg": 6, "deathIncrease": 0, "hospitalizedIncrease": 0, "hash": "6db9e3290ccc05283f7ca2043b86fc8d81e2fc9a", "commercialScore": 0, "negativeRegularScore": 0, "negativeScore": 0, "positiveScore": 0, "score": 0, "grade": "", "month_number_label": "2020-03", "date_label": "2020-03-09", "week_number_label": "2020W11", "week_start_label": "2020-03-09"}, {"date": 20200310, "state": "LA", "positive": 1, "probableCases": null, "negative": 11, "pending": null, "totalTestResultsSource": "posNeg", "totalTestResults": 12, "hospitalizedCurrently": null, "hospitalizedCumulative": null, "inIcuCurrently": null, "inIcuCumulative": null, "onVentilatorCurrently": null, "onVentilatorCumulative": null, "recovered": null, "dataQualityGrade": null, "lastUpdateEt": null, "dateModified": null, "checkTimeEt": null, "death": null, "hospitalized": null, "dateChecked": null, "totalTestsViral": null, "positiveTestsViral": null, "negativeTestsViral": null, "positiveCasesViral": 1, "deathConfirmed": null, "deathProbable": null, "totalTestEncountersViral": null, "totalTestsPeopleViral": null, "totalTestsAntibody": null, "positiveTestsAntibody": null, "negativeTestsAntibody": null, "totalTestsPeopleAntibody": null, "positiveTestsPeopleAntibody": null, "negativeTestsPeopleAntibody": null, "totalTestsPeopleAntigen": null, "positiveTestsPeopleAntigen": null, "totalTestsAntigen": null, "positiveTestsAntigen": null, "fips": "22", "positiveIncrease": 0, "negativeIncrease": 6, "total": 12, "totalTestResultsIncrease": 6, "posNeg": 12, "deathIncrease": 0, "hospitalizedIncrease": 0, "hash": "7017398265078de5fff6c5be870bd89eb4794419", "commercialScore": 0, "negativeRegularScore": 0, "negativeScore": 0, "positiveScore": 0, "score": 0, "grade": "", "month_number_label": "2020-03", "date_label": "2020-03-10", "week_number_label": "2020W11", "week_start_label": "2020-03-09"}, {"date": 20200311, "state": "LA", "positive": 6, "probableCases": null, "negative": 37, "pending": null, "totalTestResultsSource": "posNeg", "totalTestResults": 43, "hospitalizedCurrently": null, "hospitalizedCumulative": null, "inIcuCurrently": null, "inIcuCumulative": null, "onVentilatorCurrently": null, "onVentilatorCumulative": null, "recovered": null, "dataQualityGrade": null, "lastUpdateEt": null, "dateModified": null, "checkTimeEt": null, "death": null, "hospitalized": null, "dateChecked": null, "totalTestsViral": null, "positiveTestsViral": null, "negativeTestsViral": null, "positiveCasesViral": 6, "deathConfirmed": null, "deathProbable": null, "totalTestEncountersViral": null, "totalTestsPeopleViral": null, "totalTestsAntibody": null, "positiveTestsAntibody": null, "negativeTestsAntibody": null, "totalTestsPeopleAntibody": null, "positiveTestsPeopleAntibody": null, "negativeTestsPeopleAntibody": null, "totalTestsPeopleAntigen": null, "positiveTestsPeopleAntigen": null, "totalTestsAntigen": null, "positiveTestsAntigen": null, "fips": "22", "positiveIncrease": 5, "negativeIncrease": 26, "total": 43, "totalTestResultsIncrease": 31, "posNeg": 43, "deathIncrease": 0, "hospitalizedIncrease": 0, "hash": "7f53b374b988da4a46373100b8d0b0bed134093b", "commercialScore": 0, "negativeRegularScore": 0, "negativeScore": 0, "positiveScore": 0, "score": 0, "grade": "", "month_number_label": "2020-03", "date_label": "2020-03-11", "week_number_label": "2020W11", "week_start_label": "2020-03-09"}, {"date": 20200312, "state": "LA", "positive": 14, "probableCases": null, "negative": 37, "pending": null, "totalTestResultsSource": "posNeg", "totalTestResults": 51, "hospitalizedCurrently": null, "hospitalizedCumulative": null, "inIcuCurrently": null, "inIcuCumulative": null, "onVentilatorCurrently": null, "onVentilatorCumulative": null, "recovered": null, "dataQualityGrade": null, "lastUpdateEt": "3/12/2020 10:30", "dateModified": "2020-03-12T10:30:00Z", "checkTimeEt": "03/12 06:30", "death": null, "hospitalized": null, "dateChecked": "2020-03-12T10:30:00Z", "totalTestsViral": null, "positiveTestsViral": null, "negativeTestsViral": null, "positiveCasesViral": 14, "deathConfirmed": null, "deathProbable": null, "totalTestEncountersViral": null, "totalTestsPeopleViral": null, "totalTestsAntibody": null, "positiveTestsAntibody": null, "negativeTestsAntibody": null, "totalTestsPeopleAntibody": null, "positiveTestsPeopleAntibody": null, "negativeTestsPeopleAntibody": null, "totalTestsPeopleAntigen": null, "positiveTestsPeopleAntigen": null, "totalTestsAntigen": null, "positiveTestsAntigen": null, "fips": "22", "positiveIncrease": 8, "negativeIncrease": 0, "total": 51, "totalTestResultsIncrease": 8, "posNeg": 51, "deathIncrease": 0, "hospitalizedIncrease": 0, "hash": "85527f3e7e5cb4b4b56d3afce843228b23cf650d", "commercialScore": 0, "negativeRegularScore": 0, "negativeScore": 0, "positiveScore": 0, "score": 0, "grade": "", "month_number_label": "2020-03", "date_label": "2020-03-12", "week_number_label": "2020W11", "week_start_label": "2020-03-09"}, {"date": 20200313, "state": "LA", "positive": 36, "probableCases": null, "negative": 37, "pending": null, "totalTestResultsSource": "posNeg", "totalTestResults": 73, "hospitalizedCurrently": null, "hospitalizedCumulative": null, "inIcuCurrently": null, "inIcuCumulative": null, "onVentilatorCurrently": null, "onVentilatorCumulative": null, "recovered": null, "dataQualityGrade": null, "lastUpdateEt": "3/13/2020 16:00", "dateModified": "2020-03-13T16:00:00Z", "checkTimeEt": "03/13 12:00", "death": null, "hospitalized": null, "dateChecked": "2020-03-13T16:00:00Z", "totalTestsViral": null, "positiveTestsViral": null, "negativeTestsViral": null, "positiveCasesViral": 36, "deathConfirmed": null, "deathProbable": null, "totalTestEncountersViral": null, "totalTestsPeopleViral": null, "totalTestsAntibody": null, "positiveTestsAntibody": null, "negativeTestsAntibody": null, "totalTestsPeopleAntibody": null, "positiveTestsPeopleAntibody": null, "negativeTestsPeopleAntibody": null, "totalTestsPeopleAntigen": null, "positiveTestsPeopleAntigen": null, "totalTestsAntigen": null, "positiveTestsAntigen": null, "fips": "22", "positiveIncrease": 22, "negativeIncrease": 0, "total": 73, "totalTestResultsIncrease": 22, "posNeg": 73, "deathIncrease": 0, "hospitalizedIncrease": 0, "hash": "862fea49420559ba2aba63b1ae5576da5b01fd64", "commercialScore": 0, "negativeRegularScore": 0, "negativeScore": 0, "positiveScore": 0, "score": 0, "grade": "", "month_number_label": "2020-03", "date_label": "2020-03-13", "week_number_label": "2020W11", "week_start_label": "2020-03-09"}, {"date": 20200314, "state": "LA", "positive": 51, "probableCases": null, "negative": 109, "pending": null, "totalTestResultsSource": "posNeg", "totalTestResults": 160, "hospitalizedCurrently": null, "hospitalizedCumulative": null, "inIcuCurrently": null, "inIcuCumulative": null, "onVentilatorCurrently": null, "onVentilatorCumulative": null, "recovered": null, "dataQualityGrade": null, "lastUpdateEt": "3/14/2020 12:15", "dateModified": "2020-03-14T12:15:00Z", "checkTimeEt": "03/14 08:15", "death": null, "hospitalized": null, "dateChecked": "2020-03-14T12:15:00Z", "totalTestsViral": null, "positiveTestsViral": null, "negativeTestsViral": null, "positiveCasesViral": 51, "deathConfirmed": null, "deathProbable": null, "totalTestEncountersViral": null, "totalTestsPeopleViral": null, "totalTestsAntibody": null, "positiveTestsAntibody": null, "negativeTestsAntibody": null, "totalTestsPeopleAntibody": null, "positiveTestsPeopleAntibody": null, "negativeTestsPeopleAntibody": null, "totalTestsPeopleAntigen": null, "positiveTestsPeopleAntigen": null, "totalTestsAntigen": null, "positiveTestsAntigen": null, "fips": "22", "positiveIncrease": 15, "negativeIncrease": 72, "total": 160, "totalTestResultsIncrease": 87, "posNeg": 160, "deathIncrease": 0, "hospitalizedIncrease": 0, "hash": "27c763ed6187a983835fab2ec3ef8f63fea242bf", "commercialScore": 0, "negativeRegularScore": 0, "negativeScore": 0, "positiveScore": 0, "score": 0, "grade": "", "month_number_label": "2020-03", "date_label": "2020-03-14", "week_number_label": "2020W11", "week_start_label": "2020-03-09"}, {"date": 20200315, "state": "LA", "positive": 90, "probableCases": null, "negative": 156, "pending": null, "totalTestResultsSource": "posNeg", "totalTestResults": 246, "hospitalizedCurrently": null, "hospitalizedCumulative": null, "inIcuCurrently": null, "inIcuCumulative": null, "onVentilatorCurrently": null, "onVentilatorCumulative": null, "recovered": null, "dataQualityGrade": null, "lastUpdateEt": "3/15/2020 11:30", "dateModified": "2020-03-15T11:30:00Z", "checkTimeEt": "03/15 07:30", "death": 2, "hospitalized": null, "dateChecked": "2020-03-15T11:30:00Z", "totalTestsViral": null, "positiveTestsViral": null, "negativeTestsViral": null, "positiveCasesViral": 90, "deathConfirmed": null, "deathProbable": null, "totalTestEncountersViral": null, "totalTestsPeopleViral": null, "totalTestsAntibody": null, "positiveTestsAntibody": null, "negativeTestsAntibody": null, "totalTestsPeopleAntibody": null, "positiveTestsPeopleAntibody": null, "negativeTestsPeopleAntibody": null, "totalTestsPeopleAntigen": null, "positiveTestsPeopleAntigen": null, "totalTestsAntigen": null, "positiveTestsAntigen": null, "fips": "22", "positiveIncrease": 39, "negativeIncrease": 47, "total": 246, "totalTestResultsIncrease": 86, "posNeg": 246, "deathIncrease": 2, "hospitalizedIncrease": 0, "hash": "ebf5efe0cb2c88ed658ba3db79e57519a3848fbd", "commercialScore": 0, "negativeRegularScore": 0, "negativeScore": 0, "positiveScore": 0, "score": 0, "grade": "", "month_number_label": "2020-03", "date_label": "2020-03-15", "week_number_label": "2020W11", "week_start_label": "2020-03-09"}, {"date": 20200316, "state": "LA", "positive": 115, "probableCases": null, "negative": 188, "pending": null, "totalTestResultsSource": "posNeg", "totalTestResults": 303, "hospitalizedCurrently": null, "hospitalizedCumulative": null, "inIcuCurrently": null, "inIcuCumulative": null, "onVentilatorCurrently": null, "onVentilatorCumulative": null, "recovered": null, "dataQualityGrade": null, "lastUpdateEt": "3/16/2020 15:50", "dateModified": "2020-03-16T15:50:00Z", "checkTimeEt": "03/16 11:50", "death": 2, "hospitalized": null, "dateChecked": "2020-03-16T15:50:00Z", "totalTestsViral": null, "positiveTestsViral": null, "negativeTestsViral": null, "positiveCasesViral": 115, "deathConfirmed": null, "deathProbable": null, "totalTestEncountersViral": null, "totalTestsPeopleViral": null, "totalTestsAntibody": null, "positiveTestsAntibody": null, "negativeTestsAntibody": null, "totalTestsPeopleAntibody": null, "positiveTestsPeopleAntibody": null, "negativeTestsPeopleAntibody": null, "totalTestsPeopleAntigen": null, "positiveTestsPeopleAntigen": null, "totalTestsAntigen": null, "positiveTestsAntigen": null, "fips": "22", "positiveIncrease": 25, "negativeIncrease": 32, "total": 303, "totalTestResultsIncrease": 57, "posNeg": 303, "deathIncrease": 0, "hospitalizedIncrease": 0, "hash": "2800e72d3473fc122a1b2e5344418070efcc6a3a", "commercialScore": 0, "negativeRegularScore": 0, "negativeScore": 0, "positiveScore": 0, "score": 0, "grade": "", "month_number_label": "2020-03", "date_label": "2020-03-16", "week_number_label": "2020W12", "week_start_label": "2020-03-16"}, {"date": 20200317, "state": "LA", "positive": 137, "probableCases": null, "negative": 286, "pending": null, "totalTestResultsSource": "posNeg", "totalTestResults": 423, "hospitalizedCurrently": null, "hospitalizedCumulative": null, "inIcuCurrently": null, "inIcuCumulative": null, "onVentilatorCurrently": null, "onVentilatorCumulative": null, "recovered": null, "dataQualityGrade": null, "lastUpdateEt": "3/17/2020 10:30", "dateModified": "2020-03-17T10:30:00Z", "checkTimeEt": "03/17 06:30", "death": 4, "hospitalized": null, "dateChecked": "2020-03-17T10:30:00Z", "totalTestsViral": null, "positiveTestsViral": null, "negativeTestsViral": null, "positiveCasesViral": 137, "deathConfirmed": null, "deathProbable": null, "totalTestEncountersViral": null, "totalTestsPeopleViral": null, "totalTestsAntibody": null, "positiveTestsAntibody": null, "negativeTestsAntibody": null, "totalTestsPeopleAntibody": null, "positiveTestsPeopleAntibody": null, "negativeTestsPeopleAntibody": null, "totalTestsPeopleAntigen": null, "positiveTestsPeopleAntigen": null, "totalTestsAntigen": null, "positiveTestsAntigen": null, "fips": "22", "positiveIncrease": 22, "negativeIncrease": 98, "total": 423, "totalTestResultsIncrease": 120, "posNeg": 423, "deathIncrease": 2, "hospitalizedIncrease": 0, "hash": "621f1ce4fc21432f8f7995706edc811dc55bcf49", "commercialScore": 0, "negativeRegularScore": 0, "negativeScore": 0, "positiveScore": 0, "score": 0, "grade": "", "month_number_label": "2020-03", "date_label": "2020-03-17", "week_number_label": "2020W12", "week_start_label": "2020-03-16"}, {"date": 20200318, "state": "LA", "positive": 240, "probableCases": null, "negative": 335, "pending": null, "totalTestResultsSource": "posNeg", "totalTestResults": 575, "hospitalizedCurrently": null, "hospitalizedCumulative": null, "inIcuCurrently": null, "inIcuCumulative": null, "onVentilatorCurrently": null, "onVentilatorCumulative": null, "recovered": null, "dataQualityGrade": null, "lastUpdateEt": "3/18/2020 00:00", "dateModified": "2020-03-18T00:00:00Z", "checkTimeEt": "03/17 20:00", "death": 6, "hospitalized": null, "dateChecked": "2020-03-18T00:00:00Z", "totalTestsViral": null, "positiveTestsViral": null, "negativeTestsViral": null, "positiveCasesViral": 240, "deathConfirmed": null, "deathProbable": null, "totalTestEncountersViral": null, "totalTestsPeopleViral": null, "totalTestsAntibody": null, "positiveTestsAntibody": null, "negativeTestsAntibody": null, "totalTestsPeopleAntibody": null, "positiveTestsPeopleAntibody": null, "negativeTestsPeopleAntibody": null, "totalTestsPeopleAntigen": null, "positiveTestsPeopleAntigen": null, "totalTestsAntigen": null, "positiveTestsAntigen": null, "fips": "22", "positiveIncrease": 103, "negativeIncrease": 49, "total": 575, "totalTestResultsIncrease": 152, "posNeg": 575, "deathIncrease": 2, "hospitalizedIncrease": 0, "hash": "979a19d63fe0713bc8c2d55f4a78fb28f8db98a5", "commercialScore": 0, "negativeRegularScore": 0, "negativeScore": 0, "positiveScore": 0, "score": 0, "grade": "", "month_number_label": "2020-03", "date_label": "2020-03-18", "week_number_label": "2020W12", "week_start_label": "2020-03-16"}, {"date": 20200319, "state": "LA", "positive": 347, "probableCases": null, "negative": 458, "pending": null, "totalTestResultsSource": "posNeg", "totalTestResults": 805, "hospitalizedCurrently": null, "hospitalizedCumulative": null, "inIcuCurrently": null, "inIcuCumulative": null, "onVentilatorCurrently": null, "onVentilatorCumulative": null, "recovered": null, "dataQualityGrade": null, "lastUpdateEt": "3/19/2020 10:30", "dateModified": "2020-03-19T10:30:00Z", "checkTimeEt": "03/19 06:30", "death": 8, "hospitalized": null, "dateChecked": "2020-03-19T10:30:00Z", "totalTestsViral": null, "positiveTestsViral": null, "negativeTestsViral": null, "positiveCasesViral": 347, "deathConfirmed": null, "deathProbable": null, "totalTestEncountersViral": null, "totalTestsPeopleViral": null, "totalTestsAntibody": null, "positiveTestsAntibody": null, "negativeTestsAntibody": null, "totalTestsPeopleAntibody": null, "positiveTestsPeopleAntibody": null, "negativeTestsPeopleAntibody": null, "totalTestsPeopleAntigen": null, "positiveTestsPeopleAntigen": null, "totalTestsAntigen": null, "positiveTestsAntigen": null, "fips": "22", "positiveIncrease": 107, "negativeIncrease": 123, "total": 805, "totalTestResultsIncrease": 230, "posNeg": 805, "deathIncrease": 2, "hospitalizedIncrease": 0, "hash": "8daf4a1622511beb2976c3b6c3e32770d505e878", "commercialScore": 0, "negativeRegularScore": 0, "negativeScore": 0, "positiveScore": 0, "score": 0, "grade": "", "month_number_label": "2020-03", "date_label": "2020-03-19", "week_number_label": "2020W12", "week_start_label": "2020-03-16"}, {"date": 20200320, "state": "LA", "positive": 473, "probableCases": null, "negative": 568, "pending": null, "totalTestResultsSource": "posNeg", "totalTestResults": 1041, "hospitalizedCurrently": null, "hospitalizedCumulative": null, "inIcuCurrently": null, "inIcuCumulative": null, "onVentilatorCurrently": null, "onVentilatorCumulative": null, "recovered": null, "dataQualityGrade": null, "lastUpdateEt": "3/20/2020 15:30", "dateModified": "2020-03-20T15:30:00Z", "checkTimeEt": "03/20 11:30", "death": 12, "hospitalized": null, "dateChecked": "2020-03-20T15:30:00Z", "totalTestsViral": null, "positiveTestsViral": null, "negativeTestsViral": null, "positiveCasesViral": 473, "deathConfirmed": null, "deathProbable": null, "totalTestEncountersViral": null, "totalTestsPeopleViral": null, "totalTestsAntibody": null, "positiveTestsAntibody": null, "negativeTestsAntibody": null, "totalTestsPeopleAntibody": null, "positiveTestsPeopleAntibody": null, "negativeTestsPeopleAntibody": null, "totalTestsPeopleAntigen": null, "positiveTestsPeopleAntigen": null, "totalTestsAntigen": null, "positiveTestsAntigen": null, "fips": "22", "positiveIncrease": 126, "negativeIncrease": 110, "total": 1041, "totalTestResultsIncrease": 236, "posNeg": 1041, "deathIncrease": 4, "hospitalizedIncrease": 0, "hash": "40ba22dd3785eaa70c5367f101039b30e767b769", "commercialScore": 0, "negativeRegularScore": 0, "negativeScore": 0, "positiveScore": 0, "score": 0, "grade": "", "month_number_label": "2020-03", "date_label": "2020-03-20", "week_number_label": "2020W12", "week_start_label": "2020-03-16"}, {"date": 20200321, "state": "LA", "positive": 580, "probableCases": null, "negative": 2180, "pending": null, "totalTestResultsSource": "posNeg", "totalTestResults": 2760, "hospitalizedCurrently": null, "hospitalizedCumulative": null, "inIcuCurrently": null, "inIcuCumulative": null, "onVentilatorCurrently": null, "onVentilatorCumulative": null, "recovered": null, "dataQualityGrade": null, "lastUpdateEt": "3/21/2020 10:30", "dateModified": "2020-03-21T10:30:00Z", "checkTimeEt": "03/21 06:30", "death": 16, "hospitalized": null, "dateChecked": "2020-03-21T10:30:00Z", "totalTestsViral": null, "positiveTestsViral": null, "negativeTestsViral": null, "positiveCasesViral": 580, "deathConfirmed": null, "deathProbable": null, "totalTestEncountersViral": null, "totalTestsPeopleViral": null, "totalTestsAntibody": null, "positiveTestsAntibody": null, "negativeTestsAntibody": null, "totalTestsPeopleAntibody": null, "positiveTestsPeopleAntibody": null, "negativeTestsPeopleAntibody": null, "totalTestsPeopleAntigen": null, "positiveTestsPeopleAntigen": null, "totalTestsAntigen": null, "positiveTestsAntigen": null, "fips": "22", "positiveIncrease": 107, "negativeIncrease": 1612, "total": 2760, "totalTestResultsIncrease": 1719, "posNeg": 2760, "deathIncrease": 4, "hospitalizedIncrease": 0, "hash": "ff39eb1187ed942251efb3aafdb4c697655f19fa", "commercialScore": 0, "negativeRegularScore": 0, "negativeScore": 0, "positiveScore": 0, "score": 0, "grade": "", "month_number_label": "2020-03", "date_label": "2020-03-21", "week_number_label": "2020W12", "week_start_label": "2020-03-16"}, {"date": 20200322, "state": "LA", "positive": 837, "probableCases": null, "negative": 2661, "pending": null, "totalTestResultsSource": "posNeg", "totalTestResults": 3498, "hospitalizedCurrently": null, "hospitalizedCumulative": null, "inIcuCurrently": null, "inIcuCumulative": null, "onVentilatorCurrently": null, "onVentilatorCumulative": null, "recovered": null, "dataQualityGrade": null, "lastUpdateEt": "3/22/2020 10:00", "dateModified": "2020-03-22T10:00:00Z", "checkTimeEt": "03/22 06:00", "death": 20, "hospitalized": null, "dateChecked": "2020-03-22T10:00:00Z", "totalTestsViral": null, "positiveTestsViral": null, "negativeTestsViral": null, "positiveCasesViral": 837, "deathConfirmed": null, "deathProbable": null, "totalTestEncountersViral": null, "totalTestsPeopleViral": null, "totalTestsAntibody": null, "positiveTestsAntibody": null, "negativeTestsAntibody": null, "totalTestsPeopleAntibody": null, "positiveTestsPeopleAntibody": null, "negativeTestsPeopleAntibody": null, "totalTestsPeopleAntigen": null, "positiveTestsPeopleAntigen": null, "totalTestsAntigen": null, "positiveTestsAntigen": null, "fips": "22", "positiveIncrease": 257, "negativeIncrease": 481, "total": 3498, "totalTestResultsIncrease": 738, "posNeg": 3498, "deathIncrease": 4, "hospitalizedIncrease": 0, "hash": "95dda51916d03aba554819246d79f003cd01d528", "commercialScore": 0, "negativeRegularScore": 0, "negativeScore": 0, "positiveScore": 0, "score": 0, "grade": "", "month_number_label": "2020-03", "date_label": "2020-03-22", "week_number_label": "2020W12", "week_start_label": "2020-03-16"}, {"date": 20200323, "state": "LA", "positive": 1172, "probableCases": null, "negative": 4776, "pending": null, "totalTestResultsSource": "posNeg", "totalTestResults": 5948, "hospitalizedCurrently": null, "hospitalizedCumulative": null, "inIcuCurrently": null, "inIcuCumulative": null, "onVentilatorCurrently": null, "onVentilatorCumulative": null, "recovered": null, "dataQualityGrade": "B", "lastUpdateEt": "3/23/2020 13:00", "dateModified": "2020-03-23T13:00:00Z", "checkTimeEt": "03/23 09:00", "death": 34, "hospitalized": null, "dateChecked": "2020-03-23T13:00:00Z", "totalTestsViral": null, "positiveTestsViral": null, "negativeTestsViral": null, "positiveCasesViral": 1172, "deathConfirmed": null, "deathProbable": null, "totalTestEncountersViral": null, "totalTestsPeopleViral": null, "totalTestsAntibody": null, "positiveTestsAntibody": null, "negativeTestsAntibody": null, "totalTestsPeopleAntibody": null, "positiveTestsPeopleAntibody": null, "negativeTestsPeopleAntibody": null, "totalTestsPeopleAntigen": null, "positiveTestsPeopleAntigen": null, "totalTestsAntigen": null, "positiveTestsAntigen": null, "fips": "22", "positiveIncrease": 335, "negativeIncrease": 2115, "total": 5948, "totalTestResultsIncrease": 2450, "posNeg": 5948, "deathIncrease": 14, "hospitalizedIncrease": 0, "hash": "02090c23f92e8eed2e71b350122f8bf3bdd70011", "commercialScore": 0, "negativeRegularScore": 0, "negativeScore": 0, "positiveScore": 0, "score": 0, "grade": "", "month_number_label": "2020-03", "date_label": "2020-03-23", "week_number_label": "2020W13", "week_start_label": "2020-03-23"}, {"date": 20200324, "state": "LA", "positive": 1388, "probableCases": null, "negative": 7215, "pending": null, "totalTestResultsSource": "posNeg", "totalTestResults": 8603, "hospitalizedCurrently": 271, "hospitalizedCumulative": null, "inIcuCurrently": null, "inIcuCumulative": null, "onVentilatorCurrently": null, "onVentilatorCumulative": null, "recovered": null, "dataQualityGrade": "A", "lastUpdateEt": "3/24/2020 13:00", "dateModified": "2020-03-24T13:00:00Z", "checkTimeEt": "03/24 09:00", "death": 46, "hospitalized": null, "dateChecked": "2020-03-24T13:00:00Z", "totalTestsViral": null, "positiveTestsViral": null, "negativeTestsViral": null, "positiveCasesViral": 1388, "deathConfirmed": null, "deathProbable": null, "totalTestEncountersViral": null, "totalTestsPeopleViral": null, "totalTestsAntibody": null, "positiveTestsAntibody": null, "negativeTestsAntibody": null, "totalTestsPeopleAntibody": null, "positiveTestsPeopleAntibody": null, "negativeTestsPeopleAntibody": null, "totalTestsPeopleAntigen": null, "positiveTestsPeopleAntigen": null, "totalTestsAntigen": null, "positiveTestsAntigen": null, "fips": "22", "positiveIncrease": 216, "negativeIncrease": 2439, "total": 8603, "totalTestResultsIncrease": 2655, "posNeg": 8603, "deathIncrease": 12, "hospitalizedIncrease": 0, "hash": "f3a936d80318a07c1da71ce01e2c7ee3ece9e5fe", "commercialScore": 0, "negativeRegularScore": 0, "negativeScore": 0, "positiveScore": 0, "score": 0, "grade": "", "month_number_label": "2020-03", "date_label": "2020-03-24", "week_number_label": "2020W13", "week_start_label": "2020-03-23"}, {"date": 20200325, "state": "LA", "positive": 1795, "probableCases": null, "negative": 9656, "pending": null, "totalTestResultsSource": "posNeg", "totalTestResults": 11451, "hospitalizedCurrently": 491, "hospitalizedCumulative": null, "inIcuCurrently": null, "inIcuCumulative": null, "onVentilatorCurrently": 163, "onVentilatorCumulative": null, "recovered": null, "dataQualityGrade": "A", "lastUpdateEt": "3/25/2020 13:00", "dateModified": "2020-03-25T13:00:00Z", "checkTimeEt": "03/25 09:00", "death": 65, "hospitalized": null, "dateChecked": "2020-03-25T13:00:00Z", "totalTestsViral": null, "positiveTestsViral": null, "negativeTestsViral": null, "positiveCasesViral": 1795, "deathConfirmed": null, "deathProbable": null, "totalTestEncountersViral": null, "totalTestsPeopleViral": null, "totalTestsAntibody": null, "positiveTestsAntibody": null, "negativeTestsAntibody": null, "totalTestsPeopleAntibody": null, "positiveTestsPeopleAntibody": null, "negativeTestsPeopleAntibody": null, "totalTestsPeopleAntigen": null, "positiveTestsPeopleAntigen": null, "totalTestsAntigen": null, "positiveTestsAntigen": null, "fips": "22", "positiveIncrease": 407, "negativeIncrease": 2441, "total": 11451, "totalTestResultsIncrease": 2848, "posNeg": 11451, "deathIncrease": 19, "hospitalizedIncrease": 0, "hash": "600c9ac9b5646c088a7c7f6e01fd0b2eb40c7c9e", "commercialScore": 0, "negativeRegularScore": 0, "negativeScore": 0, "positiveScore": 0, "score": 0, "grade": "", "month_number_label": "2020-03", "date_label": "2020-03-25", "week_number_label": "2020W13", "week_start_label": "2020-03-23"}, {"date": 20200326, "state": "LA", "positive": 2305, "probableCases": null, "negative": 15724, "pending": null, "totalTestResultsSource": "posNeg", "totalTestResults": 18029, "hospitalizedCurrently": 676, "hospitalizedCumulative": null, "inIcuCurrently": null, "inIcuCumulative": null, "onVentilatorCurrently": 239, "onVentilatorCumulative": null, "recovered": null, "dataQualityGrade": "A", "lastUpdateEt": "3/26/2020 15:00", "dateModified": "2020-03-26T15:00:00Z", "checkTimeEt": "03/26 11:00", "death": 83, "hospitalized": null, "dateChecked": "2020-03-26T15:00:00Z", "totalTestsViral": null, "positiveTestsViral": null, "negativeTestsViral": null, "positiveCasesViral": 2305, "deathConfirmed": null, "deathProbable": null, "totalTestEncountersViral": null, "totalTestsPeopleViral": null, "totalTestsAntibody": null, "positiveTestsAntibody": null, "negativeTestsAntibody": null, "totalTestsPeopleAntibody": null, "positiveTestsPeopleAntibody": null, "negativeTestsPeopleAntibody": null, "totalTestsPeopleAntigen": null, "positiveTestsPeopleAntigen": null, "totalTestsAntigen": null, "positiveTestsAntigen": null, "fips": "22", "positiveIncrease": 510, "negativeIncrease": 6068, "total": 18029, "totalTestResultsIncrease": 6578, "posNeg": 18029, "deathIncrease": 18, "hospitalizedIncrease": 0, "hash": "bda9c24525313e04b716d319bef29e003f222656", "commercialScore": 0, "negativeRegularScore": 0, "negativeScore": 0, "positiveScore": 0, "score": 0, "grade": "", "month_number_label": "2020-03", "date_label": "2020-03-26", "week_number_label": "2020W13", "week_start_label": "2020-03-23"}, {"date": 20200327, "state": "LA", "positive": 2746, "probableCases": null, "negative": 18613, "pending": null, "totalTestResultsSource": "posNeg", "totalTestResults": 21359, "hospitalizedCurrently": 773, "hospitalizedCumulative": null, "inIcuCurrently": null, "inIcuCumulative": null, "onVentilatorCurrently": 270, "onVentilatorCumulative": null, "recovered": null, "dataQualityGrade": "A", "lastUpdateEt": "3/27/2020 13:00", "dateModified": "2020-03-27T13:00:00Z", "checkTimeEt": "03/27 09:00", "death": 119, "hospitalized": null, "dateChecked": "2020-03-27T13:00:00Z", "totalTestsViral": null, "positiveTestsViral": null, "negativeTestsViral": null, "positiveCasesViral": 2746, "deathConfirmed": null, "deathProbable": null, "totalTestEncountersViral": null, "totalTestsPeopleViral": null, "totalTestsAntibody": null, "positiveTestsAntibody": null, "negativeTestsAntibody": null, "totalTestsPeopleAntibody": null, "positiveTestsPeopleAntibody": null, "negativeTestsPeopleAntibody": null, "totalTestsPeopleAntigen": null, "positiveTestsPeopleAntigen": null, "totalTestsAntigen": null, "positiveTestsAntigen": null, "fips": "22", "positiveIncrease": 441, "negativeIncrease": 2889, "total": 21359, "totalTestResultsIncrease": 3330, "posNeg": 21359, "deathIncrease": 36, "hospitalizedIncrease": 0, "hash": "57d82018172a3f8875e30688b5f805407c360ae6", "commercialScore": 0, "negativeRegularScore": 0, "negativeScore": 0, "positiveScore": 0, "score": 0, "grade": "", "month_number_label": "2020-03", "date_label": "2020-03-27", "week_number_label": "2020W13", "week_start_label": "2020-03-23"}, {"date": 20200328, "state": "LA", "positive": 3315, "probableCases": null, "negative": 21846, "pending": null, "totalTestResultsSource": "posNeg", "totalTestResults": 25161, "hospitalizedCurrently": 927, "hospitalizedCumulative": null, "inIcuCurrently": null, "inIcuCumulative": null, "onVentilatorCurrently": 336, "onVentilatorCumulative": null, "recovered": null, "dataQualityGrade": "A", "lastUpdateEt": "3/28/2020 13:00", "dateModified": "2020-03-28T13:00:00Z", "checkTimeEt": "03/28 09:00", "death": 137, "hospitalized": null, "dateChecked": "2020-03-28T13:00:00Z", "totalTestsViral": null, "positiveTestsViral": null, "negativeTestsViral": null, "positiveCasesViral": 3315, "deathConfirmed": null, "deathProbable": null, "totalTestEncountersViral": null, "totalTestsPeopleViral": null, "totalTestsAntibody": null, "positiveTestsAntibody": null, "negativeTestsAntibody": null, "totalTestsPeopleAntibody": null, "positiveTestsPeopleAntibody": null, "negativeTestsPeopleAntibody": null, "totalTestsPeopleAntigen": null, "positiveTestsPeopleAntigen": null, "totalTestsAntigen": null, "positiveTestsAntigen": null, "fips": "22", "positiveIncrease": 569, "negativeIncrease": 3233, "total": 25161, "totalTestResultsIncrease": 3802, "posNeg": 25161, "deathIncrease": 18, "hospitalizedIncrease": 0, "hash": "09d1ab52148258abfddce55fbe7a684e933546e3", "commercialScore": 0, "negativeRegularScore": 0, "negativeScore": 0, "positiveScore": 0, "score": 0, "grade": "", "month_number_label": "2020-03", "date_label": "2020-03-28", "week_number_label": "2020W13", "week_start_label": "2020-03-23"}, {"date": 20200329, "state": "LA", "positive": 3540, "probableCases": null, "negative": 24331, "pending": null, "totalTestResultsSource": "posNeg", "totalTestResults": 27871, "hospitalizedCurrently": 1127, "hospitalizedCumulative": null, "inIcuCurrently": null, "inIcuCumulative": null, "onVentilatorCurrently": 380, "onVentilatorCumulative": null, "recovered": null, "dataQualityGrade": "A", "lastUpdateEt": "3/29/2020 13:00", "dateModified": "2020-03-29T13:00:00Z", "checkTimeEt": "03/29 09:00", "death": 151, "hospitalized": null, "dateChecked": "2020-03-29T13:00:00Z", "totalTestsViral": null, "positiveTestsViral": null, "negativeTestsViral": null, "positiveCasesViral": 3540, "deathConfirmed": null, "deathProbable": null, "totalTestEncountersViral": null, "totalTestsPeopleViral": null, "totalTestsAntibody": null, "positiveTestsAntibody": null, "negativeTestsAntibody": null, "totalTestsPeopleAntibody": null, "positiveTestsPeopleAntibody": null, "negativeTestsPeopleAntibody": null, "totalTestsPeopleAntigen": null, "positiveTestsPeopleAntigen": null, "totalTestsAntigen": null, "positiveTestsAntigen": null, "fips": "22", "positiveIncrease": 225, "negativeIncrease": 2485, "total": 27871, "totalTestResultsIncrease": 2710, "posNeg": 27871, "deathIncrease": 14, "hospitalizedIncrease": 0, "hash": "c128768f8a92ab417f6e9eae5b4d1a0e0b9c4ef5", "commercialScore": 0, "negativeRegularScore": 0, "negativeScore": 0, "positiveScore": 0, "score": 0, "grade": "", "month_number_label": "2020-03", "date_label": "2020-03-29", "week_number_label": "2020W13", "week_start_label": "2020-03-23"}, {"date": 20200330, "state": "LA", "positive": 4025, "probableCases": null, "negative": 30008, "pending": null, "totalTestResultsSource": "posNeg", "totalTestResults": 34033, "hospitalizedCurrently": 1185, "hospitalizedCumulative": null, "inIcuCurrently": null, "inIcuCumulative": null, "onVentilatorCurrently": 385, "onVentilatorCumulative": null, "recovered": null, "dataQualityGrade": "A", "lastUpdateEt": "3/30/2020 13:00", "dateModified": "2020-03-30T13:00:00Z", "checkTimeEt": "03/30 09:00", "death": 185, "hospitalized": null, "dateChecked": "2020-03-30T13:00:00Z", "totalTestsViral": null, "positiveTestsViral": null, "negativeTestsViral": null, "positiveCasesViral": 4025, "deathConfirmed": null, "deathProbable": null, "totalTestEncountersViral": null, "totalTestsPeopleViral": null, "totalTestsAntibody": null, "positiveTestsAntibody": null, "negativeTestsAntibody": null, "totalTestsPeopleAntibody": null, "positiveTestsPeopleAntibody": null, "negativeTestsPeopleAntibody": null, "totalTestsPeopleAntigen": null, "positiveTestsPeopleAntigen": null, "totalTestsAntigen": null, "positiveTestsAntigen": null, "fips": "22", "positiveIncrease": 485, "negativeIncrease": 5677, "total": 34033, "totalTestResultsIncrease": 6162, "posNeg": 34033, "deathIncrease": 34, "hospitalizedIncrease": 0, "hash": "1f9aeb89de388793ad1cccbb5fe484ddd5852205", "commercialScore": 0, "negativeRegularScore": 0, "negativeScore": 0, "positiveScore": 0, "score": 0, "grade": "", "month_number_label": "2020-03", "date_label": "2020-03-30", "week_number_label": "2020W14", "week_start_label": "2020-03-30"}, {"date": 20200331, "state": "LA", "positive": 5237, "probableCases": null, "negative": 33730, "pending": null, "totalTestResultsSource": "posNeg", "totalTestResults": 38967, "hospitalizedCurrently": 1355, "hospitalizedCumulative": null, "inIcuCurrently": null, "inIcuCumulative": null, "onVentilatorCurrently": 438, "onVentilatorCumulative": null, "recovered": null, "dataQualityGrade": "A", "lastUpdateEt": "3/31/2020 13:00", "dateModified": "2020-03-31T13:00:00Z", "checkTimeEt": "03/31 09:00", "death": 239, "hospitalized": null, "dateChecked": "2020-03-31T13:00:00Z", "totalTestsViral": null, "positiveTestsViral": null, "negativeTestsViral": null, "positiveCasesViral": 5237, "deathConfirmed": null, "deathProbable": null, "totalTestEncountersViral": null, "totalTestsPeopleViral": null, "totalTestsAntibody": null, "positiveTestsAntibody": null, "negativeTestsAntibody": null, "totalTestsPeopleAntibody": null, "positiveTestsPeopleAntibody": null, "negativeTestsPeopleAntibody": null, "totalTestsPeopleAntigen": null, "positiveTestsPeopleAntigen": null, "totalTestsAntigen": null, "positiveTestsAntigen": null, "fips": "22", "positiveIncrease": 1212, "negativeIncrease": 3722, "total": 38967, "totalTestResultsIncrease": 4934, "posNeg": 38967, "deathIncrease": 54, "hospitalizedIncrease": 0, "hash": "9fb268baffa2f08a804c0d1254b8c72b05f08c67", "commercialScore": 0, "negativeRegularScore": 0, "negativeScore": 0, "positiveScore": 0, "score": 0, "grade": "", "month_number_label": "2020-03", "date_label": "2020-03-31", "week_number_label": "2020W14", "week_start_label": "2020-03-30"}, {"date": 20200401, "state": "LA", "positive": 6424, "probableCases": null, "negative": 39352, "pending": null, "totalTestResultsSource": "posNeg", "totalTestResults": 45776, "hospitalizedCurrently": 1498, "hospitalizedCumulative": null, "inIcuCurrently": null, "inIcuCumulative": null, "onVentilatorCurrently": 490, "onVentilatorCumulative": null, "recovered": null, "dataQualityGrade": "A", "lastUpdateEt": "4/1/2020 13:00", "dateModified": "2020-04-01T13:00:00Z", "checkTimeEt": "04/01 09:00", "death": 273, "hospitalized": null, "dateChecked": "2020-04-01T13:00:00Z", "totalTestsViral": null, "positiveTestsViral": null, "negativeTestsViral": null, "positiveCasesViral": 6424, "deathConfirmed": null, "deathProbable": null, "totalTestEncountersViral": null, "totalTestsPeopleViral": null, "totalTestsAntibody": null, "positiveTestsAntibody": null, "negativeTestsAntibody": null, "totalTestsPeopleAntibody": null, "positiveTestsPeopleAntibody": null, "negativeTestsPeopleAntibody": null, "totalTestsPeopleAntigen": null, "positiveTestsPeopleAntigen": null, "totalTestsAntigen": null, "positiveTestsAntigen": null, "fips": "22", "positiveIncrease": 1187, "negativeIncrease": 5622, "total": 45776, "totalTestResultsIncrease": 6809, "posNeg": 45776, "deathIncrease": 34, "hospitalizedIncrease": 0, "hash": "c6d4d4768847fb592aaacd914837377264698cdb", "commercialScore": 0, "negativeRegularScore": 0, "negativeScore": 0, "positiveScore": 0, "score": 0, "grade": "", "month_number_label": "2020-04", "date_label": "2020-04-01", "week_number_label": "2020W14", "week_start_label": "2020-03-30"}, {"date": 20200402, "state": "LA", "positive": 9150, "probableCases": null, "negative": 41936, "pending": null, "totalTestResultsSource": "posNeg", "totalTestResults": 51086, "hospitalizedCurrently": 1639, "hospitalizedCumulative": null, "inIcuCurrently": null, "inIcuCumulative": null, "onVentilatorCurrently": 507, "onVentilatorCumulative": null, "recovered": null, "dataQualityGrade": "A", "lastUpdateEt": "4/2/2020 13:00", "dateModified": "2020-04-02T13:00:00Z", "checkTimeEt": "04/02 09:00", "death": 310, "hospitalized": null, "dateChecked": "2020-04-02T13:00:00Z", "totalTestsViral": null, "positiveTestsViral": null, "negativeTestsViral": null, "positiveCasesViral": 9150, "deathConfirmed": null, "deathProbable": null, "totalTestEncountersViral": null, "totalTestsPeopleViral": null, "totalTestsAntibody": null, "positiveTestsAntibody": null, "negativeTestsAntibody": null, "totalTestsPeopleAntibody": null, "positiveTestsPeopleAntibody": null, "negativeTestsPeopleAntibody": null, "totalTestsPeopleAntigen": null, "positiveTestsPeopleAntigen": null, "totalTestsAntigen": null, "positiveTestsAntigen": null, "fips": "22", "positiveIncrease": 2726, "negativeIncrease": 2584, "total": 51086, "totalTestResultsIncrease": 5310, "posNeg": 51086, "deathIncrease": 37, "hospitalizedIncrease": 0, "hash": "87699d810feb9177d9de9a1b433836cba3cf882a", "commercialScore": 0, "negativeRegularScore": 0, "negativeScore": 0, "positiveScore": 0, "score": 0, "grade": "", "month_number_label": "2020-04", "date_label": "2020-04-02", "week_number_label": "2020W14", "week_start_label": "2020-03-30"}, {"date": 20200403, "state": "LA", "positive": 10297, "probableCases": null, "negative": 43348, "pending": null, "totalTestResultsSource": "posNeg", "totalTestResults": 53645, "hospitalizedCurrently": 1707, "hospitalizedCumulative": null, "inIcuCurrently": null, "inIcuCumulative": null, "onVentilatorCurrently": 535, "onVentilatorCumulative": null, "recovered": null, "dataQualityGrade": "A", "lastUpdateEt": "4/3/2020 13:00", "dateModified": "2020-04-03T13:00:00Z", "checkTimeEt": "04/03 09:00", "death": 370, "hospitalized": null, "dateChecked": "2020-04-03T13:00:00Z", "totalTestsViral": null, "positiveTestsViral": null, "negativeTestsViral": null, "positiveCasesViral": 10297, "deathConfirmed": null, "deathProbable": null, "totalTestEncountersViral": null, "totalTestsPeopleViral": null, "totalTestsAntibody": null, "positiveTestsAntibody": null, "negativeTestsAntibody": null, "totalTestsPeopleAntibody": null, "positiveTestsPeopleAntibody": null, "negativeTestsPeopleAntibody": null, "totalTestsPeopleAntigen": null, "positiveTestsPeopleAntigen": null, "totalTestsAntigen": null, "positiveTestsAntigen": null, "fips": "22", "positiveIncrease": 1147, "negativeIncrease": 1412, "total": 53645, "totalTestResultsIncrease": 2559, "posNeg": 53645, "deathIncrease": 60, "hospitalizedIncrease": 0, "hash": "ced554ebf054fbe3d8846de934a205795d2d529d", "commercialScore": 0, "negativeRegularScore": 0, "negativeScore": 0, "positiveScore": 0, "score": 0, "grade": "", "month_number_label": "2020-04", "date_label": "2020-04-03", "week_number_label": "2020W14", "week_start_label": "2020-03-30"}, {"date": 20200404, "state": "LA", "positive": 12496, "probableCases": null, "negative": 46002, "pending": null, "totalTestResultsSource": "posNeg", "totalTestResults": 58498, "hospitalizedCurrently": 1726, "hospitalizedCumulative": null, "inIcuCurrently": null, "inIcuCumulative": null, "onVentilatorCurrently": 571, "onVentilatorCumulative": null, "recovered": null, "dataQualityGrade": "A", "lastUpdateEt": "4/4/2020 13:40", "dateModified": "2020-04-04T13:40:00Z", "checkTimeEt": "04/04 09:40", "death": 409, "hospitalized": null, "dateChecked": "2020-04-04T13:40:00Z", "totalTestsViral": null, "positiveTestsViral": null, "negativeTestsViral": null, "positiveCasesViral": 12496, "deathConfirmed": null, "deathProbable": null, "totalTestEncountersViral": null, "totalTestsPeopleViral": null, "totalTestsAntibody": null, "positiveTestsAntibody": null, "negativeTestsAntibody": null, "totalTestsPeopleAntibody": null, "positiveTestsPeopleAntibody": null, "negativeTestsPeopleAntibody": null, "totalTestsPeopleAntigen": null, "positiveTestsPeopleAntigen": null, "totalTestsAntigen": null, "positiveTestsAntigen": null, "fips": "22", "positiveIncrease": 2199, "negativeIncrease": 2654, "total": 58498, "totalTestResultsIncrease": 4853, "posNeg": 58498, "deathIncrease": 39, "hospitalizedIncrease": 0, "hash": "3a7925b9487d0193b24876c142d4441b4dfe0178", "commercialScore": 0, "negativeRegularScore": 0, "negativeScore": 0, "positiveScore": 0, "score": 0, "grade": "", "month_number_label": "2020-04", "date_label": "2020-04-04", "week_number_label": "2020W14", "week_start_label": "2020-03-30"}, {"date": 20200405, "state": "LA", "positive": 13010, "probableCases": null, "negative": 47315, "pending": null, "totalTestResultsSource": "posNeg", "totalTestResults": 60325, "hospitalizedCurrently": 1803, "hospitalizedCumulative": null, "inIcuCurrently": null, "inIcuCumulative": null, "onVentilatorCurrently": 561, "onVentilatorCumulative": null, "recovered": null, "dataQualityGrade": "A", "lastUpdateEt": "4/5/2020 13:00", "dateModified": "2020-04-05T13:00:00Z", "checkTimeEt": "04/05 09:00", "death": 477, "hospitalized": null, "dateChecked": "2020-04-05T13:00:00Z", "totalTestsViral": null, "positiveTestsViral": null, "negativeTestsViral": null, "positiveCasesViral": 13010, "deathConfirmed": null, "deathProbable": null, "totalTestEncountersViral": null, "totalTestsPeopleViral": null, "totalTestsAntibody": null, "positiveTestsAntibody": null, "negativeTestsAntibody": null, "totalTestsPeopleAntibody": null, "positiveTestsPeopleAntibody": null, "negativeTestsPeopleAntibody": null, "totalTestsPeopleAntigen": null, "positiveTestsPeopleAntigen": null, "totalTestsAntigen": null, "positiveTestsAntigen": null, "fips": "22", "positiveIncrease": 514, "negativeIncrease": 1313, "total": 60325, "totalTestResultsIncrease": 1827, "posNeg": 60325, "deathIncrease": 68, "hospitalizedIncrease": 0, "hash": "6070a02fa07fba8f3bf7b79b98635a9f812ca35b", "commercialScore": 0, "negativeRegularScore": 0, "negativeScore": 0, "positiveScore": 0, "score": 0, "grade": "", "month_number_label": "2020-04", "date_label": "2020-04-05", "week_number_label": "2020W14", "week_start_label": "2020-03-30"}, {"date": 20200406, "state": "LA", "positive": 14867, "probableCases": null, "negative": 54299, "pending": null, "totalTestResultsSource": "posNeg", "totalTestResults": 69166, "hospitalizedCurrently": 1981, "hospitalizedCumulative": null, "inIcuCurrently": null, "inIcuCumulative": null, "onVentilatorCurrently": 552, "onVentilatorCumulative": null, "recovered": null, "dataQualityGrade": "A", "lastUpdateEt": "4/6/2020 13:00", "dateModified": "2020-04-06T13:00:00Z", "checkTimeEt": "04/06 09:00", "death": 512, "hospitalized": null, "dateChecked": "2020-04-06T13:00:00Z", "totalTestsViral": null, "positiveTestsViral": null, "negativeTestsViral": null, "positiveCasesViral": 14867, "deathConfirmed": null, "deathProbable": null, "totalTestEncountersViral": null, "totalTestsPeopleViral": null, "totalTestsAntibody": null, "positiveTestsAntibody": null, "negativeTestsAntibody": null, "totalTestsPeopleAntibody": null, "positiveTestsPeopleAntibody": null, "negativeTestsPeopleAntibody": null, "totalTestsPeopleAntigen": null, "positiveTestsPeopleAntigen": null, "totalTestsAntigen": null, "positiveTestsAntigen": null, "fips": "22", "positiveIncrease": 1857, "negativeIncrease": 6984, "total": 69166, "totalTestResultsIncrease": 8841, "posNeg": 69166, "deathIncrease": 35, "hospitalizedIncrease": 0, "hash": "152fbc26b43c8feaee3b60337b1a02a4d5b49f6f", "commercialScore": 0, "negativeRegularScore": 0, "negativeScore": 0, "positiveScore": 0, "score": 0, "grade": "", "month_number_label": "2020-04", "date_label": "2020-04-06", "week_number_label": "2020W15", "week_start_label": "2020-04-06"}, {"date": 20200407, "state": "LA", "positive": 16284, "probableCases": null, "negative": 58371, "pending": null, "totalTestResultsSource": "posNeg", "totalTestResults": 74655, "hospitalizedCurrently": 1996, "hospitalizedCumulative": null, "inIcuCurrently": null, "inIcuCumulative": null, "onVentilatorCurrently": 519, "onVentilatorCumulative": null, "recovered": null, "dataQualityGrade": "A", "lastUpdateEt": "4/7/2020 13:00", "dateModified": "2020-04-07T13:00:00Z", "checkTimeEt": "04/07 09:00", "death": 582, "hospitalized": null, "dateChecked": "2020-04-07T13:00:00Z", "totalTestsViral": null, "positiveTestsViral": null, "negativeTestsViral": null, "positiveCasesViral": 16284, "deathConfirmed": null, "deathProbable": null, "totalTestEncountersViral": null, "totalTestsPeopleViral": null, "totalTestsAntibody": null, "positiveTestsAntibody": null, "negativeTestsAntibody": null, "totalTestsPeopleAntibody": null, "positiveTestsPeopleAntibody": null, "negativeTestsPeopleAntibody": null, "totalTestsPeopleAntigen": null, "positiveTestsPeopleAntigen": null, "totalTestsAntigen": null, "positiveTestsAntigen": null, "fips": "22", "positiveIncrease": 1417, "negativeIncrease": 4072, "total": 74655, "totalTestResultsIncrease": 5489, "posNeg": 74655, "deathIncrease": 70, "hospitalizedIncrease": 0, "hash": "4bc893899b680d8de214dea32e15cfcbe5c10f81", "commercialScore": 0, "negativeRegularScore": 0, "negativeScore": 0, "positiveScore": 0, "score": 0, "grade": "", "month_number_label": "2020-04", "date_label": "2020-04-07", "week_number_label": "2020W15", "week_start_label": "2020-04-06"}, {"date": 20200408, "state": "LA", "positive": 17030, "probableCases": null, "negative": 64376, "pending": null, "totalTestResultsSource": "posNeg", "totalTestResults": 81406, "hospitalizedCurrently": 1983, "hospitalizedCumulative": null, "inIcuCurrently": null, "inIcuCumulative": null, "onVentilatorCurrently": 490, "onVentilatorCumulative": null, "recovered": null, "dataQualityGrade": "A", "lastUpdateEt": "4/8/2020 13:00", "dateModified": "2020-04-08T13:00:00Z", "checkTimeEt": "04/08 09:00", "death": 652, "hospitalized": null, "dateChecked": "2020-04-08T13:00:00Z", "totalTestsViral": null, "positiveTestsViral": null, "negativeTestsViral": null, "positiveCasesViral": 17030, "deathConfirmed": null, "deathProbable": null, "totalTestEncountersViral": null, "totalTestsPeopleViral": null, "totalTestsAntibody": null, "positiveTestsAntibody": null, "negativeTestsAntibody": null, "totalTestsPeopleAntibody": null, "positiveTestsPeopleAntibody": null, "negativeTestsPeopleAntibody": null, "totalTestsPeopleAntigen": null, "positiveTestsPeopleAntigen": null, "totalTestsAntigen": null, "positiveTestsAntigen": null, "fips": "22", "positiveIncrease": 746, "negativeIncrease": 6005, "total": 81406, "totalTestResultsIncrease": 6751, "posNeg": 81406, "deathIncrease": 70, "hospitalizedIncrease": 0, "hash": "ef08358a77a2874dc3195cf8d3a46962aebeb746", "commercialScore": 0, "negativeRegularScore": 0, "negativeScore": 0, "positiveScore": 0, "score": 0, "grade": "", "month_number_label": "2020-04", "date_label": "2020-04-08", "week_number_label": "2020W15", "week_start_label": "2020-04-06"}, {"date": 20200409, "state": "LA", "positive": 18283, "probableCases": null, "negative": 68636, "pending": null, "totalTestResultsSource": "posNeg", "totalTestResults": 86919, "hospitalizedCurrently": 2014, "hospitalizedCumulative": null, "inIcuCurrently": null, "inIcuCumulative": null, "onVentilatorCurrently": 473, "onVentilatorCumulative": null, "recovered": null, "dataQualityGrade": "A", "lastUpdateEt": "4/9/2020 13:00", "dateModified": "2020-04-09T13:00:00Z", "checkTimeEt": "04/09 09:00", "death": 702, "hospitalized": null, "dateChecked": "2020-04-09T13:00:00Z", "totalTestsViral": null, "positiveTestsViral": null, "negativeTestsViral": null, "positiveCasesViral": 18283, "deathConfirmed": null, "deathProbable": null, "totalTestEncountersViral": null, "totalTestsPeopleViral": null, "totalTestsAntibody": null, "positiveTestsAntibody": null, "negativeTestsAntibody": null, "totalTestsPeopleAntibody": null, "positiveTestsPeopleAntibody": null, "negativeTestsPeopleAntibody": null, "totalTestsPeopleAntigen": null, "positiveTestsPeopleAntigen": null, "totalTestsAntigen": null, "positiveTestsAntigen": null, "fips": "22", "positiveIncrease": 1253, "negativeIncrease": 4260, "total": 86919, "totalTestResultsIncrease": 5513, "posNeg": 86919, "deathIncrease": 50, "hospitalizedIncrease": 0, "hash": "1e0b683b4f86bd17751cf03c6a56a4d2a05f6858", "commercialScore": 0, "negativeRegularScore": 0, "negativeScore": 0, "positiveScore": 0, "score": 0, "grade": "", "month_number_label": "2020-04", "date_label": "2020-04-09", "week_number_label": "2020W15", "week_start_label": "2020-04-06"}, {"date": 20200410, "state": "LA", "positive": 19253, "probableCases": null, "negative": 73027, "pending": null, "totalTestResultsSource": "posNeg", "totalTestResults": 92280, "hospitalizedCurrently": 2054, "hospitalizedCumulative": null, "inIcuCurrently": null, "inIcuCumulative": null, "onVentilatorCurrently": 479, "onVentilatorCumulative": null, "recovered": null, "dataQualityGrade": "A", "lastUpdateEt": "4/10/2020 13:00", "dateModified": "2020-04-10T13:00:00Z", "checkTimeEt": "04/10 09:00", "death": 755, "hospitalized": null, "dateChecked": "2020-04-10T13:00:00Z", "totalTestsViral": null, "positiveTestsViral": null, "negativeTestsViral": null, "positiveCasesViral": 19253, "deathConfirmed": null, "deathProbable": null, "totalTestEncountersViral": null, "totalTestsPeopleViral": null, "totalTestsAntibody": null, "positiveTestsAntibody": null, "negativeTestsAntibody": null, "totalTestsPeopleAntibody": null, "positiveTestsPeopleAntibody": null, "negativeTestsPeopleAntibody": null, "totalTestsPeopleAntigen": null, "positiveTestsPeopleAntigen": null, "totalTestsAntigen": null, "positiveTestsAntigen": null, "fips": "22", "positiveIncrease": 970, "negativeIncrease": 4391, "total": 92280, "totalTestResultsIncrease": 5361, "posNeg": 92280, "deathIncrease": 53, "hospitalizedIncrease": 0, "hash": "ef23fd968133f9896524fddba2ad8c59a876ccd0", "commercialScore": 0, "negativeRegularScore": 0, "negativeScore": 0, "positiveScore": 0, "score": 0, "grade": "", "month_number_label": "2020-04", "date_label": "2020-04-10", "week_number_label": "2020W15", "week_start_label": "2020-04-06"}, {"date": 20200411, "state": "LA", "positive": 20014, "probableCases": null, "negative": 76901, "pending": null, "totalTestResultsSource": "posNeg", "totalTestResults": 96915, "hospitalizedCurrently": 2067, "hospitalizedCumulative": null, "inIcuCurrently": null, "inIcuCumulative": null, "onVentilatorCurrently": 470, "onVentilatorCumulative": null, "recovered": null, "dataQualityGrade": "A", "lastUpdateEt": "4/11/2020 13:00", "dateModified": "2020-04-11T13:00:00Z", "checkTimeEt": "04/11 09:00", "death": 806, "hospitalized": null, "dateChecked": "2020-04-11T13:00:00Z", "totalTestsViral": null, "positiveTestsViral": null, "negativeTestsViral": null, "positiveCasesViral": 20014, "deathConfirmed": null, "deathProbable": null, "totalTestEncountersViral": null, "totalTestsPeopleViral": null, "totalTestsAntibody": null, "positiveTestsAntibody": null, "negativeTestsAntibody": null, "totalTestsPeopleAntibody": null, "positiveTestsPeopleAntibody": null, "negativeTestsPeopleAntibody": null, "totalTestsPeopleAntigen": null, "positiveTestsPeopleAntigen": null, "totalTestsAntigen": null, "positiveTestsAntigen": null, "fips": "22", "positiveIncrease": 761, "negativeIncrease": 3874, "total": 96915, "totalTestResultsIncrease": 4635, "posNeg": 96915, "deathIncrease": 51, "hospitalizedIncrease": 0, "hash": "02cd1640c93cfdbabac42fb4fc382351f6fbf818", "commercialScore": 0, "negativeRegularScore": 0, "negativeScore": 0, "positiveScore": 0, "score": 0, "grade": "", "month_number_label": "2020-04", "date_label": "2020-04-11", "week_number_label": "2020W15", "week_start_label": "2020-04-06"}, {"date": 20200412, "state": "LA", "positive": 20595, "probableCases": null, "negative": 83450, "pending": null, "totalTestResultsSource": "posNeg", "totalTestResults": 104045, "hospitalizedCurrently": 2084, "hospitalizedCumulative": null, "inIcuCurrently": null, "inIcuCumulative": null, "onVentilatorCurrently": 458, "onVentilatorCumulative": null, "recovered": null, "dataQualityGrade": "A", "lastUpdateEt": "4/12/2020 13:00", "dateModified": "2020-04-12T13:00:00Z", "checkTimeEt": "04/12 09:00", "death": 840, "hospitalized": null, "dateChecked": "2020-04-12T13:00:00Z", "totalTestsViral": null, "positiveTestsViral": null, "negativeTestsViral": null, "positiveCasesViral": 20595, "deathConfirmed": null, "deathProbable": null, "totalTestEncountersViral": null, "totalTestsPeopleViral": null, "totalTestsAntibody": null, "positiveTestsAntibody": null, "negativeTestsAntibody": null, "totalTestsPeopleAntibody": null, "positiveTestsPeopleAntibody": null, "negativeTestsPeopleAntibody": null, "totalTestsPeopleAntigen": null, "positiveTestsPeopleAntigen": null, "totalTestsAntigen": null, "positiveTestsAntigen": null, "fips": "22", "positiveIncrease": 581, "negativeIncrease": 6549, "total": 104045, "totalTestResultsIncrease": 7130, "posNeg": 104045, "deathIncrease": 34, "hospitalizedIncrease": 0, "hash": "fbf71b46f7e6f5052c0f9a0ebc315fe3bbb63a36", "commercialScore": 0, "negativeRegularScore": 0, "negativeScore": 0, "positiveScore": 0, "score": 0, "grade": "", "month_number_label": "2020-04", "date_label": "2020-04-12", "week_number_label": "2020W15", "week_start_label": "2020-04-06"}, {"date": 20200413, "state": "LA", "positive": 21016, "probableCases": null, "negative": 87075, "pending": null, "totalTestResultsSource": "posNeg", "totalTestResults": 108091, "hospitalizedCurrently": 2134, "hospitalizedCumulative": null, "inIcuCurrently": null, "inIcuCumulative": null, "onVentilatorCurrently": 461, "onVentilatorCumulative": null, "recovered": null, "dataQualityGrade": "A", "lastUpdateEt": "4/13/2020 13:00", "dateModified": "2020-04-13T13:00:00Z", "checkTimeEt": "04/13 09:00", "death": 884, "hospitalized": null, "dateChecked": "2020-04-13T13:00:00Z", "totalTestsViral": null, "positiveTestsViral": null, "negativeTestsViral": null, "positiveCasesViral": 21016, "deathConfirmed": null, "deathProbable": null, "totalTestEncountersViral": null, "totalTestsPeopleViral": null, "totalTestsAntibody": null, "positiveTestsAntibody": null, "negativeTestsAntibody": null, "totalTestsPeopleAntibody": null, "positiveTestsPeopleAntibody": null, "negativeTestsPeopleAntibody": null, "totalTestsPeopleAntigen": null, "positiveTestsPeopleAntigen": null, "totalTestsAntigen": null, "positiveTestsAntigen": null, "fips": "22", "positiveIncrease": 421, "negativeIncrease": 3625, "total": 108091, "totalTestResultsIncrease": 4046, "posNeg": 108091, "deathIncrease": 44, "hospitalizedIncrease": 0, "hash": "e7ae34d19e2250d6e7bc8a1148ab0e4ec0610c14", "commercialScore": 0, "negativeRegularScore": 0, "negativeScore": 0, "positiveScore": 0, "score": 0, "grade": "", "month_number_label": "2020-04", "date_label": "2020-04-13", "week_number_label": "2020W16", "week_start_label": "2020-04-13"}, {"date": 20200414, "state": "LA", "positive": 21518, "probableCases": null, "negative": 96904, "pending": null, "totalTestResultsSource": "posNeg", "totalTestResults": 118422, "hospitalizedCurrently": 1977, "hospitalizedCumulative": null, "inIcuCurrently": null, "inIcuCumulative": null, "onVentilatorCurrently": 436, "onVentilatorCumulative": null, "recovered": null, "dataQualityGrade": "A", "lastUpdateEt": "4/13/2020 13:00", "dateModified": "2020-04-13T13:00:00Z", "checkTimeEt": "04/13 09:00", "death": 1013, "hospitalized": null, "dateChecked": "2020-04-13T13:00:00Z", "totalTestsViral": null, "positiveTestsViral": null, "negativeTestsViral": null, "positiveCasesViral": 21518, "deathConfirmed": null, "deathProbable": null, "totalTestEncountersViral": null, "totalTestsPeopleViral": null, "totalTestsAntibody": null, "positiveTestsAntibody": null, "negativeTestsAntibody": null, "totalTestsPeopleAntibody": null, "positiveTestsPeopleAntibody": null, "negativeTestsPeopleAntibody": null, "totalTestsPeopleAntigen": null, "positiveTestsPeopleAntigen": null, "totalTestsAntigen": null, "positiveTestsAntigen": null, "fips": "22", "positiveIncrease": 502, "negativeIncrease": 9829, "total": 118422, "totalTestResultsIncrease": 10331, "posNeg": 118422, "deathIncrease": 129, "hospitalizedIncrease": 0, "hash": "8a3876418d952d25bd76075d00bc783aa6990769", "commercialScore": 0, "negativeRegularScore": 0, "negativeScore": 0, "positiveScore": 0, "score": 0, "grade": "", "month_number_label": "2020-04", "date_label": "2020-04-14", "week_number_label": "2020W16", "week_start_label": "2020-04-13"}, {"date": 20200415, "state": "LA", "positive": 21951, "probableCases": null, "negative": 99977, "pending": null, "totalTestResultsSource": "posNeg", "totalTestResults": 121928, "hospitalizedCurrently": 1943, "hospitalizedCumulative": null, "inIcuCurrently": null, "inIcuCumulative": null, "onVentilatorCurrently": 425, "onVentilatorCumulative": null, "recovered": null, "dataQualityGrade": "A", "lastUpdateEt": "4/15/2020 13:00", "dateModified": "2020-04-15T13:00:00Z", "checkTimeEt": "04/15 09:00", "death": 1103, "hospitalized": null, "dateChecked": "2020-04-15T13:00:00Z", "totalTestsViral": null, "positiveTestsViral": null, "negativeTestsViral": null, "positiveCasesViral": 21951, "deathConfirmed": null, "deathProbable": null, "totalTestEncountersViral": null, "totalTestsPeopleViral": null, "totalTestsAntibody": null, "positiveTestsAntibody": null, "negativeTestsAntibody": null, "totalTestsPeopleAntibody": null, "positiveTestsPeopleAntibody": null, "negativeTestsPeopleAntibody": null, "totalTestsPeopleAntigen": null, "positiveTestsPeopleAntigen": null, "totalTestsAntigen": null, "positiveTestsAntigen": null, "fips": "22", "positiveIncrease": 433, "negativeIncrease": 3073, "total": 121928, "totalTestResultsIncrease": 3506, "posNeg": 121928, "deathIncrease": 90, "hospitalizedIncrease": 0, "hash": "5709b1ae827c2d13662bc9e749f4cc33e2a9a311", "commercialScore": 0, "negativeRegularScore": 0, "negativeScore": 0, "positiveScore": 0, "score": 0, "grade": "", "month_number_label": "2020-04", "date_label": "2020-04-15", "week_number_label": "2020W16", "week_start_label": "2020-04-13"}, {"date": 20200416, "state": "LA", "positive": 22532, "probableCases": null, "negative": 104054, "pending": null, "totalTestResultsSource": "posNeg", "totalTestResults": 126586, "hospitalizedCurrently": 1914, "hospitalizedCumulative": null, "inIcuCurrently": null, "inIcuCumulative": null, "onVentilatorCurrently": 396, "onVentilatorCumulative": null, "recovered": null, "dataQualityGrade": "A", "lastUpdateEt": "4/16/2020 13:00", "dateModified": "2020-04-16T13:00:00Z", "checkTimeEt": "04/16 09:00", "death": 1156, "hospitalized": null, "dateChecked": "2020-04-16T13:00:00Z", "totalTestsViral": null, "positiveTestsViral": null, "negativeTestsViral": null, "positiveCasesViral": 22532, "deathConfirmed": null, "deathProbable": null, "totalTestEncountersViral": null, "totalTestsPeopleViral": null, "totalTestsAntibody": null, "positiveTestsAntibody": null, "negativeTestsAntibody": null, "totalTestsPeopleAntibody": null, "positiveTestsPeopleAntibody": null, "negativeTestsPeopleAntibody": null, "totalTestsPeopleAntigen": null, "positiveTestsPeopleAntigen": null, "totalTestsAntigen": null, "positiveTestsAntigen": null, "fips": "22", "positiveIncrease": 581, "negativeIncrease": 4077, "total": 126586, "totalTestResultsIncrease": 4658, "posNeg": 126586, "deathIncrease": 53, "hospitalizedIncrease": 0, "hash": "9043063d39237044a7ec83392a52aeb10a0a6dd4", "commercialScore": 0, "negativeRegularScore": 0, "negativeScore": 0, "positiveScore": 0, "score": 0, "grade": "", "month_number_label": "2020-04", "date_label": "2020-04-16", "week_number_label": "2020W16", "week_start_label": "2020-04-13"}, {"date": 20200417, "state": "LA", "positive": 23118, "probableCases": null, "negative": 108869, "pending": null, "totalTestResultsSource": "posNeg", "totalTestResults": 131987, "hospitalizedCurrently": 1868, "hospitalizedCumulative": null, "inIcuCurrently": null, "inIcuCumulative": null, "onVentilatorCurrently": 363, "onVentilatorCumulative": null, "recovered": null, "dataQualityGrade": "A", "lastUpdateEt": "4/17/2020 13:00", "dateModified": "2020-04-17T13:00:00Z", "checkTimeEt": "04/17 09:00", "death": 1213, "hospitalized": null, "dateChecked": "2020-04-17T13:00:00Z", "totalTestsViral": null, "positiveTestsViral": null, "negativeTestsViral": null, "positiveCasesViral": 23118, "deathConfirmed": null, "deathProbable": null, "totalTestEncountersViral": null, "totalTestsPeopleViral": null, "totalTestsAntibody": null, "positiveTestsAntibody": null, "negativeTestsAntibody": null, "totalTestsPeopleAntibody": null, "positiveTestsPeopleAntibody": null, "negativeTestsPeopleAntibody": null, "totalTestsPeopleAntigen": null, "positiveTestsPeopleAntigen": null, "totalTestsAntigen": null, "positiveTestsAntigen": null, "fips": "22", "positiveIncrease": 586, "negativeIncrease": 4815, "total": 131987, "totalTestResultsIncrease": 5401, "posNeg": 131987, "deathIncrease": 57, "hospitalizedIncrease": 0, "hash": "521eb375fd62f944cc55905d6ae2e334bd54cb1a", "commercialScore": 0, "negativeRegularScore": 0, "negativeScore": 0, "positiveScore": 0, "score": 0, "grade": "", "month_number_label": "2020-04", "date_label": "2020-04-17", "week_number_label": "2020W16", "week_start_label": "2020-04-13"}, {"date": 20200418, "state": "LA", "positive": 23580, "probableCases": null, "negative": 114419, "pending": null, "totalTestResultsSource": "posNeg", "totalTestResults": 137999, "hospitalizedCurrently": 1761, "hospitalizedCumulative": null, "inIcuCurrently": null, "inIcuCumulative": null, "onVentilatorCurrently": 347, "onVentilatorCumulative": null, "recovered": null, "dataQualityGrade": "A", "lastUpdateEt": "4/18/2020 13:00", "dateModified": "2020-04-18T13:00:00Z", "checkTimeEt": "04/18 09:00", "death": 1267, "hospitalized": null, "dateChecked": "2020-04-18T13:00:00Z", "totalTestsViral": null, "positiveTestsViral": null, "negativeTestsViral": null, "positiveCasesViral": 23580, "deathConfirmed": null, "deathProbable": null, "totalTestEncountersViral": null, "totalTestsPeopleViral": null, "totalTestsAntibody": null, "positiveTestsAntibody": null, "negativeTestsAntibody": null, "totalTestsPeopleAntibody": null, "positiveTestsPeopleAntibody": null, "negativeTestsPeopleAntibody": null, "totalTestsPeopleAntigen": null, "positiveTestsPeopleAntigen": null, "totalTestsAntigen": null, "positiveTestsAntigen": null, "fips": "22", "positiveIncrease": 462, "negativeIncrease": 5550, "total": 137999, "totalTestResultsIncrease": 6012, "posNeg": 137999, "deathIncrease": 54, "hospitalizedIncrease": 0, "hash": "5436da952ef12d1347c70ed41c9373ce0b73ec58", "commercialScore": 0, "negativeRegularScore": 0, "negativeScore": 0, "positiveScore": 0, "score": 0, "grade": "", "month_number_label": "2020-04", "date_label": "2020-04-18", "week_number_label": "2020W16", "week_start_label": "2020-04-13"}, {"date": 20200419, "state": "LA", "positive": 23928, "probableCases": null, "negative": 111420, "pending": null, "totalTestResultsSource": "posNeg", "totalTestResults": 135348, "hospitalizedCurrently": 1748, "hospitalizedCumulative": null, "inIcuCurrently": null, "inIcuCumulative": null, "onVentilatorCurrently": 349, "onVentilatorCumulative": null, "recovered": null, "dataQualityGrade": "A", "lastUpdateEt": "4/19/2020 13:00", "dateModified": "2020-04-19T13:00:00Z", "checkTimeEt": "04/19 09:00", "death": 1296, "hospitalized": null, "dateChecked": "2020-04-19T13:00:00Z", "totalTestsViral": null, "positiveTestsViral": null, "negativeTestsViral": null, "positiveCasesViral": 23928, "deathConfirmed": null, "deathProbable": null, "totalTestEncountersViral": null, "totalTestsPeopleViral": null, "totalTestsAntibody": null, "positiveTestsAntibody": null, "negativeTestsAntibody": null, "totalTestsPeopleAntibody": null, "positiveTestsPeopleAntibody": null, "negativeTestsPeopleAntibody": null, "totalTestsPeopleAntigen": null, "positiveTestsPeopleAntigen": null, "totalTestsAntigen": null, "positiveTestsAntigen": null, "fips": "22", "positiveIncrease": 348, "negativeIncrease": -2999, "total": 135348, "totalTestResultsIncrease": -2651, "posNeg": 135348, "deathIncrease": 29, "hospitalizedIncrease": 0, "hash": "b2cad1728d7bb2cf3f9e9be6942043267772c4d1", "commercialScore": 0, "negativeRegularScore": 0, "negativeScore": 0, "positiveScore": 0, "score": 0, "grade": "", "month_number_label": "2020-04", "date_label": "2020-04-19", "week_number_label": "2020W16", "week_start_label": "2020-04-13"}, {"date": 20200420, "state": "LA", "positive": 24523, "probableCases": null, "negative": 111588, "pending": null, "totalTestResultsSource": "posNeg", "totalTestResults": 136111, "hospitalizedCurrently": 1794, "hospitalizedCumulative": null, "inIcuCurrently": null, "inIcuCumulative": null, "onVentilatorCurrently": 332, "onVentilatorCumulative": null, "recovered": null, "dataQualityGrade": "A", "lastUpdateEt": "4/20/2020 13:00", "dateModified": "2020-04-20T13:00:00Z", "checkTimeEt": "04/20 09:00", "death": 1328, "hospitalized": null, "dateChecked": "2020-04-20T13:00:00Z", "totalTestsViral": null, "positiveTestsViral": null, "negativeTestsViral": null, "positiveCasesViral": 24523, "deathConfirmed": null, "deathProbable": null, "totalTestEncountersViral": null, "totalTestsPeopleViral": null, "totalTestsAntibody": null, "positiveTestsAntibody": null, "negativeTestsAntibody": null, "totalTestsPeopleAntibody": null, "positiveTestsPeopleAntibody": null, "negativeTestsPeopleAntibody": null, "totalTestsPeopleAntigen": null, "positiveTestsPeopleAntigen": null, "totalTestsAntigen": null, "positiveTestsAntigen": null, "fips": "22", "positiveIncrease": 595, "negativeIncrease": 168, "total": 136111, "totalTestResultsIncrease": 763, "posNeg": 136111, "deathIncrease": 32, "hospitalizedIncrease": 0, "hash": "800fdbe0d997278c31a0b716aa6e44a1d5ba13f4", "commercialScore": 0, "negativeRegularScore": 0, "negativeScore": 0, "positiveScore": 0, "score": 0, "grade": "", "month_number_label": "2020-04", "date_label": "2020-04-20", "week_number_label": "2020W17", "week_start_label": "2020-04-20"}, {"date": 20200421, "state": "LA", "positive": 24854, "probableCases": null, "negative": 111588, "pending": null, "totalTestResultsSource": "posNeg", "totalTestResults": 136442, "hospitalizedCurrently": 1798, "hospitalizedCumulative": null, "inIcuCurrently": null, "inIcuCumulative": null, "onVentilatorCurrently": 297, "onVentilatorCumulative": null, "recovered": null, "dataQualityGrade": "A", "lastUpdateEt": "4/21/2020 13:00", "dateModified": "2020-04-21T13:00:00Z", "checkTimeEt": "04/21 09:00", "death": 1405, "hospitalized": null, "dateChecked": "2020-04-21T13:00:00Z", "totalTestsViral": null, "positiveTestsViral": null, "negativeTestsViral": null, "positiveCasesViral": 24854, "deathConfirmed": null, "deathProbable": null, "totalTestEncountersViral": null, "totalTestsPeopleViral": null, "totalTestsAntibody": null, "positiveTestsAntibody": null, "negativeTestsAntibody": null, "totalTestsPeopleAntibody": null, "positiveTestsPeopleAntibody": null, "negativeTestsPeopleAntibody": null, "totalTestsPeopleAntigen": null, "positiveTestsPeopleAntigen": null, "totalTestsAntigen": null, "positiveTestsAntigen": null, "fips": "22", "positiveIncrease": 331, "negativeIncrease": 0, "total": 136442, "totalTestResultsIncrease": 331, "posNeg": 136442, "deathIncrease": 77, "hospitalizedIncrease": 0, "hash": "c8a7bfeebd9c040dff726da0a1c8002f361cdd82", "commercialScore": 0, "negativeRegularScore": 0, "negativeScore": 0, "positiveScore": 0, "score": 0, "grade": "", "month_number_label": "2020-04", "date_label": "2020-04-21", "week_number_label": "2020W17", "week_start_label": "2020-04-20"}, {"date": 20200422, "state": "LA", "positive": 25258, "probableCases": null, "negative": 111588, "pending": null, "totalTestResultsSource": "posNeg", "totalTestResults": 136846, "hospitalizedCurrently": 1747, "hospitalizedCumulative": null, "inIcuCurrently": null, "inIcuCumulative": null, "onVentilatorCurrently": 287, "onVentilatorCumulative": null, "recovered": 14927, "dataQualityGrade": "A", "lastUpdateEt": "4/22/2020 13:00", "dateModified": "2020-04-22T13:00:00Z", "checkTimeEt": "04/22 09:00", "death": 1473, "hospitalized": null, "dateChecked": "2020-04-22T13:00:00Z", "totalTestsViral": null, "positiveTestsViral": null, "negativeTestsViral": null, "positiveCasesViral": 25258, "deathConfirmed": null, "deathProbable": null, "totalTestEncountersViral": null, "totalTestsPeopleViral": null, "totalTestsAntibody": null, "positiveTestsAntibody": null, "negativeTestsAntibody": null, "totalTestsPeopleAntibody": null, "positiveTestsPeopleAntibody": null, "negativeTestsPeopleAntibody": null, "totalTestsPeopleAntigen": null, "positiveTestsPeopleAntigen": null, "totalTestsAntigen": null, "positiveTestsAntigen": null, "fips": "22", "positiveIncrease": 404, "negativeIncrease": 0, "total": 136846, "totalTestResultsIncrease": 404, "posNeg": 136846, "deathIncrease": 68, "hospitalizedIncrease": 0, "hash": "3b9b816dfa8b038ede9d71d8fb1d4162e571b657", "commercialScore": 0, "negativeRegularScore": 0, "negativeScore": 0, "positiveScore": 0, "score": 0, "grade": "", "month_number_label": "2020-04", "date_label": "2020-04-22", "week_number_label": "2020W17", "week_start_label": "2020-04-20"}, {"date": 20200423, "state": "LA", "positive": 25739, "probableCases": null, "negative": 111774, "pending": null, "totalTestResultsSource": "posNeg", "totalTestResults": 137513, "hospitalizedCurrently": 1727, "hospitalizedCumulative": null, "inIcuCurrently": null, "inIcuCumulative": null, "onVentilatorCurrently": 274, "onVentilatorCumulative": null, "recovered": 14927, "dataQualityGrade": "A", "lastUpdateEt": "4/23/2020 13:00", "dateModified": "2020-04-23T13:00:00Z", "checkTimeEt": "04/23 09:00", "death": 1540, "hospitalized": null, "dateChecked": "2020-04-23T13:00:00Z", "totalTestsViral": null, "positiveTestsViral": null, "negativeTestsViral": null, "positiveCasesViral": 25739, "deathConfirmed": null, "deathProbable": null, "totalTestEncountersViral": null, "totalTestsPeopleViral": null, "totalTestsAntibody": null, "positiveTestsAntibody": null, "negativeTestsAntibody": null, "totalTestsPeopleAntibody": null, "positiveTestsPeopleAntibody": null, "negativeTestsPeopleAntibody": null, "totalTestsPeopleAntigen": null, "positiveTestsPeopleAntigen": null, "totalTestsAntigen": null, "positiveTestsAntigen": null, "fips": "22", "positiveIncrease": 481, "negativeIncrease": 186, "total": 137513, "totalTestResultsIncrease": 667, "posNeg": 137513, "deathIncrease": 67, "hospitalizedIncrease": 0, "hash": "143952b3e737f20c10f021b9b894b0bca04a9f80", "commercialScore": 0, "negativeRegularScore": 0, "negativeScore": 0, "positiveScore": 0, "score": 0, "grade": "", "month_number_label": "2020-04", "date_label": "2020-04-23", "week_number_label": "2020W17", "week_start_label": "2020-04-20"}, {"date": 20200424, "state": "LA", "positive": 26140, "probableCases": null, "negative": 111972, "pending": null, "totalTestResultsSource": "posNeg", "totalTestResults": 138112, "hospitalizedCurrently": 1697, "hospitalizedCumulative": null, "inIcuCurrently": null, "inIcuCumulative": null, "onVentilatorCurrently": 286, "onVentilatorCumulative": null, "recovered": 14927, "dataQualityGrade": "A", "lastUpdateEt": "4/24/2020 13:00", "dateModified": "2020-04-24T13:00:00Z", "checkTimeEt": "04/24 09:00", "death": 1601, "hospitalized": null, "dateChecked": "2020-04-24T13:00:00Z", "totalTestsViral": null, "positiveTestsViral": null, "negativeTestsViral": null, "positiveCasesViral": 26140, "deathConfirmed": null, "deathProbable": null, "totalTestEncountersViral": null, "totalTestsPeopleViral": null, "totalTestsAntibody": null, "positiveTestsAntibody": null, "negativeTestsAntibody": null, "totalTestsPeopleAntibody": null, "positiveTestsPeopleAntibody": null, "negativeTestsPeopleAntibody": null, "totalTestsPeopleAntigen": null, "positiveTestsPeopleAntigen": null, "totalTestsAntigen": null, "positiveTestsAntigen": null, "fips": "22", "positiveIncrease": 401, "negativeIncrease": 198, "total": 138112, "totalTestResultsIncrease": 599, "posNeg": 138112, "deathIncrease": 61, "hospitalizedIncrease": 0, "hash": "0613e74c1b80f8ad055fec0e5f1d8a1d99797f40", "commercialScore": 0, "negativeRegularScore": 0, "negativeScore": 0, "positiveScore": 0, "score": 0, "grade": "", "month_number_label": "2020-04", "date_label": "2020-04-24", "week_number_label": "2020W17", "week_start_label": "2020-04-20"}, {"date": 20200425, "state": "LA", "positive": 26512, "probableCases": null, "negative": 112490, "pending": null, "totalTestResultsSource": "posNeg", "totalTestResults": 139002, "hospitalizedCurrently": 1700, "hospitalizedCumulative": null, "inIcuCurrently": null, "inIcuCumulative": null, "onVentilatorCurrently": 268, "onVentilatorCumulative": null, "recovered": 14927, "dataQualityGrade": "B", "lastUpdateEt": "4/25/2020 13:00", "dateModified": "2020-04-25T13:00:00Z", "checkTimeEt": "04/25 09:00", "death": 1644, "hospitalized": null, "dateChecked": "2020-04-25T13:00:00Z", "totalTestsViral": null, "positiveTestsViral": null, "negativeTestsViral": null, "positiveCasesViral": 26512, "deathConfirmed": null, "deathProbable": null, "totalTestEncountersViral": null, "totalTestsPeopleViral": null, "totalTestsAntibody": null, "positiveTestsAntibody": null, "negativeTestsAntibody": null, "totalTestsPeopleAntibody": null, "positiveTestsPeopleAntibody": null, "negativeTestsPeopleAntibody": null, "totalTestsPeopleAntigen": null, "positiveTestsPeopleAntigen": null, "totalTestsAntigen": null, "positiveTestsAntigen": null, "fips": "22", "positiveIncrease": 372, "negativeIncrease": 518, "total": 139002, "totalTestResultsIncrease": 890, "posNeg": 139002, "deathIncrease": 43, "hospitalizedIncrease": 0, "hash": "5fab8562eab75e7d35dd1308c9212569c4d10aae", "commercialScore": 0, "negativeRegularScore": 0, "negativeScore": 0, "positiveScore": 0, "score": 0, "grade": "", "month_number_label": "2020-04", "date_label": "2020-04-25", "week_number_label": "2020W17", "week_start_label": "2020-04-20"}, {"date": 20200426, "state": "LA", "positive": 26773, "probableCases": null, "negative": 116263, "pending": null, "totalTestResultsSource": "posNeg", "totalTestResults": 143036, "hospitalizedCurrently": 1701, "hospitalizedCumulative": null, "inIcuCurrently": null, "inIcuCumulative": null, "onVentilatorCurrently": 265, "onVentilatorCumulative": null, "recovered": 14927, "dataQualityGrade": "B", "lastUpdateEt": "4/26/2020 13:00", "dateModified": "2020-04-26T13:00:00Z", "checkTimeEt": "04/26 09:00", "death": 1670, "hospitalized": null, "dateChecked": "2020-04-26T13:00:00Z", "totalTestsViral": null, "positiveTestsViral": null, "negativeTestsViral": null, "positiveCasesViral": 26773, "deathConfirmed": null, "deathProbable": null, "totalTestEncountersViral": null, "totalTestsPeopleViral": null, "totalTestsAntibody": null, "positiveTestsAntibody": null, "negativeTestsAntibody": null, "totalTestsPeopleAntibody": null, "positiveTestsPeopleAntibody": null, "negativeTestsPeopleAntibody": null, "totalTestsPeopleAntigen": null, "positiveTestsPeopleAntigen": null, "totalTestsAntigen": null, "positiveTestsAntigen": null, "fips": "22", "positiveIncrease": 261, "negativeIncrease": 3773, "total": 143036, "totalTestResultsIncrease": 4034, "posNeg": 143036, "deathIncrease": 26, "hospitalizedIncrease": 0, "hash": "96748f31bf8ef15c71b04ebac8a700901089fd67", "commercialScore": 0, "negativeRegularScore": 0, "negativeScore": 0, "positiveScore": 0, "score": 0, "grade": "", "month_number_label": "2020-04", "date_label": "2020-04-26", "week_number_label": "2020W17", "week_start_label": "2020-04-20"}, {"date": 20200427, "state": "LA", "positive": 27068, "probableCases": null, "negative": 119921, "pending": null, "totalTestResultsSource": "posNeg", "totalTestResults": 146989, "hospitalizedCurrently": 1683, "hospitalizedCumulative": null, "inIcuCurrently": null, "inIcuCumulative": null, "onVentilatorCurrently": 262, "onVentilatorCumulative": null, "recovered": 17303, "dataQualityGrade": "B", "lastUpdateEt": "4/27/2020 13:00", "dateModified": "2020-04-27T13:00:00Z", "checkTimeEt": "04/27 09:00", "death": 1697, "hospitalized": null, "dateChecked": "2020-04-27T13:00:00Z", "totalTestsViral": null, "positiveTestsViral": null, "negativeTestsViral": null, "positiveCasesViral": 27068, "deathConfirmed": 1599, "deathProbable": null, "totalTestEncountersViral": null, "totalTestsPeopleViral": null, "totalTestsAntibody": null, "positiveTestsAntibody": null, "negativeTestsAntibody": null, "totalTestsPeopleAntibody": null, "positiveTestsPeopleAntibody": null, "negativeTestsPeopleAntibody": null, "totalTestsPeopleAntigen": null, "positiveTestsPeopleAntigen": null, "totalTestsAntigen": null, "positiveTestsAntigen": null, "fips": "22", "positiveIncrease": 295, "negativeIncrease": 3658, "total": 146989, "totalTestResultsIncrease": 3953, "posNeg": 146989, "deathIncrease": 27, "hospitalizedIncrease": 0, "hash": "5823de027a4774337f2b72f8c7a680eb728284b3", "commercialScore": 0, "negativeRegularScore": 0, "negativeScore": 0, "positiveScore": 0, "score": 0, "grade": "", "month_number_label": "2020-04", "date_label": "2020-04-27", "week_number_label": "2020W18", "week_start_label": "2020-04-27"}, {"date": 20200428, "state": "LA", "positive": 27286, "probableCases": null, "negative": 123822, "pending": null, "totalTestResultsSource": "posNeg", "totalTestResults": 151108, "hospitalizedCurrently": 1666, "hospitalizedCumulative": null, "inIcuCurrently": null, "inIcuCumulative": null, "onVentilatorCurrently": 244, "onVentilatorCumulative": null, "recovered": 17303, "dataQualityGrade": "B", "lastUpdateEt": "4/28/2020 13:00", "dateModified": "2020-04-28T13:00:00Z", "checkTimeEt": "04/28 09:00", "death": 1758, "hospitalized": null, "dateChecked": "2020-04-28T13:00:00Z", "totalTestsViral": null, "positiveTestsViral": null, "negativeTestsViral": null, "positiveCasesViral": 27286, "deathConfirmed": 1660, "deathProbable": null, "totalTestEncountersViral": null, "totalTestsPeopleViral": null, "totalTestsAntibody": null, "positiveTestsAntibody": null, "negativeTestsAntibody": null, "totalTestsPeopleAntibody": null, "positiveTestsPeopleAntibody": null, "negativeTestsPeopleAntibody": null, "totalTestsPeopleAntigen": null, "positiveTestsPeopleAntigen": null, "totalTestsAntigen": null, "positiveTestsAntigen": null, "fips": "22", "positiveIncrease": 218, "negativeIncrease": 3901, "total": 151108, "totalTestResultsIncrease": 4119, "posNeg": 151108, "deathIncrease": 61, "hospitalizedIncrease": 0, "hash": "8dc30456085108cca61c1043f42d4c9cb0934b7a", "commercialScore": 0, "negativeRegularScore": 0, "negativeScore": 0, "positiveScore": 0, "score": 0, "grade": "", "month_number_label": "2020-04", "date_label": "2020-04-28", "week_number_label": "2020W18", "week_start_label": "2020-04-27"}, {"date": 20200429, "state": "LA", "positive": 27660, "probableCases": null, "negative": 128908, "pending": null, "totalTestResultsSource": "posNeg", "totalTestResults": 156568, "hospitalizedCurrently": 1629, "hospitalizedCumulative": null, "inIcuCurrently": null, "inIcuCumulative": null, "onVentilatorCurrently": 244, "onVentilatorCumulative": null, "recovered": 17303, "dataQualityGrade": "B", "lastUpdateEt": "4/29/2020 13:00", "dateModified": "2020-04-29T13:00:00Z", "checkTimeEt": "04/29 09:00", "death": 1802, "hospitalized": null, "dateChecked": "2020-04-29T13:00:00Z", "totalTestsViral": null, "positiveTestsViral": null, "negativeTestsViral": null, "positiveCasesViral": 27660, "deathConfirmed": 1703, "deathProbable": null, "totalTestEncountersViral": null, "totalTestsPeopleViral": null, "totalTestsAntibody": null, "positiveTestsAntibody": null, "negativeTestsAntibody": null, "totalTestsPeopleAntibody": null, "positiveTestsPeopleAntibody": null, "negativeTestsPeopleAntibody": null, "totalTestsPeopleAntigen": null, "positiveTestsPeopleAntigen": null, "totalTestsAntigen": null, "positiveTestsAntigen": null, "fips": "22", "positiveIncrease": 374, "negativeIncrease": 5086, "total": 156568, "totalTestResultsIncrease": 5460, "posNeg": 156568, "deathIncrease": 44, "hospitalizedIncrease": 0, "hash": "d7e60d3ee6b12b275f10cb883a5572ff749180d0", "commercialScore": 0, "negativeRegularScore": 0, "negativeScore": 0, "positiveScore": 0, "score": 0, "grade": "", "month_number_label": "2020-04", "date_label": "2020-04-29", "week_number_label": "2020W18", "week_start_label": "2020-04-27"}, {"date": 20200430, "state": "LA", "positive": 28001, "probableCases": null, "negative": 133308, "pending": null, "totalTestResultsSource": "posNeg", "totalTestResults": 161309, "hospitalizedCurrently": 1601, "hospitalizedCumulative": null, "inIcuCurrently": null, "inIcuCumulative": null, "onVentilatorCurrently": 231, "onVentilatorCumulative": null, "recovered": 17303, "dataQualityGrade": "B", "lastUpdateEt": "4/30/2020 13:00", "dateModified": "2020-04-30T13:00:00Z", "checkTimeEt": "04/30 09:00", "death": 1862, "hospitalized": null, "dateChecked": "2020-04-30T13:00:00Z", "totalTestsViral": null, "positiveTestsViral": null, "negativeTestsViral": null, "positiveCasesViral": 28001, "deathConfirmed": 1729, "deathProbable": null, "totalTestEncountersViral": null, "totalTestsPeopleViral": null, "totalTestsAntibody": null, "positiveTestsAntibody": null, "negativeTestsAntibody": null, "totalTestsPeopleAntibody": null, "positiveTestsPeopleAntibody": null, "negativeTestsPeopleAntibody": null, "totalTestsPeopleAntigen": null, "positiveTestsPeopleAntigen": null, "totalTestsAntigen": null, "positiveTestsAntigen": null, "fips": "22", "positiveIncrease": 341, "negativeIncrease": 4400, "total": 161309, "totalTestResultsIncrease": 4741, "posNeg": 161309, "deathIncrease": 60, "hospitalizedIncrease": 0, "hash": "0326af5af524d2b2718236e6c221ad2fec0be5b2", "commercialScore": 0, "negativeRegularScore": 0, "negativeScore": 0, "positiveScore": 0, "score": 0, "grade": "", "month_number_label": "2020-04", "date_label": "2020-04-30", "week_number_label": "2020W18", "week_start_label": "2020-04-27"}, {"date": 20200501, "state": "LA", "positive": 28711, "probableCases": null, "negative": 139540, "pending": null, "totalTestResultsSource": "posNeg", "totalTestResults": 168251, "hospitalizedCurrently": 1607, "hospitalizedCumulative": null, "inIcuCurrently": null, "inIcuCumulative": null, "onVentilatorCurrently": 230, "onVentilatorCumulative": null, "recovered": 17303, "dataQualityGrade": "B", "lastUpdateEt": "5/1/2020 13:00", "dateModified": "2020-05-01T13:00:00Z", "checkTimeEt": "05/01 09:00", "death": 1927, "hospitalized": null, "dateChecked": "2020-05-01T13:00:00Z", "totalTestsViral": null, "positiveTestsViral": null, "negativeTestsViral": null, "positiveCasesViral": 28711, "deathConfirmed": 1740, "deathProbable": null, "totalTestEncountersViral": null, "totalTestsPeopleViral": null, "totalTestsAntibody": null, "positiveTestsAntibody": null, "negativeTestsAntibody": null, "totalTestsPeopleAntibody": null, "positiveTestsPeopleAntibody": null, "negativeTestsPeopleAntibody": null, "totalTestsPeopleAntigen": null, "positiveTestsPeopleAntigen": null, "totalTestsAntigen": null, "positiveTestsAntigen": null, "fips": "22", "positiveIncrease": 710, "negativeIncrease": 6232, "total": 168251, "totalTestResultsIncrease": 6942, "posNeg": 168251, "deathIncrease": 65, "hospitalizedIncrease": 0, "hash": "035c50c7d0994eba2fad2aae1e958ae138c9c8b8", "commercialScore": 0, "negativeRegularScore": 0, "negativeScore": 0, "positiveScore": 0, "score": 0, "grade": "", "month_number_label": "2020-05", "date_label": "2020-05-01", "week_number_label": "2020W18", "week_start_label": "2020-04-27"}, {"date": 20200502, "state": "LA", "positive": 29140, "probableCases": null, "negative": 143718, "pending": null, "totalTestResultsSource": "posNeg", "totalTestResults": 172858, "hospitalizedCurrently": 1545, "hospitalizedCumulative": null, "inIcuCurrently": null, "inIcuCumulative": null, "onVentilatorCurrently": 208, "onVentilatorCumulative": null, "recovered": 17303, "dataQualityGrade": "B", "lastUpdateEt": "5/2/2020 13:00", "dateModified": "2020-05-02T13:00:00Z", "checkTimeEt": "05/02 09:00", "death": 1950, "hospitalized": null, "dateChecked": "2020-05-02T13:00:00Z", "totalTestsViral": null, "positiveTestsViral": null, "negativeTestsViral": null, "positiveCasesViral": 29140, "deathConfirmed": 1801, "deathProbable": null, "totalTestEncountersViral": null, "totalTestsPeopleViral": null, "totalTestsAntibody": null, "positiveTestsAntibody": null, "negativeTestsAntibody": null, "totalTestsPeopleAntibody": null, "positiveTestsPeopleAntibody": null, "negativeTestsPeopleAntibody": null, "totalTestsPeopleAntigen": null, "positiveTestsPeopleAntigen": null, "totalTestsAntigen": null, "positiveTestsAntigen": null, "fips": "22", "positiveIncrease": 429, "negativeIncrease": 4178, "total": 172858, "totalTestResultsIncrease": 4607, "posNeg": 172858, "deathIncrease": 23, "hospitalizedIncrease": 0, "hash": "abf2d08e70753cb1070e09970caa0360a69796c3", "commercialScore": 0, "negativeRegularScore": 0, "negativeScore": 0, "positiveScore": 0, "score": 0, "grade": "", "month_number_label": "2020-05", "date_label": "2020-05-02", "week_number_label": "2020W18", "week_start_label": "2020-04-27"}, {"date": 20200503, "state": "LA", "positive": 29340, "probableCases": null, "negative": 146820, "pending": null, "totalTestResultsSource": "posNeg", "totalTestResults": 176160, "hospitalizedCurrently": 1530, "hospitalizedCumulative": null, "inIcuCurrently": null, "inIcuCumulative": null, "onVentilatorCurrently": 213, "onVentilatorCumulative": null, "recovered": 17303, "dataQualityGrade": "B", "lastUpdateEt": "5/3/2020 13:00", "dateModified": "2020-05-03T13:00:00Z", "checkTimeEt": "05/03 09:00", "death": 1969, "hospitalized": null, "dateChecked": "2020-05-03T13:00:00Z", "totalTestsViral": null, "positiveTestsViral": null, "negativeTestsViral": null, "positiveCasesViral": 29340, "deathConfirmed": 1845, "deathProbable": null, "totalTestEncountersViral": null, "totalTestsPeopleViral": null, "totalTestsAntibody": null, "positiveTestsAntibody": null, "negativeTestsAntibody": null, "totalTestsPeopleAntibody": null, "positiveTestsPeopleAntibody": null, "negativeTestsPeopleAntibody": null, "totalTestsPeopleAntigen": null, "positiveTestsPeopleAntigen": null, "totalTestsAntigen": null, "positiveTestsAntigen": null, "fips": "22", "positiveIncrease": 200, "negativeIncrease": 3102, "total": 176160, "totalTestResultsIncrease": 3302, "posNeg": 176160, "deathIncrease": 19, "hospitalizedIncrease": 0, "hash": "4be48267aa121c3216c70e705e38dbcdfe6a747c", "commercialScore": 0, "negativeRegularScore": 0, "negativeScore": 0, "positiveScore": 0, "score": 0, "grade": "", "month_number_label": "2020-05", "date_label": "2020-05-03", "week_number_label": "2020W18", "week_start_label": "2020-04-27"}, {"date": 20200504, "state": "LA", "positive": 29673, "probableCases": null, "negative": 151258, "pending": null, "totalTestResultsSource": "posNeg", "totalTestResults": 180931, "hospitalizedCurrently": 1502, "hospitalizedCumulative": null, "inIcuCurrently": null, "inIcuCumulative": null, "onVentilatorCurrently": 220, "onVentilatorCumulative": null, "recovered": 20316, "dataQualityGrade": "B", "lastUpdateEt": "5/4/2020 13:00", "dateModified": "2020-05-04T13:00:00Z", "checkTimeEt": "05/04 09:00", "death": 2064, "hospitalized": null, "dateChecked": "2020-05-04T13:00:00Z", "totalTestsViral": null, "positiveTestsViral": null, "negativeTestsViral": null, "positiveCasesViral": 29673, "deathConfirmed": 1905, "deathProbable": null, "totalTestEncountersViral": null, "totalTestsPeopleViral": null, "totalTestsAntibody": null, "positiveTestsAntibody": null, "negativeTestsAntibody": null, "totalTestsPeopleAntibody": null, "positiveTestsPeopleAntibody": null, "negativeTestsPeopleAntibody": null, "totalTestsPeopleAntigen": null, "positiveTestsPeopleAntigen": null, "totalTestsAntigen": null, "positiveTestsAntigen": null, "fips": "22", "positiveIncrease": 333, "negativeIncrease": 4438, "total": 180931, "totalTestResultsIncrease": 4771, "posNeg": 180931, "deathIncrease": 95, "hospitalizedIncrease": 0, "hash": "d3a8a07cf9fbdf4be6cb1e4cb830e239dde37d12", "commercialScore": 0, "negativeRegularScore": 0, "negativeScore": 0, "positiveScore": 0, "score": 0, "grade": "", "month_number_label": "2020-05", "date_label": "2020-05-04", "week_number_label": "2020W19", "week_start_label": "2020-05-04"}, {"date": 20200505, "state": "LA", "positive": 29996, "probableCases": null, "negative": 158235, "pending": null, "totalTestResultsSource": "posNeg", "totalTestResults": 188231, "hospitalizedCurrently": 1512, "hospitalizedCumulative": null, "inIcuCurrently": null, "inIcuCumulative": null, "onVentilatorCurrently": 194, "onVentilatorCumulative": null, "recovered": 20316, "dataQualityGrade": "B", "lastUpdateEt": "5/5/2020 13:00", "dateModified": "2020-05-05T13:00:00Z", "checkTimeEt": "05/05 09:00", "death": 2115, "hospitalized": null, "dateChecked": "2020-05-05T13:00:00Z", "totalTestsViral": null, "positiveTestsViral": null, "negativeTestsViral": null, "positiveCasesViral": 29996, "deathConfirmed": 1884, "deathProbable": null, "totalTestEncountersViral": null, "totalTestsPeopleViral": null, "totalTestsAntibody": null, "positiveTestsAntibody": null, "negativeTestsAntibody": null, "totalTestsPeopleAntibody": null, "positiveTestsPeopleAntibody": null, "negativeTestsPeopleAntibody": null, "totalTestsPeopleAntigen": null, "positiveTestsPeopleAntigen": null, "totalTestsAntigen": null, "positiveTestsAntigen": null, "fips": "22", "positiveIncrease": 323, "negativeIncrease": 6977, "total": 188231, "totalTestResultsIncrease": 7300, "posNeg": 188231, "deathIncrease": 51, "hospitalizedIncrease": 0, "hash": "7f2bb686004e985f0dbc9cba189af44447cd5781", "commercialScore": 0, "negativeRegularScore": 0, "negativeScore": 0, "positiveScore": 0, "score": 0, "grade": "", "month_number_label": "2020-05", "date_label": "2020-05-05", "week_number_label": "2020W19", "week_start_label": "2020-05-04"}, {"date": 20200506, "state": "LA", "positive": 30399, "probableCases": null, "negative": 164273, "pending": null, "totalTestResultsSource": "posNeg", "totalTestResults": 194672, "hospitalizedCurrently": 1465, "hospitalizedCumulative": null, "inIcuCurrently": null, "inIcuCumulative": null, "onVentilatorCurrently": 187, "onVentilatorCumulative": null, "recovered": 20316, "dataQualityGrade": "B", "lastUpdateEt": "5/6/2020 16:30", "dateModified": "2020-05-06T16:30:00Z", "checkTimeEt": "05/06 12:30", "death": 2115, "hospitalized": null, "dateChecked": "2020-05-06T16:30:00Z", "totalTestsViral": null, "positiveTestsViral": null, "negativeTestsViral": null, "positiveCasesViral": 30399, "deathConfirmed": 1907, "deathProbable": null, "totalTestEncountersViral": null, "totalTestsPeopleViral": null, "totalTestsAntibody": null, "positiveTestsAntibody": null, "negativeTestsAntibody": null, "totalTestsPeopleAntibody": null, "positiveTestsPeopleAntibody": null, "negativeTestsPeopleAntibody": null, "totalTestsPeopleAntigen": null, "positiveTestsPeopleAntigen": null, "totalTestsAntigen": null, "positiveTestsAntigen": null, "fips": "22", "positiveIncrease": 403, "negativeIncrease": 6038, "total": 194672, "totalTestResultsIncrease": 6441, "posNeg": 194672, "deathIncrease": 0, "hospitalizedIncrease": 0, "hash": "a1b270a2471567deab2f2c3a7ef14a38e6222e5c", "commercialScore": 0, "negativeRegularScore": 0, "negativeScore": 0, "positiveScore": 0, "score": 0, "grade": "", "month_number_label": "2020-05", "date_label": "2020-05-06", "week_number_label": "2020W19", "week_start_label": "2020-05-04"}, {"date": 20200507, "state": "LA", "positive": 30652, "probableCases": null, "negative": 170115, "pending": null, "totalTestResultsSource": "posNeg", "totalTestResults": 200767, "hospitalizedCurrently": 1432, "hospitalizedCumulative": null, "inIcuCurrently": null, "inIcuCumulative": null, "onVentilatorCurrently": 189, "onVentilatorCumulative": null, "recovered": 20316, "dataQualityGrade": "B", "lastUpdateEt": "5/7/2020 13:00", "dateModified": "2020-05-07T13:00:00Z", "checkTimeEt": "05/07 09:00", "death": 2208, "hospitalized": null, "dateChecked": "2020-05-07T13:00:00Z", "totalTestsViral": null, "positiveTestsViral": null, "negativeTestsViral": null, "positiveCasesViral": 30652, "deathConfirmed": 1926, "deathProbable": null, "totalTestEncountersViral": null, "totalTestsPeopleViral": null, "totalTestsAntibody": null, "positiveTestsAntibody": null, "negativeTestsAntibody": null, "totalTestsPeopleAntibody": null, "positiveTestsPeopleAntibody": null, "negativeTestsPeopleAntibody": null, "totalTestsPeopleAntigen": null, "positiveTestsPeopleAntigen": null, "totalTestsAntigen": null, "positiveTestsAntigen": null, "fips": "22", "positiveIncrease": 253, "negativeIncrease": 5842, "total": 200767, "totalTestResultsIncrease": 6095, "posNeg": 200767, "deathIncrease": 93, "hospitalizedIncrease": 0, "hash": "968d76a48b1ff2157acb72b9cc67594f6366cd8c", "commercialScore": 0, "negativeRegularScore": 0, "negativeScore": 0, "positiveScore": 0, "score": 0, "grade": "", "month_number_label": "2020-05", "date_label": "2020-05-07", "week_number_label": "2020W19", "week_start_label": "2020-05-04"}, {"date": 20200508, "state": "LA", "positive": 30855, "probableCases": null, "negative": 171561, "pending": null, "totalTestResultsSource": "posNeg", "totalTestResults": 202416, "hospitalizedCurrently": 1359, "hospitalizedCumulative": null, "inIcuCurrently": null, "inIcuCumulative": null, "onVentilatorCurrently": 185, "onVentilatorCumulative": null, "recovered": 20316, "dataQualityGrade": "B", "lastUpdateEt": "5/8/2020 13:00", "dateModified": "2020-05-08T13:00:00Z", "checkTimeEt": "05/08 09:00", "death": 2227, "hospitalized": null, "dateChecked": "2020-05-08T13:00:00Z", "totalTestsViral": null, "positiveTestsViral": null, "negativeTestsViral": null, "positiveCasesViral": 30855, "deathConfirmed": 1991, "deathProbable": null, "totalTestEncountersViral": null, "totalTestsPeopleViral": null, "totalTestsAntibody": null, "positiveTestsAntibody": null, "negativeTestsAntibody": null, "totalTestsPeopleAntibody": null, "positiveTestsPeopleAntibody": null, "negativeTestsPeopleAntibody": null, "totalTestsPeopleAntigen": null, "positiveTestsPeopleAntigen": null, "totalTestsAntigen": null, "positiveTestsAntigen": null, "fips": "22", "positiveIncrease": 203, "negativeIncrease": 1446, "total": 202416, "totalTestResultsIncrease": 1649, "posNeg": 202416, "deathIncrease": 19, "hospitalizedIncrease": 0, "hash": "dd0d0ed2ce5362db3b6578ed77bc11361f5e0619", "commercialScore": 0, "negativeRegularScore": 0, "negativeScore": 0, "positiveScore": 0, "score": 0, "grade": "", "month_number_label": "2020-05", "date_label": "2020-05-08", "week_number_label": "2020W19", "week_start_label": "2020-05-04"}, {"date": 20200509, "state": "LA", "positive": 31417, "probableCases": null, "negative": 180740, "pending": null, "totalTestResultsSource": "posNeg", "totalTest