[{"date": 20200304, "state": "CO", "positive": 2, "probableCases": null, "negative": 19, "pending": 21, "totalTestResultsSource": "totalTestEncountersViral", "totalTestResults": null, "hospitalizedCurrently": null, "hospitalizedCumulative": null, "inIcuCurrently": null, "inIcuCumulative": null, "onVentilatorCurrently": null, "onVentilatorCumulative": null, "recovered": null, "dataQualityGrade": null, "lastUpdateEt": null, "dateModified": null, "checkTimeEt": null, "death": null, "hospitalized": null, "dateChecked": null, "totalTestsViral": null, "positiveTestsViral": null, "negativeTestsViral": null, "positiveCasesViral": null, "deathConfirmed": null, "deathProbable": null, "totalTestEncountersViral": null, "totalTestsPeopleViral": null, "totalTestsAntibody": null, "positiveTestsAntibody": null, "negativeTestsAntibody": null, "totalTestsPeopleAntibody": null, "positiveTestsPeopleAntibody": null, "negativeTestsPeopleAntibody": null, "totalTestsPeopleAntigen": null, "positiveTestsPeopleAntigen": null, "totalTestsAntigen": null, "positiveTestsAntigen": null, "fips": "08", "positiveIncrease": 0, "negativeIncrease": 0, "total": 42, "totalTestResultsIncrease": 0, "posNeg": 21, "deathIncrease": 0, "hospitalizedIncrease": 0, "hash": "d37afac88c0f7c721679980a621db24c1015d9d5", "commercialScore": 0, "negativeRegularScore": 0, "negativeScore": 0, "positiveScore": 0, "score": 0, "grade": "", "month_number_label": "2020-03", "date_label": "2020-03-04", "week_number_label": "2020W10", "week_start_label": "2020-03-02"}, {"date": 20200305, "state": "CO", "positive": 2, "probableCases": null, "negative": 46, "pending": 30, "totalTestResultsSource": "totalTestEncountersViral", "totalTestResults": null, "hospitalizedCurrently": null, "hospitalizedCumulative": null, "inIcuCurrently": null, "inIcuCumulative": null, "onVentilatorCurrently": null, "onVentilatorCumulative": null, "recovered": null, "dataQualityGrade": null, "lastUpdateEt": null, "dateModified": null, "checkTimeEt": null, "death": null, "hospitalized": null, "dateChecked": null, "totalTestsViral": null, "positiveTestsViral": null, "negativeTestsViral": null, "positiveCasesViral": null, "deathConfirmed": null, "deathProbable": null, "totalTestEncountersViral": null, "totalTestsPeopleViral": null, "totalTestsAntibody": null, "positiveTestsAntibody": null, "negativeTestsAntibody": null, "totalTestsPeopleAntibody": null, "positiveTestsPeopleAntibody": null, "negativeTestsPeopleAntibody": null, "totalTestsPeopleAntigen": null, "positiveTestsPeopleAntigen": null, "totalTestsAntigen": null, "positiveTestsAntigen": null, "fips": "08", "positiveIncrease": 0, "negativeIncrease": 27, "total": 78, "totalTestResultsIncrease": 0, "posNeg": 48, "deathIncrease": 0, "hospitalizedIncrease": 0, "hash": "698fe79639e80d03f95411b59f3d1b6073d8fb93", "commercialScore": 0, "negativeRegularScore": 0, "negativeScore": 0, "positiveScore": 0, "score": 0, "grade": "", "month_number_label": "2020-03", "date_label": "2020-03-05", "week_number_label": "2020W10", "week_start_label": "2020-03-02"}, {"date": 20200306, "state": "CO", "positive": 8, "probableCases": null, "negative": 55, "pending": 69, "totalTestResultsSource": "totalTestEncountersViral", "totalTestResults": null, "hospitalizedCurrently": null, "hospitalizedCumulative": null, "inIcuCurrently": null, "inIcuCumulative": null, "onVentilatorCurrently": null, "onVentilatorCumulative": null, "recovered": null, "dataQualityGrade": null, "lastUpdateEt": null, "dateModified": null, "checkTimeEt": null, "death": null, "hospitalized": null, "dateChecked": null, "totalTestsViral": null, "positiveTestsViral": null, "negativeTestsViral": null, "positiveCasesViral": null, "deathConfirmed": null, "deathProbable": null, "totalTestEncountersViral": null, "totalTestsPeopleViral": null, "totalTestsAntibody": null, "positiveTestsAntibody": null, "negativeTestsAntibody": null, "totalTestsPeopleAntibody": null, "positiveTestsPeopleAntibody": null, "negativeTestsPeopleAntibody": null, "totalTestsPeopleAntigen": null, "positiveTestsPeopleAntigen": null, "totalTestsAntigen": null, "positiveTestsAntigen": null, "fips": "08", "positiveIncrease": 6, "negativeIncrease": 9, "total": 132, "totalTestResultsIncrease": 0, "posNeg": 63, "deathIncrease": 0, "hospitalizedIncrease": 0, "hash": "d4b3fadb2a9acfffff0b31284f90a816d5e2d44c", "commercialScore": 0, "negativeRegularScore": 0, "negativeScore": 0, "positiveScore": 0, "score": 0, "grade": "", "month_number_label": "2020-03", "date_label": "2020-03-06", "week_number_label": "2020W10", "week_start_label": "2020-03-02"}, {"date": 20200307, "state": "CO", "positive": 8, "probableCases": null, "negative": 104, "pending": null, "totalTestResultsSource": "totalTestEncountersViral", "totalTestResults": null, "hospitalizedCurrently": null, "hospitalizedCumulative": null, "inIcuCurrently": null, "inIcuCumulative": null, "onVentilatorCurrently": null, "onVentilatorCumulative": null, "recovered": null, "dataQualityGrade": null, "lastUpdateEt": null, "dateModified": null, "checkTimeEt": null, "death": null, "hospitalized": null, "dateChecked": null, "totalTestsViral": null, "positiveTestsViral": null, "negativeTestsViral": null, "positiveCasesViral": null, "deathConfirmed": null, "deathProbable": null, "totalTestEncountersViral": null, "totalTestsPeopleViral": null, "totalTestsAntibody": null, "positiveTestsAntibody": null, "negativeTestsAntibody": null, "totalTestsPeopleAntibody": null, "positiveTestsPeopleAntibody": null, "negativeTestsPeopleAntibody": null, "totalTestsPeopleAntigen": null, "positiveTestsPeopleAntigen": null, "totalTestsAntigen": null, "positiveTestsAntigen": null, "fips": "08", "positiveIncrease": 0, "negativeIncrease": 49, "total": 112, "totalTestResultsIncrease": 0, "posNeg": 112, "deathIncrease": 0, "hospitalizedIncrease": 0, "hash": "4a680216ba65a55dee5ff6dbbee789fad02172f4", "commercialScore": 0, "negativeRegularScore": 0, "negativeScore": 0, "positiveScore": 0, "score": 0, "grade": "", "month_number_label": "2020-03", "date_label": "2020-03-07", "week_number_label": "2020W10", "week_start_label": "2020-03-02"}, {"date": 20200308, "state": "CO", "positive": 9, "probableCases": null, "negative": 133, "pending": null, "totalTestResultsSource": "totalTestEncountersViral", "totalTestResults": null, "hospitalizedCurrently": null, "hospitalizedCumulative": null, "inIcuCurrently": null, "inIcuCumulative": null, "onVentilatorCurrently": null, "onVentilatorCumulative": null, "recovered": null, "dataQualityGrade": null, "lastUpdateEt": null, "dateModified": null, "checkTimeEt": null, "death": null, "hospitalized": null, "dateChecked": null, "totalTestsViral": null, "positiveTestsViral": null, "negativeTestsViral": null, "positiveCasesViral": null, "deathConfirmed": null, "deathProbable": null, "totalTestEncountersViral": null, "totalTestsPeopleViral": null, "totalTestsAntibody": null, "positiveTestsAntibody": null, "negativeTestsAntibody": null, "totalTestsPeopleAntibody": null, "positiveTestsPeopleAntibody": null, "negativeTestsPeopleAntibody": null, "totalTestsPeopleAntigen": null, "positiveTestsPeopleAntigen": null, "totalTestsAntigen": null, "positiveTestsAntigen": null, "fips": "08", "positiveIncrease": 1, "negativeIncrease": 29, "total": 142, "totalTestResultsIncrease": 0, "posNeg": 142, "deathIncrease": 0, "hospitalizedIncrease": 0, "hash": "c713fda64cbade90894cb4f45e74988287689160", "commercialScore": 0, "negativeRegularScore": 0, "negativeScore": 0, "positiveScore": 0, "score": 0, "grade": "", "month_number_label": "2020-03", "date_label": "2020-03-08", "week_number_label": "2020W10", "week_start_label": "2020-03-02"}, {"date": 20200309, "state": "CO", "positive": 12, "probableCases": null, "negative": 142, "pending": 1, "totalTestResultsSource": "totalTestEncountersViral", "totalTestResults": null, "hospitalizedCurrently": null, "hospitalizedCumulative": null, "inIcuCurrently": null, "inIcuCumulative": null, "onVentilatorCurrently": null, "onVentilatorCumulative": null, "recovered": null, "dataQualityGrade": null, "lastUpdateEt": null, "dateModified": null, "checkTimeEt": null, "death": null, "hospitalized": null, "dateChecked": null, "totalTestsViral": null, "positiveTestsViral": null, "negativeTestsViral": null, "positiveCasesViral": null, "deathConfirmed": null, "deathProbable": null, "totalTestEncountersViral": null, "totalTestsPeopleViral": null, "totalTestsAntibody": null, "positiveTestsAntibody": null, "negativeTestsAntibody": null, "totalTestsPeopleAntibody": null, "positiveTestsPeopleAntibody": null, "negativeTestsPeopleAntibody": null, "totalTestsPeopleAntigen": null, "positiveTestsPeopleAntigen": null, "totalTestsAntigen": null, "positiveTestsAntigen": null, "fips": "08", "positiveIncrease": 3, "negativeIncrease": 9, "total": 155, "totalTestResultsIncrease": 0, "posNeg": 154, "deathIncrease": 0, "hospitalizedIncrease": 0, "hash": "2fed6274753438819c6a1a7a7b0715f1124fcb6d", "commercialScore": 0, "negativeRegularScore": 0, "negativeScore": 0, "positiveScore": 0, "score": 0, "grade": "", "month_number_label": "2020-03", "date_label": "2020-03-09", "week_number_label": "2020W11", "week_start_label": "2020-03-09"}, {"date": 20200310, "state": "CO", "positive": 28, "probableCases": null, "negative": 251, "pending": null, "totalTestResultsSource": "totalTestEncountersViral", "totalTestResults": null, "hospitalizedCurrently": null, "hospitalizedCumulative": null, "inIcuCurrently": null, "inIcuCumulative": null, "onVentilatorCurrently": null, "onVentilatorCumulative": null, "recovered": null, "dataQualityGrade": null, "lastUpdateEt": null, "dateModified": null, "checkTimeEt": null, "death": null, "hospitalized": null, "dateChecked": null, "totalTestsViral": null, "positiveTestsViral": null, "negativeTestsViral": null, "positiveCasesViral": null, "deathConfirmed": null, "deathProbable": null, "totalTestEncountersViral": null, "totalTestsPeopleViral": null, "totalTestsAntibody": null, "positiveTestsAntibody": null, "negativeTestsAntibody": null, "totalTestsPeopleAntibody": null, "positiveTestsPeopleAntibody": null, "negativeTestsPeopleAntibody": null, "totalTestsPeopleAntigen": null, "positiveTestsPeopleAntigen": null, "totalTestsAntigen": null, "positiveTestsAntigen": null, "fips": "08", "positiveIncrease": 16, "negativeIncrease": 109, "total": 279, "totalTestResultsIncrease": 0, "posNeg": 279, "deathIncrease": 0, "hospitalizedIncrease": 0, "hash": "0c243e97d89937937b33cca235f98a821c974a97", "commercialScore": 0, "negativeRegularScore": 0, "negativeScore": 0, "positiveScore": 0, "score": 0, "grade": "", "month_number_label": "2020-03", "date_label": "2020-03-10", "week_number_label": "2020W11", "week_start_label": "2020-03-09"}, {"date": 20200311, "state": "CO", "positive": 45, "probableCases": null, "negative": 298, "pending": null, "totalTestResultsSource": "totalTestEncountersViral", "totalTestResults": 70, "hospitalizedCurrently": null, "hospitalizedCumulative": null, "inIcuCurrently": null, "inIcuCumulative": null, "onVentilatorCurrently": null, "onVentilatorCumulative": null, "recovered": null, "dataQualityGrade": null, "lastUpdateEt": "3/12/2020 17:00", "dateModified": "2020-03-12T17:00:00Z", "checkTimeEt": "03/12 13:00", "death": null, "hospitalized": null, "dateChecked": "2020-03-12T17:00:00Z", "totalTestsViral": null, "positiveTestsViral": null, "negativeTestsViral": null, "positiveCasesViral": null, "deathConfirmed": null, "deathProbable": null, "totalTestEncountersViral": 70, "totalTestsPeopleViral": null, "totalTestsAntibody": null, "positiveTestsAntibody": null, "negativeTestsAntibody": null, "totalTestsPeopleAntibody": null, "positiveTestsPeopleAntibody": null, "negativeTestsPeopleAntibody": null, "totalTestsPeopleAntigen": null, "positiveTestsPeopleAntigen": null, "totalTestsAntigen": null, "positiveTestsAntigen": null, "fips": "08", "positiveIncrease": 17, "negativeIncrease": 47, "total": 343, "totalTestResultsIncrease": 70, "posNeg": 343, "deathIncrease": 0, "hospitalizedIncrease": 0, "hash": "8b1876a6cdf01b044273ab41f648bb2e772541eb", "commercialScore": 0, "negativeRegularScore": 0, "negativeScore": 0, "positiveScore": 0, "score": 0, "grade": "", "month_number_label": "2020-03", "date_label": "2020-03-11", "week_number_label": "2020W11", "week_start_label": "2020-03-09"}, {"date": 20200312, "state": "CO", "positive": 72, "probableCases": null, "negative": 524, "pending": null, "totalTestResultsSource": "totalTestEncountersViral", "totalTestResults": 198, "hospitalizedCurrently": null, "hospitalizedCumulative": null, "inIcuCurrently": null, "inIcuCumulative": null, "onVentilatorCurrently": null, "onVentilatorCumulative": null, "recovered": null, "dataQualityGrade": null, "lastUpdateEt": "3/13/2020 14:00", "dateModified": "2020-03-13T14:00:00Z", "checkTimeEt": "03/13 10:00", "death": null, "hospitalized": null, "dateChecked": "2020-03-13T14:00:00Z", "totalTestsViral": null, "positiveTestsViral": null, "negativeTestsViral": null, "positiveCasesViral": null, "deathConfirmed": null, "deathProbable": null, "totalTestEncountersViral": 198, "totalTestsPeopleViral": null, "totalTestsAntibody": null, "positiveTestsAntibody": null, "negativeTestsAntibody": null, "totalTestsPeopleAntibody": null, "positiveTestsPeopleAntibody": null, "negativeTestsPeopleAntibody": null, "totalTestsPeopleAntigen": null, "positiveTestsPeopleAntigen": null, "totalTestsAntigen": null, "positiveTestsAntigen": null, "fips": "08", "positiveIncrease": 27, "negativeIncrease": 226, "total": 596, "totalTestResultsIncrease": 128, "posNeg": 596, "deathIncrease": 0, "hospitalizedIncrease": 0, "hash": "c12a9885bfc0cb31c6771af113355e759239b57b", "commercialScore": 0, "negativeRegularScore": 0, "negativeScore": 0, "positiveScore": 0, "score": 0, "grade": "", "month_number_label": "2020-03", "date_label": "2020-03-12", "week_number_label": "2020W11", "week_start_label": "2020-03-09"}, {"date": 20200313, "state": "CO", "positive": 101, "probableCases": null, "negative": 610, "pending": null, "totalTestResultsSource": "totalTestEncountersViral", "totalTestResults": 333, "hospitalizedCurrently": null, "hospitalizedCumulative": null, "inIcuCurrently": null, "inIcuCumulative": null, "onVentilatorCurrently": null, "onVentilatorCumulative": null, "recovered": null, "dataQualityGrade": null, "lastUpdateEt": "3/14/2020 14:00", "dateModified": "2020-03-14T14:00:00Z", "checkTimeEt": "03/14 10:00", "death": 1, "hospitalized": null, "dateChecked": "2020-03-14T14:00:00Z", "totalTestsViral": null, "positiveTestsViral": null, "negativeTestsViral": null, "positiveCasesViral": null, "deathConfirmed": null, "deathProbable": null, "totalTestEncountersViral": 333, "totalTestsPeopleViral": null, "totalTestsAntibody": null, "positiveTestsAntibody": null, "negativeTestsAntibody": null, "totalTestsPeopleAntibody": null, "positiveTestsPeopleAntibody": null, "negativeTestsPeopleAntibody": null, "totalTestsPeopleAntigen": null, "positiveTestsPeopleAntigen": null, "totalTestsAntigen": null, "positiveTestsAntigen": null, "fips": "08", "positiveIncrease": 29, "negativeIncrease": 86, "total": 711, "totalTestResultsIncrease": 135, "posNeg": 711, "deathIncrease": 1, "hospitalizedIncrease": 0, "hash": "2ba808700b257d3062fa6c52451b84a69c0cf141", "commercialScore": 0, "negativeRegularScore": 0, "negativeScore": 0, "positiveScore": 0, "score": 0, "grade": "", "month_number_label": "2020-03", "date_label": "2020-03-13", "week_number_label": "2020W11", "week_start_label": "2020-03-09"}, {"date": 20200314, "state": "CO", "positive": 131, "probableCases": null, "negative": 627, "pending": null, "totalTestResultsSource": "totalTestEncountersViral", "totalTestResults": 525, "hospitalizedCurrently": null, "hospitalizedCumulative": null, "inIcuCurrently": null, "inIcuCumulative": null, "onVentilatorCurrently": null, "onVentilatorCumulative": null, "recovered": null, "dataQualityGrade": null, "lastUpdateEt": "3/15/2020 15:45", "dateModified": "2020-03-15T15:45:00Z", "checkTimeEt": "03/15 11:45", "death": 1, "hospitalized": null, "dateChecked": "2020-03-15T15:45:00Z", "totalTestsViral": null, "positiveTestsViral": null, "negativeTestsViral": null, "positiveCasesViral": null, "deathConfirmed": null, "deathProbable": null, "totalTestEncountersViral": 525, "totalTestsPeopleViral": null, "totalTestsAntibody": null, "positiveTestsAntibody": null, "negativeTestsAntibody": null, "totalTestsPeopleAntibody": null, "positiveTestsPeopleAntibody": null, "negativeTestsPeopleAntibody": null, "totalTestsPeopleAntigen": null, "positiveTestsPeopleAntigen": null, "totalTestsAntigen": null, "positiveTestsAntigen": null, "fips": "08", "positiveIncrease": 30, "negativeIncrease": 17, "total": 758, "totalTestResultsIncrease": 192, "posNeg": 758, "deathIncrease": 0, "hospitalizedIncrease": 0, "hash": "058b5c07a3637a20bd36281af8734da1337e8871", "commercialScore": 0, "negativeRegularScore": 0, "negativeScore": 0, "positiveScore": 0, "score": 0, "grade": "", "month_number_label": "2020-03", "date_label": "2020-03-14", "week_number_label": "2020W11", "week_start_label": "2020-03-09"}, {"date": 20200315, "state": "CO", "positive": 131, "probableCases": null, "negative": 627, "pending": null, "totalTestResultsSource": "totalTestEncountersViral", "totalTestResults": 704, "hospitalizedCurrently": null, "hospitalizedCumulative": null, "inIcuCurrently": null, "inIcuCumulative": null, "onVentilatorCurrently": null, "onVentilatorCumulative": null, "recovered": null, "dataQualityGrade": null, "lastUpdateEt": "3/16/2020 15:35", "dateModified": "2020-03-16T15:35:00Z", "checkTimeEt": "03/16 11:35", "death": 1, "hospitalized": null, "dateChecked": "2020-03-16T15:35:00Z", "totalTestsViral": null, "positiveTestsViral": null, "negativeTestsViral": null, "positiveCasesViral": null, "deathConfirmed": null, "deathProbable": null, "totalTestEncountersViral": 704, "totalTestsPeopleViral": null, "totalTestsAntibody": null, "positiveTestsAntibody": null, "negativeTestsAntibody": null, "totalTestsPeopleAntibody": null, "positiveTestsPeopleAntibody": null, "negativeTestsPeopleAntibody": null, "totalTestsPeopleAntigen": null, "positiveTestsPeopleAntigen": null, "totalTestsAntigen": null, "positiveTestsAntigen": null, "fips": "08", "positiveIncrease": 0, "negativeIncrease": 0, "total": 758, "totalTestResultsIncrease": 179, "posNeg": 758, "deathIncrease": 0, "hospitalizedIncrease": 0, "hash": "23cad217c3f61075e656600cab31d71fd04158d3", "commercialScore": 0, "negativeRegularScore": 0, "negativeScore": 0, "positiveScore": 0, "score": 0, "grade": "", "month_number_label": "2020-03", "date_label": "2020-03-15", "week_number_label": "2020W11", "week_start_label": "2020-03-09"}, {"date": 20200316, "state": "CO", "positive": 160, "probableCases": null, "negative": 1056, "pending": null, "totalTestResultsSource": "totalTestEncountersViral", "totalTestResults": 1007, "hospitalizedCurrently": null, "hospitalizedCumulative": null, "inIcuCurrently": null, "inIcuCumulative": null, "onVentilatorCurrently": null, "onVentilatorCumulative": null, "recovered": null, "dataQualityGrade": null, "lastUpdateEt": "3/16/2020 17:00", "dateModified": "2020-03-16T17:00:00Z", "checkTimeEt": "03/16 13:00", "death": 1, "hospitalized": null, "dateChecked": "2020-03-16T17:00:00Z", "totalTestsViral": null, "positiveTestsViral": null, "negativeTestsViral": null, "positiveCasesViral": null, "deathConfirmed": null, "deathProbable": null, "totalTestEncountersViral": 1007, "totalTestsPeopleViral": null, "totalTestsAntibody": null, "positiveTestsAntibody": null, "negativeTestsAntibody": null, "totalTestsPeopleAntibody": null, "positiveTestsPeopleAntibody": null, "negativeTestsPeopleAntibody": null, "totalTestsPeopleAntigen": null, "positiveTestsPeopleAntigen": null, "totalTestsAntigen": null, "positiveTestsAntigen": null, "fips": "08", "positiveIncrease": 29, "negativeIncrease": 429, "total": 1216, "totalTestResultsIncrease": 303, "posNeg": 1216, "deathIncrease": 0, "hospitalizedIncrease": 0, "hash": "0687b6e59c94b9bb65e3f8e56993f50b93b7ff78", "commercialScore": 0, "negativeRegularScore": 0, "negativeScore": 0, "positiveScore": 0, "score": 0, "grade": "", "month_number_label": "2020-03", "date_label": "2020-03-16", "week_number_label": "2020W12", "week_start_label": "2020-03-16"}, {"date": 20200317, "state": "CO", "positive": 183, "probableCases": null, "negative": 1617, "pending": null, "totalTestResultsSource": "totalTestEncountersViral", "totalTestResults": 1468, "hospitalizedCurrently": null, "hospitalizedCumulative": 20, "inIcuCurrently": null, "inIcuCumulative": null, "onVentilatorCurrently": null, "onVentilatorCumulative": null, "recovered": null, "dataQualityGrade": null, "lastUpdateEt": "3/18/2020 00:00", "dateModified": "2020-03-18T00:00:00Z", "checkTimeEt": "03/17 20:00", "death": 2, "hospitalized": 20, "dateChecked": "2020-03-18T00:00:00Z", "totalTestsViral": null, "positiveTestsViral": null, "negativeTestsViral": null, "positiveCasesViral": null, "deathConfirmed": null, "deathProbable": null, "totalTestEncountersViral": 1468, "totalTestsPeopleViral": 1790, "totalTestsAntibody": null, "positiveTestsAntibody": null, "negativeTestsAntibody": null, "totalTestsPeopleAntibody": null, "positiveTestsPeopleAntibody": null, "negativeTestsPeopleAntibody": null, "totalTestsPeopleAntigen": null, "positiveTestsPeopleAntigen": null, "totalTestsAntigen": null, "positiveTestsAntigen": null, "fips": "08", "positiveIncrease": 23, "negativeIncrease": 561, "total": 1800, "totalTestResultsIncrease": 461, "posNeg": 1800, "deathIncrease": 1, "hospitalizedIncrease": 20, "hash": "25f4b6135c8c02245cc5cf36ad1fcd99b0d08e3b", "commercialScore": 0, "negativeRegularScore": 0, "negativeScore": 0, "positiveScore": 0, "score": 0, "grade": "", "month_number_label": "2020-03", "date_label": "2020-03-17", "week_number_label": "2020W12", "week_start_label": "2020-03-16"}, {"date": 20200318, "state": "CO", "positive": 216, "probableCases": null, "negative": 2112, "pending": null, "totalTestResultsSource": "totalTestEncountersViral", "totalTestResults": 2204, "hospitalizedCurrently": null, "hospitalizedCumulative": 26, "inIcuCurrently": null, "inIcuCumulative": null, "onVentilatorCurrently": null, "onVentilatorCumulative": null, "recovered": null, "dataQualityGrade": null, "lastUpdateEt": "3/18/2020 18:30", "dateModified": "2020-03-18T18:30:00Z", "checkTimeEt": "03/18 14:30", "death": 2, "hospitalized": 26, "dateChecked": "2020-03-18T18:30:00Z", "totalTestsViral": null, "positiveTestsViral": null, "negativeTestsViral": null, "positiveCasesViral": null, "deathConfirmed": null, "deathProbable": null, "totalTestEncountersViral": 2204, "totalTestsPeopleViral": 2328, "totalTestsAntibody": null, "positiveTestsAntibody": null, "negativeTestsAntibody": null, "totalTestsPeopleAntibody": null, "positiveTestsPeopleAntibody": null, "negativeTestsPeopleAntibody": null, "totalTestsPeopleAntigen": null, "positiveTestsPeopleAntigen": null, "totalTestsAntigen": null, "positiveTestsAntigen": null, "fips": "08", "positiveIncrease": 33, "negativeIncrease": 495, "total": 2328, "totalTestResultsIncrease": 736, "posNeg": 2328, "deathIncrease": 0, "hospitalizedIncrease": 6, "hash": "a29438ea517573b0c260ef1974248a87f06392b3", "commercialScore": 0, "negativeRegularScore": 0, "negativeScore": 0, "positiveScore": 0, "score": 0, "grade": "", "month_number_label": "2020-03", "date_label": "2020-03-18", "week_number_label": "2020W12", "week_start_label": "2020-03-16"}, {"date": 20200319, "state": "CO", "positive": 277, "probableCases": null, "negative": 2675, "pending": null, "totalTestResultsSource": "totalTestEncountersViral", "totalTestResults": 2728, "hospitalizedCurrently": null, "hospitalizedCumulative": 42, "inIcuCurrently": null, "inIcuCumulative": null, "onVentilatorCurrently": null, "onVentilatorCumulative": null, "recovered": null, "dataQualityGrade": null, "lastUpdateEt": "3/20/2020 14:42", "dateModified": "2020-03-20T14:42:00Z", "checkTimeEt": "03/20 10:42", "death": 2, "hospitalized": 42, "dateChecked": "2020-03-20T14:42:00Z", "totalTestsViral": null, "positiveTestsViral": null, "negativeTestsViral": null, "positiveCasesViral": null, "deathConfirmed": null, "deathProbable": null, "totalTestEncountersViral": 2728, "totalTestsPeopleViral": 2952, "totalTestsAntibody": null, "positiveTestsAntibody": null, "negativeTestsAntibody": null, "totalTestsPeopleAntibody": null, "positiveTestsPeopleAntibody": null, "negativeTestsPeopleAntibody": null, "totalTestsPeopleAntigen": null, "positiveTestsPeopleAntigen": null, "totalTestsAntigen": null, "positiveTestsAntigen": null, "fips": "08", "positiveIncrease": 61, "negativeIncrease": 563, "total": 2952, "totalTestResultsIncrease": 524, "posNeg": 2952, "deathIncrease": 0, "hospitalizedIncrease": 16, "hash": "175b28b6659c57af1335f48c1f89c00d817430ba", "commercialScore": 0, "negativeRegularScore": 0, "negativeScore": 0, "positiveScore": 0, "score": 0, "grade": "", "month_number_label": "2020-03", "date_label": "2020-03-19", "week_number_label": "2020W12", "week_start_label": "2020-03-16"}, {"date": 20200320, "state": "CO", "positive": 363, "probableCases": null, "negative": 3317, "pending": null, "totalTestResultsSource": "totalTestEncountersViral", "totalTestResults": 3535, "hospitalizedCurrently": null, "hospitalizedCumulative": 44, "inIcuCurrently": null, "inIcuCumulative": null, "onVentilatorCurrently": null, "onVentilatorCumulative": null, "recovered": null, "dataQualityGrade": null, "lastUpdateEt": "3/20/2020 18:00", "dateModified": "2020-03-20T18:00:00Z", "checkTimeEt": "03/20 14:00", "death": 4, "hospitalized": 44, "dateChecked": "2020-03-20T18:00:00Z", "totalTestsViral": null, "positiveTestsViral": null, "negativeTestsViral": null, "positiveCasesViral": null, "deathConfirmed": null, "deathProbable": null, "totalTestEncountersViral": 3535, "totalTestsPeopleViral": 3680, "totalTestsAntibody": null, "positiveTestsAntibody": null, "negativeTestsAntibody": null, "totalTestsPeopleAntibody": null, "positiveTestsPeopleAntibody": null, "negativeTestsPeopleAntibody": null, "totalTestsPeopleAntigen": null, "positiveTestsPeopleAntigen": null, "totalTestsAntigen": null, "positiveTestsAntigen": null, "fips": "08", "positiveIncrease": 86, "negativeIncrease": 642, "total": 3680, "totalTestResultsIncrease": 807, "posNeg": 3680, "deathIncrease": 2, "hospitalizedIncrease": 2, "hash": "b253f76c797af6d9bc050d38f8fb0ba2aa5121d6", "commercialScore": 0, "negativeRegularScore": 0, "negativeScore": 0, "positiveScore": 0, "score": 0, "grade": "", "month_number_label": "2020-03", "date_label": "2020-03-20", "week_number_label": "2020W12", "week_start_label": "2020-03-16"}, {"date": 20200321, "state": "CO", "positive": 475, "probableCases": null, "negative": 4075, "pending": null, "totalTestResultsSource": "totalTestEncountersViral", "totalTestResults": 4367, "hospitalizedCurrently": 56, "hospitalizedCumulative": 49, "inIcuCurrently": null, "inIcuCumulative": null, "onVentilatorCurrently": null, "onVentilatorCumulative": null, "recovered": null, "dataQualityGrade": null, "lastUpdateEt": "3/21/2020 18:00", "dateModified": "2020-03-21T18:00:00Z", "checkTimeEt": "03/21 14:00", "death": 5, "hospitalized": 49, "dateChecked": "2020-03-21T18:00:00Z", "totalTestsViral": null, "positiveTestsViral": null, "negativeTestsViral": null, "positiveCasesViral": null, "deathConfirmed": null, "deathProbable": null, "totalTestEncountersViral": 4367, "totalTestsPeopleViral": 4550, "totalTestsAntibody": null, "positiveTestsAntibody": null, "negativeTestsAntibody": null, "totalTestsPeopleAntibody": null, "positiveTestsPeopleAntibody": null, "negativeTestsPeopleAntibody": null, "totalTestsPeopleAntigen": null, "positiveTestsPeopleAntigen": null, "totalTestsAntigen": null, "positiveTestsAntigen": null, "fips": "08", "positiveIncrease": 112, "negativeIncrease": 758, "total": 4550, "totalTestResultsIncrease": 832, "posNeg": 4550, "deathIncrease": 1, "hospitalizedIncrease": 5, "hash": "08f4cde74f9a6cb606cd7b839720bc9053269c74", "commercialScore": 0, "negativeRegularScore": 0, "negativeScore": 0, "positiveScore": 0, "score": 0, "grade": "", "month_number_label": "2020-03", "date_label": "2020-03-21", "week_number_label": "2020W12", "week_start_label": "2020-03-16"}, {"date": 20200322, "state": "CO", "positive": 591, "probableCases": null, "negative": 4845, "pending": null, "totalTestResultsSource": "totalTestEncountersViral", "totalTestResults": 5789, "hospitalizedCurrently": 74, "hospitalizedCumulative": 58, "inIcuCurrently": null, "inIcuCumulative": null, "onVentilatorCurrently": null, "onVentilatorCumulative": null, "recovered": null, "dataQualityGrade": "A", "lastUpdateEt": "3/22/2020 18:00", "dateModified": "2020-03-22T18:00:00Z", "checkTimeEt": "03/22 14:00", "death": 6, "hospitalized": 58, "dateChecked": "2020-03-22T18:00:00Z", "totalTestsViral": null, "positiveTestsViral": null, "negativeTestsViral": null, "positiveCasesViral": null, "deathConfirmed": null, "deathProbable": null, "totalTestEncountersViral": 5789, "totalTestsPeopleViral": 5436, "totalTestsAntibody": null, "positiveTestsAntibody": null, "negativeTestsAntibody": null, "totalTestsPeopleAntibody": null, "positiveTestsPeopleAntibody": null, "negativeTestsPeopleAntibody": null, "totalTestsPeopleAntigen": null, "positiveTestsPeopleAntigen": null, "totalTestsAntigen": null, "positiveTestsAntigen": null, "fips": "08", "positiveIncrease": 116, "negativeIncrease": 770, "total": 5436, "totalTestResultsIncrease": 1422, "posNeg": 5436, "deathIncrease": 1, "hospitalizedIncrease": 9, "hash": "78c12ef23b24edfabc58e5215c64153f1037f293", "commercialScore": 0, "negativeRegularScore": 0, "negativeScore": 0, "positiveScore": 0, "score": 0, "grade": "", "month_number_label": "2020-03", "date_label": "2020-03-22", "week_number_label": "2020W12", "week_start_label": "2020-03-16"}, {"date": 20200323, "state": "CO", "positive": 720, "probableCases": null, "negative": 5504, "pending": null, "totalTestResultsSource": "totalTestEncountersViral", "totalTestResults": 6713, "hospitalizedCurrently": 116, "hospitalizedCumulative": 72, "inIcuCurrently": null, "inIcuCumulative": null, "onVentilatorCurrently": null, "onVentilatorCumulative": null, "recovered": null, "dataQualityGrade": "A", "lastUpdateEt": "3/23/2020 18:13", "dateModified": "2020-03-23T18:13:00Z", "checkTimeEt": "03/23 14:13", "death": 7, "hospitalized": 72, "dateChecked": "2020-03-23T18:13:00Z", "totalTestsViral": null, "positiveTestsViral": null, "negativeTestsViral": null, "positiveCasesViral": null, "deathConfirmed": null, "deathProbable": null, "totalTestEncountersViral": 6713, "totalTestsPeopleViral": 6224, "totalTestsAntibody": null, "positiveTestsAntibody": null, "negativeTestsAntibody": null, "totalTestsPeopleAntibody": null, "positiveTestsPeopleAntibody": null, "negativeTestsPeopleAntibody": null, "totalTestsPeopleAntigen": null, "positiveTestsPeopleAntigen": null, "totalTestsAntigen": null, "positiveTestsAntigen": null, "fips": "08", "positiveIncrease": 129, "negativeIncrease": 659, "total": 6224, "totalTestResultsIncrease": 924, "posNeg": 6224, "deathIncrease": 1, "hospitalizedIncrease": 14, "hash": "fcc1346af33ced1c71f9ca4c0671f5a82af185cf", "commercialScore": 0, "negativeRegularScore": 0, "negativeScore": 0, "positiveScore": 0, "score": 0, "grade": "", "month_number_label": "2020-03", "date_label": "2020-03-23", "week_number_label": "2020W13", "week_start_label": "2020-03-23"}, {"date": 20200324, "state": "CO", "positive": 912, "probableCases": null, "negative": 6789, "pending": null, "totalTestResultsSource": "totalTestEncountersViral", "totalTestResults": 7944, "hospitalizedCurrently": 152, "hospitalizedCumulative": 84, "inIcuCurrently": null, "inIcuCumulative": null, "onVentilatorCurrently": null, "onVentilatorCumulative": null, "recovered": null, "dataQualityGrade": "A", "lastUpdateEt": "3/24/2020 18:00", "dateModified": "2020-03-24T18:00:00Z", "checkTimeEt": "03/24 14:00", "death": 11, "hospitalized": 84, "dateChecked": "2020-03-24T18:00:00Z", "totalTestsViral": null, "positiveTestsViral": null, "negativeTestsViral": null, "positiveCasesViral": null, "deathConfirmed": null, "deathProbable": null, "totalTestEncountersViral": 7944, "totalTestsPeopleViral": 7701, "totalTestsAntibody": null, "positiveTestsAntibody": null, "negativeTestsAntibody": null, "totalTestsPeopleAntibody": null, "positiveTestsPeopleAntibody": null, "negativeTestsPeopleAntibody": null, "totalTestsPeopleAntigen": null, "positiveTestsPeopleAntigen": null, "totalTestsAntigen": null, "positiveTestsAntigen": null, "fips": "08", "positiveIncrease": 192, "negativeIncrease": 1285, "total": 7701, "totalTestResultsIncrease": 1231, "posNeg": 7701, "deathIncrease": 4, "hospitalizedIncrease": 12, "hash": "fd172029ad0cfe3e271f281ff7b3356056cfe454", "commercialScore": 0, "negativeRegularScore": 0, "negativeScore": 0, "positiveScore": 0, "score": 0, "grade": "", "month_number_label": "2020-03", "date_label": "2020-03-24", "week_number_label": "2020W13", "week_start_label": "2020-03-23"}, {"date": 20200325, "state": "CO", "positive": 1086, "probableCases": null, "negative": 6978, "pending": null, "totalTestResultsSource": "totalTestEncountersViral", "totalTestResults": 9078, "hospitalizedCurrently": 230, "hospitalizedCumulative": 148, "inIcuCurrently": null, "inIcuCumulative": null, "onVentilatorCurrently": null, "onVentilatorCumulative": null, "recovered": null, "dataQualityGrade": "A", "lastUpdateEt": "3/25/2020 18:00", "dateModified": "2020-03-25T18:00:00Z", "checkTimeEt": "03/25 14:00", "death": 19, "hospitalized": 148, "dateChecked": "2020-03-25T18:00:00Z", "totalTestsViral": null, "positiveTestsViral": null, "negativeTestsViral": null, "positiveCasesViral": null, "deathConfirmed": null, "deathProbable": null, "totalTestEncountersViral": 9078, "totalTestsPeopleViral": 8064, "totalTestsAntibody": null, "positiveTestsAntibody": null, "negativeTestsAntibody": null, "totalTestsPeopleAntibody": null, "positiveTestsPeopleAntibody": null, "negativeTestsPeopleAntibody": null, "totalTestsPeopleAntigen": null, "positiveTestsPeopleAntigen": null, "totalTestsAntigen": null, "positiveTestsAntigen": null, "fips": "08", "positiveIncrease": 174, "negativeIncrease": 189, "total": 8064, "totalTestResultsIncrease": 1134, "posNeg": 8064, "deathIncrease": 8, "hospitalizedIncrease": 64, "hash": "26e988bc8370a37f3c7721db0425f09d24cf1020", "commercialScore": 0, "negativeRegularScore": 0, "negativeScore": 0, "positiveScore": 0, "score": 0, "grade": "", "month_number_label": "2020-03", "date_label": "2020-03-25", "week_number_label": "2020W13", "week_start_label": "2020-03-23"}, {"date": 20200326, "state": "CO", "positive": 1430, "probableCases": null, "negative": 8692, "pending": null, "totalTestResultsSource": "totalTestEncountersViral", "totalTestResults": 10911, "hospitalizedCurrently": 278, "hospitalizedCumulative": 184, "inIcuCurrently": null, "inIcuCumulative": null, "onVentilatorCurrently": null, "onVentilatorCumulative": null, "recovered": null, "dataQualityGrade": "A", "lastUpdateEt": "3/26/2020 18:00", "dateModified": "2020-03-26T18:00:00Z", "checkTimeEt": "03/26 14:00", "death": 24, "hospitalized": 184, "dateChecked": "2020-03-26T18:00:00Z", "totalTestsViral": null, "positiveTestsViral": null, "negativeTestsViral": null, "positiveCasesViral": null, "deathConfirmed": null, "deathProbable": null, "totalTestEncountersViral": 10911, "totalTestsPeopleViral": 10122, "totalTestsAntibody": null, "positiveTestsAntibody": null, "negativeTestsAntibody": null, "totalTestsPeopleAntibody": null, "positiveTestsPeopleAntibody": null, "negativeTestsPeopleAntibody": null, "totalTestsPeopleAntigen": null, "positiveTestsPeopleAntigen": null, "totalTestsAntigen": null, "positiveTestsAntigen": null, "fips": "08", "positiveIncrease": 344, "negativeIncrease": 1714, "total": 10122, "totalTestResultsIncrease": 1833, "posNeg": 10122, "deathIncrease": 5, "hospitalizedIncrease": 36, "hash": "a81bbe27572c669d170849e93fc02c13a7a4cd74", "commercialScore": 0, "negativeRegularScore": 0, "negativeScore": 0, "positiveScore": 0, "score": 0, "grade": "", "month_number_label": "2020-03", "date_label": "2020-03-26", "week_number_label": "2020W13", "week_start_label": "2020-03-23"}, {"date": 20200327, "state": "CO", "positive": 1734, "probableCases": null, "negative": 9942, "pending": null, "totalTestResultsSource": "totalTestEncountersViral", "totalTestResults": 12504, "hospitalizedCurrently": 307, "hospitalizedCumulative": 239, "inIcuCurrently": null, "inIcuCumulative": null, "onVentilatorCurrently": null, "onVentilatorCumulative": null, "recovered": null, "dataQualityGrade": "A", "lastUpdateEt": "3/27/2020 18:00", "dateModified": "2020-03-27T18:00:00Z", "checkTimeEt": "03/27 14:00", "death": 31, "hospitalized": 239, "dateChecked": "2020-03-27T18:00:00Z", "totalTestsViral": null, "positiveTestsViral": null, "negativeTestsViral": null, "positiveCasesViral": null, "deathConfirmed": null, "deathProbable": null, "totalTestEncountersViral": 12504, "totalTestsPeopleViral": 11676, "totalTestsAntibody": null, "positiveTestsAntibody": null, "negativeTestsAntibody": null, "totalTestsPeopleAntibody": null, "positiveTestsPeopleAntibody": null, "negativeTestsPeopleAntibody": null, "totalTestsPeopleAntigen": null, "positiveTestsPeopleAntigen": null, "totalTestsAntigen": null, "positiveTestsAntigen": null, "fips": "08", "positiveIncrease": 304, "negativeIncrease": 1250, "total": 11676, "totalTestResultsIncrease": 1593, "posNeg": 11676, "deathIncrease": 7, "hospitalizedIncrease": 55, "hash": "63cc0e851eaee01aa0539f1c82cec865c35330b4", "commercialScore": 0, "negativeRegularScore": 0, "negativeScore": 0, "positiveScore": 0, "score": 0, "grade": "", "month_number_label": "2020-03", "date_label": "2020-03-27", "week_number_label": "2020W13", "week_start_label": "2020-03-23"}, {"date": 20200328, "state": "CO", "positive": 2061, "probableCases": null, "negative": 11215, "pending": null, "totalTestResultsSource": "totalTestEncountersViral", "totalTestResults": 14191, "hospitalizedCurrently": 332, "hospitalizedCumulative": 274, "inIcuCurrently": null, "inIcuCumulative": null, "onVentilatorCurrently": null, "onVentilatorCumulative": null, "recovered": null, "dataQualityGrade": "A", "lastUpdateEt": "3/28/2020 18:00", "dateModified": "2020-03-28T18:00:00Z", "checkTimeEt": "03/28 14:00", "death": 44, "hospitalized": 274, "dateChecked": "2020-03-28T18:00:00Z", "totalTestsViral": null, "positiveTestsViral": null, "negativeTestsViral": null, "positiveCasesViral": null, "deathConfirmed": null, "deathProbable": null, "totalTestEncountersViral": 14191, "totalTestsPeopleViral": 13276, "totalTestsAntibody": null, "positiveTestsAntibody": null, "negativeTestsAntibody": null, "totalTestsPeopleAntibody": null, "positiveTestsPeopleAntibody": null, "negativeTestsPeopleAntibody": null, "totalTestsPeopleAntigen": null, "positiveTestsPeopleAntigen": null, "totalTestsAntigen": null, "positiveTestsAntigen": null, "fips": "08", "positiveIncrease": 327, "negativeIncrease": 1273, "total": 13276, "totalTestResultsIncrease": 1687, "posNeg": 13276, "deathIncrease": 13, "hospitalizedIncrease": 35, "hash": "cf2c6f23d1bcc029a37ee1bfee6e4ba4b7d3324c", "commercialScore": 0, "negativeRegularScore": 0, "negativeScore": 0, "positiveScore": 0, "score": 0, "grade": "", "month_number_label": "2020-03", "date_label": "2020-03-28", "week_number_label": "2020W13", "week_start_label": "2020-03-23"}, {"date": 20200329, "state": "CO", "positive": 2307, "probableCases": null, "negative": 12737, "pending": null, "totalTestResultsSource": "totalTestEncountersViral", "totalTestResults": 15474, "hospitalizedCurrently": 358, "hospitalizedCumulative": 326, "inIcuCurrently": null, "inIcuCumulative": null, "onVentilatorCurrently": null, "onVentilatorCumulative": null, "recovered": null, "dataQualityGrade": "A", "lastUpdateEt": "3/30/2020 17:00", "dateModified": "2020-03-30T17:00:00Z", "checkTimeEt": "03/30 13:00", "death": 47, "hospitalized": 326, "dateChecked": "2020-03-30T17:00:00Z", "totalTestsViral": null, "positiveTestsViral": null, "negativeTestsViral": null, "positiveCasesViral": null, "deathConfirmed": null, "deathProbable": null, "totalTestEncountersViral": 15474, "totalTestsPeopleViral": 14470, "totalTestsAntibody": null, "positiveTestsAntibody": null, "negativeTestsAntibody": null, "totalTestsPeopleAntibody": null, "positiveTestsPeopleAntibody": null, "negativeTestsPeopleAntibody": null, "totalTestsPeopleAntigen": null, "positiveTestsPeopleAntigen": null, "totalTestsAntigen": null, "positiveTestsAntigen": null, "fips": "08", "positiveIncrease": 246, "negativeIncrease": 1522, "total": 15044, "totalTestResultsIncrease": 1283, "posNeg": 15044, "deathIncrease": 3, "hospitalizedIncrease": 52, "hash": "6e84e11f10e7e3ef8ea8a672e82f04138226d0f3", "commercialScore": 0, "negativeRegularScore": 0, "negativeScore": 0, "positiveScore": 0, "score": 0, "grade": "", "month_number_label": "2020-03", "date_label": "2020-03-29", "week_number_label": "2020W13", "week_start_label": "2020-03-23"}, {"date": 20200330, "state": "CO", "positive": 2627, "probableCases": null, "negative": 12737, "pending": null, "totalTestResultsSource": "totalTestEncountersViral", "totalTestResults": 17107, "hospitalizedCurrently": 503, "hospitalizedCumulative": 414, "inIcuCurrently": null, "inIcuCumulative": null, "onVentilatorCurrently": null, "onVentilatorCumulative": null, "recovered": null, "dataQualityGrade": "A", "lastUpdateEt": "3/30/2020 18:00", "dateModified": "2020-03-30T18:00:00Z", "checkTimeEt": "03/30 14:00", "death": 51, "hospitalized": 414, "dateChecked": "2020-03-30T18:00:00Z", "totalTestsViral": null, "positiveTestsViral": null, "negativeTestsViral": null, "positiveCasesViral": null, "deathConfirmed": null, "deathProbable": null, "totalTestEncountersViral": 17107, "totalTestsPeopleViral": 15364, "totalTestsAntibody": null, "positiveTestsAntibody": null, "negativeTestsAntibody": null, "totalTestsPeopleAntibody": null, "positiveTestsPeopleAntibody": null, "negativeTestsPeopleAntibody": null, "totalTestsPeopleAntigen": null, "positiveTestsPeopleAntigen": null, "totalTestsAntigen": null, "positiveTestsAntigen": null, "fips": "08", "positiveIncrease": 320, "negativeIncrease": 0, "total": 15364, "totalTestResultsIncrease": 1633, "posNeg": 15364, "deathIncrease": 4, "hospitalizedIncrease": 88, "hash": "8a80ecb730319842a07168363023dc502837b225", "commercialScore": 0, "negativeRegularScore": 0, "negativeScore": 0, "positiveScore": 0, "score": 0, "grade": "", "month_number_label": "2020-03", "date_label": "2020-03-30", "week_number_label": "2020W14", "week_start_label": "2020-03-30"}, {"date": 20200331, "state": "CO", "positive": 2966, "probableCases": null, "negative": 13883, "pending": null, "totalTestResultsSource": "totalTestEncountersViral", "totalTestResults": 18514, "hospitalizedCurrently": 574, "hospitalizedCumulative": 509, "inIcuCurrently": null, "inIcuCumulative": null, "onVentilatorCurrently": null, "onVentilatorCumulative": null, "recovered": null, "dataQualityGrade": "A", "lastUpdateEt": "3/31/2020 18:00", "dateModified": "2020-03-31T18:00:00Z", "checkTimeEt": "03/31 14:00", "death": 69, "hospitalized": 509, "dateChecked": "2020-03-31T18:00:00Z", "totalTestsViral": null, "positiveTestsViral": null, "negativeTestsViral": null, "positiveCasesViral": null, "deathConfirmed": null, "deathProbable": null, "totalTestEncountersViral": 18514, "totalTestsPeopleViral": 16849, "totalTestsAntibody": null, "positiveTestsAntibody": null, "negativeTestsAntibody": null, "totalTestsPeopleAntibody": null, "positiveTestsPeopleAntibody": null, "negativeTestsPeopleAntibody": null, "totalTestsPeopleAntigen": null, "positiveTestsPeopleAntigen": null, "totalTestsAntigen": null, "positiveTestsAntigen": null, "fips": "08", "positiveIncrease": 339, "negativeIncrease": 1146, "total": 16849, "totalTestResultsIncrease": 1407, "posNeg": 16849, "deathIncrease": 18, "hospitalizedIncrease": 95, "hash": "77d80a57b9323966bb458e1c93fba617f353928b", "commercialScore": 0, "negativeRegularScore": 0, "negativeScore": 0, "positiveScore": 0, "score": 0, "grade": "", "month_number_label": "2020-03", "date_label": "2020-03-31", "week_number_label": "2020W14", "week_start_label": "2020-03-30"}, {"date": 20200401, "state": "CO", "positive": 3342, "probableCases": null, "negative": 15303, "pending": null, "totalTestResultsSource": "totalTestEncountersViral", "totalTestResults": 20206, "hospitalizedCurrently": 698, "hospitalizedCumulative": 620, "inIcuCurrently": null, "inIcuCumulative": null, "onVentilatorCurrently": null, "onVentilatorCumulative": null, "recovered": null, "dataQualityGrade": "A", "lastUpdateEt": "4/1/2020 18:00", "dateModified": "2020-04-01T18:00:00Z", "checkTimeEt": "04/01 14:00", "death": 80, "hospitalized": 620, "dateChecked": "2020-04-01T18:00:00Z", "totalTestsViral": null, "positiveTestsViral": null, "negativeTestsViral": null, "positiveCasesViral": null, "deathConfirmed": null, "deathProbable": null, "totalTestEncountersViral": 20206, "totalTestsPeopleViral": 18645, "totalTestsAntibody": null, "positiveTestsAntibody": null, "negativeTestsAntibody": null, "totalTestsPeopleAntibody": null, "positiveTestsPeopleAntibody": null, "negativeTestsPeopleAntibody": null, "totalTestsPeopleAntigen": null, "positiveTestsPeopleAntigen": null, "totalTestsAntigen": null, "positiveTestsAntigen": null, "fips": "08", "positiveIncrease": 376, "negativeIncrease": 1420, "total": 18645, "totalTestResultsIncrease": 1692, "posNeg": 18645, "deathIncrease": 11, "hospitalizedIncrease": 111, "hash": "05c7528aad4c586061420350c3b8e03b09e4e066", "commercialScore": 0, "negativeRegularScore": 0, "negativeScore": 0, "positiveScore": 0, "score": 0, "grade": "", "month_number_label": "2020-04", "date_label": "2020-04-01", "week_number_label": "2020W14", "week_start_label": "2020-03-30"}, {"date": 20200402, "state": "CO", "positive": 3728, "probableCases": null, "negative": 16683, "pending": null, "totalTestResultsSource": "totalTestEncountersViral", "totalTestResults": 21795, "hospitalizedCurrently": 739, "hospitalizedCumulative": 710, "inIcuCurrently": null, "inIcuCumulative": null, "onVentilatorCurrently": null, "onVentilatorCumulative": null, "recovered": null, "dataQualityGrade": "A", "lastUpdateEt": "4/2/2020 18:00", "dateModified": "2020-04-02T18:00:00Z", "checkTimeEt": "04/02 14:00", "death": 97, "hospitalized": 710, "dateChecked": "2020-04-02T18:00:00Z", "totalTestsViral": null, "positiveTestsViral": null, "negativeTestsViral": null, "positiveCasesViral": null, "deathConfirmed": null, "deathProbable": null, "totalTestEncountersViral": 21795, "totalTestsPeopleViral": 20411, "totalTestsAntibody": null, "positiveTestsAntibody": null, "negativeTestsAntibody": null, "totalTestsPeopleAntibody": null, "positiveTestsPeopleAntibody": null, "negativeTestsPeopleAntibody": null, "totalTestsPeopleAntigen": null, "positiveTestsPeopleAntigen": null, "totalTestsAntigen": null, "positiveTestsAntigen": null, "fips": "08", "positiveIncrease": 386, "negativeIncrease": 1380, "total": 20411, "totalTestResultsIncrease": 1589, "posNeg": 20411, "deathIncrease": 17, "hospitalizedIncrease": 90, "hash": "a24bdd658822ad504757a9a914775ed64fcc4a73", "commercialScore": 0, "negativeRegularScore": 0, "negativeScore": 0, "positiveScore": 0, "score": 0, "grade": "", "month_number_label": "2020-04", "date_label": "2020-04-02", "week_number_label": "2020W14", "week_start_label": "2020-03-30"}, {"date": 20200403, "state": "CO", "positive": 4173, "probableCases": null, "negative": 17898, "pending": null, "totalTestResultsSource": "totalTestEncountersViral", "totalTestResults": 23611, "hospitalizedCurrently": 777, "hospitalizedCumulative": 823, "inIcuCurrently": null, "inIcuCumulative": null, "onVentilatorCurrently": null, "onVentilatorCumulative": null, "recovered": null, "dataQualityGrade": "A", "lastUpdateEt": "4/3/2020 18:00", "dateModified": "2020-04-03T18:00:00Z", "checkTimeEt": "04/03 14:00", "death": 111, "hospitalized": 823, "dateChecked": "2020-04-03T18:00:00Z", "totalTestsViral": null, "positiveTestsViral": null, "negativeTestsViral": null, "positiveCasesViral": null, "deathConfirmed": null, "deathProbable": null, "totalTestEncountersViral": 23611, "totalTestsPeopleViral": 22071, "totalTestsAntibody": null, "positiveTestsAntibody": null, "negativeTestsAntibody": null, "totalTestsPeopleAntibody": null, "positiveTestsPeopleAntibody": null, "negativeTestsPeopleAntibody": null, "totalTestsPeopleAntigen": null, "positiveTestsPeopleAntigen": null, "totalTestsAntigen": null, "positiveTestsAntigen": null, "fips": "08", "positiveIncrease": 445, "negativeIncrease": 1215, "total": 22071, "totalTestResultsIncrease": 1816, "posNeg": 22071, "deathIncrease": 14, "hospitalizedIncrease": 113, "hash": "26b43c852f468c956bd60fac559c9f16a9f8c6ff", "commercialScore": 0, "negativeRegularScore": 0, "negativeScore": 0, "positiveScore": 0, "score": 0, "grade": "", "month_number_label": "2020-04", "date_label": "2020-04-03", "week_number_label": "2020W14", "week_start_label": "2020-03-30"}, {"date": 20200404, "state": "CO", "positive": 4565, "probableCases": null, "negative": 19335, "pending": null, "totalTestResultsSource": "totalTestEncountersViral", "totalTestResults": 25579, "hospitalizedCurrently": 783, "hospitalizedCumulative": 875, "inIcuCurrently": null, "inIcuCumulative": null, "onVentilatorCurrently": null, "onVentilatorCumulative": null, "recovered": null, "dataQualityGrade": "A", "lastUpdateEt": "4/4/2020 18:00", "dateModified": "2020-04-04T18:00:00Z", "checkTimeEt": "04/04 14:00", "death": 126, "hospitalized": 875, "dateChecked": "2020-04-04T18:00:00Z", "totalTestsViral": null, "positiveTestsViral": null, "negativeTestsViral": null, "positiveCasesViral": null, "deathConfirmed": null, "deathProbable": null, "totalTestEncountersViral": 25579, "totalTestsPeopleViral": 23900, "totalTestsAntibody": null, "positiveTestsAntibody": null, "negativeTestsAntibody": null, "totalTestsPeopleAntibody": null, "positiveTestsPeopleAntibody": null, "negativeTestsPeopleAntibody": null, "totalTestsPeopleAntigen": null, "positiveTestsPeopleAntigen": null, "totalTestsAntigen": null, "positiveTestsAntigen": null, "fips": "08", "positiveIncrease": 392, "negativeIncrease": 1437, "total": 23900, "totalTestResultsIncrease": 1968, "posNeg": 23900, "deathIncrease": 15, "hospitalizedIncrease": 52, "hash": "1127196d0873b9d1572319d0be8d33a0a890d63b", "commercialScore": 0, "negativeRegularScore": 0, "negativeScore": 0, "positiveScore": 0, "score": 0, "grade": "", "month_number_label": "2020-04", "date_label": "2020-04-04", "week_number_label": "2020W14", "week_start_label": "2020-03-30"}, {"date": 20200405, "state": "CO", "positive": 4950, "probableCases": null, "negative": 20823, "pending": null, "totalTestResultsSource": "totalTestEncountersViral", "totalTestResults": 27699, "hospitalizedCurrently": 786, "hospitalizedCumulative": 924, "inIcuCurrently": null, "inIcuCumulative": null, "onVentilatorCurrently": null, "onVentilatorCumulative": null, "recovered": null, "dataQualityGrade": "A", "lastUpdateEt": "4/5/2020 18:00", "dateModified": "2020-04-05T18:00:00Z", "checkTimeEt": "04/05 14:00", "death": 140, "hospitalized": 924, "dateChecked": "2020-04-05T18:00:00Z", "totalTestsViral": null, "positiveTestsViral": null, "negativeTestsViral": null, "positiveCasesViral": null, "deathConfirmed": null, "deathProbable": null, "totalTestEncountersViral": 27699, "totalTestsPeopleViral": 25773, "totalTestsAntibody": null, "positiveTestsAntibody": null, "negativeTestsAntibody": null, "totalTestsPeopleAntibody": null, "positiveTestsPeopleAntibody": null, "negativeTestsPeopleAntibody": null, "totalTestsPeopleAntigen": null, "positiveTestsPeopleAntigen": null, "totalTestsAntigen": null, "positiveTestsAntigen": null, "fips": "08", "positiveIncrease": 385, "negativeIncrease": 1488, "total": 25773, "totalTestResultsIncrease": 2120, "posNeg": 25773, "deathIncrease": 14, "hospitalizedIncrease": 49, "hash": "f27496511297a6b54e2b7cff2184c9a1f6e9d00f", "commercialScore": 0, "negativeRegularScore": 0, "negativeScore": 0, "positiveScore": 0, "score": 0, "grade": "", "month_number_label": "2020-04", "date_label": "2020-04-05", "week_number_label": "2020W14", "week_start_label": "2020-03-30"}, {"date": 20200406, "state": "CO", "positive": 5172, "probableCases": null, "negative": 21703, "pending": null, "totalTestResultsSource": "totalTestEncountersViral", "totalTestResults": 28901, "hospitalizedCurrently": 786, "hospitalizedCumulative": 994, "inIcuCurrently": null, "inIcuCumulative": null, "onVentilatorCurrently": null, "onVentilatorCumulative": null, "recovered": null, "dataQualityGrade": "A", "lastUpdateEt": "4/6/2020 18:00", "dateModified": "2020-04-06T18:00:00Z", "checkTimeEt": "04/06 14:00", "death": 150, "hospitalized": 994, "dateChecked": "2020-04-06T18:00:00Z", "totalTestsViral": null, "positiveTestsViral": null, "negativeTestsViral": null, "positiveCasesViral": null, "deathConfirmed": null, "deathProbable": null, "totalTestEncountersViral": 28901, "totalTestsPeopleViral": 26875, "totalTestsAntibody": null, "positiveTestsAntibody": null, "negativeTestsAntibody": null, "totalTestsPeopleAntibody": null, "positiveTestsPeopleAntibody": null, "negativeTestsPeopleAntibody": null, "totalTestsPeopleAntigen": null, "positiveTestsPeopleAntigen": null, "totalTestsAntigen": null, "positiveTestsAntigen": null, "fips": "08", "positiveIncrease": 222, "negativeIncrease": 880, "total": 26875, "totalTestResultsIncrease": 1202, "posNeg": 26875, "deathIncrease": 10, "hospitalizedIncrease": 70, "hash": "ae0553e658c59682005c0f79bc6a220397bd162b", "commercialScore": 0, "negativeRegularScore": 0, "negativeScore": 0, "positiveScore": 0, "score": 0, "grade": "", "month_number_label": "2020-04", "date_label": "2020-04-06", "week_number_label": "2020W15", "week_start_label": "2020-04-06"}, {"date": 20200407, "state": "CO", "positive": 5429, "probableCases": null, "negative": 22665, "pending": null, "totalTestResultsSource": "totalTestEncountersViral", "totalTestResults": 30535, "hospitalizedCurrently": 833, "hospitalizedCumulative": 1079, "inIcuCurrently": null, "inIcuCumulative": null, "onVentilatorCurrently": null, "onVentilatorCumulative": null, "recovered": null, "dataQualityGrade": "A", "lastUpdateEt": "4/7/2020 18:00", "dateModified": "2020-04-07T18:00:00Z", "checkTimeEt": "04/07 14:00", "death": 179, "hospitalized": 1079, "dateChecked": "2020-04-07T18:00:00Z", "totalTestsViral": null, "positiveTestsViral": null, "negativeTestsViral": null, "positiveCasesViral": null, "deathConfirmed": null, "deathProbable": null, "totalTestEncountersViral": 30535, "totalTestsPeopleViral": 28094, "totalTestsAntibody": null, "positiveTestsAntibody": null, "negativeTestsAntibody": null, "totalTestsPeopleAntibody": null, "positiveTestsPeopleAntibody": null, "negativeTestsPeopleAntibody": null, "totalTestsPeopleAntigen": null, "positiveTestsPeopleAntigen": null, "totalTestsAntigen": null, "positiveTestsAntigen": null, "fips": "08", "positiveIncrease": 257, "negativeIncrease": 962, "total": 28094, "totalTestResultsIncrease": 1634, "posNeg": 28094, "deathIncrease": 29, "hospitalizedIncrease": 85, "hash": "306de912d9896c8133b7edbf3cbaa87969d3e304", "commercialScore": 0, "negativeRegularScore": 0, "negativeScore": 0, "positiveScore": 0, "score": 0, "grade": "", "month_number_label": "2020-04", "date_label": "2020-04-07", "week_number_label": "2020W15", "week_start_label": "2020-04-06"}, {"date": 20200408, "state": "CO", "positive": 5655, "probableCases": null, "negative": 23544, "pending": null, "totalTestResultsSource": "totalTestEncountersViral", "totalTestResults": 31768, "hospitalizedCurrently": 848, "hospitalizedCumulative": 1162, "inIcuCurrently": null, "inIcuCumulative": null, "onVentilatorCurrently": null, "onVentilatorCumulative": null, "recovered": null, "dataQualityGrade": "A", "lastUpdateEt": "4/8/2020 18:00", "dateModified": "2020-04-08T18:00:00Z", "checkTimeEt": "04/08 14:00", "death": 193, "hospitalized": 1162, "dateChecked": "2020-04-08T18:00:00Z", "totalTestsViral": null, "positiveTestsViral": null, "negativeTestsViral": null, "positiveCasesViral": null, "deathConfirmed": null, "deathProbable": null, "totalTestEncountersViral": 31768, "totalTestsPeopleViral": 29199, "totalTestsAntibody": null, "positiveTestsAntibody": null, "negativeTestsAntibody": null, "totalTestsPeopleAntibody": null, "positiveTestsPeopleAntibody": null, "negativeTestsPeopleAntibody": null, "totalTestsPeopleAntigen": null, "positiveTestsPeopleAntigen": null, "totalTestsAntigen": null, "positiveTestsAntigen": null, "fips": "08", "positiveIncrease": 226, "negativeIncrease": 879, "total": 29199, "totalTestResultsIncrease": 1233, "posNeg": 29199, "deathIncrease": 14, "hospitalizedIncrease": 83, "hash": "c9eaac978fdeb179da584b095083ed2190646d80", "commercialScore": 0, "negativeRegularScore": 0, "negativeScore": 0, "positiveScore": 0, "score": 0, "grade": "", "month_number_label": "2020-04", "date_label": "2020-04-08", "week_number_label": "2020W15", "week_start_label": "2020-04-06"}, {"date": 20200409, "state": "CO", "positive": 6202, "probableCases": null, "negative": 26143, "pending": null, "totalTestResultsSource": "totalTestEncountersViral", "totalTestResults": 33967, "hospitalizedCurrently": 842, "hospitalizedCumulative": 1221, "inIcuCurrently": null, "inIcuCumulative": null, "onVentilatorCurrently": null, "onVentilatorCumulative": null, "recovered": null, "dataQualityGrade": "A", "lastUpdateEt": "4/10/2020 01:59", "dateModified": "2020-04-10T01:59:00Z", "checkTimeEt": "04/09 21:59", "death": 226, "hospitalized": 1221, "dateChecked": "2020-04-10T01:59:00Z", "totalTestsViral": null, "positiveTestsViral": null, "negativeTestsViral": null, "positiveCasesViral": null, "deathConfirmed": null, "deathProbable": null, "totalTestEncountersViral": 33967, "totalTestsPeopleViral": 31180, "totalTestsAntibody": null, "positiveTestsAntibody": null, "negativeTestsAntibody": null, "totalTestsPeopleAntibody": null, "positiveTestsPeopleAntibody": null, "negativeTestsPeopleAntibody": null, "totalTestsPeopleAntigen": null, "positiveTestsPeopleAntigen": null, "totalTestsAntigen": null, "positiveTestsAntigen": null, "fips": "08", "positiveIncrease": 547, "negativeIncrease": 2599, "total": 32345, "totalTestResultsIncrease": 2199, "posNeg": 32345, "deathIncrease": 33, "hospitalizedIncrease": 59, "hash": "d8955e0c7b1661c6e11c58183cde9f6ac670ec9c", "commercialScore": 0, "negativeRegularScore": 0, "negativeScore": 0, "positiveScore": 0, "score": 0, "grade": "", "month_number_label": "2020-04", "date_label": "2020-04-09", "week_number_label": "2020W15", "week_start_label": "2020-04-06"}, {"date": 20200410, "state": "CO", "positive": 6510, "probableCases": null, "negative": 26143, "pending": null, "totalTestResultsSource": "totalTestEncountersViral", "totalTestResults": 35642, "hospitalizedCurrently": 841, "hospitalizedCumulative": 1312, "inIcuCurrently": null, "inIcuCumulative": null, "onVentilatorCurrently": null, "onVentilatorCumulative": null, "recovered": null, "dataQualityGrade": "A", "lastUpdateEt": "4/10/2020 18:00", "dateModified": "2020-04-10T18:00:00Z", "checkTimeEt": "04/10 14:00", "death": 250, "hospitalized": 1312, "dateChecked": "2020-04-10T18:00:00Z", "totalTestsViral": null, "positiveTestsViral": null, "negativeTestsViral": null, "positiveCasesViral": null, "deathConfirmed": null, "deathProbable": null, "totalTestEncountersViral": 35642, "totalTestsPeopleViral": 32653, "totalTestsAntibody": null, "positiveTestsAntibody": null, "negativeTestsAntibody": null, "totalTestsPeopleAntibody": null, "positiveTestsPeopleAntibody": null, "negativeTestsPeopleAntibody": null, "totalTestsPeopleAntigen": null, "positiveTestsPeopleAntigen": null, "totalTestsAntigen": null, "positiveTestsAntigen": null, "fips": "08", "positiveIncrease": 308, "negativeIncrease": 0, "total": 32653, "totalTestResultsIncrease": 1675, "posNeg": 32653, "deathIncrease": 24, "hospitalizedIncrease": 91, "hash": "e94ad9b75678e457d7fa984aed9045fd69327154", "commercialScore": 0, "negativeRegularScore": 0, "negativeScore": 0, "positiveScore": 0, "score": 0, "grade": "", "month_number_label": "2020-04", "date_label": "2020-04-10", "week_number_label": "2020W15", "week_start_label": "2020-04-06"}, {"date": 20200411, "state": "CO", "positive": 6893, "probableCases": null, "negative": 27980, "pending": null, "totalTestResultsSource": "totalTestEncountersViral", "totalTestResults": 38104, "hospitalizedCurrently": 822, "hospitalizedCumulative": 1376, "inIcuCurrently": null, "inIcuCumulative": null, "onVentilatorCurrently": null, "onVentilatorCumulative": null, "recovered": null, "dataQualityGrade": "A", "lastUpdateEt": "4/11/2020 00:00", "dateModified": "2020-04-11T00:00:00Z", "checkTimeEt": "04/10 20:00", "death": 274, "hospitalized": 1376, "dateChecked": "2020-04-11T00:00:00Z", "totalTestsViral": null, "positiveTestsViral": null, "negativeTestsViral": null, "positiveCasesViral": null, "deathConfirmed": null, "deathProbable": null, "totalTestEncountersViral": 38104, "totalTestsPeopleViral": 34873, "totalTestsAntibody": null, "positiveTestsAntibody": null, "negativeTestsAntibody": null, "totalTestsPeopleAntibody": null, "positiveTestsPeopleAntibody": null, "negativeTestsPeopleAntibody": null, "totalTestsPeopleAntigen": null, "positiveTestsPeopleAntigen": null, "totalTestsAntigen": null, "positiveTestsAntigen": null, "fips": "08", "positiveIncrease": 383, "negativeIncrease": 1837, "total": 34873, "totalTestResultsIncrease": 2462, "posNeg": 34873, "deathIncrease": 24, "hospitalizedIncrease": 64, "hash": "ccd2b406afebf0b77db573c4d768ac64a92e1984", "commercialScore": 0, "negativeRegularScore": 0, "negativeScore": 0, "positiveScore": 0, "score": 0, "grade": "", "month_number_label": "2020-04", "date_label": "2020-04-11", "week_number_label": "2020W15", "week_start_label": "2020-04-06"}, {"date": 20200412, "state": "CO", "positive": 7303, "probableCases": null, "negative": 29850, "pending": null, "totalTestResultsSource": "totalTestEncountersViral", "totalTestResults": 40689, "hospitalizedCurrently": 842, "hospitalizedCumulative": 1417, "inIcuCurrently": null, "inIcuCumulative": null, "onVentilatorCurrently": null, "onVentilatorCumulative": null, "recovered": null, "dataQualityGrade": "A", "lastUpdateEt": "4/11/2020 00:00", "dateModified": "2020-04-11T00:00:00Z", "checkTimeEt": "04/10 20:00", "death": 290, "hospitalized": 1417, "dateChecked": "2020-04-11T00:00:00Z", "totalTestsViral": null, "positiveTestsViral": null, "negativeTestsViral": null, "positiveCasesViral": null, "deathConfirmed": null, "deathProbable": null, "totalTestEncountersViral": 40689, "totalTestsPeopleViral": 37153, "totalTestsAntibody": null, "positiveTestsAntibody": null, "negativeTestsAntibody": null, "totalTestsPeopleAntibody": null, "positiveTestsPeopleAntibody": null, "negativeTestsPeopleAntibody": null, "totalTestsPeopleAntigen": null, "positiveTestsPeopleAntigen": null, "totalTestsAntigen": null, "positiveTestsAntigen": null, "fips": "08", "positiveIncrease": 410, "negativeIncrease": 1870, "total": 37153, "totalTestResultsIncrease": 2585, "posNeg": 37153, "deathIncrease": 16, "hospitalizedIncrease": 41, "hash": "25fe2d02049c28594579e0b9739e21e845b6c430", "commercialScore": 0, "negativeRegularScore": 0, "negativeScore": 0, "positiveScore": 0, "score": 0, "grade": "", "month_number_label": "2020-04", "date_label": "2020-04-12", "week_number_label": "2020W15", "week_start_label": "2020-04-06"}, {"date": 20200413, "state": "CO", "positive": 7691, "probableCases": null, "negative": 31051, "pending": null, "totalTestResultsSource": "totalTestEncountersViral", "totalTestResults": 42483, "hospitalizedCurrently": 888, "hospitalizedCumulative": 1493, "inIcuCurrently": null, "inIcuCumulative": null, "onVentilatorCurrently": null, "onVentilatorCumulative": null, "recovered": null, "dataQualityGrade": "A", "lastUpdateEt": "4/12/2020 00:00", "dateModified": "2020-04-12T00:00:00Z", "checkTimeEt": "04/11 20:00", "death": 308, "hospitalized": 1493, "dateChecked": "2020-04-12T00:00:00Z", "totalTestsViral": null, "positiveTestsViral": null, "negativeTestsViral": null, "positiveCasesViral": null, "deathConfirmed": null, "deathProbable": null, "totalTestEncountersViral": 42483, "totalTestsPeopleViral": 38742, "totalTestsAntibody": null, "positiveTestsAntibody": null, "negativeTestsAntibody": null, "totalTestsPeopleAntibody": null, "positiveTestsPeopleAntibody": null, "negativeTestsPeopleAntibody": null, "totalTestsPeopleAntigen": null, "positiveTestsPeopleAntigen": null, "totalTestsAntigen": null, "positiveTestsAntigen": null, "fips": "08", "positiveIncrease": 388, "negativeIncrease": 1201, "total": 38742, "totalTestResultsIncrease": 1794, "posNeg": 38742, "deathIncrease": 18, "hospitalizedIncrease": 76, "hash": "ff60fde9b8d9329df8f5bf5b7814f195a6ebc731", "commercialScore": 0, "negativeRegularScore": 0, "negativeScore": 0, "positiveScore": 0, "score": 0, "grade": "", "month_number_label": "2020-04", "date_label": "2020-04-13", "week_number_label": "2020W16", "week_start_label": "2020-04-13"}, {"date": 20200414, "state": "CO", "positive": 7941, "probableCases": null, "negative": 31639, "pending": null, "totalTestResultsSource": "totalTestEncountersViral", "totalTestResults": 43501, "hospitalizedCurrently": 878, "hospitalizedCumulative": 1556, "inIcuCurrently": null, "inIcuCumulative": null, "onVentilatorCurrently": null, "onVentilatorCumulative": null, "recovered": null, "dataQualityGrade": "A", "lastUpdateEt": "4/13/2020 00:00", "dateModified": "2020-04-13T00:00:00Z", "checkTimeEt": "04/12 20:00", "death": 329, "hospitalized": 1556, "dateChecked": "2020-04-13T00:00:00Z", "totalTestsViral": null, "positiveTestsViral": null, "negativeTestsViral": null, "positiveCasesViral": null, "deathConfirmed": null, "deathProbable": null, "totalTestEncountersViral": 43501, "totalTestsPeopleViral": 39580, "totalTestsAntibody": null, "positiveTestsAntibody": null, "negativeTestsAntibody": null, "totalTestsPeopleAntibody": null, "positiveTestsPeopleAntibody": null, "negativeTestsPeopleAntibody": null, "totalTestsPeopleAntigen": null, "positiveTestsPeopleAntigen": null, "totalTestsAntigen": null, "positiveTestsAntigen": null, "fips": "08", "positiveIncrease": 250, "negativeIncrease": 588, "total": 39580, "totalTestResultsIncrease": 1018, "posNeg": 39580, "deathIncrease": 21, "hospitalizedIncrease": 63, "hash": "171d95a3d7988e5971d94c5aa35756187655602c", "commercialScore": 0, "negativeRegularScore": 0, "negativeScore": 0, "positiveScore": 0, "score": 0, "grade": "", "month_number_label": "2020-04", "date_label": "2020-04-14", "week_number_label": "2020W16", "week_start_label": "2020-04-13"}, {"date": 20200415, "state": "CO", "positive": 8280, "probableCases": null, "negative": 32253, "pending": null, "totalTestResultsSource": "totalTestEncountersViral", "totalTestResults": 44683, "hospitalizedCurrently": 859, "hospitalizedCumulative": 1636, "inIcuCurrently": null, "inIcuCumulative": null, "onVentilatorCurrently": null, "onVentilatorCumulative": null, "recovered": null, "dataQualityGrade": "A", "lastUpdateEt": "4/14/2020 00:00", "dateModified": "2020-04-14T00:00:00Z", "checkTimeEt": "04/13 20:00", "death": 357, "hospitalized": 1636, "dateChecked": "2020-04-14T00:00:00Z", "totalTestsViral": null, "positiveTestsViral": null, "negativeTestsViral": null, "positiveCasesViral": null, "deathConfirmed": null, "deathProbable": null, "totalTestEncountersViral": 44683, "totalTestsPeopleViral": 40533, "totalTestsAntibody": null, "positiveTestsAntibody": null, "negativeTestsAntibody": null, "totalTestsPeopleAntibody": null, "positiveTestsPeopleAntibody": null, "negativeTestsPeopleAntibody": null, "totalTestsPeopleAntigen": null, "positiveTestsPeopleAntigen": null, "totalTestsAntigen": null, "positiveTestsAntigen": null, "fips": "08", "positiveIncrease": 339, "negativeIncrease": 614, "total": 40533, "totalTestResultsIncrease": 1182, "posNeg": 40533, "deathIncrease": 28, "hospitalizedIncrease": 80, "hash": "4b78232e2c403b489617ecaad056e11f69fb270c", "commercialScore": 0, "negativeRegularScore": 0, "negativeScore": 0, "positiveScore": 0, "score": 0, "grade": "", "month_number_label": "2020-04", "date_label": "2020-04-15", "week_number_label": "2020W16", "week_start_label": "2020-04-13"}, {"date": 20200416, "state": "CO", "positive": 8675, "probableCases": null, "negative": 33155, "pending": null, "totalTestResultsSource": "totalTestEncountersViral", "totalTestResults": 46178, "hospitalizedCurrently": 858, "hospitalizedCumulative": 1693, "inIcuCurrently": null, "inIcuCumulative": null, "onVentilatorCurrently": null, "onVentilatorCumulative": null, "recovered": null, "dataQualityGrade": "A", "lastUpdateEt": "4/16/2020 18:00", "dateModified": "2020-04-16T18:00:00Z", "checkTimeEt": "04/16 14:00", "death": 374, "hospitalized": 1693, "dateChecked": "2020-04-16T18:00:00Z", "totalTestsViral": null, "positiveTestsViral": null, "negativeTestsViral": null, "positiveCasesViral": null, "deathConfirmed": null, "deathProbable": null, "totalTestEncountersViral": 46178, "totalTestsPeopleViral": 41830, "totalTestsAntibody": null, "positiveTestsAntibody": null, "negativeTestsAntibody": null, "totalTestsPeopleAntibody": null, "positiveTestsPeopleAntibody": null, "negativeTestsPeopleAntibody": null, "totalTestsPeopleAntigen": null, "positiveTestsPeopleAntigen": null, "totalTestsAntigen": null, "positiveTestsAntigen": null, "fips": "08", "positiveIncrease": 395, "negativeIncrease": 902, "total": 41830, "totalTestResultsIncrease": 1495, "posNeg": 41830, "deathIncrease": 17, "hospitalizedIncrease": 57, "hash": "a8e659588b5d3257f619446f1dc237aa617208bb", "commercialScore": 0, "negativeRegularScore": 0, "negativeScore": 0, "positiveScore": 0, "score": 0, "grade": "", "month_number_label": "2020-04", "date_label": "2020-04-16", "week_number_label": "2020W16", "week_start_label": "2020-04-13"}, {"date": 20200417, "state": "CO", "positive": 9047, "probableCases": null, "negative": 34260, "pending": null, "totalTestResultsSource": "totalTestEncountersViral", "totalTestResults": 47884, "hospitalizedCurrently": 843, "hospitalizedCumulative": 1755, "inIcuCurrently": null, "inIcuCumulative": null, "onVentilatorCurrently": null, "onVentilatorCumulative": null, "recovered": null, "dataQualityGrade": "A", "lastUpdateEt": "4/17/2020 00:00", "dateModified": "2020-04-17T00:00:00Z", "checkTimeEt": "04/16 20:00", "death": 391, "hospitalized": 1755, "dateChecked": "2020-04-17T00:00:00Z", "totalTestsViral": null, "positiveTestsViral": null, "negativeTestsViral": null, "positiveCasesViral": null, "deathConfirmed": null, "deathProbable": null, "totalTestEncountersViral": 47884, "totalTestsPeopleViral": 43307, "totalTestsAntibody": null, "positiveTestsAntibody": null, "negativeTestsAntibody": null, "totalTestsPeopleAntibody": null, "positiveTestsPeopleAntibody": null, "negativeTestsPeopleAntibody": null, "totalTestsPeopleAntigen": null, "positiveTestsPeopleAntigen": null, "totalTestsAntigen": null, "positiveTestsAntigen": null, "fips": "08", "positiveIncrease": 372, "negativeIncrease": 1105, "total": 43307, "totalTestResultsIncrease": 1706, "posNeg": 43307, "deathIncrease": 17, "hospitalizedIncrease": 62, "hash": "ee8c4dbc777dfc622545f5f2ca455796120ff7a7", "commercialScore": 0, "negativeRegularScore": 0, "negativeScore": 0, "positiveScore": 0, "score": 0, "grade": "", "month_number_label": "2020-04", "date_label": "2020-04-17", "week_number_label": "2020W16", "week_start_label": "2020-04-13"}, {"date": 20200418, "state": "CO", "positive": 9433, "probableCases": null, "negative": 35173, "pending": null, "totalTestResultsSource": "totalTestEncountersViral", "totalTestResults": 49465, "hospitalizedCurrently": 874, "hospitalizedCumulative": 1797, "inIcuCurrently": null, "inIcuCumulative": null, "onVentilatorCurrently": null, "onVentilatorCumulative": null, "recovered": null, "dataQualityGrade": "A", "lastUpdateEt": "4/17/2020 00:00", "dateModified": "2020-04-17T00:00:00Z", "checkTimeEt": "04/16 20:00", "death": 411, "hospitalized": 1797, "dateChecked": "2020-04-17T00:00:00Z", "totalTestsViral": null, "positiveTestsViral": null, "negativeTestsViral": null, "positiveCasesViral": null, "deathConfirmed": null, "deathProbable": null, "totalTestEncountersViral": 49465, "totalTestsPeopleViral": 44606, "totalTestsAntibody": null, "positiveTestsAntibody": null, "negativeTestsAntibody": null, "totalTestsPeopleAntibody": null, "positiveTestsPeopleAntibody": null, "negativeTestsPeopleAntibody": null, "totalTestsPeopleAntigen": null, "positiveTestsPeopleAntigen": null, "totalTestsAntigen": null, "positiveTestsAntigen": null, "fips": "08", "positiveIncrease": 386, "negativeIncrease": 913, "total": 44606, "totalTestResultsIncrease": 1581, "posNeg": 44606, "deathIncrease": 20, "hospitalizedIncrease": 42, "hash": "c7b54ea99fa5b3da972ca8832903656aa9ea0e86", "commercialScore": 0, "negativeRegularScore": 0, "negativeScore": 0, "positiveScore": 0, "score": 0, "grade": "", "month_number_label": "2020-04", "date_label": "2020-04-18", "week_number_label": "2020W16", "week_start_label": "2020-04-13"}, {"date": 20200419, "state": "CO", "positive": 9730, "probableCases": null, "negative": 36465, "pending": null, "totalTestResultsSource": "totalTestEncountersViral", "totalTestResults": 51291, "hospitalizedCurrently": 874, "hospitalizedCumulative": 1813, "inIcuCurrently": null, "inIcuCumulative": null, "onVentilatorCurrently": null, "onVentilatorCumulative": null, "recovered": null, "dataQualityGrade": "A", "lastUpdateEt": "4/18/2020 00:00", "dateModified": "2020-04-18T00:00:00Z", "checkTimeEt": "04/17 20:00", "death": 422, "hospitalized": 1813, "dateChecked": "2020-04-18T00:00:00Z", "totalTestsViral": null, "positiveTestsViral": null, "negativeTestsViral": null, "positiveCasesViral": null, "deathConfirmed": null, "deathProbable": null, "totalTestEncountersViral": 51291, "totalTestsPeopleViral": 46195, "totalTestsAntibody": null, "positiveTestsAntibody": null, "negativeTestsAntibody": null, "totalTestsPeopleAntibody": null, "positiveTestsPeopleAntibody": null, "negativeTestsPeopleAntibody": null, "totalTestsPeopleAntigen": null, "positiveTestsPeopleAntigen": null, "totalTestsAntigen": null, "positiveTestsAntigen": null, "fips": "08", "positiveIncrease": 297, "negativeIncrease": 1292, "total": 46195, "totalTestResultsIncrease": 1826, "posNeg": 46195, "deathIncrease": 11, "hospitalizedIncrease": 16, "hash": "d42d32b4ad0d87bda6734faeb0ef24f0eec7bc88", "commercialScore": 0, "negativeRegularScore": 0, "negativeScore": 0, "positiveScore": 0, "score": 0, "grade": "", "month_number_label": "2020-04", "date_label": "2020-04-19", "week_number_label": "2020W16", "week_start_label": "2020-04-13"}, {"date": 20200420, "state": "CO", "positive": 10106, "probableCases": null, "negative": 37360, "pending": null, "totalTestResultsSource": "totalTestEncountersViral", "totalTestResults": 52768, "hospitalizedCurrently": 861, "hospitalizedCumulative": 1880, "inIcuCurrently": null, "inIcuCumulative": null, "onVentilatorCurrently": null, "onVentilatorCumulative": null, "recovered": null, "dataQualityGrade": "A", "lastUpdateEt": "4/20/2020 16:41", "dateModified": "2020-04-20T16:41:00Z", "checkTimeEt": "04/20 12:41", "death": 449, "hospitalized": 1880, "dateChecked": "2020-04-20T16:41:00Z", "totalTestsViral": null, "positiveTestsViral": null, "negativeTestsViral": null, "positiveCasesViral": null, "deathConfirmed": null, "deathProbable": null, "totalTestEncountersViral": 52768, "totalTestsPeopleViral": 47466, "totalTestsAntibody": null, "positiveTestsAntibody": null, "negativeTestsAntibody": null, "totalTestsPeopleAntibody": null, "positiveTestsPeopleAntibody": null, "negativeTestsPeopleAntibody": null, "totalTestsPeopleAntigen": null, "positiveTestsPeopleAntigen": null, "totalTestsAntigen": null, "positiveTestsAntigen": null, "fips": "08", "positiveIncrease": 376, "negativeIncrease": 895, "total": 47466, "totalTestResultsIncrease": 1477, "posNeg": 47466, "deathIncrease": 27, "hospitalizedIncrease": 67, "hash": "8edfe1858b43c58462ad327f5715887145d7d2e4", "commercialScore": 0, "negativeRegularScore": 0, "negativeScore": 0, "positiveScore": 0, "score": 0, "grade": "", "month_number_label": "2020-04", "date_label": "2020-04-20", "week_number_label": "2020W17", "week_start_label": "2020-04-20"}, {"date": 20200421, "state": "CO", "positive": 10447, "probableCases": null, "negative": 38257, "pending": null, "totalTestResultsSource": "totalTestEncountersViral", "totalTestResults": 54244, "hospitalizedCurrently": 851, "hospitalizedCumulative": 2003, "inIcuCurrently": null, "inIcuCumulative": null, "onVentilatorCurrently": null, "onVentilatorCumulative": null, "recovered": null, "dataQualityGrade": "A", "lastUpdateEt": "4/20/2020 00:00", "dateModified": "2020-04-20T00:00:00Z", "checkTimeEt": "04/19 20:00", "death": 486, "hospitalized": 2003, "dateChecked": "2020-04-20T00:00:00Z", "totalTestsViral": null, "positiveTestsViral": null, "negativeTestsViral": null, "positiveCasesViral": null, "deathConfirmed": null, "deathProbable": null, "totalTestEncountersViral": 54244, "totalTestsPeopleViral": 48704, "totalTestsAntibody": null, "positiveTestsAntibody": null, "negativeTestsAntibody": null, "totalTestsPeopleAntibody": null, "positiveTestsPeopleAntibody": null, "negativeTestsPeopleAntibody": null, "totalTestsPeopleAntigen": null, "positiveTestsPeopleAntigen": null, "totalTestsAntigen": null, "positiveTestsAntigen": null, "fips": "08", "positiveIncrease": 341, "negativeIncrease": 897, "total": 48704, "totalTestResultsIncrease": 1476, "posNeg": 48704, "deathIncrease": 37, "hospitalizedIncrease": 123, "hash": "c3b33bafc1a41e6ee44d8ac106cf10ecade8dba4", "commercialScore": 0, "negativeRegularScore": 0, "negativeScore": 0, "positiveScore": 0, "score": 0, "grade": "", "month_number_label": "2020-04", "date_label": "2020-04-21", "week_number_label": "2020W17", "week_start_label": "2020-04-20"}, {"date": 20200422, "state": "CO", "positive": 10878, "probableCases": null, "negative": 39767, "pending": null, "totalTestResultsSource": "totalTestEncountersViral", "totalTestResults": 56411, "hospitalizedCurrently": 859, "hospitalizedCumulative": 2123, "inIcuCurrently": null, "inIcuCumulative": null, "onVentilatorCurrently": null, "onVentilatorCumulative": null, "recovered": null, "dataQualityGrade": "A", "lastUpdateEt": "4/22/2020 00:00", "dateModified": "2020-04-22T00:00:00Z", "checkTimeEt": "04/21 20:00", "death": 508, "hospitalized": 2123, "dateChecked": "2020-04-22T00:00:00Z", "totalTestsViral": null, "positiveTestsViral": null, "negativeTestsViral": null, "positiveCasesViral": null, "deathConfirmed": null, "deathProbable": null, "totalTestEncountersViral": 56411, "totalTestsPeopleViral": 50645, "totalTestsAntibody": null, "positiveTestsAntibody": null, "negativeTestsAntibody": null, "totalTestsPeopleAntibody": null, "positiveTestsPeopleAntibody": null, "negativeTestsPeopleAntibody": null, "totalTestsPeopleAntigen": null, "positiveTestsPeopleAntigen": null, "totalTestsAntigen": null, "positiveTestsAntigen": null, "fips": "08", "positiveIncrease": 431, "negativeIncrease": 1510, "total": 50645, "totalTestResultsIncrease": 2167, "posNeg": 50645, "deathIncrease": 22, "hospitalizedIncrease": 120, "hash": "659d413619882426897ad7590c1499daa0cb90d8", "commercialScore": 0, "negativeRegularScore": 0, "negativeScore": 0, "positiveScore": 0, "score": 0, "grade": "", "month_number_label": "2020-04", "date_label": "2020-04-22", "week_number_label": "2020W17", "week_start_label": "2020-04-20"}, {"date": 20200423, "state": "CO", "positive": 11262, "probableCases": 974, "negative": 41062, "pending": null, "totalTestResultsSource": "totalTestEncountersViral", "totalTestResults": 58315, "hospitalizedCurrently": 1084, "hospitalizedCumulative": 2237, "inIcuCurrently": null, "inIcuCumulative": null, "onVentilatorCurrently": null, "onVentilatorCumulative": null, "recovered": null, "dataQualityGrade": "A", "lastUpdateEt": "4/22/2020 00:00", "dateModified": "2020-04-22T00:00:00Z", "checkTimeEt": "04/21 20:00", "death": 552, "hospitalized": 2237, "dateChecked": "2020-04-22T00:00:00Z", "totalTestsViral": null, "positiveTestsViral": null, "negativeTestsViral": null, "positiveCasesViral": 10208, "deathConfirmed": null, "deathProbable": null, "totalTestEncountersViral": 58315, "totalTestsPeopleViral": 52324, "totalTestsAntibody": null, "positiveTestsAntibody": null, "negativeTestsAntibody": null, "totalTestsPeopleAntibody": null, "positiveTestsPeopleAntibody": null, "negativeTestsPeopleAntibody": null, "totalTestsPeopleAntigen": null, "positiveTestsPeopleAntigen": null, "totalTestsAntigen": null, "positiveTestsAntigen": null, "fips": "08", "positiveIncrease": 384, "negativeIncrease": 1295, "total": 52324, "totalTestResultsIncrease": 1904, "posNeg": 52324, "deathIncrease": 44, "hospitalizedIncrease": 114, "hash": "071b79d155565c006c229f38a0a26f911625abcd", "commercialScore": 0, "negativeRegularScore": 0, "negativeScore": 0, "positiveScore": 0, "score": 0, "grade": "", "month_number_label": "2020-04", "date_label": "2020-04-23", "week_number_label": "2020W17", "week_start_label": "2020-04-20"}, {"date": 20200424, "state": "CO", "positive": 12255, "probableCases": 1189, "negative": 44533, "pending": null, "totalTestResultsSource": "totalTestEncountersViral", "totalTestResults": 63564, "hospitalizedCurrently": 1084, "hospitalizedCumulative": 2366, "inIcuCurrently": null, "inIcuCumulative": null, "onVentilatorCurrently": null, "onVentilatorCumulative": null, "recovered": 2086, "dataQualityGrade": "B", "lastUpdateEt": "4/23/2020 00:00", "dateModified": "2020-04-23T00:00:00Z", "checkTimeEt": "04/22 20:00", "death": 674, "hospitalized": 2366, "dateChecked": "2020-04-23T00:00:00Z", "totalTestsViral": null, "positiveTestsViral": null, "negativeTestsViral": null, "positiveCasesViral": 10995, "deathConfirmed": null, "deathProbable": null, "totalTestEncountersViral": 63564, "totalTestsPeopleViral": 56789, "totalTestsAntibody": null, "positiveTestsAntibody": null, "negativeTestsAntibody": null, "totalTestsPeopleAntibody": null, "positiveTestsPeopleAntibody": null, "negativeTestsPeopleAntibody": null, "totalTestsPeopleAntigen": null, "positiveTestsPeopleAntigen": null, "totalTestsAntigen": null, "positiveTestsAntigen": null, "fips": "08", "positiveIncrease": 993, "negativeIncrease": 3471, "total": 56788, "totalTestResultsIncrease": 5249, "posNeg": 56788, "deathIncrease": 122, "hospitalizedIncrease": 129, "hash": "53cb3f577c5189ec18d6ef5fce3fbf0dd2279d8b", "commercialScore": 0, "negativeRegularScore": 0, "negativeScore": 0, "positiveScore": 0, "score": 0, "grade": "", "month_number_label": "2020-04", "date_label": "2020-04-24", "week_number_label": "2020W17", "week_start_label": "2020-04-20"}, {"date": 20200425, "state": "CO", "positive": 12968, "probableCases": 1335, "negative": 46823, "pending": null, "totalTestResultsSource": "totalTestEncountersViral", "totalTestResults": 66507, "hospitalizedCurrently": 1046, "hospitalizedCumulative": 2410, "inIcuCurrently": null, "inIcuCumulative": null, "onVentilatorCurrently": null, "onVentilatorCumulative": null, "recovered": 2150, "dataQualityGrade": "B", "lastUpdateEt": "4/24/2020 00:00", "dateModified": "2020-04-24T00:00:00Z", "checkTimeEt": "04/23 20:00", "death": 672, "hospitalized": 2410, "dateChecked": "2020-04-24T00:00:00Z", "totalTestsViral": null, "positiveTestsViral": null, "negativeTestsViral": null, "positiveCasesViral": 11533, "deathConfirmed": null, "deathProbable": null, "totalTestEncountersViral": 66507, "totalTestsPeopleViral": 59791, "totalTestsAntibody": null, "positiveTestsAntibody": null, "negativeTestsAntibody": null, "totalTestsPeopleAntibody": null, "positiveTestsPeopleAntibody": null, "negativeTestsPeopleAntibody": null, "totalTestsPeopleAntigen": null, "positiveTestsPeopleAntigen": null, "totalTestsAntigen": null, "positiveTestsAntigen": null, "fips": "08", "positiveIncrease": 713, "negativeIncrease": 2290, "total": 59791, "totalTestResultsIncrease": 2943, "posNeg": 59791, "deathIncrease": -2, "hospitalizedIncrease": 44, "hash": "dbc92eadc57defbdb4429ad9b1c83918c614c445", "commercialScore": 0, "negativeRegularScore": 0, "negativeScore": 0, "positiveScore": 0, "score": 0, "grade": "", "month_number_label": "2020-04", "date_label": "2020-04-25", "week_number_label": "2020W17", "week_start_label": "2020-04-20"}, {"date": 20200426, "state": "CO", "positive": 13441, "probableCases": 1370, "negative": 49833, "pending": null, "totalTestResultsSource": "totalTestEncountersViral", "totalTestResults": 69744, "hospitalizedCurrently": 1007, "hospitalizedCumulative": 2438, "inIcuCurrently": null, "inIcuCumulative": null, "onVentilatorCurrently": null, "onVentilatorCumulative": null, "recovered": 2150, "dataQualityGrade": "B", "lastUpdateEt": "4/25/2020 00:00", "dateModified": "2020-04-25T00:00:00Z", "checkTimeEt": "04/24 20:00", "death": 680, "hospitalized": 2438, "dateChecked": "2020-04-25T00:00:00Z", "totalTestsViral": null, "positiveTestsViral": null, "negativeTestsViral": null, "positiveCasesViral": 11980, "deathConfirmed": null, "deathProbable": null, "totalTestEncountersViral": 69744, "totalTestsPeopleViral": 63274, "totalTestsAntibody": null, "positiveTestsAntibody": null, "negativeTestsAntibody": null, "totalTestsPeopleAntibody": null, "positiveTestsPeopleAntibody": null, "negativeTestsPeopleAntibody": null, "totalTestsPeopleAntigen": null, "positiveTestsPeopleAntigen": null, "totalTestsAntigen": null, "positiveTestsAntigen": null, "fips": "08", "positiveIncrease": 473, "negativeIncrease": 3010, "total": 63274, "totalTestResultsIncrease": 3237, "posNeg": 63274, "deathIncrease": 8, "hospitalizedIncrease": 28, "hash": "d1f7b809c832b6f179e3ddaf5eb458755254bc70", "commercialScore": 0, "negativeRegularScore": 0, "negativeScore": 0, "positiveScore": 0, "score": 0, "grade": "", "month_number_label": "2020-04", "date_label": "2020-04-26", "week_number_label": "2020W17", "week_start_label": "2020-04-20"}, {"date": 20200427, "state": "CO", "positive": 13879, "probableCases": 1424, "negative": 52462, "pending": null, "totalTestResultsSource": "totalTestEncountersViral", "totalTestResults": 72403, "hospitalizedCurrently": 994, "hospitalizedCumulative": 2485, "inIcuCurrently": null, "inIcuCumulative": null, "onVentilatorCurrently": null, "onVentilatorCumulative": null, "recovered": 2275, "dataQualityGrade": "B", "lastUpdateEt": "4/26/2020 00:00", "dateModified": "2020-04-26T00:00:00Z", "checkTimeEt": "04/25 20:00", "death": 706, "hospitalized": 2485, "dateChecked": "2020-04-26T00:00:00Z", "totalTestsViral": null, "positiveTestsViral": null, "negativeTestsViral": null, "positiveCasesViral": 12374, "deathConfirmed": null, "deathProbable": null, "totalTestEncountersViral": 72403, "totalTestsPeopleViral": 66341, "totalTestsAntibody": null, "positiveTestsAntibody": null, "negativeTestsAntibody": null, "totalTestsPeopleAntibody": null, "positiveTestsPeopleAntibody": null, "negativeTestsPeopleAntibody": null, "totalTestsPeopleAntigen": null, "positiveTestsPeopleAntigen": null, "totalTestsAntigen": null, "positiveTestsAntigen": null, "fips": "08", "positiveIncrease": 438, "negativeIncrease": 2629, "total": 66341, "totalTestResultsIncrease": 2659, "posNeg": 66341, "deathIncrease": 26, "hospitalizedIncrease": 47, "hash": "9b79fea258ff3d3e6783365fa96cb035e7a36632", "commercialScore": 0, "negativeRegularScore": 0, "negativeScore": 0, "positiveScore": 0, "score": 0, "grade": "", "month_number_label": "2020-04", "date_label": "2020-04-27", "week_number_label": "2020W18", "week_start_label": "2020-04-27"}, {"date": 20200428, "state": "CO", "positive": 14316, "probableCases": 1497, "negative": 54714, "pending": null, "totalTestResultsSource": "totalTestEncountersViral", "totalTestResults": 75105, "hospitalizedCurrently": 964, "hospitalizedCumulative": 2571, "inIcuCurrently": null, "inIcuCumulative": null, "onVentilatorCurrently": null, "onVentilatorCumulative": null, "recovered": 2275, "dataQualityGrade": "B", "lastUpdateEt": "4/27/2020 00:00", "dateModified": "2020-04-27T00:00:00Z", "checkTimeEt": "04/26 20:00", "death": 736, "hospitalized": 2571, "dateChecked": "2020-04-27T00:00:00Z", "totalTestsViral": null, "positiveTestsViral": null, "negativeTestsViral": null, "positiveCasesViral": 12741, "deathConfirmed": null, "deathProbable": null, "totalTestEncountersViral": 75105, "totalTestsPeopleViral": 67094, "totalTestsAntibody": null, "positiveTestsAntibody": null, "negativeTestsAntibody": null, "totalTestsPeopleAntibody": null, "positiveTestsPeopleAntibody": null, "negativeTestsPeopleAntibody": null, "totalTestsPeopleAntigen": null, "positiveTestsPeopleAntigen": null, "totalTestsAntigen": null, "positiveTestsAntigen": null, "fips": "08", "positiveIncrease": 437, "negativeIncrease": 2252, "total": 69030, "totalTestResultsIncrease": 2702, "posNeg": 69030, "deathIncrease": 30, "hospitalizedIncrease": 86, "hash": "a7a9f3a1e91762c2b024f660aa31dfa2a0d440c9", "commercialScore": 0, "negativeRegularScore": 0, "negativeScore": 0, "positiveScore": 0, "score": 0, "grade": "", "month_number_label": "2020-04", "date_label": "2020-04-28", "week_number_label": "2020W18", "week_start_label": "2020-04-27"}, {"date": 20200429, "state": "CO", "positive": 14758, "probableCases": 1527, "negative": 56301, "pending": null, "totalTestResultsSource": "totalTestEncountersViral", "totalTestResults": 77859, "hospitalizedCurrently": 966, "hospitalizedCumulative": 2621, "inIcuCurrently": null, "inIcuCumulative": null, "onVentilatorCurrently": null, "onVentilatorCumulative": null, "recovered": 2415, "dataQualityGrade": "B", "lastUpdateEt": "4/30/2020 00:00", "dateModified": "2020-04-30T00:00:00Z", "checkTimeEt": "04/29 20:00", "death": 766, "hospitalized": 2621, "dateChecked": "2020-04-30T00:00:00Z", "totalTestsViral": null, "positiveTestsViral": null, "negativeTestsViral": null, "positiveCasesViral": 13148, "deathConfirmed": null, "deathProbable": null, "totalTestEncountersViral": 77859, "totalTestsPeopleViral": 69449, "totalTestsAntibody": null, "positiveTestsAntibody": null, "negativeTestsAntibody": null, "totalTestsPeopleAntibody": null, "positiveTestsPeopleAntibody": null, "negativeTestsPeopleAntibody": null, "totalTestsPeopleAntigen": null, "positiveTestsPeopleAntigen": null, "totalTestsAntigen": null, "positiveTestsAntigen": null, "fips": "08", "positiveIncrease": 442, "negativeIncrease": 1587, "total": 71059, "totalTestResultsIncrease": 2754, "posNeg": 71059, "deathIncrease": 30, "hospitalizedIncrease": 50, "hash": "33c990e015237bd8e477ee656ef0fbe9e0036084", "commercialScore": 0, "negativeRegularScore": 0, "negativeScore": 0, "positiveScore": 0, "score": 0, "grade": "", "month_number_label": "2020-04", "date_label": "2020-04-29", "week_number_label": "2020W18", "week_start_label": "2020-04-27"}, {"date": 20200430, "state": "CO", "positive": 15284, "probableCases": 1545, "negative": 57106, "pending": null, "totalTestResultsSource": "totalTestEncountersViral", "totalTestResults": 81171, "hospitalizedCurrently": 959, "hospitalizedCumulative": 2697, "inIcuCurrently": null, "inIcuCumulative": null, "onVentilatorCurrently": null, "onVentilatorCumulative": null, "recovered": 2486, "dataQualityGrade": "B", "lastUpdateEt": "4/29/2020 00:00", "dateModified": "2020-04-29T00:00:00Z", "checkTimeEt": "04/28 20:00", "death": 777, "hospitalized": 2697, "dateChecked": "2020-04-29T00:00:00Z", "totalTestsViral": null, "positiveTestsViral": null, "negativeTestsViral": null, "positiveCasesViral": 13637, "deathConfirmed": null, "deathProbable": null, "totalTestEncountersViral": 81171, "totalTestsPeopleViral": 72390, "totalTestsAntibody": null, "positiveTestsAntibody": null, "negativeTestsAntibody": null, "totalTestsPeopleAntibody": null, "positiveTestsPeopleAntibody": null, "negativeTestsPeopleAntibody": null, "totalTestsPeopleAntigen": null, "positiveTestsPeopleAntigen": null, "totalTestsAntigen": null, "positiveTestsAntigen": null, "fips": "08", "positiveIncrease": 526, "negativeIncrease": 805, "total": 72390, "totalTestResultsIncrease": 3312, "posNeg": 72390, "deathIncrease": 11, "hospitalizedIncrease": 76, "hash": "b8eabb899b73dd61a3d7d04de2647c7d88b3245f", "commercialScore": 0, "negativeRegularScore": 0, "negativeScore": 0, "positiveScore": 0, "score": 0, "grade": "", "month_number_label": "2020-04", "date_label": "2020-04-30", "week_number_label": "2020W18", "week_start_label": "2020-04-27"}, {"date": 20200501, "state": "CO", "positive": 15768, "probableCases": 1590, "negative": 61181, "pending": null, "totalTestResultsSource": "totalTestEncountersViral", "totalTestResults": 84507, "hospitalizedCurrently": 931, "hospitalizedCumulative": 2747, "inIcuCurrently": null, "inIcuCumulative": null, "onVentilatorCurrently": null, "onVentilatorCumulative": null, "recovered": 2553, "dataQualityGrade": "B", "lastUpdateEt": "4/30/2020 00:00", "dateModified": "2020-04-30T00:00:00Z", "checkTimeEt": "04/29 20:00", "death": 820, "hospitalized": 2747, "dateChecked": "2020-04-30T00:00:00Z", "totalTestsViral": null, "positiveTestsViral": null, "negativeTestsViral": null, "positiveCasesViral": 14078, "deathConfirmed": null, "deathProbable": null, "totalTestEncountersViral": 84507, "totalTestsPeopleViral": 75259, "totalTestsAntibody": null, "positiveTestsAntibody": null, "negativeTestsAntibody": null, "totalTestsPeopleAntibody": null, "positiveTestsPeopleAntibody": null, "negativeTestsPeopleAntibody": null, "totalTestsPeopleAntigen": null, "positiveTestsPeopleAntigen": null, "totalTestsAntigen": null, "positiveTestsAntigen": null, "fips": "08", "positiveIncrease": 484, "negativeIncrease": 4075, "total": 76949, "totalTestResultsIncrease": 3336, "posNeg": 76949, "deathIncrease": 43, "hospitalizedIncrease": 50, "hash": "33274ee19272913a27daee803d78a01b887dac3e", "commercialScore": 0, "negativeRegularScore": 0, "negativeScore": 0, "positiveScore": 0, "score": 0, "grade": "", "month_number_label": "2020-05", "date_label": "2020-05-01", "week_number_label": "2020W18", "week_start_label": "2020-04-27"}, {"date": 20200502, "state": "CO", "positive": 16225, "probableCases": 1622, "negative": 63681, "pending": null, "totalTestResultsSource": "totalTestEncountersViral", "totalTestResults": 87842, "hospitalizedCurrently": 883, "hospitalizedCumulative": 2793, "inIcuCurrently": null, "inIcuCumulative": null, "onVentilatorCurrently": null, "onVentilatorCumulative": null, "recovered": 2607, "dataQualityGrade": "B", "lastUpdateEt": "5/1/2020 00:00", "dateModified": "2020-05-01T00:00:00Z", "checkTimeEt": "04/30 20:00", "death": 832, "hospitalized": 2793, "dateChecked": "2020-05-01T00:00:00Z", "totalTestsViral": null, "positiveTestsViral": null, "negativeTestsViral": null, "positiveCasesViral": 14498, "deathConfirmed": null, "deathProbable": null, "totalTestEncountersViral": 87842, "totalTestsPeopleViral": 78179, "totalTestsAntibody": null, "positiveTestsAntibody": null, "negativeTestsAntibody": null, "totalTestsPeopleAntibody": null, "positiveTestsPeopleAntibody": null, "negativeTestsPeopleAntibody": null, "totalTestsPeopleAntigen": null, "positiveTestsPeopleAntigen": null, "totalTestsAntigen": null, "positiveTestsAntigen": null, "fips": "08", "positiveIncrease": 457, "negativeIncrease": 2500, "total": 79906, "totalTestResultsIncrease": 3335, "posNeg": 79906, "deathIncrease": 12, "hospitalizedIncrease": 46, "hash": "aa70517299eea3c45b81e5764148b63c7836cccf", "commercialScore": 0, "negativeRegularScore": 0, "negativeScore": 0, "positiveScore": 0, "score": 0, "grade": "", "month_number_label": "2020-05", "date_label": "2020-05-02", "week_number_label": "2020W18", "week_start_label": "2020-04-27"}, {"date": 20200503, "state": "CO", "positive": 16635, "probableCases": 1637, "negative": 66455, "pending": null, "totalTestResultsSource": "totalTestEncountersViral", "totalTestResults": 91424, "hospitalizedCurrently": 883, "hospitalizedCumulative": 2799, "inIcuCurrently": null, "inIcuCumulative": null, "onVentilatorCurrently": null, "onVentilatorCumulative": null, "recovered": 2650, "dataQualityGrade": "B", "lastUpdateEt": "5/3/2020 18:00", "dateModified": "2020-05-03T18:00:00Z", "checkTimeEt": "05/03 14:00", "death": 842, "hospitalized": 2799, "dateChecked": "2020-05-03T18:00:00Z", "totalTestsViral": null, "positiveTestsViral": null, "negativeTestsViral": null, "positiveCasesViral": 14897, "deathConfirmed": null, "deathProbable": null, "totalTestEncountersViral": 91424, "totalTestsPeopleViral": 81352, "totalTestsAntibody": null, "positiveTestsAntibody": null, "negativeTestsAntibody": null, "totalTestsPeopleAntibody": null, "positiveTestsPeopleAntibody": null, "negativeTestsPeopleAntibody": null, "totalTestsPeopleAntigen": null, "positiveTestsPeopleAntigen": null, "totalTestsAntigen": null, "positiveTestsAntigen": null, "fips": "08", "positiveIncrease": 410, "negativeIncrease": 2774, "total": 83090, "totalTestResultsIncrease": 3582, "posNeg": 83090, "deathIncrease": 10, "hospitalizedIncrease": 6, "hash": "91fa21f117f7b59f182037fb224becace6285581", "commercialScore": 0, "negativeRegularScore": 0, "negativeScore": 0, "positiveScore": 0, "score": 0, "grade": "", "month_number_label": "2020-05", "date_label": "2020-05-03", "week_number_label": "2020W18", "week_start_label": "2020-04-27"}, {"date": 20200504, "state": "CO", "positive": 16907, "probableCases": 1709, "negative": 68097, "pending": null, "totalTestResultsSource": "totalTestEncountersViral", "totalTestResults": 93656, "hospitalizedCurrently": 834, "hospitalizedCumulative": 2838, "inIcuCurrently": null, "inIcuCumulative": null, "onVentilatorCurrently": null, "onVentilatorCumulative": null, "recovered": 2743, "dataQualityGrade": "B", "lastUpdateEt": "5/3/2020 00:00", "dateModified": "2020-05-03T00:00:00Z", "checkTimeEt": "05/02 20:00", "death": 851, "hospitalized": 2838, "dateChecked": "2020-05-03T00:00:00Z", "totalTestsViral": null, "positiveTestsViral": null, "negativeTestsViral": null, "positiveCasesViral": 15169, "deathConfirmed": null, "deathProbable": null, "totalTestEncountersViral": 93656, "totalTestsPeopleViral": 83266, "totalTestsAntibody": null, "positiveTestsAntibody": null, "negativeTestsAntibody": null, "totalTestsPeopleAntibody": null, "positiveTestsPeopleAntibody": null, "negativeTestsPeopleAntibody": null, "totalTestsPeopleAntigen": null, "positiveTestsPeopleAntigen": null, "totalTestsAntigen": null, "positiveTestsAntigen": null, "fips": "08", "positiveIncrease": 272, "negativeIncrease": 1642, "total": 85004, "totalTestResultsIncrease": 2232, "posNeg": 85004, "deathIncrease": 9, "hospitalizedIncrease": 39, "hash": "6e7b180cf633201a8d7bee5d8784b1a14b7ec582", "commercialScore": 0, "negativeRegularScore": 0, "negativeScore": 0, "positiveScore": 0, "score": 0, "grade": "", "month_number_label": "2020-05", "date_label": "2020-05-04", "week_number_label": "2020W19", "week_start_label": "2020-05-04"}, {"date": 20200505, "state": "CO", "positive": 17364, "probableCases": 1717, "negative": 68612, "pending": null, "totalTestResultsSource": "totalTestEncountersViral", "totalTestResults": 96666, "hospitalizedCurrently": 792, "hospitalizedCumulative": 2919, "inIcuCurrently": null, "inIcuCumulative": null, "onVentilatorCurrently": null, "onVentilatorCumulative": null, "recovered": 2801, "dataQualityGrade": "B", "lastUpdateEt": "5/5/2020 00:00", "dateModified": "2020-05-05T00:00:00Z", "checkTimeEt": "05/04 20:00", "death": 903, "hospitalized": 2919, "dateChecked": "2020-05-05T00:00:00Z", "totalTestsViral": null, "positiveTestsViral": null, "negativeTestsViral": null, "positiveCasesViral": 15600, "deathConfirmed": null, "deathProbable": null, "totalTestEncountersViral": 96666, "totalTestsPeopleViral": 85976, "totalTestsAntibody": null, "positiveTestsAntibody": null,