[{"date": 20200304, "state": "OR", "positive": 3, "probableCases": null, "negative": 29, "pending": 18, "totalTestResultsSource": "totalTestsViral", "totalTestResults": null, "hospitalizedCurrently": null, "hospitalizedCumulative": null, "inIcuCurrently": null, "inIcuCumulative": null, "onVentilatorCurrently": null, "onVentilatorCumulative": null, "recovered": null, "dataQualityGrade": null, "lastUpdateEt": null, "dateModified": null, "checkTimeEt": null, "death": null, "hospitalized": null, "dateChecked": null, "totalTestsViral": null, "positiveTestsViral": null, "negativeTestsViral": null, "positiveCasesViral": null, "deathConfirmed": null, "deathProbable": null, "totalTestEncountersViral": null, "totalTestsPeopleViral": null, "totalTestsAntibody": null, "positiveTestsAntibody": null, "negativeTestsAntibody": null, "totalTestsPeopleAntibody": null, "positiveTestsPeopleAntibody": null, "negativeTestsPeopleAntibody": null, "totalTestsPeopleAntigen": null, "positiveTestsPeopleAntigen": null, "totalTestsAntigen": null, "positiveTestsAntigen": null, "fips": "41", "positiveIncrease": 0, "negativeIncrease": 0, "total": 50, "totalTestResultsIncrease": 0, "posNeg": 32, "deathIncrease": 0, "hospitalizedIncrease": 0, "hash": "7674f0c66162c0601d9ba88ad7c3e71df3b91aca", "commercialScore": 0, "negativeRegularScore": 0, "negativeScore": 0, "positiveScore": 0, "score": 0, "grade": "", "month_number_label": "2020-03", "date_label": "2020-03-04", "week_number_label": "2020W10", "week_start_label": "2020-03-02"}, {"date": 20200305, "state": "OR", "positive": 3, "probableCases": null, "negative": 45, "pending": 13, "totalTestResultsSource": "totalTestsViral", "totalTestResults": null, "hospitalizedCurrently": null, "hospitalizedCumulative": null, "inIcuCurrently": null, "inIcuCumulative": null, "onVentilatorCurrently": null, "onVentilatorCumulative": null, "recovered": null, "dataQualityGrade": null, "lastUpdateEt": null, "dateModified": null, "checkTimeEt": null, "death": null, "hospitalized": null, "dateChecked": null, "totalTestsViral": null, "positiveTestsViral": null, "negativeTestsViral": null, "positiveCasesViral": null, "deathConfirmed": null, "deathProbable": null, "totalTestEncountersViral": null, "totalTestsPeopleViral": null, "totalTestsAntibody": null, "positiveTestsAntibody": null, "negativeTestsAntibody": null, "totalTestsPeopleAntibody": null, "positiveTestsPeopleAntibody": null, "negativeTestsPeopleAntibody": null, "totalTestsPeopleAntigen": null, "positiveTestsPeopleAntigen": null, "totalTestsAntigen": null, "positiveTestsAntigen": null, "fips": "41", "positiveIncrease": 0, "negativeIncrease": 16, "total": 61, "totalTestResultsIncrease": 0, "posNeg": 48, "deathIncrease": 0, "hospitalizedIncrease": 0, "hash": "08eb38e539ee2d138a0b578f1aa5fb2f574cdff6", "commercialScore": 0, "negativeRegularScore": 0, "negativeScore": 0, "positiveScore": 0, "score": 0, "grade": "", "month_number_label": "2020-03", "date_label": "2020-03-05", "week_number_label": "2020W10", "week_start_label": "2020-03-02"}, {"date": 20200306, "state": "OR", "positive": 3, "probableCases": null, "negative": 64, "pending": 28, "totalTestResultsSource": "totalTestsViral", "totalTestResults": null, "hospitalizedCurrently": null, "hospitalizedCumulative": null, "inIcuCurrently": null, "inIcuCumulative": null, "onVentilatorCurrently": null, "onVentilatorCumulative": null, "recovered": null, "dataQualityGrade": null, "lastUpdateEt": null, "dateModified": null, "checkTimeEt": null, "death": null, "hospitalized": null, "dateChecked": null, "totalTestsViral": null, "positiveTestsViral": null, "negativeTestsViral": null, "positiveCasesViral": null, "deathConfirmed": null, "deathProbable": null, "totalTestEncountersViral": null, "totalTestsPeopleViral": null, "totalTestsAntibody": null, "positiveTestsAntibody": null, "negativeTestsAntibody": null, "totalTestsPeopleAntibody": null, "positiveTestsPeopleAntibody": null, "negativeTestsPeopleAntibody": null, "totalTestsPeopleAntigen": null, "positiveTestsPeopleAntigen": null, "totalTestsAntigen": null, "positiveTestsAntigen": null, "fips": "41", "positiveIncrease": 0, "negativeIncrease": 19, "total": 95, "totalTestResultsIncrease": 0, "posNeg": 67, "deathIncrease": 0, "hospitalizedIncrease": 0, "hash": "6c0c102e54cb76ad886b2fd3d9f198b37680a705", "commercialScore": 0, "negativeRegularScore": 0, "negativeScore": 0, "positiveScore": 0, "score": 0, "grade": "", "month_number_label": "2020-03", "date_label": "2020-03-06", "week_number_label": "2020W10", "week_start_label": "2020-03-02"}, {"date": 20200307, "state": "OR", "positive": 7, "probableCases": null, "negative": 77, "pending": 40, "totalTestResultsSource": "totalTestsViral", "totalTestResults": null, "hospitalizedCurrently": null, "hospitalizedCumulative": null, "inIcuCurrently": null, "inIcuCumulative": null, "onVentilatorCurrently": null, "onVentilatorCumulative": null, "recovered": null, "dataQualityGrade": null, "lastUpdateEt": null, "dateModified": null, "checkTimeEt": null, "death": null, "hospitalized": null, "dateChecked": null, "totalTestsViral": null, "positiveTestsViral": null, "negativeTestsViral": null, "positiveCasesViral": null, "deathConfirmed": null, "deathProbable": null, "totalTestEncountersViral": null, "totalTestsPeopleViral": null, "totalTestsAntibody": null, "positiveTestsAntibody": null, "negativeTestsAntibody": null, "totalTestsPeopleAntibody": null, "positiveTestsPeopleAntibody": null, "negativeTestsPeopleAntibody": null, "totalTestsPeopleAntigen": null, "positiveTestsPeopleAntigen": null, "totalTestsAntigen": null, "positiveTestsAntigen": null, "fips": "41", "positiveIncrease": 4, "negativeIncrease": 13, "total": 124, "totalTestResultsIncrease": 0, "posNeg": 84, "deathIncrease": 0, "hospitalizedIncrease": 0, "hash": "d293cae2859e59f66a7bd4a5a92211ba393bed10", "commercialScore": 0, "negativeRegularScore": 0, "negativeScore": 0, "positiveScore": 0, "score": 0, "grade": "", "month_number_label": "2020-03", "date_label": "2020-03-07", "week_number_label": "2020W10", "week_start_label": "2020-03-02"}, {"date": 20200308, "state": "OR", "positive": 14, "probableCases": null, "negative": 100, "pending": 53, "totalTestResultsSource": "totalTestsViral", "totalTestResults": null, "hospitalizedCurrently": null, "hospitalizedCumulative": null, "inIcuCurrently": null, "inIcuCumulative": null, "onVentilatorCurrently": null, "onVentilatorCumulative": null, "recovered": null, "dataQualityGrade": null, "lastUpdateEt": null, "dateModified": null, "checkTimeEt": null, "death": null, "hospitalized": null, "dateChecked": null, "totalTestsViral": null, "positiveTestsViral": null, "negativeTestsViral": null, "positiveCasesViral": null, "deathConfirmed": null, "deathProbable": null, "totalTestEncountersViral": null, "totalTestsPeopleViral": null, "totalTestsAntibody": null, "positiveTestsAntibody": null, "negativeTestsAntibody": null, "totalTestsPeopleAntibody": null, "positiveTestsPeopleAntibody": null, "negativeTestsPeopleAntibody": null, "totalTestsPeopleAntigen": null, "positiveTestsPeopleAntigen": null, "totalTestsAntigen": null, "positiveTestsAntigen": null, "fips": "41", "positiveIncrease": 7, "negativeIncrease": 23, "total": 167, "totalTestResultsIncrease": 0, "posNeg": 114, "deathIncrease": 0, "hospitalizedIncrease": 0, "hash": "fc8cad68f47c603d27c8660ef8b111bbd191d850", "commercialScore": 0, "negativeRegularScore": 0, "negativeScore": 0, "positiveScore": 0, "score": 0, "grade": "", "month_number_label": "2020-03", "date_label": "2020-03-08", "week_number_label": "2020W10", "week_start_label": "2020-03-02"}, {"date": 20200309, "state": "OR", "positive": 14, "probableCases": null, "negative": 165, "pending": 52, "totalTestResultsSource": "totalTestsViral", "totalTestResults": null, "hospitalizedCurrently": null, "hospitalizedCumulative": null, "inIcuCurrently": null, "inIcuCumulative": null, "onVentilatorCurrently": null, "onVentilatorCumulative": null, "recovered": null, "dataQualityGrade": null, "lastUpdateEt": null, "dateModified": null, "checkTimeEt": null, "death": null, "hospitalized": null, "dateChecked": null, "totalTestsViral": null, "positiveTestsViral": null, "negativeTestsViral": null, "positiveCasesViral": null, "deathConfirmed": null, "deathProbable": null, "totalTestEncountersViral": null, "totalTestsPeopleViral": null, "totalTestsAntibody": null, "positiveTestsAntibody": null, "negativeTestsAntibody": null, "totalTestsPeopleAntibody": null, "positiveTestsPeopleAntibody": null, "negativeTestsPeopleAntibody": null, "totalTestsPeopleAntigen": null, "positiveTestsPeopleAntigen": null, "totalTestsAntigen": null, "positiveTestsAntigen": null, "fips": "41", "positiveIncrease": 0, "negativeIncrease": 65, "total": 231, "totalTestResultsIncrease": 0, "posNeg": 179, "deathIncrease": 0, "hospitalizedIncrease": 0, "hash": "696ef62b34b64cef3919c3876afdbf92d4529d1c", "commercialScore": 0, "negativeRegularScore": 0, "negativeScore": 0, "positiveScore": 0, "score": 0, "grade": "", "month_number_label": "2020-03", "date_label": "2020-03-09", "week_number_label": "2020W11", "week_start_label": "2020-03-09"}, {"date": 20200310, "state": "OR", "positive": 15, "probableCases": null, "negative": 213, "pending": 67, "totalTestResultsSource": "totalTestsViral", "totalTestResults": null, "hospitalizedCurrently": null, "hospitalizedCumulative": null, "inIcuCurrently": null, "inIcuCumulative": null, "onVentilatorCurrently": null, "onVentilatorCumulative": null, "recovered": null, "dataQualityGrade": null, "lastUpdateEt": null, "dateModified": null, "checkTimeEt": null, "death": null, "hospitalized": null, "dateChecked": null, "totalTestsViral": null, "positiveTestsViral": null, "negativeTestsViral": null, "positiveCasesViral": null, "deathConfirmed": null, "deathProbable": null, "totalTestEncountersViral": null, "totalTestsPeopleViral": null, "totalTestsAntibody": null, "positiveTestsAntibody": null, "negativeTestsAntibody": null, "totalTestsPeopleAntibody": null, "positiveTestsPeopleAntibody": null, "negativeTestsPeopleAntibody": null, "totalTestsPeopleAntigen": null, "positiveTestsPeopleAntigen": null, "totalTestsAntigen": null, "positiveTestsAntigen": null, "fips": "41", "positiveIncrease": 1, "negativeIncrease": 48, "total": 295, "totalTestResultsIncrease": 0, "posNeg": 228, "deathIncrease": 0, "hospitalizedIncrease": 0, "hash": "ea7d1a4768fc654a979f9c4578fe9b62c0dcc6a5", "commercialScore": 0, "negativeRegularScore": 0, "negativeScore": 0, "positiveScore": 0, "score": 0, "grade": "", "month_number_label": "2020-03", "date_label": "2020-03-10", "week_number_label": "2020W11", "week_start_label": "2020-03-09"}, {"date": 20200311, "state": "OR", "positive": 19, "probableCases": null, "negative": 286, "pending": 62, "totalTestResultsSource": "totalTestsViral", "totalTestResults": null, "hospitalizedCurrently": null, "hospitalizedCumulative": null, "inIcuCurrently": null, "inIcuCumulative": null, "onVentilatorCurrently": null, "onVentilatorCumulative": null, "recovered": null, "dataQualityGrade": null, "lastUpdateEt": null, "dateModified": null, "checkTimeEt": null, "death": null, "hospitalized": null, "dateChecked": null, "totalTestsViral": null, "positiveTestsViral": null, "negativeTestsViral": null, "positiveCasesViral": null, "deathConfirmed": null, "deathProbable": null, "totalTestEncountersViral": null, "totalTestsPeopleViral": null, "totalTestsAntibody": null, "positiveTestsAntibody": null, "negativeTestsAntibody": null, "totalTestsPeopleAntibody": null, "positiveTestsPeopleAntibody": null, "negativeTestsPeopleAntibody": null, "totalTestsPeopleAntigen": null, "positiveTestsPeopleAntigen": null, "totalTestsAntigen": null, "positiveTestsAntigen": null, "fips": "41", "positiveIncrease": 4, "negativeIncrease": 73, "total": 367, "totalTestResultsIncrease": 0, "posNeg": 305, "deathIncrease": 0, "hospitalizedIncrease": 0, "hash": "4a6eb61432ebc981a65f5659f6669cde59e096cb", "commercialScore": 0, "negativeRegularScore": 0, "negativeScore": 0, "positiveScore": 0, "score": 0, "grade": "", "month_number_label": "2020-03", "date_label": "2020-03-11", "week_number_label": "2020W11", "week_start_label": "2020-03-09"}, {"date": 20200312, "state": "OR", "positive": 19, "probableCases": null, "negative": 286, "pending": 62, "totalTestResultsSource": "totalTestsViral", "totalTestResults": null, "hospitalizedCurrently": null, "hospitalizedCumulative": null, "inIcuCurrently": null, "inIcuCumulative": null, "onVentilatorCurrently": null, "onVentilatorCumulative": null, "recovered": null, "dataQualityGrade": null, "lastUpdateEt": "3/11/2020 13:00", "dateModified": "2020-03-11T13:00:00Z", "checkTimeEt": "03/11 09:00", "death": null, "hospitalized": null, "dateChecked": "2020-03-11T13:00:00Z", "totalTestsViral": null, "positiveTestsViral": null, "negativeTestsViral": null, "positiveCasesViral": null, "deathConfirmed": null, "deathProbable": null, "totalTestEncountersViral": null, "totalTestsPeopleViral": null, "totalTestsAntibody": null, "positiveTestsAntibody": null, "negativeTestsAntibody": null, "totalTestsPeopleAntibody": null, "positiveTestsPeopleAntibody": null, "negativeTestsPeopleAntibody": null, "totalTestsPeopleAntigen": null, "positiveTestsPeopleAntigen": null, "totalTestsAntigen": null, "positiveTestsAntigen": null, "fips": "41", "positiveIncrease": 0, "negativeIncrease": 0, "total": 367, "totalTestResultsIncrease": 0, "posNeg": 305, "deathIncrease": 0, "hospitalizedIncrease": 0, "hash": "46ec88b50500618301b15c370b4c47fceec62e1d", "commercialScore": 0, "negativeRegularScore": 0, "negativeScore": 0, "positiveScore": 0, "score": 0, "grade": "", "month_number_label": "2020-03", "date_label": "2020-03-12", "week_number_label": "2020W11", "week_start_label": "2020-03-09"}, {"date": 20200313, "state": "OR", "positive": 30, "probableCases": null, "negative": 337, "pending": 157, "totalTestResultsSource": "totalTestsViral", "totalTestResults": null, "hospitalizedCurrently": null, "hospitalizedCumulative": null, "inIcuCurrently": null, "inIcuCumulative": null, "onVentilatorCurrently": null, "onVentilatorCumulative": null, "recovered": null, "dataQualityGrade": null, "lastUpdateEt": "3/13/2020 13:00", "dateModified": "2020-03-13T13:00:00Z", "checkTimeEt": "03/13 09:00", "death": null, "hospitalized": null, "dateChecked": "2020-03-13T13:00:00Z", "totalTestsViral": null, "positiveTestsViral": null, "negativeTestsViral": null, "positiveCasesViral": null, "deathConfirmed": null, "deathProbable": null, "totalTestEncountersViral": null, "totalTestsPeopleViral": null, "totalTestsAntibody": null, "positiveTestsAntibody": null, "negativeTestsAntibody": null, "totalTestsPeopleAntibody": null, "positiveTestsPeopleAntibody": null, "negativeTestsPeopleAntibody": null, "totalTestsPeopleAntigen": null, "positiveTestsPeopleAntigen": null, "totalTestsAntigen": null, "positiveTestsAntigen": null, "fips": "41", "positiveIncrease": 11, "negativeIncrease": 51, "total": 524, "totalTestResultsIncrease": 0, "posNeg": 367, "deathIncrease": 0, "hospitalizedIncrease": 0, "hash": "aeb73a275066cda7cc86a54938a672dbf0cb61a8", "commercialScore": 0, "negativeRegularScore": 0, "negativeScore": 0, "positiveScore": 0, "score": 0, "grade": "", "month_number_label": "2020-03", "date_label": "2020-03-13", "week_number_label": "2020W11", "week_start_label": "2020-03-09"}, {"date": 20200314, "state": "OR", "positive": 30, "probableCases": null, "negative": 337, "pending": 157, "totalTestResultsSource": "totalTestsViral", "totalTestResults": null, "hospitalizedCurrently": null, "hospitalizedCumulative": null, "inIcuCurrently": null, "inIcuCumulative": null, "onVentilatorCurrently": null, "onVentilatorCumulative": null, "recovered": null, "dataQualityGrade": null, "lastUpdateEt": "3/13/2020 13:00", "dateModified": "2020-03-13T13:00:00Z", "checkTimeEt": "03/13 09:00", "death": null, "hospitalized": null, "dateChecked": "2020-03-13T13:00:00Z", "totalTestsViral": null, "positiveTestsViral": null, "negativeTestsViral": null, "positiveCasesViral": null, "deathConfirmed": null, "deathProbable": null, "totalTestEncountersViral": null, "totalTestsPeopleViral": null, "totalTestsAntibody": null, "positiveTestsAntibody": null, "negativeTestsAntibody": null, "totalTestsPeopleAntibody": null, "positiveTestsPeopleAntibody": null, "negativeTestsPeopleAntibody": null, "totalTestsPeopleAntigen": null, "positiveTestsPeopleAntigen": null, "totalTestsAntigen": null, "positiveTestsAntigen": null, "fips": "41", "positiveIncrease": 0, "negativeIncrease": 0, "total": 524, "totalTestResultsIncrease": 0, "posNeg": 367, "deathIncrease": 0, "hospitalizedIncrease": 0, "hash": "b8f3712d8d9b2e6929adbc1b6fc18def76de6f89", "commercialScore": 0, "negativeRegularScore": 0, "negativeScore": 0, "positiveScore": 0, "score": 0, "grade": "", "month_number_label": "2020-03", "date_label": "2020-03-14", "week_number_label": "2020W11", "week_start_label": "2020-03-09"}, {"date": 20200315, "state": "OR", "positive": 36, "probableCases": null, "negative": 420, "pending": 225, "totalTestResultsSource": "totalTestsViral", "totalTestResults": null, "hospitalizedCurrently": null, "hospitalizedCumulative": null, "inIcuCurrently": null, "inIcuCumulative": null, "onVentilatorCurrently": null, "onVentilatorCumulative": null, "recovered": null, "dataQualityGrade": null, "lastUpdateEt": "3/14/2020 14:00", "dateModified": "2020-03-14T14:00:00Z", "checkTimeEt": "03/14 10:00", "death": null, "hospitalized": null, "dateChecked": "2020-03-14T14:00:00Z", "totalTestsViral": null, "positiveTestsViral": null, "negativeTestsViral": null, "positiveCasesViral": null, "deathConfirmed": null, "deathProbable": null, "totalTestEncountersViral": null, "totalTestsPeopleViral": null, "totalTestsAntibody": null, "positiveTestsAntibody": null, "negativeTestsAntibody": null, "totalTestsPeopleAntibody": null, "positiveTestsPeopleAntibody": null, "negativeTestsPeopleAntibody": null, "totalTestsPeopleAntigen": null, "positiveTestsPeopleAntigen": null, "totalTestsAntigen": null, "positiveTestsAntigen": null, "fips": "41", "positiveIncrease": 6, "negativeIncrease": 83, "total": 681, "totalTestResultsIncrease": 0, "posNeg": 456, "deathIncrease": 0, "hospitalizedIncrease": 0, "hash": "699e1f83f110f418f574586efa49abc26791b9c8", "commercialScore": 0, "negativeRegularScore": 0, "negativeScore": 0, "positiveScore": 0, "score": 0, "grade": "", "month_number_label": "2020-03", "date_label": "2020-03-15", "week_number_label": "2020W11", "week_start_label": "2020-03-09"}, {"date": 20200316, "state": "OR", "positive": 39, "probableCases": null, "negative": 579, "pending": 182, "totalTestResultsSource": "totalTestsViral", "totalTestResults": null, "hospitalizedCurrently": null, "hospitalizedCumulative": null, "inIcuCurrently": null, "inIcuCumulative": null, "onVentilatorCurrently": null, "onVentilatorCumulative": null, "recovered": null, "dataQualityGrade": null, "lastUpdateEt": "3/16/2020 15:38", "dateModified": "2020-03-16T15:38:00Z", "checkTimeEt": "03/16 11:38", "death": null, "hospitalized": null, "dateChecked": "2020-03-16T15:38:00Z", "totalTestsViral": null, "positiveTestsViral": null, "negativeTestsViral": null, "positiveCasesViral": null, "deathConfirmed": null, "deathProbable": null, "totalTestEncountersViral": null, "totalTestsPeopleViral": null, "totalTestsAntibody": null, "positiveTestsAntibody": null, "negativeTestsAntibody": null, "totalTestsPeopleAntibody": null, "positiveTestsPeopleAntibody": null, "negativeTestsPeopleAntibody": null, "totalTestsPeopleAntigen": null, "positiveTestsPeopleAntigen": null, "totalTestsAntigen": null, "positiveTestsAntigen": null, "fips": "41", "positiveIncrease": 3, "negativeIncrease": 159, "total": 800, "totalTestResultsIncrease": 0, "posNeg": 618, "deathIncrease": 0, "hospitalizedIncrease": 0, "hash": "5ae2f194cd524753956f0c81c9d37f9cc226bdda", "commercialScore": 0, "negativeRegularScore": 0, "negativeScore": 0, "positiveScore": 0, "score": 0, "grade": "", "month_number_label": "2020-03", "date_label": "2020-03-16", "week_number_label": "2020W12", "week_start_label": "2020-03-16"}, {"date": 20200317, "state": "OR", "positive": 47, "probableCases": null, "negative": 689, "pending": 184, "totalTestResultsSource": "totalTestsViral", "totalTestResults": null, "hospitalizedCurrently": null, "hospitalizedCumulative": null, "inIcuCurrently": null, "inIcuCumulative": null, "onVentilatorCurrently": null, "onVentilatorCumulative": null, "recovered": null, "dataQualityGrade": null, "lastUpdateEt": "3/16/2020 13:51", "dateModified": "2020-03-16T13:51:00Z", "checkTimeEt": "03/16 09:51", "death": null, "hospitalized": null, "dateChecked": "2020-03-16T13:51:00Z", "totalTestsViral": null, "positiveTestsViral": null, "negativeTestsViral": null, "positiveCasesViral": null, "deathConfirmed": null, "deathProbable": null, "totalTestEncountersViral": null, "totalTestsPeopleViral": null, "totalTestsAntibody": null, "positiveTestsAntibody": null, "negativeTestsAntibody": null, "totalTestsPeopleAntibody": null, "positiveTestsPeopleAntibody": null, "negativeTestsPeopleAntibody": null, "totalTestsPeopleAntigen": null, "positiveTestsPeopleAntigen": null, "totalTestsAntigen": null, "positiveTestsAntigen": null, "fips": "41", "positiveIncrease": 8, "negativeIncrease": 110, "total": 920, "totalTestResultsIncrease": 0, "posNeg": 736, "deathIncrease": 0, "hospitalizedIncrease": 0, "hash": "183d7083128572e216d9549f19b7fdd37cd3165c", "commercialScore": 0, "negativeRegularScore": 0, "negativeScore": 0, "positiveScore": 0, "score": 0, "grade": "", "month_number_label": "2020-03", "date_label": "2020-03-17", "week_number_label": "2020W12", "week_start_label": "2020-03-16"}, {"date": 20200318, "state": "OR", "positive": 75, "probableCases": null, "negative": 1118, "pending": 361, "totalTestResultsSource": "totalTestsViral", "totalTestResults": null, "hospitalizedCurrently": null, "hospitalizedCumulative": null, "inIcuCurrently": null, "inIcuCumulative": null, "onVentilatorCurrently": null, "onVentilatorCumulative": null, "recovered": null, "dataQualityGrade": null, "lastUpdateEt": "3/17/2020 12:00", "dateModified": "2020-03-17T12:00:00Z", "checkTimeEt": "03/17 08:00", "death": 3, "hospitalized": null, "dateChecked": "2020-03-17T12:00:00Z", "totalTestsViral": null, "positiveTestsViral": null, "negativeTestsViral": null, "positiveCasesViral": null, "deathConfirmed": null, "deathProbable": null, "totalTestEncountersViral": null, "totalTestsPeopleViral": null, "totalTestsAntibody": null, "positiveTestsAntibody": null, "negativeTestsAntibody": null, "totalTestsPeopleAntibody": null, "positiveTestsPeopleAntibody": null, "negativeTestsPeopleAntibody": null, "totalTestsPeopleAntigen": null, "positiveTestsPeopleAntigen": null, "totalTestsAntigen": null, "positiveTestsAntigen": null, "fips": "41", "positiveIncrease": 28, "negativeIncrease": 429, "total": 1554, "totalTestResultsIncrease": 0, "posNeg": 1193, "deathIncrease": 3, "hospitalizedIncrease": 0, "hash": "c2796378c2ec7ed69849ae97059d25c8128893ea", "commercialScore": 0, "negativeRegularScore": 0, "negativeScore": 0, "positiveScore": 0, "score": 0, "grade": "", "month_number_label": "2020-03", "date_label": "2020-03-18", "week_number_label": "2020W12", "week_start_label": "2020-03-16"}, {"date": 20200319, "state": "OR", "positive": 88, "probableCases": null, "negative": 1329, "pending": 437, "totalTestResultsSource": "totalTestsViral", "totalTestResults": null, "hospitalizedCurrently": null, "hospitalizedCumulative": null, "inIcuCurrently": null, "inIcuCumulative": null, "onVentilatorCurrently": null, "onVentilatorCumulative": null, "recovered": null, "dataQualityGrade": null, "lastUpdateEt": "3/19/2020 11:00", "dateModified": "2020-03-19T11:00:00Z", "checkTimeEt": "03/19 07:00", "death": 3, "hospitalized": null, "dateChecked": "2020-03-19T11:00:00Z", "totalTestsViral": null, "positiveTestsViral": null, "negativeTestsViral": null, "positiveCasesViral": null, "deathConfirmed": null, "deathProbable": null, "totalTestEncountersViral": null, "totalTestsPeopleViral": null, "totalTestsAntibody": null, "positiveTestsAntibody": null, "negativeTestsAntibody": null, "totalTestsPeopleAntibody": null, "positiveTestsPeopleAntibody": null, "negativeTestsPeopleAntibody": null, "totalTestsPeopleAntigen": null, "positiveTestsPeopleAntigen": null, "totalTestsAntigen": null, "positiveTestsAntigen": null, "fips": "41", "positiveIncrease": 13, "negativeIncrease": 211, "total": 1854, "totalTestResultsIncrease": 0, "posNeg": 1417, "deathIncrease": 0, "hospitalizedIncrease": 0, "hash": "8d11f1dda2ae5213082a9d31df5fac1e0745a477", "commercialScore": 0, "negativeRegularScore": 0, "negativeScore": 0, "positiveScore": 0, "score": 0, "grade": "", "month_number_label": "2020-03", "date_label": "2020-03-19", "week_number_label": "2020W12", "week_start_label": "2020-03-16"}, {"date": 20200320, "state": "OR", "positive": 114, "probableCases": null, "negative": 2003, "pending": 433, "totalTestResultsSource": "totalTestsViral", "totalTestResults": null, "hospitalizedCurrently": null, "hospitalizedCumulative": null, "inIcuCurrently": null, "inIcuCumulative": null, "onVentilatorCurrently": null, "onVentilatorCumulative": null, "recovered": null, "dataQualityGrade": null, "lastUpdateEt": "3/20/2020 11:00", "dateModified": "2020-03-20T11:00:00Z", "checkTimeEt": "03/20 07:00", "death": 3, "hospitalized": null, "dateChecked": "2020-03-20T11:00:00Z", "totalTestsViral": null, "positiveTestsViral": null, "negativeTestsViral": null, "positiveCasesViral": null, "deathConfirmed": null, "deathProbable": null, "totalTestEncountersViral": null, "totalTestsPeopleViral": null, "totalTestsAntibody": null, "positiveTestsAntibody": null, "negativeTestsAntibody": null, "totalTestsPeopleAntibody": null, "positiveTestsPeopleAntibody": null, "negativeTestsPeopleAntibody": null, "totalTestsPeopleAntigen": null, "positiveTestsPeopleAntigen": null, "totalTestsAntigen": null, "positiveTestsAntigen": null, "fips": "41", "positiveIncrease": 26, "negativeIncrease": 674, "total": 2550, "totalTestResultsIncrease": 0, "posNeg": 2117, "deathIncrease": 0, "hospitalizedIncrease": 0, "hash": "1c60c092261f2ed6118355737cfaa127531a559e", "commercialScore": 0, "negativeRegularScore": 0, "negativeScore": 0, "positiveScore": 0, "score": 0, "grade": "", "month_number_label": "2020-03", "date_label": "2020-03-20", "week_number_label": "2020W12", "week_start_label": "2020-03-16"}, {"date": 20200321, "state": "OR", "positive": 114, "probableCases": null, "negative": 2003, "pending": 433, "totalTestResultsSource": "totalTestsViral", "totalTestResults": null, "hospitalizedCurrently": null, "hospitalizedCumulative": null, "inIcuCurrently": null, "inIcuCumulative": null, "onVentilatorCurrently": null, "onVentilatorCumulative": null, "recovered": null, "dataQualityGrade": null, "lastUpdateEt": "3/20/2020 11:00", "dateModified": "2020-03-20T11:00:00Z", "checkTimeEt": "03/20 07:00", "death": 3, "hospitalized": null, "dateChecked": "2020-03-20T11:00:00Z", "totalTestsViral": null, "positiveTestsViral": null, "negativeTestsViral": null, "positiveCasesViral": null, "deathConfirmed": null, "deathProbable": null, "totalTestEncountersViral": null, "totalTestsPeopleViral": null, "totalTestsAntibody": null, "positiveTestsAntibody": null, "negativeTestsAntibody": null, "totalTestsPeopleAntibody": null, "positiveTestsPeopleAntibody": null, "negativeTestsPeopleAntibody": null, "totalTestsPeopleAntigen": null, "positiveTestsPeopleAntigen": null, "totalTestsAntigen": null, "positiveTestsAntigen": null, "fips": "41", "positiveIncrease": 0, "negativeIncrease": 0, "total": 2550, "totalTestResultsIncrease": 0, "posNeg": 2117, "deathIncrease": 0, "hospitalizedIncrease": 0, "hash": "3a1d697af4308e6f8f6d8a869e0c45126d17b478", "commercialScore": 0, "negativeRegularScore": 0, "negativeScore": 0, "positiveScore": 0, "score": 0, "grade": "", "month_number_label": "2020-03", "date_label": "2020-03-21", "week_number_label": "2020W12", "week_start_label": "2020-03-16"}, {"date": 20200322, "state": "OR", "positive": 161, "probableCases": null, "negative": 2864, "pending": null, "totalTestResultsSource": "totalTestsViral", "totalTestResults": null, "hospitalizedCurrently": null, "hospitalizedCumulative": 43, "inIcuCurrently": null, "inIcuCumulative": null, "onVentilatorCurrently": null, "onVentilatorCumulative": null, "recovered": null, "dataQualityGrade": null, "lastUpdateEt": "3/22/2020 11:00", "dateModified": "2020-03-22T11:00:00Z", "checkTimeEt": "03/22 07:00", "death": 4, "hospitalized": 43, "dateChecked": "2020-03-22T11:00:00Z", "totalTestsViral": null, "positiveTestsViral": null, "negativeTestsViral": null, "positiveCasesViral": null, "deathConfirmed": null, "deathProbable": null, "totalTestEncountersViral": null, "totalTestsPeopleViral": null, "totalTestsAntibody": null, "positiveTestsAntibody": null, "negativeTestsAntibody": null, "totalTestsPeopleAntibody": null, "positiveTestsPeopleAntibody": null, "negativeTestsPeopleAntibody": null, "totalTestsPeopleAntigen": null, "positiveTestsPeopleAntigen": null, "totalTestsAntigen": null, "positiveTestsAntigen": null, "fips": "41", "positiveIncrease": 47, "negativeIncrease": 861, "total": 3025, "totalTestResultsIncrease": 0, "posNeg": 3025, "deathIncrease": 1, "hospitalizedIncrease": 43, "hash": "125bce2dd37b051f857706ecd6f5abb99a9ebe27", "commercialScore": 0, "negativeRegularScore": 0, "negativeScore": 0, "positiveScore": 0, "score": 0, "grade": "", "month_number_label": "2020-03", "date_label": "2020-03-22", "week_number_label": "2020W12", "week_start_label": "2020-03-16"}, {"date": 20200323, "state": "OR", "positive": 191, "probableCases": null, "negative": 3649, "pending": null, "totalTestResultsSource": "totalTestsViral", "totalTestResults": null, "hospitalizedCurrently": null, "hospitalizedCumulative": 56, "inIcuCurrently": null, "inIcuCumulative": null, "onVentilatorCurrently": null, "onVentilatorCumulative": null, "recovered": null, "dataQualityGrade": "A", "lastUpdateEt": "3/23/2020 11:00", "dateModified": "2020-03-23T11:00:00Z", "checkTimeEt": "03/23 07:00", "death": 5, "hospitalized": 56, "dateChecked": "2020-03-23T11:00:00Z", "totalTestsViral": null, "positiveTestsViral": null, "negativeTestsViral": null, "positiveCasesViral": null, "deathConfirmed": null, "deathProbable": null, "totalTestEncountersViral": null, "totalTestsPeopleViral": null, "totalTestsAntibody": null, "positiveTestsAntibody": null, "negativeTestsAntibody": null, "totalTestsPeopleAntibody": null, "positiveTestsPeopleAntibody": null, "negativeTestsPeopleAntibody": null, "totalTestsPeopleAntigen": null, "positiveTestsPeopleAntigen": null, "totalTestsAntigen": null, "positiveTestsAntigen": null, "fips": "41", "positiveIncrease": 30, "negativeIncrease": 785, "total": 3840, "totalTestResultsIncrease": 0, "posNeg": 3840, "deathIncrease": 1, "hospitalizedIncrease": 13, "hash": "593b38b1fad7089b37be71a80a44a6aed32fab35", "commercialScore": 0, "negativeRegularScore": 0, "negativeScore": 0, "positiveScore": 0, "score": 0, "grade": "", "month_number_label": "2020-03", "date_label": "2020-03-23", "week_number_label": "2020W13", "week_start_label": "2020-03-23"}, {"date": 20200324, "state": "OR", "positive": 209, "probableCases": null, "negative": 4350, "pending": null, "totalTestResultsSource": "totalTestsViral", "totalTestResults": null, "hospitalizedCurrently": null, "hospitalizedCumulative": 61, "inIcuCurrently": null, "inIcuCumulative": null, "onVentilatorCurrently": null, "onVentilatorCumulative": null, "recovered": null, "dataQualityGrade": "A", "lastUpdateEt": "3/24/2020 11:00", "dateModified": "2020-03-24T11:00:00Z", "checkTimeEt": "03/24 07:00", "death": 8, "hospitalized": 61, "dateChecked": "2020-03-24T11:00:00Z", "totalTestsViral": null, "positiveTestsViral": null, "negativeTestsViral": null, "positiveCasesViral": null, "deathConfirmed": null, "deathProbable": null, "totalTestEncountersViral": null, "totalTestsPeopleViral": null, "totalTestsAntibody": null, "positiveTestsAntibody": null, "negativeTestsAntibody": null, "totalTestsPeopleAntibody": null, "positiveTestsPeopleAntibody": null, "negativeTestsPeopleAntibody": null, "totalTestsPeopleAntigen": null, "positiveTestsPeopleAntigen": null, "totalTestsAntigen": null, "positiveTestsAntigen": null, "fips": "41", "positiveIncrease": 18, "negativeIncrease": 701, "total": 4559, "totalTestResultsIncrease": 0, "posNeg": 4559, "deathIncrease": 3, "hospitalizedIncrease": 5, "hash": "326f15a84e433d15ffb0cc1c24bae5d688b41332", "commercialScore": 0, "negativeRegularScore": 0, "negativeScore": 0, "positiveScore": 0, "score": 0, "grade": "", "month_number_label": "2020-03", "date_label": "2020-03-24", "week_number_label": "2020W13", "week_start_label": "2020-03-23"}, {"date": 20200325, "state": "OR", "positive": 209, "probableCases": null, "negative": 4350, "pending": null, "totalTestResultsSource": "totalTestsViral", "totalTestResults": null, "hospitalizedCurrently": null, "hospitalizedCumulative": 61, "inIcuCurrently": null, "inIcuCumulative": null, "onVentilatorCurrently": null, "onVentilatorCumulative": null, "recovered": null, "dataQualityGrade": "A", "lastUpdateEt": "3/24/2020 11:00", "dateModified": "2020-03-24T11:00:00Z", "checkTimeEt": "03/24 07:00", "death": 8, "hospitalized": 61, "dateChecked": "2020-03-24T11:00:00Z", "totalTestsViral": null, "positiveTestsViral": null, "negativeTestsViral": null, "positiveCasesViral": null, "deathConfirmed": null, "deathProbable": null, "totalTestEncountersViral": null, "totalTestsPeopleViral": null, "totalTestsAntibody": null, "positiveTestsAntibody": null, "negativeTestsAntibody": null, "totalTestsPeopleAntibody": null, "positiveTestsPeopleAntibody": null, "negativeTestsPeopleAntibody": null, "totalTestsPeopleAntigen": null, "positiveTestsPeopleAntigen": null, "totalTestsAntigen": null, "positiveTestsAntigen": null, "fips": "41", "positiveIncrease": 0, "negativeIncrease": 0, "total": 4559, "totalTestResultsIncrease": 0, "posNeg": 4559, "deathIncrease": 0, "hospitalizedIncrease": 0, "hash": "0ca63e387198daa756754ab9a5f877c83fda91c1", "commercialScore": 0, "negativeRegularScore": 0, "negativeScore": 0, "positiveScore": 0, "score": 0, "grade": "", "month_number_label": "2020-03", "date_label": "2020-03-25", "week_number_label": "2020W13", "week_start_label": "2020-03-23"}, {"date": 20200326, "state": "OR", "positive": 327, "probableCases": null, "negative": 6953, "pending": null, "totalTestResultsSource": "totalTestsViral", "totalTestResults": null, "hospitalizedCurrently": null, "hospitalizedCumulative": 90, "inIcuCurrently": null, "inIcuCumulative": null, "onVentilatorCurrently": null, "onVentilatorCumulative": null, "recovered": null, "dataQualityGrade": "A", "lastUpdateEt": "3/26/2020 16:31", "dateModified": "2020-03-26T16:31:00Z", "checkTimeEt": "03/26 12:31", "death": 11, "hospitalized": 90, "dateChecked": "2020-03-26T16:31:00Z", "totalTestsViral": null, "positiveTestsViral": null, "negativeTestsViral": null, "positiveCasesViral": null, "deathConfirmed": null, "deathProbable": null, "totalTestEncountersViral": null, "totalTestsPeopleViral": null, "totalTestsAntibody": null, "positiveTestsAntibody": null, "negativeTestsAntibody": null, "totalTestsPeopleAntibody": null, "positiveTestsPeopleAntibody": null, "negativeTestsPeopleAntibody": null, "totalTestsPeopleAntigen": null, "positiveTestsPeopleAntigen": null, "totalTestsAntigen": null, "positiveTestsAntigen": null, "fips": "41", "positiveIncrease": 118, "negativeIncrease": 2603, "total": 7280, "totalTestResultsIncrease": 0, "posNeg": 7280, "deathIncrease": 3, "hospitalizedIncrease": 29, "hash": "7d1cc072a96c85245c70f18f00ab922edc6a09c9", "commercialScore": 0, "negativeRegularScore": 0, "negativeScore": 0, "positiveScore": 0, "score": 0, "grade": "", "month_number_label": "2020-03", "date_label": "2020-03-26", "week_number_label": "2020W13", "week_start_label": "2020-03-23"}, {"date": 20200327, "state": "OR", "positive": 414, "probableCases": null, "negative": 8510, "pending": null, "totalTestResultsSource": "totalTestsViral", "totalTestResults": null, "hospitalizedCurrently": 91, "hospitalizedCumulative": 102, "inIcuCurrently": null, "inIcuCumulative": null, "onVentilatorCurrently": 31, "onVentilatorCumulative": null, "recovered": null, "dataQualityGrade": "A", "lastUpdateEt": "3/27/2020 12:30", "dateModified": "2020-03-27T12:30:00Z", "checkTimeEt": "03/27 08:30", "death": 12, "hospitalized": 102, "dateChecked": "2020-03-27T12:30:00Z", "totalTestsViral": null, "positiveTestsViral": null, "negativeTestsViral": null, "positiveCasesViral": null, "deathConfirmed": null, "deathProbable": null, "totalTestEncountersViral": null, "totalTestsPeopleViral": null, "totalTestsAntibody": null, "positiveTestsAntibody": null, "negativeTestsAntibody": null, "totalTestsPeopleAntibody": null, "positiveTestsPeopleAntibody": null, "negativeTestsPeopleAntibody": null, "totalTestsPeopleAntigen": null, "positiveTestsPeopleAntigen": null, "totalTestsAntigen": null, "positiveTestsAntigen": null, "fips": "41", "positiveIncrease": 87, "negativeIncrease": 1557, "total": 8924, "totalTestResultsIncrease": 0, "posNeg": 8924, "deathIncrease": 1, "hospitalizedIncrease": 12, "hash": "07d8bd065d35b106fc5fe4312e9ebf633e5a41fd", "commercialScore": 0, "negativeRegularScore": 0, "negativeScore": 0, "positiveScore": 0, "score": 0, "grade": "", "month_number_label": "2020-03", "date_label": "2020-03-27", "week_number_label": "2020W13", "week_start_label": "2020-03-23"}, {"date": 20200328, "state": "OR", "positive": 479, "probableCases": null, "negative": 9693, "pending": null, "totalTestResultsSource": "totalTestsViral", "totalTestResults": null, "hospitalizedCurrently": 107, "hospitalizedCumulative": 117, "inIcuCurrently": null, "inIcuCumulative": null, "onVentilatorCurrently": 31, "onVentilatorCumulative": null, "recovered": null, "dataQualityGrade": "A", "lastUpdateEt": "3/27/2020 12:30", "dateModified": "2020-03-27T12:30:00Z", "checkTimeEt": "03/27 08:30", "death": 13, "hospitalized": 117, "dateChecked": "2020-03-27T12:30:00Z", "totalTestsViral": null, "positiveTestsViral": null, "negativeTestsViral": null, "positiveCasesViral": null, "deathConfirmed": null, "deathProbable": null, "totalTestEncountersViral": null, "totalTestsPeopleViral": null, "totalTestsAntibody": null, "positiveTestsAntibody": null, "negativeTestsAntibody": null, "totalTestsPeopleAntibody": null, "positiveTestsPeopleAntibody": null, "negativeTestsPeopleAntibody": null, "totalTestsPeopleAntigen": null, "positiveTestsPeopleAntigen": null, "totalTestsAntigen": null, "positiveTestsAntigen": null, "fips": "41", "positiveIncrease": 65, "negativeIncrease": 1183, "total": 10172, "totalTestResultsIncrease": 0, "posNeg": 10172, "deathIncrease": 1, "hospitalizedIncrease": 15, "hash": "9696fd0c7422b3a0ccccbc8e8a78dfe81a1b89e3", "commercialScore": 0, "negativeRegularScore": 0, "negativeScore": 0, "positiveScore": 0, "score": 0, "grade": "", "month_number_label": "2020-03", "date_label": "2020-03-28", "week_number_label": "2020W13", "week_start_label": "2020-03-23"}, {"date": 20200329, "state": "OR", "positive": 548, "probableCases": null, "negative": 10878, "pending": null, "totalTestResultsSource": "totalTestsViral", "totalTestResults": 1336, "hospitalizedCurrently": 107, "hospitalizedCumulative": 129, "inIcuCurrently": null, "inIcuCumulative": null, "onVentilatorCurrently": 37, "onVentilatorCumulative": null, "recovered": null, "dataQualityGrade": "A", "lastUpdateEt": "3/29/2020 11:00", "dateModified": "2020-03-29T11:00:00Z", "checkTimeEt": "03/29 07:00", "death": 13, "hospitalized": 129, "dateChecked": "2020-03-29T11:00:00Z", "totalTestsViral": 1336, "positiveTestsViral": 1305, "negativeTestsViral": 31, "positiveCasesViral": null, "deathConfirmed": null, "deathProbable": null, "totalTestEncountersViral": null, "totalTestsPeopleViral": null, "totalTestsAntibody": null, "positiveTestsAntibody": null, "negativeTestsAntibody": null, "totalTestsPeopleAntibody": null, "positiveTestsPeopleAntibody": null, "negativeTestsPeopleAntibody": null, "totalTestsPeopleAntigen": null, "positiveTestsPeopleAntigen": null, "totalTestsAntigen": null, "positiveTestsAntigen": null, "fips": "41", "positiveIncrease": 69, "negativeIncrease": 1185, "total": 11426, "totalTestResultsIncrease": 1336, "posNeg": 11426, "deathIncrease": 0, "hospitalizedIncrease": 12, "hash": "a61b01d7bbb21b793f7484bb70989740a731f2ce", "commercialScore": 0, "negativeRegularScore": 0, "negativeScore": 0, "positiveScore": 0, "score": 0, "grade": "", "month_number_label": "2020-03", "date_label": "2020-03-29", "week_number_label": "2020W13", "week_start_label": "2020-03-23"}, {"date": 20200330, "state": "OR", "positive": 606, "probableCases": null, "negative": 12277, "pending": null, "totalTestResultsSource": "totalTestsViral", "totalTestResults": 2542, "hospitalizedCurrently": 132, "hospitalizedCumulative": 140, "inIcuCurrently": null, "inIcuCumulative": null, "onVentilatorCurrently": 39, "onVentilatorCumulative": null, "recovered": null, "dataQualityGrade": "A", "lastUpdateEt": "3/30/2020 11:00", "dateModified": "2020-03-30T11:00:00Z", "checkTimeEt": "03/30 07:00", "death": 16, "hospitalized": 140, "dateChecked": "2020-03-30T11:00:00Z", "totalTestsViral": 2542, "positiveTestsViral": 1689, "negativeTestsViral": 853, "positiveCasesViral": null, "deathConfirmed": null, "deathProbable": null, "totalTestEncountersViral": null, "totalTestsPeopleViral": null, "totalTestsAntibody": null, "positiveTestsAntibody": null, "negativeTestsAntibody": null, "totalTestsPeopleAntibody": null, "positiveTestsPeopleAntibody": null, "negativeTestsPeopleAntibody": null, "totalTestsPeopleAntigen": null, "positiveTestsPeopleAntigen": null, "totalTestsAntigen": null, "positiveTestsAntigen": null, "fips": "41", "positiveIncrease": 58, "negativeIncrease": 1399, "total": 12883, "totalTestResultsIncrease": 1206, "posNeg": 12883, "deathIncrease": 3, "hospitalizedIncrease": 11, "hash": "5395e85b6d9a0b614400cd71d8025a73f88f8d0b", "commercialScore": 0, "negativeRegularScore": 0, "negativeScore": 0, "positiveScore": 0, "score": 0, "grade": "", "month_number_label": "2020-03", "date_label": "2020-03-30", "week_number_label": "2020W14", "week_start_label": "2020-03-30"}, {"date": 20200331, "state": "OR", "positive": 690, "probableCases": null, "negative": 13136, "pending": null, "totalTestResultsSource": "totalTestsViral", "totalTestResults": 3606, "hospitalizedCurrently": 132, "hospitalizedCumulative": 154, "inIcuCurrently": null, "inIcuCumulative": null, "onVentilatorCurrently": 40, "onVentilatorCumulative": null, "recovered": null, "dataQualityGrade": "A", "lastUpdateEt": "3/31/2020 11:00", "dateModified": "2020-03-31T11:00:00Z", "checkTimeEt": "03/31 07:00", "death": 18, "hospitalized": 154, "dateChecked": "2020-03-31T11:00:00Z", "totalTestsViral": 3606, "positiveTestsViral": 1816, "negativeTestsViral": 1790, "positiveCasesViral": null, "deathConfirmed": null, "deathProbable": null, "totalTestEncountersViral": null, "totalTestsPeopleViral": null, "totalTestsAntibody": null, "positiveTestsAntibody": null, "negativeTestsAntibody": null, "totalTestsPeopleAntibody": null, "positiveTestsPeopleAntibody": null, "negativeTestsPeopleAntibody": null, "totalTestsPeopleAntigen": null, "positiveTestsPeopleAntigen": null, "totalTestsAntigen": null, "positiveTestsAntigen": null, "fips": "41", "positiveIncrease": 84, "negativeIncrease": 859, "total": 13826, "totalTestResultsIncrease": 1064, "posNeg": 13826, "deathIncrease": 2, "hospitalizedIncrease": 14, "hash": "d6af35da3e70fc7d06d4dce510c01e3a73b1fb84", "commercialScore": 0, "negativeRegularScore": 0, "negativeScore": 0, "positiveScore": 0, "score": 0, "grade": "", "month_number_label": "2020-03", "date_label": "2020-03-31", "week_number_label": "2020W14", "week_start_label": "2020-03-30"}, {"date": 20200401, "state": "OR", "positive": 736, "probableCases": null, "negative": 13136, "pending": null, "totalTestResultsSource": "totalTestsViral", "totalTestResults": 5528, "hospitalizedCurrently": 132, "hospitalizedCumulative": 154, "inIcuCurrently": null, "inIcuCumulative": null, "onVentilatorCurrently": 40, "onVentilatorCumulative": null, "recovered": null, "dataQualityGrade": "A", "lastUpdateEt": "3/31/2020 11:00", "dateModified": "2020-03-31T11:00:00Z", "checkTimeEt": "03/31 07:00", "death": 18, "hospitalized": 154, "dateChecked": "2020-03-31T11:00:00Z", "totalTestsViral": 5528, "positiveTestsViral": 2007, "negativeTestsViral": 3521, "positiveCasesViral": null, "deathConfirmed": null, "deathProbable": null, "totalTestEncountersViral": null, "totalTestsPeopleViral": null, "totalTestsAntibody": null, "positiveTestsAntibody": null, "negativeTestsAntibody": null, "totalTestsPeopleAntibody": null, "positiveTestsPeopleAntibody": null, "negativeTestsPeopleAntibody": null, "totalTestsPeopleAntigen": null, "positiveTestsPeopleAntigen": null, "totalTestsAntigen": null, "positiveTestsAntigen": null, "fips": "41", "positiveIncrease": 46, "negativeIncrease": 0, "total": 13872, "totalTestResultsIncrease": 1922, "posNeg": 13872, "deathIncrease": 0, "hospitalizedIncrease": 0, "hash": "5b9191793de46be5d2b4da33c099c386dc17fe81", "commercialScore": 0, "negativeRegularScore": 0, "negativeScore": 0, "positiveScore": 0, "score": 0, "grade": "", "month_number_label": "2020-04", "date_label": "2020-04-01", "week_number_label": "2020W14", "week_start_label": "2020-03-30"}, {"date": 20200402, "state": "OR", "positive": 826, "probableCases": null, "negative": 15259, "pending": null, "totalTestResultsSource": "totalTestsViral", "totalTestResults": 7310, "hospitalizedCurrently": 134, "hospitalizedCumulative": 188, "inIcuCurrently": null, "inIcuCumulative": null, "onVentilatorCurrently": 38, "onVentilatorCumulative": null, "recovered": null, "dataQualityGrade": "A", "lastUpdateEt": "4/1/2020 11:00", "dateModified": "2020-04-01T11:00:00Z", "checkTimeEt": "04/01 07:00", "death": 21, "hospitalized": 188, "dateChecked": "2020-04-01T11:00:00Z", "totalTestsViral": 7310, "positiveTestsViral": 2239, "negativeTestsViral": 5071, "positiveCasesViral": null, "deathConfirmed": null, "deathProbable": null, "totalTestEncountersViral": null, "totalTestsPeopleViral": null, "totalTestsAntibody": null, "positiveTestsAntibody": null, "negativeTestsAntibody": null, "totalTestsPeopleAntibody": null, "positiveTestsPeopleAntibody": null, "negativeTestsPeopleAntibody": null, "totalTestsPeopleAntigen": null, "positiveTestsPeopleAntigen": null, "totalTestsAntigen": null, "positiveTestsAntigen": null, "fips": "41", "positiveIncrease": 90, "negativeIncrease": 2123, "total": 16085, "totalTestResultsIncrease": 1782, "posNeg": 16085, "deathIncrease": 3, "hospitalizedIncrease": 34, "hash": "702f0b7645672da4d548f40bfab4e04e18600ed6", "commercialScore": 0, "negativeRegularScore": 0, "negativeScore": 0, "positiveScore": 0, "score": 0, "grade": "", "month_number_label": "2020-04", "date_label": "2020-04-02", "week_number_label": "2020W14", "week_start_label": "2020-03-30"}, {"date": 20200403, "state": "OR", "positive": 899, "probableCases": null, "negative": 16535, "pending": null, "totalTestResultsSource": "totalTestsViral", "totalTestResults": 9569, "hospitalizedCurrently": 188, "hospitalizedCumulative": 204, "inIcuCurrently": null, "inIcuCumulative": null, "onVentilatorCurrently": 38, "onVentilatorCumulative": null, "recovered": null, "dataQualityGrade": "A", "lastUpdateEt": "4/2/2020 11:00", "dateModified": "2020-04-02T11:00:00Z", "checkTimeEt": "04/02 07:00", "death": 22, "hospitalized": 204, "dateChecked": "2020-04-02T11:00:00Z", "totalTestsViral": 9569, "positiveTestsViral": 2413, "negativeTestsViral": 7156, "positiveCasesViral": null, "deathConfirmed": null, "deathProbable": null, "totalTestEncountersViral": null, "totalTestsPeopleViral": null, "totalTestsAntibody": null, "positiveTestsAntibody": null, "negativeTestsAntibody": null, "totalTestsPeopleAntibody": null, "positiveTestsPeopleAntibody": null, "negativeTestsPeopleAntibody": null, "totalTestsPeopleAntigen": null, "positiveTestsPeopleAntigen": null, "totalTestsAntigen": null, "positiveTestsAntigen": null, "fips": "41", "positiveIncrease": 73, "negativeIncrease": 1276, "total": 17434, "totalTestResultsIncrease": 2259, "posNeg": 17434, "deathIncrease": 1, "hospitalizedIncrease": 16, "hash": "79a3856432f92c0b83657662b9e92b103f510db5", "commercialScore": 0, "negativeRegularScore": 0, "negativeScore": 0, "positiveScore": 0, "score": 0, "grade": "", "month_number_label": "2020-04", "date_label": "2020-04-03", "week_number_label": "2020W14", "week_start_label": "2020-03-30"}, {"date": 20200404, "state": "OR", "positive": 999, "probableCases": null, "negative": 16535, "pending": null, "totalTestResultsSource": "totalTestsViral", "totalTestResults": 12322, "hospitalizedCurrently": null, "hospitalizedCumulative": 239, "inIcuCurrently": null, "inIcuCumulative": null, "onVentilatorCurrently": 38, "onVentilatorCumulative": null, "recovered": null, "dataQualityGrade": "A", "lastUpdateEt": "4/3/2020 12:00", "dateModified": "2020-04-03T12:00:00Z", "checkTimeEt": "04/03 08:00", "death": 26, "hospitalized": 239, "dateChecked": "2020-04-03T12:00:00Z", "totalTestsViral": 12322, "positiveTestsViral": 2699, "negativeTestsViral": 9623, "positiveCasesViral": null, "deathConfirmed": null, "deathProbable": null, "totalTestEncountersViral": null, "totalTestsPeopleViral": null, "totalTestsAntibody": null, "positiveTestsAntibody": null, "negativeTestsAntibody": null, "totalTestsPeopleAntibody": null, "positiveTestsPeopleAntibody": null, "negativeTestsPeopleAntibody": null, "totalTestsPeopleAntigen": null, "positiveTestsPeopleAntigen": null, "totalTestsAntigen": null, "positiveTestsAntigen": null, "fips": "41", "positiveIncrease": 100, "negativeIncrease": 0, "total": 17534, "totalTestResultsIncrease": 2753, "posNeg": 17534, "deathIncrease": 4, "hospitalizedIncrease": 35, "hash": "487929babd7ba02a180fc4556bec18040698058a", "commercialScore": 0, "negativeRegularScore": 0, "negativeScore": 0, "positiveScore": 0, "score": 0, "grade": "", "month_number_label": "2020-04", "date_label": "2020-04-04", "week_number_label": "2020W14", "week_start_label": "2020-03-30"}, {"date": 20200405, "state": "OR", "positive": 1068, "probableCases": null, "negative": 19556, "pending": null, "totalTestResultsSource": "totalTestsViral", "totalTestResults": 14206, "hospitalizedCurrently": null, "hospitalizedCumulative": 258, "inIcuCurrently": null, "inIcuCumulative": null, "onVentilatorCurrently": 40, "onVentilatorCumulative": null, "recovered": null, "dataQualityGrade": "A", "lastUpdateEt": "4/4/2020 11:00", "dateModified": "2020-04-04T11:00:00Z", "checkTimeEt": "04/04 07:00", "death": 27, "hospitalized": 258, "dateChecked": "2020-04-04T11:00:00Z", "totalTestsViral": 14206, "positiveTestsViral": 2847, "negativeTestsViral": 11359, "positiveCasesViral": null, "deathConfirmed": null, "deathProbable": null, "totalTestEncountersViral": null, "totalTestsPeopleViral": null, "totalTestsAntibody": null, "positiveTestsAntibody": null, "negativeTestsAntibody": null, "totalTestsPeopleAntibody": null, "positiveTestsPeopleAntibody": null, "negativeTestsPeopleAntibody": null, "totalTestsPeopleAntigen": null, "positiveTestsPeopleAntigen": null, "totalTestsAntigen": null, "positiveTestsAntigen": null, "fips": "41", "positiveIncrease": 69, "negativeIncrease": 3021, "total": 20624, "totalTestResultsIncrease": 1884, "posNeg": 20624, "deathIncrease": 1, "hospitalizedIncrease": 19, "hash": "6d5737771bb37d852e3f82c72c9c7f72cb928c48", "commercialScore": 0, "negativeRegularScore": 0, "negativeScore": 0, "positiveScore": 0, "score": 0, "grade": "", "month_number_label": "2020-04", "date_label": "2020-04-05", "week_number_label": "2020W14", "week_start_label": "2020-03-30"}, {"date": 20200406, "state": "OR", "positive": 1132, "probableCases": null, "negative": 20669, "pending": null, "totalTestResultsSource": "totalTestsViral", "totalTestResults": 15730, "hospitalizedCurrently": null, "hospitalizedCumulative": 258, "inIcuCurrently": null, "inIcuCumulative": null, "onVentilatorCurrently": 40, "onVentilatorCumulative": null, "recovered": null, "dataQualityGrade": "A", "lastUpdateEt": "4/5/2020 11:00", "dateModified": "2020-04-05T11:00:00Z", "checkTimeEt": "04/05 07:00", "death": 27, "hospitalized": 258, "dateChecked": "2020-04-05T11:00:00Z", "totalTestsViral": 15730, "positiveTestsViral": 2955, "negativeTestsViral": 12775, "positiveCasesViral": null, "deathConfirmed": null, "deathProbable": null, "totalTestEncountersViral": null, "totalTestsPeopleViral": null, "totalTestsAntibody": null, "positiveTestsAntibody": null, "negativeTestsAntibody": null, "totalTestsPeopleAntibody": null, "positiveTestsPeopleAntibody": null, "negativeTestsPeopleAntibody": null, "totalTestsPeopleAntigen": null, "positiveTestsPeopleAntigen": null, "totalTestsAntigen": null, "positiveTestsAntigen": null, "fips": "41", "positiveIncrease": 64, "negativeIncrease": 1113, "total": 21801, "totalTestResultsIncrease": 1524, "posNeg": 21801, "deathIncrease": 0, "hospitalizedIncrease": 0, "hash": "8b8e176d6946e28d5c1cf5d8c12b6ebc9bcd601d", "commercialScore": 0, "negativeRegularScore": 0, "negativeScore": 0, "positiveScore": 0, "score": 0, "grade": "", "month_number_label": "2020-04", "date_label": "2020-04-06", "week_number_label": "2020W15", "week_start_label": "2020-04-06"}, {"date": 20200407, "state": "OR", "positive": 1181, "probableCases": null, "negative": 21826, "pending": null, "totalTestResultsSource": "totalTestsViral", "totalTestResults": 18021, "hospitalizedCurrently": null, "hospitalizedCumulative": 324, "inIcuCurrently": null, "inIcuCumulative": null, "onVentilatorCurrently": 69, "onVentilatorCumulative": null, "recovered": null, "dataQualityGrade": "A", "lastUpdateEt": "4/6/2020 11:00", "dateModified": "2020-04-06T11:00:00Z", "checkTimeEt": "04/06 07:00", "death": 33, "hospitalized": 324, "dateChecked": "2020-04-06T11:00:00Z", "totalTestsViral": 18021, "positiveTestsViral": 3124, "negativeTestsViral": 14897, "positiveCasesViral": null, "deathConfirmed": null, "deathProbable": null, "totalTestEncountersViral": null, "totalTestsPeopleViral": null, "totalTestsAntibody": null, "positiveTestsAntibody": null, "negativeTestsAntibody": null, "totalTestsPeopleAntibody": null, "positiveTestsPeopleAntibody": null, "negativeTestsPeopleAntibody": null, "totalTestsPeopleAntigen": null, "positiveTestsPeopleAntigen": null, "totalTestsAntigen": null, "positiveTestsAntigen": null, "fips": "41", "positiveIncrease": 49, "negativeIncrease": 1157, "total": 23007, "totalTestResultsIncrease": 2291, "posNeg": 23007, "deathIncrease": 6, "hospitalizedIncrease": 66, "hash": "cececddf7c48ba059f884ce68d6461bb84bce735", "commercialScore": 0, "negativeRegularScore": 0, "negativeScore": 0, "positiveScore": 0, "score": 0, "grade": "", "month_number_label": "2020-04", "date_label": "2020-04-07", "week_number_label": "2020W15", "week_start_label": "2020-04-06"}, {"date": 20200408, "state": "OR", "positive": 1239, "probableCases": null, "negative": 23325, "pending": null, "totalTestResultsSource": "totalTestsViral", "totalTestResults": 20189, "hospitalizedCurrently": 156, "hospitalizedCumulative": 324, "inIcuCurrently": 61, "inIcuCumulative": null, "onVentilatorCurrently": 58, "onVentilatorCumulative": null, "recovered": null, "dataQualityGrade": "A", "lastUpdateEt": "4/7/2020 11:00", "dateModified": "2020-04-07T11:00:00Z", "checkTimeEt": "04/07 07:00", "death": 33, "hospitalized": 324, "dateChecked": "2020-04-07T11:00:00Z", "totalTestsViral": 20189, "positiveTestsViral": 3660, "negativeTestsViral": 16529, "positiveCasesViral": null, "deathConfirmed": null, "deathProbable": null, "totalTestEncountersViral": null, "totalTestsPeopleViral": null, "totalTestsAntibody": null, "positiveTestsAntibody": null, "negativeTestsAntibody": null, "totalTestsPeopleAntibody": null, "positiveTestsPeopleAntibody": null, "negativeTestsPeopleAntibody": null, "totalTestsPeopleAntigen": null, "positiveTestsPeopleAntigen": null, "totalTestsAntigen": null, "positiveTestsAntigen": null, "fips": "41", "positiveIncrease": 58, "negativeIncrease": 1499, "total": 24564, "totalTestResultsIncrease": 2168, "posNeg": 24564, "deathIncrease": 0, "hospitalizedIncrease": 0, "hash": "579bf529ba351787c495080c3e5c44d9ae7e919d", "commercialScore": 0, "negativeRegularScore": 0, "negativeScore": 0, "positiveScore": 0, "score": 0, "grade": "", "month_number_label": "2020-04", "date_label": "2020-04-08", "week_number_label": "2020W15", "week_start_label": "2020-04-06"}, {"date": 20200409, "state": "OR", "positive": 1321, "probableCases": null, "negative": 24306, "pending": null, "totalTestResultsSource": "totalTestsViral", "totalTestResults": 22105, "hospitalizedCurrently": 146, "hospitalizedCumulative": 326, "inIcuCurrently": 66, "inIcuCumulative": null, "onVentilatorCurrently": 54, "onVentilatorCumulative": null, "recovered": null, "dataQualityGrade": "A", "lastUpdateEt": "4/9/2020 11:00", "dateModified": "2020-04-09T11:00:00Z", "checkTimeEt": "04/09 07:00", "death": 44, "hospitalized": 326, "dateChecked": "2020-04-09T11:00:00Z", "totalTestsViral": 22105, "positiveTestsViral": 3828, "negativeTestsViral": 18277, "positiveCasesViral": null, "deathConfirmed": null, "deathProbable": null, "totalTestEncountersViral": null, "totalTestsPeopleViral": null, "totalTestsAntibody": null, "positiveTestsAntibody": null, "negativeTestsAntibody": null, "totalTestsPeopleAntibody": null, "positiveTestsPeopleAntibody": null, "negativeTestsPeopleAntibody": null, "totalTestsPeopleAntigen": null, "positiveTestsPeopleAntigen": null, "totalTestsAntigen": null, "positiveTestsAntigen": null, "fips": "41", "positiveIncrease": 82, "negativeIncrease": 981, "total": 25627, "totalTestResultsIncrease": 1916, "posNeg": 25627, "deathIncrease": 11, "hospitalizedIncrease": 2, "hash": "03d3e3e137b46b75fa9c31270e48245fc94a09f9", "commercialScore": 0, "negativeRegularScore": 0, "negativeScore": 0, "positiveScore": 0, "score": 0, "grade": "", "month_number_label": "2020-04", "date_label": "2020-04-09", "week_number_label": "2020W15", "week_start_label": "2020-04-06"}, {"date": 20200410, "state": "OR", "positive": 1321, "probableCases": null, "negative": 24306, "pending": null, "totalTestResultsSource": "totalTestsViral", "totalTestResults": 24290, "hospitalizedCurrently": 146, "hospitalizedCumulative": 326, "inIcuCurrently": 66, "inIcuCumulative": null, "onVentilatorCurrently": 54, "onVentilatorCumulative": null, "recovered": null, "dataQualityGrade": "A", "lastUpdateEt": "4/9/2020 11:00", "dateModified": "2020-04-09T11:00:00Z", "checkTimeEt": "04/09 07:00", "death": 44, "hospitalized": 326, "dateChecked": "2020-04-09T11:00:00Z", "totalTestsViral": 24290, "positiveTestsViral": 3969, "negativeTestsViral": 20321, "positiveCasesViral": null, "deathConfirmed": null, "deathProbable": null, "totalTestEncountersViral": null, "totalTestsPeopleViral": null, "totalTestsAntibody": null, "positiveTestsAntibody": null, "negativeTestsAntibody": null, "totalTestsPeopleAntibody": null, "positiveTestsPeopleAntibody": null, "negativeTestsPeopleAntibody": null, "totalTestsPeopleAntigen": null, "positiveTestsPeopleAntigen": null, "totalTestsAntigen": null, "positiveTestsAntigen": null, "fips": "41", "positiveIncrease": 0, "negativeIncrease": 0, "total": 25627, "totalTestResultsIncrease": 2185, "posNeg": 25627, "deathIncrease": 0, "hospitalizedIncrease": 0, "hash": "9994582067622ab0f784e2d7aa6bd064eb8b6cc2", "commercialScore": 0, "negativeRegularScore": 0, "negativeScore": 0, "positiveScore": 0, "score": 0, "grade": "", "month_number_label": "2020-04", "date_label": "2020-04-10", "week_number_label": "2020W15", "week_start_label": "2020-04-06"}, {"date": 20200411, "state": "OR", "positive": 1371, "probableCases": null, "negative": 25853, "pending": null, "totalTestResultsSource": "totalTestsViral", "totalTestResults": 26548, "hospitalizedCurrently": 140, "hospitalizedCumulative": 338, "inIcuCurrently": 58, "inIcuCumulative": null, "onVentilatorCurrently": 46, "onVentilatorCumulative": null, "recovered": null, "dataQualityGrade": "A", "lastUpdateEt": "4/10/2020 11:00", "dateModified": "2020-04-10T11:00:00Z", "checkTimeEt": "04/10 07:00", "death": 48, "hospitalized": 338, "dateChecked": "2020-04-10T11:00:00Z", "totalTestsViral": 26548, "positiveTestsViral": 4134, "negativeTestsViral": 22414, "positiveCasesViral": null, "deathConfirmed": null, "deathProbable": null, "totalTestEncountersViral": null, "totalTestsPeopleViral": null, "totalTestsAntibody": null, "positiveTestsAntibody": null, "negativeTestsAntibody": null, "totalTestsPeopleAntibody": null, "positiveTestsPeopleAntibody": null, "negativeTestsPeopleAntibody": null, "totalTestsPeopleAntigen": null, "positiveTestsPeopleAntigen": null, "totalTestsAntigen": null, "positiveTestsAntigen": null, "fips": "41", "positiveIncrease": 50, "negativeIncrease": 1547, "total": 27224, "totalTestResultsIncrease": 2258, "posNeg": 27224, "deathIncrease": 4, "hospitalizedIncrease": 12, "hash": "42ff5e4ff50d495167110f13f79dd93c1198de8b", "commercialScore": 0, "negativeRegularScore": 0, "negativeScore": 0, "positiveScore": 0, "score": 0, "grade": "", "month_number_label": "2020-04", "date_label": "2020-04-11", "week_number_label": "2020W15", "week_start_label": "2020-04-06"}, {"date": 20200412, "state": "OR", "positive": 1527, "probableCases": null, "negative": 28231, "pending": null, "totalTestResultsSource": "totalTestsViral", "totalTestResults": 28316, "hospitalizedCurrently": 295, "hospitalizedCumulative": 359, "inIcuCurrently": 81, "inIcuCumulative": null, "onVentilatorCurrently": 52, "onVentilatorCumulative": null, "recovered": null, "dataQualityGrade": "A", "lastUpdateEt": "4/12/2020 11:00", "dateModified": "2020-04-12T11:00:00Z", "checkTimeEt": "04/12 07:00", "death": 52, "hospitalized": 359, "dateChecked": "2020-04-12T11:00:00Z", "totalTestsViral": 28316, "positiveTestsViral": 4284, "negativeTestsViral": 24032, "positiveCasesViral": null, "deathConfirmed": null, "deathProbable": null, "totalTestEncountersViral": null, "totalTestsPeopleViral": null, "totalTestsAntibody": null, "positiveTestsAntibody": null, "negativeTestsAntibody": null, "totalTestsPeopleAntibody": null, "positiveTestsPeopleAntibody": null, "negativeTestsPeopleAntibody": null, "totalTestsPeopleAntigen": null, "positiveTestsPeopleAntigen": null, "totalTestsAntigen": null, "positiveTestsAntigen": null, "fips": "41", "positiveIncrease": 156, "negativeIncrease": 2378, "total": 29758, "totalTestResultsIncrease": 1768, "posNeg": 29758, "deathIncrease": 4, "hospitalizedIncrease": 21, "hash": "9e1463abc1494546e6fdc855c35ee8971268b048", "commercialScore": 0, "negativeRegularScore": 0, "negativeScore": 0, "positiveScore": 0, "score": 0, "grade": "", "month_number_label": "2020-04", "date_label": "2020-04-12", "week_number_label": "2020W15", "week_start_label": "2020-04-06"}, {"date": 20200413, "state": "OR", "positive": 1584, "probableCases": null, "negative": 29537, "pending": null, "totalTestResultsSource": "totalTestsViral", "totalTestResults": 30144, "hospitalizedCurrently": 321, "hospitalizedCumulative": 369, "inIcuCurrently": 96, "inIcuCumulative": null, "onVentilatorCurrently": 50, "onVentilatorCumulative": null, "recovered": null, "dataQualityGrade": "A", "lastUpdateEt": "4/13/2020 11:00", "dateModified": "2020-04-13T11:00:00Z", "checkTimeEt": "04/13 07:00", "death": 53, "hospitalized": 369, "dateChecked": "2020-04-13T11:00:00Z", "totalTestsViral": 30144, "positiveTestsViral": 4419, "negativeTestsViral": 25725, "positiveCasesViral": null, "deathConfirmed": null, "deathProbable": null, "totalTestEncountersViral": null, "totalTestsPeopleViral": null, "totalTestsAntibody": null, "positiveTestsAntibody": null, "negativeTestsAntibody": null, "totalTestsPeopleAntibody": null, "positiveTestsPeopleAntibody": null, "negativeTestsPeopleAntibody": null, "totalTestsPeopleAntigen": null, "positiveTestsPeopleAntigen": null, "totalTestsAntigen": null, "positiveTestsAntigen": null, "fips": "41", "positiveIncrease": 57, "negativeIncrease": 1306, "total": 31121, "totalTestResultsIncrease": 1828, "posNeg": 31121, "deathIncrease": 1, "hospitalizedIncrease": 10, "hash": "828dcaa83edeef36205d29dca50c5b11b62c223e", "commercialScore": 0, "negativeRegularScore": 0, "negativeScore": 0, "positiveScore": 0, "score": 0, "grade": "", "month_number_label": "2020-04", "date_label": "2020-04-13", "week_number_label": "2020W16", "week_start_label": "2020-04-13"}, {"date": 20200414, "state": "OR", "positive": 1633, "probableCases": null, "negative": 30730, "pending": null, "totalTestResultsSource": "totalTestsViral", "totalTestResults": 31387, "hospitalizedCurrently": 311, "hospitalizedCumulative": 381, "inIcuCurrently": 88, "inIcuCumulative": null, "onVentilatorCurrently": 44, "onVentilatorCumulative": null, "recovered": null, "dataQualityGrade": "A", "lastUpdateEt": "4/14/2020 11:00", "dateModified": "2020-04-14T11:00:00Z", "checkTimeEt": "04/14 07:00", "death": 55, "hospitalized": 381, "dateChecked": "2020-04-14T11:00:00Z", "totalTestsViral": 31387, "positiveTestsViral": 4507, "negativeTestsViral": 26880, "positiveCasesViral": null, "deathConfirmed": null, "deathProbable": null, "totalTestEncountersViral": null, "totalTestsPeopleViral": null, "totalTestsAntibody": null, "positiveTestsAntibody": null, "negativeTestsAntibody": null, "totalTestsPeopleAntibody": null, "positiveTestsPeopleAntibody": null, "negativeTestsPeopleAntibody": null, "totalTestsPeopleAntigen": null, "positiveTestsPeopleAntigen": null, "totalTestsAntigen": null, "positiveTestsAntigen": null, "fips": "41", "positiveIncrease": 49, "negativeIncrease": 1193, "total": 32363, "totalTestResultsIncrease": 1243, "posNeg": 32363, "deathIncrease": 2, "hospitalizedIncrease": 12, "hash": "42668a4c3d43c073b85f9c0aa758db7ee54c1dc5", "commercialScore": 0, "negativeRegularScore": 0, "negativeScore": 0, "positiveScore": 0, "score": 0, "grade": "", "month_number_label": "2020-04", "date_label": "2020-04-14", "week_number_label": "2020W16", "week_start_label": "2020-04-13"}, {"date": 20200415, "state": "OR", "positive": 1663, "probableCases": null, "negative": 31688, "pending": null, "totalTestResultsSource": "totalTestsViral", "totalTestResults": 32861, "hospitalizedCurrently": 305, "hospitalizedCumulative": 401, "inIcuCurrently": 95, "inIcuCumulative": null, "onVentilatorCurrently": 43, "onVentilatorCumulative": null, "recovered": null, "dataQualityGrade": "A", "lastUpdateEt": "4/15/2020 11:00", "dateModified": "2020-04-15T11:00:00Z", "checkTimeEt": "04/15 07:00", "death": 58, "hospitalized": 401, "dateChecked": "2020-04-15T11:00:00Z", "totalTestsViral": 32861, "positiveTestsViral": 4626, "negativeTestsViral": 28235, "positiveCasesViral": null, "deathConfirmed": null, "deathProbable": null, "totalTestEncountersViral": null, "totalTestsPeopleViral": null, "totalTestsAntibody": null, "positiveTestsAntibody": null, "negativeTestsAntibody": null, "totalTestsPeopleAntibody": null, "positiveTestsPeopleAntibody": null, "negativeTestsPeopleAntibody": null, "totalTestsPeopleAntigen": null, "positiveTestsPeopleAntigen": null, "totalTestsAntigen": null, "positiveTestsAntigen": null, "fips": "41", "positiveIncrease": 30, "negativeIncrease": 958, "total": 33351, "totalTestResultsIncrease": 1474, "posNeg": 33351, "deathIncrease": 3, "hospitalizedIncrease": 20, "hash": "5be61b1b9a09e7bc02b4ba1710a05a0d8a4c344b", "commercialScore": 0, "negativeRegularScore": 0, "negativeScore": 0, "positiveScore": 0, "score": 0, "grade": "", "month_number_label": "2020-04", "date_label": "2020-04-15", "week_number_label": "2020W16", "week_start_label": "2020-04-13"}, {"date": 20200416, "state": "OR", "positive": 1736, "probableCases": null, "negative": 33202, "pending": null, "totalTestResultsSource": "totalTestsViral", "totalTestResults": 35283, "hospitalizedCurrently": 307, "hospitalizedCumulative": 414, "inIcuCurrently": 89, "inIcuCumulative": null, "onVentilatorCurrently": 43, "onVentilatorCumulative": null, "recovered": null, "dataQualityGrade": "A", "lastUpdateEt": "4/16/2020 11:00", "dateModified": "2020-04-16T11:00:00Z", "checkTimeEt": "04/16 07:00", "death": 64, "hospitalized": 414, "dateChecked": "2020-04-16T11:00:00Z", "totalTestsViral": 35283, "positiveTestsViral": 4807, "negativeTestsViral": 30476, "positiveCasesViral": null, "deathConfirmed": null, "deathProbable": null, "totalTestEncountersViral": null, "totalTestsPeopleViral": null, "totalTestsAntibody": null, "positiveTestsAntibody": null, "negativeTestsAntibody": null, "totalTestsPeopleAntibody": null, "positiveTestsPeopleAntibody": null, "negativeTestsPeopleAntibody": null, "totalTestsPeopleAntigen": null, "positiveTestsPeopleAntigen": null, "totalTestsAntigen": null, "positiveTestsAntigen": null, "fips": "41", "positiveIncrease": 73, "negativeIncrease": 1514, "total": 34938, "totalTestResultsIncrease": 2422, "posNeg": 34938, "deathIncrease": 6, "hospitalizedIncrease": 13, "hash": "b946937d4fc21236f423faee36024f1d4f3daa5b", "commercialScore": 0, "negativeRegularScore": 0, "negativeScore": 0, "positiveScore": 0, "score": 0, "grade": "", "month_number_label": "2020-04", "date_label": "2020-04-16", "week_number_label": "2020W16", "week_start_label": "2020-04-13"}, {"date": 20200417, "state": "OR", "positive": 1785, "probableCases": null, "negative": 34536, "pending": null, "totalTestResultsSource": "totalTestsViral", "totalTestResults": 37583, "hospitalizedCurrently": 301, "hospitalizedCumulative": 427, "inIcuCurrently": 69, "inIcuCumulative": null, "onVentilatorCurrently": 41, "onVentilatorCumulative": null, "recovered": null, "dataQualityGrade": "A", "lastUpdateEt": "4/17/2020 11:00", "dateModified": "2020-04-17T11:00:00Z", "checkTimeEt": "04/17 07:00", "death": 70, "hospitalized": 427, "dateChecked": "2020-04-17T11:00:00Z", "totalTestsViral": 37583, "positiveTestsViral": 4948, "negativeTestsViral": 32635, "positiveCasesViral": null, "deathConfirmed": null, "deathProbable": null, "totalTestEncountersViral": null, "totalTestsPeopleViral": null, "totalTestsAntibody": null, "positiveTestsAntibody": null, "negativeTestsAntibody": null, "totalTestsPeopleAntibody": null, "positiveTestsPeopleAntibody": null, "negativeTestsPeopleAntibody": null, "totalTestsPeopleAntigen": null, "positiveTestsPeopleAntigen": null, "totalTestsAntigen": null, "positiveTestsAntigen": null, "fips": "41", "positiveIncrease": 49, "negativeIncrease": 1334, "total": 36321, "totalTestResultsIncrease": 2300, "posNeg": 36321, "deathIncrease": 6, "hospitalizedIncrease": 13, "hash": "e7eb3193438c185aa29263b0e4fe1e5f5a39f80a", "commercialScore": 0, "negativeRegularScore": 0, "negativeScore": 0, "positiveScore": 0, "score": 0, "grade": "", "month_number_label": "2020-04", "date_label": "2020-04-17", "week_number_label": "2020W16", "week_start_label": "2020-04-13"}, {"date": 20200418, "state": "OR", "positive": 1844, "probableCases": null, "negative": 35739, "pending": null, "totalTestResultsSource": "totalTestsViral", "totalTestResults": 39641, "hospitalizedCurrently": 290, "hospitalizedCumulative": 449, "inIcuCurrently": 74, "inIcuCumulative": null, "onVentilatorCurrently": 37, "onVentilatorCumulative": null, "recovered": null, "dataQualityGrade": "A", "lastUpdateEt": "4/18/2020 11:00", "dateModified": "2020-04-18T11:00:00Z", "checkTimeEt": "04/18 07:00", "death": 72, "hospitalized": 449, "dateChecked": "2020-04-18T11:00:00Z", "totalTestsViral": 39641, "positiveTestsViral": 5105, "negativeTestsViral": 34536, "positiveCasesViral": null, "deathConfirmed": null, "deathProbable": null, "totalTestEncountersViral": null, "totalTestsPeopleViral": null, "totalTestsAntibody": null, "positiveTestsAntibody": null, "negativeTestsAntibody": null, "totalTestsPeopleAntibody": null, "positiveTestsPeopleAntibody": null, "negativeTestsPeopleAntibody": null, "totalTestsPeopleAntigen": null, "positiveTestsPeopleAntigen": null, "totalTestsAntigen": null, "positiveTestsAntigen": null, "fips": "41", "positiveIncrease": 59, "negativeIncrease": 1203, "total": 37583, "totalTestResultsIncrease": 2058, "posNeg": 37583, "deathIncrease": 2, "hospitalizedIncrease": 22, "hash": "4ac0ebe59b09723fe2ea520972c97c75c51e8635", "commercialScore": 0, "negativeRegularScore": 0, "negativeScore": 0, "positiveScore": 0, "score": 0, "grade": "", "month_number_label": "2020-04", "date_label": "2020-04-18", "week_number_label": "2020W16", "week_start_label": "2020-04-13"}, {"date": 20200419, "state": "OR", "positive": 1910, "probableCases": null, "negative": 37128, "pending": null, "totalTestResultsSource": "totalTestsViral", "totalTestResults": 42029, "hospitalizedCurrently": 290, "hospitalizedCumulative": 456, "inIcuCurrently": 74, "inIcuCumulative": null, "onVentilatorCurrently": 37, "onVentilatorCumulative": null, "recovered": null, "dataQualityGrade": "A", "lastUpdateEt": "4/19/2020 11:00", "dateModified": "2020-04-19T11:00:00Z", "checkTimeEt": "04/19 07:00", "death": 74, "hospitalized": 456, "dateChecked": "2020-04-19T11:00:00Z", "totalTestsViral": 42029, "positiveTestsViral": 5326, "negativeTestsViral": 36703, "positiveCasesViral": null, "deathConfirmed": null, "deathProbable": null, "totalTestEncountersViral": null, "totalTestsPeopleViral": null, "totalTestsAntibody": null, "positiveTestsAntibody": null, "negativeTestsAntibody": null, "totalTestsPeopleAntibody": null, "positiveTestsPeopleAntibody": null, "negativeTestsPeopleAntibody": null, "totalTestsPeopleAntigen": null, "positiveTestsPeopleAntigen": null, "totalTestsAntigen": null, "positiveTestsAntigen": null, "fips": "41", "positiveIncrease": 66, "negativeIncrease": 1389, "total": 39038, "totalTestResultsIncrease": 2388, "posNeg": 39038, "deathIncrease": 2, "hospitalizedIncrease": 7, "hash": "9b129579169a5d6de2b637bcf495c8693852d1f5", "commercialScore": 0, "negativeRegularScore": 0, "negativeScore": 0, "positiveScore": 0, "score": 0, "grade": "", "month_number_label": "2020-04", "date_label": "2020-04-19", "week_number_label": "2020W16", "week_start_label": "2020-04-13"}, {"date": 20200420, "state": "OR", "positive": 1956, "probableCases": null, "negative": 38089, "pending": null, "totalTestResultsSource": "totalTestsViral", "totalTestResults": 43975, "hospitalizedCurrently": 303, "hospitalizedCumulative": 465, "inIcuCurrently": 74, "inIcuCumulative": null, "onVentilatorCurrently": 35, "onVentilatorCumulative": null, "recovered": null, "dataQualityGrade": "A", "lastUpdateEt": "4/20/2020 11:00", "dateModified": "2020-04-20T11:00:00Z", "checkTimeEt": "04/20 07:00", "death": 75, "hospitalized": 465, "dateChecked": "2020-04-20T11:00:00Z", "totalTestsViral": 43975, "positiveTestsViral": 5501, "negativeTestsViral": 38474, "positiveCasesViral": null, "deathConfirmed": null, "deathProbable": null, "totalTestEncountersViral": null, "totalTestsPeopleViral": null, "totalTestsAntibody": null, "positiveTestsAntibody": null, "negativeTestsAntibody": null, "totalTestsPeopleAntibody": null, "positiveTestsPeopleAntibody": null, "negativeTestsPeopleAntibody": null, "totalTestsPeopleAntigen": null, "positiveTestsPeopleAntigen": null, "totalTestsAntigen": null, "positiveTestsAntigen": null, "fips": "41", "positiveIncrease": 46, "negativeIncrease": 961, "total": 40045, "totalTestResultsIncrease": 1946, "posNeg": 40045, "deathIncrease": 1, "hospitalizedIncrease": 9, "hash": "f899c2acb8458f9823eb5446704b5245f14ad147", "commercialScore": 0, "negativeRegularScore": 0, "negativeScore": 0, "positiveScore": 0, "score": 0, "grade": "", "month_number_label": "2020-04", "date_label": "2020-04-20", "week_number_label": "2020W17", "week_start_label": "2020-04-20"}, {"date": 20200421, "state": "OR", "positive": 2002, "probableCases": null, "negative": 39126, "pending": null, "totalTestResultsSource": "totalTestsViral", "totalTestResults": 45328, "hospitalizedCurrently": 297, "hospitalizedCumulative": 471, "inIcuCurrently": 70, "inIcuCumulative": null, "onVentilatorCurrently": 35, "onVentilatorCumulative": null, "recovered": null, "dataQualityGrade": "A", "lastUpdateEt": "4/21/2020 11:00", "dateModified": "2020-04-21T11:00:00Z", "checkTimeEt": "04/21 07:00", "death": 78, "hospitalized": 471, "dateChecked": "2020-04-21T11:00:00Z", "totalTestsViral": 45328, "positiveTestsViral": 5612, "negativeTestsViral": 39716, "positiveCasesViral": null, "deathConfirmed": null, "deathProbable": null, "totalTestEncountersViral": null, "totalTestsPeopleViral": null, "totalTestsAntibody": null, "positiveTestsAntibody": null, "negativeTestsAntibody": null, "totalTestsPeopleAntibody": null, "positiveTestsPeopleAntibody": null, "negativeTestsPeopleAntibody": null, "totalTestsPeopleAntigen": null, "positiveTestsPeopleAntigen": null, "totalTestsAntigen": null, "positiveTestsAntigen": null, "fips": "41", "positiveIncrease": 46, "negativeIncrease": 1037, "total": 41128, "totalTestResultsIncrease": 1353, "posNeg": 41128, "deathIncrease": 3, "hospitalizedIncrease": 6, "hash": "79dc9f1fe43ec36c0a000c398cf1b7d9b969b7dd", "commercialScore": 0, "negativeRegularScore": 0, "negativeScore": 0, "positiveScore": 0, "score": 0, "grade": "", "month_number_label": "2020-04", "date_label": "2020-04-21", "week_number_label": "2020W17", "week_start_label": "2020-04-20"}, {"date": 20200422, "state": "OR", "positive": 2059, "probableCases": null, "negative": 39126, "pending": null, "totalTestResultsSource": "totalTestsViral", "totalTestResults": 47837, "hospitalizedCurrently": 302, "hospitalizedCumulative": 488, "inIcuCurrently": 67, "inIcuCumulative": null, "onVentilatorCurrently": 35, "onVentilatorCumulative": null, "recovered": null, "dataQualityGrade": "A", "lastUpdateEt": "4/22/2020 11:00", "dateModified": "2020-04-22T11:00:00Z", "checkTimeEt": "04/22 07:00", "death": 78, "hospitalized": 488, "dateChecked": "2020-04-22T11:00:00Z", "totalTestsViral": 47837, "positiveTestsViral": 5799, "negativeTestsViral": 42038, "positiveCasesViral": null, "deathConfirmed": null, "deathProbable": null, "totalTestEncountersViral": null, "totalTestsPeopleViral": null, "totalTestsAntibody": null, "positiveTestsAntibody": null, "negativeTestsAntibody": null, "totalTestsPeopleAntibody": null, "positiveTestsPeopleAntibody": null, "negativeTestsPeopleAntibody": null, "totalTestsPeopleAntigen": null, "positiveTestsPeopleAntigen": null, "totalTestsAntigen": null, "positiveTestsAntigen": null, "fips": "41", "positiveIncrease": 57, "negativeIncrease": 0, "total": 41185, "totalTestResultsIncrease": 2509, "posNeg": 41185, "deathIncrease": 0, "hospitalizedIncrease": 17, "hash": "fa6e752ccc3f22af3e426dbac445f126ffb75925", "commercialScore": 0, "negativeRegularScore": 0, "negativeScore": 0, "positiveScore": 0, "score": 0, "grade": "", "month_number_label": "2020-04", "date_label": "2020-04-22", "week_number_label": "2020W17", "week_start_label": "2020-04-20"}, {"date": 20200423, "state": "OR", "positive": 2127, "probableCases": null, "negative": 41849, "pending": null, "totalTestResultsSource": "totalTestsViral", "totalTestResults": 50259, "hospitalizedCurrently": 304, "hospitalizedCumulative": 512, "inIcuCurrently": 74, "inIcuCumulative": null, "onVentilatorCurrently": 36, "onVentilatorCumulative": null, "recovered": null, "dataQualityGrade": "A", "lastUpdateEt": "4/23/2020 11:00", "dateModified": "2020-04-23T11:00:00Z", "checkTimeEt": "04/23 07:00", "death": 83, "hospitalized": 512, "dateChecked": "2020-04-23T11:00:00Z", "totalTestsViral": 50259, "positiveTestsViral": 5967, "negativeTestsViral": 44292, "positiveCasesViral": null, "deathConfirmed": null, "deathProbable": null, "totalTestEncountersViral": null, "totalTestsPeopleViral": null, "totalTestsAntibody": null, "positiveTestsAntibody": null, "negativeTestsAntibody": null, "totalTestsPeopleAntibody": null, "positiveTestsPeopleAntibody": null, "negativeTestsPeopleAntibody": null, "totalTestsPeopleAntigen": null, "positiveTestsPeopleAntigen": null, "totalTestsAntigen": null, "positiveTestsAntigen": null, "fips": "41", "positiveIncrease": 68, "negativeIncrease": 2723, "total": 43976, "totalTestResultsIncrease": 2422, "posNeg": 43976, "deathIncrease": 5, "hospitalizedIncrease": 24, "hash": "fdb0c59ecc6e7b714b2f4063cbd936bf18ec26e9", "commercialScore": 0, "negativeRegularScore": 0, "negativeScore": 0, "positiveScore": 0, "score": 0, "grade": "", "month_number_label": "2020-04", "date_label": "2020-04-23", "week_number_label": "2020W17", "week_start_label": "2020-04-20"}, {"date": 20200424, "state": "OR", "positive": 2177, "probableCases": null, "negative": 43315, "pending": null, "totalTestResultsSource": "totalTestsViral", "totalTestResults": 53845, "hospitalizedCurrently": 258, "hospitalizedCumulative": 520, "inIcuCurrently": 56, "inIcuCumulative": null, "onVentilatorCurrently": 29, "onVentilatorCumulative": null, "recovered": null, "dataQualityGrade": "A", "lastUpdateEt": "4/24/2020 11:00", "dateModified": "2020-04-24T11:00:00Z", "checkTimeEt": "04/24 07:00", "death": 86, "hospitalized": 520, "dateChecked": "2020-04-24T11:00:00Z", "totalTestsViral": 53845, "positiveTestsViral": 6180, "negativeTestsViral": 47665, "positiveCasesViral": null, "deathConfirmed": null, "deathProbable": null, "totalTestEncountersViral": null, "totalTestsPeopleViral": null, "totalTestsAntibody": null, "positiveTestsAntibody": null, "negativeTestsAntibody": null, "totalTestsPeopleAntibody": null, "positiveTestsPeopleAntibody": null, "negativeTestsPeopleAntibody": null, "totalTestsPeopleAntigen": null, "positiveTestsPeopleAntigen": null, "totalTestsAntigen": null, "positiveTestsAntigen": null, "fips": "41", "positiveIncrease": 50, "negativeIncrease": 1466, "total": 45492, "totalTestResultsIncrease": 3586, "posNeg": 45492, "deathIncrease": 3, "hospitalizedIncrease": 8, "hash": "08aa1e0cb515737a19c62ca2ee2fe873999ea393", "commercialScore": 0, "negativeRegularScore": 0, "negativeScore": 0, "positiveScore": 0, "score": 0, "grade": "", "month_number_label": "2020-04", "date_label": "2020-04-24", "week_number_label": "2020W17", "week_start_label": "2020-04-20"}, {"date": 20200425, "state": "OR", "positive": 2253, "probableCases": null, "negative": 45124, "pending": null, "totalTestResultsSource": "totalTestsViral", "totalTestResults": 56494, "hospitalizedCurrently": 261, "hospitalizedCumulative": 536, "inIcuCurrently": 60, "inIcuCumulative": null, "onVentilatorCurrently": 29, "onVentilatorCumulative": null, "recovered": null, "dataQualityGrade": "B", "lastUpdateEt": "4/25/2020 11:00", "dateModified": "2020-04-25T11:00:00Z", "checkTimeEt": "04/25 07:00", "death": 87, "hospitalized": 536, "dateChecked": "2020-04-25T11:00:00Z", "totalTestsViral": 56494, "positiveTestsViral": 6349, "negativeTestsViral": 50145, "positiveCasesViral": null, "deathConfirmed": null, "deathProbable": null, "totalTestEncountersViral": null, "totalTestsPeopleViral": null, "totalTestsAntibody": null, "positiveTestsAntibody": null, "negativeTestsAntibody": null, "totalTestsPeopleAntibody": null, "positiveTestsPeopleAntibody": null, "negativeTestsPeopleAntibody": null, "totalTestsPeopleAntigen": null, "positiveTestsPeopleAntigen": null, "totalTestsAntigen": null, "positiveTestsAntigen": null, "fips": "41", "positiveIncrease": 76, "negativeIncrease": 1809, "total": 47377, "totalTestResultsIncrease": 2649, "posNeg": 47377, "deathIncrease": 1, "hospitalizedIncrease": 16, "hash": "23f5fa068b31ebc68663472b8dc5093ab63c985f", "commercialScore": 0, "negativeRegularScore": 0, "negativeScore": 0, "positiveScore": 0, "score": 0, "grade": "", "month_number_label": "2020-04", "date_label": "2020-04-25", "week_number_label": "2020W17", "week_start_label": "2020-04-20"}, {"date": 20200426, "state": "OR", "positive": 2311, "probableCases": null, "negative": 46653, "pending": null, "totalTestResultsSource": "totalTestsViral", "totalTestResults": 58802, "hospitalizedCurrently": 249, "hospitalizedCumulative": 546, "inIcuCurrently": 71, "inIcuCumulative": null, "onVentilatorCurrently": 31, "onVentilatorCumulative": null, "recovered": null, "dataQualityGrade": "B", "lastUpdateEt": "4/26/2020 11:00", "dateModified": "2020-04-26T11:00:00Z", "checkTimeEt": "04/26 07:00", "death": 91, "hospitalized": 546, "dateChecked": "2020-04-26T11:00:00Z", "totalTestsViral": 58802, "positiveTestsViral": 6511, "negativeTestsViral": 52291, "positiveCasesViral": null, "deathConfirmed": null, "deathProbable": null, "totalTestEncountersViral": null, "totalTestsPeopleViral": null, "totalTestsAntibody": null, "positiveTestsAntibody": null, "negativeTestsAntibody": null, "totalTestsPeopleAntibody": null, "positiveTestsPeopleAntibody": null, "negativeTestsPeopleAntibody": null, "totalTestsPeopleAntigen": null, "positiveTestsPeopleAntigen": null, "totalTestsAntigen": null, "positiveTestsAntigen": null, "fips": "41", "positiveIncrease": 58, "negativeIncrease": 1529, "total": 48964, "totalTestResultsIncrease": 2308, "posNeg": 48964, "deathIncrease": 4, "hospitalizedIncrease": 10, "hash": "0c5764716618e568effc5ed382a7d2afb9394743", "commercialScore": 0, "negativeRegularScore": 0, "negativeScore": 0, "positiveScore": 0, "score": 0, "grade": "", "month_number_label": "2020-04", "date_label": "2020-04-26", "week_number_label": "2020W17", "week_start_label": "2020-04-20"}, {"date": 20200427, "state": "OR", "positive": 2354, "probableCases": null, "negative": 48844, "pending": null, "totalTestResultsSource": "totalTestsViral", "totalTestResults": 61789, "hospitalizedCurrently": 249, "hospitalizedCumulative": 554, "inIcuCurrently": 71, "inIcuCumulative": null, "onVentilatorCurrently": 31, "onVentilatorCumulative": null, "recovered": null, "dataQualityGrade": "B", "lastUpdateEt": "4/27/2020 11:00", "dateModified": "2020-04-27T11:00:00Z", "checkTimeEt": "04/27 07:00", "death": 92, "hospitalized": 554, "dateChecked": "2020-04-27T11:00:00Z", "totalTestsViral": 61789, "positiveTestsViral": 6665, "negativeTestsViral": 55124, "positiveCasesViral": null, "deathConfirmed": null, "deathProbable": null, "totalTestEncountersViral": null, "totalTestsPeopleViral": null, "totalTestsAntibody": null, "positiveTestsAntibody": null, "negativeTestsAntibody": null, "totalTestsPeopleAntibody": null, "positiveTestsPeopleAntibody": null, "negativeTestsPeopleAntibody": null, "totalTestsPeopleAntigen": null, "positiveTestsPeopleAntigen": null, "totalTestsAntigen": null, "positiveTestsAntigen": null, "fips": "41", "positiveIncrease": 43, "negativeIncrease": 2191, "total": 51198, "totalTestResultsIncrease": 2987, "posNeg": 51198, "deathIncrease": 1, "hospitalizedIncrease": 8, "hash": "c88010f709d930cf458ca0e656d05f7d88a0acb4", "commercialScore": 0, "negativeRegularScore": 0, "negativeScore": 0, "positiveScore": 0, "score": 0, "grade": "", "month_number_label": "2020-04", "date_label": "2020-04-27", "week_number_label": "2020W18", "week_start_label": "2020-04-27"}, {"date": 20200428, "state": "OR", "positive": 2354, "probableCases": null, "negative": 48844, "pending": null, "totalTestResultsSource": "totalTestsViral", "totalTestResults": 64418, "hospitalizedCurrently": 249, "hospitalizedCumulative": 554, "inIcuCurrently": 71, "inIcuCumulative": null, "onVentilatorCurrently": 31, "onVentilatorCumulative": null, "recovered": null, "dataQualityGrade": "B", "lastUpdateEt": "4/27/2020 11:00", "dateModified": "2020-04-27T11:00:00Z", "checkTimeEt": "04/27 07:00", "death": 92, "hospitalized": 554, "dateChecked": "2020-04-27T11:00:00Z", "totalTestsViral": 64418, "positiveTestsViral": 6711, "negativeTestsViral": 57707, "positiveCasesViral": null, "deathConfirmed": null, "deathProbable": null, "totalTestEncountersViral": null, "totalTestsPeopleViral": null, "totalTestsAntibody": null, "positiveTestsAntibody": null, "negativeTestsAntibody": null, "totalTestsPeopleAntibody": null, "positiveTestsPeopleAntibody": null, "negativeTestsPeopleAntibody": null, "totalTestsPeopleAntigen": null, "positiveTestsPeopleAntigen": null, "totalTestsAntigen": null, "positiveTestsAntigen": null, "fips": "41", "positiveIncrease": 0, "negativeIncrease": 0, "total": 51198, "totalTestResultsIncrease": 2629, "posNeg": 51198, "deathIncrease": 0, "hospitalizedIncrease": 0, "hash": "30f4eca4c87224c29d19ced22c06f3a742517cbc", "commercialScore": 0, "negativeRegularScore": 0, "negativeScore": 0, "positiveScore": 0, "score": 0, "grade": "", "month_number_label": "2020-04", "date_label": "2020-04-28", "week_number_label": "2020W18", "week_start_label": "2020-04-27"}, {"date": 20200429, "state": "OR", "positive": 2446, "probableCases": null, "negative": 52026, "pending": null, "totalTestResultsSource": "totalTestsViral", "totalTestResults": 68053, "hospitalizedCurrently": 227, "hospitalizedCumulative": 569, "inIcuCurrently": 56, "inIcuCumulative": null, "onVentilatorCurrently": 24, "onVentilatorCumulative": null, "recovered": null, "dataQualityGrade": "A", "lastUpdateEt": "4/29/2020 11:00", "dateModified": "2020-04-29T11:00:00Z", "checkTimeEt": "04/29 07:00", "death": 101, "hospitalized": 569, "dateChecked": "2020-04-29T11:00:00Z", "totalTestsViral": 68053, "positiveTestsViral": 6882, "negativeTestsViral": 61171, "positiveCasesViral": null, "deathConfirmed": null, "deathProbable": null, "totalTestEncountersViral": null, "totalTestsPeopleViral": null, "totalTestsAntibody": null, "positiveTestsAntibody": null, "negativeTestsAntibody": null, "totalTestsPeopleAntibody": null, "positiveTestsPeopleAntibody": null, "negativeTestsPeopleAntibody": null, "totalTestsPeopleAntigen": null, "positiveTestsPeopleAntigen": null, "totalTestsAntigen": null, "positiveTestsAntigen": null, "fips": "41", "positiveIncrease": 92, "negativeIncrease": 3182, "total": 54472, "totalTestResultsIncrease": 3635, "posNeg": 54472, "deathIncrease": 9, "hospitalizedIncrease": 15, "hash": "d3cb3b2d7ce825af4182cecde2e0795adf907bc4", "commercialScore": 0, "negativeRegularScore": 0, "negativeScore": 0, "positiveScore": 0, "score": 0, "grade": "", "month_number_label": "2020-04", "date_label": "2020-04-29", "week_number_label": "2020W18", "week_start_label": "2020-04-27"}, {"date": 20200430, "state": "OR", "positive": 2510, "probableCases": null, "negative": 53522, "pending": null, "totalTestResultsSource": "totalTestsViral", "totalTestResults": 70846, "hospitalizedCurrently": 243, "hospitalizedCumulative": 578, "inIcuCurrently": 65, "inIcuCumulative": null, "onVentilatorCurrently": 28, "onVentilatorCumulative": null, "recovered": null, "dataQualityGrade": "A", "lastUpdateEt": "4/30/2020 11:00", "dateModified": "2020-04-30T11:00:00Z", "checkTimeEt": "04/30 07:00", "death": 103, "hospitalized": 578, "dateChecked": "2020-04-30T11:00:00Z", "totalTestsViral": 70846, "positiveTestsViral": 7057, "negativeTestsViral": 63789, "positiveCasesViral": null, "deathConfirmed": null, "deathProbable": null, "totalTestEncountersViral": null, "totalTestsPeopleViral": null, "totalTestsAntibody": null, "positiveTestsAntibody": null, "negativeTestsAntibody": null, "totalTestsPeopleAntibody": null, "positiveTestsPeopleAntibody": null, "negativeTestsPeopleAntibody": null, "totalTestsPeopleAntigen": null, "positiveTestsPeopleAntigen": null, "totalTestsAntigen": null, "positiveTestsAntigen": null, "fips": "41", "positiveIncrease": 64, "negativeIncrease": 1496, "total": 56032, "totalTestResultsIncrease": 2793, "posNeg": 56032, "deathIncrease": 2, "hospitalizedIncrease": 9, "hash": "4933b4fda1058b8ecef7c531eb9f4f43af0abdda", "commercialScore": 0, "negativeRegularScore": 0, "negativeScore": 0, "positiveScore": 0, "score": 0, "grade": "", "month_number_label": "2020-04", "date_label": "2020-04-30", "week_number_label": "2020W18", "week_start_label": "2020-04-27"}, {"date": 20200501, "state": "OR", "positive": 2579, "probableCases": null, "negative": 55597, "pending": null, "totalTestResultsSource": "totalTestsViral", "totalTestResults": 74149, "hospitalizedCurrently": 208, "hospitalizedCumulative": 591, "inIcuCurrently": 49, "inIcuCumulative": null, "onVentilatorCurrently": 23, "onVentilatorCumulative": null, "recovered": null, "dataQualityGrade": "A", "lastUpdateEt": "5/1/2020 11:00", "dateModified": "2020-05-01T11:00:00Z", "checkTimeEt": "05/01 07:00", "death": 104, "hospitalized": 591, "dateChecked": "2020-05-01T11:00:00Z", "totalTestsViral": 74149, "positiveTestsViral": 7226, "negativeTestsViral": 66923, "positiveCasesViral": null, "deathConfirmed": null, "deathProbable": null, "totalTestEncountersViral": null, "totalTestsPeopleViral": null, "totalTestsAntibody": null, "positiveTestsAntibody": null, "negativeTestsAntibody": null, "totalTestsPeopleAntibody": null, "positiveTestsPeopleAntibody": null, "negativeTestsPeopleAntibody": null, "totalTestsPeopleAntigen": null, "positiveTestsPeopleAntigen": null, "totalTestsAntigen": null, "positiveTestsAntigen": null, "fips": "41", "positiveIncrease": 69, "negativeIncrease": 2075, "total": 58176, "totalTestResultsIncrease": 3303, "posNeg": 58176, "deathIncrease": 1, "hospitalizedIncrease": 13, "hash": "53dcc37595b40c991e76829e2556ffe44ea87a6c", "commercialScore": 0, "negativeRegularScore": 0, "negativeScore": 0, "positiveScore": 0, "score": 0, "grade": "", "month_number_label": "2020-05", "date_label": "2020-05-01", "week_number_label": "2020W18", "week_start_label": "2020-04-27"}, {"date": 20200502, "state": "OR", "positive": 2635, "probableCases": null, "negative": 57501, "pending": null, "totalTestResultsSource": "totalTestsViral", "totalTestResults": 77517, "hospitalizedCurrently": 209, "hospitalizedCumulative": 595, "inIcuCurrently": 50, "inIcuCumulative": null, "onVentilatorCurrently": 22, "onVentilatorCumulative": null, "recovered": null, "dataQualityGrade": "A", "lastUpdateEt": "5/2/2020 11:00", "dateModified": "2020-05-02T11:00:00Z", "checkTimeEt": "05/02 07:00", "death": 109, "hospitalized": 595, "dateChecked": "2020-05-02T11:00:00Z", "totalTestsViral": 77517, "positiveTestsViral": 7422, "negativeTestsViral": 70095, "positiveCasesViral": null, "deathConfirmed": null, "deathProbable": null, "totalTestEncountersViral": null, "totalTestsPeopleViral": null, "totalTestsAntibody": null, "positiveTestsAntibody": null, "negativeTestsAntibody": null, "totalTestsPeopleAntibody": null, "positiveTestsPeopleAntibody": null, "negativeTestsPeopleAntibody": null, "totalTestsPeopleAntigen": null, "positiveTestsPeopleAntigen": null, "totalTestsAntigen": null, "positiveTestsAntigen": null, "fips": "41", "positiveIncrease": 56, "negativeIncrease": 1904, "total": 60136, "totalTestResultsIncrease": 3368, "posNeg": 60136, "deathIncrease": 5, "hospitalizedIncrease": 4, "hash": "e8e0cfb716f05899084042d98f54cfe10c649f7e", "commercialScore": 0, "negativeRegularScore": 0, "negativeScore": 0, "positiveScore": 0, "score": 0, "grade": "", "month_number_label": "2020-05", "date_label": "2020-05-02", "week_number_label": "2020W18", "week_start_label": "2020-04-27"}, {"date": 20200503, "state": "OR", "positive": 2680, "probableCases": null, "negative": 59374, "pending": null, "totalTestResultsSource": "totalTestsViral", "totalTestResults": 81009, "hospitalizedCurrently": 205, "hospitalizedCumulative": 598, "inIcuCurrently": 46, "inIcuCumulative": null, "onVentilatorCurrently": 21, "onVentilatorCumulative": null, "recovered": 860, "dataQualityGrade": "A+", "lastUpdateEt": "5/3/2020 11:00", "dateModified": "2020-05-03T11:00:00Z", "checkTimeEt": "05/03 07:00", "death": 109, "hospitalized": 598, "dateChecked": "2020-05-03T11:00:00Z", "totalTestsViral": 81009, "positiveTestsViral": 7723, "negativeTestsViral": 73286, "positiveCasesViral": null, "deathConfirmed": null, "deathProbable": null, "totalTestEncountersViral": null, "totalTestsPeopleViral": null, "totalTestsAntibody": null, "positiveTestsAntibody": null, "negativeTestsAntibody": null, "totalTestsPeopleAntibody": null, "positiveTestsPeopleAntibody": null, "negativeTestsPeopleAntibody": null, "totalTestsPeopleAntigen": null, "positiveTestsPeopleAntigen": null, "totalTestsAntigen": null, "positiveTestsAntigen": null, "fips": "41", "positiveIncrease": 45, "negativeIncrease": 1873, "total": 62054, "totalTestResultsIncrease": 3492, "posNeg": 62054, "deathIncrease": 0, "hospitalizedIncrease": 3, "hash": "402c7676c7d1611bd16e02a0509bbc0c88a6e5cd", "commercialScore": 0, "negativeRegularScore": 0, "negativeScore": 0, "positiveScore": 0, "score": 0, "grade": "", "month_number_label": "2020-05", "date_label": "2020-05-03", "week_number_label": "2020W18", "week_start_label": "2020-04-27"}, {"date": 20200504, "state": "OR", "positive": 2759, "probableCases": 14, "negative": 60698, "pending": null, "totalTestResultsSource": "totalTestsViral", "totalTestResults": 83706, "hospitalizedCurrently": 207, "hospitalizedCumulative": 608, "inIcuCurrently": 41, "inIcuCumulative": null, "onVentilatorCurrently": 17, "onVentilatorCumulative": null, "recovered": 860, "dataQualityGrade": "A+", "lastUpdateEt": "5/4/2020 11:00", "dateModified": "2020-05-04T11:00:00Z", "checkTimeEt": "05/04 07:00", "death": 109, "hospitalized": 608, "dateChecked": "2020-05-04T11:00:00Z", "totalTestsViral": 83706, "positiveTestsViral": 7855, "negativeTestsViral": 75851, "positiveCasesViral": 2745, "deathConfirmed": null, "deathProbable": null, "totalTestEncountersViral": null, "totalTestsPeopleViral": null, "totalTestsAntibody": null, "positiveTestsAntibody": null, "negativeTestsAntibody": null, "totalTestsPeopleAntibody": null, "positiveTestsPeopleAntibody": null, "negativeTestsPeopleAntibody": null, "totalTestsPeopleAntigen": null, "positiveTestsPeopleAntigen": null, "totalTestsAntigen": null, "positiveTestsAntigen": null, "fips": "41", "positiveIncrease": 79, "negativeIncrease": 1324, "total": 63457, "totalTestResultsIncrease": 2697, "posNeg": 63457, "deathIncrease": 0, "hospitalizedIncrease": 10, "hash": "a8c3e4e3ed47dbdc1cc26b25223824088279fdd6", "commercialScore": 0, "negativeRegularScore": 0, "negativeScore": 0, "positiveScore": 0, "score": 0, "grade": "", "month_number_label": "2020-05", "date_label": "2020-05-04", "week_number_label": "2020W19", "week_start_label": "2020-05-04"}, {"date": 20200505, "state": "OR", "positive": 2839, "probableCases": 22, "negative": 62585, "pending": null, "totalTestResultsSource": "totalTestsViral", "totalTestResults": 86610, "hospitalizedCurrently": 219, "hospitalizedCumulative": 622, "inIcuCurrently": 49, "inIcuCumulative": null, "onVentilatorCurrently": 25, "onVentilatorCumulative": null, "recovered": 860, "dataQualityGrade": "A+", "lastUpdateEt": "5/5/2020 11:00", "dateModified": "2020-05-05T11:00:00Z", "checkTimeEt": "05/05 07:00", "death": 113, "hospitalized": 622, "dateChecked": "2020-05-05T11:00:00Z", "totalTestsViral": 86610, "positiveTestsViral": 7940, "negativeTestsViral": 78670, "positiveCasesViral": 2817, "deathConfirmed": null, "deathProbable": null, "totalTestEncountersViral": null, "totalTestsPeopleViral": null, "totalTestsAntibody": null, "positiveTestsAntibody": null, "negativeTestsAntibody": null, "totalTestsPeopleAntibody": null, "positiveTestsPeopleAntibody": null, "negativeTestsPeopleAntibody": null, "totalTestsPeopleAntigen": null, "positiveTestsPeopleAntigen": null, "totalTestsAntigen": null, "positiveTestsAntigen": null, "fips": "41", "positiveIncrease": 80, "negativeIncrease": 1887, "total": 65424, "totalTestResultsIncrease": 2904, "posNeg": 65424, "deathIncrease": 4, "hospitalizedIncrease": 14, "hash": "5a3cbd9f952ff2242c3174bf6a70a228846f37e6", "commercialScore": 0, "negativeRegularScore": 0, "negativeScore": 0, "positiveScore": 0, "score": 0, "grade": "", "month_number_label": "2020-05", "date_label": "2020-05-05", "week_number_label": "2020W19", "week_start_label": "2020-05-04"}, {"date": 20200506, "state": "OR", "positive": 2916, "probableCases": 29, "negative": 65060, "pending": null, "totalTestResultsSource": "totalTestsViral", "totalTestResults": 89702, "hospitalizedCurrently": 191, "hospitalizedCumulative": 641, "inIcuCurrently": 47, "inIcuCumulative": null, "onVentilatorCurrently": 20, "onVentilat