[{"date": 20200302, "state": "NY", "positive": 0, "probableCases": null, "negative": null, "pending": null, "totalTestResultsSource": "totalTestEncountersViral", "totalTestResults": 0, "hospitalizedCurrently": null, "hospitalizedCumulative": null, "inIcuCurrently": null, "inIcuCumulative": null, "onVentilatorCurrently": null, "onVentilatorCumulative": null, "recovered": null, "dataQualityGrade": null, "lastUpdateEt": null, "dateModified": null, "checkTimeEt": null, "death": null, "hospitalized": null, "dateChecked": null, "totalTestsViral": null, "positiveTestsViral": null, "negativeTestsViral": null, "positiveCasesViral": 0, "deathConfirmed": null, "deathProbable": null, "totalTestEncountersViral": 0, "totalTestsPeopleViral": null, "totalTestsAntibody": null, "positiveTestsAntibody": null, "negativeTestsAntibody": null, "totalTestsPeopleAntibody": null, "positiveTestsPeopleAntibody": null, "negativeTestsPeopleAntibody": null, "totalTestsPeopleAntigen": null, "positiveTestsPeopleAntigen": null, "totalTestsAntigen": null, "positiveTestsAntigen": null, "fips": "36", "positiveIncrease": 0, "negativeIncrease": 0, "total": 0, "totalTestResultsIncrease": 0, "posNeg": 0, "deathIncrease": 0, "hospitalizedIncrease": 0, "hash": "55af911bc063efc92d8c7f505dc81bd475142aa0", "commercialScore": 0, "negativeRegularScore": 0, "negativeScore": 0, "positiveScore": 0, "score": 0, "grade": "", "month_number_label": "2020-03", "date_label": "2020-03-02", "week_number_label": "2020W10", "week_start_label": "2020-03-02"}, {"date": 20200303, "state": "NY", "positive": 1, "probableCases": null, "negative": 0, "pending": null, "totalTestResultsSource": "totalTestEncountersViral", "totalTestResults": 1, "hospitalizedCurrently": null, "hospitalizedCumulative": null, "inIcuCurrently": null, "inIcuCumulative": null, "onVentilatorCurrently": null, "onVentilatorCumulative": null, "recovered": null, "dataQualityGrade": null, "lastUpdateEt": null, "dateModified": null, "checkTimeEt": null, "death": null, "hospitalized": null, "dateChecked": null, "totalTestsViral": null, "positiveTestsViral": null, "negativeTestsViral": null, "positiveCasesViral": 1, "deathConfirmed": null, "deathProbable": null, "totalTestEncountersViral": 1, "totalTestsPeopleViral": null, "totalTestsAntibody": null, "positiveTestsAntibody": null, "negativeTestsAntibody": null, "totalTestsPeopleAntibody": null, "positiveTestsPeopleAntibody": null, "negativeTestsPeopleAntibody": null, "totalTestsPeopleAntigen": null, "positiveTestsPeopleAntigen": null, "totalTestsAntigen": null, "positiveTestsAntigen": null, "fips": "36", "positiveIncrease": 1, "negativeIncrease": 0, "total": 1, "totalTestResultsIncrease": 1, "posNeg": 1, "deathIncrease": 0, "hospitalizedIncrease": 0, "hash": "56f6375d726af450918f35a0af71d690f00cd22e", "commercialScore": 0, "negativeRegularScore": 0, "negativeScore": 0, "positiveScore": 0, "score": 0, "grade": "", "month_number_label": "2020-03", "date_label": "2020-03-03", "week_number_label": "2020W10", "week_start_label": "2020-03-02"}, {"date": 20200304, "state": "NY", "positive": 1, "probableCases": null, "negative": 9, "pending": 24, "totalTestResultsSource": "totalTestEncountersViral", "totalTestResults": 10, "hospitalizedCurrently": null, "hospitalizedCumulative": null, "inIcuCurrently": null, "inIcuCumulative": null, "onVentilatorCurrently": null, "onVentilatorCumulative": null, "recovered": null, "dataQualityGrade": null, "lastUpdateEt": null, "dateModified": null, "checkTimeEt": null, "death": null, "hospitalized": null, "dateChecked": null, "totalTestsViral": null, "positiveTestsViral": null, "negativeTestsViral": null, "positiveCasesViral": 1, "deathConfirmed": 0, "deathProbable": null, "totalTestEncountersViral": 10, "totalTestsPeopleViral": null, "totalTestsAntibody": null, "positiveTestsAntibody": null, "negativeTestsAntibody": null, "totalTestsPeopleAntibody": null, "positiveTestsPeopleAntibody": null, "negativeTestsPeopleAntibody": null, "totalTestsPeopleAntigen": null, "positiveTestsPeopleAntigen": null, "totalTestsAntigen": null, "positiveTestsAntigen": null, "fips": "36", "positiveIncrease": 0, "negativeIncrease": 9, "total": 34, "totalTestResultsIncrease": 9, "posNeg": 10, "deathIncrease": 0, "hospitalizedIncrease": 0, "hash": "c89eb28873a5f533c6c692adff3518c87b729e3e", "commercialScore": 0, "negativeRegularScore": 0, "negativeScore": 0, "positiveScore": 0, "score": 0, "grade": "", "month_number_label": "2020-03", "date_label": "2020-03-04", "week_number_label": "2020W10", "week_start_label": "2020-03-02"}, {"date": 20200305, "state": "NY", "positive": 3, "probableCases": null, "negative": 27, "pending": 24, "totalTestResultsSource": "totalTestEncountersViral", "totalTestResults": 30, "hospitalizedCurrently": null, "hospitalizedCumulative": null, "inIcuCurrently": null, "inIcuCumulative": null, "onVentilatorCurrently": null, "onVentilatorCumulative": null, "recovered": null, "dataQualityGrade": null, "lastUpdateEt": null, "dateModified": null, "checkTimeEt": null, "death": null, "hospitalized": null, "dateChecked": null, "totalTestsViral": null, "positiveTestsViral": null, "negativeTestsViral": null, "positiveCasesViral": 3, "deathConfirmed": null, "deathProbable": null, "totalTestEncountersViral": 30, "totalTestsPeopleViral": null, "totalTestsAntibody": null, "positiveTestsAntibody": null, "negativeTestsAntibody": null, "totalTestsPeopleAntibody": null, "positiveTestsPeopleAntibody": null, "negativeTestsPeopleAntibody": null, "totalTestsPeopleAntigen": null, "positiveTestsPeopleAntigen": null, "totalTestsAntigen": null, "positiveTestsAntigen": null, "fips": "36", "positiveIncrease": 2, "negativeIncrease": 18, "total": 54, "totalTestResultsIncrease": 20, "posNeg": 30, "deathIncrease": 0, "hospitalizedIncrease": 0, "hash": "74d4e4cfe0745e431467de2e6ce6a622d238952a", "commercialScore": 0, "negativeRegularScore": 0, "negativeScore": 0, "positiveScore": 0, "score": 0, "grade": "", "month_number_label": "2020-03", "date_label": "2020-03-05", "week_number_label": "2020W10", "week_start_label": "2020-03-02"}, {"date": 20200306, "state": "NY", "positive": 25, "probableCases": null, "negative": 97, "pending": 236, "totalTestResultsSource": "totalTestEncountersViral", "totalTestResults": 122, "hospitalizedCurrently": null, "hospitalizedCumulative": null, "inIcuCurrently": null, "inIcuCumulative": null, "onVentilatorCurrently": null, "onVentilatorCumulative": null, "recovered": null, "dataQualityGrade": null, "lastUpdateEt": null, "dateModified": null, "checkTimeEt": null, "death": null, "hospitalized": null, "dateChecked": null, "totalTestsViral": null, "positiveTestsViral": null, "negativeTestsViral": null, "positiveCasesViral": 25, "deathConfirmed": null, "deathProbable": null, "totalTestEncountersViral": 122, "totalTestsPeopleViral": null, "totalTestsAntibody": null, "positiveTestsAntibody": null, "negativeTestsAntibody": null, "totalTestsPeopleAntibody": null, "positiveTestsPeopleAntibody": null, "negativeTestsPeopleAntibody": null, "totalTestsPeopleAntigen": null, "positiveTestsPeopleAntigen": null, "totalTestsAntigen": null, "positiveTestsAntigen": null, "fips": "36", "positiveIncrease": 22, "negativeIncrease": 70, "total": 358, "totalTestResultsIncrease": 92, "posNeg": 122, "deathIncrease": 0, "hospitalizedIncrease": 0, "hash": "d240e8e71094ce27b7d103312b14e772aacac556", "commercialScore": 0, "negativeRegularScore": 0, "negativeScore": 0, "positiveScore": 0, "score": 0, "grade": "", "month_number_label": "2020-03", "date_label": "2020-03-06", "week_number_label": "2020W10", "week_start_label": "2020-03-02"}, {"date": 20200307, "state": "NY", "positive": 36, "probableCases": null, "negative": 152, "pending": 236, "totalTestResultsSource": "totalTestEncountersViral", "totalTestResults": 188, "hospitalizedCurrently": null, "hospitalizedCumulative": null, "inIcuCurrently": null, "inIcuCumulative": null, "onVentilatorCurrently": null, "onVentilatorCumulative": null, "recovered": null, "dataQualityGrade": null, "lastUpdateEt": null, "dateModified": null, "checkTimeEt": null, "death": null, "hospitalized": null, "dateChecked": null, "totalTestsViral": null, "positiveTestsViral": null, "negativeTestsViral": null, "positiveCasesViral": 36, "deathConfirmed": null, "deathProbable": null, "totalTestEncountersViral": 188, "totalTestsPeopleViral": null, "totalTestsAntibody": null, "positiveTestsAntibody": null, "negativeTestsAntibody": null, "totalTestsPeopleAntibody": null, "positiveTestsPeopleAntibody": null, "negativeTestsPeopleAntibody": null, "totalTestsPeopleAntigen": null, "positiveTestsPeopleAntigen": null, "totalTestsAntigen": null, "positiveTestsAntigen": null, "fips": "36", "positiveIncrease": 11, "negativeIncrease": 55, "total": 424, "totalTestResultsIncrease": 66, "posNeg": 188, "deathIncrease": 0, "hospitalizedIncrease": 0, "hash": "57832d89fd1b09775d42773008efe806821611ad", "commercialScore": 0, "negativeRegularScore": 0, "negativeScore": 0, "positiveScore": 0, "score": 0, "grade": "", "month_number_label": "2020-03", "date_label": "2020-03-07", "week_number_label": "2020W10", "week_start_label": "2020-03-02"}, {"date": 20200308, "state": "NY", "positive": 60, "probableCases": null, "negative": 328, "pending": null, "totalTestResultsSource": "totalTestEncountersViral", "totalTestResults": 388, "hospitalizedCurrently": null, "hospitalizedCumulative": null, "inIcuCurrently": null, "inIcuCumulative": null, "onVentilatorCurrently": null, "onVentilatorCumulative": null, "recovered": null, "dataQualityGrade": null, "lastUpdateEt": null, "dateModified": null, "checkTimeEt": null, "death": null, "hospitalized": null, "dateChecked": null, "totalTestsViral": null, "positiveTestsViral": null, "negativeTestsViral": null, "positiveCasesViral": 60, "deathConfirmed": null, "deathProbable": null, "totalTestEncountersViral": 388, "totalTestsPeopleViral": null, "totalTestsAntibody": null, "positiveTestsAntibody": null, "negativeTestsAntibody": null, "totalTestsPeopleAntibody": null, "positiveTestsPeopleAntibody": null, "negativeTestsPeopleAntibody": null, "totalTestsPeopleAntigen": null, "positiveTestsPeopleAntigen": null, "totalTestsAntigen": null, "positiveTestsAntigen": null, "fips": "36", "positiveIncrease": 24, "negativeIncrease": 176, "total": 388, "totalTestResultsIncrease": 200, "posNeg": 388, "deathIncrease": 0, "hospitalizedIncrease": 0, "hash": "9c6deec3edfb61bdcba14cdcca47af0c8a134d88", "commercialScore": 0, "negativeRegularScore": 0, "negativeScore": 0, "positiveScore": 0, "score": 0, "grade": "", "month_number_label": "2020-03", "date_label": "2020-03-08", "week_number_label": "2020W10", "week_start_label": "2020-03-02"}, {"date": 20200309, "state": "NY", "positive": 88, "probableCases": null, "negative": 607, "pending": null, "totalTestResultsSource": "totalTestEncountersViral", "totalTestResults": 695, "hospitalizedCurrently": null, "hospitalizedCumulative": null, "inIcuCurrently": null, "inIcuCumulative": null, "onVentilatorCurrently": null, "onVentilatorCumulative": null, "recovered": null, "dataQualityGrade": null, "lastUpdateEt": null, "dateModified": null, "checkTimeEt": null, "death": null, "hospitalized": null, "dateChecked": null, "totalTestsViral": null, "positiveTestsViral": null, "negativeTestsViral": null, "positiveCasesViral": 88, "deathConfirmed": null, "deathProbable": null, "totalTestEncountersViral": 695, "totalTestsPeopleViral": null, "totalTestsAntibody": null, "positiveTestsAntibody": null, "negativeTestsAntibody": null, "totalTestsPeopleAntibody": null, "positiveTestsPeopleAntibody": null, "negativeTestsPeopleAntibody": null, "totalTestsPeopleAntigen": null, "positiveTestsPeopleAntigen": null, "totalTestsAntigen": null, "positiveTestsAntigen": null, "fips": "36", "positiveIncrease": 28, "negativeIncrease": 279, "total": 695, "totalTestResultsIncrease": 307, "posNeg": 695, "deathIncrease": 0, "hospitalizedIncrease": 0, "hash": "b2dd28bc8014277034e74c520037b0587fa24937", "commercialScore": 0, "negativeRegularScore": 0, "negativeScore": 0, "positiveScore": 0, "score": 0, "grade": "", "month_number_label": "2020-03", "date_label": "2020-03-09", "week_number_label": "2020W11", "week_start_label": "2020-03-09"}, {"date": 20200310, "state": "NY", "positive": 151, "probableCases": null, "negative": 945, "pending": null, "totalTestResultsSource": "totalTestEncountersViral", "totalTestResults": 1096, "hospitalizedCurrently": null, "hospitalizedCumulative": null, "inIcuCurrently": null, "inIcuCumulative": null, "onVentilatorCurrently": null, "onVentilatorCumulative": null, "recovered": null, "dataQualityGrade": null, "lastUpdateEt": null, "dateModified": null, "checkTimeEt": null, "death": null, "hospitalized": null, "dateChecked": null, "totalTestsViral": null, "positiveTestsViral": null, "negativeTestsViral": null, "positiveCasesViral": 151, "deathConfirmed": null, "deathProbable": null, "totalTestEncountersViral": 1096, "totalTestsPeopleViral": null, "totalTestsAntibody": null, "positiveTestsAntibody": null, "negativeTestsAntibody": null, "totalTestsPeopleAntibody": null, "positiveTestsPeopleAntibody": null, "negativeTestsPeopleAntibody": null, "totalTestsPeopleAntigen": null, "positiveTestsPeopleAntigen": null, "totalTestsAntigen": null, "positiveTestsAntigen": null, "fips": "36", "positiveIncrease": 63, "negativeIncrease": 338, "total": 1096, "totalTestResultsIncrease": 401, "posNeg": 1096, "deathIncrease": 0, "hospitalizedIncrease": 0, "hash": "9c7e326bb0e9add20074c050494d234c8d71913f", "commercialScore": 0, "negativeRegularScore": 0, "negativeScore": 0, "positiveScore": 0, "score": 0, "grade": "", "month_number_label": "2020-03", "date_label": "2020-03-10", "week_number_label": "2020W11", "week_start_label": "2020-03-09"}, {"date": 20200311, "state": "NY", "positive": 195, "probableCases": null, "negative": 1326, "pending": null, "totalTestResultsSource": "totalTestEncountersViral", "totalTestResults": 1521, "hospitalizedCurrently": null, "hospitalizedCumulative": null, "inIcuCurrently": null, "inIcuCumulative": null, "onVentilatorCurrently": null, "onVentilatorCumulative": null, "recovered": null, "dataQualityGrade": null, "lastUpdateEt": null, "dateModified": null, "checkTimeEt": null, "death": null, "hospitalized": null, "dateChecked": null, "totalTestsViral": null, "positiveTestsViral": null, "negativeTestsViral": null, "positiveCasesViral": 195, "deathConfirmed": null, "deathProbable": null, "totalTestEncountersViral": 1521, "totalTestsPeopleViral": null, "totalTestsAntibody": null, "positiveTestsAntibody": null, "negativeTestsAntibody": null, "totalTestsPeopleAntibody": null, "positiveTestsPeopleAntibody": null, "negativeTestsPeopleAntibody": null, "totalTestsPeopleAntigen": null, "positiveTestsPeopleAntigen": null, "totalTestsAntigen": null, "positiveTestsAntigen": null, "fips": "36", "positiveIncrease": 44, "negativeIncrease": 381, "total": 1521, "totalTestResultsIncrease": 425, "posNeg": 1521, "deathIncrease": 0, "hospitalizedIncrease": 0, "hash": "8a0c48be1b791eb0f5ec686a11592610a9cc8c48", "commercialScore": 0, "negativeRegularScore": 0, "negativeScore": 0, "positiveScore": 0, "score": 0, "grade": "", "month_number_label": "2020-03", "date_label": "2020-03-11", "week_number_label": "2020W11", "week_start_label": "2020-03-09"}, {"date": 20200312, "state": "NY", "positive": 251, "probableCases": null, "negative": 1823, "pending": null, "totalTestResultsSource": "totalTestEncountersViral", "totalTestResults": 2074, "hospitalizedCurrently": null, "hospitalizedCumulative": null, "inIcuCurrently": null, "inIcuCumulative": null, "onVentilatorCurrently": null, "onVentilatorCumulative": null, "recovered": null, "dataQualityGrade": null, "lastUpdateEt": "3/11/2020 16:00", "dateModified": "2020-03-11T16:00:00Z", "checkTimeEt": "03/11 12:00", "death": null, "hospitalized": null, "dateChecked": "2020-03-11T16:00:00Z", "totalTestsViral": null, "positiveTestsViral": null, "negativeTestsViral": null, "positiveCasesViral": 251, "deathConfirmed": null, "deathProbable": null, "totalTestEncountersViral": 2074, "totalTestsPeopleViral": null, "totalTestsAntibody": null, "positiveTestsAntibody": null, "negativeTestsAntibody": null, "totalTestsPeopleAntibody": null, "positiveTestsPeopleAntibody": null, "negativeTestsPeopleAntibody": null, "totalTestsPeopleAntigen": null, "positiveTestsPeopleAntigen": null, "totalTestsAntigen": null, "positiveTestsAntigen": null, "fips": "36", "positiveIncrease": 56, "negativeIncrease": 497, "total": 2074, "totalTestResultsIncrease": 553, "posNeg": 2074, "deathIncrease": 0, "hospitalizedIncrease": 0, "hash": "f39e271ccd84bfde1d17fb36221f0214708ad449", "commercialScore": 0, "negativeRegularScore": 0, "negativeScore": 0, "positiveScore": 0, "score": 0, "grade": "", "month_number_label": "2020-03", "date_label": "2020-03-12", "week_number_label": "2020W11", "week_start_label": "2020-03-09"}, {"date": 20200313, "state": "NY", "positive": 353, "probableCases": null, "negative": 2483, "pending": null, "totalTestResultsSource": "totalTestEncountersViral", "totalTestResults": 2836, "hospitalizedCurrently": null, "hospitalizedCumulative": null, "inIcuCurrently": null, "inIcuCumulative": null, "onVentilatorCurrently": null, "onVentilatorCumulative": null, "recovered": null, "dataQualityGrade": null, "lastUpdateEt": "3/12/2020 16:00", "dateModified": "2020-03-12T16:00:00Z", "checkTimeEt": "03/12 12:00", "death": null, "hospitalized": null, "dateChecked": "2020-03-12T16:00:00Z", "totalTestsViral": null, "positiveTestsViral": null, "negativeTestsViral": null, "positiveCasesViral": 353, "deathConfirmed": null, "deathProbable": null, "totalTestEncountersViral": 2836, "totalTestsPeopleViral": null, "totalTestsAntibody": null, "positiveTestsAntibody": null, "negativeTestsAntibody": null, "totalTestsPeopleAntibody": null, "positiveTestsPeopleAntibody": null, "negativeTestsPeopleAntibody": null, "totalTestsPeopleAntigen": null, "positiveTestsPeopleAntigen": null, "totalTestsAntigen": null, "positiveTestsAntigen": null, "fips": "36", "positiveIncrease": 102, "negativeIncrease": 660, "total": 2836, "totalTestResultsIncrease": 762, "posNeg": 2836, "deathIncrease": 0, "hospitalizedIncrease": 0, "hash": "6306ce72e12d425f2e20e5832ea724ceffb7c7b0", "commercialScore": 0, "negativeRegularScore": 0, "negativeScore": 0, "positiveScore": 0, "score": 0, "grade": "", "month_number_label": "2020-03", "date_label": "2020-03-13", "week_number_label": "2020W11", "week_start_label": "2020-03-09"}, {"date": 20200314, "state": "NY", "positive": 517, "probableCases": null, "negative": 3609, "pending": null, "totalTestResultsSource": "totalTestEncountersViral", "totalTestResults": 4126, "hospitalizedCurrently": null, "hospitalizedCumulative": null, "inIcuCurrently": null, "inIcuCumulative": null, "onVentilatorCurrently": null, "onVentilatorCumulative": null, "recovered": null, "dataQualityGrade": null, "lastUpdateEt": "3/14/2020 12:30", "dateModified": "2020-03-14T12:30:00Z", "checkTimeEt": "03/14 08:30", "death": null, "hospitalized": null, "dateChecked": "2020-03-14T12:30:00Z", "totalTestsViral": null, "positiveTestsViral": null, "negativeTestsViral": null, "positiveCasesViral": 517, "deathConfirmed": null, "deathProbable": null, "totalTestEncountersViral": 4126, "totalTestsPeopleViral": null, "totalTestsAntibody": null, "positiveTestsAntibody": null, "negativeTestsAntibody": null, "totalTestsPeopleAntibody": null, "positiveTestsPeopleAntibody": null, "negativeTestsPeopleAntibody": null, "totalTestsPeopleAntigen": null, "positiveTestsPeopleAntigen": null, "totalTestsAntigen": null, "positiveTestsAntigen": null, "fips": "36", "positiveIncrease": 164, "negativeIncrease": 1126, "total": 4126, "totalTestResultsIncrease": 1290, "posNeg": 4126, "deathIncrease": 0, "hospitalizedIncrease": 0, "hash": "353d9d3ac77f0533843246329e4cdf81a81769c8", "commercialScore": 0, "negativeRegularScore": 0, "negativeScore": 0, "positiveScore": 0, "score": 0, "grade": "", "month_number_label": "2020-03", "date_label": "2020-03-14", "week_number_label": "2020W11", "week_start_label": "2020-03-09"}, {"date": 20200315, "state": "NY", "positive": 648, "probableCases": null, "negative": 4771, "pending": null, "totalTestResultsSource": "totalTestEncountersViral", "totalTestResults": 5419, "hospitalizedCurrently": null, "hospitalizedCumulative": null, "inIcuCurrently": null, "inIcuCumulative": null, "onVentilatorCurrently": null, "onVentilatorCumulative": null, "recovered": null, "dataQualityGrade": null, "lastUpdateEt": "3/15/2020 00:00", "dateModified": "2020-03-15T00:00:00Z", "checkTimeEt": "03/14 20:00", "death": 3, "hospitalized": null, "dateChecked": "2020-03-15T00:00:00Z", "totalTestsViral": null, "positiveTestsViral": null, "negativeTestsViral": null, "positiveCasesViral": 648, "deathConfirmed": null, "deathProbable": null, "totalTestEncountersViral": 5419, "totalTestsPeopleViral": null, "totalTestsAntibody": null, "positiveTestsAntibody": null, "negativeTestsAntibody": null, "totalTestsPeopleAntibody": null, "positiveTestsPeopleAntibody": null, "negativeTestsPeopleAntibody": null, "totalTestsPeopleAntigen": null, "positiveTestsPeopleAntigen": null, "totalTestsAntigen": null, "positiveTestsAntigen": null, "fips": "36", "positiveIncrease": 131, "negativeIncrease": 1162, "total": 5419, "totalTestResultsIncrease": 1293, "posNeg": 5419, "deathIncrease": 3, "hospitalizedIncrease": 0, "hash": "e2c4ee40fa189de1e92006645d0741cee325f230", "commercialScore": 0, "negativeRegularScore": 0, "negativeScore": 0, "positiveScore": 0, "score": 0, "grade": "", "month_number_label": "2020-03", "date_label": "2020-03-15", "week_number_label": "2020W11", "week_start_label": "2020-03-09"}, {"date": 20200316, "state": "NY", "positive": 942, "probableCases": null, "negative": 6413, "pending": null, "totalTestResultsSource": "totalTestEncountersViral", "totalTestResults": 7355, "hospitalizedCurrently": null, "hospitalizedCumulative": null, "inIcuCurrently": null, "inIcuCumulative": null, "onVentilatorCurrently": null, "onVentilatorCumulative": null, "recovered": null, "dataQualityGrade": null, "lastUpdateEt": "3/16/2020 16:22", "dateModified": "2020-03-16T16:22:00Z", "checkTimeEt": "03/16 12:22", "death": 7, "hospitalized": null, "dateChecked": "2020-03-16T16:22:00Z", "totalTestsViral": null, "positiveTestsViral": null, "negativeTestsViral": null, "positiveCasesViral": 942, "deathConfirmed": null, "deathProbable": null, "totalTestEncountersViral": 7355, "totalTestsPeopleViral": null, "totalTestsAntibody": null, "positiveTestsAntibody": null, "negativeTestsAntibody": null, "totalTestsPeopleAntibody": null, "positiveTestsPeopleAntibody": null, "negativeTestsPeopleAntibody": null, "totalTestsPeopleAntigen": null, "positiveTestsPeopleAntigen": null, "totalTestsAntigen": null, "positiveTestsAntigen": null, "fips": "36", "positiveIncrease": 294, "negativeIncrease": 1642, "total": 7355, "totalTestResultsIncrease": 1936, "posNeg": 7355, "deathIncrease": 4, "hospitalizedIncrease": 0, "hash": "f8692763b75155e591d5f6bd7e43353970aceafb", "commercialScore": 0, "negativeRegularScore": 0, "negativeScore": 0, "positiveScore": 0, "score": 0, "grade": "", "month_number_label": "2020-03", "date_label": "2020-03-16", "week_number_label": "2020W12", "week_start_label": "2020-03-16"}, {"date": 20200317, "state": "NY", "positive": 1374, "probableCases": null, "negative": 8888, "pending": null, "totalTestResultsSource": "totalTestEncountersViral", "totalTestResults": 10262, "hospitalizedCurrently": 325, "hospitalizedCumulative": null, "inIcuCurrently": null, "inIcuCumulative": null, "onVentilatorCurrently": null, "onVentilatorCumulative": null, "recovered": null, "dataQualityGrade": null, "lastUpdateEt": "3/16/2020 15:00", "dateModified": "2020-03-16T15:00:00Z", "checkTimeEt": "03/16 11:00", "death": 7, "hospitalized": null, "dateChecked": "2020-03-16T15:00:00Z", "totalTestsViral": null, "positiveTestsViral": null, "negativeTestsViral": null, "positiveCasesViral": 1374, "deathConfirmed": null, "deathProbable": null, "totalTestEncountersViral": 10262, "totalTestsPeopleViral": null, "totalTestsAntibody": null, "positiveTestsAntibody": null, "negativeTestsAntibody": null, "totalTestsPeopleAntibody": null, "positiveTestsPeopleAntibody": null, "negativeTestsPeopleAntibody": null, "totalTestsPeopleAntigen": null, "positiveTestsPeopleAntigen": null, "totalTestsAntigen": null, "positiveTestsAntigen": null, "fips": "36", "positiveIncrease": 432, "negativeIncrease": 2475, "total": 10262, "totalTestResultsIncrease": 2907, "posNeg": 10262, "deathIncrease": 0, "hospitalizedIncrease": 0, "hash": "e6c8a38b18a0c6085a0f4e2d023dd97c88db1655", "commercialScore": 0, "negativeRegularScore": 0, "negativeScore": 0, "positiveScore": 0, "score": 0, "grade": "", "month_number_label": "2020-03", "date_label": "2020-03-17", "week_number_label": "2020W12", "week_start_label": "2020-03-16"}, {"date": 20200318, "state": "NY", "positive": 2383, "probableCases": null, "negative": 12432, "pending": null, "totalTestResultsSource": "totalTestEncountersViral", "totalTestResults": 14815, "hospitalizedCurrently": 416, "hospitalizedCumulative": null, "inIcuCurrently": null, "inIcuCumulative": null, "onVentilatorCurrently": null, "onVentilatorCumulative": null, "recovered": null, "dataQualityGrade": null, "lastUpdateEt": "3/18/2020 15:05", "dateModified": "2020-03-18T15:05:00Z", "checkTimeEt": "03/18 11:05", "death": 12, "hospitalized": null, "dateChecked": "2020-03-18T15:05:00Z", "totalTestsViral": null, "positiveTestsViral": null, "negativeTestsViral": null, "positiveCasesViral": 2383, "deathConfirmed": null, "deathProbable": null, "totalTestEncountersViral": 14815, "totalTestsPeopleViral": null, "totalTestsAntibody": null, "positiveTestsAntibody": null, "negativeTestsAntibody": null, "totalTestsPeopleAntibody": null, "positiveTestsPeopleAntibody": null, "negativeTestsPeopleAntibody": null, "totalTestsPeopleAntigen": null, "positiveTestsPeopleAntigen": null, "totalTestsAntigen": null, "positiveTestsAntigen": null, "fips": "36", "positiveIncrease": 1009, "negativeIncrease": 3544, "total": 14815, "totalTestResultsIncrease": 4553, "posNeg": 14815, "deathIncrease": 5, "hospitalizedIncrease": 0, "hash": "29437af321f85278f92f5b85efcde6d9fe209ea8", "commercialScore": 0, "negativeRegularScore": 0, "negativeScore": 0, "positiveScore": 0, "score": 0, "grade": "", "month_number_label": "2020-03", "date_label": "2020-03-18", "week_number_label": "2020W12", "week_start_label": "2020-03-16"}, {"date": 20200319, "state": "NY", "positive": 4152, "probableCases": null, "negative": 18361, "pending": null, "totalTestResultsSource": "totalTestEncountersViral", "totalTestResults": 22513, "hospitalizedCurrently": 617, "hospitalizedCumulative": null, "inIcuCurrently": null, "inIcuCumulative": null, "onVentilatorCurrently": null, "onVentilatorCumulative": null, "recovered": null, "dataQualityGrade": null, "lastUpdateEt": "3/19/2020 13:20", "dateModified": "2020-03-19T13:20:00Z", "checkTimeEt": "03/19 09:20", "death": 12, "hospitalized": null, "dateChecked": "2020-03-19T13:20:00Z", "totalTestsViral": null, "positiveTestsViral": null, "negativeTestsViral": null, "positiveCasesViral": 4152, "deathConfirmed": null, "deathProbable": null, "totalTestEncountersViral": 22513, "totalTestsPeopleViral": null, "totalTestsAntibody": null, "positiveTestsAntibody": null, "negativeTestsAntibody": null, "totalTestsPeopleAntibody": null, "positiveTestsPeopleAntibody": null, "negativeTestsPeopleAntibody": null, "totalTestsPeopleAntigen": null, "positiveTestsPeopleAntigen": null, "totalTestsAntigen": null, "positiveTestsAntigen": null, "fips": "36", "positiveIncrease": 1769, "negativeIncrease": 5929, "total": 22513, "totalTestResultsIncrease": 7698, "posNeg": 22513, "deathIncrease": 0, "hospitalizedIncrease": 0, "hash": "f8449cb560ce1bb80f169d6f53ee74e411a8ef77", "commercialScore": 0, "negativeRegularScore": 0, "negativeScore": 0, "positiveScore": 0, "score": 0, "grade": "", "month_number_label": "2020-03", "date_label": "2020-03-19", "week_number_label": "2020W12", "week_start_label": "2020-03-16"}, {"date": 20200320, "state": "NY", "positive": 7102, "probableCases": null, "negative": 25535, "pending": null, "totalTestResultsSource": "totalTestEncountersViral", "totalTestResults": 32637, "hospitalizedCurrently": 1042, "hospitalizedCumulative": null, "inIcuCurrently": null, "inIcuCumulative": null, "onVentilatorCurrently": null, "onVentilatorCumulative": null, "recovered": null, "dataQualityGrade": null, "lastUpdateEt": "3/20/2020 13:20", "dateModified": "2020-03-20T13:20:00Z", "checkTimeEt": "03/20 09:20", "death": 35, "hospitalized": null, "dateChecked": "2020-03-20T13:20:00Z", "totalTestsViral": null, "positiveTestsViral": null, "negativeTestsViral": null, "positiveCasesViral": 7102, "deathConfirmed": null, "deathProbable": null, "totalTestEncountersViral": 32637, "totalTestsPeopleViral": null, "totalTestsAntibody": null, "positiveTestsAntibody": null, "negativeTestsAntibody": null, "totalTestsPeopleAntibody": null, "positiveTestsPeopleAntibody": null, "negativeTestsPeopleAntibody": null, "totalTestsPeopleAntigen": null, "positiveTestsPeopleAntigen": null, "totalTestsAntigen": null, "positiveTestsAntigen": null, "fips": "36", "positiveIncrease": 2950, "negativeIncrease": 7174, "total": 32637, "totalTestResultsIncrease": 10124, "posNeg": 32637, "deathIncrease": 23, "hospitalizedIncrease": 0, "hash": "a5bbf45815228a294a08f037ffaf958ca32e54e2", "commercialScore": 0, "negativeRegularScore": 0, "negativeScore": 0, "positiveScore": 0, "score": 0, "grade": "", "month_number_label": "2020-03", "date_label": "2020-03-20", "week_number_label": "2020W12", "week_start_label": "2020-03-16"}, {"date": 20200321, "state": "NY", "positive": 10356, "probableCases": null, "negative": 35368, "pending": null, "totalTestResultsSource": "totalTestEncountersViral", "totalTestResults": 45724, "hospitalizedCurrently": 1436, "hospitalizedCumulative": 1531, "inIcuCurrently": null, "inIcuCumulative": null, "onVentilatorCurrently": null, "onVentilatorCumulative": null, "recovered": null, "dataQualityGrade": null, "lastUpdateEt": "3/20/2020 21:22", "dateModified": "2020-03-20T21:22:00Z", "checkTimeEt": "03/20 17:22", "death": 44, "hospitalized": 1531, "dateChecked": "2020-03-20T21:22:00Z", "totalTestsViral": null, "positiveTestsViral": null, "negativeTestsViral": null, "positiveCasesViral": 10356, "deathConfirmed": null, "deathProbable": null, "totalTestEncountersViral": 45724, "totalTestsPeopleViral": null, "totalTestsAntibody": null, "positiveTestsAntibody": null, "negativeTestsAntibody": null, "totalTestsPeopleAntibody": null, "positiveTestsPeopleAntibody": null, "negativeTestsPeopleAntibody": null, "totalTestsPeopleAntigen": null, "positiveTestsPeopleAntigen": null, "totalTestsAntigen": null, "positiveTestsAntigen": null, "fips": "36", "positiveIncrease": 3254, "negativeIncrease": 9833, "total": 45724, "totalTestResultsIncrease": 13087, "posNeg": 45724, "deathIncrease": 9, "hospitalizedIncrease": 1531, "hash": "526554b584be71c09c70677b84c9bef3606edec5", "commercialScore": 0, "negativeRegularScore": 0, "negativeScore": 0, "positiveScore": 0, "score": 0, "grade": "", "month_number_label": "2020-03", "date_label": "2020-03-21", "week_number_label": "2020W12", "week_start_label": "2020-03-16"}, {"date": 20200322, "state": "NY", "positive": 15168, "probableCases": null, "negative": 46585, "pending": null, "totalTestResultsSource": "totalTestEncountersViral", "totalTestResults": 61753, "hospitalizedCurrently": 2043, "hospitalizedCumulative": 2354, "inIcuCurrently": null, "inIcuCumulative": null, "onVentilatorCurrently": null, "onVentilatorCumulative": null, "recovered": null, "dataQualityGrade": null, "lastUpdateEt": "3/22/2020 11:00", "dateModified": "2020-03-22T11:00:00Z", "checkTimeEt": "03/22 07:00", "death": 114, "hospitalized": 2354, "dateChecked": "2020-03-22T11:00:00Z", "totalTestsViral": null, "positiveTestsViral": null, "negativeTestsViral": null, "positiveCasesViral": 15168, "deathConfirmed": null, "deathProbable": null, "totalTestEncountersViral": 61753, "totalTestsPeopleViral": null, "totalTestsAntibody": null, "positiveTestsAntibody": null, "negativeTestsAntibody": null, "totalTestsPeopleAntibody": null, "positiveTestsPeopleAntibody": null, "negativeTestsPeopleAntibody": null, "totalTestsPeopleAntigen": null, "positiveTestsPeopleAntigen": null, "totalTestsAntigen": null, "positiveTestsAntigen": null, "fips": "36", "positiveIncrease": 4812, "negativeIncrease": 11217, "total": 61753, "totalTestResultsIncrease": 16029, "posNeg": 61753, "deathIncrease": 70, "hospitalizedIncrease": 823, "hash": "65f4cc8117469016447a141645a22b77249376c7", "commercialScore": 0, "negativeRegularScore": 0, "negativeScore": 0, "positiveScore": 0, "score": 0, "grade": "", "month_number_label": "2020-03", "date_label": "2020-03-22", "week_number_label": "2020W12", "week_start_label": "2020-03-16"}, {"date": 20200323, "state": "NY", "positive": 20875, "probableCases": null, "negative": 57690, "pending": null, "totalTestResultsSource": "totalTestEncountersViral", "totalTestResults": 78565, "hospitalizedCurrently": 2629, "hospitalizedCumulative": 3125, "inIcuCurrently": null, "inIcuCumulative": null, "onVentilatorCurrently": null, "onVentilatorCumulative": null, "recovered": null, "dataQualityGrade": "B", "lastUpdateEt": "3/23/2020 11:36", "dateModified": "2020-03-23T11:36:00Z", "checkTimeEt": "03/23 07:36", "death": 114, "hospitalized": 3125, "dateChecked": "2020-03-23T11:36:00Z", "totalTestsViral": null, "positiveTestsViral": null, "negativeTestsViral": null, "positiveCasesViral": 20875, "deathConfirmed": null, "deathProbable": null, "totalTestEncountersViral": 78565, "totalTestsPeopleViral": null, "totalTestsAntibody": null, "positiveTestsAntibody": null, "negativeTestsAntibody": null, "totalTestsPeopleAntibody": null, "positiveTestsPeopleAntibody": null, "negativeTestsPeopleAntibody": null, "totalTestsPeopleAntigen": null, "positiveTestsPeopleAntigen": null, "totalTestsAntigen": null, "positiveTestsAntigen": null, "fips": "36", "positiveIncrease": 5707, "negativeIncrease": 11105, "total": 78565, "totalTestResultsIncrease": 16812, "posNeg": 78565, "deathIncrease": 0, "hospitalizedIncrease": 771, "hash": "98fcbc7db2cd2ed83e10adbc9c47bf3059019e71", "commercialScore": 0, "negativeRegularScore": 0, "negativeScore": 0, "positiveScore": 0, "score": 0, "grade": "", "month_number_label": "2020-03", "date_label": "2020-03-23", "week_number_label": "2020W13", "week_start_label": "2020-03-23"}, {"date": 20200324, "state": "NY", "positive": 25665, "probableCases": null, "negative": 65852, "pending": null, "totalTestResultsSource": "totalTestEncountersViral", "totalTestResults": 91517, "hospitalizedCurrently": 3343, "hospitalizedCumulative": 4041, "inIcuCurrently": null, "inIcuCumulative": null, "onVentilatorCurrently": null, "onVentilatorCumulative": null, "recovered": null, "dataQualityGrade": "B", "lastUpdateEt": "3/24/2020 11:30", "dateModified": "2020-03-24T11:30:00Z", "checkTimeEt": "03/24 07:30", "death": 210, "hospitalized": 4041, "dateChecked": "2020-03-24T11:30:00Z", "totalTestsViral": null, "positiveTestsViral": null, "negativeTestsViral": null, "positiveCasesViral": 25665, "deathConfirmed": null, "deathProbable": null, "totalTestEncountersViral": 91517, "totalTestsPeopleViral": null, "totalTestsAntibody": null, "positiveTestsAntibody": null, "negativeTestsAntibody": null, "totalTestsPeopleAntibody": null, "positiveTestsPeopleAntibody": null, "negativeTestsPeopleAntibody": null, "totalTestsPeopleAntigen": null, "positiveTestsPeopleAntigen": null, "totalTestsAntigen": null, "positiveTestsAntigen": null, "fips": "36", "positiveIncrease": 4790, "negativeIncrease": 8162, "total": 91517, "totalTestResultsIncrease": 12952, "posNeg": 91517, "deathIncrease": 96, "hospitalizedIncrease": 916, "hash": "0f87c509453e4b05b4e154eeda1efc41e602be51", "commercialScore": 0, "negativeRegularScore": 0, "negativeScore": 0, "positiveScore": 0, "score": 0, "grade": "", "month_number_label": "2020-03", "date_label": "2020-03-24", "week_number_label": "2020W13", "week_start_label": "2020-03-23"}, {"date": 20200325, "state": "NY", "positive": 30810, "probableCases": null, "negative": 72849, "pending": null, "totalTestResultsSource": "totalTestEncountersViral", "totalTestResults": 103659, "hospitalizedCurrently": 4079, "hospitalizedCumulative": 5126, "inIcuCurrently": null, "inIcuCumulative": null, "onVentilatorCurrently": null, "onVentilatorCumulative": null, "recovered": null, "dataQualityGrade": "B", "lastUpdateEt": "3/25/2020 11:45", "dateModified": "2020-03-25T11:45:00Z", "checkTimeEt": "03/25 07:45", "death": 285, "hospitalized": 5126, "dateChecked": "2020-03-25T11:45:00Z", "totalTestsViral": null, "positiveTestsViral": null, "negativeTestsViral": null, "positiveCasesViral": 30810, "deathConfirmed": null, "deathProbable": null, "totalTestEncountersViral": 103659, "totalTestsPeopleViral": null, "totalTestsAntibody": null, "positiveTestsAntibody": null, "negativeTestsAntibody": null, "totalTestsPeopleAntibody": null, "positiveTestsPeopleAntibody": null, "negativeTestsPeopleAntibody": null, "totalTestsPeopleAntigen": null, "positiveTestsPeopleAntigen": null, "totalTestsAntigen": null, "positiveTestsAntigen": null, "fips": "36", "positiveIncrease": 5145, "negativeIncrease": 6997, "total": 103659, "totalTestResultsIncrease": 12142, "posNeg": 103659, "deathIncrease": 75, "hospitalizedIncrease": 1085, "hash": "f48f61159da48a71837301c9726dc6d77bc6643f", "commercialScore": 0, "negativeRegularScore": 0, "negativeScore": 0, "positiveScore": 0, "score": 0, "grade": "", "month_number_label": "2020-03", "date_label": "2020-03-25", "week_number_label": "2020W13", "week_start_label": "2020-03-23"}, {"date": 20200326, "state": "NY", "positive": 37258, "probableCases": null, "negative": 85052, "pending": null, "totalTestResultsSource": "totalTestEncountersViral", "totalTestResults": 122310, "hospitalizedCurrently": 5327, "hospitalizedCumulative": 6921, "inIcuCurrently": 1290, "inIcuCumulative": null, "onVentilatorCurrently": null, "onVentilatorCumulative": null, "recovered": null, "dataQualityGrade": "B", "lastUpdateEt": "3/26/2020 16:59", "dateModified": "2020-03-26T16:59:00Z", "checkTimeEt": "03/26 12:59", "death": 385, "hospitalized": 6921, "dateChecked": "2020-03-26T16:59:00Z", "totalTestsViral": null, "positiveTestsViral": null, "negativeTestsViral": null, "positiveCasesViral": 37258, "deathConfirmed": null, "deathProbable": null, "totalTestEncountersViral": 122310, "totalTestsPeopleViral": null, "totalTestsAntibody": null, "positiveTestsAntibody": null, "negativeTestsAntibody": null, "totalTestsPeopleAntibody": null, "positiveTestsPeopleAntibody": null, "negativeTestsPeopleAntibody": null, "totalTestsPeopleAntigen": null, "positiveTestsPeopleAntigen": null, "totalTestsAntigen": null, "positiveTestsAntigen": null, "fips": "36", "positiveIncrease": 6448, "negativeIncrease": 12203, "total": 122310, "totalTestResultsIncrease": 18651, "posNeg": 122310, "deathIncrease": 100, "hospitalizedIncrease": 1795, "hash": "4d54d48e69b6de77f9816f52626a93f51c447da2", "commercialScore": 0, "negativeRegularScore": 0, "negativeScore": 0, "positiveScore": 0, "score": 0, "grade": "", "month_number_label": "2020-03", "date_label": "2020-03-26", "week_number_label": "2020W13", "week_start_label": "2020-03-23"}, {"date": 20200327, "state": "NY", "positive": 44637, "probableCases": null, "negative": 93988, "pending": null, "totalTestResultsSource": "totalTestEncountersViral", "totalTestResults": 138625, "hospitalizedCurrently": 6481, "hospitalizedCumulative": 8732, "inIcuCurrently": 1583, "inIcuCumulative": null, "onVentilatorCurrently": null, "onVentilatorCumulative": null, "recovered": 2045, "dataQualityGrade": "A", "lastUpdateEt": "3/27/2020 11:15", "dateModified": "2020-03-27T11:15:00Z", "checkTimeEt": "03/27 07:15", "death": 519, "hospitalized": 8732, "dateChecked": "2020-03-27T11:15:00Z", "totalTestsViral": null, "positiveTestsViral": null, "negativeTestsViral": null, "positiveCasesViral": 44637, "deathConfirmed": null, "deathProbable": null, "totalTestEncountersViral": 138625, "totalTestsPeopleViral": null, "totalTestsAntibody": null, "positiveTestsAntibody": null, "negativeTestsAntibody": null, "totalTestsPeopleAntibody": null, "positiveTestsPeopleAntibody": null, "negativeTestsPeopleAntibody": null, "totalTestsPeopleAntigen": null, "positiveTestsPeopleAntigen": null, "totalTestsAntigen": null, "positiveTestsAntigen": null, "fips": "36", "positiveIncrease": 7379, "negativeIncrease": 8936, "total": 138625, "totalTestResultsIncrease": 16315, "posNeg": 138625, "deathIncrease": 134, "hospitalizedIncrease": 1811, "hash": "fb3c7b037a500018cdc371085c4b23eceee5fdc7", "commercialScore": 0, "negativeRegularScore": 0, "negativeScore": 0, "positiveScore": 0, "score": 0, "grade": "", "month_number_label": "2020-03", "date_label": "2020-03-27", "week_number_label": "2020W13", "week_start_label": "2020-03-23"}, {"date": 20200328, "state": "NY", "positive": 52318, "probableCases": null, "negative": 103751, "pending": null, "totalTestResultsSource": "totalTestEncountersViral", "totalTestResults": 156069, "hospitalizedCurrently": 7328, "hospitalizedCumulative": 10454, "inIcuCurrently": 1755, "inIcuCumulative": null, "onVentilatorCurrently": null, "onVentilatorCumulative": null, "recovered": 2726, "dataQualityGrade": "A", "lastUpdateEt": "3/28/2020 13:15", "dateModified": "2020-03-28T13:15:00Z", "checkTimeEt": "03/28 09:15", "death": 728, "hospitalized": 10454, "dateChecked": "2020-03-28T13:15:00Z", "totalTestsViral": null, "positiveTestsViral": null, "negativeTestsViral": null, "positiveCasesViral": 52318, "deathConfirmed": null, "deathProbable": null, "totalTestEncountersViral": 156069, "totalTestsPeopleViral": null, "totalTestsAntibody": null, "positiveTestsAntibody": null, "negativeTestsAntibody": null, "totalTestsPeopleAntibody": null, "positiveTestsPeopleAntibody": null, "negativeTestsPeopleAntibody": null, "totalTestsPeopleAntigen": null, "positiveTestsPeopleAntigen": null, "totalTestsAntigen": null, "positiveTestsAntigen": null, "fips": "36", "positiveIncrease": 7681, "negativeIncrease": 9763, "total": 156069, "totalTestResultsIncrease": 17444, "posNeg": 156069, "deathIncrease": 209, "hospitalizedIncrease": 1722, "hash": "558911adbd2edeeebda35f61e0863cbc6ed29a60", "commercialScore": 0, "negativeRegularScore": 0, "negativeScore": 0, "positiveScore": 0, "score": 0, "grade": "", "month_number_label": "2020-03", "date_label": "2020-03-28", "week_number_label": "2020W13", "week_start_label": "2020-03-23"}, {"date": 20200329, "state": "NY", "positive": 59513, "probableCases": null, "negative": 112957, "pending": null, "totalTestResultsSource": "totalTestEncountersViral", "totalTestResults": 172470, "hospitalizedCurrently": 8503, "hospitalizedCumulative": 12695, "inIcuCurrently": 2037, "inIcuCumulative": null, "onVentilatorCurrently": null, "onVentilatorCumulative": null, "recovered": 3572, "dataQualityGrade": "A", "lastUpdateEt": "3/29/2020 09:16", "dateModified": "2020-03-29T09:16:00Z", "checkTimeEt": "03/29 05:16", "death": 965, "hospitalized": 12695, "dateChecked": "2020-03-29T09:16:00Z", "totalTestsViral": null, "positiveTestsViral": null, "negativeTestsViral": null, "positiveCasesViral": 59513, "deathConfirmed": null, "deathProbable": null, "totalTestEncountersViral": 172470, "totalTestsPeopleViral": null, "totalTestsAntibody": null, "positiveTestsAntibody": null, "negativeTestsAntibody": null, "totalTestsPeopleAntibody": null, "positiveTestsPeopleAntibody": null, "negativeTestsPeopleAntibody": null, "totalTestsPeopleAntigen": null, "positiveTestsPeopleAntigen": null, "totalTestsAntigen": null, "positiveTestsAntigen": null, "fips": "36", "positiveIncrease": 7195, "negativeIncrease": 9206, "total": 172470, "totalTestResultsIncrease": 16401, "posNeg": 172470, "deathIncrease": 237, "hospitalizedIncrease": 2241, "hash": "2cc2b186966608a5b9b27bdb25e156caa7814dc8", "commercialScore": 0, "negativeRegularScore": 0, "negativeScore": 0, "positiveScore": 0, "score": 0, "grade": "", "month_number_label": "2020-03", "date_label": "2020-03-29", "week_number_label": "2020W13", "week_start_label": "2020-03-23"}, {"date": 20200330, "state": "NY", "positive": 66497, "probableCases": null, "negative": 120088, "pending": null, "totalTestResultsSource": "totalTestEncountersViral", "totalTestResults": 186585, "hospitalizedCurrently": 9517, "hospitalizedCumulative": 14578, "inIcuCurrently": 2352, "inIcuCumulative": null, "onVentilatorCurrently": null, "onVentilatorCumulative": null, "recovered": 4204, "dataQualityGrade": "A", "lastUpdateEt": "3/29/2020 09:16", "dateModified": "2020-03-29T09:16:00Z", "checkTimeEt": "03/29 05:16", "death": 1218, "hospitalized": 14578, "dateChecked": "2020-03-29T09:16:00Z", "totalTestsViral": null, "positiveTestsViral": null, "negativeTestsViral": null, "positiveCasesViral": 66497, "deathConfirmed": null, "deathProbable": null, "totalTestEncountersViral": 186585, "totalTestsPeopleViral": null, "totalTestsAntibody": null, "positiveTestsAntibody": null, "negativeTestsAntibody": null, "totalTestsPeopleAntibody": null, "positiveTestsPeopleAntibody": null, "negativeTestsPeopleAntibody": null, "totalTestsPeopleAntigen": null, "positiveTestsPeopleAntigen": null, "totalTestsAntigen": null, "positiveTestsAntigen": null, "fips": "36", "positiveIncrease": 6984, "negativeIncrease": 7131, "total": 186585, "totalTestResultsIncrease": 14115, "posNeg": 186585, "deathIncrease": 253, "hospitalizedIncrease": 1883, "hash": "5a995a400c345a8e926ec1c343754ae33ffa61ff", "commercialScore": 0, "negativeRegularScore": 0, "negativeScore": 0, "positiveScore": 0, "score": 0, "grade": "", "month_number_label": "2020-03", "date_label": "2020-03-30", "week_number_label": "2020W14", "week_start_label": "2020-03-30"}, {"date": 20200331, "state": "NY", "positive": 75795, "probableCases": null, "negative": 129438, "pending": null, "totalTestResultsSource": "totalTestEncountersViral", "totalTestResults": 205233, "hospitalizedCurrently": 10929, "hospitalizedCumulative": 17085, "inIcuCurrently": 2710, "inIcuCumulative": null, "onVentilatorCurrently": null, "onVentilatorCumulative": null, "recovered": 4975, "dataQualityGrade": "A", "lastUpdateEt": "3/29/2020 09:16", "dateModified": "2020-03-29T09:16:00Z", "checkTimeEt": "03/29 05:16", "death": 1550, "hospitalized": 17085, "dateChecked": "2020-03-29T09:16:00Z", "totalTestsViral": null, "positiveTestsViral": null, "negativeTestsViral": null, "positiveCasesViral": 75795, "deathConfirmed": null, "deathProbable": null, "totalTestEncountersViral": 205233, "totalTestsPeopleViral": null, "totalTestsAntibody": null, "positiveTestsAntibody": null, "negativeTestsAntibody": null, "totalTestsPeopleAntibody": null, "positiveTestsPeopleAntibody": null, "negativeTestsPeopleAntibody": null, "totalTestsPeopleAntigen": null, "positiveTestsPeopleAntigen": null, "totalTestsAntigen": null, "positiveTestsAntigen": null, "fips": "36", "positiveIncrease": 9298, "negativeIncrease": 9350, "total": 205233, "totalTestResultsIncrease": 18648, "posNeg": 205233, "deathIncrease": 332, "hospitalizedIncrease": 2507, "hash": "b11f61ac004f44176a72125b14e3bd8d8047f262", "commercialScore": 0, "negativeRegularScore": 0, "negativeScore": 0, "positiveScore": 0, "score": 0, "grade": "", "month_number_label": "2020-03", "date_label": "2020-03-31", "week_number_label": "2020W14", "week_start_label": "2020-03-30"}, {"date": 20200401, "state": "NY", "positive": 83712, "probableCases": null, "negative": 137222, "pending": null, "totalTestResultsSource": "totalTestEncountersViral", "totalTestResults": 220934, "hospitalizedCurrently": 12226, "hospitalizedCumulative": 19929, "inIcuCurrently": 3022, "inIcuCumulative": null, "onVentilatorCurrently": null, "onVentilatorCumulative": null, "recovered": 6142, "dataQualityGrade": "A", "lastUpdateEt": "4/1/2020 12:00", "dateModified": "2020-04-01T12:00:00Z", "checkTimeEt": "04/01 08:00", "death": 1941, "hospitalized": 19929, "dateChecked": "2020-04-01T12:00:00Z", "totalTestsViral": null, "positiveTestsViral": null, "negativeTestsViral": null, "positiveCasesViral": 83712, "deathConfirmed": null, "deathProbable": null, "totalTestEncountersViral": 220934, "totalTestsPeopleViral": null, "totalTestsAntibody": null, "positiveTestsAntibody": null, "negativeTestsAntibody": null, "totalTestsPeopleAntibody": null, "positiveTestsPeopleAntibody": null, "negativeTestsPeopleAntibody": null, "totalTestsPeopleAntigen": null, "positiveTestsPeopleAntigen": null, "totalTestsAntigen": null, "positiveTestsAntigen": null, "fips": "36", "positiveIncrease": 7917, "negativeIncrease": 7784, "total": 220934, "totalTestResultsIncrease": 15701, "posNeg": 220934, "deathIncrease": 391, "hospitalizedIncrease": 2844, "hash": "9359a164b481cfe9f9594dfba6f5f2c7dc9f6bb3", "commercialScore": 0, "negativeRegularScore": 0, "negativeScore": 0, "positiveScore": 0, "score": 0, "grade": "", "month_number_label": "2020-04", "date_label": "2020-04-01", "week_number_label": "2020W14", "week_start_label": "2020-03-30"}, {"date": 20200402, "state": "NY", "positive": 92381, "probableCases": null, "negative": 146584, "pending": null, "totalTestResultsSource": "totalTestEncountersViral", "totalTestResults": 238965, "hospitalizedCurrently": 13383, "hospitalizedCumulative": 22786, "inIcuCurrently": 3396, "inIcuCumulative": null, "onVentilatorCurrently": null, "onVentilatorCumulative": null, "recovered": 7434, "dataQualityGrade": "A", "lastUpdateEt": "4/2/2020 11:45", "dateModified": "2020-04-02T11:45:00Z", "checkTimeEt": "04/02 07:45", "death": 2373, "hospitalized": 22786, "dateChecked": "2020-04-02T11:45:00Z", "totalTestsViral": null, "positiveTestsViral": null, "negativeTestsViral": null, "positiveCasesViral": 92381, "deathConfirmed": null, "deathProbable": null, "totalTestEncountersViral": 238965, "totalTestsPeopleViral": null, "totalTestsAntibody": null, "positiveTestsAntibody": null, "negativeTestsAntibody": null, "totalTestsPeopleAntibody": null, "positiveTestsPeopleAntibody": null, "negativeTestsPeopleAntibody": null, "totalTestsPeopleAntigen": null, "positiveTestsPeopleAntigen": null, "totalTestsAntigen": null, "positiveTestsAntigen": null, "fips": "36", "positiveIncrease": 8669, "negativeIncrease": 9362, "total": 238965, "totalTestResultsIncrease": 18031, "posNeg": 238965, "deathIncrease": 432, "hospitalizedIncrease": 2857, "hash": "d692593bbc2b71883fe298caed58335bed83256d", "commercialScore": 0, "negativeRegularScore": 0, "negativeScore": 0, "positiveScore": 0, "score": 0, "grade": "", "month_number_label": "2020-04", "date_label": "2020-04-02", "week_number_label": "2020W14", "week_start_label": "2020-03-30"}, {"date": 20200403, "state": "NY", "positive": 102863, "probableCases": null, "negative": 157657, "pending": null, "totalTestResultsSource": "totalTestEncountersViral", "totalTestResults": 260520, "hospitalizedCurrently": 14810, "hospitalizedCumulative": 26210, "inIcuCurrently": 3731, "inIcuCumulative": null, "onVentilatorCurrently": null, "onVentilatorCumulative": null, "recovered": 8886, "dataQualityGrade": "A", "lastUpdateEt": "4/3/2020 11:00", "dateModified": "2020-04-03T11:00:00Z", "checkTimeEt": "04/03 07:00", "death": 2935, "hospitalized": 26210, "dateChecked": "2020-04-03T11:00:00Z", "totalTestsViral": null, "positiveTestsViral": null, "negativeTestsViral": null, "positiveCasesViral": 102863, "deathConfirmed": null, "deathProbable": null, "totalTestEncountersViral": 260520, "totalTestsPeopleViral": null, "totalTestsAntibody": null, "positiveTestsAntibody": null, "negativeTestsAntibody": null, "totalTestsPeopleAntibody": null, "positiveTestsPeopleAntibody": null, "negativeTestsPeopleAntibody": null, "totalTestsPeopleAntigen": null, "positiveTestsPeopleAntigen": null, "totalTestsAntigen": null, "positiveTestsAntigen": null, "fips": "36", "positiveIncrease": 10482, "negativeIncrease": 11073, "total": 260520, "totalTestResultsIncrease": 21555, "posNeg": 260520, "deathIncrease": 562, "hospitalizedIncrease": 3424, "hash": "f6a0005a94ccde872ec5a0f98d3db239f248ab90", "commercialScore": 0, "negativeRegularScore": 0, "negativeScore": 0, "positiveScore": 0, "score": 0, "grade": "", "month_number_label": "2020-04", "date_label": "2020-04-03", "week_number_label": "2020W14", "week_start_label": "2020-03-30"}, {"date": 20200404, "state": "NY", "positive": 113704, "probableCases": null, "negative": 169917, "pending": null, "totalTestResultsSource": "totalTestEncountersViral", "totalTestResults": 283621, "hospitalizedCurrently": 15905, "hospitalizedCumulative": 29471, "inIcuCurrently": 4126, "inIcuCumulative": null, "onVentilatorCurrently": null, "onVentilatorCumulative": null, "recovered": 10478, "dataQualityGrade": "A", "lastUpdateEt": "4/3/2020 11:00", "dateModified": "2020-04-03T11:00:00Z", "checkTimeEt": "04/03 07:00", "death": 3565, "hospitalized": 29471, "dateChecked": "2020-04-03T11:00:00Z", "totalTestsViral": null, "positiveTestsViral": null, "negativeTestsViral": null, "positiveCasesViral": 113704, "deathConfirmed": null, "deathProbable": null, "totalTestEncountersViral": 283621, "totalTestsPeopleViral": null, "totalTestsAntibody": null, "positiveTestsAntibody": null, "negativeTestsAntibody": null, "totalTestsPeopleAntibody": null, "positiveTestsPeopleAntibody": null, "negativeTestsPeopleAntibody": null, "totalTestsPeopleAntigen": null, "positiveTestsPeopleAntigen": null, "totalTestsAntigen": null, "positiveTestsAntigen": null, "fips": "36", "positiveIncrease": 10841, "negativeIncrease": 12260, "total": 283621, "totalTestResultsIncrease": 23101, "posNeg": 283621, "deathIncrease": 630, "hospitalizedIncrease": 3261, "hash": "6070378c7f3173039e9fc0bf5aabd4493100eb06", "commercialScore": 0, "negativeRegularScore": 0, "negativeScore": 0, "positiveScore": 0, "score": 0, "grade": "", "month_number_label": "2020-04", "date_label": "2020-04-04", "week_number_label": "2020W14", "week_start_label": "2020-03-30"}, {"date": 20200405, "state": "NY", "positive": 122031, "probableCases": null, "negative": 180249, "pending": null, "totalTestResultsSource": "totalTestEncountersViral", "totalTestResults": 302280, "hospitalizedCurrently": 16479, "hospitalizedCumulative": 32293, "inIcuCurrently": 4376, "inIcuCumulative": null, "onVentilatorCurrently": null, "onVentilatorCumulative": null, "recovered": 12187, "dataQualityGrade": "A", "lastUpdateEt": "4/4/2020 00:00", "dateModified": "2020-04-04T00:00:00Z", "checkTimeEt": "04/03 20:00", "death": 4159, "hospitalized": 32293, "dateChecked": "2020-04-04T00:00:00Z", "totalTestsViral": null, "positiveTestsViral": null, "negativeTestsViral": null, "positiveCasesViral": 122031, "deathConfirmed": null, "deathProbable": null, "totalTestEncountersViral": 302280, "totalTestsPeopleViral": null, "totalTestsAntibody": null, "positiveTestsAntibody": null, "negativeTestsAntibody": null, "totalTestsPeopleAntibody": null, "positiveTestsPeopleAntibody": null, "negativeTestsPeopleAntibody": null, "totalTestsPeopleAntigen": null, "positiveTestsPeopleAntigen": null, "totalTestsAntigen": null, "positiveTestsAntigen": null, "fips": "36", "positiveIncrease": 8327, "negativeIncrease": 10332, "total": 302280, "totalTestResultsIncrease": 18659, "posNeg": 302280, "deathIncrease": 594, "hospitalizedIncrease": 2822, "hash": "660555f9d236dc5075f5cdddf7c4c158e7f6dc55", "commercialScore": 0, "negativeRegularScore": 0, "negativeScore": 0, "positiveScore": 0, "score": 0, "grade": "", "month_number_label": "2020-04", "date_label": "2020-04-05", "week_number_label": "2020W14", "week_start_label": "2020-03-30"}, {"date": 20200406, "state": "NY", "positive": 130689, "probableCases": null, "negative": 190122, "pending": null, "totalTestResultsSource": "totalTestEncountersViral", "totalTestResults": 320811, "hospitalizedCurrently": 16837, "hospitalizedCumulative": 34377, "inIcuCurrently": 4504, "inIcuCumulative": null, "onVentilatorCurrently": null, "onVentilatorCumulative": null, "recovered": 13366, "dataQualityGrade": "A", "lastUpdateEt": "4/6/2020 00:00", "dateModified": "2020-04-06T00:00:00Z", "checkTimeEt": "04/05 20:00", "death": 4758, "hospitalized": 34377, "dateChecked": "2020-04-06T00:00:00Z", "totalTestsViral": null, "positiveTestsViral": null, "negativeTestsViral": null, "positiveCasesViral": 130689, "deathConfirmed": null, "deathProbable": null, "totalTestEncountersViral": 320811, "totalTestsPeopleViral": null, "totalTestsAntibody": null, "positiveTestsAntibody": null, "negativeTestsAntibody": null, "totalTestsPeopleAntibody": null, "positiveTestsPeopleAntibody": null, "negativeTestsPeopleAntibody": null, "totalTestsPeopleAntigen": null, "positiveTestsPeopleAntigen": null, "totalTestsAntigen": null, "positiveTestsAntigen": null, "fips": "36", "positiveIncrease": 8658, "negativeIncrease": 9873, "total": 320811, "totalTestResultsIncrease": 18531, "posNeg": 320811, "deathIncrease": 599, "hospitalizedIncrease": 2084, "hash": "9235a5cb22c833dabc1546d87528f860890b625a", "commercialScore": 0, "negativeRegularScore": 0, "negativeScore": 0, "positiveScore": 0, "score": 0, "grade": "", "month_number_label": "2020-04", "date_label": "2020-04-06", "week_number_label": "2020W15", "week_start_label": "2020-04-06"}, {"date": 20200407, "state": "NY", "positive": 138863, "probableCases": null, "negative": 201195, "pending": null, "totalTestResultsSource": "totalTestEncountersViral", "totalTestResults": 340058, "hospitalizedCurrently": 17493, "hospitalizedCumulative": 36932, "inIcuCurrently": 4539, "inIcuCumulative": null, "onVentilatorCurrently": null, "onVentilatorCumulative": null, "recovered": 14590, "dataQualityGrade": "A", "lastUpdateEt": "4/6/2020 00:00", "dateModified": "2020-04-06T00:00:00Z", "checkTimeEt": "04/05 20:00", "death": 5489, "hospitalized": 36932, "dateChecked": "2020-04-06T00:00:00Z", "totalTestsViral": null, "positiveTestsViral": null, "negativeTestsViral": null, "positiveCasesViral": 138863, "deathConfirmed": null, "deathProbable": null, "totalTestEncountersViral": 340058, "totalTestsPeopleViral": null, "totalTestsAntibody": null, "positiveTestsAntibody": null, "negativeTestsAntibody": null, "totalTestsPeopleAntibody": null, "positiveTestsPeopleAntibody": null, "negativeTestsPeopleAntibody": null, "totalTestsPeopleAntigen": null, "positiveTestsPeopleAntigen": null, "totalTestsAntigen": null, "positiveTestsAntigen": null, "fips": "36", "positiveIncrease": 8174, "negativeIncrease": 11073, "total": 340058, "totalTestResultsIncrease": 19247, "posNeg": 340058, "deathIncrease": 731, "hospitalizedIncrease": 2555, "hash": "c094040381366d164f26e1c27016a32b2858ad5a", "commercialScore": 0, "negativeRegularScore": 0, "negativeScore": 0, "positiveScore": 0, "score": 0, "grade": "", "month_number_label": "2020-04", "date_label": "2020-04-07", "week_number_label": "2020W15", "week_start_label": "2020-04-06"}, {"date": 20200408, "state": "NY", "positive": 149316, "probableCases": null, "negative": 215837, "pending": null, "totalTestResultsSource": "totalTestEncountersViral", "totalTestResults": 365153, "hospitalizedCurrently": 18079, "hospitalizedCumulative": 39982, "inIcuCurrently": 4841, "inIcuCumulative": null, "onVentilatorCurrently": null, "onVentilatorCumulative": null, "recovered": 16353, "dataQualityGrade": "A", "lastUpdateEt": "4/7/2020 00:00", "dateModified": "2020-04-07T00:00:00Z", "checkTimeEt": "04/06 20:00", "death": 6268, "hospitalized": 39982, "dateChecked": "2020-04-07T00:00:00Z", "totalTestsViral": null, "positiveTestsViral": null, "negativeTestsViral": null, "positiveCasesViral": 149316, "deathConfirmed": null, "deathProbable": null, "totalTestEncountersViral": 365153, "totalTestsPeopleViral": null, "totalTestsAntibody": null, "positiveTestsAntibody": null, "negativeTestsAntibody": null, "totalTestsPeopleAntibody": null, "positiveTestsPeopleAntibody": null, "negativeTestsPeopleAntibody": null, "totalTestsPeopleAntigen": null, "positiveTestsPeopleAntigen": null, "totalTestsAntigen": null, "positiveTestsAntigen": null, "fips": "36", "positiveIncrease": 10453, "negativeIncrease": 14642, "total": 365153, "totalTestResultsIncrease": 25095, "posNeg": 365153, "deathIncrease": 779, "hospitalizedIncrease": 3050, "hash": "29590ca7f3cbaf3239ceff5237e8ee325f4ac133", "commercialScore": 0, "negativeRegularScore": 0, "negativeScore": 0, "positiveScore": 0, "score": 0, "grade": "", "month_number_label": "2020-04", "date_label": "2020-04-08", "week_number_label": "2020W15", "week_start_label": "2020-04-06"}, {"date": 20200409, "state": "NY", "positive": 159937, "probableCases": null, "negative": 231612, "pending": null, "totalTestResultsSource": "totalTestEncountersViral", "totalTestResults": 391549, "hospitalizedCurrently": 18279, "hospitalizedCumulative": 42852, "inIcuCurrently": 4925, "inIcuCumulative": null, "onVentilatorCurrently": null, "onVentilatorCumulative": null, "recovered": 18297, "dataQualityGrade": "A", "lastUpdateEt": "4/9/2020 00:00", "dateModified": "2020-04-09T00:00:00Z", "checkTimeEt": "04/08 20:00", "death": 7067, "hospitalized": 42852, "dateChecked": "2020-04-09T00:00:00Z", "totalTestsViral": null, "positiveTestsViral": null, "negativeTestsViral": null, "positiveCasesViral": 159937, "deathConfirmed": null, "deathProbable": null, "totalTestEncountersViral": 391549, "totalTestsPeopleViral": null, "totalTestsAntibody": null, "positiveTestsAntibody": null, "negativeTestsAntibody": null, "totalTestsPeopleAntibody": null, "positiveTestsPeopleAntibody": null, "negativeTestsPeopleAntibody": null, "totalTestsPeopleAntigen": null, "positiveTestsPeopleAntigen": null, "totalTestsAntigen": null, "positiveTestsAntigen": null, "fips": "36", "positiveIncrease": 10621, "negativeIncrease": 15775, "total": 391549, "totalTestResultsIncrease": 26396, "posNeg": 391549, "deathIncrease": 799, "hospitalizedIncrease": 2870, "hash": "bdc0e3498354d1db4dd3a11fc51876b56ef602c6", "commercialScore": 0, "negativeRegularScore": 0, "negativeScore": 0, "positiveScore": 0, "score": 0, "grade": "", "month_number_label": "2020-04", "date_label": "2020-04-09", "week_number_label": "2020W15", "week_start_label": "2020-04-06"}, {"date": 20200410, "state": "NY", "positive": 170512, "probableCases": null, "negative": 247373, "pending": null, "totalTestResultsSource": "totalTestEncountersViral", "totalTestResults": 417885, "hospitalizedCurrently": 18569, "hospitalizedCumulative": 45768, "inIcuCurrently": 4908, "inIcuCumulative": null, "onVentilatorCurrently": null, "onVentilatorCumulative": null, "recovered": 20249, "dataQualityGrade": "A", "lastUpdateEt": "4/10/2020 00:00", "dateModified": "2020-04-10T00:00:00Z", "checkTimeEt": "04/09 20:00", "death": 7844, "hospitalized": 45768, "dateChecked": "2020-04-10T00:00:00Z", "totalTestsViral": null, "positiveTestsViral": null, "negativeTestsViral": null, "positiveCasesViral": 170512, "deathConfirmed": null, "deathProbable": null, "totalTestEncountersViral": 417885, "totalTestsPeopleViral": null, "totalTestsAntibody": null, "positiveTestsAntibody": null, "negativeTestsAntibody": null, "totalTestsPeopleAntibody": null, "positiveTestsPeopleAntibody": null, "negativeTestsPeopleAntibody": null, "totalTestsPeopleAntigen": null, "positiveTestsPeopleAntigen": null, "totalTestsAntigen": null, "positiveTestsAntigen": null, "fips": "36", "positiveIncrease": 10575, "negativeIncrease": 15761, "total": 417885, "totalTestResultsIncrease": 26336, "posNeg": 417885, "deathIncrease": 777, "hospitalizedIncrease": 2916, "hash": "ef630f2513548120b9501961b42cc8ceba1a39ac", "commercialScore": 0, "negativeRegularScore": 0, "negativeScore": 0, "positiveScore": 0, "score": 0, "grade": "", "month_number_label": "2020-04", "date_label": "2020-04-10", "week_number_label": "2020W15", "week_start_label": "2020-04-06"}, {"date": 20200411, "state": "NY", "positive": 180458, "probableCases": null, "negative": 260522, "pending": null, "totalTestResultsSource": "totalTestEncountersViral", "totalTestResults": 440980, "hospitalizedCurrently": 18654, "hospitalizedCumulative": 48297, "inIcuCurrently": 5009, "inIcuCumulative": null, "onVentilatorCurrently": null, "onVentilatorCumulative": null, "recovered": 22025, "dataQualityGrade": "A", "lastUpdateEt": "4/11/2020 00:00", "dateModified": "2020-04-11T00:00:00Z", "checkTimeEt": "04/10 20:00", "death": 8627, "hospitalized": 48297, "dateChecked": "2020-04-11T00:00:00Z", "totalTestsViral": null, "positiveTestsViral": null, "negativeTestsViral": null, "positiveCasesViral": 180458, "deathConfirmed": null, "deathProbable": null, "totalTestEncountersViral": 440980, "totalTestsPeopleViral": null, "totalTestsAntibody": null, "positiveTestsAntibody": null, "negativeTestsAntibody": null, "totalTestsPeopleAntibody": null, "positiveTestsPeopleAntibody": null, "negativeTestsPeopleAntibody": null, "totalTestsPeopleAntigen": null, "positiveTestsPeopleAntigen": null, "totalTestsAntigen": null, "positiveTestsAntigen": null, "fips": "36", "positiveIncrease": 9946, "negativeIncrease": 13149, "total": 440980, "totalTestResultsIncrease": 23095, "posNeg": 440980, "deathIncrease": 783, "hospitalizedIncrease": 2529, "hash": "f133a82face58a7ef7a4266ff99ca786603b57ec", "commercialScore": 0, "negativeRegularScore": 0, "negativeScore": 0, "positiveScore": 0, "score": 0, "grade": "", "month_number_label": "2020-04", "date_label": "2020-04-11", "week_number_label": "2020W15", "week_start_label": "2020-04-06"}, {"date": 20200412, "state": "NY", "positive": 188694, "probableCases": null, "negative": 272907, "pending": null, "totalTestResultsSource": "totalTestEncountersViral", "totalTestResults": 461601, "hospitalizedCurrently": 18707, "hospitalizedCumulative": 50919, "inIcuCurrently": 5198, "inIcuCumulative": null, "onVentilatorCurrently": null, "onVentilatorCumulative": null, "recovered": 23887, "dataQualityGrade": "A", "lastUpdateEt": "4/12/2020 00:00", "dateModified": "2020-04-12T00:00:00Z", "checkTimeEt": "04/11 20:00", "death": 9385, "hospitalized": 50919, "dateChecked": "2020-04-12T00:00:00Z", "totalTestsViral": null, "positiveTestsViral": null, "negativeTestsViral": null, "positiveCasesViral": 188694, "deathConfirmed": null, "deathProbable": null, "totalTestEncountersViral": 461601, "totalTestsPeopleViral": null, "totalTestsAntibody": null, "positiveTestsAntibody": null, "negativeTestsAntibody": null, "totalTestsPeopleAntibody": null, "positiveTestsPeopleAntibody": null, "negativeTestsPeopleAntibody": null, "totalTestsPeopleAntigen": null, "positiveTestsPeopleAntigen": null, "totalTestsAntigen": null, "positiveTestsAntigen": null, "fips": "36", "positiveIncrease": 8236, "negativeIncrease": 12385, "total": 461601, "totalTestResultsIncrease": 20621, "posNeg": 461601, "deathIncrease": 758, "hospitalizedIncrease": 2622, "hash": "c7c533a28412328fb2ee6010ecfedc676e012c6d", "commercialScore": 0, "negativeRegularScore": 0, "negativeScore": 0, "positiveScore": 0, "score": 0, "grade": "", "month_number_label": "2020-04", "date_label": "2020-04-12", "week_number_label": "2020W15", "week_start_label": "2020-04-06"}, {"date": 20200413, "state": "NY", "positive": 195031, "probableCases": null, "negative": 283326, "pending": null, "totalTestResultsSource": "totalTestEncountersViral", "totalTestResults": 478357, "hospitalizedCurrently": 18825, "hospitalizedCumulative": 52936, "inIcuCurrently": 5156, "inIcuCumulative": null, "onVentilatorCurrently": null, "onVentilatorCumulative": null, "recovered": 23887, "dataQualityGrade": "A", "lastUpdateEt": "4/13/2020 00:00", "dateModified": "2020-04-13T00:00:00Z", "checkTimeEt": "04/12 20:00", "death": 10056, "hospitalized": 52936, "dateChecked": "2020-04-13T00:00:00Z", "totalTestsViral": null, "positiveTestsViral": null, "negativeTestsViral": null, "positiveCasesViral": 195031, "deathConfirmed": null, "deathProbable": null, "totalTestEncountersViral": 478357, "totalTestsPeopleViral": null, "totalTestsAntibody": null, "positiveTestsAntibody": null, "negativeTestsAntibody": null, "totalTestsPeopleAntibody": null, "positiveTestsPeopleAntibody": null, "negativeTestsPeopleAntibody": null, "totalTestsPeopleAntigen": null, "positiveTestsPeopleAntigen": null, "totalTestsAntigen": null, "positiveTestsAntigen": null, "fips": "36", "positiveIncrease": 6337, "negativeIncrease": 10419, "total": 478357, "totalTestResultsIncrease": 16756, "posNeg": 478357, "deathIncrease": 671, "hospitalizedIncrease": 2017, "hash": "f38e99a9257ca39cc967a05702860ccfde5b717c", "commercialScore": 0, "negativeRegularScore": 0, "negativeScore": 0, "positiveScore": 0, "score": 0, "grade": "", "month_number_label": "2020-04", "date_label": "2020-04-13", "week_number_label": "2020W16", "week_start_label": "2020-04-13"}, {"date": 20200414, "state": "NY", "positive": 202208, "probableCases": null, "negative": 296935, "pending": null, "totalTestResultsSource": "totalTestEncountersViral", "totalTestResults": 499143, "hospitalizedCurrently": 18697, "hospitalizedCumulative": 54653, "inIcuCurrently": 5225, "inIcuCumulative": null, "onVentilatorCurrently": null, "onVentilatorCumulative": null, "recovered": 25589, "dataQualityGrade": "A", "lastUpdateEt": "4/14/2020 00:00", "dateModified": "2020-04-14T00:00:00Z", "checkTimeEt": "04/13 20:00", "death": 10834, "hospitalized": 54653, "dateChecked": "2020-04-14T00:00:00Z", "totalTestsViral": null, "positiveTestsViral": null, "negativeTestsViral": null, "positiveCasesViral": 202208, "deathConfirmed": null, "deathProbable": null, "totalTestEncountersViral": 499143, "totalTestsPeopleViral": null, "totalTestsAntibody": null, "positiveTestsAntibody": null, "negativeTestsAntibody": null, "totalTestsPeopleAntibody": null, "positiveTestsPeopleAntibody": null, "negativeTestsPeopleAntibody": null, "totalTestsPeopleAntigen": null, "positiveTestsPeopleAntigen": null, "totalTestsAntigen": null, "positiveTestsAntigen": null, "fips": "36", "positiveIncrease": 7177, "negativeIncrease": 13609, "total": 499143, "totalTestResultsIncrease": 20786, "posNeg": 499143, "deathIncrease": 778, "hospitalizedIncrease": 1717, "hash": "b87885829132571fb8e68ca1f23ffd4fe6e1f0a2", "commercialScore": 0, "negativeRegularScore": 0, "negativeScore": 0, "positiveScore": 0, "score": 0, "grade": "", "month_number_label": "2020-04", "date_label": "2020-04-14", "week_number_label": "2020W16", "week_start_label": "2020-04-13"}, {"date": 20200415, "state": "NY", "positive": 213779, "probableCases": null, "negative": 312233, "pending": null, "totalTestResultsSource": "totalTestEncountersViral", "totalTestResults": 526012, "hospitalizedCurrently": 18335, "hospitalizedCumulative": 56968, "inIcuCurrently": 5205, "inIcuCumulative": null, "onVentilatorCurrently": null, "onVentilatorCumulative": null, "recovered": 28004, "dataQualityGrade": "A", "lastUpdateEt": "4/15/2020 00:00", "dateModified": "2020-04-15T00:00:00Z", "checkTimeEt": "04/14 20:00", "death": 11586, "hospitalized": 56968, "dateChecked": "2020-04-15T00:00:00Z", "totalTestsViral": null, "positiveTestsViral": null, "negativeTestsViral": null, "positiveCasesViral": 213779, "deathConfirmed": null, "deathProbable": null, "totalTestEncountersViral": 526012, "totalTestsPeopleViral": null, "totalTestsAntibody": null, "positiveTestsAntibody": null, "negativeTestsAntibody": null, "totalTestsPeopleAntibody": null, "positiveTestsPeopleAntibody": null, "negativeTestsPeopleAntibody": null, "totalTestsPeopleAntigen": null, "positiveTestsPeopleAntigen": null, "totalTestsAntigen": null, "positiveTestsAntigen": null, "fips": "36", "positiveIncrease": 11571, "negativeIncrease": 15298, "total": 526012, "totalTestResultsIncrease": 26869, "posNeg": 526012, "deathIncrease": 752, "hospitalizedIncrease": 2315, "hash": "9850a0b80dc2d93b965d1bb1d6b081b8149c5719", "commercialScore": 0, "negativeRegularScore": 0, "negativeScore": 0, "positiveScore": 0, "score": 0, "grade": "", "month_number_label": "2020-04", "date_label": "2020-04-15", "week_number_label": "2020W16", "week_start_label": "2020-04-13"}, {"date": 20200416, "state": "NY", "positive": 222284, "probableCases": null, "negative": 328295, "pending": null, "totalTestResultsSource": "totalTestEncountersViral", "totalTestResults": 550579, "hospitalizedCurrently": 17735, "hospitalizedCumulative": 59052, "inIcuCurrently": 5071, "inIcuCumulative": null, "onVentilatorCurrently": null, "onVentilatorCumulative": null, "recovered": 30800, "dataQualityGrade": "A", "lastUpdateEt": "4/16/2020 00:00", "dateModified": "2020-04-16T00:00:00Z", "checkTimeEt": "04/15 20:00", "death": 12192, "hospitalized": 59052, "dateChecked": "2020-04-16T00:00:00Z", "totalTestsViral": null, "positiveTestsViral": null, "negativeTestsViral": null, "positiveCasesViral": 222284, "deathConfirmed": null, "deathProbable": null, "totalTestEncountersViral": 550579, "totalTestsPeopleViral": null, "totalTestsAntibody": null, "positiveTestsAntibody": null, "negativeTestsAntibody": null, "totalTestsPeopleAntibody": null, "positiveTestsPeopleAntibody": null, "negativeTestsPeopleAntibody": null, "totalTestsPeopleAntigen": null, "positiveTestsPeopleAntigen": null, "totalTestsAntigen": null, "positiveTestsAntigen": null, "fips": "36", "positiveIncrease": 8505, "negativeIncrease": 16062, "total": 550579, "totalTestResultsIncrease": 24567, "posNeg": 550579, "deathIncrease": 606, "hospitalizedIncrease": 2084, "hash": "ade3b005028d57e71de4155b640f5489d34cd0ba", "commercialScore": 0, "negativeRegularScore": 0, "negativeScore": 0, "positiveScore": 0, "score": 0, "grade": "", "month_number_label": "2020-04", "date_label": "2020-04-16", "week_number_label": "2020W16", "week_start_label": "2020-04-13"}, {"date": 20200417, "state": "NY", "positive": 229642, "probableCases": null, "negative": 343581, "pending": null, "totalTestResultsSource": "totalTestEncountersViral", "totalTestResults": 573223, "hospitalizedCurrently": 17316, "hospitalizedCumulative": 61120, "inIcuCurrently": 5039, "inIcuCumulative": null, "onVentilatorCurrently": null, "onVentilatorCumulative": null, "recovered": 33392, "dataQualityGrade": "A", "lastUpdateEt": "4/17/2020 14:00", "dateModified": "2020-04-17T14:00:00Z", "checkTimeEt": "04/17 10:00", "death": 12822, "hospitalized": 61120, "dateChecked": "2020-04-17T14:00:00Z", "totalTestsViral": null, "positiveTestsViral": null, "negativeTestsViral": null, "positiveCasesViral": 229642, "deathConfirmed": null, "deathProbable": null, "totalTestEncountersViral": 573223, "totalTestsPeopleViral": null, "totalTestsAntibody": null, "positiveTestsAntibody": null, "negativeTestsAntibody": null, "totalTestsPeopleAntibody": null, "positiveTestsPeopleAntibody": null, "negativeTestsPeopleAntibody": null, "totalTestsPeopleAntigen": null, "positiveTestsPeopleAntigen": null, "totalTestsAntigen": null, "positiveTestsAntigen": null, "fips": "36", "positiveIncrease": 7358, "negativeIncrease": 15286, "total": 573223, "totalTestResultsIncrease": 22644, "posNeg": 573223, "deathIncrease": 630, "hospitalizedIncrease": 2068, "hash": "f5a087055e40510b96a840fb8c2a1614f536f3e8", "commercialScore": 0, "negativeRegularScore": 0, "negativeScore": 0, "positiveScore": 0, "score": 0, "grade": "", "month_number_label": "2020-04", "date_label": "2020-04-17", "week_number_label": "2020W16", "week_start_label": "2020-04-13"}, {"date": 20200418, "state": "NY", "positive": 236732, "probableCases": null, "negative": 359800, "pending": null, "totalTestResultsSource": "totalTestEncountersViral", "totalTestResults": 596532, "hospitalizedCurrently": 16967, "hospitalizedCumulative": 63103, "inIcuCurrently": 4996, "inIcuCumulative": null, "onVentilatorCurrently": null, "onVentilatorCumulative": null, "recovered": 35458, "dataQualityGrade": "A", "lastUpdateEt": "4/18/2020 00:00", "dateModified": "2020-04-18T00:00:00Z", "checkTimeEt": "04/17 20:00", "death": 13362, "hospitalized": 63103, "dateChecked": "2020-04-18T00:00:00Z", "totalTestsViral": null, "positiveTestsViral": null, "negativeTestsViral": null, "positiveCasesViral": 236732, "deathConfirmed": null, "deathProbable": null, "totalTestEncountersViral": 596532, "totalTestsPeopleViral": null, "totalTestsAntibody": null, "positiveTestsAntibody": null, "negativeTestsAntibody": null, "totalTestsPeopleAntibody": null, "positiveTestsPeopleAntibody": null, "negativeTestsPeopleAntibody": null, "totalTestsPeopleAntigen": null, "positiveTestsPeopleAntigen": null, "totalTestsAntigen": null, "positiveTestsAntigen": null, "fips": "36", "positiveIncrease": 7090, "negativeIncrease": 16219, "total": 596532, "totalTestResultsIncrease": 23309, "posNeg": 596532, "deathIncrease": 540, "hospitalizedIncrease": 1983, "hash": "315af88943912332b392d17ca5ec7d3fa24d53f3", "commercialScore": 0, "negativeRegularScore": 0, "negativeScore": 0, "positiveScore": 0, "score": 0, "grade": "", "month_number_label": "2020-04", "date_label": "2020-04-18", "week_number_label": "2020W16", "week_start_label": "2020-04-13"}, {"date": 20200419, "state": "NY", "positive": 242786, "probableCases": null, "negative": 374769, "pending": null, "totalTestResultsSource": "totalTestEncountersViral", "totalTestResults": 617555, "hospitalizedCurrently": 16213, "hospitalizedCumulative": 64550, "inIcuCurrently": 4878, "inIcuCumulative": null, "onVentilatorCurrently": null, "onVentilatorCumulative": null, "recovered": 37596, "dataQualityGrade": "A", "lastUpdateEt": "4/19/2020 00:00", "dateModified": "2020-04-19T00:00:00Z", "checkTimeEt": "04/18 20:00", "death": 13869, "hospitalized": 64550, "dateChecked": "2020-04-19T00:00:00Z", "totalTestsViral": null, "positiveTestsViral": null, "negativeTestsViral": null, "positiveCasesViral": 242786, "deathConfirmed": null, "deathProbable": null, "totalTestEncountersViral": 617555, "totalTestsPeopleViral": null, "totalTestsAntibody": null, "positiveTestsAntibody": null, "negativeTestsAntibody": null, "totalTestsPeopleAntibody": null, "positiveTestsPeopleAntibody": null, "negativeTestsPeopleAntibody": null, "totalTestsPeopleAntigen": null, "positiveTestsPeopleAntigen": null, "totalTestsAntigen": null, "positiveTestsAntigen": null, "fips": "36", "positiveIncrease": 6054, "negativeIncrease": 14969, "total": 617555, "totalTestResultsIncrease": 21023, "posNeg": 617555, "deathIncrease": 507, "hospitalizedIncrease": 1447, "hash": "ba4763c1d26cd2e0f7ecc9018e87b0f11c7769f5", "commercialScore": 0, "negativeRegularScore": 0, "negativeScore": 0, "positiveScore": 0, "score": 0, "grade": "", "month_number_label": "2020-04", "date_label": "2020-04-19", "week_number_label": "2020W16", "week_start_label": "2020-04-13"}, {"date": 20200420, "state": "NY", "positive": 247512, "probableCases": null, "negative": 386349, "pending": null, "totalTestResultsSource": "totalTestEncountersViral", "totalTestResults": 633861, "hospitalizedCurrently": 16103, "hospitalizedCumulative": 65969, "inIcuCurrently": 4814, "inIcuCumulative": null, "onVentilatorCurrently": null, "onVentilatorCumulative": null, "recovered": 39085, "dataQualityGrade": "A", "lastUpdateEt": "4/20/2020 00:00", "dateModified": "2020-04-20T00:00:00Z", "checkTimeEt": "04/19 20:00", "death": 14347, "hospitalized": 65969, "dateChecked": "2020-04-20T00:00:00Z", "totalTestsViral": null, "positiveTestsViral": null, "negativeTestsViral": null, "positiveCasesViral": 247512, "deathConfirmed": null, "deathProbable": null, "totalTestEncountersViral": 633861, "totalTestsPeopleViral": null, "totalTestsAntibody": null, "positiveTestsAntibody": null, "negativeTestsAntibody": null, "totalTestsPeopleAntibody": null, "positiveTestsPeopleAntibody": null, "negativeTestsPeopleAntibody": null, "totalTestsPeopleAntigen": null, "positiveTestsPeopleAntigen": null, "totalTestsAntigen": null, "positiveTestsAntigen": null, "fips": "36", "positiveIncrease": 4726, "negativeIncrease": 11580, "total": 633861, "totalTestResultsIncrease": 16306, "posNeg": 633861, "deathIncrease": 478, "hospitalizedIncrease": 1419, "hash": "fc3fd8aa788c55bcb3a0204f1cdfbf1ffe60a947", "commercialScore": 0, "negativeRegularScore": 0, "negativeScore": 0, "positiveScore": 0, "score": 0, "grade": "", "month_number_label": "2020-04", "date_label": "2020-04-20", "week_number_label": "2020W17", "week_start_label": "2020-04-20"}, {"date": 20200421, "state": "NY", "positive": 251690, "probableCases": null, "negative": 397635, "pending": null, "totalTestResultsSource": "totalTestEncountersViral", "totalTestResults": 649325, "hospitalizedCurrently": 16135, "hospitalizedCumulative": 67271, "inIcuCurrently": 4729, "inIcuCumulative": null, "onVentilatorCurrently": null, "onVentilatorCumulative": null, "recovered": 40482, "dataQualityGrade": "A", "lastUpdateEt": "4/21/2020 00:00", "dateModified": "2020-04-21T00:00:00Z", "checkTimeEt": "04/20 20:00", "death": 14828, "hospitalized": 67271, "dateChecked": "2020-04-21T00:00:00Z", "totalTestsViral": null, "positiveTestsViral": null, "negativeTestsViral": null, "positiveCasesViral": 251690, "deathConfirmed": null, "deathProbable": null, "totalTestEncountersViral": 649325, "totalTestsPeopleViral": null, "totalTestsAntibody": null, "positiveTestsAntibody": null, "negativeTestsAntibody": null, "totalTestsPeopleAntibody": null, "positiveTestsPeopleAntibody": null, "negativeTestsPeopleAntibody": null, "totalTestsPeopleAntigen": null, "positiveTestsPeopleAntigen": null, "totalTestsAntigen": null, "positiveTestsAntigen": null, "fips": "36", "positiveIncrease": 4178, "negativeIncrease": 11286, "total": 649325, "totalTestResultsIncrease": 15464, "posNeg": 649325, "deathIncrease": 481, "hospitalizedIncrease": 1302, "hash": "edf86029c2920d850ceba1abfd3ce3d25ede07f7", "commercialScore": 0, "negativeRegularScore": 0, "negativeScore": 0, "positiveScore": 0, "score": 0, "grade": "", "month_number_label": "2020-04", "date_label": "2020-04-21", "week_number_label": "2020W17", "week_start_label": "2020-04-20"}, {"date": 20200422, "state": "NY", "positive": 257216, "probableCases": null, "negative": 412766, "pending": null, "totalTestResultsSource": "totalTestEncountersViral", "totalTestResults": 669982, "hospitalizedCurrently": 15599, "hospitalizedCumulative": 68773, "inIcuCurrently": 4690, "inIcuCumulative": null, "onVentilatorCurrently": null, "onVentilatorCumulative": null, "recovered": 42308, "dataQualityGrade": "A", "lastUpdateEt": "4/22/2020 00:00", "dateModified": "2020-04-22T00:00:00Z", "checkTimeEt": "04/21 20:00", "death": 15302, "hospitalized": 68773, "dateChecked": "2020-04-22T00:00:00Z", "totalTestsViral": null, "positiveTestsViral": null, "negativeTestsViral": null, "positiveCasesViral": 257216, "deathConfirmed": null, "deathProbable": null, "totalTestEncountersViral": 669982, "totalTestsPeopleViral": null, "totalTestsAntibody": null, "positiveTestsAntibody": null, "negativeTestsAntibody": null, "totalTestsPeopleAntibody": null, "positiveTestsPeopleAntibody": null, "negativeTestsPeopleAntibody": null, "totalTestsPeopleAntigen": null, "positiveTestsPeopleAntigen": null, "totalTestsAntigen": null, "positiveTestsAntigen": null, "fips": "36", "positiveIncrease": 5526, "negativeIncrease": 15131, "total": 669982, "totalTestResultsIncrease": 20657, "posNeg": 669982, "deathIncrease": 474, "hospitalizedIncrease": 1502, "hash": "3498010bc9f4f4f3a3603a804898d5e7f3d70751", "commercialScore": 0, "negativeRegularScore": 0, "negativeScore": 0, "positiveScore": 0, "score": 0, "grade": "", "month_number_label": "2020-04", "date_label": "2020-04-22", "week_number_label": "2020W17", "week_start_label": "2020-04-20"}, {"date": 20200423, "state": "NY", "positive": 263460, "probableCases": null, "negative": 432460, "pending": null, "totalTestResultsSource": "totalTestEncountersViral", "totalTestResults": 695920, "hospitalizedCurrently": 15021, "hospitalizedCumulative": 70182, "inIcuCurrently": 4597, "inIcuCumulative": null, "onVentilatorCurrently": null, "onVentilatorCumulative": null, "recovered": 44244, "dataQualityGrade": "A", "lastUpdateEt": "4/23/2020 00:00", "dateModified": "2020-04-23T00:00:00Z", "checkTimeEt": "04/22 20:00", "death": 15740, "hospitalized": 70182, "dateChecked": "2020-04-23T00:00:00Z", "totalTestsViral": null, "positiveTestsViral": null, "negativeTestsViral": null, "positiveCasesViral": 263460, "deathConfirmed": null, "deathProbable": null, "totalTestEncountersViral": 695920, "totalTestsPeopleViral": null, "totalTestsAntibody": null, "positiveTestsAntibody": null, "negativeTestsAntibody": null, "totalTestsPeopleAntibody": null, "positiveTestsPeopleAntibody": null, "negativeTestsPeopleAntibody": null, "totalTestsPeopleAntigen": null, "positiveTestsPeopleAntigen": null, "totalTestsAntigen": null, "positiveTestsAntigen": null, "fips": "36", "positiveIncrease": 6244, "negativeIncrease": 19694, "total": 695920, "totalTestResultsIncrease": 25938, "posNeg": 695920, "deathIncrease": 438, "hospitalizedIncrease": 1409, "hash": "0f61450dbce857fc6deb6b4ef1f6d831648b7d3a", "commercialScore": 0, "negativeRegularScore": 0, "negativeScore": 0, "positiveScore": 0, "score": 0, "grade": "", "month_number_label": "2020-04", "date_label": "2020-04-23", "week_number_label": "2020W17", "week_start_label": "2020-04-20"}, {"date": 20200424, "state": "NY", "positive": 271590, "probableCases": null, "negative": 459066, "pending": null, "totalTestResultsSource": "totalTestEncountersViral", "totalTestResults": 730656, "hospitalizedCurrently": 14258, "hospitalizedCumulative": 71373, "inIcuCurrently": 4540, "inIcuCumulative": null, "onVentilatorCurrently": null, "onVentilatorCumulative": null, "recovered": 46156, "dataQualityGrade": "A", "lastUpdateEt": "4/24/2020 00:00", "dateModified": "2020-04-24T00:00:00Z", "checkTimeEt": "04/23 20:00", "death": 16162, "hospitalized": 71373, "dateChecked": "2020-04-24T00:00:00Z", "totalTestsViral": null, "positiveTestsViral": null, "negativeTestsViral": null, "positiveCasesViral": 271590, "deathConfirmed": null, "deathProbable": null, "totalTestEncountersViral": 730656, "totalTestsPeopleViral": null, "totalTestsAntibody": null, "positiveTestsAntibody": null, "negativeTestsAntibody": null, "totalTestsPeopleAntibody": null, "positiveTestsPeopleAntibody": null, "negativeTestsPeopleAntibody": null, "totalTestsPeopleAntigen": null, "positiveTestsPeopleAntigen": null, "totalTestsAntigen": null, "positiveTestsAntigen": null, "fips": "36", "positiveIncrease": 8130, "negativeIncrease": 26606, "total": 730656, "totalTestResultsIncrease": 34736, "posNeg": 730656, "deathIncrease": 422, "hospitalizedIncrease": 1191, "hash": "d39e566ee96de56f4c24b51ceee0fe4bd33f6733", "commercialScore": 0, "negativeRegularScore": 0, "negativeScore": 0, "positiveScore": 0, "score": 0, "grade": "", "month_number_label": "2020-04", "date_label": "2020-04-24", "week_number_label": "2020W17", "week_start_label": "2020-04-20"}, {"date": 20200425, "state": "NY", "positive": 282143, "probableCases": null, "negative": 495425, "pending": null, "totalTestResultsSource": "totalTestEncountersViral", "totalTestResults": 777568, "hospitalizedCurrently": 13524, "hospitalizedCumulative": 72444, "inIcuCurrently": 4410, "inIcuCumulative": null, "onVentilatorCurrently": null, "onVentilatorCumulative": null, "recovered": 47935, "dataQualityGrade": "B", "lastUpdateEt": "4/25/2020 00:00", "dateModified": "2020-04-25T00:00:00Z", "checkTimeEt": "04/24 20:00", "death": 16599, "hospitalized": 72444, "dateChecked": "2020-04-25T00:00:00Z", "totalTestsViral": null, "positiveTestsViral": null, "negativeTestsViral": null, "positiveCasesViral": 282143, "deathConfirmed": null, "deathProbable": null, "totalTestEncountersViral": 777568, "totalTestsPeopleViral": null, "totalTestsAntibody": null, "positiveTestsAntibody": null, "negativeTestsAntibody": null, "totalTestsPeopleAntibody": null, "positiveTestsPeopleAntibody": null, "negativeTestsPeopleAntibody": null, "totalTestsPeopleAntigen": null, "positiveTestsPeopleAntigen": null, "totalTestsAntigen": null, "positiveTestsAntigen": null, "fips": "36", "positiveIncrease": 10553, "negativeIncrease": 36359, "total": 777568, "totalTestResultsIncrease": 46912, "posNeg": 777568, "deathIncrease": 437, "hospitalizedIncrease": 1071, "hash": "1ec990177775eb82afa27e903a29db769211341a", "commercialScore": 0, "negativeRegularScore": 0, "negativeScore": 0, "positiveScore": 0, "score": 0, "grade": "", "month_number_label": "2020-04", "date_label": "2020-04-25", "week_number_label": "2020W17", "week_start_label": "2020-04-20"}, {"date": 20200426, "state": "NY", "positive": 288045, "probableCases": null, "negative": 517305, "pending": null, "totalTestResultsSource": "totalTestEncountersViral", "totalTestResults": 805350, "hospitalizedCurrently": 12839, "hospitalizedCumulative": 73540, "inIcuCurrently": 4284, "inIcuCumulative": null, "onVentilatorCurrently": null, "onVentilatorCumulative": null, "recovered": 49687, "dataQualityGrade": "B", "lastUpdateEt": "4/26/2020 00:00", "dateModified": "2020-04-26T00:00:00Z", "checkTimeEt": "04/25 20:00", "death": 16966, "hospitalized": 73540, "dateChecked": "2020-04-26T00:00:00Z", "totalTestsViral": null, "positiveTestsViral": null, "negativeTestsViral": null, "positiveCasesViral": 288045, "deathConfirmed": null, "deathProbable": null, "totalTestEncountersViral": 805350, "totalTestsPeopleViral": null, "totalTestsAntibody": null, "positiveTestsAntibody": null, "negativeTestsAntibody": null, "totalTestsPeopleAntibody": null, "positiveTestsPeopleAntibody": null, "negativeTestsPeopleAntibody": null, "totalTestsPeopleAntigen": null, "positiveTestsPeopleAntigen": null, "totalTestsAntigen": null, "positiveTestsAntigen": null, "fips": "36", "positiveIncrease": 5902, "negativeIncrease": 21880, "total": 805350, "totalTestResultsIncrease": 27782, "posNeg": 805350, "deathIncrease": 367, "hospitalizedIncrease": 1096, "hash": "bfceb7bea2df1c631c53ec169892159220bf64af", "commercialScore": 0, "negativeRegularScore": 0, "negativeScore": 0, "positiveScore": 0, "score": 0, "grade": "", "month_number_label": "2020-04", "date_label": "2020-04-26", "week_number_label": "2020W17", "week_start_label": "2020-04-20"}, {"date": 20200427, "state": "NY", "positive": 291996, "probableCases": null, "negative": 534099, "pending": null, "totalTestResultsSource": "totalTestEncountersViral", "totalTestResults": 826095, "hospitalizedCurrently": 12819, "hospitalizedCumulative": 74602, "inIcuCurrently": 4157, "inIcuCumulative": null, "onVentilatorCurrently": null, "onVentilatorCumulative": null, "recovered": 50751, "dataQualityGrade": "B", "lastUpdateEt": "4/27/2020 00:00", "dateModified": "2020-04-27T00:00:00Z", "checkTimeEt": "04/26 20:00", "death": 17303, "hospitalized": 74602, "dateChecked": "2020-04-27T00:00:00Z", "totalTestsViral": null, "positiveTestsViral": null, "negativeTestsViral": null, "positiveCasesViral": 291996, "deathConfirmed": null, "deathProbable": null, "totalTestEncountersViral": 826095, "totalTestsPeopleViral": null, "totalTestsAntibody": null, "positiveTestsAntibody": null, "negativeTestsAntibody": null, "totalTestsPeopleAntibody": null, "positiveTestsPeopleAntibody": null, "negativeTestsPeopleAntibody": null, "totalTestsPeopleAntigen": null, "positiveTestsPeopleAntigen": null, "totalTestsAntigen": null, "positiveTestsAntigen": null, "fips": "36", "positiveIncrease": 3951, "negativeIncrease": 16794, "total": 826095, "totalTestResultsIncrease": 20745, "posNeg": 826095, "deathIncrease": 337, "hospitalizedIncrease": 1062, "hash": "9d65272a142519beb9af3108264b493019062670", "commercialScore": 0, "negativeRegularScore": 0, "negativeScore": 0, "positiveScore": 0, "score": 0, "grade": "", "month_number_label": "2020-04", "date_label": "2020-04-27", "week_number_label": "2020W18", "week_start_label": "2020-04-27"}, {"date": 20200428, "state": "NY", "positive": 295106, "probableCases": null, "negative": 549888, "pending": null, "totalTestResultsSource": "totalTestEncountersViral", "totalTestResults": 844994, "hospitalizedCurrently": 12646, "hospitalizedCumulative": 75362, "inIcuCurrently": 4071, "inIcuCumulative": null, "onVentilatorCurrently": null, "onVentilatorCumulative": null, "recovered": 51673, "dataQualityGrade": "B", "lastUpdateEt": "4/28/2020 00:00", "dateModified": "2020-04-28T00:00:00Z", "checkTimeEt": "04/27 20:00", "death": 17638, "hospitalized": 75362, "dateChecked": "2020-04-28T00:00:00Z", "totalTestsViral": null, "positiveTestsViral": null, "negativeTestsViral": null, "positiveCasesViral": 295106, "deathConfirmed": null, "deathProbable": null, "totalTestEncountersViral": 844994, "totalTestsPeopleViral": null, "totalTestsAntibody": null, "positiveTestsAntibody": null, "negativeTestsAntibody": null, "totalTestsPeopleAntibody": null, "positiveTestsPeopleAntibody": null, "negativeTestsPeopleAntibody": null, "totalTestsPeopleAntigen": null, "positiveTestsPeopleAntigen": null, "totalTestsAntigen": null, "positiveTestsAntigen": null, "fips": "36", "positiveIncrease": 3110, "negativeIncrease": 15789, "total": 844994, "totalTestResultsIncrease": 18899, "posNeg": 844994, "deathIncrease": 335, "hospitalizedIncrease": 760, "hash": "9f7f62c1b05d0fd5241e932610044a4e3a1cfc4b", "commercialScore": 0, "negativeRegularScore": 0, "negativeScore": 0, "positiveScore": 0, "score": 0, "grade": "", "month_number_label": "2020-04", "date_label": "2020-04-28", "week_number_label": "2020W18", "week_start_label": "2020-04-27"}, {"date": 20200429, "state": "NY", "positive": 299691, "probableCases": null, "negative": 572790, "pending": null, "totalTestResultsSource": "totalTestEncountersViral", "totalTestResults": 872481, "hospitalizedCurrently": 12159, "hospitalizedCumulative": 76450, "inIcuCurrently": 3923, "inIcuCumulative": null, "onVentilatorCurrently": null, "onVentilatorCumulative": null, "recovered": 53238, "dataQualityGrade": "B", "lastUpdateEt": "4/29/2020 00:00", "dateModified": "2020-04-29T00:00:00Z", "checkTimeEt": "04/28 20:00", "death": 18015, "hospitalized": 76450, "dateChecked": "2020-04-29T00:00:00Z", "totalTestsViral": null, "positiveTestsViral": null, "negativeTestsViral": null, "positiveCasesViral": 299691, "deathConfirmed": null, "deathProbable": null, "totalTestEncountersViral": 872481, "totalTestsPeopleViral": null, "totalTestsAntibody": null, "positiveTestsAntibody": null, "negativeTestsAntibody": null, "totalTestsPeopleAntibody": null, "positiveTestsPeopleAntibody": null, "negativeTestsPeopleAntibody": null, "totalTestsPeopleAntigen": null, "positiveTestsPeopleAntigen": null, "totalTestsAntigen": null, "positiveTestsAntigen": null, "fips": "36", "positiveIncrease": 4585, "negativeIncrease": 22902, "total": 872481, "totalTestResultsIncrease": 27487, "posNeg": 872481, "deathIncrease": 377, "hospitalizedIncrease": 1088, "hash": "af23abed283cc4f528cce35e9dd2ae2d9d4de26a", "commercialScore": 0, "negativeRegularScore": 0, "negativeScore": 0, "positiveScore": 0, "score": 0, "grade": "", "month_number_label": "2020-04", "date_label": "2020-04-29", "week_number_label": "2020W18", "week_start_label": "2020-04-27"}, {"date": 20200430, "state": "NY", "positive": 304372, "probableCases": null, "negative": 596264, "pending": null, "totalTestResultsSource": "totalTestEncountersViral", "totalTestResults": 900636, "hospitalizedCurrently": 11598, "hospitalizedCumulative": 77400, "inIcuCurrently": 3769, "inIcuCumulative": null, "onVentilatorCurrently": null, "onVentilatorCumulative": null, "recovered": 54771, "dataQualityGrade": "B", "lastUpdateEt": "4/30/2020 00:00", "dateModified": "2020-04-30T00:00:00Z", "checkTimeEt": "04/29 20:00", "death": 18321, "hospitalized": 77400, "dateChecked": "2020-04-30T00:00:00Z", "totalTestsViral": null, "positiveTestsViral": null, "negativeTestsViral": null, "positiveCasesViral": 304372, "deathConfirmed": null, "deathProbable": null, "totalTestEncountersViral": 900636, "totalTestsPeopleViral": null, "totalTestsAntibody": null, "positiveTestsAntibody": null, "negativeTestsAntibody": null, "totalTestsPeopleAntibody": null, "positiveTestsPeopleAntibody": null, "negativeTestsPeopleAntibody": null, "totalTestsPeopleAntigen": null, "positiveTestsPeopleAntigen": null, "totalTestsAntigen": null, "positiveTestsAntigen": null, "fips": "36", "positiveIncrease": 4681, "negativeIncrease": 23474, "total": 900636, "totalTestResultsIncrease": 28155, "posNeg": 900636, "deathIncrease": 306, "hospitalizedIncrease": 950, "hash": "ec9561ab69c165f4a85b7bd5fba1f4134a8b6568", "commercialScore": 0, "negativeRegularScore": 0, "negativeScore": 0, "positiveScore": 0, "score": 0, "grade": "", "month_number_label": "2020-04", "date_label": "2020-04-30", "week_number_label": "2020W18", "week_start_label": "2020-04-27"}, {"date": 20200501, "state": "NY", "positive": 308314, "probableCases": null, "negative": 619124, "pending": null, "totalTestResultsSource": "totalTestEncountersViral", "totalTestResults": 927438, "hospitalizedCurrently": 10993, "hospitalizedCumulative": 78224, "inIcuCurrently": 3640, "inIcuCumulative": null, "onVentilatorCurrently": null, "onVentilatorCumulative": null, "recovered": 56187, "dataQualityGrade": "B", "lastUpdateEt": "5/1/2020 00:00", "dateModified": "2020-05-01T00:00:00Z", "checkTimeEt": "04/30 20:00", "death": 18610, "hospitalized": 78224, "dateChecked": "2020-05-01T00:00:00Z", "totalTestsViral": null, "positiveTestsViral": null, "negativeTestsViral": null, "positiveCasesViral": 308314, "deathConfirmed": null, "deathProbable": null, "totalTestEncountersViral": 927438, "totalTestsPeopleViral": null, "totalTestsAntibody": null, "positiveTestsAntibody": null, "negativeTestsAntibody": null, "totalTestsPeopleAntibody": null, "positiveTestsPeopleAntibody": null, "negativeTestsPeopleAntibody": null, "totalTestsPeopleAntigen": null, "positiveTestsPeopleAntigen": null, "totalTestsAntigen": null, "positiveTestsAntigen": null, "fips": "36", "positiveIncrease": 3942, "negativeIncrease": 22860, "total": 927438, "totalTestResultsIncrease": 26802, "posNeg": 927438, "deathIncrease": 289, "hospitalizedIncrease": 824, "hash": "078fd14b8218e7a7e56ce0472586ce9a2987d94f", "commercialScore": 0, "negativeRegularScore": 0, "negativeScore": 0, "positiveScore": 0, "score": 0, "grade": "", "month_number_label": "2020-05", "date_label": "2020-05-01", "week_number_label": "2020W18", "week_start_label": "2020-04-27"}, {"date": 20200502, "state": "NY", "positive": 312977, "probableCases": null, "negative": 646040, "pending": null, "totalTestResultsSource": "totalTestEncountersViral", "totalTestResults": 959017, "hospitalizedCurrently": 10350, "hospitalizedCumulative": 78942, "inIcuCurrently": 3501, "inIcuCumulative": null, "onVentilatorCurrently": null, "onVentilatorCumulative": null, "recovered": 57540, "dataQualityGrade": "B", "lastUpdateEt": "5/2/2020 00:00", "dateModified": "2020-05-02T00:00:00Z", "checkTimeEt": "05/01 20:00", "death": 18909, "hospitalized": 78942, "dateChecked": "2020-05-02T00:00:00Z", "totalTestsViral": null, "positiveTestsViral": null, "negativeTestsViral": null, "positiveCasesViral": 312977, "deathConfirmed": null, "deathProbable": null, "totalTestEncountersViral": 959017, "totalTestsPeopleViral": null, "totalTestsAntibody": null, "positiveTestsAntibody": null, "negativeTestsAntibody": null, "totalTestsPeopleAntibody": null, "positiveTestsPeopleAntibody": null, "negativeTestsPeopleAntibody": null, "totalTestsPeopleAntigen": null, "positiveTestsPeopleAntigen": null, "totalTestsAntigen": null, "positiveTestsAntigen": null, "fips": "36", "positiveIncrease": 4663, "negativeIncrease": 26916, "total": 959017, "totalTestResultsIncrease": 31579, "posNeg": 959017, "deathIncrease": 299, "hospitalizedIncrease": 718, "hash": "09d119bd3fca2534486a2f93353c6ecb74474632", "commercialScore": 0, "negativeRegularScore": 0, "negativeScore": 0, "positiveScore": 0, "score": 0, "grade": "", "month_number_label": "2020-05", "date_label": "2020-05-02", "week_number_label": "2020W18", "week_start_label": "2020-04-27"}, {"date": 20200503, "state": "NY", "positive": 316415, "probableCases": null, "negative": 669496, "pending": null, "totalTestResultsSource": "totalTestEncounte